,Heading,Subheading,Publisher,Published,Found
87,"£9,000 in savings? Here's how I'd aim to turn it into an £11,932 annual passive income with ...","I think the company's growth prospects, undervaluation, and high yield ... Ameresco to Announce Second Quarter 2024 Financial Results on August 5, 2024.",uk.finance.yahoo.com,2024-07-03 12:11:53+00:00,2024-07-04 02:00:53
88,Southwest Air adopts 'poison pill' as activist investor Elliott takes significant stake in company,"Business Wire. Ameresco to Announce Second Quarter 2024 Financial Results on August 5, 2024. 16 minutes ago. Home- News- Crypto- Bank of England ...",uk.finance.yahoo.com,2024-07-03 12:21:18+00:00,2024-07-04 12:00:59
89,"With A 26% Price Drop For Ameresco, Inc. (NYSE:AMRC) You'll Still Get What You Pay For","Ameresco, Inc. ( NYSE:AMRC ) shares have retraced a considerable 26% in the last month, reversing a fair amount of...",simplywall.st,2024-07-04 10:41:04+00:00,2024-07-04 17:00:57
90,Ameresco announces debt financing from Nuveen - TipRanks.com,"The financing is leverage-neutral for the quarter ended June 30, 2024, as the net proceeds were used to pay off the remaining balance of the Company's ...",www.tipranks.com,2024-07-04 08:04:59+00:00,2024-07-04 17:00:57
91,Ameresco Inc. (AMRC) Stock: A Comprehensive 52-Week Review - Invest Chronicle,"... Ameresco Inc.'s current trading price is -57.05% away from its 52-week high, while its distance from the 52-week low is 54.64%. The stock's price ...",investchronicle.com,2024-07-04 20:12:25+00:00,2024-07-04 21:00:56
92,"Global Biomass Power Generation Market 2024 : Trends, Business - openPR.com","... Ameresco Inc., Ramboll Group A/S, Babcock & Wilcox Enterprises Inc ... LinkedIn: https://in.linkedin.com/company/the-business-research-company",www.openpr.com,2024-07-05 10:08:13+00:00,2024-07-05 12:00:56
93,Army installs battery energy storage system to store renewable solar energy at Fort Detrick,"... company Ameresco, has a capacity of six megawatts. The solar energy facility at the base, which Ameresco also installed, has a capacity of 18.6 ...",www.fredericknewspost.com,2024-07-06 12:19:05+00:00,2024-07-06 18:00:53
94,Redwood Trust And 4 Other Stocks Have Very High Payout Ratio - Via News,The company also offers personal and corporate trust; brokerage and ... Ameresco And 6 Other Stocks Have High Sales Growth And An Above 3 ...,via.news,2024-07-07 18:30:58+00:00,2024-07-07 20:00:56
95,Alphabet And 3 Other Stocks Have High Sales Growth And An Above 3% Return on Equity,"Ameresco And 6 Other Stocks Have High Sales Growth And An Above 3 ... Sterling Construction Company, Inc., a construction company, engages in ...",via.news,2024-07-07 12:23:27+00:00,2024-07-07 20:00:56
96,Remote Renewable Management Systems Market: Detailed Analysis - openPR.com,"Ltd., Ameresco Inc., Cahors Group, SMA Solar Technology, Nova Energy ... LinkedIn: https://in.linkedin.com/company/the-business-research-company",www.openpr.com,2024-07-08 12:59:34+00:00,2024-07-08 16:00:58
97,"Vanguard Group Inc. Buys 41,199 Shares of Ameresco, Inc. (NYSE:AMRC) - Defense World","Vanguard Group Inc. owned 5.95% of Ameresco worth $98,479,000 as of its most recent filing with the Securities and Exchange Commission (SEC). Get ...",www.defenseworld.net,2024-07-08 12:33:12+00:00,2024-07-08 16:00:58
98,Reflecting On Defense Contractors Stocks' Q1 Earnings: KBR (NYSE:KBR) - Yahoo Finance Canada,"It was a strong quarter for the company, with a decent beat of analysts' earnings and backlog sales estimates. ... Ameresco Announces a new ...",ca.finance.yahoo.com,2024-07-08 12:14:44+00:00,2024-07-08 16:00:58
99,Ameresco Announces a new Contract for a Battery Energy Storage System Asset with ...,"About Ameresco, Inc. Founded in 2000, Ameresco, Inc. (NYSE:AMRC) is a leading cleantech integrator and renewable energy asset developer, owner and ...",finance.yahoo.com,2024-07-08 12:11:46+00:00,2024-07-08 16:00:58
100,"Montrose Environmental Group Acquires Spirit Environmental, Expanding Air Consulting ...",The company's market cap stands at $140.4 million. Ameresco (NYSE:AMRC) shares moved upwards by 19.01% to $26.47. The market value of their ...,quantisnow.com,2024-07-08 11:18:16+00:00,2024-07-08 16:00:58
101,Ameresco (NYSE:AMRC) Stock Price Up 4.4% - MarketBeat,"The business's revenue was up 10.1% compared to the same quarter last year. During the same period last year, the company earned $0.03 earnings per ...",www.marketbeat.com,2024-07-08 15:51:14+00:00,2024-07-08 20:00:54
102,"Vanguard Group Inc. Buys 41,199 Shares of Ameresco, Inc. (NYSE:AMRC) - MarketBeat","Vanguard Group Inc. raised its stake in shares of Ameresco, Inc. (NYSE:AMRC - Free Report) by 1.3% in the 4th quarter, according to the company in ...",www.marketbeat.com,2024-07-08 20:16:30+00:00,2024-07-09 02:00:55
103,Ameresco (NYSE:AMRC) Stock Price Up 4.4% - Defense World,"Ameresco, Inc. (NYSE:AMRC – Get Free Report) shares shot up 4.4% on Monday . The stock traded as high as $28.49 and last traded at $28.48.",www.defenseworld.net,2024-07-08 16:18:53+00:00,2024-07-09 02:00:55
104,Advanced Renewable Energy System Unveiled at Fort Detrick - EC&amp;M,"Ameresco, Inc. recently held a ribbon-cutting ceremony at the U.S. Army Garrison Fort Detrick's Area B Solar Field to celebrate the activation of ...",www.ecmweb.com,2024-07-09 03:30:39+00:00,2024-07-09 06:00:54
105,Infrastructure Distributors Q1 Earnings: MRC Global (NYSE:MRC) Simply the Best,Ameresco Announces a new Contract for a Battery Energy Storage System ... Invesco Ltd: Form 8.3 - International Paper Company. 13 minutes ago.,au.finance.yahoo.com,2024-07-08 12:14:39+00:00,2024-07-09 06:00:54
106,Renewable Renaissance: Biomass Power Generation on the Rise - openPR.com,"Some of the key players covered in the report include Drax Group PLC, Ameresco ... The company is equipped with an experienced team of analysts and ...",www.openpr.com,2024-07-09 10:21:12+00:00,2024-07-09 12:00:54
107,Ameresco Announces a new Contract for a Battery Energy Storage System Asset with ...,"FRAMINGHAM, Mass. & EVERETT, Wash.--( BUSINESS WIRE Ameresco, Inc. , (NYSE: AMRC), a leading cleantech integrator specializing in energy ...",energycentral.com,2024-07-09 06:38:40+00:00,2024-07-09 12:00:54
108,Devon Energy buys Grayson Mill Energy's Williston Basin business in $5B cash-and-stock deal,Ameresco gets new contract for battery energy storage system. Seeking Alpha.,www.msn.com,2024-07-09 03:44:04+00:00,2024-07-09 12:00:54
109,"Ameresco, Inc. Announces New Contract for A Battery Energy Storage System Asset with ...","Ameresco, Inc. announced it has signed a contract with Snohomish County Public Utility District to construct a battery energy storage system with ...",www.marketscreener.com,2024-07-08 14:13:20+00:00,2024-07-09 12:00:54
110,Is McKesson Corporation (MCK) a Resilient Stock? - Yahoo Finance,"We continue to see the company as a durable compounder, with limited ... Ameresco Announces a new Contract for a Battery Energy Storage System ...",au.finance.yahoo.com,2024-07-08 12:17:49+00:00,2024-07-09 12:00:54
111,Moneris Introduces Moneris Go Retail POS for Canadian Micro and Small Businesses,Business Wire. Ameresco Announces a new Contract for a Battery Energy Storage System Asset with Snohomish County Public Utility District (PUD). 5 ...,ca.finance.yahoo.com,2024-07-08 12:09:55+00:00,2024-07-09 12:00:54
112,Ameresco signs deal with Snohomish County Public Utility District for energy storage system,"Ameresco, Inc. has inked a deal with Snohomish County Public Utility District to construct a battery energy storage system (BESS).",dailyenergyinsider.com,2024-07-09 14:20:48+00:00,2024-07-09 17:00:54
113,Denver-based Elevation Midstream to merge with Platte River Holdings,"Ameresco, Inc. has inked a deal with Snohomish County Public Utility ... Utility company NiSource released its 2024 ESG report Monday ...",dailyenergyinsider.com,2024-07-09 14:00:41+00:00,2024-07-09 17:00:54
114,Consumers Energy plans to power thousands of new EV charging locations across Michigan,"... company will achieve being able to serve one million EVs and more beyond 2030. ... Ameresco, Inc. has inked a deal with Snohomish County Public Utility ...",dailyenergyinsider.com,2024-07-09 20:20:34+00:00,2024-07-09 22:00:54
115,FuelCell Energy : Reports Second Quarter Fiscal 2024 Financial Results - MarketScreener,"... Company to jointly develop carbon capture technology, while retaining ... Ameresco, Inc. to provide the Sacramento Sewer district with our ...",www.marketscreener.com,2024-07-09 17:35:48+00:00,2024-07-09 22:00:54
116,"Edison Electric Institute, IBEW and NECA honor America's lineworkers","Ameresco, Inc. has inked a deal with Snohomish County Public Utility District to construct a battery energy storage system (BESS).… 1 day ago. All ...",dailyenergyinsider.com,2024-07-10 14:53:23+00:00,2024-07-10 17:00:56
117,CA landfills increasingly turn methane gas into energy - Public News Service,"Bakas leads all landfill projects and renewable natural gas business at Ameresco, a company that designs, builds and op. Methane is a potent ...",www.publicnewsservice.org,2024-07-10 13:02:19+00:00,2024-07-10 17:00:56
118,"Jennison Associates LLC Sells 3262 Shares of Ameresco, Inc. (NYSE:AMRC)","Read Jennison Associates LLC Sells 3262 Shares of Ameresco, Inc. (NYSE:AMRC) at Defense World.",www.defenseworld.net,2024-07-10 12:09:14+00:00,2024-07-10 17:00:56
119,Dragonfly Energy Strengthens Presence in Canada with Country's Largest Coast ... - MarketScreener,The Company's overarching mission is the future deployment of its ... Ameresco Inc. to Boost Renewable Energy and Power System Applications.,www.marketscreener.com,2024-07-10 12:03:39+00:00,2024-07-10 17:00:56
120,CPP Investments acquires 20% stake in Europe's team.blue for €550 million,"Ameresco, Amis, Patel and Brewers, LLP, Anagram Partners, Apotex Inc ... Company. team.blue. Law Firm / Organization. Kirkland & Ellis LLP. On July ...",www.canadianlawyermag.com,2024-07-10 09:37:01+00:00,2024-07-10 17:00:56
121,Altus Group sells Property Tax Business to Ryan LLC for C$700 million | Canadian Lawyer,"Ameresco, Amis, Patel and Brewers, LLP, Anagram Partners, Apotex Inc ... Company. Altus Group Limited. Law Firm / Organization. Stikeman Elliott ...",www.canadianlawyermag.com,2024-07-10 09:25:08+00:00,2024-07-10 17:00:56
122,Ameresco (NYSE:AMRC) Shares Down 2.5% - MarketBeat,Corporate insiders own 42.00% of the company's stock. Hedge Funds Weigh In On Ameresco. Institutional investors and hedge funds have recently made ...,www.marketbeat.com,2024-07-09 20:06:12+00:00,2024-07-10 17:00:56
123,3 High Insider Ownership US Stocks Achieving At Least 29% Earnings Growth,"Ameresco, Inc. is a clean technology integrator offering energy ... Ameresco, a company focused on sustainable energy solutions, recently ...",simplywall.st,2024-07-10 19:46:10+00:00,2024-07-10 21:00:51
124,Jennison Associates LLC Buys 15081 Shares of Ivanhoe Electric Inc. (NYSEAMERICAN:IE),"Jennison Associates LLC Sells 3,262 Shares of Ameresco, Inc. Daily Ratings & News for Ivanhoe Electric. Complete the form below to receive the latest ...",www.defenseworld.net,2024-07-10 18:09:06+00:00,2024-07-10 21:00:51
125,Ameresco (NYSE:AMRC) Shares Down 2.5% - Defense World,"Ameresco, Inc. (NYSE:AMRC – Get Free Report) shares dropped 2.5% during mid-day trading on Tuesday . The company traded as low as $25.46 and last ...",www.defenseworld.net,2024-07-11 12:36:38+00:00,2024-07-11 14:00:52
126,California: SCE witholding payment to Ameresco after BESS delays - Energy-Storage.News,"Vanadium redox flow battery (VRFB) firm Invinity Energy Systems sold or won funding for 136.7MWh of product in 2023, while growing revenues 500%.",www.energy-storage.news,2024-07-11 11:25:17+00:00,2024-07-11 14:00:52
127,"Valmont Industries, Inc. Announces Second Quarter 2024 Earnings Call","The company will host investor meetings throughout the day with a fireside ... Ameresco, Inc., (NYSE:AMRC), a leading cleantech integrator ...",quantisnow.com,2024-07-11 08:23:36+00:00,2024-07-11 14:00:52
128,What's Driving Ameresco Inc's Surprising 17% Stock Rally? - GuruFocus,Ameresco Inc specializes in delivering comprehensive energy efficiency solutions across North America and Europe. The company's business model is ...,www.gurufocus.com,2024-07-11 14:44:14+00:00,2024-07-11 18:00:57
129,Canada Growth Fund and Strathcona Resources form $2 billion CCS partnership,"Ameresco, Amis, Patel and Brewers, LLP, Anagram Partners, Apotex ... Canada Growth Fund Inc. Law Firm / Organization. Stikeman Elliott LLP. Company.",www.canadianlawyermag.com,2024-07-11 08:50:11+00:00,2024-07-11 18:00:57
130,Ameresco (NYSE:AMRC) Shares Gap Up to $27.10 | MarketBeat,"The company's quarterly revenue was up 10.1% on a year-over-year basis. Equities research analysts predict that Ameresco, Inc. will post 1.38 earnings ...",www.marketbeat.com,2024-07-11 18:12:12+00:00,2024-07-11 22:00:57
131,Government to Invest $45.3 Million to Decrease Energy Costs at 3 Canadian Division ...,"Ameresco Inc. of Richmond, ON was awarded the contract to perform the work. Left, Minister of National Defence Bill Blair, and, right, Minister of ...",www.cmfmag.ca,2024-07-11 21:54:58+00:00,2024-07-12 02:00:52
132,"Energy as a Service Market Report 2024 - Market Size, Growth Rate, - openPR.com","Ltd., EDF Renewable Energy, Ameresco Inc., WGL Energy, ABB India Ltd ... LinkedIn: https://in.linkedin.com/company/the-business-research-company",www.openpr.com,2024-07-12 06:09:16+00:00,2024-07-12 10:00:54
133,Canadian landing gear manufacturer Héroux-Devtek to be acquired by Platinum Equity for ...,"Ameresco, Amis, Patel and Brewers, LLP, Anagram Partners, Apotex Inc ... Forooghian + Company Law Corporation, Fox Williams LLP, Franco-Nevada ...",www.canadianlawyermag.com,2024-07-12 09:13:57+00:00,2024-07-12 17:00:53
134,A Closer Look at Ameresco Inc. (AMRC) Stock Gains - Invest Chronicle,Ameresco Inc. experienced a rather shaky stock market performance. The highest value in the past year was recorded at $63.19 on 07/19/23 and the ...,investchronicle.com,2024-07-12 18:14:42+00:00,2024-07-12 21:00:52
135,"Earnings Alert For The Week Of July 15, 2024 (NYSE:A) | Seeking Alpha","Ameresco, Inc. Class A. 1%. 45. $1,498.95. $1,998.68. ($499.72). -25.00 ... I have no business relationship with any company whose stock is mentioned in ...",seekingalpha.com,2024-07-13 14:29:10+00:00,2024-07-13 18:00:55
136,Coda Octopus Group And 7 Other Stocks Have High Sales Growth And An Above 3 ...,"Ameresco And 7 Other Stocks Have High ... The company operates through two segments, Marine Engineering Business and Marine Technology Business.",via.news,2024-07-13 11:25:40+00:00,2024-07-13 18:00:55
137,McCleary eyes city-driven solar power installation | The Daily World,"Representatives from Ameresco, a Washington-based energy services company, presented to the meeting about the proposal. “We feel we can get this ...",www.thedailyworld.com,2024-07-13 18:08:01+00:00,2024-07-13 21:00:52
138,Ameresco (NYSE:AMRC) Shares Gap Up to $27.10 - Defense World,"Truist Financial lowered their price target on shares of Ameresco from $40.00 to $37.00 and set a “buy” rating for the company in a report on Monday, ...",www.defenseworld.net,2024-07-13 15:16:10+00:00,2024-07-13 21:00:52
139,Air Products and Chemicals And 3 Other Stocks Have Very High Payout Ratio - Via News,Ameresco And 4 Other Stocks Have High Sales Growth And An Above 3 ... Citizens & Northern Corporation operates as the bank holding company ...,via.news,2024-07-15 12:31:05+00:00,2024-07-15 14:00:54
140,Ameresco Stock Sees Relative Strength Rating Rise To 85 | Investor's Business Daily,Ameresco (AMRC) ... The alternative energy firm showed 0% earnings growth in the latest quarterly report. Revenue rose 10%. Look for the next report on ...,www.investors.com,2024-07-15 20:18:42+00:00,2024-07-15 21:00:51
141,Is BCE's High-Yielding Dividend in Danger? - Yahoo Finance,The company last reported its quarterly earnings on May 2. And for the ... Ameresco Stock Sees Relative Strength Rating Rise To 85. 13 minutes ...,ca.finance.yahoo.com,2024-07-15 19:54:48+00:00,2024-07-15 21:00:51
142,English High Court Cancels 2021 Sale of SMCP Shares - Yahoo Finance,"... company Shandong Ruyi Group, to Dynamic Treasure Group Ltd. (DTG), a ... Ameresco Stock Sees Relative Strength Rating Rise To 85. 6 minutes ...",uk.finance.yahoo.com,2024-07-15 19:47:56+00:00,2024-07-15 21:00:51
143,Ready to Jump After Recent Trade: Ameresco Inc. (AMRC) - Sete News,Ready to Jump After Recent Trade: Ameresco Inc. (AMRC)- Price Performance and Earnings: Stock performance is one of the indicators that investors use ...,www.setenews.com,2024-07-15 22:10:28+00:00,2024-07-16 02:01:00
144,Ameresco (NYSE:AMRC) Stock Price Down 6.9% - MarketBeat,"During the same quarter last year, the business earned $0.03 earnings per share. Equities research analysts forecast that Ameresco, Inc. will post ...",www.marketbeat.com,2024-07-15 20:11:49+00:00,2024-07-16 02:01:00
145,Craig-Hallum Remains a Hold on PureCycle Technologies (PCT) | Markets Insider,"Stine covers the Industrials sector, focusing on stocks such as Chart Industries, Plug Power, and Ameresco. ... Roth CH Acquisition I Co is a blank ...",markets.businessinsider.com,2024-07-15 17:17:27+00:00,2024-07-16 02:01:00
146,Bioliquid Heat and Power Generation Industry to Witness Massive Growth (2024-2031 ... - WhaTech,"... Company, Ameresco Inc., Envitec Biogas AG, Enviva Inc., Drax Group, STRABAG International GmbH, Ensyn Corporation, Enerkem, and Green Plains Inc.",www.whatech.com,2024-07-17 12:26:42+00:00,2024-07-17 14:00:54
147,"Ameresco, Inc. (NYSE:AMRC) Shares Purchased by Mirae Asset Global Investments Co. Ltd.","Read Ameresco, Inc. (NYSE:AMRC) Shares Purchased by Mirae Asset Global Investments Co. Ltd. at Defense World.",www.defenseworld.net,2024-07-17 12:13:40+00:00,2024-07-17 14:00:54
148,Mirae Asset Global Investments Co. Ltd. Acquires 12257 Shares of Centerra Gold Inc. (NYSE:CGAU),"Ameresco, Inc. (NYSE:AMRC) Shares Purchased by Mirae Asset Global Investments Co. Ltd. You might be interested in:.",www.defenseworld.net,2024-07-17 12:13:13+00:00,2024-07-17 14:00:54
149,"Biomass Electricity Global Market 2024 - Latest Research, - openPR.com","... Corporation, Renewable Energy Group, Pond Technologies, Bio-Enpower Inc, Ag-West Bio, Airscience Technologies Inc. (Biogas), Ameresco Inc., Enviva ...",www.openpr.com,2024-07-17 11:31:07+00:00,2024-07-17 14:00:54
150,"Biomass Power Generation Market Segments, Drivers,Competitive Aspects, And Prospects ...","✦ Ameresco, Inc ✦ John Wood Group ✦ Vattenfall AB. Biomass Power Generation Market Segmentation: By Types: ✦ Solid Biofuels ✦ Biogas",www.whatech.com,2024-07-17 05:58:36+00:00,2024-07-17 14:00:54
151,Stocks Showing Improving Market Leadership: Ameresco Earns 86 RS Rating,Investor's Business DailyInvestor's Business DailyFREE - In Google Play ... Ameresco is working on a consolidation with a 37.77 buy point. See if ...,www.investors.com,2024-07-17 16:59:09+00:00,2024-07-17 18:00:54
152,Evaluating Comfort Systems USA And Competitors In Construction &amp; Engineering Industry,"Ameresco Inc, 30.82, 1.94, 1.27, -0.33%, $0.03, $0.05, 10.1%. Argan Inc, 28.32 ... Company's most recent dividend, on Comfort Systems USA, Inc. common ...",quantisnow.com,2024-07-17 15:14:57+00:00,2024-07-17 18:00:54
153,Ameresco Inc. (AMRC) requires closer examination - US Post News,"While Ameresco Inc. has overperformed by 7.76%, investors are advised to look at stock chart patterns for technical insight.",www.uspostnews.com,2024-07-17 18:41:06+00:00,2024-07-17 22:00:57
154,Craig-Hallum Gives a Buy Rating to Enphase Energy (ENPH) | Markets Insider,"Stine covers the Industrials sector, focusing on stocks such as Chart Industries, Plug Power, and Ameresco. ... company reported a quarterly ...",markets.businessinsider.com,2024-07-17 21:42:20+00:00,2024-07-18 03:00:54
155,Industrial Energy-Efficiency Services Global Strategic - GlobeNewswire,"Company Profiles: Coverage of major players such as Ameresco, Inc., DALKIA, DNV Group AS, and more. Complimentary Updates: Receive free report ...",www.globenewswire.com,2024-07-18 10:42:41+00:00,2024-07-18 15:00:57
156,"Quantbot Technologies LP Purchases New Shares in Live Oak Bancshares, Inc. (NASDAQ:LOB)","Live Oak Bancshares, Inc operates as the bank holding company for ... Quantbot Technologies LP Sells 3,967 Shares of Ameresco, Inc. (NYSE ...",www.defenseworld.net,2024-07-18 10:24:30+00:00,2024-07-18 15:00:57
157,"Quantbot Technologies LP Sells 10,493 Shares of The Descartes Systems Group Inc ...","Quantbot Technologies LP Sells 3,967 Shares of Ameresco, Inc. (NYSE:AMRC)- Quantbot Technologies LP Increases Holdings in EZCORP, Inc. (NASDAQ:EZPW) ...",www.defenseworld.net,2024-07-18 10:24:29+00:00,2024-07-18 15:00:57
158,"Biogas Market 2024 - By Size, Industry Analysis, Segmentation - openPR.com","... Ameresco, Wartsila, Schmack Biogas GmbH, Future Biogas Limited ... LinkedIn: https://in.linkedin.com/company/the-business-research-company",www.openpr.com,2024-07-18 10:14:14+00:00,2024-07-18 15:00:57
159,New SVP of Business Operations Joins SmartBear to Bring Increased Understanding ... - Le Lézard,"WHAT: Ameresco, Inc., a leading cleantech integrator specializing in energy efficiency and renewable energy, and United Power, a member-owned, not-for ...",www.lelezard.com,2024-07-18 13:57:53+00:00,2024-07-18 18:00:55
160,"Quantbot Technologies LP Sells 3967 Shares of Ameresco, Inc. (NYSE:AMRC)",Get Ameresco alerts: Other institutional investors have also made changes to their positions in the company. Vanguard Group Inc. grew its holdings ...,www.defenseworld.net,2024-07-18 13:08:10+00:00,2024-07-18 18:00:55
161,Three TSX Growth Companies With Minimum 14% Insider Ownership - Yahoo Finance,... company's future prospects and alignment with shareholder interests. Top 10 ... Media Advisory: United Power and Ameresco Celebrate Launch of ...,ca.finance.yahoo.com,2024-07-18 12:11:48+00:00,2024-07-18 18:00:55
162,Florida PSC approves three projects proposed by Peninsula Pipeline Company,Please review our Privacy Policy before submitting. Most Read Last 7 Days. ESG Clean Energy develops a breakthrough carbon capture system- Ameresco ...,dailyenergyinsider.com,2024-07-18 20:31:01+00:00,2024-07-19 03:00:53
163,BNP PARIBAS ASSET MANAGEMENT Holding S.A. Has $13.21 Million Stake in Ameresco ...,Institutional investors and hedge funds own 99.24% of the company's stock. Analyst Ratings Changes. A number of research analysts recently issued ...,www.marketbeat.com,2024-07-18 19:41:18+00:00,2024-07-19 03:00:53
164,Quantbot Technologies LP Acquires 3231 Shares of Fidus Investment Co. (NASDAQ:FDUS),"Fidus Investment Corporation is a business development company. It ... Quantbot Technologies LP Sells 3,967 Shares of Ameresco, Inc. (NYSE ...",www.defenseworld.net,2024-07-18 10:33:53+00:00,2024-07-19 03:00:53
165,"BNP Paribas Financial Markets Lowers Stock Position in Ameresco, Inc. (NYSE:AMRC)","Cetera Trust Company N.A acquired a new position in shares of Ameresco during the 4th quarter worth $106,000. Dynamic Advisor Solutions LLC increased ...",www.defenseworld.net,2024-07-19 08:53:17+00:00,2024-07-19 11:00:54
166,"Ameresco, Inc. (NYSE:AMRC) Receives Average Recommendation of &quot;Moderate Buy&quot; from ...","Shares of Ameresco, Inc. (NYSE:AMRC - Get Free Report) have been assigned an average rating of ""Moderate Buy"" from the sixteen brokerages that are ...",www.marketbeat.com,2024-07-19 06:12:09+00:00,2024-07-19 11:00:54
167,"Gogoro Inc.'s (NASDAQ:GGR) top owners are individual investors with 47% stake, while 19 ...",And private companies on the other hand have a 19% ownership in the company. ... Media Advisory: United Power and Ameresco Celebrate Launch of ...,ca.finance.yahoo.com,2024-07-18 12:15:31+00:00,2024-07-19 11:00:54
168,"Wrap up: Second developer picked for SRS solar, DOE sites honored for sustainability, more",The Department of Energy has chosen Ameresco ... Jennifer Macy took over as the leader of Merrick and Co.'s nuclear services & technology division on ...,www.exchangemonitor.com,2024-07-19 15:21:36+00:00,2024-07-19 18:00:52
169,BNP Paribas Financial Markets Has $1.20 Million Stake in Kforce Inc. (NASDAQ:KFRC),"BNP Paribas Financial Markets Lowers Stock Position in Ameresco, Inc. Daily Ratings & News for Kforce. Complete the form below to receive the latest ...",www.defenseworld.net,2024-07-19 14:51:57+00:00,2024-07-19 18:00:52
170,"Biogas Generation Systems Market Statistical Forecast, Trade - openPR.com","Press release - DataM Intelligence - Biogas Generation Systems Market Statistical Forecast, Trade Analysis 2024 - Engie SA, Ameresco Inc, ...",www.openpr.com,2024-07-19 12:41:35+00:00,2024-07-19 18:00:52
171,UNITED POWER AND AMERESCO CELEBRATE LAUNCH OF TRANSFORMATIONAL ...,"Ameresco, Inc., a leading cleantech integrator specializing in energy efficiency and renewable energy, and United Power, a member-owned, ...",www.marketscreener.com,2024-07-19 12:19:49+00:00,2024-07-19 18:00:52
172,A Look Back at Construction and Engineering Stocks' Q1 Earnings: Ameresco (NYSE:AMRC ...,"But like the broader industrials sector, construction and engineering companies are at the whim of economic cycles as external factors like interest ...",finance.yahoo.com,2024-07-19 12:10:03+00:00,2024-07-19 18:00:52
173,A Look Back At Construction And Engineering Stocks' Q1 Earnings: Ameresco (NYSE ...,Construction and engineering companies not only boast technical know-how in specialized areas but also may hold special licenses and permits. Those ...,www.barchart.com,2024-07-19 11:25:57+00:00,2024-07-19 18:00:52
