,Heading,Subheading,Publisher,Published,Found
174,The energy transition means increased attack surfaces for hackers,This introduces information exchanges between the DER and an energy company's ... Media Advisory: United Power and Ameresco Celebrate Launch of ...,energycentral.com,2024-07-19 10:49:50+00:00,2024-07-19 18:00:52
175,"BNP Paribas Financial Markets Sells 156,083 Shares of Ameresco, Inc. (NYSE:AMRC)","BNP Paribas Financial Markets cut its holdings in shares of Ameresco, Inc. (NYSE:AMRC - Free Report) by 75.5% during the first quarter, ...",www.marketbeat.com,2024-07-19 10:20:55+00:00,2024-07-19 18:00:52
176,Media Advisory: United Power and Ameresco Celebrate Launch of Transformational Battery ...,"About Ameresco, Inc. Founded in 2000, Ameresco, Inc. (NYSE:AMRC) is a leading cleantech integrator and renewable energy asset developer, owner ...",energycentral.com,2024-07-19 04:22:51+00:00,2024-07-19 18:00:52
177,"John Wiley &amp; Sons, Inc. (NYSE:WLY) Position Cut by BNP Paribas Financial Markets","BNP Paribas Financial Markets Lowers Stock Position in Ameresco, Inc. Daily Ratings & News for John Wiley & Sons. Complete the form below to receive ...",www.defenseworld.net,2024-07-19 20:50:13+00:00,2024-07-19 22:00:54
178,"Analysts' Top Consumer Cyclical Picks: Tesla (TSLA), Petco Health and Wellness Company (WOOF)","Kallo covers the Industrial Goods sector, focusing on stocks such as Archer Daniels Midland, Bloom Energy, and Ameresco. Currently, the analyst ...",markets.businessinsider.com,2024-07-19 16:17:01+00:00,2024-07-19 22:00:54
179,MassDEP rejects controversial proposal to dump nuclear wastewater into Cape Cod Bay,By Eva Levin Authorities rejected a company's controversial request to ... Media Advisory: United Power and Ameresco Celebrate Launch of ...,energycentral.com,2024-07-19 15:20:11+00:00,2024-07-19 22:00:54
180,BNP Paribas Financial Markets Has $1.23 Million Position in GDS Holdings Limited (NASDAQ:GDS),"... company in its most recent filing with the SEC. The fund owned 185,137 ... BNP Paribas Financial Markets Lowers Stock Position in Ameresco, Inc.",www.defenseworld.net,2024-07-19 20:50:12+00:00,2024-07-20 03:00:53
181,Second solar farm could be built on the Savannah River Site - Post and Courier,Ameresco is a familiar name to longtime site watchers: the company operates the biomass plant at the site. Savannah River National Lab hosts ...,www.postandcourier.com,2024-07-20 01:02:59+00:00,2024-07-20 14:00:56
182,Wells Fargo &amp; Company Raises Western Alliance Bancorporation (NYSE:WAL) Price Target ...,Wells Fargo & Company Raises Western Alliance Bancorporation (NYSE:WAL) Price Target to $85.00 ... Ameresco (NYSE:AMRC) Shares Gap Up Following Analyst ...,www.defenseworld.net,2024-07-22 16:24:06+00:00,2024-07-22 19:00:53
183,Ameresco completes 313MWh of BESS projects for Colorado utility - Energy-Storage.News,"Italian renewables company Redelfi has launched an energy storage development platform in the US, while US investor Bluestar Energy Capital has ...",www.energy-storage.news,2024-07-22 16:22:20+00:00,2024-07-22 19:00:53
184,Ameresco (NYSE:AMRC) Shares Gap Up Following Analyst Upgrade - Defense World,"Ameresco, Inc. (NYSE:AMRC – Get Free Report)'s stock price gapped up prior to trading on Monday after Piper Sandler raised their price target on ...",www.defenseworld.net,2024-07-22 15:09:14+00:00,2024-07-22 19:00:53
185,Key Takeaways From Ameresco Analyst Ratings - Benzinga,"Ameresco Inc provides energy efficiency solutions for facilities in North America and Europe. It focuses on projects that reduce energy, also focuses ...",www.benzinga.com,2024-07-22 14:44:47+00:00,2024-07-22 19:00:53
186,"U.S. Casella Waste Systems, Clean Harbors, Crowdstrike - XM",... Inc AMZN.O: Bernstein raises target price to $215 from $210. * Ameresco Inc AMRC.N: Piper Sandler raises target price to $37 from $30. * American ...,www.xm.com,2024-07-22 13:11:09+00:00,2024-07-22 19:00:53
187,Fulton County officials consider solar array proposal at Tryon | News | dailygazette.com,"Mraz said the IDA has received a proposal from Ameresco, a solar development company ... The company is proposing to use a municipal solar ...",www.dailygazette.com,2024-07-22 07:03:20+00:00,2024-07-22 19:00:53
188,"Casella Waste Systems, Clean Harbors, Crowdstrike — TradingView News",* Ameresco Inc AMRC: Piper Sandler raises target price to $37 from $30. * Badger Meter Inc BMI: Stifel cuts target price to $189 from $192.,www.tradingview.com,2024-07-22 07:01:58+00:00,2024-07-22 19:00:53
189,"Connors Investor Services Inc. Raises Position in Ameresco, Inc. (NYSE:AMRC)","Connors Investor Services Inc. raised its holdings in shares of Ameresco, Inc. (NYSE:AMRC - Free Report) by 35.4% in the 1st quarter, according to ...",www.marketbeat.com,2024-07-22 04:28:13+00:00,2024-07-22 19:00:53
190,"First Foundation Advisors Cuts Position in Domino's Pizza, Inc. (NYSE:DPZ)",Company insiders own 0.76% of the company's stock. Wall Street ... Ameresco (NYSE:AMRC) Shares Gap Up Following Analyst Upgrade- Western ...,www.defenseworld.net,2024-07-22 15:09:26+00:00,2024-07-22 22:00:50
191,Piper Sandler Increases Ameresco (NYSE:AMRC) Price Target to $37.00 - Defense World,Stifel Nicolaus lowered their target price on shares of Ameresco from $35.00 to $32.00 and set a “buy” rating for the company in a research note on ...,www.defenseworld.net,2024-07-22 17:23:16+00:00,2024-07-23 03:00:56
192,Ameresco Inc. (AMRC)'s Ratio Roundup: Key Metrics for Trailing Twelve Months - DWinneX,"As of close of business last night, Ameresco Inc.'s stock clocked out ... Insiders hold about 39.07% of the company's shares, while institutions hold ...",dwinnex.com,2024-07-23 02:16:07+00:00,2024-07-23 11:00:56
193,Ameresco (NYSE:AMRC) Price Target Raised to $37.00 - MarketBeat,"Piper Sandler lifted their price objective on shares of Ameresco from $30.00 to $37.00 and gave the company an ""overweight"" rating in a research ...",www.marketbeat.com,2024-07-23 00:16:59+00:00,2024-07-23 11:00:56
194,2024 Top Solar + Storage Installers,"CompanyAmeresco, Storage kWh Installed in 202332,375.00, HQ StateMA, Primary MarketC&I, Primary ServiceDeveloper, Solar kW Installed in 202392,370.70 ...",www.solarpowerworldonline.com,2024-07-23 17:04:08+00:00,2024-07-23 18:00:57
195,Sustainable organisation invites organisations to apply for grants - South West,"Bristol City Leap, a partnership between Bristol City Council, Ameresco ... Fifty jobs lost as office fit-out company ceases trading- Michael ...",www.thebusinessdesk.com,2024-07-24 17:49:20+00:00,2024-07-24 18:00:57
196,Biomass Power Generation Market Changing Strategies to Remain Competitive Analysis,"[**Note: To get a sample copy of the report must use the corporate email id or business contact details for higher priority.] ... DONG Energy, Ameresco, ...",www.thenrinews.com,2024-07-24 15:51:29+00:00,2024-07-24 18:00:57
197,"Biomass Power Generation Market is projected to reach USD 1.66 billion by 2032, driven by ...","General Electric Co.,; John Wood Group Plc,; Thermax Ltd.,; Valmet Oyj,; Acciona SA,; Ameresco Inc,; Andritz AG,; Vattenfall AB.",www.whatech.com,2024-07-24 10:05:04+00:00,2024-07-24 18:00:57
198,Hithium Launches Eastern Europe's Largest BESS Project - Batteries News,"To this end, the company has set up a regional office in Munich ... Ameresco Announces a new Contract for a Battery Energy Storage System ...",batteriesnews.com,2024-07-24 06:42:51+00:00,2024-07-24 18:00:57
199,Clean Energy Fuels (CLNE) Receives a Buy from Craig-Hallum | Markets Insider,"The company's shares closed yesterday at $2.67. Stine covers the Industrials sector, focusing on stocks such as Chart Industries, Ameresco, and Plug ...",markets.businessinsider.com,2024-07-25 00:46:11+00:00,2024-07-25 03:00:55
200,Can you still get a good price for Ameresco Inc. (AMRC) Shares at this point?,"While Ameresco Inc. has underperformed by -1.43%, investors are advised to look at stock chart patterns for technical insight.",www.uspostnews.com,2024-07-25 00:05:14+00:00,2024-07-25 03:00:55
201,Construction starts at Greek solar giant - reNews - Renewable Energy News,"Ameresco Sunel Energy has begun constructing Lightsource BP's 560MW Enipease solar project in Greece. The Enipeas project, co-funded by the ...",renews.biz,2024-07-25 16:49:20+00:00,2024-07-25 18:00:56
202,Ameresco Sunel Energy SA Begins Construction on Lightsource bp's 560 MWp ENIPEAS ...,"About Ameresco, Inc. Founded in 2000, Ameresco, Inc.- About Lightsource bp. Lightsource bp is a global leader in the development and management of ...",www.businesswire.com,2024-07-25 12:40:35+00:00,2024-07-25 18:00:56
203,"Carrier's profit beats estimates on price hikes, demand for cooling systems - Head Topics","SAN DIEGO, July 25, 2024--Aya Healthcare, the largest healthcare talent software and staffing company ... Ameresco Sunel Energy SA Begins ...",headtopics.com,2024-07-25 12:24:26+00:00,2024-07-25 18:00:56
204,Ameresco Sunel Energy SA Begins Construction on Lightsource bp's 560 MWp ENIPEAS ...,"LONDON & FRAMINGHAM, Mass., July 25, 2024--(BUSINESS WIRE)--Today Ameresco Sunel Energy SA announced its role in the construction of Lightsource ...",finance.yahoo.com,2024-07-25 12:13:44+00:00,2024-07-25 18:00:56
205,Ameresco Sunel Energy SA Begins Construction on Lightsource bp's 560 MWp ENIPEAS ...,"Ameresco Sunel Energy SA, a joint venture between Ameresco, Inc. (NYSE: AMRC) and Sunel Group, is committed to supporting local communities ...",www.stocktitan.net,2024-07-25 12:09:59+00:00,2024-07-25 18:00:56
206,"Carrier's profit beats estimates on price hikes, demand for cooling systems - Yahoo Finance",The Florida-based company has also benefited from a rapid adoption ... Ameresco Sunel Energy SA Begins Construction on Lightsource bp's 560 ...,uk.finance.yahoo.com,2024-07-25 12:08:46+00:00,2024-07-25 18:00:56
207,Plan for new Aloha Stadium development heading for early approval | Honolulu Star-Advertiser,"... Inc., Stanford Carr Development LLC, Ameresco Inc. and Aloha Stadium Community Development LLC (The Cordish Company) as lead equity members. The ...",www.staradvertiser.com,2024-07-26 17:29:05+00:00,2024-07-26 19:00:54
208,Biogas Plants Market to Scale New Heights as Market Players Focus - openPR.com,"... Ameresco, Inc. (United States) , Quadrogen (Canada), Agrinz Technologies GmbH (Austria) , SP Renewable Energy Sources Pvt. Ltd (India) , Beijing ...",www.openpr.com,2024-07-26 17:19:48+00:00,2024-07-26 19:00:54
209,Construction begins on 560MW solar PV project in Greece - PV Tech,"Ameresco Sunel Energy SA, established through a partnership between renewables developer Ameresco ... Greek energy company DEPA Commercial and ...",www.pv-tech.org,2024-07-26 16:16:09+00:00,2024-07-26 19:00:54
210,Work underway on Lightsource bp's 560 MW solar project in Greece - PV Magazine,Lightsource bp has announced its joint venture company Ameresco Sunel Energy SA as the EPC contractor and O&M provider for its 560 MW solar ...,www.pv-magazine.com,2024-07-26 15:44:34+00:00,2024-07-26 19:00:54
211,Jupiter Power puts Energy Vault BESS project into commercial operation in ERCOT,"The company also provided engineering, procurement and construction ... Ameresco completes 313MWh of BESS projects for Colorado utility. July ...",www.energy-storage.news,2024-07-26 15:17:52+00:00,2024-07-26 19:00:54
212,Ameresco Sunel Energy begins work on 560MWp Greek solar project - Power Technology,The gold standard of business intelligence. Find out more. Related Company Profiles. Ameresco Inc- View all. The ENIPEAS solar project is backed by ...,www.power-technology.com,2024-07-26 14:47:59+00:00,2024-07-26 19:00:54
213,Greece's DEPA Commercial obtains financing for EUR 816 million solar power portfolio,"With a loan that it just signed with the European Investment Bank (EIB), the Greek company ... 26 July 2024 - Ameresco Sunel Energy is the ...",balkangreenenergynews.com,2024-07-26 14:12:05+00:00,2024-07-26 19:00:54
214,Greece's Faria adds 35-MW solar project to domestic portfolio - Renewables Now,Greek renewable energy company Faria Renewables SA has expanded its ... Join for free! More stories to explore. Ameresco Sunel JV to build 560-MWp Greek ...,renewablesnow.com,2024-07-26 13:28:21+00:00,2024-07-26 19:00:54
215,Fortis Energy buys 180-MW solar-plus-storage project in Serbia - Renewables Now,"“This strategic investment strengthens Fortis's commitment to paving the path of the energy transition,” the Turkish company said. ... Ameresco Sunel JV ...",renewablesnow.com,2024-07-26 12:42:04+00:00,2024-07-26 19:00:54
216,Dragonfly Energy to Report Second Quarter 2024 Financial and Operational Results on ...,... Company will release its ... Ameresco Inc. to Boost Renewable Energy and Power System Applications. Dec. 06 CI. North American Morning Briefing ...,www.marketscreener.com,2024-07-26 11:43:06+00:00,2024-07-26 19:00:54
217,Ameresco Sunel Energy begins work on 560MWp Greek solar project - Yahoo Finance,Lululemon Athletica Inc. EquityNMS. EW. Edwards Lifesciences Corporation. EquityNYQ. DECK. Deckers Outdoor Corporation. EquityNYQ. LLY. Eli Lilly and ...,finance.yahoo.com,2024-07-26 09:22:40+00:00,2024-07-26 19:00:54
218,Construction of huge solar park begins | eKathimerini.com,"... Ameresco Sunel Energy, a joint venture between US company Ameresco, a leading provider of integrated clean technology services specializing in ...",www.ekathimerini.com,2024-07-26 21:12:08+00:00,2024-07-26 23:01:00
219,Plan for new Aloha Stadium development heading for early approval - AOL.com,"... Inc., Stanford Carr Development LLC, Ameresco Inc. and Aloha Stadium Community Development LLC (The Cordish Company ) as lead equity members. The ...",www.aol.com,2024-07-26 17:44:59+00:00,2024-07-26 23:01:00
220,"What Is Ameresco, Inc.'s (NYSE:AMRC) Share Price Doing? - Yahoo Finance","While Ameresco, Inc. ( NYSE:AMRC ) might not have the largest market cap around , it received a lot of attention from a...",finance.yahoo.com,2024-07-27 13:43:42+00:00,2024-07-27 18:00:58
221,"Analysts Offer Insights on Consumer Cyclical Companies: QuantumScape (QS), Adidas ...","Kallo covers the Industrial Goods sector, focusing on stocks such as Archer Daniels Midland, Bloom Energy, and Ameresco. QuantumScape has an ...",markets.businessinsider.com,2024-07-27 12:36:35+00:00,2024-07-27 18:00:58
222,"19,902 Shares in Ameresco, Inc. (NYSE:AMRC) Purchased by Natixis - MarketBeat","Natixis acquired a new stake in Ameresco, Inc. (NYSE:AMRC - Free Report) in the first quarter, according to the company in its most recent 13F ...",www.marketbeat.com,2024-07-27 12:35:22+00:00,2024-07-27 18:00:58
223,"Russell Investments Group Ltd. Boosts Stake in Ameresco, Inc. (NYSE:AMRC)",Get Ameresco alerts: Other hedge funds also recently added to or reduced their stakes in the company. Trustees of Princeton University acquired a ...,www.defenseworld.net,2024-07-27 10:51:28+00:00,2024-07-27 18:00:58
224,Ares Acquisition Co. II (NYSE:AACT) Sees Large Increase in Short Interest - Defense World,"Trims Stake in O-I Glass, Inc. (NYSE:OI)- Russell Investments Group Ltd. Boosts Stake in Ameresco, Inc. (NYSE:AMRC)- Russell Investments Group Ltd.",www.defenseworld.net,2024-07-27 10:47:30+00:00,2024-07-27 18:00:58
225,Stadium plan heads for early approval - The Garden Island,... Ameresco Inc. and Aloha Stadium Community Development LLC (The Cordish Company) as lead equity members. ... Hawaiian Dredging Construction Co. Inc ...,www.thegardenisland.com,2024-07-27 20:57:39+00:00,2024-07-27 22:00:59
226,United Power and Ameresco Celebrate Launch of Transformational Battery Energy Storage ...,"Ameresco, Inc., a leading cleantech integrator specializing in energy efficiency and renewable energy, and United Power, a member-owned, not-for ...",batteriesnews.com,2024-07-27 17:15:54+00:00,2024-07-27 22:00:59
227,AMPYR Energy USA Expands US Solar and Battery Storage Capacity,... company's growing U.S. pipeline of over 4 gigawatts (GW) of carbon free ... United Power and Ameresco Celebrate Launch of Transformational ...,batteriesnews.com,2024-07-28 14:08:26+00:00,2024-07-28 18:01:01
228,United Power and Ameresco Celebrate Launch of Transformational Battery Energy Storage ...,"Ameresco, Inc. (NYSE:AMRC) This press release features multimedia. View the full release here: ...",www.placera.se,2024-07-29 10:02:20+00:00,2024-07-29 11:00:52
229,Ameresco (AMRC) Scheduled to Post Earnings on Monday - Defense World,"The company had revenue of $298.41 million during the quarter, compared to the consensus estimate of $255.38 million. Ameresco had a return on equity ...",www.defenseworld.net,2024-07-29 06:39:26+00:00,2024-07-29 11:00:52
230,Lumentum Holdings Inc. (NASDAQ:LITE) Receives Average Rating of “Hold” from Brokerages,... company. The average 1 year price target among brokerages that have issued a ... Ameresco (AMRC) Scheduled to Post Earnings on Monday- Enanta ...,www.defenseworld.net,2024-07-29 06:38:18+00:00,2024-07-29 11:00:52
231,Media Advisory: United Power and Ameresco Celebrate Launch of Transformational Battery ...,"--(BUSINESS WIRE)--Jul 29, 2024--. Ameresco, Inc. (NYSE:AMRC). This press release features multimedia. View the full release here: ...",www.valdostadailytimes.com,2024-07-29 22:18:43+00:00,2024-07-29 23:00:54
232,Ameresco and United Power Celebrate Completing Construction of Colorado's Largest ...,"Ameresco, Inc., (NYSE: AMRC), a leading cleantech integrator specializing in energy efficiency and renewable energy, today announced the ...",www.businesswire.com,2024-07-29 21:51:41+00:00,2024-07-29 23:00:54
233,Ameresco and United Power Celebrate Completing Construction of Colorado's ... - Stock Titan,"--(BUSINESS WIRE)-- Ameresco, Inc., (NYSE: AMRC), a leading cleantech integrator specializing in energy efficiency and renewable energy, today ...",www.stocktitan.net,2024-07-29 20:42:59+00:00,2024-07-29 23:00:54
234,"Stanley Black &amp; Decker, Inc. (SWK): The Best Dividend Stock of All Time? - Yahoo Finance",Business Wire. Ameresco and United Power Celebrate Completing Construction of Colorado's Largest Distributed Battery Energy Storage System to ...,uk.finance.yahoo.com,2024-07-29 20:39:52+00:00,2024-07-29 23:00:54
235,2 Dividend Stocks That Pay Me More Than $14.37 Per Month - Yahoo Finance,"Furthermore, robust cash flow from operations supports the company's ability to sustain and grow its dividend. ... Ameresco and United Power ...",ca.finance.yahoo.com,2024-07-29 20:38:54+00:00,2024-07-29 23:00:54
236,Enphase Energy (ENPH) Gets a Buy from Craig-Hallum | Markets Insider,"The company's shares closed last Friday at $119.34. Stine covers the Industrials sector, focusing on stocks such as Chart Industries, Ameresco ...",markets.businessinsider.com,2024-07-29 18:57:39+00:00,2024-07-29 23:00:54
237,Research Analysts Issue Forecasts for Americas Silver Corp's Q2 2024 Earnings (TSE:USA),"The company has a quick ratio of 0.19, a current ratio of 0.44 and a ... Ameresco (AMRC) Scheduled to Post Earnings on Monday- Enanta ...",www.defenseworld.net,2024-07-29 17:30:56+00:00,2024-07-29 23:00:54
238,"Ameresco, Inc. and United Power, Inc. Celebrate Completion of Construction of ... - MarketScreener","Ameresco, Inc. is a cleantech integrator and renewable energy asset developer, owner and operator. The Companyâ€™s comprehensive portfolio includes ...",www.marketscreener.com,2024-07-30 02:27:55+00:00,2024-07-30 03:00:54
239,Mogavero Architects Announces New President to Lead Company into the Future,"Ameresco, Inc., , a leading cleantech integrator specializing in energy efficiency and renewable energy, today announced the successful completion of ...",www.lelezard.com,2024-07-29 21:29:57+00:00,2024-07-30 03:00:54
240,Ameresco and United Power Celebrate Completing Construction of Colorado's Largest ...,"FRAMINGHAM, Mass. & BRIGHTON, Colo., July 29, 2024--Ameresco, Inc., (NYSE: AMRC), a leading cleantech integrator specializing in energy efficiency ...",finance.yahoo.com,2024-07-29 20:38:54+00:00,2024-07-30 03:00:54
241,"Veracyte, Inc. (NASDAQ:VCYT) Receives Average Recommendation of “Moderate Buy” from ...","Veracyte, Inc operates as a diagnostics company in the United States and internationally. ... Ameresco (AMRC) Scheduled to Post Earnings on Monday ...",www.defenseworld.net,2024-07-29 18:30:51+00:00,2024-07-30 03:00:54
242,Allient Inc. Announces Second Quarter 2024 Financial Results Conference Call and Webcast,The Company will host a conference call and webcast the following day to ... Ameresco and United Power Celebrate Completing Construction of ...,www.silicon.co.uk,2024-07-30 03:19:42+00:00,2024-07-30 07:00:56
243,Amerisafe: Q2 Earnings Snapshot - Yahoo Finance,"AMSF) on Monday reported second-quarter earnings of $11 million. On a per-share basis, the Deridder, Louisiana-based company ... Business Wire. Ameresco ...",uk.finance.yahoo.com,2024-07-29 20:36:53+00:00,2024-07-30 07:00:56
244,"Biogas Plant Market Report 2024: Growth, Trends, Analysis, - openPR.com","... Ameresco Inc., Biofrigas Sweden AB, BTS Biogas SRL/GmbH, Carbotech ... LinkedIn: https://in.linkedin.com/company/the-business-research-company",www.openpr.com,2024-07-30 10:01:41+00:00,2024-07-30 11:00:53
245,Ameresco installs Colorado BESS fleet - reNews,"Strategically positioned throughout United Power's service territory, the assets will enable the company to enhance load balancing and integrate ...",renews.biz,2024-07-30 09:20:03+00:00,2024-07-30 11:00:53
246,"Bioenergy Global Market Report 2024 - By Report, Size, Growth - openPR.com","... Ameresco Inc., Archer Daniels Midland Company, EnviTec Biogas AG ... LinkedIn: https://in.linkedin.com/company/the-business-research-company",www.openpr.com,2024-07-30 07:56:18+00:00,2024-07-30 11:00:53
247,"Brokers Issue Forecasts for USANA Health Sciences, Inc.'s FY2024 Earnings (NYSE:USNA)","The company reported $0.54 earnings per share (EPS) for the quarter, missing ... Ameresco (AMRC) Scheduled to Post Earnings on Monday- Enanta ...",www.defenseworld.net,2024-07-29 19:42:18+00:00,2024-07-30 11:00:53
248,"Demand Response Management Systems Global Market Analysis, - openPR.com","... Ameresco Inc., AutoGrid Systems Inc., CPower Inc., Eaton Corporation ... LinkedIn: https://in.linkedin.com/company/the-business-research-company",www.openpr.com,2024-07-30 12:03:31+00:00,2024-07-30 15:00:50
249,Some Investors May Be Worried About Ameresco's (NYSE:AMRC) Returns On Capital,"... company with a great business model and plenty of profitable reinvestment opportunities. Although, when we looked at Ameresco (NYSE:AMRC), it didn ...",simplywall.st,2024-07-30 10:23:42+00:00,2024-07-30 15:00:50
250,WASTE CONNECTIONS ANNOUNCES THE APPOINTMENT OF CHERYLYN HARLEY ...,"Ameresco, Inc., , a leading cleantech integrator specializing in energy efficiency and renewable energy, today announced the successful completion ...",www.lelezard.com,2024-07-29 21:29:58+00:00,2024-07-30 15:00:50
251,Ameresco Celebrates the Completion of Construction of Colorado's Largest Distributed ...,"United Power and Ameresco celebrated the ribbon cutting ceremony at United Power's Bromley Substation located in Brighton, CO.",milehighcre.com,2024-07-30 15:32:44+00:00,2024-07-30 19:00:55
252,Analysts Offer Insights on Consumer Goods Companies: Darling Ingredients (DAR ...,"Kallo covers the Industrial Goods sector, focusing on stocks such as Bloom Energy, Ameresco, and ESS Tech. Darling Ingredients has an analyst ...",markets.businessinsider.com,2024-07-30 12:20:20+00:00,2024-07-30 19:00:55
253,Hudson Technologies Announces Appointment of Brian J. Bertaux as Chief Financial Officer,Nicole Bulgarino is an Executive Vice President and corporate officer for Ameresco (NYSE:AMRC) a leading energy efficiency and e. 10/3/22 8:30:00 ...,quantisnow.com,2024-07-30 20:45:13+00:00,2024-07-30 22:00:57
254,esVolta Secures $258 Million Credit Facilities for ERCOT Battery Storage Portfolio,It will help us to accelerate our company's growth and cost-effectively ... Ameresco and United Power Celebrate Completing Construction of ...,batteriesnews.com,2024-07-30 20:30:55+00:00,2024-07-30 22:00:57
255,Craig-Hallum Reaffirms Their Buy Rating on Plug Power (PLUG) | Markets Insider,"The company's shares closed yesterday at $2.40. Stine covers the Industrials sector, focusing on stocks such as Chart Industries, Ameresco, and Plug ...",markets.businessinsider.com,2024-07-30 16:14:19+00:00,2024-07-30 22:00:57
256,FuelCell Energy stock hits 52-week low at $0.49 amid challenges - Investing.com,"FuelCell's technology will be featured in a biogeneration project by Ameresco (NYSE:AMRC), contributing $12 million to the company's product backlog.",www.investing.com,2024-07-30 14:59:37+00:00,2024-07-30 22:00:57
257,Ameresco and United Power Celebrate Completing Construction of Colorado's Largest ...,"FRAMINGHAM, Mass. & BRIGHTON, Colo.--(BUSINESS WIRE)--Ameresco, Inc., (NYSE: AMRC), a leading cleantech integrator specializing in energy efficiency ...",www.canaleenergia.com,2024-07-30 11:29:55+00:00,2024-07-30 22:00:57
258,CBRE Q2 Multifamily and Retail Figures - Mile High CRE,"Ameresco Celebrates the Completion of Construction of Colorado's Largest Distributed Battery Energy Storage System ... Ameresco, Inc.'s multiple Battery.",milehighcre.com,2024-07-31 05:58:20+00:00,2024-07-31 07:00:53
259,9 renewable U.S. stocks that could be targets for acquisition - The Globe and Mail,"Ameresco Inc, AMRC-N, Renewable Energy Services, 100.00, 99, 1.80 ... The third company scoring 100 – Gevo Inc., a renewable fuels maker – has the ...",www.theglobeandmail.com,2024-07-31 05:28:55+00:00,2024-07-31 07:00:53
