,Heading,Subheading,Publisher,Published,Found
89,"Global Wooden Decking Market Forecasted to Grow at a 2.9% CAGR, Reaching a Valuation ...","... Boise Cascade Company; Builders FirstSource, Inc; AZEK Building Products, Inc., among others. Some notable developments are as follows: In October ...",www.fmiblog.com,2024-07-23 13:49:51+00:00,2024-07-23 20:02:12
90,"Daily Brief India: Trent Ltd, SAI Life Sciences, ACME Solar Holdings, Sino-Ocean Group and more","... company. Sai Life Sciences is the fastest-growing Indian CRDMOs among ... Boise Cascade Co, Vera Bradley, Centrus Energy , CoreCivic and more.",www.smartkarma.com,2024-07-23 04:49:12+00:00,2024-07-23 20:02:12
91,"Korea Stock Exchange Kospi Index, KakaoBank , Doosan Bobcat Inc, Kumho Tire Co and more","... company's legal troubles. ... Daily Brief United States: Microsoft Corp, Crude Oil, Copper, Symbotic, Boise Cascade Co, Vera Bradley, Centrus Energy , ...",www.smartkarma.com,2024-07-23 02:08:12+00:00,2024-07-23 20:02:12
92,Boise Cascade Company Second Quarter 2024 Earnings Webcast and Conference Call,"... BOISE, Idaho--(BUSINESS WIRE)--Jul 23, 2024--. Boise Cascade Company (NYSE: BCC) will host a webcast and conference call to discuss 2024 second ...",www.bdtonline.com,2024-07-24 02:28:20+00:00,2024-07-24 06:02:16
93,Boise Cascade Company Second Quarter 2024 Earnings Webcast and Conference Call,"BOISE, Idaho, July 23, 2024--Boise Cascade Company (NYSE: BCC) will host a webcast and conference call to discuss 2024 second quarter earnings on ...",finance.yahoo.com,2024-07-23 20:13:12+00:00,2024-07-24 06:02:16
94,CN Declares Third-Quarter 2024 Dividend - Yahoo Finance,... Company's common shares outstanding. A quarterly dividend of ... Boise Cascade Company Second Quarter 2024 Earnings Webcast and Conference Call.,sg.finance.yahoo.com,2024-07-23 20:11:06+00:00,2024-07-24 06:02:16
95,Checking in on Boise Cascade Co (BCC) after recent insiders movement - Knox Daily,"Boise Cascade Co's filing revealed that its EVP, BMD Strom Jeffrey Robert unloaded Company's shares for reported $0.42 million on May 15 '24.",knoxdaily.com,2024-07-24 22:32:56+00:00,2024-07-25 03:02:21
96,Shareholders Would Enjoy A Repeat Of Boise Cascade's (NYSE:BCC) Recent Growth In Returns,"To sum it up, Boise Cascade has proven it can reinvest in the business and generate higher returns on that capital employed, which is terrific. And ...",simplywall.st,2024-07-24 20:32:03+00:00,2024-07-25 03:02:21
97,Boise Cascade Earns IBD Rating Upgrade | Investor's Business Daily,Boise Cascade is expected to release its next quarterly numbers on or around Aug. 5. The company earns the No. 2 rank among its peers in the Building- ...,www.investors.com,2024-07-26 16:21:29+00:00,2024-07-26 18:02:21
98,Mid-Am Building Supply expands new facility | Woodworking Network,The completion of the new facility marks a milestone in the company's continued growth and customer service. ... Boise Cascade Will Invest $43 Million ...,www.woodworkingnetwork.com,2024-07-26 13:53:37+00:00,2024-07-26 18:02:21
99,ACE ADDS ON IN MINNESOTA - Building Products Digest,"David Seidl has taken over Sears Trostel Lumber of Fort Collins, CO. ... BOISE CASCADE EXPANDS WESTLAKE ROYAL SIDING DISTRIBUTION IN WEST. Boise ...",www.building-products.com,2024-07-27 06:15:10+00:00,2024-07-27 15:02:17
100,Exterior Sheathing Market Review: All Eyes on 2024 Outlook - Newstrail,"Key Players in This Report Include: Boise Cascade Company (United States), CertainTeed Corporation (United States), DuPont (United States), Georgia- ...",www.newstrail.com,2024-07-27 22:26:29+00:00,2024-07-28 00:02:17
101,Boise Cascade (BCC) to Release Quarterly Earnings on Monday - Defense World,About Boise Cascade ... Boise Cascade Company engages in manufacture of wood products and distribution of building materials in the United States and ...,www.defenseworld.net,2024-07-29 11:44:52+00:00,2024-07-29 17:02:28
102,Consensus: Boise's decision to sell I-Falls mill a good move | BusinessNorth Exclusives,"The Chicago firm has created a new company called Boise Cascade LLC to run the operations, while the present Boise Cascade Corp. will take the ...",www.businessnorth.com,2024-07-29 23:32:24+00:00,2024-07-30 03:02:20
103,Cross Laminated Timber Market Research And Strategies - openPR.com,"... Boise Cascade Company, Building Systems Design Inc., Canadian ... LinkedIn: https://in.linkedin.com/company/the-business-research-company",www.openpr.com,2024-07-30 08:29:30+00:00,2024-07-30 12:02:18
104,Laminated Veneer Lumber (LVL) Market Policy Impact: Navigating Regulatory Changes,Leading 10 Companies in the Laminated Veneer Lumber (LVL) Market Research Report: MJB Wood Group; Metsä Wood; Boise Cascade; Juken New Zealand ...,moosegazette.com,2024-07-30 07:59:58+00:00,2024-07-30 12:02:18
105,"XSMO, NSIT, BCC, VRRM: ETF Inflow Alert - Nasdaq","Among the largest underlying components of XSMO, in trading today Insight Enterprises Inc. (Symbol: NSIT) is down about 0.2%, Boise Cascade Co.",www.nasdaq.com,2024-07-30 00:23:24+00:00,2024-07-30 12:02:18
106,"Trex (TREX) Reports Next Week: Wall Street Expects Earnings Growth - July 30, 2024","Trex Company, Inc. (TREX) - free report &gt;&gt;- Boise Cascade, L.L.C. (BCC) - free report &gt;&gt;. Published in. consensus-outlook earnings earnings-consensus ...",www.zacks.com,2024-07-30 15:29:18+00:00,2024-07-30 22:02:21
107,"HNI Co. (NYSE:HNI) CFO Marshall H. Bridges Sells 4,138 Shares - Defense World",Bokf Na Grows Holdings in Boise Cascade- Crown Castle Inc.,www.defenseworld.net,2024-07-30 15:24:45+00:00,2024-07-30 22:02:21
108,Coast Guard Cutter Alert says farewell to the Northwest - Tillamook Headlight-Herald,"When Zielaskowski returned from his time in the Coast Guard, he started at Boise Cascade three days later. He worked in the company for over 40 years.",www.tillamookheadlightherald.com,2024-07-31 04:41:22+00:00,2024-07-31 09:02:17
109,"Here's the latest on Idaho wildfires, Oregon's smoke-producing blazes affecting Boise","The Boulder Fire, 9 miles southwest of Cascade, has grown to 324 acres and remains 0% contained. The Wolf Creek Fire has burned 909 acres on the ...",www.idahostatesman.com,2024-07-31 04:36:26+00:00,2024-07-31 09:02:17
110,Trex (TREX) Reports Next Week: Wall Street Expects Earnings Growth | Nasdaq,"Over the last 30 days, the consensus EPS estimate for Boise Cascade has been revised 13.8% down to the current level. Nevertheless, the company ...",www.nasdaq.com,2024-07-31 02:07:17+00:00,2024-07-31 09:02:17
111,Boise Cascade says it might close Oregon plywood mill,... Boise Cascade after learning of contaminants in the water that originated at the company's landfill. “DEQ is working diligently and in good faith ...,www.centraloregondaily.com,2024-07-31 00:16:02+00:00,2024-07-31 09:02:17
112,Plywood Market worth $73.3 billion by 2027 | Key players Georgia - openPR.com,"With its headquarters in Boise, Idaho, Boise Cascade Company is a producer of wood products and wholesaler of construction supplies. There are 60 ...",www.openpr.com,2024-07-31 15:41:56+00:00,2024-07-31 18:02:12
113,Boise Cascade Announces Regular and Special Dividends - TipRanks.com,Boise Cascade (BCC) has shared an update. Boise Cascade Company has announced the issuance of both a regular quarterly dividend of $0.21 per share ...,www.tipranks.com,2024-08-01 21:38:28+00:00,2024-08-02 00:02:19
114,Composite Wood Panels Industry Overall Study Report - TIMC,"... companies. The final report copy provides the impact analysis of ... Boise Cascade Company, Integrated Wood Components. Global Composite ...",www.theindianmoviechannel.com,2024-08-01 21:12:26+00:00,2024-08-02 00:02:19
115,Boise Cascade Company Announces 5% Quarterly Dividend Increase and Special Dividend,"BOISE, Idaho--(BUSINESS WIRE)--Aug 1, 2024--. Boise Cascade Company's (Boise Cascade or the Company) (NYSE: BCC) Board of Directors has declared a ...",www.chronicle-tribune.com,2024-08-01 21:03:35+00:00,2024-08-02 00:02:19
116,Boise Cascade Company Announces 5% Quarterly Dividend Increase and Special Dividend,"Boise Cascade Company's (Boise Cascade or the Company) (NYSE: BCC) Board of Directors has declared a quarterly dividend of $0.21 per share, an ...",www.morningstar.com,2024-08-01 20:56:14+00:00,2024-08-02 00:02:19
117,Boise Cascade Company Announces 5% Quarterly Dividend Increase and Special Dividend,Boise Cascade Company is a producer of engineered wood products (EWP) and plywood in North America and a wholesale distributor of building products in ...,www.marketscreener.com,2024-08-01 20:46:20+00:00,2024-08-02 00:02:19
118,Boise Cascade Company Announces 5% Quarterly Dividend Increase and Special ... - Placera,"Boise Cascade Company's (Boise Cascade or the Company) (NYSE: BCC) Board of Directors has declared a quarterly dividend of $0.21 per share, ...",www.placera.se,2024-08-01 20:43:12+00:00,2024-08-02 00:02:19
119,Block reports quarterly profit on resilient spending - Yahoo Finance,Business Wire. Boise Cascade Company Announces 5% Quarterly Dividend Increase and Special Dividend. 8 minutes ago. Investor's Business Daily. Snap ...,ca.finance.yahoo.com,2024-08-01 20:41:46+00:00,2024-08-02 00:02:19
120,Boise Cascade Company Announces 5% Quarterly Dividend Increase and Special Dividend,"BOISE, Idaho, August 01, 2024--Boise Cascade Company's (Boise Cascade or the Company) (NYSE: BCC) Board of Directors has declared a quarterly ...",finance.yahoo.com,2024-08-01 20:38:13+00:00,2024-08-02 00:02:19
121,Boise Cascade Company Announces 5% Quarterly Dividend Increase and Special Dividend,"Boise Cascade Company (NYSE: BCC) has announced a 5% increase in its quarterly dividend to $0.21 per share, along with a special dividend of $5.00 ...",www.stocktitan.net,2024-08-01 20:37:13+00:00,2024-08-02 00:02:19
122,West Fraser's OSB business outshines MDF and particleboard in Q2,... company says in its most recent Q2 update ... Boise Cascade commissions scientific review- News- Hadfield invests to ...,www.ttjonline.com,2024-08-01 17:45:39+00:00,2024-08-02 00:02:19
123,BRC (NYSE:BRCC) Shares Gap Up to $5.63 - Defense World,Two analysts have rated the stock with a hold rating and four have assigned a buy rating to the company's stock. ... MD Raises Position in Boise Cascade ...,www.defenseworld.net,2024-08-01 16:55:23+00:00,2024-08-02 00:02:19
124,BCC Dividend Announcement $0.2100/Share 8/1/2024,"NYSE:BCC Boise Cascade Co. (DE) Dividend Announcement $0.2100 per share on August 1, 2024.",www.dividendinvestor.com,2024-08-02 12:20:01+00:00,2024-08-02 20:02:11
125,Engineered Wood I-joist Market Growth Trends Prediction - Economica,"... -joist market: Boise Cascade Roseburg LP EACOM Timber Corporation Chantiers Chibougamau Nordic Pacific Woodtech Corporation Stark Truss Company, Inc.",economica.ma,2024-08-02 08:28:58+00:00,2024-08-02 20:02:11
126,"Clorox forecasts annual profit above estimates, beats fourth-quarter profit on lower input costs",The company's sales in grilling business of its household ... Boise Cascade Company Announces 5% Quarterly Dividend Increase and Special Dividend.,ca.finance.yahoo.com,2024-08-01 20:37:35+00:00,2024-08-02 20:02:11
