,Heading,Subheading,Publisher,Published,Found
0,Core &amp; Main Earnings: What To Look For From CNM - The Globe and Mail,Watsco traded up 7.5% following the results while Boise Cascade was down 6.2%. ... The Financing represents an opportunity for the Company to bolster ...,www.theglobeandmail.com,2024-06-18 07:02:42,2024-06-18 15:11:13
1,Should Invesco S&amp;P SmallCap Momentum ETF (XSMO) Be on Your Investing Radar?,"Looking at individual holdings, Abercrombie & Fitch Co ANF accounts for about 3.12% of total assets, followed by Boise Cascade Co BCC and ...",www.tradingview.com,2024-06-17 06:35:46,2024-06-18 15:11:13
2,Exterior Sheathing Market to Witness Stunning Growth | Boise - openPR.com,"... Boise Cascade, CertainTeed, DuPont - published on openPR ... Boise Cascade Company (United States), CertainTeed Corporation (United ...",www.openpr.com,2024-06-19 00:59:39,2024-06-19 13:17:59
3,"Gary Deily Obituary - Catasauqua, PA - The Morning Call","Gary is a retired truck driver having worked for Mail-Well Envelopes, formerly Boise Cascade, for many years. ... Company Info. Careers- Contact Us ...",www.mcall.com,2024-06-18 18:06:19,2024-06-19 13:17:59
4,Form 487 Advisors Disciplined - StreetInsider,"The Interpublic Group of Companies, Inc. ​. 1.99. ​. ​. 29.58. ​. ​. 2,958. ​. 1,125. ​. SIRI ... Boise Cascade Company. ​. 1.96. ​. ​. 126.85. ​. ​.",www.streetinsider.com,2024-06-18 16:17:05,2024-06-19 13:17:59
5,Exterior Sheathing Market to Witness Stunning Growth | Boise - openPR.com,"... Boise Cascade, CertainTeed, DuPont - published on openPR ... Boise Cascade Company (United States), CertainTeed Corporation (United ...",www.openpr.com,2024-06-19 05:59:39+00:00,2024-06-19 17:02:10
6,"Gary Deily Obituary - Catasauqua, PA - The Morning Call","Gary is a retired truck driver having worked for Mail-Well Envelopes, formerly Boise Cascade, for many years. ... Company Info. Careers- Contact Us ...",www.mcall.com,2024-06-18 23:06:19+00:00,2024-06-19 17:02:10
7,Form 487 Advisors Disciplined - StreetInsider,"The Interpublic Group of Companies, Inc. ​. 1.99. ​. ​. 29.58. ​. ​. 2,958. ​. 1,125. ​. SIRI ... Boise Cascade Company. ​. 1.96. ​. ​. 126.85. ​. ​.",www.streetinsider.com,2024-06-18 21:17:05+00:00,2024-06-19 17:02:10
8,Views from the &quot;Rogue Gold&quot; Tree Sit (with Cricket and D) | KPFA,"... Boise Cascade and other timber companies log this area they're calling Rogue Gold, recent success of a tree sit at Poor Windy, revelations of ...",kpfa.org,2024-06-19 18:07:47+00:00,2024-06-19 21:02:09
9,GMS (GMS) Q1 Earnings Report Preview: What To Look For - The Globe and Mail,"Boise Cascade delivered year-on-year revenue growth of 6.5%, beating ... The company is committed to building a community around sustainable ...",www.theglobeandmail.com,2024-06-19 17:36:39+00:00,2024-06-19 21:02:09
10,BCC's Market Quandary: Decoding the Ups and Downs of 2023 - Invest Chronicle,"The stock market performance of Boise Cascade Co has been very steady. Over the last year, the company's stock hit its highest at $154.67 on 04/01/24, ...",investchronicle.com,2024-06-19 16:51:54+00:00,2024-06-19 21:02:09
11,Analysts See 11% Gains Ahead For The Holdings of SDVY | Nasdaq,"Boise Cascade Co. BCC, $126.29, $141.00, 11.65%. Carter's Inc, CRI, $63.38, $70.50, 11.23%. Are analysts justified in these ...",www.nasdaq.com,2024-06-19 15:11:21+00:00,2024-06-19 21:02:09
12,GMS (GMS) Q1 Earnings Report Preview: What To Look For - The Globe and Mail,"The majority of analysts covering the company have reconfirmed their ... Boise Cascade delivered year-on-year revenue growth of 6.5%, beating ...",www.theglobeandmail.com,2024-06-19 10:56:08+00:00,2024-06-19 21:02:09
13,Should Invesco S&amp;P SmallCap Momentum ETF (XSMO) Be on Your Investing Radar?,"... Boise Cascade Co (BCC) and Installed Building Products Inc (IBP). ... With about 119 holdings, it effectively diversifies company-specific risk.",malaysia.news.yahoo.com,2024-06-19 05:24:12+00:00,2024-06-19 21:02:09
14,Wellington Management Group LLP Sells 571428 Shares of Nuvei Co. (NASDAQ:NVEI),"... Boise Cascade (NYSE:BCC)- Wellington Management Group LLP Raises Position in The Toro Company (NYSE:TTC)- NetEase, Inc. (NASDAQ:NTES) Stake Boosted ...",www.defenseworld.net,2024-06-20 09:16:13+00:00,2024-06-20 12:02:12
15,BofA Securities analysts downgrades an Underperform rating for Boise Cascade Co (BCC),"Boise Cascade Co's filing revealed that its EVP, BMD Strom Jeffrey Robert unloaded Company's shares for reported $0.42 million on May 15 '24.",knoxdaily.com,2024-06-20 07:18:40+00:00,2024-06-20 18:02:14
16,Smart Investing in Turbulent Times Weekly Update - Cabot Wealth Network,... Boise Cascade (BCC) reported fourth-quarter 2015 results that disappointed the market ... The company will report full-year 2015 results on February 22.,www.cabotwealth.com,2024-06-20 08:19:53+00:00,2024-06-21 02:02:08
17,Laminated Veneer Lumber (LVL) Market Size &amp; Regional Growth - openPR.com,"• Boise Cascade • Anderson Lumbar Company • Clarke Veneers & Plywood ... Companies are likely to focus on innovation, sustainability, and expanding ...",www.openpr.com,2024-06-21 10:23:57+00:00,2024-06-21 16:02:12
18,Wooden Decking Market: Anticipated CAGR of 2.9% and a Projected Valuation of US$ 10.4 ...,"... Boise Cascade Company; Builders FirstSource, Inc; AZEK Building Products, Inc., among others. Some notable developments are as follows: In October ...",marketresearchblog.org,2024-06-21 03:01:05+00:00,2024-06-21 16:02:12
19,Alfred Ehritz Obituary - PA - The Morning Call,"... company in Philadelphia for 10 years. After that, he worked as a machinist and a punch press department head for Boise Cascade at the East ...",www.mcall.com,2024-06-22 20:03:31+00:00,2024-06-23 03:02:10
20,Global Building Boards Market Strategic Alliances: Partnerships for Growth - TIMC,"Kronospan, Stone Rex, Blue Ridge Fiberboard, Boise Cascade Holdings LLC, Collins Companies Incorporated, Plum Creek Timber Company Incorporated ...",www.theindianmoviechannel.com,2024-06-23 09:14:43+00:00,2024-06-23 10:02:10
21,Process Service Specialists Expands into Southwest Louisiana with New $3.5 Million ...,The company expects to create 160 direct new jobs in Calcasieu Parish ... – Boise Cascade Wood Products announced it plans to invest $75 million ...,www.opportunitylouisiana.gov,2024-06-24 16:13:41+00:00,2024-06-24 18:02:04
22,Goldman Sachs Group Inc. Sells 140725 Shares of ChampionX Co. (NASDAQ:CHX),Company insiders own 1.38% of the company's stock. Wall Street Analyst Weigh In ... Boise Cascade (NYSE:BCC) Shares Purchased by Vanguard Group Inc.,www.defenseworld.net,2024-06-24 14:58:11+00:00,2024-06-24 18:02:04
23,Reliability Coordinator - Boise Cascade - Built In,"The company is located in Boise, ID. Boise Cascade was founded in 1957. It has 2803 total employees. To see all 16 open jobs at Boise Cascade, click ...",builtin.com,2024-06-24 13:27:10+00:00,2024-06-24 18:02:04
24,Boise Cascade (NYSE:BCC) Has A Pretty Healthy Balance Sheet - Simply Wall St News,Boise Cascade. Engages in manufacture of wood products and distribution of building materials in the United States and Canada.,simplywall.st,2024-06-25 16:53:46+00:00,2024-06-25 19:02:07
25,Forty years of stories attest to growth in Idaho,Although Boise Cascade Corp.'s sales and earnings were relatively flat ... Business growth and the success of new Boise products has led to the ...,idahobusinessreview.com,2024-06-25 15:30:41+00:00,2024-06-25 19:02:07
26,"Glue Laminated Timber Market Size, Share, Revenue, Trends And Drivers For 2024-2033","The Business Research Company's Glue Laminated Timber Global Market ... Key companies such as Stora Enso Oyj, Boise Cascade Company, and Canfor ...",www.einnews.com,2024-06-25 12:55:26+00:00,2024-06-25 19:02:07
27,"Range Financial Group LLC Buys 409 Shares of General Mills, Inc. (NYSE:GIS)","(NYSE:GIS – Free Report) by 7.2% during the first quarter, according to the company ... Range Financial Group LLC Grows Stock Holdings in Boise Cascade ...",www.defenseworld.net,2024-06-25 11:47:21+00:00,2024-06-25 19:02:07
28,MILLS HONORED WITH APA SAFETY &amp; HEALTH AWARDS - Building Products Digest,"Other winners included: • Annual Safety & Health Honor Roll for plywood: Boise Cascade, Chapman, Al., and White City, Or.; for OSB: LP ...",www.building-products.com,2024-06-25 10:04:22+00:00,2024-06-25 19:02:07
29,Is First Trust Small Cap Core AlphaDEX ETF (FYX) a Strong ETF Right Now?,"When you look at individual holdings, Green Brick Partners, Inc. (GRBK) accounts for about 0.49% of the fund's total assets, followed by Boise Cascade ...",ca.style.yahoo.com,2024-06-25 06:57:28+00:00,2024-06-25 19:02:07
30,Ferdinando Loffredo Obituary - PA - The Morning Call,"Elizabeth of Hungary Catholic Church, Whitehall. Freddy was a longtime papercutter for the former Boise Cascade, Catasauqua, until retiring,and ...",www.mcall.com,2024-06-25 06:04:55+00:00,2024-06-25 19:02:07
31,Ontario government to invest for workers in need | Woodworking Network,boise-cascade-roof-working.jpg. ONTARIO — The Ontario government is ... Share your thoughts with us in the comments below. Economy and Business ...,www.woodworkingnetwork.com,2024-06-26 17:07:15+00:00,2024-06-26 19:02:15
32,Boise Cascade Company (BCC): Is This Land and Timber Stock a Good Buy?,"In this article, we are going to take a look at where Boise Cascade Company (NYSE:BCC) stands against the other land and timber stocks. The land and ...",finance.yahoo.com,2024-06-27 02:43:10+00:00,2024-06-27 04:02:11
33,10 Best Land and Timber Stocks to Buy According to Hedge Funds - Insider Monkey,"Boise Cascade Company (NYSE:BCC), founded in 2004 and headquartered in Boise, Idaho, is a one-stop shop for builders across the United States and ...",www.insidermonkey.com,2024-06-27 01:34:54+00:00,2024-06-27 04:02:11
34,Boise Cascade Co [BCC] Investment Appeal on the Rise - Knox Daily,"Boise Cascade Co's recently made public that its EVP, BMD Strom Jeffrey Robert unloaded Company's shares for reported $0.42 million on May 15 '24.",knoxdaily.com,2024-06-27 00:57:31+00:00,2024-06-27 04:02:11
35,3 Stocks With 100+% EPS Growth Trajectories Over the Next 5 Years - InvestorPlace,Boise Cascade (NYSE:BCC) is a land and timber company that owns significant timberland holdings to support its wood production operations. Demand for ...,investorplace.com,2024-06-28 17:45:52+00:00,2024-06-28 19:02:14
36,Charles B. Coombs IV Obituary - Cape Cod Times,He worked for many years at Boise Cascade and often said how fortunate ... Company Logo. Privacy Preference Center. When you visit our website ...,www.capecodtimes.com,2024-06-28 13:55:19+00:00,2024-06-28 19:02:14
37,"Forbes' list may surprise you | Jeffrey Scharf, Everybody's Business - Santa Cruz Sentinel","Boise Cascade, Clorox, Dish Network, DoorDash, Moderna, Monster Beveridge? 9. Which of these lost money – 3M, State Farm, Walgreens, Boeing? 10 ...",www.santacruzsentinel.com,2024-06-28 09:18:32+00:00,2024-06-28 19:02:14
38,"Bertha Carpenter Obituary (1929 - 2024) - Meridian, ID - Idaho Press Tribune - Legacy.com","... Boise Payette Lumber Company, working as a secretary. Bertha was working for Boise Payette Lumber when they became Boise Cascade Corporation where ...",www.legacy.com,2024-06-30 13:21:57+00:00,2024-06-30 17:02:15
39,Public officials urge caution amid 'peak season' of harmful algal blooms,"I'm Sofia Blenkinsop, a sophomore at Boise State thrilled to work with Boise State Public Radio. After co-founding a podcast club in high school ...",www.boisestatepublicradio.org,2024-07-01 17:04:04+00:00,2024-07-01 19:02:20
40,PNC Financial Services Group Inc. Trims Stock Position in Boise Cascade (NYSE:BCC),About Boise Cascade ... Boise Cascade Company engages in manufacture of wood products and distribution of building materials in the United States and ...,www.defenseworld.net,2024-07-01 08:36:01+00:00,2024-07-01 19:02:20
41,"Major Drug Bust Near Idaho Border Finds Meth, 60000 Fentanyl Pills - 103.5 kissfm","According to TestClear.com, you should expect to take a urine test before being hired with Central Paving Inc. Boise Cascade. Google Maps. Boise ...",1035kissfmboise.com,2024-07-02 16:29:24+00:00,2024-07-02 19:02:17
42,(BCC) - Analyzing Boise Cascade's Short Interest - Benzinga,Boise Cascade Short Interest Graph (3 Months). short_fig. As you ... A company's peer is another company that has similar characteristics to ...,www.benzinga.com,2024-07-02 15:47:44+00:00,2024-07-02 19:02:17
43,"Navigating Engineered Wood Market size 2024 : Share Insights, Future Demand and ... - EIN News","Louisiana-Pacific Corporation (LP), Boise Cascade Company, Shenzhen Risewell Industry Co., Ltd, Celulosa Arauco Y Constitucion SA, Weyerhaeuser ...",www.einnews.com,2024-07-02 15:09:51+00:00,2024-07-02 19:02:17
44,"Doris Larson Obituary (1934 - 2024) - Beaverton, OR - The Oregonian","In July 1970, the family moved to Beaverton, OR when Don's work transferred him to the Portland office of Boise Cascade Corporation and their fourth ...",obits.oregonlive.com,2024-07-02 11:14:01+00:00,2024-07-02 19:02:17
45,4th of July 2024: Guide to celebrations in the Boise area - KTVB,Fireworks to begin at 10 p.m.. Thunder Mountain Days in Cascade ... Local company announces plans to bring 4th of July parade back to Boise ...,www.ktvb.com,2024-07-03 18:01:03+00:00,2024-07-03 19:02:15
46,Benjamin Obdyke names new Northwest sales associate | HBS Dealer,"Pearson has a range of expertise in building products and distribution, joining Benjamin Obdyke from Boise Cascade ... company's products present for ...",hbsdealer.com,2024-07-03 14:19:17+00:00,2024-07-03 19:02:15
47,Scott Davies Obituary - PA - The Morning Call,"He was an adjuster for the former Mail Well and Boise Cascade, Allentown, for more than 30 years. ... Company, Catasauqua, and the Jednota Club, North ...",www.mcall.com,2024-07-03 08:38:54+00:00,2024-07-03 19:02:15
48,"Saudi Arabia Plywood and Laminates Market, Competition, - GlobeNewswire","Koch Industries, Inc. West Fraser Timber Co. Ltd. Louisiana-Pacific Corporation; Kronoplus Limited; Boise Cascade Company; PotlatchDeltic Corporation.",www.globenewswire.com,2024-07-05 14:19:30+00:00,2024-07-05 19:02:22
49,Let's Front Run These 5 Upcoming Dividend Hikes - Nasdaq,Boise Cascade (BCC) Dividend Yield: 7.6% 2023 Increase(s): 67% Projected Q3 Dividend Announcement: Late July. Boise Cascade (BCC) makes and ...,www.nasdaq.com,2024-07-05 13:33:43+00:00,2024-07-05 19:02:22
50,Another Dividend Hike Season On Tap: 5 Stocks To Watch - Forbes,Boise Cascade (BCC). Dividend Yield: 7.6%. 2023 Increase(s): 67%. Projected Q3 Dividend Announcement: Late July. Boise Cascade (BCC) makes and ...,www.forbes.com,2024-07-06 18:06:17+00:00,2024-07-06 19:02:17
51,Plywood Market: 2024's Advanced Manufacturing Techniques and Market Dynamics,Weyerhaeuser Company; Boise Cascade; UPM-Kymmene Corporation; Sveza; Others. Plywood Market Players & Competitor Analysis: The report covers the key ...,www.whatech.com,2024-07-06 06:56:06+00:00,2024-07-06 19:02:17
52,Van ECK Associates Corp Has $2.33 Million Position in Jones Lang LaSalle Incorporated ...,Van ECK Associates Corp Boosts Stake in United Therapeutics Co. (NASDAQ:UTHR)- Van ECK Associates Corp Boosts Stock Holdings in Boise Cascade (NYSE: ...,www.defenseworld.net,2024-07-07 10:42:22+00:00,2024-07-07 12:02:19
53,Van ECK Associates Corp Has $2.43 Million Position in VanEck Agribusiness ETF ...,"O ROURKE & COMPANY Inc now owns 10,283 shares of the company's ... Van ECK Associates Corp Boosts Stock Holdings in Boise Cascade (NYSE:BCC) ...",www.defenseworld.net,2024-07-07 16:41:49+00:00,2024-07-07 19:02:21
54,Van ECK Associates Corp Takes $2.42 Million Position in iShares Residential and ... - Defense World,... company in its most recent Form 13F filing with the Securities and ... Van ECK Associates Corp Boosts Stock Holdings in Boise Cascade (NYSE:BCC) ...,www.defenseworld.net,2024-07-07 22:41:08+00:00,2024-07-08 04:02:14
55,Van ECK Associates Corp Boosts Stock Holdings in Boise Cascade (NYSE:BCC),Boise Cascade Profile ... Boise Cascade Company engages in manufacture of wood products and distribution of building materials in the United States and ...,www.defenseworld.net,2024-07-07 22:41:04+00:00,2024-07-08 04:02:14
56,Industrial Distributors Stocks Q1 In Review: Boise Cascade (NYSE:BCC) Vs Peers,"Shares Analysis by Investing.com (Ismael De La Cruz) covering: S&P 500, NVIDIA Corporation. Read Investing.com (Ismael De La Cruz)'s latest ...",ca.investing.com,2024-07-08 11:36:47+00:00,2024-07-08 13:02:21
57,Industrial Distributors Stocks Q1 In Review: Boise Cascade (NYSE:BCC) Vs Peers,"Formed through the merger of two lumber companies, Boise Cascade Company (NYSE:BCC) manufactures and distributes wood products and other building ...",finance.yahoo.com,2024-07-08 11:23:18+00:00,2024-07-08 13:02:21
58,"Engineered Wood Market Outlook 2024-2031: Examining Supply, - openPR.com",☆ Boise Cascade ☆ Georgia-Pacific (Georgia-Pacific Wood Products LLC) ... ☆ Weyerhaeuser Company Detailed Segmentation: Engineered Wood ...,www.openpr.com,2024-07-08 08:44:49+00:00,2024-07-08 13:02:21
59,"Nordea Investment Management AB Sells 7,717 Shares of Boise Cascade (NYSE:BCC)",Boise Cascade Company engages in manufacture of wood products and distribution of building materials in the United States and Canada. It operates ...,www.marketbeat.com,2024-07-08 18:16:36+00:00,2024-07-08 22:02:26
60,"Boise Cascade Company Expands to Hondo, TX - EIN News","The third Boise Cascade distribution center in the state, the facility will support the company's expansion into high-growth markets while also ...",www.einnews.com,2024-07-09 12:16:31+00:00,2024-07-09 17:02:18
61,Boise Cascade Becomes Oversold | Nasdaq,"But making Boise Cascade Co. an even more interesting and timely stock to look at, is the fact that in trading on Wednesday, shares of BCC entered ...",www.nasdaq.com,2024-07-10 15:36:37+00:00,2024-07-10 19:02:21
62,Wood Particle Board Market : Reaching the Modern Consumer - KnowCasino,Georgia-pacific; Wanhua Ecoboard Co. Ltd; Kastamonu Entegre; Boise Cascade Company; Columbia Forest Products; Inc. Norbord Inc. Dalian Penghong Wood ...,www.knowcasino.co.nz,2024-07-10 12:06:16+00:00,2024-07-10 19:02:21
63,"U.S. CoreCivic, Eli Lilly, 40 - XM",... Inc BERY.N: BofA Global Research cuts PT to $72 from $81. * BlackRock BLK.N: Morgan Stanley cuts target price to $1013 from $1025. * Boise Cascade Co ...,www.xm.com,2024-07-11 19:25:50+00:00,2024-07-11 22:02:19
64,"John Sahlberg Obituary (1953 - 2024) - Boise, ID - Idaho Statesman - Legacy.com","During his 37-year career with Boise Cascade Corporation and Boise Cascade Company, he handled over 300 labor arbitrations, undertook numerous ...",www.legacy.com,2024-07-11 17:45:36+00:00,2024-07-11 22:02:19
65,"Should You Investigate Expedia Group, Inc. (NASDAQ:EXPE) At US$130? - Simply Wall St",Calculating The Fair Value Of Boise Cascade Company (NYSE:BCC)- Simply Wall St- Investors Still Aren't Entirely Convinced By ...,simplywall.st,2024-07-11 13:42:10+00:00,2024-07-11 22:02:19
66,Global Ship Lease (NYSE:GSL) Knows How To Allocate Capital Effectively - Simply Wall St,"Calculating The Fair Value Of Boise Cascade Company (NYSE:BCC)- Simply Wall St- Should You Investigate Expedia Group, Inc. (NASDAQ ...",simplywall.st,2024-07-11 13:28:36+00:00,2024-07-11 22:02:19
67,"Engineered Wood Market See Huge Growth for New Normal | UPM, SVEZA, Georgia-Pacific ...","... Boise Cascade, Rimbunan Hijau, Samling, Syktyvkar plywood mill, Plum Creek Timber Company, Swanson Group, Potlatch Corporation, Roseburg, Demidovo ...",www.theindianmoviechannel.com,2024-07-12 04:27:17+00:00,2024-07-12 07:02:20
68,Acadia Healthcare Company (NASDAQ:ACHC) Might Have The Makings Of A Multi-Bagger,"Calculating The Fair Value Of Boise Cascade Company (NYSE:BCC). Simply Wall St- Should You Investigate Expedia Group, Inc. (NASDAQ ...",simplywall.st,2024-07-12 01:00:36+00:00,2024-07-12 07:02:20
69,Boise Cascade Breaks Above 200-Day Moving Average - Bullish for BCC - ProInvestor,"In trading on Friday, shares of Boise Cascade Co. (Symbol: BCC) crossed above their 200 day moving average of $125.03, changing hands as high as ...",proinvestor.com,2024-07-12 15:39:57+00:00,2024-07-12 17:02:20
70,"Plywood Market Analysis Development, Growth Prospects, - openPR.com","Uniply Industries Ltd. ☆ Boise Cascade LLC ☆ Ainsworth Lumber Co. Ltd. ☆ Georgia-Pacific Corporation. Detailed Segmentation: Plywood Market, ...",www.openpr.com,2024-07-12 11:16:18+00:00,2024-07-12 17:02:20
71,"John Sahlberg Obituary (1953 - 2024) - Boise, ID - Idaho Statesman - Legacy.com","During his 37-year career with Boise Cascade Corporation and Boise Cascade Company, he handled over 300 labor arbitrations, ...",www.legacy.com,2024-07-12 02:25:29+00:00,2024-07-13 01:02:19
72,"V. Morgan Obituary (2024) - Vancouver, WA - The Columbian - Legacy.com","... Boise Cascade in Portland where their third child, David, was born in ... The business still runs to this day, as part of a larger paper company.",www.legacy.com,2024-07-14 07:21:48+00:00,2024-07-14 13:02:14
73,"John Thomas Sahlberg obituary, 1953-2024, Boise, Idaho - Legacy.com","During his 37-year career with Boise Cascade Corporation and Boise Cascade Company, he handled over 300 labor arbitrations ...",www.legacy.com,2024-07-14 19:29:33+00:00,2024-07-14 23:02:14
74,"Sahlberg, John Thomas | Obituaries | idahopress.com","... Boise Cascade Corporation. During his 37-year career with Boise Cascade Corporation and Boise Cascade Company, he handled over 300 labor ...",www.idahopress.com,2024-07-14 19:20:19+00:00,2024-07-14 23:02:14
75,Duality Advisers LP Takes $289000 Position in Boise Cascade (NYSE:BCC),Boise Cascade Company Profile ... Boise Cascade Company engages in manufacture of wood products and distribution of building materials in the United ...,www.defenseworld.net,2024-07-15 10:43:14+00:00,2024-07-15 17:02:19
76,Structural Panel Market Mergers and Acquisitions: Key Deals and Strategies - KnowCasino,Boise Cascade; Roseburg; Columbia; Timber Products; Coastal Forest Resources; Hood Industries. Structural Panel Market Competitive Landscape. The ...,www.knowcasino.co.nz,2024-07-15 23:56:01+00:00,2024-07-16 02:02:20
77,The industry's Top Women of 2024 - HBS Dealer,"Diana Tronzano, National Account executive, BlueLinx Corporation. Marcy Whitlock, Safety Specialist, Boise Cascade. Narom (Natt) Yin, Office ...",hbsdealer.com,2024-07-15 23:21:44+00:00,2024-07-16 02:02:20
78,"Plywood Market size is set to grow by USD 13.47 billion from 2024-2028, Increasing ...","Boise Cascade Co., Century Plyboards Ltd., Columbia Forest Products Inc., Duroply Industries Ltd., Evergreen Plywood Industries, Ganahl Lumber Co ...",finance.yahoo.com,2024-07-15 21:11:37+00:00,2024-07-16 02:02:20
79,"U.S. BlackRock, Goldman Sachs, Netflix - XM",... Inc BX.N: Citigroup raises target price to $127 from $124. * Bloom Energy Corp BE.N: JP Morgan raises target price to $14 from $12. * Boise Cascade ...,www.xm.com,2024-07-16 14:13:16+00:00,2024-07-16 19:02:17
80,"Truist Securities Maintains Buy on Boise Cascade, Lowers Price Target to $159","Boise Cascade Company (""Boise Cascade,"" the ""Company,"" ""we,"" or ""our"") (NYSE:BCC) today reported net income of $104.1 million, or $2.61 per share, ...",quantisnow.com,2024-07-16 13:44:59+00:00,2024-07-16 19:02:17
81,Albertson family firm buys Scout camp near Payette Lake ID - Idaho Statesman,"The camp was sold to Alscott Real Estate LLC, a Boise-based development business owned by the heirs of Joe and Kathryn Albertson, who founded the ...",www.idahostatesman.com,2024-07-17 11:47:54+00:00,2024-07-17 15:02:14
82,Obituary: Donald Joseph Jasud - Sun Journal,"... Co and retiring from Boise Cascade. First and foremost, Donald was a devoted husband, father, grandfather and great grandfather. Family was his ...",www.sunjournal.com,2024-07-18 12:52:46+00:00,2024-07-18 17:02:15
83,Birch Wood Product Market to Witness Massive Growth by 2030 | - openPR.com,"... Boise Cascade Company (United States), Georgia-Pacific LLC ... company's pipeline products and provides key information about the company, major…",www.openpr.com,2024-07-18 10:59:26+00:00,2024-07-18 17:02:15
84,IBD Rating Upgrades: Boise Cascade Shows Improved Technical Strength,"Taking a look at top and bottom line numbers, the company has posted two quarters of increasing earnings growth. Sales growth has also increased over ...",www.investors.com,2024-07-19 15:04:26+00:00,2024-07-19 20:02:13
85,Westlake Royal Building Products bolsters partnership with Boise Cascade - HBS Dealer,Boise Cascade is a leader in the building products industry throughout North America. The company is publicly traded on the New York Stock Exchange ...,hbsdealer.com,2024-07-22 20:52:17+00:00,2024-07-23 00:02:12
86,"Henry Brook Obituary (2024) - Mountain View, CA - Legacy.com",... Company. This led to yet another job opportunity with Boise Cascade Corporation. These employment advancements and opportunities required moves to ...,www.legacy.com,2024-07-22 20:22:54+00:00,2024-07-23 00:02:12
87,Analysts Estimate Boise Cascade (BCC) to Report a Decline in Earnings: What to Look Out for,Estimate revisions ahead of a company's earnings release offer clues to the business conditions for the period whose results are coming out. Our ...,finance.yahoo.com,2024-07-22 16:22:14+00:00,2024-07-23 00:02:12
88,"Vernon Maynard Lindback Obituary (2024) - Minneapolis, MN - Legacy.com","Vernon and Marcia moved to the Twin Cities, where he worked at American Can, Boise Cascade ... Jerry Miller (1943–2024), guitarist and co-founder of ...",www.legacy.com,2024-07-23 15:02:08+00:00,2024-07-23 20:02:12
