,Heading,Subheading,Publisher,Published,Found
1308,"As Wiz turns down a $23 billion offer from Google, a founder shares his regret on selling to Cisco",Or Rappaport may have decided that his company would be better positioned to achieve its goals as a public company. ... diane.brady@fortune.com,fortune.com,2024-07-24 08:29:36+00:00,2024-07-24 10:02:23
1309,Seattle Seahawks 2024 training camp preview - ESPN,"Brady Henderson, ESPNJul 23, 2024, 08:00 PM. Close. Brady Henderson is a ... The Walt Disney Company Logo. Notice of Right to Opt Out of Sale ...",www.espn.com.au,2024-07-23 22:18:29+00:00,2024-07-24 10:02:23
1310,"Mizzou's Brady Cook can't worry about 'being a celebrity quarterback,' coach Eli Drinkwitz says",Lear employee shares hope that strike will lead to company 'giving us what we're worth' ...,www.stltoday.com,2024-07-24 10:02:54+00:00,2024-07-24 12:02:17
1311,How 'Brady' lists help prosecutors track police misconduct - ClickOrlando.com,Taser deaths ... Brady” lists or similar records can hurt those officers' ability ...,www.clickorlando.com,2024-07-24 09:40:45+00:00,2024-07-24 12:02:17
1312,"Wayne Brady on ex-wife, her husband: 'It's not a throuple' - UPI.com",Wayne Brady and Taketa were married from 1999 to 2008. Maile Brady was born in 2003 and entered show business at 15 on The Bold and the Beautiful.,www.upi.com,2024-07-24 09:05:55+00:00,2024-07-24 12:02:17
1313,John Brady Obituary - PA - The Morning Call,"John J. BradyJohn J. Duffy Brady, 80, of Hellertown, died Saturday, July 11, 2009. Born March 9, 1929 in Fountain Hill, he was the son of the late ...",www.mcall.com,2024-07-24 05:39:17+00:00,2024-07-24 12:02:17
1314,Watch Joe Brady bring energy and enthusiasm to Bills practice - MyChamplainValley.com,Energized from the offseason. Get the full exclusive look in the latest episode of Embedded on our YouTube: https://t.co/aaOdYxg4Nt@NorthtownAuto ...,www.mychamplainvalley.com,2024-07-24 05:19:50+00:00,2024-07-24 12:02:17
1315,Helen Brady Obituary - PA - The Morning Call,"Brady OBITUARY. Helen I. Brady. Helen I. Brady, 84, of Bethlehem ... Company Info. Careers- Contact Us- Sitemap- Help Center- Archives- About Us.",www.mcall.com,2024-07-24 06:15:47+00:00,2024-07-24 13:02:22
1316,Donald Brady Obituary - PA - The Morning Call,"Brady OBITUARY. Donald E. Brady. Donald E. Brady, 84, of Bethlehem ... Company Info. Careers- Contact Us- Sitemap- Help Center- Archives- About Us.",www.mcall.com,2024-07-24 06:28:57+00:00,2024-07-24 14:02:24
1317,Kendra Scott CEO Tom Nolan doesn't like a know-it-all leader. Here's why - Fortune,"Diane Brady: Leadership Next is powered by the folks at Deloitte who, like me, are exploring the changing roles of business leadership and how CEOs ...",fortune.com,2024-07-24 14:41:57+00:00,2024-07-24 16:02:29
1318,Ranking the top 25 NFL players since 2000 - ESPN,When Brady was asked which of his seven Super Bowl rings was his ... The Walt Disney Company Logo. Notice of Right to Opt Out of Sale/Sharing.,www.espn.com,2024-07-24 14:32:18+00:00,2024-07-24 16:02:29
1319,Dutton/Brady Gym Floor | | choteauacantha.com,"Dutton/Brady Public Schools is replacing its old gymnasium floor design ... Business office hours: Monday-Friday, 8 a.m.-5 p.m.. News email: acantha ...",www.choteauacantha.com,2024-07-24 14:04:45+00:00,2024-07-24 16:02:29
1320,"All About Wayne Brady's Daughter, Maile Masako Brady - People","The Freeform docuseries follows Brady and his blended family, including his ex-wife and business partner Taketa, her partner Fordham and Maile. In a ...",people.com,2024-07-24 13:31:21+00:00,2024-07-24 16:02:29
1321,How Tom Brady Saved the Day With 'Entourage' Cameo - Newsweek,Brady made an appearance in a Season 6 episode of the HBO show titled ... Company. About UsMastheadDiversityAnnouncementsArchivePolicies and ...,www.newsweek.com,2024-07-24 12:02:10+00:00,2024-07-24 16:02:29
1322,Harper's Bazaar &amp; Veuve Clicquot Bold Conversations 2024,"With a master's degree in Environmental Geoscience, Brady impressed the judges with her ability to translate her academic acumen into business success ...",www.harpersbazaar.com,2024-07-24 11:41:33+00:00,2024-07-24 16:02:29
1323,"Business Names: July 15-19, 2024 | Business | tylerpaper.com",Brady Allen Dominy doing business as Nexus Wealth Strategies. Robert E. Schmoker doing business as Premier Flexipac. Kelly Osborne doing business ...,tylerpaper.com,2024-07-24 10:49:55+00:00,2024-07-24 16:02:29
1324,Wayne Brady just shared a heartwarming update a year after coming out as pansexual,... Brady's former backup dancers) as they co-parent their 21-year-old daughter. The show explores their untraditional points of view and values about ...,www.thepinknews.com,2024-07-24 15:59:42+00:00,2024-07-24 17:02:24
1325,International Powerhouse Star Delta Brady is About to debut in WWE - Times of India,A piece of amazing news is just coming in that WWE is about to sign a new talent in their company. WWE recently introduced so many new talented ...,timesofindia.indiatimes.com,2024-07-24 15:46:37+00:00,2024-07-24 17:02:24
1326,'Superman's María Gabriela De Faría To Topline Serial Killer Pic 'Romanticizing Monsters ...,"Previously, Brady co-wrote and directed the horror pic Dark Nature, also contributing to Screambox's Creepypasta. ADVERTISEMENT. Advertisement. De ...",ca.news.yahoo.com,2024-07-24 16:29:52+00:00,2024-07-24 18:02:25
1327,María Gabriela De Faría To Star In 'Romanticizing Monsters' Serial Killer Film - Deadline,"Previously, Brady co-wrote and directed the horror pic Dark Nature, also contributing to Screambox's Creepypasta. De Faría is represented by ...",deadline.com,2024-07-24 16:17:48+00:00,2024-07-24 18:02:25
1328,Wayne Brady's nontraditional home life redefines today's modern family in new reality series,"Wayne Brady's nontraditional home life redefines ... The Walt Disney Company is the parent company of Freeform, Hulu and this ABC station.",6abc.com,2024-07-24 17:04:33+00:00,2024-07-24 19:02:24
1329,Wayne Brady found his family to be more accepting of his pansexuality than internet trolls and bigots,"In new interview with Us Weekly to promote new show, Wayne Brady: The Family Remix, Brady ... Company Logo. Privacy Preference Center. When you visit ...",www.laineygossip.com,2024-07-24 18:26:47+00:00,2024-07-24 20:02:25
1330,Ex-BOE Official Predicts Labour Tax Hikes as High as £25 Billion - Bloomberg,Bloomberg the Company & Its ProductsThe Company & its ProductsBloomberg ... Photographer: Jonathan Brady/Getty Images. Gift this article. Have ...,www.bloomberg.com,2024-07-24 13:42:26+00:00,2024-07-24 20:02:25
1331,Beef 'O' Brady's Rolls Out SoundHound's Advanced Voice AI Ordering System,"(Nasdaq: SOUN) (“SoundHound”), a global leader in voice artificial intelligence, and Beef 'O' Brady's ... company, revealing that nearly 80% of regular ...",www.perishablenews.com,2024-07-24 13:24:32+00:00,2024-07-24 20:02:25
1332,Tillie Brady roars into 98 | | bradfordera.com,Tillie Brady roars into 98. By SARA FURLONG s.furlong@bradfordera ... Fountain Co. Neighbor- Herald Journal- KV Post News- Newton Co. Enterprise ...,www.bradfordera.com,2024-07-24 13:06:22+00:00,2024-07-24 20:02:25
1333,HCI Equity Partners-backed LawnPro scoops up lawn care services provider LawnRx,"... company after the transaction and continue to run the day-to-day operations; Quarles & Brady served as legal counsel to HCI; Based in Washington, DC ...",www.pehub.com,2024-07-24 12:50:11+00:00,2024-07-24 20:02:25
1334,"Kawakami: Kyle Shanahan on Brock Purdy, Bill Belichick and not obsessing over the OL","... Brady and offer him a one-year run at QB1? Only Shanahan would've done ... ©2024 The Athletic Media Company, A New York Times Company- Privacy ...",www.nytimes.com,2024-07-24 19:23:54+00:00,2024-07-24 21:02:26
1335,Wayne Brady says sitcom writers had 'no respect' for his real modern family - Yahoo,"The core four includes Brady, his ex-wife and best friend, Mandie Taketa, with whom he co-parents their 21-year-old daughter, Maile Brady, as well ...",www.yahoo.com,2024-07-24 17:38:01+00:00,2024-07-24 21:02:26
1336,Tom Brady Center Hikes South Florida House on Market for $3.2 Million - Robb Report,"Jensen, who serves as a managing partner and co-owner of the Tampa-based design/build company Gilk, acquired the then-newly built residence for ...",robbreport.com,2024-07-24 20:41:09+00:00,2024-07-24 22:02:25
1337,"Wayne Brady's unconventional family is the real deal, and they're giving us all a front row seat","... Brady: The Family Remix,” which focuses on his unconventional family that includes his ex-wife and business partner Mandie Taketa, their college ...",www.crossroadstoday.com,2024-07-24 20:24:12+00:00,2024-07-24 22:02:25
1338,Wayne Brady Celebrates One Year Anniversary Since Coming Out as Pansexual - Complex,"In The Family Remix, Brady and his ex-wife, Mandie Taketa, tackle co-parenting their daughter, 21-year-old Maile. The series is sure to shed light on ...",www.complex.com,2024-07-24 20:21:30+00:00,2024-07-24 22:02:25
1339,Wayne Brady's nontraditional home life redefines today's modern family in new reality series - ABC7,"""Wayne Brady: The Family Remix"" debuts on Freeform Wednesday, July 24, at 10 p.m., and drops the next day on Hulu. The Walt Disney Company is the ...",abc7.com,2024-07-24 18:50:04+00:00,2024-07-24 22:02:25
1340,Tom Brady Linked To SI Swimsuit Cover Model | San Diego Sports 760 - iHeart,Seven-time Super Bowl champion Tom Brady is reportedly linked to an SI Swimsuit cover mode ... Company Logo. Your Opt Out Preference Signal is Honored ...,sportssd.iheart.com,2024-07-24 21:07:39+00:00,2024-07-24 23:02:20
1341,"Meet Tom Brady's son Jack Moynahan, who's tight with his dad – and reportedly even taller than him","The NFL star was just spotted with his oldest son – who he co-parents with Gisele Bündchen – at a sushi restaurant in New York City, ...",www.scmp.com,2024-07-24 21:01:44+00:00,2024-07-24 23:02:20
1342,Brady Ellison looks to win gold in fifth Olympic appearance - NECN,Brady Ellison is on the precipice of history as he sets out to win ... Company Logo. Residents of one of the states listed in the 'Your Rights ...,www.necn.com,2024-07-24 20:56:23+00:00,2024-07-24 23:02:20
1343,Kevin Hart Explains Why Tom Brady's Roast Was a 'Lesson' for the... Retired NFL Star,A Delta Air Lines Airbus A330-300 with the registration N808NW takes off from Amsterdam- News- Delta CEO Gives End Date for Company's Travel ...,www.mensjournal.com,2024-07-24 20:43:48+00:00,2024-07-24 23:02:20
1344,Tom Brady and Brooks Nader Got Close at Billionaire 4th of July Party | Us Weekly,Tom Brady and supermodel Brooks Nader sparked dating rumors after ... Company Logo. Do Not Sell My Personal Information. When you visit our ...,www.usmagazine.com,2024-07-24 20:22:57+00:00,2024-07-24 23:02:20
1345,Tom Brady's Alleged New Romance Features a Very Drastic Age Gap,"Tom Brady's dating history includes models significantly younger than him, including Isabella Settanni and now, model Brooks Nader.",www.sheknows.com,2024-07-24 20:19:29+00:00,2024-07-24 23:02:20
1346,'Wayne Brady: The Family Remix' Freeform Review: Stream It Or Skip It? - Decider,"Mandie knows that they're currently not getting along, but Wayne needs to figure out how to co-parent in this situation. Also, Maile is not a fan of ...",decider.com,2024-07-24 20:03:42+00:00,2024-07-24 23:02:20
1347,"LIFER PAUL CLARK: AFTER 37 YRS., MURDER CHARGES DISMISSED ON INNOCENCE ...","... Brady v. Maryland. Wayne Co. Conviction Integrity Unit found key evidence, but denied relief 4 years ago for unknown reasons. Read Judge Slavens ...",voiceofdetroit.net,2024-07-24 19:23:15+00:00,2024-07-24 23:02:20
1348,"Envera Systems Acquires Applications by Design, Inc - The Malaysian Reserve","... Brady-Sheehan, CEO and President at Envera. “This partnership ... The Company is accelerating growth in existing markets and nationally ...",themalaysianreserve.com,2024-07-24 18:06:15+00:00,2024-07-24 23:02:20
1349,Patriots need Drake Maye to be Tom Brady replacement - 98.5 The Sports Hub,"He is the co-host of the number 1 midday show in Boston, Zolak & Bertrand, and he also appears on WBZ-TV as a Patriots insider. Zo is a University ...",985thesportshub.com,2024-07-24 16:14:35+00:00,2024-07-24 23:02:20
1350,Brady Tkachuk: 'Burning desire' to win Cup amid Matthew's celebrations | theScore.com,HEADLINES- Daily Newsletter- MORE STORIES- Daily Newsletter- Top Leagues- Company- Follow Us- Products.,www.thescore.com,2024-07-24 22:17:23+00:00,2024-07-25 00:02:26
1351,Tom Brady Is Dating 27-Year-Old Sports Illustrated Model Brooks Nader - The Daily Beast,"Jay Wallace, Fox News Media's president and executive editor, and Jessica Loker, the company's VP of politics, sent the letters. Wallace and Loker ...",www.thedailybeast.com,2024-07-24 22:16:54+00:00,2024-07-25 00:02:26
1352,Tom Brady and Sports Illustrated model Brooks Nader ARE dating - Daily Mail,"Haire is Vice President of the media company The Arena Group, which is the former publisher of Sports Illustrated. Brooks appeared to move on from ...",www.dailymail.co.uk,2024-07-24 22:10:45+00:00,2024-07-25 00:02:26
1353,The top 25 fantasy football players of this century - ESPN,Brady's longevity -- his second-best seasonal fantasy point total came ... The Walt Disney Company Logo. Notice of Right to Opt Out of Sale ...,www.espn.com,2024-07-24 21:43:44+00:00,2024-07-25 00:02:26
1354,America First Legal sues CrowdStrike over DEI practices | | coloradopolitics.com,"America First Legal sues CrowdStrike over DEI practices. Brady Knox, Washington Examiner ... Company lacks effective internal controls and suggests an ...",www.coloradopolitics.com,2024-07-24 18:58:17+00:00,2024-07-25 00:02:26
1355,'A Complete Unknown': Timothée Chalamet performs as Bob Dylan in new trailer - ABC11,The Walt Disney Company is the parent company of Searchlight Pictures and this ABC station. ... Wayne Brady shares unconventional home life in 'Family ...,abc11.com,2024-07-24 18:20:30+00:00,2024-07-25 00:02:26
1356,"5 things to know about Brooks Nader, the Sports Illustrated Swimsuit model dating Tom Brady","Here are five facts about Brooks Nader, the Sports Illustrated Swimsuit model who's ""casually dating"" Tom Brady ... Company Logo. This page is not ...",pagesix.com,2024-07-24 23:54:37+00:00,2024-07-25 01:02:26
1357,Tom Brady is 'casually dating' model Brooks Nader amid ongoing divorce - HOLA,"During a lecture at the VTEX event in São Paulo, Brazil, the Latina supermodel fought back tears while discussing with the co-founder of VTEX, Mariano ...",www.hola.com,2024-07-24 23:28:34+00:00,2024-07-25 01:02:26
1358,"Wayne Brady's unconventional family is the real deal, and they're giving us all a front row seat | CNN","Maile Brady, Wayne Brady, Mandie Taketa and Jason Michael Fordham ... Discovery Company. All Rights Reserved. CNN Sans ™ & © 2016 Cable News ...",amp.cnn.com,2024-07-24 19:50:15+00:00,2024-07-25 01:02:26
1359,"Kevin Hart understands Tom Brady's roast regrets, but feels it was 'necessary' for comedy climate",The Original Company. Copyright © 2024. All Rights Reserved. This site is protected by reCAPTCHA and the Google Privacy Policy and Terms of Service ...,www.wzdm.com,2024-07-24 19:37:56+00:00,2024-07-25 01:02:26
1360,True Nature of Tom Brady and Brooks Nader's Relationship Revealed - Us Weekly,"Despite relationship rumors, Us Weekly can confirm that Tom Brady and Brooks Nader are not dating. ... Company Logo. Do Not Sell My Personal Information.",www.usmagazine.com,2024-07-25 01:19:32+00:00,2024-07-25 02:02:22
1361,Kevin Hart: Tom Brady doing Netflix roast was 'necessary' step away from 'climate of sensitivity',"Brendon is a Media Commentary staff writer at Awful Announcing. He has also covered basketball and sports business at Front Office Sports, SB Nation, ...",awfulannouncing.com,2024-07-25 00:20:15+00:00,2024-07-25 02:02:22
1362,"Seven Eight Capital LP Invests $438,000 in Brady Co. (NYSE:BRC) - MarketBeat","Seven Eight Capital LP purchased a new position in shares of Brady Co. (NYSE:BRC - Free Report) in the 1st quarter, according to the company in ...",www.marketbeat.com,2024-07-24 22:17:09+00:00,2024-07-25 02:02:22
1363,Tom Brady's Center Hikes His South Florida Home on the Market for $3.2 Million,"No the managing partner and co-owner of the Tampa-based design/build company Gilk, Jensen acquired the then-newly built residence for just over ...",uk.news.yahoo.com,2024-07-24 20:34:09+00:00,2024-07-25 02:02:22
1364,"Kevin Hart Has Tom Brady Roast Regrets, Vows To Do Things Different In Future Prep","Trending on Deadline- 1 Mindy Cohn Says 'Facts Of Life' Revival Is ""Very Dead"" Due To ""Greedy"" Co-Star: ""We Are Not As United""- 2 ""Hell Of A Speech"": ...",deadline.com,2024-07-25 02:50:46+00:00,2024-07-25 04:02:40
1365,Wayne Brady reveals he's a dad again at 52 to new son Val - Entertainment Weekly,"Brady is ready to be transparent about it all, supported by his close-knit blended family/costars: ex-wife, best friend, and business partner Mandie ...",ew.com,2024-07-25 02:13:41+00:00,2024-07-25 04:02:40
1366,Wayne Brady Reveals He Secretly Welcomed a Baby With Ex-Girlfriend Tina | Us Weekly,"Wayne Brady used his new Freeform reality series, Wayne Brady: The ... Company Logo. Do Not Sell My Personal Information. When you visit our ...",www.usmagazine.com,2024-07-25 03:36:52+00:00,2024-07-25 05:02:26
1367,Seahawks reach 3-year extension with Pro Bowl safety Julian Love - ESPN,"Brady Henderson, ESPNJul 24, 2024, 08:43 PM ET. Close. Brady Henderson is ... The Walt Disney Company Logo. Notice of Right to Opt Out of Sale ...",www.espn.com,2024-07-25 02:15:31+00:00,2024-07-25 05:02:26
1368,Wayne Brady on Why He Waited a Decade to Come Out as Pansexual to Ex-Wife Mandie ...,"Wayne recently sat down with his blended family -- including his ex-wife and business partner, Mandie Taketa, their daughter, Maile, 21, and Mandie's ...",www.cbs8.com,2024-07-25 05:59:56+00:00,2024-07-25 07:02:21
1369,Tom Brady and Model Brooks Nader Have Been Casually 'Hooking Up' This Summer: Source,"Tom Brady and Brooks Nader have reportedly been enjoying each other's company, though a second source says the rumors are not true.",people.com,2024-07-25 05:39:39+00:00,2024-07-25 07:02:21
1370,"IDPH, Brady &amp; Ad Council Unveil Video PSA to Promote &quot;Pause to Heal&quot; Firearm Safety ...","... company, the Mill], to generate maximum emotional impact. The Pause to Heal FRO campaign was spearheaded pro-bono by the industry-leading national ...",www.prnewswire.com,2024-07-25 04:01:53+00:00,2024-07-25 07:02:21
1371,Why Wayne Brady and Ex-Wife Mandie Taketa Brought Their Family to Reality TV - TheWrap,With the former couple also serving as executive producers for the series via their A Wayne & Mandie Creative production company alonside ...,www.thewrap.com,2024-07-25 03:01:31+00:00,2024-07-25 07:02:21
1372,Govia Thameslink Railway: Rail company sets targets to combat climate change - BBC,Jonathan Brady/PA Wire A Thameslink train at platform 11 Jonathan Brady/PA Wire. GTR say it already sources clean or renewable electricity for its ...,www.bbc.com,2024-07-25 11:07:25+00:00,2024-07-25 13:02:22
1373,Kevin Hart Expresses Sympathy for Tom Brady's Roast Regrets | News - BET,"After the retired football legend revealed concerns about jokes targeting his exes during the Netflix ""Roast of Tom Brady ... Company Logo. Your Privacy ...",www.bet.com,2024-07-25 08:04:49+00:00,2024-07-25 13:02:22
1374,GE Aerospace Selected to Support SNC for USAF Survivable Airborne Operations Center Effort,"... Brady Hauboldt, Vice President of Business Development – NC3 programs. “We are proud to have GE Aerospace as a key part of Team SAOC.” With more ...",www.geaerospace.com,2024-07-25 07:40:37+00:00,2024-07-25 13:02:22
1375,TechBridge Distribution MEA announces strategic partnership with Brady Corporation,"Brady Corporation is global leader renowned for its commitment to quality, innovation, customer satisfaction and sustainability initiatives. Companies ...",www.tahawultech.com,2024-07-25 06:42:03+00:00,2024-07-25 13:02:22
1376,Tom Brady and Model Brooks Nader Have Been Casually 'Hooking Up' This Summer: Source,"Tom Brady and Brooks Nader have reportedly been enjoying each other's company. A source tells PEOPLE the Sports Illustrated Swimsuit cover model, ...",ca.news.yahoo.com,2024-07-25 05:00:23+00:00,2024-07-25 13:02:22
1377,Mount Holly Police investigate potential credit card skimmer - Gaston Gazette,Cramerton resident Lizzy Brady said she was getting groceries in Belmont on the morning of July 19 when her card was declined. She was taken aback by ...,www.gastongazette.com,2024-07-25 15:21:38+00:00,2024-07-25 16:02:26
1378,"IDPH, Brady &amp; Ad Council Unveil Video PSA to Promote “Pause to Heal” Firearm Safety ...","Company. About Us- Contact Us- Privacy Policy- Cookie Policy- Terms of Use- Partner Showcase. Follow us. Our reports. Advertising, Shopper ...",www.mediavillage.com,2024-07-25 14:54:57+00:00,2024-07-25 16:02:26
1379,Wayne Brady Announces Birth of Surprise Son With Ex-Girlfriend Tina - The Daily Beast,"It's a completely different form of co-parenting,” Brady said. Brady said that Val has been welcomed into the fold of the “Core Fou,” of himself ...",www.thedailybeast.com,2024-07-25 14:43:58+00:00,2024-07-25 16:02:26
1380,How Brady Corbet Made His 215-Minute 70mm Epic 'The Brutalist' - Variety,"But when he first started planning the movie seven years ago with his co-writer and wife Mona Fastvold, Corbet felt that the format was perfect for a ...",variety.com,2024-07-25 14:39:19+00:00,2024-07-25 16:02:26
1381,"Erik Brady: As Paris beckons, golden memories of Olympic Games gone by - Buffalo News","... Norway's 1994 Lillehammer Olympics are the best Winter Games I got to see,"" writes Erik Brady. At those games ... A Trump-owned company sells $299 ...",buffalonews.com,2024-07-25 14:34:23+00:00,2024-07-25 16:02:26
1382,Dean talks to Wayne Brady about what to expect on the new reality show 'The Family Remix',... Brady: The Family Remix.” It's a deep dive into the ultimate blended ... companies to allow residents of those states to submit a request for ...,wgntv.com,2024-07-25 14:17:09+00:00,2024-07-25 16:02:26
1383,1 in 5 CEOs now use generative AI as part of their jobs | Fortune,"That said, the majority have some degree of confidence in their company's ability to navigate external disruptors. ... More news below. Diane Brady",fortune.com,2024-07-25 13:47:53+00:00,2024-07-25 16:02:26
1384,Wayne Brady reveals he quietly welcomed baby with ex-girlfriend Tina: 'I was floored',“How do I co-parent with this person that I am not with and make this work?” he asked. The actor's ex-wife Mandie Taketa and their 21-year-old ...,pagesix.com,2024-07-25 13:46:55+00:00,2024-07-25 16:02:26
1385,"IDPH, Brady &amp; Ad Council Unveil Video PSA to Promote “Pause to Heal” Firearm Safety ...","Brady is uniting Americans against gun violence. We invite everyone ... company, the Mill] to generate maximum emotional impact. The Pause to ...",bradyunited.org,2024-07-25 13:28:21+00:00,2024-07-25 16:02:26
1386,"Greg Olsen on Going Viral, Tom Brady &amp; More - KRQE",... CO- Las Vegas/Northeast NM- Roswell/Southeast NM- Las Cruces- Roads- Live ... Brady and winning the Sports Emmy for Best Sports Event Analyst two ...,www.krqe.com,2024-07-25 13:22:37+00:00,2024-07-25 16:02:26
1387,Inside Tom Brady's Alleged New Relationship With 'Sports Illustrated' Model - Newsweek,"He has been focusing on various business ventures and spending quality time with his children. ""I want to try to guide my kids into a life of purpose ...",www.newsweek.com,2024-07-25 09:44:04+00:00,2024-07-25 16:02:26
1388,Köerber Beer Company opens tap room in Barboursville - herald-dispatch.com,"Köerber Beer Company's tap room is located at 650 Brady St. in Barboursville, near 1861 Public House. Paul Sebert | For The Herald-Dispatch.",www.herald-dispatch.com,2024-07-25 16:06:24+00:00,2024-07-25 17:02:24
1389,Will Bowman hire impact Draisaitl and McDavid's future in Edmonton?| OverDrive - YouTube,"... Brady as the best quarterback, how will Tom Brady's legacy look in the future and more. They are also joined by the host of Oil Stream on Edmonton ...",www.youtube.com,2024-07-25 13:42:24+00:00,2024-07-25 17:02:24
1390,"Greg Olsen on Going Viral, Tom Brady &amp; More - WATE",... Co. earned 'Golf Capital of TN' moniker. Top Stories. It's one of N ... Other topics discussed with Olsen include whether Comedy Central missed a golden ...,www.wate.com,2024-07-25 13:31:28+00:00,2024-07-25 17:02:24
1391,"Greg Olsen on Going Viral, Tom Brady &amp; More - WCIA.com",... Co. committee holding public meeting on severe … 1 week ago. Video ... Other topics discussed with Olsen include whether Comedy Central missed a golden ...,www.wcia.com,2024-07-25 13:27:47+00:00,2024-07-25 17:02:24
1392,"Greg Olsen on Going Viral, Tom Brady &amp; More - WSPA",... Co. business. 1 hour ago. Video. Panthers training camp no longer taking ... Brady and winning the Sports Emmy for Best Sports Event Analyst two ...,www.wspa.com,2024-07-25 13:24:28+00:00,2024-07-25 17:02:24
1393,&quot;I wasn't being authentically me&quot;: Wayne Brady paints a portrait of pansexuality through reality TV,"Brady and his ex-wife Mandie Taketa, who remains his best friend despite their marriage ending in 2008, lovingly co-parent their 21-year-old ...",www.salon.com,2024-07-25 19:00:29+00:00,2024-07-25 20:02:27
1394,Hormel Foods Named to Forbes List of America's Best Employers for Women 2024,"... Brady, who leads the company's largest business segment as executive vice president and group vice president of Retail. “We are proud to be ...",www.hormelfoods.com,2024-07-25 18:20:01+00:00,2024-07-25 20:02:27
