,Heading,Subheading,Publisher,Published,Found
438,Sunak gives peerages to Theresa May and Graham Brady | The Independent,Business- Science- Space- News Videos. Sports Sports- Sports- US Sports ... More about. PA ReadyGraham BradyMargaret BeckettHarriet HarmanBen ...,www.independent.co.uk,2024-07-04 21:06:52+00:00,2024-07-04 23:02:21
439,Sunak gives peerages to Theresa May and Graham Brady | Great Yarmouth Mercury,Sunak gives peerages to Theresa May and Graham Brady. 12 mins ago. By ... Company 'fell short of its own standards' when demolition worker died ...,www.greatyarmouthmercury.co.uk,2024-07-04 22:43:22+00:00,2024-07-05 00:02:27
440,Mariners' Legend Felix Hernandez Got Some Company in Baseball History on Wednesday,"... Brady on ""X"" @wdevradiobrady. RELATED MARINERS CONTENT. EVANS NOT JOINING BULLPEN: After a trial period at Double-A Arkansas, top pitching prospect ...",www.si.com,2024-07-04 22:43:19+00:00,2024-07-05 00:02:27
441,Sunak gives peerages to Theresa May and Graham Brady | North Wales Pioneer,Sunak gives peerages to Theresa May and Graham Brady. 12 mins ago. By PA ... Llandudno carpet company awarded Royal Warrant as expansion continues ...,www.northwalespioneer.co.uk,2024-07-04 22:35:27+00:00,2024-07-05 00:02:27
442,Sunak gives peerages to Theresa May and Graham Brady - Craven Herald,News UK News Skipton & District News Farming Business- Craven Herald ... Sunak gives peerages to Theresa May and Graham Brady. 12 mins ago. By ...,www.cravenherald.co.uk,2024-07-04 22:27:37+00:00,2024-07-05 00:02:27
443,Sunak gives peerages to Theresa May and Graham Brady - Ledbury Reporter,Sunak gives peerages to Theresa May and Graham Brady. 12 mins ago ... Housing company announced new member of leadership team- Walkers Crisps ...,www.ledburyreporter.co.uk,2024-07-04 22:25:27+00:00,2024-07-05 00:02:27
444,Sunak gives peerages to Theresa May and Graham Brady - Dunfermline Press,Sunak gives peerages to Theresa May and Graham Brady. 12 mins ago. By PA ... Major change to Dunfermline restaurant as company makes announcement ...,www.dunfermlinepress.com,2024-07-04 22:25:16+00:00,2024-07-05 00:02:27
445,Tom Brady picks up white party outfit before Michael Rubin's star-studded Hamptons bash,Tom Brady responds to Al Horford wearing a Drunk Brady shirt in Celtics parade ... Company Logo. This page is not available in your area. Strictly ...,nypost.com,2024-07-04 22:20:40+00:00,2024-07-05 00:02:27
446,Sunak gives peerages to Theresa May and Graham Brady | Western Telegraph,News UK News County News Local News Business Health news Editor's Pick Farming News Crime ... Sunak gives peerages to Theresa May and Graham Brady.,www.westerntelegraph.co.uk,2024-07-04 22:19:22+00:00,2024-07-05 00:02:27
447,Sunak gives peerages to Theresa May and Graham Brady - Cotswold Journal,Business- E-editions- What's On- Announcements- Puzzles- Reader Rewards- News UK News Cotswolds Community News- Cotswold Journal. Sunak gives ...,www.cotswoldjournal.co.uk,2024-07-04 22:18:41+00:00,2024-07-05 00:02:27
448,Sunak gives peerages to Theresa May and Graham Brady - Whitchurch Herald,Sunak gives peerages to Theresa May and Graham Brady. 12 mins ago ... Ellesmere company's bus suffers damage after large object thrown from bridge ...,www.whitchurchherald.co.uk,2024-07-04 22:17:16+00:00,2024-07-05 00:02:27
449,Sunak gives peerages to Theresa May and Graham Brady | Runcorn and Widnes World,Sunak gives peerages to Theresa May and Graham Brady. 12 mins ago ... Successful gymnastics company opens branch in Widnes after six-figure loan ...,www.runcornandwidnesworld.co.uk,2024-07-04 22:17:14+00:00,2024-07-05 00:02:27
450,Sunak gives peerages to Theresa May and Graham Brady | News Shopper,"Among Sir Keir Starmer's nominations for peerages are Dame Margaret Beckett, Harriet Harman, Margaret Hodge and Kevan Jones.",www.newsshopper.co.uk,2024-07-04 22:17:14+00:00,2024-07-05 00:02:27
451,Sunak gives peerages to Theresa May and Graham Brady | Salisbury Journal,Business- Education- Politics- Crime- Sport- Headlines- Salisbury FC ... Sunak gives peerages to Theresa May and Graham Brady. 4th July. By PA ...,www.salisburyjournal.co.uk,2024-07-04 21:51:18+00:00,2024-07-05 00:02:27
452,Sunak gives peerages to Theresa May and Graham Brady | Gazette &amp; Herald,"Sunak gives peerages to Theresa May and Graham Brady. 1 min ago. By ... York director and his company guilty of £100,000 VAT crime- 'Thanks to ...",www.gazetteherald.co.uk,2024-07-04 21:51:06+00:00,2024-07-05 00:02:27
453,Sunak gives peerages to Theresa May and Graham Brady | Evening Standard,NewsSportBusinessLifestyleCultureGoing OutHomes & PropertyComment- News | Politics. Sunak gives peerages to Theresa May and Graham Brady. Among Sir ...,www.standard.co.uk,2024-07-04 23:45:39+00:00,2024-07-05 01:02:28
454,Tom Brady throws TD pass to Micah Parsons in beach football game - AS USA,"Dallas Cowboys linebacker Micah Parsons is a versatile player, his latest position being Tom Brady's receiver in a game of football at the beach ...",en.as.com,2024-07-04 23:39:53+00:00,2024-07-05 01:02:28
455,Tom Brady Plays Football With Travis Scott and More on 4th of July | Us Weekly,"Tom Brady played a pickup football game with Quavo, Travis Scott and ... Company Logo. Do Not Sell My Personal Information. When you visit our ...",www.usmagazine.com,2024-07-04 22:54:27+00:00,2024-07-05 01:02:28
456,Milwaukee car windows smashed near Brady Street: 'It's very sad',"... Brady, and in the surrounding area were also hit. ... The Republican National Convention hired a Waukesha County company to monitor threats inside and ...",www.fox6now.com,2024-07-05 01:26:10+00:00,2024-07-05 03:02:22
457,Sunak gives peerages to Theresa May and Graham Brady | Denbighshire Free Press,Sunak gives peerages to Theresa May and Graham Brady. 4th July. By ... Global success for Corwen manikin firm as company eyes £4million+ turnover ...,www.denbighshirefreepress.co.uk,2024-07-04 22:31:21+00:00,2024-07-05 03:02:22
458,Greens' co-leader Carla Denyer unseats Labour in Bristol Central | General election 2024,... co-leader Carla Denyer after casting her vote in Bristol. Photograph: Jonathan Brady/PA. View image in fullscreen. The Green party's co-leader Carla ...,www.theguardian.com,2024-07-05 05:07:01+00:00,2024-07-05 06:02:23
459,Tom Brady intercepted by Damar Hamlin in pre-white party beach game loss,... Company Logo. This page is not available in your area. Strictly Necessary Cookies. These cookies are necessary for the website to function and ...,nypost.com,2024-07-05 05:04:56+00:00,2024-07-05 06:02:23
460,Tom Brady Plays Beach Pickup Football with Damar Hamlin and Travis Scott at Fourth of ...,"Georgia has since found love again with former co-star Charlie De Melo, who played Toyah's solicitor husband Imran Habeeb. Imran was written out ...",uk.news.yahoo.com,2024-07-05 04:37:47+00:00,2024-07-05 06:02:23
461,"Tom Brady, Olivia Dunne, Jake Paul and Rob Gronkowski lead sports stars at Michael ... - Daily Mail","In the years since, Rubin has successfully secured a variety of deals with firm like Nike, the NFL, and MLB, granting his company the right to ...",www.dailymail.co.uk,2024-07-05 04:16:41+00:00,2024-07-05 06:02:23
462,Dissolution Peerages 2024 - GOV.UK,"The Rt Hon Sir Graham Brady PC - Lately Member of Parliament for Altrincham and Sale West, and Chairman of the 1922 Committee. The Rt Hon Chris ...",www.gov.uk,2024-07-04 23:13:17+00:00,2024-07-05 06:02:23
463,Sunak gives peerages to Theresa May and Graham Brady - Halesowen News,News UK News Local Business Daily Crime- Halesowen News. Sunak gives ... Sunak gives peerages to Theresa May and Graham Brady. 4th July. By PA ...,www.halesowennews.co.uk,2024-07-04 22:44:58+00:00,2024-07-05 06:02:23
464,Sunak gives peerages to Theresa May and Graham Brady | Newham Recorder,Business- Weather- Health- Housing- Education- Obituaries- UK News- Sport- UK ... Sunak gives peerages to Theresa May and Graham Brady. 4th July.,www.newhamrecorder.co.uk,2024-07-04 22:29:38+00:00,2024-07-05 06:02:23
465,Sunak gives peerages to Theresa May and Graham Brady | Ludlow Advertiser,Sunak gives peerages to Theresa May and Graham Brady. 4th July. By PA News ... Shropshire's company of the year announced at glittering ceremony ...,www.ludlowadvertiser.co.uk,2024-07-04 22:23:54+00:00,2024-07-05 06:02:23
466,Eurasia Group's Ian Bremmer says Labour's landslide election win will boost U.K. business,"Eurasia Group's Ian Bremmer says Labour's landslide election win will boost U.K. business. BYDiane Brady and Nicholas Gordon. July 5, 2024 at 2 ...",fortune.com,2024-07-05 10:12:17+00:00,2024-07-05 11:02:20
467,Tom Brady joins Damar Hamlin and Travis Scott for beach pickup football on Fourth of July,Tom Brady joins Damar Hamlin and Travis Scott for beach ... lil baby s red cybertruck co signed by elon musk draws mixed reactions from fans.,tribune.com.pk,2024-07-05 09:11:03+00:00,2024-07-05 11:02:20
468,Annie Conaty (née Brady) | NorthernSound,"Annie Conaty (née Brady) Loreto Wood, Cavan Town, Cavan Thursday ... Milltown Business Park Monaghan H18 YF22. Contact Us- Terms- Advertise ...",www.northernsound.ie,2024-07-05 10:16:36+00:00,2024-07-05 13:02:20
469,Roundabout Farm with Airbnbs in Thurning on sale for £1.85m | Eastern Daily Press,... Brady)&lt;/. Roundabout Farm in Thurning (Image: Minors & Brady). A barn conversion with an award-winning bed and breakfast business is on the market ...,www.edp24.co.uk,2024-07-05 10:05:15+00:00,2024-07-05 13:02:20
470,As you were in two Co Armagh constituencies but bad night for DUP overall,"It's a case of as you were in Newry & Armagh and Upper Bann constituencies. Daire Hughes, who replaced Mickey Brady on the ballot paper, ...",armaghi.com,2024-07-05 08:33:38+00:00,2024-07-05 13:02:20
471,Spill Containment Decks Market size is set to grow by USD 63.9 million from 2024-2028 ...,"Ltd., Brady Corp., Complete Environmental Products Inc., DENIOS INC., ENPAC, EnSafeCo LLC, EnviroGuard, Ergen Plastic Industries, Justrite Mfg. Co.",themalaysianreserve.com,2024-07-04 23:13:21+00:00,2024-07-05 13:02:20
472,TAC InfoSec adds over 500 new clients from 50 countries in Q1 - PTI,"... Brady Corporation, FAO of United Nations, FUJIFILM, CASIO, Nissan Motors, Juspay, One Card, Zepto, and MPL, among others, the company said in a ...",www.ptinews.com,2024-07-05 10:22:56+00:00,2024-07-05 14:02:24
473,Former Employee Accused of Assaulting Co-Worker Outside Punxsutawney Spirit Office Building,"Court records indicate the Punxsutawney Borough Police Department filed criminal charges against 38-year-old Nathan Scott Brady, of Punxsutawney, in ...",www.explorejeffersonpa.com,2024-07-05 14:21:49+00:00,2024-07-05 15:02:24
474,Theresa May and 'bionic' MP Craig Mackinley awarded peerages - BBC News,"... Brady. Conservative Craig Mackinley, who said he wanted to be known as ... Amazon at 30: What next for 'The Everything Company'?",www.bbc.co.uk,2024-07-05 14:16:59+00:00,2024-07-05 15:02:24
475,Stars turn out for Michael Rubin's annual Hamptons July 4th party,... Company. About Us- Staff- FAQ- Contact Us- Advertise- Celebrate- Subscribe ... Brady and C.J. STROUD headed up a beach football game prior to the ...,www.sportsbusinessjournal.com,2024-07-05 13:25:24+00:00,2024-07-05 15:02:24
476,"CONSERVATIVES, YOUR PARTY NEEDS YOU: Don't let Sunak and the Brady bunch stitch ...",It was here that he became fascinated by how personal investors and small companies could turn negligible resources into enormous fortunes.,conservativepost.co.uk,2024-07-05 13:11:22+00:00,2024-07-05 15:02:24
477,Stars turn out for Michael Rubin's annual Hamptons July 4th party,"Names like Tom Brady, Kim Kardashian and Travis Scott turned out to Fanatics CEO Michael Rubin's annual white party in the Hamptons on Thursday.",www.sportsbusinessjournal.com,2024-07-05 13:10:56+00:00,2024-07-05 15:02:24
478,Tom Brady and Elton John Were Surprise Guests On The Cape Last Weekend - FUN 107,"George Stephanopoulos' roots lie in Fall River. He is a television host, political commentator, and former Democratic advisor, and currently a co- ...",fun107.com,2024-07-05 12:35:19+00:00,2024-07-05 15:02:24
479,"Theresa May, Graham Brady and Chris Grayling among new nominees to the House of Lords","The opinions in Politics.co.uk's Comment section are those of the author. Former prime minister Theresa May, former cabinet minister Chris Grayling ...",www.politics.co.uk,2024-07-05 02:18:23+00:00,2024-07-05 15:02:24
480,"Photos: Tom Brady, Kevin Durant, Livvy Dunne, More Attend Michael Rubin's White Party","... co/Hhg9quyhTY""&gt;https://t.co/Hhg9quyhTY&lt;/a&gt;. NFL @NFL .&lt;a href=""https://twitter.com/TomBrady?ref_src=twsrc%5Etfw""&gt;@TomBrady&lt;/a&gt;, &lt;a href=""https ...",bleacherreport.com,2024-07-05 15:34:30+00:00,2024-07-05 16:02:24
481,Developer Bartra asked to cut back scale of Brady's Pub development - The Irish Times,"The co-living scheme did not proceed and in May, Bartra Property (Castleknock) Ltd lodged plans for the apartment scheme for the site. READ MORE. Matt ...",www.irishtimes.com,2024-07-05 15:26:50+00:00,2024-07-05 16:02:24
482,Moran within striking distance as McBride makes the cut in Andalucia - Irish Golfer Magazine,Moran tees off his final day on Aguilon Golf at 9.17AM with France's Nicholas Muller and Adam Brady for company as the top 49 battle it out on Friday.,irishgolfer.ie,2024-07-05 07:43:28+00:00,2024-07-05 16:02:24
483,Tom Brady can't cut it vs. CJ Stroud in beach football game at Michael Rubin's July 4th party,"Tom Brady has Seven Super Bowl wins, but when it comes to beach football ... As Kylian Mbappe and Co have also been profligate in front of goal.",www.dailymail.co.uk,2024-07-05 15:33:35+00:00,2024-07-05 17:02:18
484,Tom Brady Once Threw a Bullet Pass on a Yacht That Busted a Drone - Q97.9,LOOK: Movies and TV shows casting in Maine- 'Family Business'- 'Cairo'- 'Free Martin'- 'School Spouses'- 'Asherah: The TV Series'- 'Throwing Stones'.,wjbq.com,2024-07-05 15:10:35+00:00,2024-07-05 17:02:18
485,Patrick Mahomes names one aspect where he won't follow Tom Brady in retirement,"Kansas City Chiefs quarterback Patrick Mahomes is on his way to becoming one of the greatest quarterbacks of all time, threatening Tom Brady for ...",www.sportskeeda.com,2024-07-05 10:19:37+00:00,2024-07-05 17:02:18
486,The $1 Million Bet | LBBOnline,"... Brady was the experiment host. Wayne spoke with each participant one ... AKQA is a design and innovation company that employs over 6,500 professionals ...",www.lbbonline.com,2024-07-05 14:11:14+00:00,2024-07-05 18:02:22
487,Waterford's Harvest Festival returns for 15th year,"His company, MPI Artist, represents many of Ireland's top entertainers including The High Kings, Paul Brady, Mary Black, Jack Lukeman, Sharon ...",waterfordcouncil.ie,2024-07-05 13:46:48+00:00,2024-07-05 18:02:22
488,Here's Why Investors Should Bet on Emerson (EMR) Stock Now | Nasdaq,The company's measures to reward its shareholders are encouraging. ... Brady Corporation BRC presently carries a Zacks Rank of 2 and has a ...,www.nasdaq.com,2024-07-05 17:21:16+00:00,2024-07-05 19:02:25
489,Brady reveals there was 'a lot of interest' in McGeehan after Cobblers win race to sign midfielder,Jon Brady believes Cameron McGeehan's 'energy' and 'power' will make him ... Advertise My Business- Ad Manager- Place your Ad- Submit Your Story ...,www.northamptonchron.co.uk,2024-07-05 15:24:02+00:00,2024-07-05 19:02:25
490,"Tom Brady Plays Football With Travis Scott, Quavo and More at Michael Rubin's White Party",Tom Brady had some star-studded receivers for his football game on ... Company Logo. Your Privacy. Your Privacy. This page provides an overview ...,www.etonline.com,2024-07-05 18:39:05+00:00,2024-07-05 20:02:25
491,Travis Scott Catches Pass From Tom Brady During Beach Football Game - Billboard,Travis Scott Catches Pass From Tom Brady During Beach Football Game Before Michael Rubin's White Party ... Company Logo. Privacy Preference Center. When ...,www.billboard.com,2024-07-05 18:18:35+00:00,2024-07-05 20:02:25
492,"In Brief: 'Outer Range' canceled by Prime Video, and more - 1310 KFKA","The show, a joint venture between British public service broadcaster Channel 4 and a funeral company ... The Hull Show – July 3 , Hour 2 – Brady's ...",1310kfka.com,2024-07-05 16:40:10+00:00,2024-07-05 20:02:25
493,Car windows smashed near Brady Street | State - apg-wi.com,"Car windows smashed near Brady Street. Fox - Milwaukee; Jul 4, 2024; 5 ... Bush Brothers & Company. Bush Brothers & Company. Help Wanted. Transport ...",www.apg-wi.com,2024-07-05 11:21:14+00:00,2024-07-05 20:02:25
494,ProLux Announces Sponsorship of Rising Boxing Star Brady Ochoa - PRWeb,"ProLux sponsors rising boxer Brady Ochoa, supporting his training and competitions. ""His dedication aligns with our values,"" said co-founder ...",www.prweb.com,2024-07-05 20:04:52+00:00,2024-07-05 21:02:18
495,Michael Rubin Hosts Star-Studded July 4th White Party in The Hamptons - TMZ,"Rubin -- the owner of the sports apparel company ""Fanatics"" -- hosted a jaw-dropping celebrity guest list, which included Kim Kardashian, Tom Brady ...",www.tmz.com,2024-07-05 19:55:15+00:00,2024-07-05 21:02:18
496,"The White Party That Brought Kim Kardashian, Drake and Tom Brady to the Hamptons","It's hard to name just one noteworthy guest who attended the Fourth of July White Party hosted by the business mogul Michael Rubin and his fiancé, ...",www.nytimes.com,2024-07-05 19:50:07+00:00,2024-07-05 21:02:18
497,Del Toro Adds New Shoe Categories for Summer 2024 - Footwear News,According to Del Toro owner and chief executive officer Brady Perrigo ... Company Logo. Privacy Preference Center. When you visit any website ...,footwearnews.com,2024-07-05 19:27:49+00:00,2024-07-05 21:02:18
498,Bills' Damar Hamlin picks off Tom Brady in friendly beach game ahead of star-studded ...,"Tom Brady is heading to the broadcast booth next season, but the ... A Division of The Findlay Publishing Company- WFIN || WKXA || 106.3 The ...",wfin.com,2024-07-05 20:38:41+00:00,2024-07-05 22:02:17
499,Tom Brady is branded a LIAR by a former New England Patriots teammate... and here's why,"While expressing his admiration for Patrick Mahomes ' style of play during an appearance on the Pivot podcast, Brady ... co were confirmed to be heading ...",www.dailymail.co.uk,2024-07-05 20:32:13+00:00,2024-07-05 22:02:17
500,Brown Deer fireworks finale - FOX6 News Milwaukee,"... Brady Street. 2 injured, 1 arrested after crash. video. 2 injured, 1 ... company providing extra security. REPUBLICAN NATIONAL CONVENTION 2024.",www.fox6now.com,2024-07-05 17:00:35+00:00,2024-07-05 22:02:17
501,Tom Brady suffers rare loss in star-studded friendly beach football game - Yahoo News UK,"Rubin later sold that company, later known as GSI Commerce, to eBay in 2011 for $2.4 billion. As part of that deal, he kept Fanatics — the company's ...",uk.news.yahoo.com,2024-07-05 21:14:49+00:00,2024-07-05 23:02:21
502,"Millionaire Michael Rubin Highlights Star-Studded White Party with Tom Brady, Rob ...",Yet CJ Stroud and Co. managed to get the upper hand over Brady and his team as they won over the GOAT.,www.essentiallysports.com,2024-07-05 20:50:34+00:00,2024-07-05 23:02:21
503,"Tom Brady, Livvy Dunne, the Kardashians, more party it up at July 4 Hamptons bash","The all-white attire party featured the company of Tom Brady and his NFL pals Rob Gronkowski, Joe Burrow, C.J. Stroud and Odell Beckham Jr ...",greaterlongisland.com,2024-07-05 22:27:10+00:00,2024-07-06 00:02:22
504,Look: Bengals QB Joe Burrow Hangs With Tom Brady at Michael Rubin's White Party,He's also the co-owner/creator of Cincinnati Bengals Talk on YouTube. He earned a journalism degree from the University of Cincinnati and has ...,www.si.com,2024-07-05 22:10:14+00:00,2024-07-06 00:02:22
505,J.Lo Sending Mixed Signals? (NEW: 6PM) | TMZ Minute - FOX News Radio,"Varney and Company- Cavuto- Fox Audio Network Podcasts- Fox News ... Tom Brady hangs with Michael Rubin in the Hamptons. Plus, Danny Trejo ...",radio.foxnews.com,2024-07-05 18:09:59+00:00,2024-07-06 00:02:22
506,Tom Brady among notable names listed in sportsbook's odds to purchase Celtics,"Tom Brady has the 11th shortest odds to purchase the Boston Celtics, according to BetOnline ... Ellison is the co-founder of Oracle, a software giant, ...",www.boston.com,2024-07-06 01:31:30+00:00,2024-07-06 03:02:25
507,Tom Brady 'a liar' for Patrick Mahomes comparison: Christian Fauria - New York Post,One of Tom Brady's former teammates is skeptical that the old quarterback could learn new tricks ... Company Logo. This page is not available in your ...,nypost.com,2024-07-06 01:03:07+00:00,2024-07-06 03:02:25
508,Moment Tom Brady is captured in 'embarrassing' incident before Michael Rubin's white party ...,NFL legend Tom Brady's golden arm looked a little rusty during Michael Rubin's July 4 bash.The seven-time Super Bowl winner took part in a beach ...,www.the-sun.com,2024-07-05 21:01:28+00:00,2024-07-06 03:02:25
509,'He's not wired like Patrick Mahomes' claims Tom Brady's ex-teammate as he labels NFL ...,NEW England Patriots legend Tom Brady recently revealed his regrets in taking football too seriously during his career.But one of the NFL icon's ...,www.the-sun.com,2024-07-05 23:31:38+00:00,2024-07-06 04:02:24
510,Brady Co. (NYSE:BRC) Shares Acquired by Allspring Global Investments Holdings LLC,"Allspring Global Investments Holdings LLC lifted its position in shares of Brady Co. (NYSE:BRC - Free Report) by 17.5% during the first quarter, ...",www.marketbeat.com,2024-07-06 09:01:14+00:00,2024-07-06 10:02:20
511,"Diversified Trust Co Sells 7,674 Shares of Brady Co. (NYSE:BRC) - Defense World","Diversified Trust Co's holdings in Brady were worth $298,000 at the end of the most recent quarter. Get Brady alerts: A number of other hedge funds ...",www.defenseworld.net,2024-07-06 08:53:28+00:00,2024-07-06 10:02:20
512,Former Bills QB Talks Josh Allen vs. Patrick Mahomes Rivalry; Manning vs. Brady?,"Unfortunately for Allen and co., Fitzpatrick is right on the money. Though the Bills have had some recent regular-season success against K.C. ...",athlonsports.com,2024-07-06 07:58:32+00:00,2024-07-06 10:02:20
513,Travis Scott Catches Pass From Tom Brady During Beach Football Game Before Michael ... - Yahoo,'Murder Company': Kelsey Grammer's grandfather informed his character in World War II film. 3h ago. Harper's Bazaar. Winnie Harlow Shuts Down The ...,www.yahoo.com,2024-07-06 05:39:33+00:00,2024-07-06 10:02:20
514,Raw milk to be legalized in Delaware - American Farm Publications,"... co-owner of G&S Dairy; Nikko Brady, director of agriculture and environmental affairs for Gov. John Carney; and Christy Vanderwende Wright, policy ...",americanfarm.com,2024-07-06 05:34:34+00:00,2024-07-06 10:02:20
515,Tom Brady among notable names listed in sportsbook's odds to purchase Celtics - MSN,"Brady, Jeff Bezos, and Larry Ellison are ... Ellison is the co-founder of Oracle, a software giant, and served as the company's CEO until 2014.",www.msn.com,2024-07-06 03:02:37+00:00,2024-07-06 10:02:20
516,Massachusetts-based software company UKG lays off 14% of its workforce ... - Nashoba Valley Voice,"Massachusetts-based software company UKG lays off 14% of its workforce, 2,200 employees ... Brady says roast affected his kids, 'wouldn't do it again ...",www.nashobavalleyvoice.com,2024-07-06 01:59:45+00:00,2024-07-06 10:02:20
517,Former Patriots TE calls Tom Brady a 'liar' for take on Patrick Mahomes | Sporting News,"He's not wired like Mahomes.'” The former tight end continued to explain his take despite his co-host, Andy Gresh, fighting back. “I've seen him have ...",www.sportingnews.com,2024-07-06 14:02:11+00:00,2024-07-06 16:02:26
518,"LeBron James, Tom Brady's odds to be Celtics next owner, revealed - ClutchPoints","Larry Ellison (2/1), the co-founder of Oracle and current betting favorite… Abigail Johnson (4/1), Boston native and president/CEO of Fidelity ...",clutchpoints.com,2024-07-06 13:48:35+00:00,2024-07-06 16:02:26
519,Tom Brady faces Texans QB C.J. Stroud in July 4th beach football game,C.J. Stroud and Tom Brady spent July 4th slinging the pigskin around in the Hamptons ... Company Logo. Privacy Preference Center. When you visit our ...,texanswire.usatoday.com,2024-07-06 13:05:48+00:00,2024-07-06 16:02:26
520,Alert: Reformist candidate Masoud Pezeshkian leads in initial results from Iran's presidential ...,Brady Cheneski delivers the Valedictory Address during the New ... Our CompanyCareersOur Use of AIEthics PolicyAnnual DEI ReportHearst Connecticut Jobs.,www.newstimes.com,2024-07-06 11:53:34+00:00,2024-07-06 16:02:26
521,Christian singer Stevenson to perform in FD - Messenger News,"... Brady O'Brien, of Brady O'Brien Live/Trinity United Methodist Church in Fort Dodge. Grammy-nominated songwriter and national recording artist Ryan ...",www.messengernews.net,2024-07-06 11:04:48+00:00,2024-07-06 16:02:26
522,WATCH: Tom Brady joins in celebrity holiday pickup football game - Patriots Wire,"It was a fun event that gave Brady a chance to let loose with some of the best in the sports and entertainment business. Travis Scott, Quavo, Tom ...",patriotswire.usatoday.com,2024-07-06 09:52:11+00:00,2024-07-06 16:02:26
523,Is Tom Brady going to another Super Bowl or Odell Beckham Jr. finding a team a more likely ...,"The NFC South looks like the least competitive division in the NFL, but quarterback Tom Brady ... Mace, who also serves as the Riders defensive co- ...",ca.sports.yahoo.com,2024-07-05 23:16:23+00:00,2024-07-06 16:02:26
524,Manitoba climbs to top of dodgeball mountain - Winnipeg Free Press,"On the women's side, Rogue, a Manitoban team co-captained by Catie Brady, took home silver for the third year in a row. Brady was named Most Valuable ...",www.winnipegfreepress.com,2024-07-05 23:15:39+00:00,2024-07-06 16:02:26
