,Heading,Subheading,Publisher,Published,Found
0,"Tom Brady's kids spend Father's Day with Gisele Bündchen's boyfriend, Joaquim Valente","... Brady's kids 6. Meanwhile, Brady spent the day at work. tombrady/Instagram ... Company Logo. This page is not available in your area. NYP - Strictly ...",pagesix.com,2024-06-18 13:17:12,2024-06-18 15:11:18
1,3 thoughts on commitment of Brady Hart to Michigan football - GBM Wolverine,BOOOOMMMMM!!!!!! Michigan has landed a commitment from Top 100 2026 QB Brady Hart. A massive land for @CoachKCampbell and company. Full story (FREE) # ...,gbmwolverine.com,2024-06-18 13:10:43,2024-06-18 15:11:18
2,Michigan gets commit from Brady Hart for 2026 recruiting class - ESPN,"Quarterback Brady Hart, who is ranked 120th overall in the 2026 ESPN ... The Walt Disney Company Logo. Notice of Right to Opt Out of Sale/Sharing.",www.espn.com,2024-06-18 13:02:40,2024-06-18 15:11:18
3,Michigan football trending for elite 2026 quarterback,"On the heels of his unofficial visit to Ann Arbor, 2026 Cocoa (Fla.) four-star QB Brady Hart is getting predicted to land at Michigan.",wolverineswire.usatoday.com,2024-06-18 12:28:38,2024-06-18 15:11:18
4,Top 150 QB Brady Hart on his commitment to Michigan: 'We're going to build the best class ...,CBS Sports is a registered trademark of CBS Broadcasting Inc. Company Logo. Your Privacy. Your Privacy. This page provides an overview of our use of ...,247sports.com,2024-06-18 12:19:04,2024-06-18 15:11:18
5,"Tom Brady, Isaiah Thomas, Barack Obama and others react to Celtics' 18th championship","Congrats @celtics, the 2023-2024 NBA Champions and now the all-time NBA leader with 18 titles. A true legacy of excellence. https://t.co/WLts3VNeAT. — ...",www.boston.com,2024-06-18 12:01:32,2024-06-18 15:11:18
6,Sioux Falls expert panel to focus on sustainable opportunities for cattle producers,"The Making Sense of Sustainability panel discussion will feature Cattle Rancher Brady Wulf, Clear Springs Cattle Company, Starbuck, Minnesota; Don ...",www.farmforum.net,2024-06-18 11:56:55,2024-06-18 15:11:18
7,"LOOK: Tom Brady makes pro football broadcasting debut for UFL Championship Game, gets ...",Brady broadcasted the first professional football game of his career. ... Company Logo. Your Privacy. Your Privacy. This page provides an overview ...,www.cbssports.com,2024-06-18 11:31:41,2024-06-18 15:11:18
8,NFL Legend Tom Brady Celebrates Celtics' NBA Title: 'Another One in Boston',"Discovery Company. All Rights Reserved. WM Logo. For privacy options, please see our privacy policy: https://www.warnermediaprivacy.com ...",bleacherreport.com,2024-06-18 11:25:16,2024-06-18 15:11:18
9,Here's the one joke Bill Burr says Patriots cut from Tom Brady ceremony - MassLive.com,"... Brady with various celebrities. BetMGM BET UP TO $1,500! BONUS BET REFUND AFTER A LOSS. CLAIM OFFER Promo code: MASS150. STATES: AZ, CO, IA, IL, IN ...",www.masslive.com,2024-06-18 11:25:04,2024-06-18 15:11:18
10,Nicola Coughlan becomes latest celebrity to model for Skims - Breaking News,"In her modelling debut for the US clothing company the Irish actress can be ... company Frame, and Tom Brady's apparel brand Brady. Advertisement.",www.breakingnews.ie,2024-06-18 10:32:49,2024-06-18 15:11:18
11,Spokane UFC fighter Brady Hiestand wins comeback fight Saturday night - KREM 2,Brady Hiestand won his fight after being out for over ... Notifications can be turned off anytime in the browser settings. No Thanks Allow. Company Logo ...,www.krem.com,2024-06-18 10:07:08,2024-06-18 15:11:18
12,Cruise ship with Broadway stars to steam off to Mexico in spring 2025 - WPLG,... Brady appears at the American Music Awardsin Los Angeles on Nov. 20 ... company. 9+. search by queryly. Advanced Search close.,www.local10.com,2024-06-18 09:39:03,2024-06-18 15:11:18
13,"Zacks Industry Outlook Highlights Allegion, MSA Safety, Brady and Napco Security Technologies","The increase in demand for cybersecurity products is supporting several industry participants as well. Companies like Allegion plc, MSA Safety Inc., ...",finance.yahoo.com,2024-06-18 09:34:36,2024-06-18 15:11:18
14,Cruise ship with Broadway stars to steam off to Mexico in spring 2025 - CTPost,NEW YORK (AP) — A cruise ship with some of Broadway's biggest names — including Tony Award-winner Laura Benanti and Emmy-winner Wayne Brady — will ...,www.ctpost.com,2024-06-18 09:23:39,2024-06-18 15:11:18
15,Gisele Bündchen Is Reportedly &quot;Blossoming&quot; After Her Divorce with Tom Brady,"Just one month earlier, Bundchen became visibly emotional and started tearing up when asked how she was dealing with the divorce as well as co- ...",www.instyle.com,2024-06-18 09:09:04,2024-06-18 15:11:18
16,Global software vendor foresees circular future - Recycling Today,"London-based Brady plc had itself acquired long-time American metals recycling software firm Systems Alternatives Inc. (SAI) in 2012, eventually ...",www.recyclingtoday.com,2024-06-18 08:49:19,2024-06-18 15:11:18
17,Cam Newton Says Tom Brady Managed to 'Skip the Line' for New TV Gig | Us Weekly,"Company Logo. Do Not Sell My Personal Information. When you visit our website, we store cookies on your browser to collect information. The ...",www.usmagazine.com,2024-06-18 08:09:13,2024-06-18 15:11:18
18,"Insiders Claimed Tom Brady's Roast Hurt Gisele Bündchen's New Relationship, But Not So Fast","As it stands, the former spouses have moved on with their lives, though they continue to co-parent their two kids. When it comes to their romantic ...",www.cinemablend.com,2024-06-18 03:56:02,2024-06-18 15:11:18
19,ESPN Enters the NFT Space with Tom Brady's Startup - Yahoo News,Autograph is a sports and entertainment NFT startup that the quarterback co-founded in 2021. The sports media giant's first NFT drop will be based on ...,au.news.yahoo.com,2024-06-18 03:16:43,2024-06-18 15:11:18
20,Brady (NYSE:BRC) Will Pay A Dividend Of $0.235 - Yahoo Finance,The company's investors will be pleased to have been receiving dividend income for some time. We are encouraged to see that Brady has grown ...,finance.yahoo.com,2024-06-19 07:00:25,2024-06-19 13:18:03
21,"Lowell, MA Trevor Bady accused of killing 15-year-old girl - NBC Boston","The district attorney's office said Alianah and Brady had dated, and Alianah told others Brady was abusive. ... marijuana company fined for safety ...",www.nbcboston.com,2024-06-19 06:56:49,2024-06-19 13:18:03
22,"Unpacking Dak Prescott's timeline for new deal, Tom Brady in broadcasting - NBC Sports",... Brady's broadcasting career and more ... Company Logo. Residents of one of the states listed in the 'Your Rights ...,www.nbcsports.com,2024-06-19 05:49:59,2024-06-19 13:18:03
23,William Hart Obituary | Jefferson City News Tribune,... Brady's Glass Company in Jefferson City. William was a member of St. John's Lutheran Church (Stringtown/Lohman). He enjoyed roller skating in his ...,www.newstribune.com,2024-06-19 05:30:08,2024-06-19 13:18:03
24,Kentucky Baseball Coaches Association All State team - Appalachian News-Express,"), Miller Green (McCracken Co.), Eli Baker (Lyon Co.), Jackson Thompson (Hopkinsville), Brady Atwell (Owensboro Catholic), Peyton Cary (Muhlenberg Co.) ...",www.news-expressky.com,2024-06-19 05:03:37,2024-06-19 13:18:03
25,Here is what Tom Brady said about the Boston Celtics' NBA Finals win - AS USA - Diario AS,"— Tom Brady (@TomBrady) June 18, 2024. This brings us to former Patriots ... A PRISA Company- El PAÍSLos 40 principalesSantillanaSantillana Compartir ...",en.as.com,2024-06-19 05:01:40,2024-06-19 13:18:03
26,New brewery pub opens in Barboursville - herald-dispatch.com,A new brewery pub has opened in Barboursville. Köerber Beer Company at 650 Brady St. combines the art of brewing craft beer with the welcoming ...,www.herald-dispatch.com,2024-06-19 04:32:52,2024-06-19 13:18:03
27,Who needs Wall Street? She swapped the trading floor for Red Bank interior design firm,"Sarah Brady enjoyed her time working the trading floor in New York, but she didn't have the passion for it. That led to Salt Design Co. in Red ...",www.app.com,2024-06-19 04:13:38,2024-06-19 13:18:03
28,"Shoshana Bean, Laura Benanti, Wayne Brady &amp; More to Join 3rd Sailing of The Broadway Cruise",Cabins are on-sale now! Book early and get priority access to mainstage shows. Confirmed performers and artists include Tony nominee Shoshana Bean (Co ...,www.broadwayworld.com,2024-06-19 03:50:48,2024-06-19 13:18:03
29,Easy Automation Expands Leadership Team with New Chief Technology Officer,... Co-President Brady Gaalswyk. “Having 10+ years of ag software engineering experience and most recently working and consulting for Fortune 500 ...,www.grainjournal.com,2024-06-19 03:45:34,2024-06-19 13:18:03
30,Michigan adds 4-star QB Brady Hart to 2026 class | National - PrimePublishers.com,Our Company. About Us- Our Management- Contact Us- Employment. Our ... Email. Syndication: Florida Today. Cocoa QB Brady Hart rolls away from the ...,www.primepublishers.com,2024-06-19 03:31:25,2024-06-19 13:18:03
31,Michigan adds 4-star QB Brady Hart to 2026 class | National | moorenews.com,0. Syndication: Florida Today. Cocoa QB Brady Hart rolls away from the ... David Beckham Settles Lawsuit Against Mark Wahlberg's Company F45- Kevin ...,www.moorenews.com,2024-06-19 03:16:57,2024-06-19 13:18:03
32,Michigan adds 4-star QB Brady Hart to 2026 class | Sports - Albany Herald,"Cocoa QB Brady Hart rolls away from the Dunnellon defense to pass ... Business After Hours April 2024. 215 N. Jackson Stre... | Albany, GA- Tue.",www.albanyherald.com,2024-06-19 03:15:17,2024-06-19 13:18:03
33,Michigan adds 4-star QB Brady Hart to 2026 class | National - Community Newspaper Group,Email. Syndication: Florida Today. Cocoa QB Brady Hart rolls away from ... Fountain Co. Neighbor- Herald Journal- KV Post News- Newton Co. Enterprise ...,www.communitynewspapergroup.com,2024-06-19 03:15:01,2024-06-19 13:18:03
34,Michigan adds 4-star QB Brady Hart to 2026 class | National | iosconews.com,Cocoa QB Brady Hart rolls away from the Dunnellon defense to pass ... Fountain Co. Neighbor- Herald Journal- KV Post News- Newton Co. Enterprise ...,www.iosconews.com,2024-06-19 03:14:59,2024-06-19 13:18:03
35,Michigan adds 4-star QB Brady Hart to 2026 class | National Sports | manchestertimes.com,Cocoa QB Brady Hart rolls away from the Dunnellon defense to pass during ... Business Directory- Promote Your Event- Email Alerts- Search- Weather.,www.manchestertimes.com,2024-06-19 03:10:37,2024-06-19 13:18:03
36,Michigan adds 4-star QB Brady Hart to 2026 class | Sports | webstercountycitizen.com,... Night on the Track - Hosted By: Fleet Feet Springfield & Heartland Racing Co. Logan-Rogersville Track Meet. 6:00PM. Promote your event- Sep 19.,www.webstercountycitizen.com,2024-06-19 03:10:37,2024-06-19 13:18:03
37,Michigan adds 4-star QB Brady Hart to 2026 class | National | derbyinformer.com,"Which ""Scenes From a Marriage"" actor needed space from her co-star Oscar Isaac after the intense shoot?- Bryce Dallas Howard- Nicole Beharie- Jessica ...",www.derbyinformer.com,2024-06-19 03:06:55,2024-06-19 13:18:03
38,Bethenny Frankel Called This Product the 'Tom Brady of Toners' - Us Weekly,Bethenny Frankel compared her favorite Biologique Recherche P50 toner to Hermes and Tom Brady — find out more. ... Company Logo. Do Not Sell My Personal ...,www.usmagazine.com,2024-06-19 01:57:34,2024-06-19 13:18:03
39,Eamonn Brady Obituary - Palatine (1949-2024) - Chicago Tribune,"Eamonn Brady, native of Co. Kilkenny, Ireland, passed away on June 15, 2024. He was 74 years old. Beloved husband of Deborah nee Sidor for 37 ...",www.chicagotribune.com,2024-06-19 00:58:44,2024-06-19 13:18:03
40,Brady (NYSE:BRC) Will Pay A Dividend Of $0.235 - Yahoo Finance,The company's investors will be pleased to have been receiving dividend income for some time. We are encouraged to see that Brady has grown ...,finance.yahoo.com,2024-06-19 12:00:25+00:00,2024-06-19 17:02:13
41,"Lowell, MA Trevor Bady accused of killing 15-year-old girl - NBC Boston","The district attorney's office said Alianah and Brady had dated, and Alianah told others Brady was abusive. ... marijuana company fined for safety ...",www.nbcboston.com,2024-06-19 11:56:49+00:00,2024-06-19 17:02:13
42,"Unpacking Dak Prescott's timeline for new deal, Tom Brady in broadcasting - NBC Sports",... Brady's broadcasting career and more ... Company Logo. Residents of one of the states listed in the 'Your Rights ...,www.nbcsports.com,2024-06-19 10:49:59+00:00,2024-06-19 17:02:13
43,William Hart Obituary | Jefferson City News Tribune,... Brady's Glass Company in Jefferson City. William was a member of St. John's Lutheran Church (Stringtown/Lohman). He enjoyed roller skating in his ...,www.newstribune.com,2024-06-19 10:30:08+00:00,2024-06-19 17:02:13
44,Kentucky Baseball Coaches Association All State team - Appalachian News-Express,"), Miller Green (McCracken Co.), Eli Baker (Lyon Co.), Jackson Thompson (Hopkinsville), Brady Atwell (Owensboro Catholic), Peyton Cary (Muhlenberg Co.) ...",www.news-expressky.com,2024-06-19 10:03:37+00:00,2024-06-19 17:02:13
45,Here is what Tom Brady said about the Boston Celtics' NBA Finals win - AS USA - Diario AS,"— Tom Brady (@TomBrady) June 18, 2024. This brings us to former Patriots ... A PRISA Company- El PAÍSLos 40 principalesSantillanaSantillana Compartir ...",en.as.com,2024-06-19 10:01:40+00:00,2024-06-19 17:02:13
46,New brewery pub opens in Barboursville - herald-dispatch.com,A new brewery pub has opened in Barboursville. Köerber Beer Company at 650 Brady St. combines the art of brewing craft beer with the welcoming ...,www.herald-dispatch.com,2024-06-19 09:32:52+00:00,2024-06-19 17:02:13
47,Who needs Wall Street? She swapped the trading floor for Red Bank interior design firm,"Sarah Brady enjoyed her time working the trading floor in New York, but she didn't have the passion for it. That led to Salt Design Co. in Red ...",www.app.com,2024-06-19 09:13:38+00:00,2024-06-19 17:02:13
48,"Shoshana Bean, Laura Benanti, Wayne Brady &amp; More to Join 3rd Sailing of The Broadway Cruise",Cabins are on-sale now! Book early and get priority access to mainstage shows. Confirmed performers and artists include Tony nominee Shoshana Bean (Co ...,www.broadwayworld.com,2024-06-19 08:50:48+00:00,2024-06-19 17:02:13
49,Easy Automation Expands Leadership Team with New Chief Technology Officer,... Co-President Brady Gaalswyk. “Having 10+ years of ag software engineering experience and most recently working and consulting for Fortune 500 ...,www.grainjournal.com,2024-06-19 08:45:34+00:00,2024-06-19 17:02:13
50,Michigan adds 4-star QB Brady Hart to 2026 class | National - PrimePublishers.com,Our Company. About Us- Our Management- Contact Us- Employment. Our ... Email. Syndication: Florida Today. Cocoa QB Brady Hart rolls away from the ...,www.primepublishers.com,2024-06-19 08:31:25+00:00,2024-06-19 17:02:13
51,Michigan adds 4-star QB Brady Hart to 2026 class | National | moorenews.com,0. Syndication: Florida Today. Cocoa QB Brady Hart rolls away from the ... David Beckham Settles Lawsuit Against Mark Wahlberg's Company F45- Kevin ...,www.moorenews.com,2024-06-19 08:16:57+00:00,2024-06-19 17:02:13
52,Michigan adds 4-star QB Brady Hart to 2026 class | Sports - Albany Herald,"Cocoa QB Brady Hart rolls away from the Dunnellon defense to pass ... Business After Hours April 2024. 215 N. Jackson Stre... | Albany, GA- Tue.",www.albanyherald.com,2024-06-19 08:15:17+00:00,2024-06-19 17:02:13
53,Michigan adds 4-star QB Brady Hart to 2026 class | National - Community Newspaper Group,Email. Syndication: Florida Today. Cocoa QB Brady Hart rolls away from ... Fountain Co. Neighbor- Herald Journal- KV Post News- Newton Co. Enterprise ...,www.communitynewspapergroup.com,2024-06-19 08:15:01+00:00,2024-06-19 17:02:13
54,Michigan adds 4-star QB Brady Hart to 2026 class | National | iosconews.com,Cocoa QB Brady Hart rolls away from the Dunnellon defense to pass ... Fountain Co. Neighbor- Herald Journal- KV Post News- Newton Co. Enterprise ...,www.iosconews.com,2024-06-19 08:14:59+00:00,2024-06-19 17:02:13
55,Michigan adds 4-star QB Brady Hart to 2026 class | National Sports | manchestertimes.com,Cocoa QB Brady Hart rolls away from the Dunnellon defense to pass during ... Business Directory- Promote Your Event- Email Alerts- Search- Weather.,www.manchestertimes.com,2024-06-19 08:10:37+00:00,2024-06-19 17:02:13
56,Michigan adds 4-star QB Brady Hart to 2026 class | Sports | webstercountycitizen.com,... Night on the Track - Hosted By: Fleet Feet Springfield & Heartland Racing Co. Logan-Rogersville Track Meet. 6:00PM. Promote your event- Sep 19.,www.webstercountycitizen.com,2024-06-19 08:10:37+00:00,2024-06-19 17:02:13
57,Michigan adds 4-star QB Brady Hart to 2026 class | National | derbyinformer.com,"Which ""Scenes From a Marriage"" actor needed space from her co-star Oscar Isaac after the intense shoot?- Bryce Dallas Howard- Nicole Beharie- Jessica ...",www.derbyinformer.com,2024-06-19 08:06:55+00:00,2024-06-19 17:02:13
58,Bethenny Frankel Called This Product the 'Tom Brady of Toners' - Us Weekly,Bethenny Frankel compared her favorite Biologique Recherche P50 toner to Hermes and Tom Brady — find out more. ... Company Logo. Do Not Sell My Personal ...,www.usmagazine.com,2024-06-19 06:57:34+00:00,2024-06-19 17:02:13
59,Eamonn Brady Obituary - Palatine (1949-2024) - Chicago Tribune,"Eamonn Brady, native of Co. Kilkenny, Ireland, passed away on June 15, 2024. He was 74 years old. Beloved husband of Deborah nee Sidor for 37 ...",www.chicagotribune.com,2024-06-19 05:58:44+00:00,2024-06-19 17:02:13
60,Gopuff reaches its 'biggest-ever partnership' with Tom Brady - Philadelphia Business Journal,Brady has also invested in the Philadelphia-based startup unicorn. Gopuff is calling the partnership with the seven-time Super Bowl winning ...,www.bizjournals.com,2024-06-21 12:28:50+00:00,2024-06-21 13:02:15
61,Tom Brady linked to Brazilian influencer Isabella Settanni who looks just like his ex Gisele ...,Chicago Sky head coach storms out of press conference after Angel Reese and Co. lost to WNBA-worst Mystics Stayed for four minutes- Celtics fans ...,www.dailymail.co.uk,2024-06-21 12:28:38+00:00,2024-06-21 13:02:15
62,Ryan Reynolds and Rob McElhenney to face showdown with Tom Brady as Wrexham ... - The Mirror,Wrexham co-owners Ryan Reynolds and Rob McElhenney will face off against Tom Brady's Birmingham City next season after both sides secured ...,www.mirror.co.uk,2024-06-21 12:10:41+00:00,2024-06-21 13:02:15
63,On demand delivery specialist Gopuff inks multi-year strategic partnership with NFL legend ...,"... Brady. Through the partnership, Brady, who is also an investor in Gopuff, will collaborate with the company on the likes of product development ...",retailtechinnovationhub.com,2024-06-21 11:51:19+00:00,2024-06-21 13:02:15
64,"Tom Brady on Belichick, Patriots career, NFL on FOX job: 'I don't want to let anyone down'","... Co. Brady calls it one of his biggest pet peeves about the modern NFL. ""One of the great things in my experience with the Patriots was that every ...",www.foxsports.com,2024-06-21 11:34:59+00:00,2024-06-21 13:02:15
65,Tom Brady on his Netflix roast and life after retirement | AP interview - Olean Times Herald,"... company, and is a dad to three kids. Brady spoke with The AP about what's keeping him busy these days and his recent Netflix roast. #tombrady.",www.oleantimesherald.com,2024-06-21 11:32:32+00:00,2024-06-21 13:02:15
66,Wayne Brady on how Robin Williams helped him step into his truth - Entertainment Weekly,"... Brady says. ""That's the cool thing about show business; sometimes you get a chance to meet your heroes."".",ew.com,2024-06-21 11:16:26+00:00,2024-06-21 13:02:15
67,Tom Brady easing into retirement - sort of. - AP News,"... company, and is a dad to three kids. Brady spoke with The AP about what's keeping him busy these days and his recent Netflix roast. (June 20).",apnews.com,2024-06-21 11:06:29+00:00,2024-06-21 13:02:15
68,Colin Cowherd details 'strangely tense day' interviewing Tom Brady - Awful Announcing,"... Brady, confirms future appearances on 'The Herd'. ""Brady's important for the company. It's a big move. He's Tom Brady, it's Fox, it's the NFL."".",awfulannouncing.com,2024-06-21 11:00:17+00:00,2024-06-21 13:02:15
69,Tom Brady excited for 'more structure' with new NFL on FOX gig - FOX News Radio,FOX Business Network Premium Podcasts- Mornings With Maria- Varney and Company- Cavuto- Fox Audio Network Podcasts- Fox News Podcasts- Fox ...,radio.foxnews.com,2024-06-21 10:31:14+00:00,2024-06-21 13:02:15
70,Tom Brady Explains Why Patriots Were 'Always Relaxed' Before Games - NESN.com,TC & Company- My Story: Bruins- My Story: Red Sox- Patriots Podcast- Soccer ... Tom Brady Explains Why Patriots Were 'Always Relaxed' Before Games.,nesn.com,2024-06-21 10:21:50+00:00,2024-06-21 13:02:15
71,FOX executives freaked out about Tom Brady's appearance with Colin Cowherd - MSN,"Tom Brady is set to make his debut calling NFL games from the booth this season with FOX Sports, and the company was nervous about his recent ...",www.msn.com,2024-06-21 10:20:53+00:00,2024-06-21 13:02:15
72,This Costa Rica Resort Is at the Forefront of Hotel Design — With a Mid-canopy Trampoline ...,"See what makes this small hideaway on the Pacific Coast such a trailblazer. By. Paul Brady ... firm that collaborated on the project. ""When designing ...",www.travelandleisure.com,2024-06-21 10:13:48+00:00,2024-06-21 13:02:15
73,Tom Brady Reveals His Date for the 2024 Summer Olympics: 'It's Going to Be So Fun' (Exclusive),"(Brady is a Hertz ambassador, and recently released a funny new spot for the rental company's ""Let's Go"" campaign.) ""That race is incredible,"" the ...",people.com,2024-06-21 10:10:06+00:00,2024-06-21 13:02:15
74,"Has a Michigan recruiting surge arrived? As 2025 class grows, Brady Hart delivers 2026 win","— Brady Hart (@BradyHartQB) June 18, 2024. Quarterback recruiting is a game ... ©2024 The Athletic Media Company, A New York Times Company- Privacy ...",www.nytimes.com,2024-06-21 09:12:18+00:00,2024-06-21 13:02:15
75,"Wayne Brady Brings Pansexuality to Reality TV, Along With His Blended Family","... business, A Wayne & Mandie Creative, the production company behind the unscripted series. Pushing past that discomfort was an important step for ...",www.hollywoodreporter.com,2024-06-21 08:45:30+00:00,2024-06-21 13:02:15
76,Ferry company raffling off boat service to Celtics parade - Boston.com,Ferry company raffling off boat service to Celtics parade. WadaHoppah is ... 4 takeaways from Tom Brady's appearance with Colin Cowherd- Visit 4 ...,www.boston.com,2024-06-21 08:03:10+00:00,2024-06-21 13:02:15
77,Tom Brady in another huge business venture as NFL legend continues million-dollar ... - The US Sun,"Brady has increased his portfolio expansion, partnering with instant commerce company Gopuff. Advertisement. Brady being inducted into the Patriots ...",www.the-sun.com,2024-06-21 07:15:57+00:00,2024-06-21 13:02:15
78,"Tom Brady joins Gopuff, instant commerce leader, in multiyear strategic partnership","In the coming weeks, Brady will have a curated category on the Gopuff app and the company's website that will be complete with TB12, Nobull and other ...",www.foxbusiness.com,2024-06-21 07:14:33+00:00,2024-06-21 13:02:15
79,Gopuff Adds A New Teammate In Tom Brady - Store Brands,The e-commerce platform known for its quick delivery options partners with the renowned quarterback to boost company growth.,storebrands.com,2024-06-21 06:45:37+00:00,2024-06-21 13:02:15
80,Tom Brady responds to Al Horford wearing a Drunk Brady shirt in Celtics parade,"... co/cQxaQrYSAx pic.twitter.com/zrcSjJhvIn. — Tom Brady (@TomBrady) June 21, 2024. Explore More. Jordon Hudson cheerleading competition- Bill ...",nypost.com,2024-06-22 11:17:13+00:00,2024-06-22 12:02:16
81,Patriots Fans Will Love Compilation Of Reunions At Tom Brady Ceremony - NESN.com,All the Patriots s came to @GilletteStadium to celebrate @TomBrady. Full behind-the-scenes: https://t.co/fjZ2Q80Vmm pic.twitter.com/ORZKZQW0hv.,nesn.com,2024-06-22 11:02:23+00:00,2024-06-22 12:02:16
82,Joe Theismann had one piece of advice for Tom Brady's broadcasting career,Thank you! ALLOW ADS ON NEW YORK POST Continue without supporting. Contact support|We're using. Company Logo. This page is not available in your area ...,nypost.com,2024-06-22 11:01:24+00:00,2024-06-22 12:02:16
83,Tom Brady Posts Jack Nicholson Meme As Al Horford Wears His Shirt to Celtics Parade,"Tom Brady @TomBrady. &lt;a href=""https://t.co/cQxaQrYSAx""&gt;https://t.co/cQxaQrYSAx&lt;/a&gt; &lt;a href=""https://t.co/zrcSjJhvIn""&gt;pic.twitter.com/zrcSjJhvIn&lt;/a&gt;.",bleacherreport.com,2024-06-22 11:00:14+00:00,2024-06-22 12:02:16
84,National Medal of Honor Museum to showcase Vietnam-era Huey | Fort Worth Star-Telegram,The North Texas museum opening March 2025 in Arlington will feature a Bell UH-1 Iroquois helicopter flown by retired Maj. Gen. Patrick Brady.,www.star-telegram.com,2024-06-22 10:49:05+00:00,2024-06-22 12:02:16
85,Who is Isabella Settanni? Meet the Gisele Bündchen look-alike linked to Tom Brady,She is the heiress of a horticulture company. Isabella Settanni 9. Settanni and Brady have not been photographed together despite reports they've ...,pagesix.com,2024-06-22 10:05:52+00:00,2024-06-22 12:02:16
86,Tom Brady linked with glam Brazilian influencer Isabella Settanni who looks like ex Gisele ...,Read more on Tom Brady. BIG IN BUSINESS. Tom Brady in another business venture to expand million-dollar portfolio- GETTING READY. 'I don't want to ...,www.the-sun.com,2024-06-22 09:26:41+00:00,2024-06-22 12:02:16
