,Heading,Subheading,Publisher,Published,Found
872,Two Grand Forks business leaders receive Prairie Business 2024 Leaders and Legacies award,"Charles Gorecki, CEO of the UND Energy and Environmental Research Center; and Todd Van Dusen, CEO and shareholder at Brady Martz & Associates are the ...",finance.yahoo.com,2024-07-14 15:01:04+00:00,2024-07-14 17:02:16
873,Inside Bill Belichick's wild summer: From a new job and a new girlfriend (49 years his ... - Daily Mail,"'Seriously, I'm so honored to be here for the roast of Tom Brady on Netflix... ... business'. © Associated Newspapers Ltd. Contact us Mobile apps ...",www.dailymail.co.uk,2024-07-14 14:40:05+00:00,2024-07-14 17:02:16
874,BioCorRx Provides Business Update for the Second Quarter of 2020 - The Globe and Mail,"Brady Granier, CEO, and Director of BioCorRx, Inc., stated, “Despite ... Company's subsidiary, BioCorRx Pharmaceuticals Inc., continues to ...",www.theglobeandmail.com,2024-07-14 12:01:18+00:00,2024-07-14 17:02:16
875,"NYCFC keeper Matt Freese, Fire's Chris Brady yield nothing in scoreless draw.",Business & Finance- National News- National Politics- World News- Editorial- History- Stock Market- Submit Your News- Sports- Local Sports ...,www.citizentribune.com,2024-07-14 08:45:09+00:00,2024-07-14 17:02:16
876,"Period property in Old Catton, Norwich, goes up for sale",News Crime Business Traffic & Travel Politics Weather Health Housing Education ... Brady (Image: Minors & Brady). 1/11. Show caption. 1/11. A period ...,www.eveningnews24.co.uk,2024-07-14 17:16:47+00:00,2024-07-14 19:02:22
877,Man charged with manslaughter in Kerry granted bail in High Court - Irish Independent,Kieran Brady (35) of Athea in Co Limerick was granted bail this week on certain conditions including that he does not contact any witnesses in ...,www.independent.ie,2024-07-14 13:40:23+00:00,2024-07-14 19:02:22
878,Five comedy festivals kick off this week : News 2024 - Chortle,"NORFOLK: Norwich-based comedy company Hooma Comedy is bringing ... Brady, Dylan Moran, Simon Amstell and more… Listings and tickets. LONDON ...",www.chortle.co.uk,2024-07-14 10:29:10+00:00,2024-07-14 19:02:22
879,NFL: Behind the scenes of Bucs' dominant Super Bowl win vs. Chiefs - Bucs Wire,"But Brady and company finished the regular season with four straight wins, then won three consecutive playoff games on the road to earn a rematch ...",bucswire.usatoday.com,2024-07-14 18:09:22+00:00,2024-07-14 20:02:19
880,List Plus: New Mexico's unique workplaces - Albuquerque Business First,""" – Martin Brady, director of business incubation and acceleration initiatives, The Enterprise Center at San Juan College; ""Quiet place to work ...",www.bizjournals.com,2024-07-14 19:41:50+00:00,2024-07-14 21:02:23
881,Rafael Devers' long HR breaks a seat in right field and Red Sox take series with 5-4 win over Royals,All-Star Devers sent a first-inning slider from Brady Singer (5-6) with ... Our CompanyCareersOur Use of AIEthics Policy. Contact. Contact Us.,www.beaumontenterprise.com,2024-07-14 20:34:09+00:00,2024-07-14 22:02:26
882,"NYCFC keeper Matt Freese, Fire's Chris Brady yield nothing in scoreless draw. - Ottumwa Courier","AL MARTIN REAL ESTATE & AUCTION CO., INC. Ashby's- BRADLEY T. BARNES CPA, P.C.- DIXON'S FLOORS 'N More- Dutchman's Store- FARM BUREAU FINANCIAL ...",www.ottumwacourier.com,2024-07-14 15:20:37+00:00,2024-07-15 00:02:22
883,"NYCFC keeper Matt Freese, Fire's Chris Brady yield nothing in scoreless draw. - The Derrick",A pivotal moment in the league's revival came in 2021 when three-time Grammy winner Bad Bunny became co-owner of Los Cangrejeros of Santurce ...,www.thederrick.com,2024-07-14 15:16:57+00:00,2024-07-15 00:02:22
884,Richard Seymour Finalizing Deal To Join Tom Brady As Owner - Yardbarker,"... co Coliseum. The Raiders defeated the Jaguars in overtime 26-23. Mandatory Credit: Kirby Lee/Image of Sport-USA TODAY Sports Oct 21, 2012; Oakland ...",www.yardbarker.com,2024-07-14 19:48:10+00:00,2024-07-15 01:02:21
885,Pennsylvania town reckons with Trump rally shooting: 'The rhetoric has to stop',"... brady paul ln' over field. A road sign on Sunday in Butler, near the ... Shapiro called on Americans to “be firm” and to “advocate for” their beliefs ...",www.theguardian.com,2024-07-15 00:17:05+00:00,2024-07-15 03:02:20
886,"Days Of Our Lives Spoilers Tuesday, July 2: Kate's Biz Idea, Abe's Opportunity, Steve's ...","Kate Roberts Brady's Business Idea Dool spoilers for Tuesday, July 2 reveal that Kate has a business idea. Now, Kate has already experienced a few ...",m.imdb.com,2024-07-15 00:21:12+00:00,2024-07-15 04:02:22
887,Royals' Brady Singer: Pulled in the third - CBSSports.com,Company Logo. Your Privacy. Your Privacy. This page provides an overview of our use of cookies and similar technologies (from here we will refer to ...,www.cbssports.com,2024-07-15 05:22:59+00:00,2024-07-15 07:02:21
888,Robinson and Brady Begin Terms as Chairs of the Faculty Senate and Campus Faculty,Kevin Brady. Brady has been elected chair of the Campus Faculty ... company ProPika. Libraries Beta Testing OneSearch AI Research Assistant.,news.uark.edu,2024-07-15 05:07:00+00:00,2024-07-15 07:02:21
889,PRESS RELEASE: Book launch – ONE MAN STANDING ALONE IN A PARK EVERY ...,"To book, go to https://www.bradygunn.com/tickets/. Media Contacts: Name: Marina ByrneCompany: Brady Gunn - A Stand in the ParkEmail: admin@ ...",getthewordout.com.au,2024-07-15 03:08:10+00:00,2024-07-15 07:02:21
890,"Period property in Old Catton, Norwich, goes up for sale | Eastern Daily Press",News Crime Court Business Traffic & Travel Politics Weather Health Housing Education ... Brady (Image: Minors & Brady). 1/11. Show caption. 1/11. A ...,www.edp24.co.uk,2024-07-14 15:58:34+00:00,2024-07-15 07:02:21
891,Honeywell CEO's $1.8 billion LNG deal is his fourth acquisition in eight months - MSN,"Honeywell CEO's $1.8 billion LNG deal is his fourth acquisition in eight months. Story by Diane Brady, Nicholas Gordon ... His company is a pioneer in ...",www.msn.com,2024-07-14 10:56:42+00:00,2024-07-15 07:02:21
892,"Supermarket concentration benefits stores, not shoppers - The University of Sydney",Associate Professor Catherine Sutton-Brady teaches and researches international marketing and business to business marketing. This story was first ...,www.sydney.edu.au,2024-07-15 07:10:34+00:00,2024-07-15 08:02:20
893,Business Moves - Insurance Journal,"PCF Insurance Services, The Brady Agency, Ignitist, Roseberry Insurance Agency, Sinnot Agency. Broker PCF Insurance Services continued its recent ...",www.insurancejournal.com,2024-07-15 06:26:23+00:00,2024-07-15 08:02:20
894,Tetra Technologies sets second quarter earnings call | Business | magnoliareporter.com,"On August 1, 2024, Tetra Technologies will host a conference call at 9:30 a.m. to discuss the results. Brady M. Murphy, president and CEO, and Elijio ...",www.magnoliareporter.com,2024-07-15 09:07:22+00:00,2024-07-15 13:02:26
895,Bella Hadid Takes Cue From Tom Brady's Ex-Wife Gisele Bundchen As She Dons THIS ... - Pinkvilla,Company. About Us- Image Usage Policy- Privacy Policy- Contact Us- Editorial Guidlines- Affiliate Disclosure- Product Research- Cookie Policy ...,www.pinkvilla.com,2024-07-15 07:02:01+00:00,2024-07-15 13:02:26
896,July 5: Harris County Civil Court docket for &quot;contract - other&quot; cases | Southeast Texas Record,"... Company; Jon D. Totz v. Del Con Services, Inc.; James Andrew Delewis. 3_1227419. 21ST Mortgage Corporation; Shawn Brady v. Jose M Blanco-Pulido.",setexasrecord.com,2024-07-15 05:39:13+00:00,2024-07-15 13:02:26
897,CEOs speak out against Trump assassination attempt—and get trolled - Fortune,More news below. Diane Brady diane.brady@fortune.com- Follow on LinkedIn ... Now the group is suing the parent company of Chili's. BYThe ...,fortune.com,2024-07-15 15:02:47+00:00,2024-07-15 16:02:21
898,Burberry replaces its CEO amid challenges in the luxury goods sector - Irish Examiner,"Picture: Jonathan Brady/PA Wire. Mon, 15 Jul, 2024 - 13:30 ... The company is consulting on job cuts to slash costs, chief financial ...",www.irishexaminer.com,2024-07-15 14:02:55+00:00,2024-07-15 16:02:21
899,Upwell Water LLC Adds Stuart Bernstein and Nicole Neeman Brady to its Board of Advisors,"PRNewswire/ -- Upwell Water LLC, a leading tech-enabled water resource and infrastructure company, is pleased to announce the appointment of ...",www.prnewswire.com,2024-07-15 13:50:08+00:00,2024-07-15 16:02:21
900,Brady Co. (NYSE:BRC) Stock Holdings Lessened by Illinois Municipal Retirement Fund,Read Brady Co. (NYSE:BRC) Stock Holdings Lessened by Illinois Municipal Retirement Fund at Defense World.,www.defenseworld.net,2024-07-15 13:15:07+00:00,2024-07-15 16:02:21
901,Sunday Sports Extra | ktvb.com,Join KTVB Sports anchors Jay Tust and Brady Frederick as they highlight the biggest sports stories of the week. ... Company Logo. 'Do Not Sell or ...,www.ktvb.com,2024-07-15 11:04:56+00:00,2024-07-15 16:02:21
902,Tom Brady Sends Playful Warning to CJ Stroud after Losing at Michael Rubin's White Party,Tom Brady sent a playful warning to CJ Stroud after losing a ... Company. About Us- Image Usage Policy- Privacy Policy- Contact Us- Editorial ...,www.pinkvilla.com,2024-07-15 15:58:18+00:00,2024-07-15 17:02:23
903,Is YouTube Really the New TV? The NFL Sunday Ticket Legal Battle May Help Decide,Tom Brady The NFL's legal troubles could eventually unwind YouTube's ... The company might need to prioritize securing alternative event ...,observer.com,2024-07-15 15:57:57+00:00,2024-07-15 17:02:23
904,CEO of Outcomes Rocket Unveils Game-Changing Marketing Assessment Tool,"Comprehensive analysis: Evaluates the company's performance across owned, earned, and paid media. ... Maddison Brady (408) 850-1269 380348 ...",www.streetinsider.com,2024-07-15 12:40:38+00:00,2024-07-15 17:02:23
905,CEOs speak out against Trump assassination attempt—and get trolled,More news below. Diane Brady diane.brady@fortune.com- Follow on ... U-Haul Holding Company's (NYSE:UHAL) market cap touched US$12b last ...,ca.finance.yahoo.com,2024-07-15 12:30:50+00:00,2024-07-15 17:02:23
906,Wayne Brady Just Revealed The Dark Truth About Reality TV When The Cameras Aren't Rolling,"Shannen Doherty's Beverly Hills, 90210 and Charmed co-stars, including Alyssa Milano, pay tribute.",www.msn.com,2024-07-15 11:24:09+00:00,2024-07-15 17:02:23
907,Man charged with manslaughter in Kerry granted bail in High Court - MSN,... Co Kerry last month has been granted bail at the High Court. Kieran Brady (35) of Athea in Co Limerick was granted bail this week on certain ...,.google.com,2024-07-15 01:30:51+00:00,2024-07-15 17:02:23
908,Seattle Mariners Offense in Bad Company at All-Star Break,"... company. Most games with 3-or-fewer runs scored as we reach the All-Star ... Brady Farkas on ""X"" @Teren_Kowatsch and @wdevradiobrady. You can ...",www.si.com,2024-07-15 17:39:52+00:00,2024-07-15 18:02:27
909,Did Tom Brady Get A Deal On His Billionaire Bunker Mortgage? - Yahoo Finance,"After Brady hung up his cleats with the Tampa Bay Buccaneers, having ... Tip: Try a valid symbol or a specific company name for relevant results ...",finance.yahoo.com,2024-07-15 16:44:28+00:00,2024-07-15 18:02:27
910,“An America Awash in Guns”: Brady President Kris Brown on Trump Shooting &amp; the Need for ...,"... Brady Campaign to Prevent Gun Violence, now known simply as Brady. ... company's [website].” Again, vending machines selling ammunition will ...",www.democracynow.org,2024-07-15 16:16:19+00:00,2024-07-15 18:02:27
911,The Buccaneers success hinges on Baker Mayfield being better than Tom Brady (again),"Baker Mayfield did what late-stage Tom Brady couldn't, which is ... wild ... Company Logo. Privacy Preference Center. When you visit our website, we ...",ftw.usatoday.com,2024-07-15 17:53:07+00:00,2024-07-15 19:02:24
912,Upwell Water LLC Adds Stuart Bernstein and Nicole Neeman Brady to its Board of Advisors,"... company. Ms. Neeman Brady is a graduate of Brown University and Harvard Business School. Mr. Geoff Adamson, Chief Investment Officer and Chief ...",www.morningstar.com,2024-07-15 14:35:38+00:00,2024-07-15 19:02:24
913,Gisele Bündchen goes biking with boyfriend Joaquim Valente - Page Six,Tom Brady in Montana with his kids. Inside Tom Brady's adventurous ... Company Logo. This page is not available in your area. Strictly ...,pagesix.com,2024-07-15 18:28:53+00:00,2024-07-15 20:02:23
914,Brady Campbell Named Women's Golf Assistant Coach - University of Arizona Athletics,Kristoff Panke was named Third Team NAIA All-American and the conference's Co-Player of the Year. The native of Washington began his coaching ...,arizonawildcats.com,2024-07-15 18:23:25+00:00,2024-07-15 20:02:23
915,Brady President Kris Brown on Trump Shooting &amp; the Need for Gun Control - YouTube,"... Brady Campaign to Prevent Gun Violence, now known simply as Brady. ""Reasonable ... Company. Amanpour and Company New 72K views- 42:51- Go to channel ...",www.youtube.com,2024-07-15 19:31:25+00:00,2024-07-15 21:02:20
916,"What Makes Brady (BRC) a Good Fit for 'Trend Investing' - July 15, 2024 - Zacks",Brady (BRC) could be a great choice for investors looking to make a profit ... Each of the company logos represented herein are trademarks of ...,www.zacks.com,2024-07-15 18:19:56+00:00,2024-07-15 21:02:20
917,Dianne Brady - Two River Times,"Dianne Brady passed away June 23, 2024, at her home in Leonardo ... She loved working with her co-workers and the many children whose lives she touched.",tworivertimes.com,2024-07-15 20:28:37+00:00,2024-07-15 22:02:23
918,Alec Baldwin Trial Ends On 'Technicality' Also Known As 'Basic Constitutional Rights',This is the story. Of a precedent named Brady... ; A Law Firm Checklist For Successful Transaction Management- The questions to ask to make transaction ...,abovethelaw.com,2024-07-15 19:24:35+00:00,2024-07-15 22:02:23
919,"Ronald D. Brady Jr., 60, formerly of Westborough - Community Advocate",How can the Community Advocate help you promote your business? Advertising Info- Suggest a Story.,www.communityadvocate.com,2024-07-15 16:44:36+00:00,2024-07-15 22:02:23
920,HAL BRADY: The common thread | Faith | news-daily.com,"HAL BRADY: The common thread. By Hal Brady; Jul 13, 2024; Jul 13, 2024 ... 1565 Commercial Co... | Jonesboro, GA. Thu. 11- Fri. 12- Sat. 13- Sun. 14.",www.news-daily.com,2024-07-15 19:52:34+00:00,2024-07-15 23:02:23
921,Bills OC Joe Brady hoping for 'little bit of everything' from Curtis Samuel: 'His versatility will ...,Samuel's finest season thus far came in his only year with Joe Brady as his offensive coordinator. ... Company Logo. Your Privacy Choices. Your Opt Out ...,www.nfl.com,2024-07-16 00:22:51+00:00,2024-07-16 01:02:20
922,"Brady, Babich set for first training camp as Bills coordinators | wgrz.com",Joe Brady and Bobby Babich will each be going through their first ... Company Logo. 'Do Not Sell or Share My Personal Information' Notice. Like ...,www.wgrz.com,2024-07-15 23:20:32+00:00,2024-07-16 01:02:20
923,Man charged with two counts of murder after body parts found in suitcases on UK bridge,"(Jonathan Brady/PA via AP)Jonathan Brady/AP. Show Less Show More ... © 2024 Edwardsville Publishing Company, LLCPrivacy NoticeInterest Based AdsYour ...",www.myjournalcourier.com,2024-07-15 20:01:38+00:00,2024-07-16 01:02:20
924,BCSC given administrative power beyond those of U.S. SEC - Business in Vancouver,Capstone Asset Management Inc. agreed to the fine without a hearing after BCSC executive director Peter Brady determined the firm's level of insurance ...,www.biv.com,2024-07-16 00:29:26+00:00,2024-07-16 03:02:23
925,Haven Brady Summa Smash - WALB,Haven Brady Summa ...,www.walb.com,2024-07-16 01:34:37+00:00,2024-07-16 04:02:24
926,PUBLIC NOTICE PROCEEDINGS FOR | Legal Announcements | themountainmail.com,"BOWEN DITCH COMPANY $45,000.00. BRADY, EVAN $600.00. BROWN, SUMMER $125.00. Brunner, Janice $125.00. BRYANS, CANDACE $748.75. BUCHAN, JARED $150.00",www.themountainmail.com,2024-07-16 06:15:28+00:00,2024-07-16 10:02:20
927,JON BRADY THRILLED WITH TYLER MAGLOIRE'S RETURN - Northampton Town FC,"... BRADY THRILLED WITH TYLER MAGLOIRE'S RETURN. Interviews. 21 hours ago ... Company Logo. Privacy Preference Center. When you visit any website, it ...",www.ntfc.co.uk,2024-07-16 06:14:26+00:00,2024-07-16 10:02:20
928,Tour de France: Why We Celebrate Suffering in Sport - Cycling West,"By Michael Brady, University of Glasgow The Tour de France is one of ... CO, WY)- Utah Road Bike Racing- Regional Road Bike Racing (ID, NV, AZ ...",www.cyclingwest.com,2024-07-16 02:08:34+00:00,2024-07-16 10:02:20
929,Is JD Vance pro-business? Trump VP pick hard to pin down | Fortune,"Vance pro-business? Trump's VP pick is hard to pin down. BYDiane Brady and Nicholas Gordon. July 16, 2024 at 2:36 AM PDT.",fortune.com,2024-07-16 09:45:09+00:00,2024-07-16 11:02:13
930,Chicago White Sox Join Terrible Group in Baseball History with Woeful First Half,... company. Brady Farkas | 12 Hours Ago. Chicago White Sox manager ...,www.si.com,2024-07-16 07:23:41+00:00,2024-07-16 11:02:13
931,Rediscover the Magic of Summer Camp in New Children's Book Ranked #1 on Amazon,"Susan co-authors the Bradykin series with her daughter, Megan, combining their love for writing with their commitment to promoting the benefits of ...",www.abc27.com,2024-07-16 04:15:12+00:00,2024-07-16 11:02:13
932,"Minnesota #DNR Conservation Officer Reports-July 15, 2024 | The Mighty 790 KFGO",CO Brady Manteufel (Bagley) addressed calls on bears and followed up on a public waters violation this week. Angler and ATV checks were conducted ...,kfgo.com,2024-07-16 03:13:02+00:00,2024-07-16 11:02:13
933,BradyPLUS Drives Growth in the NY Metropolitan Area with the Acquisition of TED Supply,"""Our entire team looks forward to being part of a growing company with ... For more information, please visit www.tedsupply.com. About BradyPLUS ( ...",www.prnewswire.com,2024-07-16 13:23:30+00:00,2024-07-16 15:02:20
934,Ocado shares jump as it narrows losses and boosts technology business - The Guardian,"... Brady/PA. Retail industry. Ocado shares jump as it narrows losses and boosts technology business. Revenues from technology arm, which sells robots to ...",www.theguardian.com,2024-07-16 12:45:57+00:00,2024-07-16 15:02:20
935,Bills OC Joe Brady on offensive plan in 2024: 'I think some of that is still TBD' - NFL.com,"After having an offseason to fully implement his plan for Buffalo's offense in 2024, Bills OC Joe Brady ... Company Logo. Your Privacy Choices. Your Opt ...",www.nfl.com,2024-07-16 14:55:15+00:00,2024-07-16 16:02:18
936,Did Tom Brady Play Baseball? | PINKVILLA,"Tom Brady played multiple sports along with the NFL, but did he play baseball ... Last year, American trading card company Topps went on to imagine the ...",www.pinkvilla.com,2024-07-16 14:31:11+00:00,2024-07-16 16:02:18
937,"Hooksett, NH, car crash: Brady Gut arrested, 2nd driver hurt - NBC Boston","Brady Gut, a 31-year-old from Chichester, faces a charge of ... Company Logo. Residents of one of the states listed in the 'Your Rights ...",www.nbcboston.com,2024-07-16 14:09:05+00:00,2024-07-16 16:02:18
938,Randy Moss comments on emotional moment at Tom Brady induction ceremony,Former New England Patriots receiver Randy Moss commented on his emotional moment at the Tom Brady induction ceremony ... Company Logo. Privacy ...,patriotswire.usatoday.com,2024-07-16 16:51:19+00:00,2024-07-16 18:02:17
939,Here's Why You Should Retain IDEX (IEX) in Your Portfolio | Nasdaq,Shares of Brady have gained 11.9% in the past six months. Crane Company CR presently carries a Zacks Rank of 2. CR delivered a trailing four-quarter ...,www.nasdaq.com,2024-07-16 15:54:18+00:00,2024-07-16 18:02:17
940,"Trump may warm up to gun control like Reagan did, according to former GOP mayor, Brady ...","Trump may warm up to gun control like Reagan did, according to former GOP mayor, Brady Campaign leader ... Fox Broadcasting Company- Vice Presidency Of ...",www.wfft.com,2024-07-16 15:36:09+00:00,2024-07-16 18:02:17
941,Community-Focused Dental Care: Meet the New Owners of Flandreau and Dell Rapids Clinics,"Brady and Lauren Roby, and their son, along with their partner Dr. Shayna Vercruysse, hosted an Open House this past week at their Dell Rapids ...",moodycountyenterprise.com,2024-07-16 15:32:25+00:00,2024-07-16 18:02:17
942,Hans Riede Quoted in Law360 Story About Wage and Hour Cases to Watch in Coming Months,"Hans Riede, Quarles & Brady's Washington, D.C., office co-managing partner and office chair of the Labor & Employment Practice Group, ...",www.quarles.com,2024-07-16 15:07:13+00:00,2024-07-16 18:02:17
943,"SEC Odds, Picks, Team Preview: 2 Futures to Bet for Brady Cook &amp; Missouri","If either of them drops another game, that will give Missouri a chance to claim the other spot if it handles its own business. Barring injuries ...",www.actionnetwork.com,2024-07-16 12:55:37+00:00,2024-07-16 18:02:17
944,He's in the game; Gaylord's Brady Pretzlaff makes MSU debut in EA's College Football 25,"The brand-new brewery later celebrated its ribbon cutting ceremony on July 11. Cypress Roots Brewing Company's beer selection is traditional, with ...",www.aol.com,2024-07-16 18:06:33+00:00,2024-07-16 19:02:21
945,Garda killer Aaron Brady maintains witnesses gave 'untrue' evidence against him - Limerick Leader,"In August 2020, Brady (33) formerly of New Road, Crossmaglen, Co Armagh was convicted by a jury of the murder of Detective Garda Adrian Donohoe ...",www.limerickleader.ie,2024-07-16 16:16:47+00:00,2024-07-16 19:02:21
946,Cobblers boss Brady signs on as Keogh and Lawes get set to lock T20 horns!,Cobblers boss Brady signs on as Keogh and Lawes get set to lock T20 horns! ... co.uk. To enquire about hospitality packages please email info ...,www.northamptonchron.co.uk,2024-07-16 18:16:40+00:00,2024-07-16 20:02:15
947,Canada calls on Elmira's Brady Martin - Hockey - The Record,Elmira's Brady Martin has been invited to Hockey Canada's Under-18 camp. ... 'It's alarming': Waterloo business says impostors have duped their clients.,www.therecord.com,2024-07-16 18:05:49+00:00,2024-07-16 20:02:15
948,Former Custom House Capital chief executive appeals fraud sentence - BreakingNews.ie,"A total of €253.4 million across over 3,000 accounts was held by the company on the date of liquidation. ... Barrister For Garda Killer Aaron Brady ...",www.breakingnews.ie,2024-07-16 17:16:07+00:00,2024-07-16 20:02:15
949,Drink spiking to become a specific criminal offence in the UK - Newstalk ZB,UK correspondent Enda Brady says the existing legislation hasn't been updated since the 1800s - so this change is badly needed. LISTEN ABOVE.,www.newstalkzb.co.nz,2024-07-16 14:10:22+00:00,2024-07-16 20:02:15
950,nLIGHT to Announce Second Quarter 2024 Financial Results on August 1st,... Brady as the company's new CFO. Brady will remain employed with. 3/27/23 4:05:00 PM ET. $LASR- $NKLA. Semiconductors. Technology. Auto Manufacturing.,quantisnow.com,2024-07-16 17:15:58+00:00,2024-07-16 21:02:18
951,"SEC odds, picks, team preview: 2 futures to bet for Brady Cook and Missouri | Yardbarker","If either of them drops another game, that will give Missouri a chance to claim the other spot if it handles its own business. Barring injuries, ...",www.yardbarker.com,2024-07-16 15:14:22+00:00,2024-07-16 21:02:18
952,KKTV 11 News Meteorologist Brady Brewster is going 'over the edge' for CASA!,Pueblo is a great ...,www.kktv.com,2024-07-16 21:09:53+00:00,2024-07-16 22:02:17
953,Missouri Quarterback Brady Cook Previews Upcoming Season - Sports Illustrated,Tigers co-captain Brady Cook discusses pairing up with First Team All-SEC wide receiver Luther Burden III for the final time and what to expect ...,www.si.com,2024-07-16 21:08:47+00:00,2024-07-16 22:02:17
954,Cyber threats from China demand better measures to protect democracy | The Post,"... Brady, the authors of this article. At the time of the cyber attack ... Stuff.co.nz. News Tips? News Tips? Send your photos, videos, and tip ...",www.thepost.co.nz,2024-07-16 21:05:35+00:00,2024-07-16 22:02:17
955,"UFC UNFILTERED | Julian Erosa, actor Lewis Tan, guest co-host Din Thomas","Watch the 805th Episode of Unfiltered with guests Julian Erosa, Lewis Tan, and guest co-host Din Thomas ... Brady Hiestand and Alex Perez. UFC ...",www.ufc.com,2024-07-16 21:52:11+00:00,2024-07-16 23:02:17
956,Brady Cook gives rave review of new Kentucky OC Bush Hamdan - 247 Sports,They may be used by those companies to build a profile of your interests and show you relevant advertising on this and on other properties. If you do ...,247sports.com,2024-07-16 21:33:08+00:00,2024-07-16 23:02:17
957,Is J.D. Vance pro-business? Trump's VP pick is hard to pin down - Yahoo Finance,"Vance pro-business? Trump's VP pick is hard to pin down. Diane Brady, Nicholas Gordon. Tue, July 16, 2024 at 2:36 a.m. PDT ·2 min read. Joe Raedle ...",ca.finance.yahoo.com,2024-07-16 17:51:28+00:00,2024-07-16 23:02:17
958,Arkansas RHP Brady Tygart taken in 12th round of 2024 MLB Draft - 247 Sports,"We also have the best and most user-friendly mobile platform in the business. If you're away from your computer, don't worry – 247Sports offers full ...",247sports.com,2024-07-16 22:37:16+00:00,2024-07-17 00:02:17
959,How Mizzou's Brady Cook and Luther Burden III have enjoyed new college football video ...,"""The whole time, I'm just glued to the screen, smiling,"" Missouri quarterback Brady Cook, who carries an 88 overall rating in the game, said.",www.maryvilleforum.com,2024-07-16 22:58:18+00:00,2024-07-17 01:02:14
960,Aaron Donald: 'I Hated Tom Brady' for 3 Years After Rams' Super Bowl Loss to Patriots,"Discovery Company. All Rights Reserved. Company Logo. Do Not Sell or Share My Personal Information. For California, Colorado, Connecticut, Oregon ...",bleacherreport.com,2024-07-17 01:30:03+00:00,2024-07-17 03:02:14
