,Heading,Subheading,Publisher,Published,Found
349,10 Best Industrial Stocks to Buy According to Hedge Funds - Insider Monkey,CSX Corporation (NASDAQ:CSX) and its subsidiaries offer rail-based ... The company provides various other transportation solutions such as ...,www.insidermonkey.com,2024-07-13 20:46:32+00:00,2024-07-14 01:03:48
350,"U.S. corporate bankruptcies are soaring above the pandemic-era peak, adding to ... - Yahoo Finance","But a week later, the company shifted to Chapter 7 ... CSX Corporation (CSX): Did This Industrial Stock Get a Good Rating from Analysts?",uk.finance.yahoo.com,2024-07-13 21:37:58+00:00,2024-07-14 07:03:54
351,Overpass planned for Chesapeake's top reported 'blocked' railroad crossing | WAVY.com,"Efforts to enforce the law haven't proved successful. In 2017, the State Corporation Commission imposed a $18,600 fine on CSX Transportation for ...",www.wavy.com,2024-07-14 09:10:26+00:00,2024-07-14 10:03:45
352,CSX's (NASDAQ:CSX) Dividend Will Be $0.12 - Yahoo Finance,The company's investors will be pleased to have been receiving dividend income for some time. We are encouraged to see that CSX has grown earnings per ...,finance.yahoo.com,2024-07-14 13:35:34+00:00,2024-07-14 17:03:42
353,"SG Americas Securities LLC Grows Position in IDEXX Laboratories, Inc. (NASDAQ:IDXX)","Wealthspire Advisors LLC Decreases Stake in Maximus, Inc. (NYSE:MMS)- CSX Co. (NASDAQ:CSX) Shares Sold by Wealthspire Advisors LLC- Frontera Energy ...",www.defenseworld.net,2024-07-14 12:38:28+00:00,2024-07-14 17:03:42
354,Wealthspire Advisors LLC Sells 211 Shares of Genuine Parts (NYSE:GPC) - Defense World,"Grimes & Company Inc. now owns 3,178 shares of the specialty ... CSX Co. (NASDAQ:CSX) Shares Sold by Wealthspire Advisors LLC- Frontera ...",www.defenseworld.net,2024-07-14 12:37:41+00:00,2024-07-14 17:03:42
355,Investors Are Counting on Jerome Powell to Save Plug Power (PLUG) Stock - MSN,... company expecting revenue of about $900 million. Other clean energy ... CSX Corporation (CSX): Did This Industrial Stock Get a Good Rating from Analysts.,www.msn.com,2024-07-14 00:49:23+00:00,2024-07-14 20:03:44
356,10 Best Industrial Stocks to Buy According to Hedge Funds - Insider Monkey,... company's investor day next week. The adjustment reflects strategic ... CSXDaily NewsletterCRH plc (NYSE:CRH)Linde plc (NASDAQ:LIN)RTX ...,www.insidermonkey.com,2024-07-14 02:13:34+00:00,2024-07-14 22:03:55
357,Chief Bank's Digital Micro-Lending App 'Chief Easy' Offers Loans ... - Cambodia Investment Review,"Companies CSX- CAMGSM Plc. Rings In Transparency With Landmark First Annual General Meeting. July 1, 2024. ‹› Markets. Markets Economy- Navigating ...",cambodiainvestmentreview.com,2024-07-15 05:08:57+00:00,2024-07-15 07:03:56
358,Construction begins on new CSX-owned rail bridge over Hudson River,"Railroad industry news about: Livingston Avenue Bridge, CSX, Amtrak ... Company Type (Select One)*, Class 1 Railroad, Rail Transit, Regional ...",www.progressiverailroading.com,2024-07-15 15:25:24+00:00,2024-07-15 17:03:55
359,Colonial Drive closed at rail crossing as CSX performs maintenance - WECT,According to the NCDOT ...,www.wect.com,2024-07-15 16:36:26+00:00,2024-07-15 18:03:57
360,"CSX, Transgender Worker Settle Gender Dysphoria, Sex Bias Case - Bloomberg Law News",CSX Transportation Inc. and a transgender woman who was terminated after urinating in a New York rail yard agreed to end her sex and gender ...,news.bloomberglaw.com,2024-07-15 19:43:31+00:00,2024-07-15 21:03:48
361,"Empowered Funds LLC Boosts Stake in Safe Bulkers, Inc. (NYSE:SB) - Defense World",LSV Asset Management Raises Holdings in CSX Co. (NASDAQ:CSX)- Moelis & Company (NYSE:MC) Position Lifted by Texas Permanent School Fund Corp ...,www.defenseworld.net,2024-07-15 17:32:45+00:00,2024-07-15 21:03:48
362,Riverfront Conservancy closer to complete riverwalk - Detroit Free Press,"... companies — many with ties to the Bridge Co. The Ambassador Bridge ... Currently, the Bridge Company and CSX Transportation maintain a joint ...",www.freep.com,2024-07-15 21:12:49+00:00,2024-07-15 22:03:48
363,EPA will review civil rights complaint against city over Baltimore trash incinerator,... CSX coal operations in Curtis Bay. She is flanked by Meg Chow and ... Company (BRESCO) for residential waste disposal. The city and DPW stand ...,www.baltimorebrew.com,2024-07-15 18:26:58+00:00,2024-07-15 22:03:48
364,"US close: Dow hits new record on Trump bets, Powell comments - Sharecast.com",Travelers Company Inc. (TRV)$213.400.85% Unitedhealth Group Inc. (UNH) ... CSX Corp. (CSX)$34.602.40% J.B. Hunt Transport Services Inc. (JBHT) ...,www.sharecast.com,2024-07-15 21:31:51+00:00,2024-07-15 23:03:49
365,8-year-old struck by train Monday in Cherry Hill taken to hospital in stable condition - Baltimore Sun,"Private police from railroad company CSX have been notified of the incident, police said. Share this: Click to share on Facebook (Opens in new ...",www.baltimoresun.com,2024-07-16 04:02:31+00:00,2024-07-16 05:03:49
366,8-year-old struck by train Monday in Cherry Hill taken to hospital in stable condition - Yahoo,"... a severe injury to one of his extremities, police said. Private police from railroad company CSX have been notified of the incident, police ...",www.yahoo.com,2024-07-16 04:35:35+00:00,2024-07-16 06:03:52
367,"US close: Dow hits new record on Trump bets, Powell comments - Stockbroking - Redmayne Bentley",... Company Inc. (TRV) $213.40 0.85% Unitedhealth Group Inc. (UNH) $515.37 ... CSX Corp. (CSX) $34.60 2.40% J.B. Hunt Transport Services Inc ...,www.redmayne.co.uk,2024-07-16 03:19:48+00:00,2024-07-16 08:03:38
368,"Daniel Craig Eubank Obituary (2024) - Hinton, WV - Pivont Funeral Home - Legacy.com",After military service Dan enjoyed a 40 year career with CSX Railroad. Where he achieved many mile stones as he continued to rise in the company.,www.legacy.com,2024-07-16 07:26:14+00:00,2024-07-16 13:03:44
369,CSX CEO Joe Hinrichs Discusses How CSX is Continually Improving Customer Service at ...,to CSX than you might expect. Learn all about CSX and discover what ... Company Store- Privacy- Retirees- Contact Us- Terms of Use- ShipCSX Login.,www.csx.com,2024-07-16 13:58:16+00:00,2024-07-16 16:03:42
370,CSX's Allison Russo Named to RT&amp;S Magazine's Women in Railroad Engineering List,"Additionally, she regularly engages in company-sponsored events such as the CSX Santa Train packing party, helping the company prepare to provide ...",www.csx.com,2024-07-16 13:52:16+00:00,2024-07-16 16:03:42
371,"Levi &amp; Korsinsky Reminds Shareholders of a Lead Plaintiff Deadline of July 16, 2024 in ...","Levi & Korsinsky Reminds Shareholders of a Lead Plaintiff Deadline of July 16, 2024 in Teladoc Health, Inc. Lawsuit – TDOC- CSX Earns Top Disability ...",forextv.com,2024-07-16 17:07:35+00:00,2024-07-16 18:03:41
372,"CSX Earns Top Disability Equality Index® Score, Named &quot;Best Place to Work&quot; for Sixth-Straight Year","CSX, based in Jacksonville, Florida, is a premier transportation company. ... CSX Corporation is specialized in the railroad transport services.",www.marketscreener.com,2024-07-16 16:34:59+00:00,2024-07-16 18:03:41
373,"CSX Earns Top Disability Equality Index® Score, Named &quot;Best Place to Work&quot; for Sixth-Straight Year","CSX Corporation. Tue, Jul 16, 2024, 9:30 AM PDT 2 min read. In this ... CSX, based in Jacksonville, Florida, is a premier transportation company.",finance.yahoo.com,2024-07-16 16:34:00+00:00,2024-07-16 18:03:41
374,United Refining Company Acquires Pump N' Pantry - NACS,CSX—The Engine Behind the SOI Report. Operational Growth and ... Pennsylvania retailer Pump N' Pantry has sold its 14-store business to United Refining ...,www.convenience.org,2024-07-16 15:52:51+00:00,2024-07-16 18:03:41
375,The Psychology Behind Stock Picking: An Analysis and Mitigation Technique,... company is finalizing an acquisition of a high-potential smaller company ... CSX Corporation — A Wide-Moat Business That's Getting Cheap. Did you ...,medium.datadriveninvestor.com,2024-07-16 15:29:44+00:00,2024-07-16 18:03:41
376,Where I Invest £50000 Per Year - DataDrivenInvestor,"The company is structured as a mutual, meaning it's owned by its ... CSX Corporation — A Wide-Moat Business That's Getting Cheap. Did you ...",medium.datadriveninvestor.com,2024-07-16 15:29:43+00:00,2024-07-16 18:03:41
377,CSX Quantitative Stock Analysis - Nasdaq,CSX CORP (CSX) is a large-cap growth stock in the Railroads industry. The rating using this strategy is 77% based on the firm's underlying ...,www.nasdaq.com,2024-07-16 14:16:30+00:00,2024-07-16 18:03:41
378,"CSX Earns Top Disability Equality Index® Score, Named &quot;Best Place to Work&quot; for Sixth-Straight Year","to CSX than you might expect. Learn all about CSX and discover what ... CSX, based in Jacksonville, Florida, is a premier transportation company.",www.csx.com,2024-07-16 17:09:13+00:00,2024-07-16 19:03:48
379,"CSX Earns Top Disability Equality Index® Score, Named &quot;Best - GlobeNewswire","CSX Earns Top Disability Equality Index® Score, Named ""Best Place to Work"" for Sixth-Straight Year. July 16, 2024 12:30 ET | Source: CSX Corporation",www.globenewswire.com,2024-07-16 16:37:47+00:00,2024-07-16 19:03:48
380,Amtrak Awards Construction Contract for East River Tunnel Rehabilitation,"Watch: CSX Making Important Infrastructure Enhancements at Three Yards ... This team, the company says, will be fully integrated with Amtrak's in ...",www.rtands.com,2024-07-16 15:18:37+00:00,2024-07-16 19:03:48
381,Barclays Sticks to Its Buy Rating for CSX (CSX) | Markets Insider,"The company's shares closed yesterday at $34.60. According to TipRanks, Oglenski is a 5-star analyst with an average return of 8.6% and a 55.87% ...",markets.businessinsider.com,2024-07-16 15:24:06+00:00,2024-07-16 21:03:42
382,Lorain's Caboose 3855 gets closer to completion with addition of new interior paint,The caboose represents a piece of Lorain's railroad history as it once serviced the city of Lorain on CSX Corporation transportation trains. The ...,www.morningjournal.com,2024-07-16 22:31:27+00:00,2024-07-17 00:03:42
383,CSX Corp. stock underperforms Tuesday when compared to competitors despite daily gains,"Company Close Updates. CSX Corp. stock underperforms Tuesday when ... CSX advanced 2.11% to $35.33 Tuesday, on what proved to be an all-around ...",www.marketwatch.com,2024-07-16 21:19:57+00:00,2024-07-17 02:03:44
384,Herzog and DBK Start Preconstruction on Amtrak's New Penn Coach Yard Maintenance Facility,Herzog Contracting Corporation and Dana B. Kenyon Company (DBK) have ... Watch: CSX Making Important Infrastructure Enhancements at Three Yards.,www.rtands.com,2024-07-17 02:30:26+00:00,2024-07-17 04:03:43
385,"Botswana, Zimbabwe, Mozambique ink major rail and port development deal","MOL and Electric Power Development Co. to install hard sail wind power ... This week, CSX is restarting coal exports in Baltimore after deep ...",www.bulkmaterialsinternational.com,2024-07-17 06:03:51+00:00,2024-07-17 07:03:39
386,"Duos Issues Update On Duos Edge AI Subsidiary, Announces That The New President ...","Duos Technologies Group, Inc. (""Duos"" or the ""Company ... Lonegro enjoyed a long and distinguished career at CSX Corporation (NASDAQ:CSX) ...",quantisnow.com,2024-07-17 12:25:03+00:00,2024-07-17 14:03:43
387,Concurrent Investment Advisors LLC Buys New Holdings in Veeva Systems Inc. (NYSE:VEEV),Company insiders own 10.50% of the company's stock. Veeva Systems ... Has $22.15 Million Stock Position in CSX Co. (NASDAQ:CSX)- NEXT HEADLINE ...,www.defenseworld.net,2024-07-17 12:23:22+00:00,2024-07-17 14:03:43
388,Railway Infrastructure Maintenance Services Market Analysis - openPR.com,"... Company, Union Pacific Railroad, etc. In 2022, the global top 10 ... CSX Transportation West Japan Railway Company Norfolk Southern Railway",www.openpr.com,2024-07-17 09:32:27+00:00,2024-07-17 14:03:43
389,Airline Leader Ryanair Takes Flight; This Support Level Offers New Buy Area - MSN,"Please watch the video at Investors.com - Market Pauses At Record Highs; Snowflake, CSX, D.R.- The company's December-quarter results are due Jan.",.google.com,2024-07-17 06:59:07+00:00,2024-07-17 14:03:43
390,FTA orders SEPTA to fix safety problems - Progressive Railroading,"CSX- Kansas City Southern- Norfolk Southern- Union Pacific. RAILROADS ... Company Type (Select One)*, Class 1 Railroad, Rail Transit, Regional ...",www.progressiverailroading.com,2024-07-17 02:57:42+00:00,2024-07-17 14:03:43
391,"Stifel Maintains Buy on Union Pacific, Lowers Price Target to $265 - Quantisnow",Image for Shares of railroad companies are trading higher amid possible optimism that the Fed will. 7/16/24 1:30:51 PM ET. $CSX- $NSC- $UNP.,quantisnow.com,2024-07-17 14:05:16+00:00,2024-07-17 16:03:40
392,Fayette railroad crossings to be replaced | News | dailycourier.com,Crews from CSX or Hennessey & Company Inc. will be maintaining or replacing railroad crossings from 6 to 5 p.m. on the following dates and associated ...,www.dailycourier.com,2024-07-17 16:53:09+00:00,2024-07-17 18:03:40
393,3 Flying Car Stocks to Buy Now: Q3 Edition | InvestorPlace,"And, according to company co-president Brian Gu, the cars should be ... CSX Corporation (NASDAQ:CSX), American Airlines (NASDAQ:AAL), Lear ...",investorplace.com,2024-07-17 16:52:09+00:00,2024-07-17 18:03:40
394,Concurrent Investment Advisors LLC Cuts Stock Position in Invesco Municipal Opportunity ...,Sei Investments Co. Increases Holdings in Biogen Inc. (NASDAQ:BIIB)- Sei Investments Co. Has $22.15 Million Stock Position in CSX Co. (NASDAQ:CSX).,www.defenseworld.net,2024-07-17 12:29:14+00:00,2024-07-17 18:03:40
395,"Fire affects train service, closes East Lane to traffic | News | winchesterstar.com",WINCHESTER — A small fire near the CSX railroad tracks in the city ... Company extinguishes a fire along the railroad ties on East Lane ...,www.winchesterstar.com,2024-07-17 11:58:44+00:00,2024-07-17 18:03:40
396,"CSX Earns Top Disability Equality Index® Score, Named &quot;Best Place to Work&quot; for Sixth-Straight Year","The Index is a joint initiative of Disability:IN and the AAPD, aimed at driving transparency and progress in disability inclusion across corporate ...",markets.businessinsider.com,2024-07-16 17:00:06+00:00,2024-07-17 18:03:40
397,CSX (WBO:CSX) Float Percentage Of Total Shares Outstanding - GuruFocus,All currency related amount are indicated in the company's associated stock exchange currency. CSX (WBO:CSX) Business Description. Industry.,www.gurufocus.com,2024-07-17 18:17:30+00:00,2024-07-17 20:03:45
398,CleanSpace Holdings (ASX:CSX) LT-Debt-to-Total-Asset - GuruFocus,All currency related amount are indicated in the company's associated stock exchange currency. Download. * Premium members only. CleanSpace Holdings ...,www.gurufocus.com,2024-07-17 18:17:28+00:00,2024-07-17 20:03:45
399,Transloading Company opens facility in Cumberland County; Operations will remove the ...,"STS of Fayetteville adds the corporation's eighth location in the Southeast. Through the CSX Rail line, the company will provide direct rail ...",bizfayetteville.com,2024-07-17 19:44:30+00:00,2024-07-17 21:03:50
400,Norfolk Southern AVP Corletto to chair RailMarketplace board - Progressive Railroading,"RailMarketplace is a purchasing consortium that includes BNSF Railway Co., Canadian Pacific Kansas City, CN, CSX, NS and Union Pacific Railroad.",www.progressiverailroading.com,2024-07-17 17:55:48+00:00,2024-07-17 22:03:45
401,CSX Recognizes National Merit Finalists with Scholarship Luncheon,"This initiative underscores the company's commitment to education and community engagement. In June, CSX hosted a special luncheon to celebrate the ...",www.csx.com,2024-07-17 22:18:31+00:00,2024-07-17 23:03:42
402,Concord police planning to clear N. Main Street encampment,"... CSX, which has a ... Moulton spoke with CSX this week regarding the camp on N. Main Street and told ...",www.concordmonitor.com,2024-07-17 21:52:28+00:00,2024-07-17 23:03:42
403,CSX Corp. stock underperforms Wednesday when compared to competitors despite daily gains,"Company Close Updates. CSX Corp. stock underperforms Wednesday when ... CSX inched 0.34% higher to $35.45 Wednesday, on what proved to be an ...",www.marketwatch.com,2024-07-17 21:46:20+00:00,2024-07-18 01:03:46
404,Concurrent Investment Advisors LLC Invests $218000 in Capital Southwest Co. (NASDAQ:CSWC),Capital Southwest Corporation is a business development company ... Has $22.15 Million Stock Position in CSX Co. (NASDAQ:CSX)- Home- About Us ...,www.defenseworld.net,2024-07-17 18:19:55+00:00,2024-07-18 01:03:46
405,Curtis Bay residents impacted by 2021 coal explosion have until July 18 to apply for settlement pay,"""CSX confirms the company has reached a settlement agreement with the plaintiffs of the Curtis Bay class action lawsuit filed following the ...",www.cbsnews.com,2024-07-18 00:41:27+00:00,2024-07-18 03:03:41
406,Deadline nearing for Curtis Bay residents to join CSX lawsuit - CBS News,... csx-lawsuit/. ©2024 CBS Broadcasting Inc. All Rights Reserved. Terms of Use- Privacy Policy- California Notice; Cookie Details; WJZ- Events & ...,www.cbsnews.com,2024-07-18 15:43:47+00:00,2024-07-18 17:03:44
407,CSX Scores For Employing People With Disabilities - WCBC,"July 18th, 2024 by WCBC Radio. CSX Corporation was named one of America's best places to work by the Disability Equality Index for the ...",www.wcbcradio.com,2024-07-18 15:20:54+00:00,2024-07-18 17:03:44
408,"More Reach, More Innovation: Syncron's Connected Service Experience now on AWS Marketplace","Syncron aligns all aftermarket services with its Connected Service Experience (CSX) cloud platform, helping companies differentiate themselves through ...",www.prnewswire.com,2024-07-18 14:25:24+00:00,2024-07-18 17:03:44
409,Clean Seed Capital Group Ltd. (&quot;Clean Seed&quot; or the &quot;Company&quot;) (NEX: CSX.H) Letter to its ...,"July 18, 2024 – TheNewswire – Vancouver, British Columbia - Clean Seed Capital Group Ltd. (“Clean Seed” or the “Company”) (NEX: CSX.",www.thenewswire.com,2024-07-18 13:03:14+00:00,2024-07-18 17:03:44
410,"Revamped downtown CSX redevelopment plan features upscale hotel, music venue","... company Live Nation Entertainment Inc. It would also feature a two-level, subgrade parking garage, restaurants, retail and an elevated walkway ...",www.ibj.com,2024-07-18 12:42:02+00:00,2024-07-18 17:03:44
411,Pioneer Railcorp (OTCMKTS:PRRR) Shares Up 0.2% - Defense World,"... Railroad, Conrail, Inc, CSX Transportation, Illinois Central Railroad, Norfolk Southern Railway and Union Pacific Railroad. Featured Articles. Five ...",www.defenseworld.net,2024-07-18 12:29:24+00:00,2024-07-18 17:03:44
412,Two new shipping container storage yards approved in Portsmouth - The Virginian-Pilot,"The request was made by Paul Tschiderer of AES Consulting on behalf of CSX Transportation, Inc., which owns the irregularly shaped parcel bounded to ...",www.pilotonline.com,2024-07-18 11:50:09+00:00,2024-07-18 17:03:44
413,Future Industry Growth of Railway Infrastructure Maintenance,"... CSX Transportation, West Japan Railway Company, Norfolk Southern ... ⥤ The report provides an extensive corporate profile consisting of company ...",www.openpr.com,2024-07-18 11:23:53+00:00,2024-07-18 17:03:44
414,Union Pacific Increases Quarterly Dividend From $1.30 To $1.34 Per Share - Quantisnow,Shares of railroad companies are trading higher amid possible optimism that the Fed will cut rates. 7/16/24 1:30:51 PM ET. $CSX- $NSC- $UNP.,quantisnow.com,2024-07-18 07:24:43+00:00,2024-07-18 17:03:44
415,Electric vehicle manufacturer Cenntro fell short of production goals | Jax Daily Record,"... companies reporting their second-quarter results. Normally, Jacksonville-based railroad company CSX Corp. is one of the first companies to report ...",www.jaxdailyrecord.com,2024-07-18 04:37:39+00:00,2024-07-18 17:03:44
416,Intermodal Freight Transportation Market Share,Intermodal Freight Transportation Market Companies- Union Pacific Railroad- CSX Transportation- BNSF Railway Company (a subsidiary of Berkshire ...,www.gminsights.com,2024-07-17 21:27:11+00:00,2024-07-18 17:03:44
417,General Electric AC6000CW locomotives: Where are they now? - Trains Magazine,The company heavily modified CSX No. 656 into a rolling entertainment center for guests of the railroad and renumbered it ACWR No. 87. Some of the ...,www.trains.com,2024-07-18 16:31:59+00:00,2024-07-18 18:03:39
418,CSX Recognized as Top-Performing Finished Vehicle Transport by Hyundai GLOVIS,CSX's relationship with Hyundai is longstanding. The rail company has served Hyundai Motor Manufacturing Alabama since 2005 and Kia Motors ...,www.csx.com,2024-07-18 17:46:19+00:00,2024-07-18 19:03:57
419,These 10 U.S. states have America's best economies in 2024 - NBC10 Philadelphia,"Kicking off the company's construction of a planned 218-mile high ... Major Corporate Headquarters: CSX, Carnival. on now. 12PM: NBC10 News ...",www.nbcphiladelphia.com,2024-07-18 16:20:16+00:00,2024-07-18 19:03:57
420,"Rail Transport Market Report 2024: Size, Share, Growth, Trends, Forecast 2033","... CSX Corporation, Central Japan Railway Company, Canadian National ... LinkedIn: https://in.linkedin.com/company/the-business-research-company",www.openpr.com,2024-07-18 19:23:16+00:00,2024-07-18 20:03:38
421,Shinola to open new hotel in downtown Indianapolis - HOTELSMag.com,"... CSX building in downtown Indianapolis into a $300 million, new multi ... A long-time partner in Indianapolis' music scene, the company employs more than ...",hotelsmag.com,2024-07-18 18:56:13+00:00,2024-07-18 20:03:38
422,"Reach, More Innovation: Syncron's Connected Service Experience now on AWS Marketplace","By leveraging our CSX platform, companies can unlock the deep value of ... company(s) or engage in any investment activity under discussion.",kalkinemedia.com,2024-07-18 18:53:55+00:00,2024-07-18 20:03:38
423,Weedsport man struck-and-killed train in Onondaga County - Fingerlakes1.com,State Police said 48-year-old Matthew Jones was hit near the CSX railroad tracks by Newport Road and Warners around 4:47 p.m. ... The company was ...,www.fingerlakes1.com,2024-07-18 18:17:20+00:00,2024-07-18 20:03:38
424,These 10 U.S. states have America's best economies in 2024 - NBC Connecticut,"Kicking off the company's construction of a planned 218-mile high ... Major Corporate Headquarters: CSX, Carnival. 33+ actually good Amazon ...",www.nbcconnecticut.com,2024-07-18 16:13:52+00:00,2024-07-18 20:03:38
425,6th Circ. Is No Help To CSX Worker Fired For Train Death Post - Law360,The Sixth Circuit ruled Thursday that a former CSX Transporation Inc. engineer waited too long to try to revive his wrongful termination suit ...,www.law360.com,2024-07-18 22:52:57+00:00,2024-07-19 00:03:40
426,One for the Road Boys LLC vs CSX Transportation | Legal Ads | sullivan-times.com,"Plaintiff,. vs. CSX TRANSPORTATION, INC.,. UNION PACIFIC RAILROAD COMPANY,. AND ALL THEIR UNKNOWN. SUCCESSORS, ASSIGNS, AND ANY. AND ...",www.sullivan-times.com,2024-07-19 10:17:10+00:00,2024-07-19 12:03:36
427,"Shinola hotel, music venue may replace downtown Indy CSX warehouse - IndyStar","Populus, the company that designed the Las Vegas Sphere, will design the venue. Designers will construct the project to be ""complimentary to and ...",www.indystar.com,2024-07-19 09:25:37+00:00,2024-07-19 12:03:36
428,CleanSpace Reports Strong Revenue and Stock Surge - TipRanks.com,"(CSX) has experienced a notable increase in stock prices, from $0.315 ... The company attributes these movements to its recently announced ...",www.tipranks.com,2024-07-19 06:09:15+00:00,2024-07-19 12:03:36
429,"Market Update (7/18/2024) - S&amp;P 500: 0% - Winners: MKC.V, XEL, AOS - Losers: GATX, RHHBY, AM","Company. Return. Chart. 10-K. 1, McCormick & company (MKC.V), 0.01%, chart ... CSX (CSX), 0%, chart- 10-k. 7, Option Care Health (OPCH), 0%, chart- 10 ...",www.trefis.com,2024-07-19 08:49:01+00:00,2024-07-19 13:03:37
430,Closing Bell: Local markets fell on Friday with ASX 200 down 64 pts | The Chronicle,Cleanspace (ASX:CSX) is killing it after a cracking FY24 sales ... company's Golden Ridge project. Exploration has revealed a gold vein ...,www.thechronicle.com.au,2024-07-19 08:00:43+00:00,2024-07-19 13:03:37
431,Closing Bell: Local markets fell on Friday with ASX 200 down 64 pts - Stockhead,"Chariot Corporation, 0.155, 19%, 116,289, $11,651,622. CSX, Cleanspace Holdings, 0.590, 93%, 282,465, $23,594,721. E25, Element 25 Ltd, 0.250, 19% ...",stockhead.com.au,2024-07-19 07:14:03+00:00,2024-07-19 13:03:37
432,"Train burglarized in in Hyde Park neighborhood, MPD says | News | fox13memphis.com",Several CSX railway workers told police that they had reported the ... Escalating disruptions continued hours after the technology company ...,www.fox13memphis.com,2024-07-19 15:25:38+00:00,2024-07-19 16:03:49
433,"Robert Lee &quot;Bob&quot; Clevenger Sr. Obituary (2024) - Troy, NY - Simple Choices, Inc. Cremation Service","Bob loved the natural beauty and quiet of West Virginia. After thirty years of welding at CSX Railroad in Selkirk, he returned home to care for his ...",www.legacy.com,2024-07-19 14:57:58+00:00,2024-07-19 16:03:49
434,Hyundai GLOVIS honors CSX as a top vehicle transport service provider,"Railroad industry news about: CSX, Hyundai GLOVIS, Club Elite award ... Company Type (Select One)*, Class 1 Railroad, Rail Transit, Regional ...",www.progressiverailroading.com,2024-07-19 14:40:01+00:00,2024-07-19 16:03:49
435,'Largest IT outage in history' leaves world reeling - CNBC,"The company's CEO George Kurtz has since said that the company is ... Other major railroad companies Norfolk Southern , BNSF and CSX told ...",www.cnbc.com,2024-07-19 14:37:36+00:00,2024-07-19 16:03:49
