,Heading,Subheading,Publisher,Published,Found
436,CSX Worker Who Posted About Crash Can't Revive Suit Over Firing - Bloomberg Law News,A former locomotive engineer with CSX Transportation Inc. lost his bid to revive a lawsuit challenging the company's decision to fire him because ...,news.bloomberglaw.com,2024-07-19 13:50:22+00:00,2024-07-19 16:03:49
437,Partial Revocation Order Granted - TheNewswire,(“Clean Seed” or the “Company”)(NEX: CSX.H) has applied for and received from the British Columbia Securities Commission (“BCSC”) a partial ...,www.thenewswire.com,2024-07-19 13:02:05+00:00,2024-07-19 16:03:49
438,On track: Understanding rail investment - BusinessDesk,"If you can achieve this (like CSX has on the east coast of the US), then this is the holy grail. Measuring efficiency. When we look at rail companies, ...",businessdesk.co.nz,2024-07-19 17:05:52+00:00,2024-07-19 18:03:38
439,Digging Into Mohnish Pabrai's Coal Portfolio - Forbes,"Pabrai started his investing journey after selling his IT consulting company, Transtech, for $20 million in 2000. ... company relies on the CSX Curtis ...",www.forbes.com,2024-07-19 16:32:35+00:00,2024-07-19 18:03:38
440,Clean Seed Capital Advances with Private Placement - TipRanks.com,"Clean Seed Capital (TSE:CSX.H) has released an update. Clean Seed Capital ... Company to raise $250,000 for financial compliance and operations.",www.tipranks.com,2024-07-19 13:43:53+00:00,2024-07-19 18:03:38
441,"How Microsoft, CrowdStrike IT outage is hitting global supply chain - CNBC","Other major freight operators, including CSX, Norfolk Southern and ... Maritime intelligence company Kpler told CNBC early indications showed ...",www.cnbc.com,2024-07-19 17:55:26+00:00,2024-07-19 19:03:39
442,Global tech outage largely bypasses freight and passenger railroads - FreightWaves,... Company Earnings- Truck Driver Issues- Trade and ... BNSF Railway and CSX said their systems were not affected and that operations were normal.,www.freightwaves.com,2024-07-19 15:08:35+00:00,2024-07-19 20:03:40
443,Global tech outage largely bypasses freight and passenger railroads - Trains Magazine,"BNSF Railway, Canadian National, and CSX said their systems were not affected and that operations were normal. ... company. How does this happen ...",www.trains.com,2024-07-20 02:33:51+00:00,2024-07-20 04:03:32
444,CSX Corp. stock underperforms Friday when compared to competitors - MarketWatch,"Company Close Updates. CSX Corp. stock underperforms Friday when ... CSX dropped 0.94% to $34.69 Friday, on what proved to be an all-around ...",www.marketwatch.com,2024-07-19 22:52:22+00:00,2024-07-20 04:03:32
445,CSX's 52-Week Rollercoaster: From $29.03 to $40.12 – What's Next for Investors?,"CSX Corp. had a pretty favorable run when it comes to the market performance. Over the past year, the company's stock reached a high of $40.12 on ...",investchronicle.com,2024-07-20 07:02:21+00:00,2024-07-20 20:03:35
446,UPDATE 1-White House renews pressure on railroads over paid sick leave - Yahoo Sports,"... companies will do more for their workers, a second White House official said. CSX announced on Tuesday that it had reached a deal with two railroad ...",ca.sports.yahoo.com,2024-07-20 22:05:33+00:00,2024-07-21 03:03:37
447,Railroad crossing maintenance begins Monday in Fayette County - Herald-Standard,"Routes in several Fayette County municipalities will be closed over the next three weeks as crews from CSX or Hennessey & Company, Inc. will be ...",www.heraldstandard.com,2024-07-21 04:02:07+00:00,2024-07-21 06:03:38
448,"Train derailment in Fredericksburg, Virginia, police investigate - WUSA9",The CSX will be taking over the investigation from Fredericksburg Police. ... Company Logo. 'Do Not Sell or Share My Personal Information' Notice.,www.wusa9.com,2024-07-21 05:43:21+00:00,2024-07-21 07:03:52
449,10 policies if Trump wins and stock implications: Jefferies - Investing.com,"Company News. Your Q2 Earnings Guide: Discover the Stocks ProPicks ... ), CSX Corp (NASDAQ:CSX), Norfolk Southern Corp (NYSE:NSC), eBay Inc ...",www.investing.com,2024-07-21 10:23:56+00:00,2024-07-21 12:03:36
450,"Freight train cars derail, striking wall that collapsed garage buildings in Fredericksburg, Va.","... CSX freight train derailed in Fredericksburg, Virginia, on Saturday ... Company Logo. Your Opt Out Preference Signal is Honored. Do Not Sell or ...",wtop.com,2024-07-21 13:52:18+00:00,2024-07-21 15:03:41
451,CSX Freight Train derails in Fredericksburg causing damage to garages | WRIC ABC 8News,"According to police, CSX will be taking over the investigation. Copyright 2024 Nexstar Media Inc. All rights reserved. This material may not be ...",www.wric.com,2024-07-21 12:24:54+00:00,2024-07-21 15:03:41
452,"Train derailment in Virginia damages garages, no injuries reported - The National Desk","CSX released a statement on the incident saying that it ""appreciates ... company outside the Harbor Boulevard entrance Monday, July 1, 2024 ...",thenationaldesk.com,2024-07-21 14:52:04+00:00,2024-07-21 16:03:40
453,"Train derailment in Virginia damages garages, no injuries reported - ABC 33/40","... Company Heart of Education Awards- KidCam. On ABC 33/40 arrow symbol ... CSX released a statement on the incident saying that it ""appreciates ...",www.abc3340.com,2024-07-21 14:44:15+00:00,2024-07-21 16:03:40
454,"Train derailment in Virginia damages garages, no injuries reported - Fox28 Savannah",News. ICE captures Salvadoran migrant convicted of sex crime against Virginia minor- Company ... CSX released a statement on the incident saying that ...,fox28savannah.com,2024-07-21 14:46:57+00:00,2024-07-21 17:03:40
455,Train Flattens Garage In Fredericksburg Derailment: Authorities - Patch,"""CSX appreciates the swift response of the Fredricksburg City first responders,"" the rail company said in a prepared statement. ""The safety of ...",patch.com,2024-07-21 22:52:00+00:00,2024-07-22 00:03:36
456,"CSX train derails, damaging garages at residential complex (updated) - Trains Magazine","Several structures were damaged as a result of this CSX derailment in Fredericksburg, Va., on Saturday, July 20. Fredericksburg Police Department ...",www.trains.com,2024-07-22 14:23:22+00:00,2024-07-22 16:03:41
457,Look Under The Hood: EFIV Has 10% Upside - Nasdaq,"SPDR S&P 500 ESG ETF, EFIV, $53.76 ; Charles River Laboratories International Inc. CRL, $218.24 ; CSX Corp, CSX, $34.69 ; AT&T Inc, T- $19.12 ...",www.nasdaq.com,2024-07-22 12:42:13+00:00,2024-07-22 16:03:41
458,CSX (NASDAQ:CSX) Has Announced A Dividend Of $0.12 - Simply Wall St News,CSX Corporation's ( NASDAQ:CSX ) investors are due to receive a payment of $0.12 per share on 13th of September. This...,simplywall.st,2024-07-22 12:11:13+00:00,2024-07-22 16:03:41
459,Weekly Upgrades and Downgrades - InvestorPlace,"After taking a close look at the latest data on institutional buying pressure and each company's ... CSX Corporation, C, C, C. DASH, DoorDash, Inc.",investorplace.com,2024-07-22 16:47:11+00:00,2024-07-22 18:03:37
460,"Nicolet Advisory Services LLC Invests $240,000 in Ollie's Bargain Outlet Holdings, Inc ...",Corporate insiders own 0.87% of the company's stock. Ollie's ... Intech Investment Management LLC Decreases Holdings in CSX Co. (NASDAQ ...,www.defenseworld.net,2024-07-22 16:25:06+00:00,2024-07-22 18:03:37
461,Train car derails crashing into a garage on Seneca Avenue in Niagara Falls - WGRZ-TV,"We have reached out to CSX for any comment, and to see if a conductor ... Company Logo. 'Do Not Sell or Share My Personal Information' Notice.",www.wgrz.com,2024-07-22 16:24:23+00:00,2024-07-22 18:03:37
462,Watch: Officials investigate train that crashed into Niagara Falls garage - YouTube,"CSX train jumps tracks, crashes into garage in Niagara Falls. WKBW TV ... Frito-Lay Worker Electrocuted, Denied Medical Care & Surveilled by Company ...",www.youtube.com,2024-07-22 15:56:15+00:00,2024-07-22 19:03:36
463,Wilmington CSX Rail Work - WWAYTV3,"Wilmington CSX Rail Work. 1 hour ago. WWAY News,. Railroad Crossing ... Corporate Philanthropy- Meet The News Team- Advertise With WWAY- Creative ...",www.wwaytv3.com,2024-07-22 18:55:43+00:00,2024-07-22 20:03:39
464,No one hurt when CSX locomotive derails and strikes residential garage in Niagara Falls,CSX says one of its locomotives derailed and struck a residential garage in Niagara Falls ... Kerle Tire Company Inc. Kerle Tire Company Inc. St ...,www.thederrick.com,2024-07-22 18:41:15+00:00,2024-07-22 20:03:39
465,No one hurt when CSX locomotive derails and strikes residential garage in Niagara Falls,CSX says one of its locomotives derailed and struck a residential garage in Niagara Falls. ... The Walt Disney Company Logo. Notice of Right to Opt Out ...,abcnews.go.com,2024-07-22 18:37:39+00:00,2024-07-22 20:03:39
466,No one hurt when CSX locomotive derails and strikes residential garage in Niagara Falls,CSX says one of its locomotives derailed and struck a residential garage in Niagara Falls ... Over the last few weeks Herr and Company have been putting ...,www.dnronline.com,2024-07-22 18:34:04+00:00,2024-07-22 20:03:39
467,No one hurt when CSX locomotive derails and strikes residential garage in Niagara Falls,CSX says one of its locomotives derailed and struck a ... Our CompanyCareersOur Use of AIEthics PolicyAnnual DEI ReportHearst Connecticut Jobs.,www.newstimes.com,2024-07-22 18:25:35+00:00,2024-07-22 20:03:39
468,No one hurt when CSX locomotive derails and strikes residential garage in Niagara Falls,"Your use of our site is deemed your consent. Continue. Company Logo. Do Not Sell My Personal Information. When you visit our website, we store ...",mynorthwest.com,2024-07-22 18:23:21+00:00,2024-07-22 20:03:39
469,Derailed Train Engine Crashes Into Residential Garage in Niagara Falls - Yahoo News UK,... company confirmed.Footage filmed by photographer Robert Bennett shows the CSX Transportation engine and the collapsed garage on 35th Street on ...,uk.news.yahoo.com,2024-07-22 20:33:22+00:00,2024-07-22 21:03:46
470,"CSX train derails in upstate NY, crashes into home. See video of the aftermath","The rail company did not immediately answer questions Monday about the train's operation, cargo, or the company's use of remote operation, in general.",www.democratandchronicle.com,2024-07-22 20:20:32+00:00,2024-07-22 21:03:46
471,"Pilot, 26, dies moments after releasing skydivers near Niagara Falls - Yahoo News UK","“I really feel bad for the business and the company she was working for, because they're a great company. ... CSX Transportation rail yard. Only ...",uk.news.yahoo.com,2024-07-22 20:19:16+00:00,2024-07-22 21:03:46
472,"Freight locomotive runs off tracks, flattens garage at home in Niagara Falls - SCNow",CSX says one of its locomotives derailed and struck a residential garage in Niagara Falls ... The rail company said state and local authorities ...,scnow.com,2024-07-22 20:15:58+00:00,2024-07-22 21:03:46
473,No one hurt when CSX locomotive derails and strikes residential garage in Niagara Falls,"CSX says one of its locomotives derailed and struck a residential garage in Niagara Falls ... Inc 2345 Maxon Rd. Ext., Schenectady, NY | Terms of Use | ...",www.dailygazette.com,2024-07-22 20:00:55+00:00,2024-07-22 21:03:46
474,"Freight locomotive runs off tracks, flattens garage at home in Niagara Falls | National","CSX says one of its locomotives derailed and struck a residential garage in Niagara Falls ... COMPANY, INC 2016 | Terms of Use | Privacy Policy. Powered ...",www.caledonianrecord.com,2024-07-22 19:49:56+00:00,2024-07-22 21:03:46
475,"Freight locomotive runs off tracks, flattens garage at home in Niagara Falls - The Record",No one hurt when CSX locomotive derails and strikes residential garage in Niagara Falls ... The rail company said state and local authorities ...,www.therecord.com,2024-07-22 19:41:44+00:00,2024-07-22 21:03:46
476,No one hurt when CSX locomotive derails and strikes residential garage in Niagara Falls,"CSX says one of its locomotives derailed and struck a residential garage in Niagara Falls ... Inc Rsvp | Clinton, IL- Thu. 18. Theatre Shows. Penn ...",www.wandtv.com,2024-07-22 19:40:38+00:00,2024-07-22 21:03:46
477,No one hurt when CSX locomotive derails and strikes residential garage in Niagara Falls,"... Contests & Promotions. Download Our Apps. Available for iOS and Android KTVZ News App KTVZ Weather App. © 2024, NPG of Oregon, Inc. Bend, OR USA .",ktvz.com,2024-07-22 19:23:54+00:00,2024-07-22 21:03:46
478,No one hurt when CSX locomotive derails and strikes residential garage in Niagara Falls,"Company Logo. About Your Privacy Choices. We and our 379 partners store and/or access information on your device, such as unique IDs in cookies to ...",apnews.com,2024-07-22 18:26:21+00:00,2024-07-22 21:03:46
479,No one hurt when CSX locomotive derails and strikes residential garage in Niagara Falls,CSX says one of its locomotives derailed and struck a residential garage in Niagara Falls. ... Company. About The Post- Newsroom Policies & Standards ...,www.washingtonpost.com,2024-07-22 18:25:24+00:00,2024-07-22 21:03:46
480,"Video shows aftermath from train derailing, crashing into New York garage - USA Today","The train derailed near Seneca Avenue in Niagara, New York, CSX said, with the crash damaging a residential garage and spilling diesel fuel.",www.usatoday.com,2024-07-22 21:17:05+00:00,2024-07-22 22:03:36
481,No one hurt when CSX locomotive derails and strikes residential garage in Niagara Falls,LOCAL SPOTLIGHT: Which DC-area restaurants made RAMMYs' best of the best this year? Close alert. EXCLUSIVE: Prince George's Co. school board member ...,wtop.com,2024-07-22 19:49:36+00:00,2024-07-22 22:03:36
482,No one hurt when CSX locomotive derails and strikes residential garage in Niagara Falls,CSX says one of its locomotives derailed and struck a residential ... Quincy security company receives F rating from Better Business Bureau.,www.whig.com,2024-07-22 18:35:56+00:00,2024-07-22 22:03:36
483,"Train derails, hits garage in Niagara Falls | News 4 Buffalo - WIVB",... CSX employee. The train went through a [ ... Inc. | All Rights Reserved. ✕. Nexstar Logo. Do Not Sell or Share My Personal Information. Your Opt ...,www.wivb.com,2024-07-22 22:10:09+00:00,2024-07-22 23:03:41
484,No one hurt when CSX locomotive derails and strikes residential garage in Niagara Falls,"... CSX said in an emailed statement. The rail company said state and local authorities, along with the Environmental Protection Agency, were notified.",www.msn.com,2024-07-22 21:54:46+00:00,2024-07-22 23:03:41
485,"Video shows aftermath from train derailing, crashing into New York garage","... CSX said, with the crash damaging a residential garage and spilling diesel fuel ... “I really feel bad for the business and the company she was working ...",ca.news.yahoo.com,2024-07-22 21:12:12+00:00,2024-07-22 23:03:41
486,"Freight locomotive runs off tracks, flattens garage at home in Niagara Falls - WAND-TV","... Csx Locomotive Derails Garage Niagara Falls- Accidents- Business- U.s. ... Inc Rsvp | Clinton, IL- Thu. 18. Theatre Shows. Penn Station | Arthur, IL ...",www.wandtv.com,2024-07-22 20:40:22+00:00,2024-07-23 00:03:38
487,Train crashes into garage in Niagara Falls; no injuries - Buffalo News,A CSX locomotive derailed near Seneca Avenue in Niagara Falls this ... A Trump-owned company sells $299 sneakers with an image of his bloodied face ...,buffalonews.com,2024-07-22 19:18:53+00:00,2024-07-23 00:03:38
488,CSX train jumps tracks and crashes into garage in Niagara Falls - WKBW,"Copyright 2024 Scripps Media, Inc. All rights reserved. This material may not be published, broadcast, rewritten, or redistributed. A Voice For ...",www.wkbw.com,2024-07-23 02:54:10+00:00,2024-07-23 04:03:42
489,"Freight locomotive runs off tracks, flattens garage at home in Niagara Falls","... CSX Transportation rail yard. Only ... “I really feel bad for the business and the company she was working for, because they're a great company.",ca.news.yahoo.com,2024-07-23 00:29:07+00:00,2024-07-23 04:03:42
490,Train crashes into a Niagara Falls home garage — for the second time,"The CSX locomotive reportedly jumped the rail at about 8:15 a.m. Monday, striking a garage behind the home … Marcus Gillebaard, a North Tonawanda ...",boingboing.net,2024-07-23 00:01:58+00:00,2024-07-23 04:03:42
491,"Freight locomotive runs off tracks, flattens garage at home in Niagara Falls - Butler Eagle",The detached garage sits just a few feet from the end of a short rail spur at a CSX Transportation rail yard. ... Eagle Printing Company- Contact ...,www.butlereagle.com,2024-07-22 22:29:28+00:00,2024-07-23 04:03:42
492,"Video shows aftermath from train derailing, crashing into New York garage - MSN","The train derailed near Seneca Avenue in Niagara, New York around 8:30 a.m. Monday, CSX said, with the crash damaging a residential garage and ...",www.msn.com,2024-07-23 02:21:05+00:00,2024-07-23 06:03:37
493,CleanSpace Holdings Eyes Stock Quotation Boost - TipRanks.com,CleanSpace Holdings Ltd. (AU:CSX) has released an update. CleanSpace Holdings Limited has announced a new application for the quotation of 18750 ...,www.tipranks.com,2024-07-23 07:34:39+00:00,2024-07-23 09:03:43
494,"T&amp;E headcount is up from a year ago, but below 2019 as railroads dial in performance, growth",CSX has offset fewer domestic coal moves with a shift to export coal and business gains in intermodal and merchandise. The railroad's volume through ...,www.trains.com,2024-07-23 10:14:19+00:00,2024-07-23 12:03:42
495,CSX expected to provide update on city train derailment - Fredericksburg.com,A CSX Transportation freight train ... A Trump-owned company sells $299 sneakers with an image of his bloodied face after rally shooting.,fredericksburg.com,2024-07-23 09:00:49+00:00,2024-07-23 12:03:42
496,What To Expect From Norfolk Southern's Q2? - Trefis,"... company should see a slight rise in sales y-o-y, higher costs will ... Which Is A Better Railroad Pick – Norfolk Southern Stock Or CSX? Will ...",www.trefis.com,2024-07-23 14:49:39+00:00,2024-07-23 16:03:39
497,"Train runs off tracks, flattens garage at N.Y. home - PennLive.com","The rail company said state and local authorities, along with the Environmental Protection Agency, were notified. CSX said the cause of the derailment ...",www.pennlive.com,2024-07-23 11:00:35+00:00,2024-07-23 16:03:39
498,Sen. Ortt raises questions after Niagara Falls train derailment - Spectrum News,I will be seeking answers to those questions from CSX as to avoid a deadly incident of this magnitude moving forward. ... The rail company said ...,spectrumlocalnews.com,2024-07-23 15:35:09+00:00,2024-07-23 17:03:46
499,SBB Cargo Orders 20 Vectron Locomotives from Siemens Mobility | Railway-News,"Class I freight railroad company, CSX has expanded its partnership with Siemens Mobility to implement digital solutions for freight rail. Germany: 18 ...",railway-news.com,2024-07-23 12:06:06+00:00,2024-07-23 18:03:44
500,Nicolet Advisory Services LLC Buys Shares of 675 The Cigna Group (NYSE:CI),... company in its most recent filing with the Securities and Exchange Commission. ... Intech Investment Management LLC Decreases Holdings in CSX Co. ( ...,www.defenseworld.net,2024-07-22 21:18:50+00:00,2024-07-23 19:03:38
501,Garage Hit By Derailed Train For The Second Time - Jalopnik,"Suggested Reading. Almost All Ice Cream Truck Music Is Controlled By One Company ... CSX is investigating the derailment's cause and stated, “Our ...",jalopnik.com,2024-07-23 19:51:42+00:00,2024-07-23 22:03:44
502,"Pilot, 26, dies moments after releasing skydivers near Niagara Falls - Yahoo News UK","“I really feel bad for the business and the company she was working for, because they're a great company. ... CSX and its contractors are ...",uk.news.yahoo.com,2024-07-23 07:47:24+00:00,2024-07-23 22:03:44
503,US close: Stocks lower as Q2 tech earnings come into focus - Sharecast.com,"Travelers Company Inc. (TRV)$208.491.51% Goldman Sachs Group Inc. (GS) ... CSX Corp. (CSX)$33.64-2.52% JD.com, Inc. (JD)$26.19-2.46% Trip.com ...",www.sharecast.com,2024-07-23 21:31:02+00:00,2024-07-23 23:03:38
504,'Doing what she loved': Skydive pilot killed in plane crash near Niagara Falls,"She was doing what she loved, flying for a local skydiving company, when her plane crashed,"" Paul wrote. ... CSX train jumps tracks, crashes into garage ...",ca.news.yahoo.com,2024-07-23 00:16:34+00:00,2024-07-23 23:03:38
505,Canadian National (CNI) Q2 Earnings and Revenues Lag Estimates - Nasdaq,"Over the last four quarters, the company has surpassed consensus EPS estimates two times. ... CSX Corporation (CSX) : Free Stock Analysis Report- To ...",www.nasdaq.com,2024-07-23 22:46:09+00:00,2024-07-24 00:03:45
506,"Reading &amp; Northern promotes Busher to vice-president, real estate - Trains Magazine",She also oversees the publication of the company's quarterly ... CSX unveils heritage locomotive celebrating Chicago & Eastern Illinois Railroad.,www.trains.com,2024-07-23 22:01:40+00:00,2024-07-24 00:03:45
507,Ortt: questions remain following Falls train derailment | News - niagara-gazette.com,"In his statement, Ortt also indicated that he planned to follow up with CSX Transportation, the company that operates freight rail lines in the ...",www.niagara-gazette.com,2024-07-24 00:27:54+00:00,2024-07-24 01:03:47
508,Rushed railcar inspections and 'stagnated' safety record reinforce concerns after fiery Ohio crash,"None of the CEOs of the major railroads — which include Norfolk Southern, CSX ... Our CompanyCareersOur Use of AIEthics Policy. Contact. Contact Us.",www.beaumontenterprise.com,2024-07-24 00:05:19+00:00,2024-07-24 01:03:47
509,"Homeowners 'a wreck' after CSX train jumps tracks, crashes into garage - Spectrum News","A statement from CSX said the company is working with authorities to investigate the derailment and added, “Our primary focus right now is the ...",spectrumlocalnews.com,2024-07-23 23:34:52+00:00,2024-07-24 01:03:47
510,Joseph Alfonza Jackson Charged With Malicious Wounding In VA - Daily Voice,"Fredericksburg CSX Train Derailment: What We Know Fredericksburg CSX ... Job Title, Keyword or Company. Please enter at least 3 characters for ...",dailyvoice.com,2024-07-24 00:38:33+00:00,2024-07-24 04:03:50
511,Rushed railcar inspections and 'stagnated' safety record reinforce concerns after fiery Ohio crash,"None of the CEOs of the major railroads — which include Norfolk Southern, CSX ... A Hubbard Broadcasting Company. NBC- Me TV.",www.whec.com,2024-07-24 00:34:10+00:00,2024-07-24 04:03:50
512,Rushed railcar inspections and 'stagnated' safety record reinforce concerns after fiery Ohio crash,"None of the CEOs of the major railroads — which include Norfolk Southern, CSX ... Company Logo. About Your Privacy Choices. We and our 379 partners ...",apnews.com,2024-07-24 00:25:46+00:00,2024-07-24 04:03:50
513,CSX Corp. stock underperforms Tuesday when compared to competitors - MarketWatch,"Company Close Updates. CSX Corp. stock underperforms Tuesday when ... CSX slipped 2.52% to $33.64 Tuesday, on what proved to be an all-around ...",www.marketwatch.com,2024-07-23 23:01:27+00:00,2024-07-24 04:03:50
514,US close: Stocks lower as Q2 tech earnings come into focus - Research the market - Halifax,"$186.50 4.24% Travelers Company Inc. (TRV) $208.49 1.51% Goldman Sachs ... CSX Corp. (CSX) $33.64 -2.52% JD.com, Inc. (JD) $26.19 -2.46% Trip ...",www.investments.halifax.co.uk,2024-07-24 03:32:57+00:00,2024-07-24 05:03:53
515,"&quot;It sucks, its horrible&quot; - drivers and first responders express frustration over parked trains ...","CSX transportation, and the Indiana Rail Road both operate hundreds of ... Man accused of making threatening phone calls - from the Parke Co.",www.wthitv.com,2024-07-24 03:31:19+00:00,2024-07-24 05:03:53
516,New zoning sought for development near airport - Marysville Journal-Tribune,... CSX railroad tracks and Weaver Road. Officials from the New Albany Company have said they would like the land rezoned as part of a Planned Unit ...,www.marysvillejt.com,2024-07-24 02:59:10+00:00,2024-07-24 05:03:53
517,Rushed railcar inspections and 'stagnated' safety record reinforce concerns after fiery Ohio crash,"None of the CEOs of the major railroads — which include Norfolk Southern, CSX ... Our CompanyCareersOur Use of AIEthics PolicyAnnual DEI Report ...",www.stamfordadvocate.com,2024-07-24 00:47:16+00:00,2024-07-24 05:03:53
518,Rushed railcar inspections and 'stagnated' safety record reinforce concerns after fiery Ohio crash,"None of the CEOs of the major railroads — which include Norfolk Southern, CSX ... © 2024 Edwardsville Publishing Company, LLCPrivacy Notice ...",.google.com,2024-07-24 00:31:00+00:00,2024-07-24 06:03:45
519,Ortt: questions remain following Niagara Falls train derailment | News | lockportjournal.com,"In his statement, Ortt indicated that he planned to follow up with CSX Transportation, the company that operates freight rail lines in the Eastern ...",www.lockportjournal.com,2024-07-24 08:07:52+00:00,2024-07-24 10:03:52
520,"'Come Get Me:' Intoxicated Man Called Dispatch, Asked To Be Arrested In Stafford, Sheriff Says","Fredericksburg CSX Train Derailment: What We Know Are You Running A Local Business? ... Job Title, Keyword or Company. Please enter at least 3 ...",dailyvoice.com,2024-07-24 06:03:10+00:00,2024-07-24 10:03:52
521,US close: Stocks lower as Q2 tech earnings come into focus - Redmayne Bentley,"... Company Inc. (TRV) $208.49 1.51% Goldman Sachs Group Inc. (GS) $491.09 ... CSX Corp. (CSX) $33.64 -2.52% JD.com, Inc. (JD) $26.19 -2.46% Trip ...",www.redmayne.co.uk,2024-07-24 02:59:25+00:00,2024-07-24 10:03:52
