,Heading,Subheading,Publisher,Published,Found
175,"CSX Corp. stock rises Tuesday, still underperforms market - MarketWatch","Company Close Updates. CSX Corp. stock rises Tuesday, still underperforms market. Published: July 2, 2024 at 4:48 p.m. ET. By. MarketWatch Automation.",www.marketwatch.com,2024-07-02 23:27:09+00:00,2024-07-03 06:03:35
176,"CSX Corp. stock rises Tuesday, still underperforms market - MarketWatch","closed $6.36 short of its 52-week high ($40.12), which the company achieved on February 23rd. The stock outperformed some of its competitors Tuesday, ...",www.marketwatch.com,2024-07-02 23:27:07+00:00,2024-07-03 06:03:35
177,5 Broker-Loved Stocks to Keep an Eye on in the Current Scenario - Yahoo Finance,CSX Corporation (CSX) Quarterly Results Surpassed Expectations. 10 minutes ago. WWD. Design Shanghai's New Collectible Art Fair to Bow in October. 10 ...,sg.finance.yahoo.com,2024-07-02 16:27:45+00:00,2024-07-03 08:03:35
178,"TKO Invests In NFL, RedBird Joint Venture As It Inks Sunday Ticket Deal - Yahoo Finance","TKO Group Holdings, the parent company of UFC and the WWE, which is ... CSX Corporation (CSX) Quarterly Results Surpassed Expectations. 10 ...",uk.finance.yahoo.com,2024-07-02 16:28:35+00:00,2024-07-03 15:03:46
179,Indian food truck open for business in Clark County - Dayton Daily News,"BreakingNews. Woman struck, killed by CSX train in Dayton- dayton-daily-news logo. Local- Business- Investigations- Opinion- Life- Food- Sports ...",www.daytondailynews.com,2024-07-03 11:49:39+00:00,2024-07-03 16:03:44
180,BlackRock Income and Growth Investment Trust Plc - Transaction in Own Shares,"In accordance with Listing Rule 12.4.6, BlackRock Income and Growth Investment Trust plc (the Company) ... CSX Corporation (CSX) Quarterly Results ...",uk.finance.yahoo.com,2024-07-02 16:28:35+00:00,2024-07-03 16:03:44
181,Dayton issues demolition and residential permits for former church site,"BreakingNews. Woman struck, killed by CSX train in Dayton- dayton ... Sometimes, an entity can create an limited liability company that owns ...",www.daytondailynews.com,2024-07-03 11:03:23+00:00,2024-07-03 17:03:56
182,12 Best Dividend Stocks Under $25 - Insider Monkey,"Hedge Fund Investor Letters Q1 2024 Hedge Fund and Insider Trading News: Bill Ackman, David Einhorn, Saba Capital... CSX Corporation (CSX) Quarterly ...",www.insidermonkey.com,2024-07-03 14:03:06+00:00,2024-07-03 18:03:54
183,Wall Street Analyst Initiated CSX Corp. [CSX]. What else is Wall St. saying - The DBT News,"BLACKROCK INC., holding 1.04 billion shares of the stock with an approximate value of $178.43 billion in CSX stocks shares; and BERKSHIRE HATHAWAY INC ...",dbtnews.com,2024-07-03 10:49:13+00:00,2024-07-03 18:03:54
184,Dividend Aristocrats Ranked By Yield: Top 10 - Insider Monkey,"The American energy company manufactures and sells fuels, additives, petrochemicals, and lubricants. ... CSX Corporation (CSX) Quarterly Results ...",www.insidermonkey.com,2024-07-03 14:42:17+00:00,2024-07-03 19:03:48
185,Railroad crossing in Slaughters to be closed July 16 - WEHT,Officials say CSX Railroad plans to close the KY 138 railroad ... Copyright 2024 Nexstar Media Inc. All rights reserved. This material ...,www.tristatehomepage.com,2024-07-03 18:19:49+00:00,2024-07-03 20:04:01
186,Recent Central Florida bankruptcies - Orlando Sentinel,"Assets: $310,000. Liabilities: $708,089. Major creditors: CSX Transportation Inc., Atlanta, $170,761; Bus & Truck Repair, Orlando, $16,193; Capital ...",www.orlandosentinel.com,2024-07-03 19:59:44+00:00,2024-07-03 21:03:45
187,Train cars derail in Mattawamkeag | newscentermaine.com,"Two box cars of a CSX train derailed, causing a ... Notifications can be turned off anytime in the browser settings. No Thanks Allow. Company Logo ...",www.newscentermaine.com,2024-07-03 12:37:25+00:00,2024-07-03 21:03:45
188,Polish freight company PKP Cargo to lay off about 30% of workforce - MarketScreener,"Company Profile. PKP Cargo SA is a Poland-based company active in the ... CSX CORPORATION- Stock CSX Corporation. -3.23%, 66B. NORFOLK SOUTHERN ...",es.marketscreener.com,2024-07-03 18:51:25+00:00,2024-07-03 22:03:47
189,12 Best Dividend Stocks Under $25 - Insider Monkey,"2. KeyCorp (NYSE:KEY)- CSX Corporation (CSX) Quarterly Results Surpassed Expectations- Billionaire Phillipe Laffont's Top 10 ""Mostly AI"" Stock Picks.",www.insidermonkey.com,2024-07-03 18:18:57+00:00,2024-07-03 22:03:47
190,Cleanup of diesel spill from train crash in Penobscot County now underway | newscentermaine.com,Lincoln fire officials say two box cars went off the tracks Tuesday when a CSX train hit a parked train car in Mattawamkeag. ... Company Logo. 'Do ...,www.newscentermaine.com,2024-07-03 21:18:35+00:00,2024-07-03 23:03:53
191,12 Best Dividend Stocks Under $25 - Insider Monkey,The company was able to grow its business over the years due to the ... CSX Corporation (CSX) Quarterly Results Surpassed Expectations Biogen ...,www.insidermonkey.com,2024-07-03 15:12:49+00:00,2024-07-03 23:03:53
192,Amtrak and NJ TRANSIT Work to Address Service Delays by Examining Infrastructure,CSX Service Resumes on Harpers Ferry Bridge After Fire- MBTA Completes ... Copyright © 2024 Simmons-Boardman Publishing Inc. NEWS- Freight.,www.rtands.com,2024-07-04 01:47:19+00:00,2024-07-04 03:03:44
193,Crews still cleaning up diesel spill in Mattawamkeag after train derailment - News Center Maine,"Maine DEP confirmed that no fuel leaked into the Penobscot River, which runs next to the railroad. CSX and Maine DEP will be installing recovery wells ...",www.newscentermaine.com,2024-07-04 00:48:47+00:00,2024-07-04 03:03:44
194,"Cleanup underway after train derails, spilling diesel fuel near Penobscot River - News Center Maine",Lincoln fire officials two box cars went off the tracks Tuesday when a CSX train truck a parked train car. ... Company Logo. 'Do Not Sell or Share ...,www.newscentermaine.com,2024-07-04 00:31:35+00:00,2024-07-04 03:03:44
195,Busy South End remains closed after tractor-trailer takes down powerlines - MSN,Kennedy Boulevard Closure Planned In Tampa For CSX Railroad Repairs.,www.msn.com,2024-07-03 20:59:44+00:00,2024-07-04 03:03:44
196,"Letters to the Editor — Energy, immunity, animals on the Fourth, debate",A CSX and Union Pacific train passes by the Handley ...,www.dallasnews.com,2024-07-04 05:51:28+00:00,2024-07-04 07:03:56
197,"NRHS, Railway Age, RT&amp;S Announce Second Annual Outstanding Railroad Historic ...",CSX Service Resumes on Harpers Ferry Bridge After Fire. June 25 ... Copyright © 2024 Simmons-Boardman Publishing Inc. NEWS- Freight- Class 1 ...,www.rtands.com,2024-07-04 01:47:19+00:00,2024-07-04 07:03:56
198,"Woman struck, killed by CSX train in Dayton ID'd - Yahoo","""CSX appreciates the swift response of Montgomery County emergency personnel and extends our thoughts to those impacted by this incident,"" the company ...",www.yahoo.com,2024-07-04 01:33:08+00:00,2024-07-04 07:03:56
199,CSX Corp. stock underperforms Wednesday when compared to competitors - MarketWatch,"Company Close Updates. CSX Corp. stock underperforms Wednesday when ... CSX sank 0.62% to $33.55 Wednesday, on what proved to be an all-around ...",www.marketwatch.com,2024-07-03 23:23:32+00:00,2024-07-04 07:03:56
200,"Railcar Leasing Service Market: By Technology, Application, Global Analysis And Forecast To 2033","... Inc., Mitsui & Co. Ltd., Wells Fargo, Caterpillar Inc., Union Pacific Corporation, CSX Corporation, Canadian National Railway Company, The ...",www.openpr.com,2024-07-04 07:38:57+00:00,2024-07-04 11:03:46
201,10 Biggest AI Stories and Ratings Updates You Should Not Miss This Week,"OpenAI, the company behind ChatGPT, is a leading artificial intelligence company based in the United States. ... CSX Corporation (CSX) Quarterly Results ...",www.insidermonkey.com,2024-07-04 02:16:58+00:00,2024-07-04 11:03:46
202,E131: Tom O'Sullivan on the Evolution of Realestate.com.kh and Cambodia's Real Estate ...,... company pivoted to a transaction-based model during COVID ... Companies CSX- CAMGSM Plc. Rings In Transparency With Landmark First ...,cambodiainvestmentreview.com,2024-07-04 11:07:51+00:00,2024-07-04 13:03:55
203,Weak performance for Northeast Florida stocks | Jax Daily Record,"Jacksonville has three S&P 500 companies and two of them, CSX Corp. and ... rose 152% and cellulose specialties product company Rayonier Advanced ...",www.jaxdailyrecord.com,2024-07-05 04:30:36+00:00,2024-07-05 06:03:57
204,"CSX planning multiple railroad crossing closures, starting in Hopkins Co. - WHOP","CSX Railroad is planning to a close a number of railroad crossings in the coming weeks, starting with four in Hopkins County and eventually ...",whopam.com,2024-07-05 14:54:01+00:00,2024-07-05 16:03:54
205,Amtrak Adds 33 More Weekly Northeast Regional Stops at Newark Liberty International Airport,~el Jefe :: RAILROAD.NET Site Administrator/Co-Owner; Carman at Naugatuck Railroad ... Default Avatar CSX River Line Schedules. by Jeff Smith. Fri ...,railroad.net,2024-07-05 12:32:10+00:00,2024-07-05 17:03:44
206,CSX plans railroad maintenance next week in Hopkins Co. - WEHT,"The Kentucky Transportation Cabinet (KYTC) says CSX Railroad plans to close a number of railroad crossings in the coming weeks, starting with four ...",www.tristatehomepage.com,2024-07-05 17:05:09+00:00,2024-07-05 18:03:52
207,"Kentucky Bands, Bourbon and Wine Festival set for July 13 in Oak Grove - WHOP","... Tourism has upcoming, go to Visit Oak Grove, KY on Facebook. PrevPreviousCSX planning multiple railroad crossing closures, starting in Hopkins Co.",whopam.com,2024-07-05 16:20:25+00:00,2024-07-05 18:03:52
208,Jersey City street remains closed from damage caused by train striking bridge - NJ.com,"A CSX train of double-stacked containers struck the span June 27 when ... Veolia, the company that manages the city's water lines, is not involved in ...",www.nj.com,2024-07-05 21:21:14+00:00,2024-07-05 22:03:52
209,Looking Into Beacon Roofing Supply's Recent Short Interest,Lonegro enjoyed a long and distinguished career at CSX Corporation (NASDAQ:CSX) ... Company's Commercial business serving non-residential roofing ...,quantisnow.com,2024-07-05 18:27:46+00:00,2024-07-05 23:03:48
210,CSX Corp. [CSX] Records 50-Day SMA of $33.45 - Knox Daily,Investors can expect a company's stock to rise or fall based on the buying and selling of stock by its insiders. CSX Corp. shares valued at ...,knoxdaily.com,2024-07-05 23:50:32+00:00,2024-07-06 01:03:48
211,CSX Corp. stock underperforms Friday when compared to competitors - MarketWatch,"Company Close Updates. CSX Corp. stock underperforms Friday when ... CSX dropped 0.75% to $33.30 Friday, on what proved to be an all-around ...",www.marketwatch.com,2024-07-05 23:21:55+00:00,2024-07-06 04:04:00
212,Phillip Bank Launches Market-Leading Payroll Solutions for Companies,"... company accounts, access free local EFTs, and benefit from OTC ... Companies CSX- CAMGSM Plc. Rings In Transparency With Landmark First ...",cambodiainvestmentreview.com,2024-07-05 20:06:17+00:00,2024-07-06 04:04:00
213,New Century Financial Group LLC Has $349000 Position in AstraZeneca PLC (NASDAQ:AZN),... company in its most recent Form 13F filing with the Securities ... New Century Financial Group LLC Makes New Investment in CSX Co. (NASDAQ ...,www.defenseworld.net,2024-07-06 01:59:06+00:00,2024-07-06 13:03:47
214,"Retirement Guys Formula LLC Makes New $212,000 Investment in Marathon Petroleum Co ...",New Century Financial Group LLC Makes New Investment in CSX Co. (NASDAQ:CSX)- S&P Global Inc. (NYSE:SPGI) Shares Sold by New Century Financial ...,www.defenseworld.net,2024-07-06 01:51:04+00:00,2024-07-06 14:03:52
215,Commonwealth Equity Services LLC Grows Stock Position in iShares High Yield Bond ...,Has $1.34 Million Holdings in CSX Co. (NASDAQ:CSX)- Public Service Enterprise Group Incorporated (NYSE:PEG) Shares Acquired by J.W. Cole Advisors Inc ...,www.defenseworld.net,2024-07-06 13:52:35+00:00,2024-07-06 18:03:59
216,CSX plans railroad maintenance next week in Hopkins Co. - MSN,"HENDERSON, Ky. (WEHT) – The Kentucky Transportation Cabinet (KYTC) says CSX Railroad plans to close a number of railroad crossings in the coming ...",www.msn.com,2024-07-06 03:55:59+00:00,2024-07-06 19:03:48
217,Cleveland's lakefront has something no other major Great Lakes city has - NEOtrans,... CSX Transportation Inc. local serving the Port of Cleveland. Most of this rail traffic is just passing through town. The majority of trains aren't ...,neo-trans.blog,2024-07-06 21:00:19+00:00,2024-07-06 22:03:45
218,"Roy H. Schoenfeld Obituary (2024) - Massillon, OH - Paquelet Funeral Homes - Legacy.com","He worked as a brakeman on the railroad and retired from the CSX Railroad Company. Roy was an outdoorsman and an avid fisherman (Ricelake, Ontario ...",www.legacy.com,2024-07-06 20:40:35+00:00,2024-07-06 22:03:45
219,"Derailed train between Wyoming, Lockland carried hazardous materials - MSN","... CSX, the company that owns the derailed train. In 2024, nine train derailments have occurred so far in Ohio. This is the ninth derailment to be ...",www.msn.com,2024-07-06 16:39:05+00:00,2024-07-06 22:03:45
220,"Railway Infrastructure Maintenance market China Railway Corporation, Network Rail ... - TIMC",Union Pacific Railroad Canadian National Railway Norfolk Southern Railway CSX Transportation Canadian Pacific Railway Australian Rail Track ...,www.theindianmoviechannel.com,2024-07-06 23:08:10+00:00,2024-07-07 05:03:51
221,Encampment of violent vagabonds terrorizing NH family - New York Post,"... CSX, a freight railroad company. While Concord police can go and issue no-trespassing orders at any time, CSX also has its own police detail that ...",nypost.com,2024-07-07 06:45:42+00:00,2024-07-07 07:03:58
222,Global Payments Inc. (NYSE:GPN) Shares Sold by Sequoia Financial Advisors LLC,"Diversify Advisory Services LLC Invests $326,000 in Super Micro Computer, Inc.- Sequoia Financial Advisors LLC Has $3.45 Million Stock Position in CSX ...",www.defenseworld.net,2024-07-07 12:25:36+00:00,2024-07-07 16:03:49
223,What to know about Northbank Riverwalk closures in Jacksonville | firstcoastnews.com,The CSX Northbank Bulkhead Replacement will take place between the Acosta Bridge and W. ... Company Logo. 'Do Not Sell or Share My Personal ...,www.firstcoastnews.com,2024-07-07 22:06:42+00:00,2024-07-07 23:03:56
224,Leader Talks: H.E. Sou Socheat on SERC's Vision for Cambodia's Securities Markets from ...,Key Points: • Strategic Growth: SERC's 2024-2028 vision aims to attract more company ... Companies CSX- CAMGSM Plc. Rings In Transparency With Landmark ...,cambodiainvestmentreview.com,2024-07-08 02:38:54+00:00,2024-07-08 06:03:47
225,Detours and congestion around Kennedy Blvd and Willow Ave next week - Spot On Florida,... CSX railroad repair project. Read further at news source. ☆ FURTHER REFERENCES ☆. Posted in: West Central Florida Places: Hillsborough County,spotonflorida.com,2024-07-08 11:22:28+00:00,2024-07-08 14:03:46
226,New Virginia-North Carolina intercity passenger rail line starts construction,Virginia purchased 75 miles of the right of way from freight railroad CSX in 2020. ... Company Announcements. Industry Dive logo. Industry Dive ...,www.smartcitiesdive.com,2024-07-08 15:19:17+00:00,2024-07-08 16:03:54
227,"Railroad industry still facing cost/wage inflation, lower volume headwinds - Seeking Alpha","With the added pressure of negative mix, BofA Securities downgraded CSX Corporation (NASDAQ:CSX) to Neutral from Buy and lowered its EPS estimates ...",seekingalpha.com,2024-07-08 14:47:43+00:00,2024-07-08 16:03:54
228,Tokio Marine Asset Management Co. Ltd. Purchases 201 Shares of Northrop Grumman Co ...,"The fund owned 3,571 shares of the aerospace company's stock after purchasing an additional 201 shares during the quarter. ... CSX Co. (NASDAQ:CSX) ...",www.defenseworld.net,2024-07-08 13:43:35+00:00,2024-07-08 16:03:54
229,Kennedy Boulevard closes for railroad work - WTSP.com,The FDOT and CSX Railroad Transportation closed the Kennedy ... Company Logo. 'Do Not Sell or Share My Personal Information' Notice. Like ...,www.wtsp.com,2024-07-08 15:33:56+00:00,2024-07-08 17:03:47
230,CSX repair work forces partial closure of Tampa's Kennedy Boulevard | Florida Business,This article was posted online by Tampa Bay Business Journal. Spot On Florida collects excepts of news articles from this source and add these in the ...,spotonflorida.com,2024-07-08 16:37:08+00:00,2024-07-08 18:03:55
231,"Visa Takes Off with #TravelwithVisa Campaign at Phnom Penh International Airport, Cambodia",Companies CSX- CAMGSM Plc. Rings In Transparency With Landmark First ... LinkedIn: https://www.linkedin.com/company/airport-advertising-cambodia.,cambodiainvestmentreview.com,2024-07-08 09:02:49+00:00,2024-07-08 18:03:55
232,CSX repair work forces partial closure of Tampa's Kennedy Boulevard,Drive your business forward with real-time intelligence and actionable reporting. Subscribe Now.,www.bizjournals.com,2024-07-08 20:51:32+00:00,2024-07-08 22:03:57
233,"Shelter-in-place order briefly issued at North Dakota derailment site, officials say","... Business July 5, 2024. Failed wheel bearing caused Kentucky train derailment but didn't trigger alarms beforehand, CSX says- Business November 28 ...",www.columbian.com,2024-07-08 20:33:32+00:00,2024-07-08 22:03:57
234,Healthiest Employers Named in Florida Awards - EIN News,CSI Companies CSX Fidelity National Financial Gilbane Trailer Bridge U-Haul International. Haley Potoczek Springbuk +1 317.721.9834 info ...,www.einnews.com,2024-07-08 19:57:15+00:00,2024-07-08 22:03:57
235,Bank of America Securities Remains a Buy on Canadian National Railway (CNI),"Hoexter covers the Industrials sector, focusing on stocks such as Canadian National Railway, Canadian Pacific Kansas City, and CSX. In addition to ...",markets.businessinsider.com,2024-07-08 16:34:35+00:00,2024-07-08 22:03:57
236,Morgan Stanley Reaffirms Their Hold Rating on CSX (CSX) | Markets Insider,Morgan Stanley analyst Ravi Shanker maintained a Hold rating on CSX (CSX – Research Report) today and set a price target of $30.00. The co...,markets.businessinsider.com,2024-07-08 16:50:18+00:00,2024-07-08 23:03:47
237,CSX Reviews Capitalization of Prior-Period Engineering Materials and Labor - MarketScreener,By Josh Beckerman CSX said it is reviewing the capitalization of prior-period engineering materials and labor. The railroad company said Monday ...,www.marketscreener.com,2024-07-08 23:12:27+00:00,2024-07-09 00:03:56
238,CSX Corporation Announces Date for Second Quarter Earnings Release and Earnings Call,"JACKSONVILLE, Fla., July 08, 2024 (GLOBE NEWSWIRE) -- CSX Corp. (NASDAQ: CSX) will release second quarter financial and operating results after .",markets.businessinsider.com,2024-07-08 23:10:19+00:00,2024-07-09 00:03:56
239,Carver Companies towing pedestrian bridge from Italy along the Erie Canal | WorkBoat,"Once assembled and installed, the 266' bridge will cross the I-190 highway and the CSX freight rail line, connecting the Lower West Side of ...",www.workboat.com,2024-07-08 13:34:05+00:00,2024-07-09 00:03:56
240,"Paramount and Skydance merge, signaling end of a family reign in Hollywood and the rise ...",... company Oracle. Shari Redstone's National Amusements has ... CSX Corporation Announces Date for Second Quarter Earnings Release and Earnings Call.,ca.finance.yahoo.com,2024-07-08 21:53:21+00:00,2024-07-09 01:03:44
241,CSX Reviews Capitalization of Prior-Period Engineering Materials and Labor | Morningstar,"The railroad company said Monday that excluding the results of this review, it still expects to improve operating income and operating margin on a ...",www.morningstar.com,2024-07-08 22:34:50+00:00,2024-07-09 04:03:57
242,CSX Corporation Announces Date for Second Quarter Earnings Release and Earnings Call,"Following the earnings call, a webcast replay will be archived on the company's website. About CSX. CSX, based in Jacksonville, Florida, is a premier ...",finance.yahoo.com,2024-07-08 21:55:30+00:00,2024-07-09 04:03:57
243,CSX Corporation Announces Date for Second Quarter Earnings Release and Earnings Call,"JACKSONVILLE, Fla., July 08, 2024 (GLOBE NEWSWIRE) -- CSX Corp. (NASDAQ: CSX) will release second quarter financial and operating results after ...",www.bakersfield.com,2024-07-09 04:21:16+00:00,2024-07-09 07:04:04
244,Healthiest Employers Named in Florida Awards - FOX4KC.com,... company culture and benefits offerings to attract and maintain top talent. ... CSI Companies CSX Fidelity National Financial Gilbane Trailer Bridge U ...,fox4kc.com,2024-07-09 04:05:44+00:00,2024-07-09 07:04:04
245,"CFO Goldfarb Adrian Graham was granted 506 shares, increasing direct ownership by 5 ...",Lonegro enjoyed a long and distinguished career at CSX Corporation (NASDAQ:CSX) ... The Company has solidified its collaboration with a leading ...,quantisnow.com,2024-07-09 02:24:58+00:00,2024-07-09 07:04:04
246,Opinion: Lessons in Cambodia's Real Estate: Raw Opinion of a Practitioner,"Companies CSX- CAMGSM Plc. Rings In Transparency With Landmark First ... Other options include renewable long-term leases, engaging a trust company, ...",cambodiainvestmentreview.com,2024-07-09 01:40:41+00:00,2024-07-09 07:04:04
247,Quark Strengthens Commitment to Microsoft to Address Global Enterprise Content Lifecycle ...,The company will provide a seamless path for current ... CSX Corporation Announces Date for Second Quarter Earnings Release and Earnings Call ...,www.streetinsider.com,2024-07-08 22:31:12+00:00,2024-07-09 07:04:04
248,These “19th-Century” Dividends Will Roll in 2025 (and Beyond) - Contrarian Outlook,"Look at the share prices of the two railways we'll delve into today—Union Pacific (UNP) and CSX Corp. ... Co. will cut rates, reinflating ...",contrarianoutlook.com,2024-07-09 09:05:04+00:00,2024-07-09 10:04:01
249,Norfolk Southern leads railroads in growth during second quarter - Trains Magazine,CSX saw its traffic rise by 1.7% thanks largely to a 4.3% increase in ... Since working for a company and depending on a pension or social ...,www.trains.com,2024-07-09 11:26:05+00:00,2024-07-09 13:03:46
250,The True Story Of Trump's $75 Million Backer - Forbes,"Mellon soon had more cash at his disposal. In 2022, after nearly a half century in the railroad business, he sold his company to publicly traded CSX ...",www.forbes.com,2024-07-09 10:59:47+00:00,2024-07-09 13:03:46
251,CSX Corp. on Pace for Largest Percent Decrease Since August 2023 — Data Talk,"CSX Corporation (CSX) is currently at $32.29, down $1.10 or 3.29%. --Would be lowest close since June 14, 2024, when it closed at $32.18.",www.morningstar.com,2024-07-09 15:03:12+00:00,2024-07-09 16:03:58
252,These &quot;19th-Century&quot; Dividends Will Roll in 2025 (and Beyond) - Nasdaq,"(CSX). Both have been derailed (sorry, I couldn't resist) this year as ... Company Logo. Do Not Sell or Share My Personal Data. When you visit ...",www.nasdaq.com,2024-07-09 14:56:30+00:00,2024-07-09 16:03:58
253,TD Cowen lowers profit estimates for top U.S. railroads on lower volumes,Company News- Corporate Social Responsibility- Contact- Careers- XM ... CSX.O and Norfolk Southern NSC.N and price targets for the latter two.,www.xm.com,2024-07-09 13:28:58+00:00,2024-07-09 16:03:58
254,4 Stocks to Watch From the Prospering Railroad Industry - Yahoo Finance,"Despite the challenges surrounding the industry, Canadian National Railway Company (CNI), Canadian Pacific Kansas City Limited CP, CSX Corporation CSX ...",finance.yahoo.com,2024-07-09 15:59:03+00:00,2024-07-09 17:03:49
255,TD Cowen lowers profit estimates for top U.S. railroads on lower volumes - TradingView,"Brokerage TD Cowen lowers Q2 profit estimates for U.S. railroads Union Pacific NYSE:UNP, CSX ... Company. About- Features- Pricing- Social network ...",www.tradingview.com,2024-07-09 13:04:56+00:00,2024-07-09 17:03:49
256,Goodwin snags Washington antitrust duo | Natasha Doris | CDR Article,"Cross represents corporate clients, including Uber, DuPont, Oracle, CSX Transportation and John Deere as claimants and defendants in federal and ...",www.cdr-news.com,2024-07-09 15:59:28+00:00,2024-07-09 18:03:52
257,New Virginia-North Carolina intercity passenger rail line starts construction,Virginia purchased 75 miles of the right of way from freight railroad CSX in 2020. ... Company Announcements. Eyrus logo. General Contractors Send ...,www.constructiondive.com,2024-07-09 14:25:58+00:00,2024-07-09 18:03:52
258,CSX delays quarterly earnings report due to review of prior period accounting - Trains,In each of the past two years its second quarter financial results were announced on July 20. “This release date reflects the Company's review of the ...,www.trains.com,2024-07-09 18:46:22+00:00,2024-07-09 20:03:59
259,Wells Fargo Sticks to Its Hold Rating for CSX (CSX) | Markets Insider,"The company's shares closed yesterday at $33.39. According to TipRanks, Wetherbee is a 5-star analyst with an average return of 12.6% and a 58.39% ...",markets.businessinsider.com,2024-07-09 15:34:51+00:00,2024-07-09 20:03:59
260,4 Stocks to Watch From the Prospering Railroad Industry | Nasdaq,"Despite the challenges surrounding the industry, Canadian National Railway Company ( CNI ), Canadian Pacific Kansas City Limited CP, CSX Corporation ...",www.nasdaq.com,2024-07-09 15:29:13+00:00,2024-07-09 20:03:59
261,Angie Williams Receives Florida State University's Accounting Alumni Achievement Award,"In her role at CSX, Williams is responsible for overseeing all corporate ... Her leadership and expertise have been pivotal in ensuring the company's ...",www.csx.com,2024-07-09 19:33:02+00:00,2024-07-09 21:03:58
