,Heading,Subheading,Publisher,Published,Found
176,Closing Bell: The Good Shroom CO Inc up on Friday (MUSH) - The Globe and Mail,... Dow Jones Industrial Average closed 0.09% at 39164.06 and the Nasdaq Composite closed 0.30% at 17858.68. The Good Shroom CO Inc has listed on the ...,www.theglobeandmail.com,2024-06-29 09:20:21+00:00,2024-06-30 06:03:51
177,Dow Championship to boost regional economy by over $20 million - Huron Daily Tribune,"Dow Championship is one of the largest events in Midland and in the Great Lakes Bay region, said Tony Stamas, a president of Midland Business ...",www.michigansthumb.com,2024-06-30 15:05:46+00:00,2024-06-30 16:03:59
178,Park Avenue Securities LLC Cuts Position in Invesco Dow Jones Industrial Average ...,Invesco Dow Jones Industrial Average Dividend ETF Company Profile ... Grimes & Company Inc. Has $1.61 Million Stock Holdings in The Goldman ...,www.defenseworld.net,2024-06-30 14:55:41+00:00,2024-06-30 16:03:59
179,"Top Asset Managers Rack Up $95 Billion in Deal Profits, but Shareholders Focus More on Fees","Privacy Notice- Cookie Notice- Copyright Policy- Data Policy- Terms of Use- SUBSCRIBESIGN IN. Copyright ©2024 Dow Jones & Company, Inc. All ...",www.wsj.com,2024-06-30 13:24:02+00:00,2024-06-30 16:03:59
180,Closing Bell: First Trust Dow Jones Internet ETF Hgd up on Wednesday (FDN-F),"First Trust Dow Jones Internet ETF Hgd is a None company headquartered in, None. ... Fundamentals information provided by Fundata Canada Inc.",www.theglobeandmail.com,2024-06-30 11:59:16+00:00,2024-06-30 16:03:59
181,Kupcho and Ewing alone at top in Dow Championship - Midland Daily News,"In a weekend marked by crowded leaderboards at the Dow Championship, Jennifer Kupcho and Ally Ewing put a little space between themselves and the ...",www.ourmidland.com,2024-06-30 09:17:54+00:00,2024-06-30 16:03:59
182,Lower inflation and no recession set stocks up -2- | Morningstar,"... Dow Jones Newswires. 06-29-24 1139ET. Copyright (c) 2024 Dow Jones & Company, Inc. Evaluate the market like an analyst. Subscribe to Morningstar ...",www.morningstar.com,2024-06-30 03:48:18+00:00,2024-06-30 16:03:59
183,"ROSEN, A LEADING LAW FIRM, Encourages UiPath, Inc. Investors to Secure Counsel ...","Rosen Law Firm has achieved the largest ever securities class action settlement against a Chinese Company. ... Copyright © 2024 Dow Jones & Company, Inc ...",www.barrons.com,2024-06-30 00:47:24+00:00,2024-06-30 16:03:59
184,"MRNS INVESTOR ALERT: Bronstein, Gewirtz &amp; Grossman LLC Reminds Marinus ... - Barron's","MRNS INVESTOR ALERT: Bronstein, Gewirtz & Grossman LLC Reminds Marinus Pharmaceuticals, Inc. ... Copyright © 2024 Dow Jones & Company, Inc. All Rights ...",www.barrons.com,2024-06-30 16:27:25+00:00,2024-06-30 18:03:58
185,"As jobs get harder to find, stocks could be in trouble after best first half to an election year in ...","... Dow Jones Newswires. 06-30-24 1213ET. Copyright (c) 2024 Dow Jones & Company, Inc. Evaluate the market like an analyst. Subscribe to Morningstar ...",www.morningstar.com,2024-06-30 16:23:57+00:00,2024-06-30 18:03:58
186,SPDR Dow Jones Global Real Estate ETF (NYSEARCA:RWO) Sees Large Volume Increase,"Raymond James Financial Services Advisors Inc. now owns 329,410 shares of the company's stock valued at $14,399,000 after purchasing an additional ...",www.defenseworld.net,2024-06-30 15:19:43+00:00,2024-06-30 18:03:58
187,"Dow futures steady, Ross Stores up 5.5% after earnings - MSN","Ahead in Friday's trade, quarterly earnings results from Palo Alto Networks Inc (NASDAQ:PANW), Deere & Company (NYSE:DE) and Estee Lauder Companies ...",.google.com,2024-06-29 18:13:06+00:00,2024-06-30 18:03:58
188,"RIVN INVESTOR ALERT: Bronstein, Gewirtz &amp; Grossman LLC Reminds Rivian ... - Barron's","... Company's business, operations, and prospects. Specifically, Defendants made ... Copyright © 2024 Dow Jones & Company, Inc. All Rights Reserved.",www.barrons.com,2024-06-30 16:27:26+00:00,2024-06-30 19:03:54
189,"If jobs keep getting harder to find, the stock market could be in trouble | Morningstar","... Dow Jones Newswires. 06-30-24 1201ET. Copyright (c) 2024 Dow Jones & Company, Inc. Evaluate the market like an analyst. Subscribe to Morningstar ...",www.morningstar.com,2024-06-30 16:08:36+00:00,2024-06-30 19:03:54
190,Dow's SOAR Summit aims to inspire action through ideas - Midland Daily News,"Dow Chief Inclusion Officer Alveda Williams, who oversees the SOAR Summit, laughed when she was was asked who's coming next year.",www.ourmidland.com,2024-06-30 18:56:19+00:00,2024-06-30 21:03:59
191,Globe Life Inc. f/k/a Torchmark Corporation Sued for Securities Law Violations - Markets Insider,"NEW YORK, NY / ACCESSWIRE / June 30, 2024 / If you suffered a loss on your Globe Life Inc ... Dow Jones Live- Your Portfolio- The word Stocks- Stocks ...",markets.businessinsider.com,2024-06-30 11:03:16+00:00,2024-06-30 21:03:59
192,Head of Boots pharmacy chain reportedly will depart as Walgreens struggles | Morningstar,"... company Walgreens Boots Alliance Inc. Sky News and Reuters reported ... Copyright (c) 2024 Dow Jones & Company, Inc. Evaluate the market like ...",www.morningstar.com,2024-06-30 21:53:06+00:00,2024-06-30 23:03:59
193,WestJet cancels hundreds of flights after aircraft mechanics strike | CNN Business,Factset: FactSet Research Systems Inc. ... Standard & Poor's and S&P are registered trademarks of Standard & Poor's Financial Services LLC and Dow Jones ...,us.cnn.com,2024-06-30 17:44:36+00:00,2024-06-30 23:03:59
194,"Pomerantz Law Firm Announces the Filing of a Class Action Against Enphase Energy, Inc. - ENPH","(""Enphase"" or the ""Company"") (NASDAQ: ENPH). Such investors are advised to ... Copyright © 2024 Dow Jones & Company, Inc. All Rights Reserved.",www.barrons.com,2024-06-30 18:25:47+00:00,2024-07-01 02:03:57
195,Pomerantz Law Firm Reminds Shareholders with Losses on their Investment in Biogen Inc ...,"... Company's business, operations, and compliance policies. Specifically ... Copyright © 2024 Dow Jones & Company, Inc. All Rights Reserved.",www.barrons.com,2024-06-30 15:32:19+00:00,2024-07-01 02:03:57
196,Invesco Dow Jones Industrial Average Dividend ETF (NYSEARCA:DJD) Shares Bought by ...,A number of other institutional investors have also modified their holdings of the business. Win Advisors Inc. purchased a new stake in shares of ...,www.defenseworld.net,2024-06-30 21:39:08+00:00,2024-07-01 07:04:13
197,News Highlights: Top Company News of the Day - Monday at 3 AM ET | Morningstar,"(END) Dow Jones Newswires. July 01, 2024 03:15 ET (07:15 GMT). Copyright (c) 2024 Dow Jones & Company, Inc. Evaluate the market like an analyst ...",www.morningstar.com,2024-07-01 07:46:05+00:00,2024-07-01 09:04:00
198,Implied Volatility Surging for Dow (DOW) Stock Options - Nasdaq,"Investors in Dow Inc. DOW need to pay close attention to the stock based on moves in the options market lately. That is because the Jul 19, ...",www.nasdaq.com,2024-07-01 14:38:53+00:00,2024-07-01 15:03:59
199,"Stock Market Today: Dow, S&amp;P 500 Open Higher; 'Roaring Kitty' Backs Chewy - WSJ","Memestock maven Keith Gill, a.k.a. Roaring Kitty, disclosed in an SEC filing he owns 9 million shares of the pet-supplies company. Treasury yields ...",www.wsj.com,2024-07-01 14:12:36+00:00,2024-07-01 15:03:59
200,Global Electronic Wet Chemicals Industry Research 2024: An $8.39 Billion Market by 2034 ...,"Cabot Microelectronics Corporation. Dow Chemical Company. Fujifilm Corporation. Honeywell International Inc. KMG Chemicals, Inc. Linde plc. Mitsubishi ...",finance.yahoo.com,2024-07-01 11:39:36+00:00,2024-07-01 15:03:59
201,Investors Appear Satisfied With Dow Inc.'s (NYSE:DOW) Prospects - Simply Wall St News,"(NYSE:DOW) may be sending very bearish signals at the moment, given that almost half of all companies in the United States have P/E ratios under 16x ...",simplywall.st,2024-07-01 11:38:45+00:00,2024-07-01 15:03:59
202,Head of Boots pharmacy chain to depart as owner Walgreens struggles | Morningstar,"... company Walgreens Boots Alliance Inc. Sebastian James has given ... Copyright (c) 2024 Dow Jones & Company, Inc. Evaluate the market like ...",www.morningstar.com,2024-07-01 11:06:27+00:00,2024-07-01 15:03:59
203,D.B. Root &amp; Company LLC Makes New Investment in SPDR Dow Jones Industrial Average ...,Hedge funds and other institutional investors own 37.11% of the company's stock. SPDR Dow Jones Industrial Average ETF Trust Stock Performance.,www.defenseworld.net,2024-07-01 10:38:41+00:00,2024-07-01 15:03:59
204,Trilogy Capital Inc. Increases Position in SPDR Dow Jones REIT ETF (NYSEARCA:RWR),"The institutional investor owned 17,693 shares of the company's stock after acquiring an additional 5,184 shares during the quarter. Trilogy Capital ...",www.defenseworld.net,2024-07-01 10:12:56+00:00,2024-07-01 15:03:59
205,"Global Agricultural Films Market 2024-2029 by Type, Application and Region - GlobeNewswire",Kuraray Co. Ltd. Coveris; RKW Group; BASF SE; Rani Group; Dow Inc. Armando Alvarez Group; Trioworld; Industrial Development Company Sal; ExxonMobil ...,www.globenewswire.com,2024-07-01 09:09:21+00:00,2024-07-01 15:03:59
206,Fitch Affirms Dow's IDR at 'BBB+'; Outlook Stable,"Fitch Ratings-New York-01 July 2024: Fitch Ratings has affirmed Dow Inc. and Dow Chemical Company's (collectively, Dow) Long-Term Issuer Default ...",.google.com,2024-07-01 14:49:41+00:00,2024-07-01 17:03:56
207,Dow Inc. (DOW) Increases Yet Falls Behind Market: What Investors Need to Know - MSN,"The company's earnings per share (EPS) are projected to be $0.75, reflecting no change from the same quarter last year. Simultaneously, our latest ...",www.msn.com,2024-07-01 14:46:29+00:00,2024-07-01 17:03:56
208,Salesforce leads &quot;Dominate the Dow&quot; ProPicks to 2.21% gain in June 2024 - Investing.com,"... Co., Inc. (NYSE:MRK). Merck, a global healthcare company delivering innovative health solutions, boasts a robust pipeline with anticipated ...",www.investing.com,2024-07-01 14:40:24+00:00,2024-07-01 17:03:56
209,DOW &amp; Fiori Team Up to Advance Sustainable Vehicle Recycling - Yahoo Finance,"Better-ranked stocks in the basic materials space include Carpenter Technology Corporation CRS, ATI Inc. ATI and Ecolab Inc. ECL. CRS beat the Zacks ...",finance.yahoo.com,2024-07-01 13:25:49+00:00,2024-07-01 17:03:56
210,"Global Net Lease, Inc. Announces Common Stock Dividend for the Third Quarter 2024",... Dow Jones Live- Your Portfolio- The word Stocks- Stocks ... Dividends authorized by the Company's board of directors and declared by the Company ...,markets.businessinsider.com,2024-07-01 10:16:46+00:00,2024-07-01 17:03:56
211,US open: Mixed start to H2 trading. - Research the market - Halifax,US open: Mixed start to H2 trading. ; Dow Jones - Risers. Merck & Co. Inc. (MRK) $128.41 ; Dow Jones - Fallers. Caterpillar Inc. (CAT) $329.81 ; S&P 500 ...,www.investments.halifax.co.uk,2024-07-01 14:27:07+00:00,2024-07-01 19:04:09
212,Neighbors enjoy great view of Dow Championship - Midland Daily News,"North Peak Brewing Company delays opening of new Bay City location ... © 2024 Hearst Newspapers Michigan, Inc.Privacy NoticeInterest Based Ads ...",www.ourmidland.com,2024-07-01 18:21:20+00:00,2024-07-01 21:04:01
213,Analysts Offer Insights on Materials Companies: Dow Inc (DOW) and Anglo American (OtherAAUKF),"In a report released today, Michael Sison from Wells Fargo maintained a Buy rating on Dow Inc, with a price target of $65.00. The company's shares ...",markets.businessinsider.com,2024-07-01 17:29:32+00:00,2024-07-01 21:04:01
214,"Stocks could struggle to surpass Wall Street's high bar for second-quarter earnings, Goldman says","... Dow Jones Newswires. 07-01-24 1154ET. Copyright (c) 2024 Dow Jones & Company, Inc. Evaluate the market like an analyst. Subscribe to Morningstar ...",www.morningstar.com,2024-07-01 16:01:56+00:00,2024-07-01 21:04:01
215,U.S. stocks higher at close of trade; Dow Jones Industrial Average up 0.13% - Investing.com,"Meanwhile, Apple Inc (NASDAQ:AAPL) added 2.90% or 6.11 points to end at 216.73 and Boeing Co (NYSE:BA) was up 2.58% or 4.69 points to 186.70 in late ...",www.investing.com,2024-07-01 20:58:13+00:00,2024-07-01 23:03:57
216,"New Buy Rating for Anglo American (AAUKF), the Basic Materials Giant | Markets Insider",The company's shares closed last Thursday at $31.46. ... Anglo American NewsMORE- Analysts Offer Insights on Materials Companies: Dow Inc (DOW) and ...,markets.businessinsider.com,2024-07-01 17:53:38+00:00,2024-07-01 23:03:57
217,"5 Biggest Winners, 5 Biggest Losers From Dow Jones Industrial Average In First Half 2024",Walmart Inc WMT: +28.9%- Amazon.com Inc AMZN: +27.2%- American Express Company AXP: +23.6%- Microsoft Corp MSFT: +18.9%- JPMorgan Chase & Co JPM: + ...,www.tradingview.com,2024-07-01 22:55:34+00:00,2024-07-02 02:03:55
218,"5 Biggest Winners, 5 Biggest Losers From Dow Jones Industrial Average In First Half 2024",Walmart Inc. WMT-0.34% ; Amazon.com Inc. AMZN+2.06% ; American Express Company. AXP+0.98% ; Microsoft Corp. MSFT+2.29% ; JPMorgan Chase & Co. JPM+1.67%.,www.benzinga.com,2024-07-02 00:42:19+00:00,2024-07-02 05:04:02
219,Form 424B2 CITIGROUP INC - StreetInsider,... business of Citigroup Inc. more generally. Citigroup Inc. will release ... The Dow Jones Industrial Average™ is a price-weighted index rather ...,www.streetinsider.com,2024-07-01 22:16:53+00:00,2024-07-02 09:03:55
220,"Stock Market Today: Dow, S&amp;P Live Updates for July 2 - Bloomberg","Tesla Inc. shares fell more than 1% in premarket trading, surrendering ... company plans to hire over 10,000 new employees in its grid business.",www.bloomberg.com,2024-07-02 12:14:59+00:00,2024-07-02 13:03:54
221,The S&amp;P 500's reliance on a few winning stocks is getting worse | Morningstar,"... Dow Jones Newswires. 07-02-24 0715ET. Copyright (c) 2024 Dow Jones & Company, Inc. Evaluate the market like an analyst. Subscribe to Morningstar ...",www.morningstar.com,2024-07-02 11:22:48+00:00,2024-07-02 13:03:54
222,Merck &amp; Co. Inc. stock outperforms competitors on strong trading day - MarketWatch,"... Dow Jones Industrial Average DJIA rising 0.13% to 39,169.52. The stock's rise snapped a four-day losing streak. Merck & Co. Inc. closed... Shares ...",www.marketwatch.com,2024-07-01 20:42:34+00:00,2024-07-02 13:03:54
223,Dow Jones Acquires A2i Systems - PR Newswire,"Dow Jones & Company, Inc. Jul 02, 2024, 09:00 ET ...",www.prnewswire.com,2024-07-02 13:03:50+00:00,2024-07-02 15:04:05
224,See How Travelers Companies Ranks Among Analysts' Top Dow 30 Picks - Nasdaq,"A study of analyst recommendations at the major brokerages shows that Travelers Companies Inc (Symbol: TRV) is the #29 broker pick, on average, ...",www.nasdaq.com,2024-07-02 12:16:23+00:00,2024-07-02 15:04:05
225,"The 5 Cheapest Tech Stocks Now: Western Digital, HP Inc., HP Enterprise, and More | Barron's","Not every tech company is trading at a mega premium valuation, though. To find inexpensive tech names, Barron's asked Dow Jones Market Data to find ...",www.barrons.com,2024-07-02 06:05:49+00:00,2024-07-02 15:04:05
226,Dow Jones Forecast: DJIA kicks off Q3 modestly higher - FOREX.com,"... Inc. StoneX Europe Ltd, is a Cyprus Investment Firm (CIF) company registered to the Department of Registrar of Companies and Official Receiver ...",www.forex.com,2024-07-02 00:29:40+00:00,2024-07-02 15:04:05
227,Dow stock retains 'Overweight' from Piper Sandler amid strategic growth - Investing.com,"Evercore ISI maintained its In Line rating and a $62.00 price target for Dow Inc., while emphasizing the company's strategic initiatives and growth ...",www.investing.com,2024-07-02 14:25:47+00:00,2024-07-02 17:03:58
228,"LSEG and Dow Jones Announce a Multi-year Data, News and Analytics Partnership","Dow Jones is a division of News Corp (Nasdaq: NWS, NWSA; ASX: NWS, NWSLV). SOURCE Dow Jones & Company, Inc.",www.prnewswire.com,2024-07-02 14:05:26+00:00,2024-07-02 17:03:58
229,Blue Ocean Tech sees no need for closing bell with overnight-trading platform | Morningstar,"... Dow Jones Newswires. 07-01-24 1212ET. Copyright (c) 2024 Dow Jones & Company, Inc. Evaluate the market like an analyst. Subscribe to Morningstar ...",www.morningstar.com,2024-07-02 04:20:27+00:00,2024-07-02 17:03:58
230,"London Stock Exchange Group, Dow Jones Sign Multi-Year News, Analytics Agreement","... Dow Jones Newswires. July 02, 2024 10:50 ET (14:50 GMT). Copyright (c) 2024 Dow Jones & Company, Inc. Evaluate the market like an analyst. Subscribe ...",www.morningstar.com,2024-07-02 15:07:45+00:00,2024-07-02 20:04:01
231,LSEG announces multi-year news and data partnership with Dow Jones - Yahoo Finance,"LSEG will also co-develop with Dow Jones an ""enhanced news ... Tesla, Inc. EquityNMS. BYDDY. BYD Company Limited. EquityPNK. OPTT. Ocean ...",finance.yahoo.com,2024-07-02 14:52:02+00:00,2024-07-02 20:04:01
232,"LSEG and Dow Jones Announce a Multi-year Data, News and Analytics Partnership","Dow Jones & Company (PRNewsfoto/Dow Jones & Company, Inc.) Beginning today, trusted news ...",finance.yahoo.com,2024-07-02 14:07:15+00:00,2024-07-02 20:04:01
233,Nvidia is most-owned chip stock in active funds - but another is moving up fast | Morningstar,"... Dow Jones Newswires. 07-02-24 1048ET. Copyright (c) 2024 Dow Jones & Company, Inc. Evaluate the market like an analyst. Subscribe to Morningstar ...",www.morningstar.com,2024-07-02 20:55:28+00:00,2024-07-02 22:03:58
234,Inside the school that teaches big name brands how to make ice cream - CNN,"Tesla, Inc. 230.06. + 20.19. 9.62%. NVDA. NVIDIA Corporation. 121.37 ... Dow Jones: The Dow Jones branded indices are proprietary to and are ...",www.cnn.com,2024-07-02 19:57:24+00:00,2024-07-02 22:03:58
235,Dow Inc (DOW): New Buy Recommendation for This Basic Materials Giant | Markets Insider,"The company's shares closed yesterday at $52.63. According to TipRanks, Neivert is an analyst with an average return of -1.1% and a 45.68% success ...",markets.businessinsider.com,2024-07-02 18:01:20+00:00,2024-07-02 22:03:58
236,News Corp's Dow Jones Acquires Fuel Pricing Solutions Provider A2i Systems,"News Corp is the parent company of Dow Jones & Co., publisher of The ... Copyright © MarketWatch, Inc. All rights reserved. By using this ...",www.marketwatch.com,2024-07-02 21:22:07+00:00,2024-07-03 00:03:57
237,"S&amp;P 500, Nasdaq set new record highs, Dow pops by 160 points - Yahoo Finance","It is business as usual for the major indexes (^DJI, ^IXIC, ^GSPC), all closing Tuesday in the green. The Dow Jones Industrial Average pushes ...",finance.yahoo.com,2024-07-02 20:16:39+00:00,2024-07-03 00:03:57
238,Why Adobe and Uber are newly named top stock picks at Deutsche Bank | Morningstar,"... Dow Jones Newswires. 07-02-24 1140ET. Copyright (c) 2024 Dow Jones & Company, Inc. Evaluate the market like an analyst. Subscribe to Morningstar ...",www.morningstar.com,2024-07-02 21:43:35+00:00,2024-07-03 03:03:51
239,Dow Jones Acquires A2i Systems | Oil Energy | wvnews.com,"Dow Jones & Company (PRNewsfoto/Dow Jones & Company, Inc.) By Dow Jones & Company ...",www.wvnews.com,2024-07-02 16:08:12+00:00,2024-07-03 03:03:51
240,"Dow Inc. stock rises Tuesday, still underperforms market - MarketWatch","closed $7.98 short of its 52-week high ($60.69), which the company reached on April 4th. The...",www.marketwatch.com,2024-07-03 01:07:03+00:00,2024-07-03 07:04:05
241,"LSEG and Dow Jones Announce a Multi-year Data, News and Analytics Partnership","SOURCE Dow Jones & Company, Inc. Evaluate the market like an analyst. Subscribe to Morningstar Investor today. Start Free Trial ...",www.morningstar.com,2024-07-02 14:13:09+00:00,2024-07-03 07:04:05
242,"Stock Market Today: Dow, S&amp;P 500, Nasdaq Set to Open Up - Barron's","Nvidia Is the Fifth Most Profitable Company in the S&P 500. Here Are the 4 ... Copyright © 2024 Dow Jones & Company, Inc. All Rights Reserved.",www.barrons.com,2024-07-03 08:58:41+00:00,2024-07-03 10:03:55
243,"Stock Market Today: Dow, S&amp;P Live Updates for July 3 - Bloomberg","Bloomberg the Company & Its ProductsThe Company & its ProductsBloomberg ... Tesla Inc. surged 10% to lead gains in megacaps, helping the ...",www.bloomberg.com,2024-07-03 04:30:19+00:00,2024-07-03 10:03:55
244,Global High-Purity Epoxy Resin Market Major Trends And Growth Dr - SOUTHEAST,"Key players in the high-purity epoxy resin market include Dow Inc., Mitsubishi Chemical Corporation, 3M Company, Sika AG, and Olin Corporation.",southeast.newschannelnebraska.com,2024-07-03 03:10:30+00:00,2024-07-03 10:03:55
245,"Wealth Enhancement Advisory Services LLC Purchases 3,948 Shares of iShares Dow ...","raised its stake in iShares Dow Jones U.S. ETF by 6.0% during the 4th quarter. Arkansas Financial Group Inc. now owns 3,097 shares of the company's ...",www.defenseworld.net,2024-07-02 23:54:28+00:00,2024-07-03 10:03:55
246,Dow Jones Acquires A2i Systems | NWS Stock News,"SOURCE Dow Jones & Company, Inc. FAQ. What company did Dow Jones acquire on July 2, 2024? Dow Jones acquired A2i ...",www.stocktitan.net,2024-07-02 17:22:47+00:00,2024-07-03 10:03:55
247,Compass Ion Advisors LLC Buys 161 Shares of SPDR Dow Jones REIT ETF (NYSEARCA:RWR),"Charles Schwab Investment Management Inc. now owns 1,864,241 shares of the company's stock worth $177,699,000 after purchasing an additional 13,598 ...",www.defenseworld.net,2024-07-02 14:26:46+00:00,2024-07-03 10:03:55
248,Trump Media brings in over $105 million from DJT stock warrants - Morningstar,"(END) Dow Jones Newswires. 07-02-24 1858ET. Copyright (c) 2024 Dow Jones & Company, Inc. Evaluate the market like an analyst. Subscribe to ...",www.morningstar.com,2024-07-03 11:02:08+00:00,2024-07-03 16:04:09
249,U.S. stocks higher at close of trade; Dow Jones Industrial Average up 0.41% - Investing.com,"Meanwhile, Apple Inc (NASDAQ:AAPL) added 1.67% or 3.62 points to end at 220.37 and JPMorgan Chase & Co (NYSE:JPM) was up 1.65% or 3.38 points to ...",www.investing.com,2024-07-02 20:40:28+00:00,2024-07-03 16:04:09
250,S&amp;P Dow Jones Indices Reports U.S. Common Indicated Dividend Payments ... - PR Newswire,Protagonist Therapeutics Inc. (NASD: PTGX) will replace Encore Wire ... Cookie Policy. Accept All Cookies. Manage Preferences. Company Logo ...,www.prnewswire.com,2024-07-03 13:02:56+00:00,2024-07-03 17:04:17
251,Intuitive Machines' stock rockets as next moon mission approaches | Morningstar,"... Dow Jones Newswires. 07-02-24 1536ET. Copyright (c) 2024 Dow Jones & Company, Inc. Evaluate the market like an analyst. Subscribe to Morningstar ...",www.morningstar.com,2024-07-03 07:46:46+00:00,2024-07-03 17:04:17
252,"Stock market's upcoming earnings season may delay 'overdue' pullback for S&amp;P 500, says LPL","... Dow Jones Newswires. 07-02-24 1633ET. Copyright (c) 2024 Dow Jones & Company, Inc. Evaluate the market like an analyst. Subscribe to Morningstar ...",www.morningstar.com,2024-07-03 08:36:51+00:00,2024-07-03 19:04:10
253,Silicone Elastomers Industry Worth $17.72 Billion by 2034 - Global and Regional Market ...,"Dow, Inc. Wacker Chemie AG; Momentive Performance Materials, Inc. SHIN-ETSU Chemical Co. Ltd. China National Bluestar Co Ltd. Rogers Corporation ...",www.businesswire.com,2024-07-03 18:45:45+00:00,2024-07-03 20:04:22
254,Lucas Dow appointed as Managing Director and Chief Executive Officer - Yahoo Finance,It is expected James will remain as an Executive Director until 31 January 2025 to facilitate the hand over and business continuity after which he ...,finance.yahoo.com,2024-07-03 17:00:12+00:00,2024-07-03 20:04:22
255,Improved China iPhone Sales to Boost Apple Supply-Chain Companies - Barron's,"Stock Market News: Dow Gains After Powell Remarks. The S&P 500 and Nasdaq ... Copyright © 2024 Dow Jones & Company, Inc. All Rights Reserved.",www.barrons.com,2024-07-03 15:16:40+00:00,2024-07-03 20:04:22
256,Is your active mutual fund beating the U.S. stock market this year? | Morningstar,"... Dow Jones Newswires. 07-03-24 1401ET. Copyright (c) 2024 Dow Jones & Company, Inc. Evaluate the market like an analyst. Subscribe to Morningstar ...",www.morningstar.com,2024-07-03 18:11:22+00:00,2024-07-03 21:04:09
257,Solana Leads Way As Large Cryptocurrencies Decline | Morningstar,"In crypto-related company news, shares of Coinbase Global Inc ... Copyright (c) 2024 Dow Jones & Company, Inc. Evaluate the market like ...",www.morningstar.com,2024-07-03 14:30:29+00:00,2024-07-03 22:04:10
258,Keyword Studios Accepts $2.66 Billion EQT Takeover - WSJ,"2 billion on Keywords. Write to Cristina Gallardo at cristina.gallardo@wsj.com. Advertisement. Copyright ©2024 Dow Jones & Company, Inc. All Rights ...",www.wsj.com,2024-07-03 08:04:47+00:00,2024-07-03 22:04:10
259,U.S. stocks mixed at close of trade; Dow Jones Industrial Average down 0.06%,Merck & Company Inc (NYSE:MRK) declined 1.46% or 1.87 points to end at 125.85 and Amazon.com Inc (NASDAQ:AMZN) was down 1.21% or 2.41 points to 197.59 ...,www.investing.com,2024-07-03 20:44:06+00:00,2024-07-03 23:04:15
260,Stock Market Today: Dow Futures Edge Up; Treasury Yields Little Changed,"Live updates on stocks and other markets, including the Dow Jones Industrial Average, S&P 500 and Nasdaq Composite. ... Company, Inc. All Rights ...",www.wsj.com,2024-07-03 12:29:07+00:00,2024-07-03 23:04:15
261,"Dow Inc. stock rises Wednesday, still underperforms market - MarketWatch","This was the stock's second consecutive day of gains. Dow Inc. closed $7.81 below its 52-week high ($60.69), which the company reached on April 4th.",www.marketwatch.com,2024-07-03 23:21:44+00:00,2024-07-04 04:04:12
262,Allen &amp; Co. President Buys One of North Carolina's Most Expensive Homes for $13.9 Million,"The New York-based company is perhaps best known for hosting an annual ... Dow Jones & Company, Inc. All Rights Reserved. Copyright ©2024 Dow ...",www.wsj.com,2024-07-04 05:03:08+00:00,2024-07-04 07:04:15
