,Heading,Subheading,Publisher,Published,Found
0,Stock Market Today: Dow Gains 188 Points To Start the Short Week - Kiplinger,"... media group and leading digital publisher. Visit our corporate site. © Future US, Inc. Full 7th Floor, 130 West 42nd Street, New York, NY 10036.",www.kiplinger.com,2024-06-17 21:41:23,2024-06-18 15:13:03
1,Broadcom just keeps getting bigger as it's deemed best AI stock besides Nvidia,"... Dow Jones Newswires. 06-17-24 1555ET. Copyright (c) 2024 Dow Jones & Company, Inc. Evaluate the market like an analyst. Subscribe to Morningstar ...",www.morningstar.com,2024-06-17 21:04:18,2024-06-18 15:13:03
2,"Stock Market Today: Dow up nearly 190 points as S&amp;P 500, Nasdaq post another round of records","2 weighting, dislodging Apple Inc. As a result, the $71 billion ... Company. Dow Jones- Code of Conduct- Corrections- Reprints & Licensing- Digital ...",www.marketwatch.com,2024-06-17 20:48:10,2024-06-18 15:13:03
3,"Markets News, June 17, 2024: Autodesk, Broadcom Lead Nasdaq to Sixth Straight Record","The Nasdaq Composite gained 1%, while the S&P 500 rose 0.8% and the Dow Jones Industrial Average advanced 0.5%. ... company's operations, corporate ...",www.investopedia.com,2024-06-17 20:37:47,2024-06-18 15:13:03
4,Dow Inc. (DOW) Increases Yet Falls Behind Market: What Investors Need to Know,"The PEG ratio bears resemblance to the frequently used P/E ratio, but this parameter also includes the company's expected earnings growth trajectory.",finance.yahoo.com,2024-06-17 19:57:18,2024-06-18 15:13:03
5,"Stock Market Today: Dow, S&amp;P Live Updates for June 18 - Bloomberg","... corporate bond sales that exceeded $21 billion , led by Home Depot Inc. Optimism over a resilient economy, improving corporate earnings and the ...",www.bloomberg.com,2024-06-17 18:07:09,2024-06-18 15:13:03
6,"S&amp;P 500, Nasdaq notch new records, Dow snaps losing streak - Yahoo Finance","Tip: Try a valid symbol or a specific company name for relevant results ... MBIO Mustang Bio, Inc. 0.7500 +0.6200 (+476.92%)- LEN Lennar Corporation.",finance.yahoo.com,2024-06-17 17:07:44,2024-06-18 15:13:03
7,U.S. stocks higher at close of trade; Dow Jones Industrial Average up 0.49% - Investing.com,"Meanwhile, Intel Corporation (NASDAQ:INTC) added 1.74% or 0.53 points to end at 30.98 and Nike Inc (NYSE:NKE) was up 1.72% or 1.61 points to 95.00 in ...",www.investing.com,2024-06-17 15:39:06,2024-06-18 15:13:03
8,Form 424B2 BANK OF MONTREAL /CAN/ - StreetInsider,"... company owned by CME Group Inc. and by Dow Jones & Company. Generally ... Royalty trusts, U.S. limited liability companies, closed-end investment ...",www.streetinsider.com,2024-06-17 14:44:32,2024-06-18 15:13:03
9,"Richardson Financial Services Inc. Takes $100,000 Position in SPDR Dow Jones ... - Defense World","The institutional investor purchased 3,662 shares of the company's stock, valued at approximately $100,000. Get SPDR Dow Jones International Real ...",www.defenseworld.net,2024-06-17 13:32:08,2024-06-18 15:13:03
10,Univation launches LDPE and EVA production technology - Packaging Gateway,The gold standard of business intelligence. Find out more. Related Company Profiles. Dow Inc- View all. UNIGILITY leverages Dow's established tubular ...,www.packaging-gateway.com,2024-06-17 11:13:53,2024-06-18 15:13:03
11,Dow Futures Fall; Nasdaq Futures Edge Up - WSJ,"... Dow Jones & Company, Inc. All Rights Reserved. Copyright ©2024 Dow Jones & Company, Inc. All Rights Reserved. This copy is for your personal, non ...",www.wsj.com,2024-06-17 06:57:40,2024-06-18 15:13:03
12,Dow : to showcase MobilityScience™ solutions for low-carbon mobility at the ... - MarketScreener,"Dow (NYSE: DOW) is one of the world's leading materials science companies, serving customers in high-growth markets such as packaging, infrastructure, ...",www.marketscreener.com,2024-06-20 00:20:18+00:00,2024-06-20 03:03:55
13,Jon Stewart takes on the upcoming election | CNN Business,Factset: FactSet Research Systems Inc. All rights reserved. Chicago ... Dow Jones: The Dow Jones branded indices are proprietary to and are ...,www.cnn.com,2024-06-19 20:37:50+00:00,2024-06-20 03:03:55
14,"Markets News, June 18, 2024: Nvidia Market Cap Tops Microsoft; S&amp;P 500, Nasdaq Eke Out ...","... company. The S&P 500 gained 0.3% to close at a record for the second day. The Dow ... Inc. debenture due June 1, 2029, to be issued in the principal ...",www.investopedia.com,2024-06-19 19:16:47+00:00,2024-06-20 03:03:55
15,"STOCKS NEWS US-Dow, Russell, MSCI All-Country hit all-time highs | Reuters",Shares of Internet search engine company Google Inc. neared the $500 level after Credit Suisse on Wednesday said it reinstated coverage of with an ...,www.reuters.com,2024-06-19 17:15:42+00:00,2024-06-20 03:03:55
16,Global Citizenship | Corporate Dow,Dow's Global Citizenship strategy seeks to merge corporate citizenship with real world social responsibility. Learn more about our commitment to ...,corporate.dow.com,2024-06-19 16:23:40+00:00,2024-06-20 03:03:55
17,STOCKS NEWS US-Dow makes run for first positive month since Aug | Reuters,Shares of Web search leader Google Inc cut gains on Thursday following news that the company will slash about 200 sales and marketing jobs globally.,www.reuters.com,2024-06-19 14:17:06+00:00,2024-06-20 03:03:55
18,Advancing Safety Practices in Logistics: STG Logistics Recognized by Dow - PR Newswire,Dow delivered sales of approximately $45 billion in 2023. References to Dow or the Company mean Dow Inc. and its subsidiaries. Learn more about us ...,www.prnewswire.com,2024-06-19 09:57:12+00:00,2024-06-20 03:03:55
19,Dow launches new Revoloop recycled plastic resins,"In what is being called an “exciting evolution in the recycling narrative,” Midland, Michigan-based Dow Chemical Co. ... © 2024 GIE Media, Inc. All ...",www.recyclingtoday.com,2024-06-19 06:12:00+00:00,2024-06-20 03:03:55
20,"Dow releases 2023 INtersections Report, outlining progress toward its sustainability commitments",Dow (NYSE: DOW) is one of the world's leading materials science companies ... References to Dow or the Company mean Dow Inc. and its subsidiaries.,www.prnewswire.com,2024-06-19 02:01:01+00:00,2024-06-20 03:03:55
21,3 Dow Dividend Stocks Beating the Market This Year - Nasdaq,"(WMT), Merck & Co., Inc. (MRK), and American Express Company (AXP) - are outperforming not only their parent index on a year to date basis, but they' ...",www.nasdaq.com,2024-06-19 01:49:27+00:00,2024-06-20 03:03:55
22,Dow Inc. stock outperforms competitors on strong trading day - MarketWatch,"Nvidia passes Microsoft to become the largest company by market value, analysts raise their price targets on shares of Micron Technology, and Tesla ...",www.marketwatch.com,2024-06-18 23:57:43+00:00,2024-06-20 03:03:55
23,Dow Inc. stock outperforms competitors on strong trading day - MarketWatch,"closed $5.25 below its 52-week high ($60.69), which the company achieved on April 4th. Advertisement. The stock demonstrated a mixed performance when ...",www.marketwatch.com,2024-06-18 23:57:39+00:00,2024-06-20 03:03:55
24,2023 Progress Report: Advancing Sustainability Initiatives | Corporate Dow,"Dow's 2023 progress report offers insights into sustainability strategies, environmental improvements, and community impact programs that drive ...",corporate.dow.com,2024-06-18 23:51:20+00:00,2024-06-20 03:03:55
25,"DuPont, Corteva Must Face Pension Benefits Class Action - Law360",Companies. Corteva Inc. Dow Inc. DuPont de Nemours Inc. Government Agencies. U.S. District Court for the Eastern District of Pennsylvania. Judge ...,www.law360.com,2024-06-18 22:44:51+00:00,2024-06-20 03:03:55
26,Nvidia supremacy: Company becomes largest in the U.S. as stock extends big run,"... Dow Jones Newswires. 06-18-24 1336ET. Copyright (c) 2024 Dow Jones & Company, Inc. Evaluate the market like an analyst. Subscribe to Morningstar ...",www.morningstar.com,2024-06-18 17:48:09+00:00,2024-06-20 03:03:55
27,Dow Exec Says Chemical Industry Wants Solution to High Gas Prices,"... Inc. The U.S. natural gas market continues to be the ""nation's silent energy crisis,"" but The Dow Chemical Co. has been ""anything but silent...and ...",www.naturalgasintel.com,2024-06-18 16:25:19+00:00,2024-06-20 03:03:55
28,Stock Market Today: S&amp;P 500 closes lower as Nvidia slumps - MarketWatch,"The Dow Jones ... The Magnificent Seven also includes Microsoft Corp., Tesla Inc., Facebook parent Meta Platforms Inc., Google parent Alphabet Inc.",www.marketwatch.com,2024-06-21 00:57:07+00:00,2024-06-21 03:03:55
29,"Stock Market Today: Dow, S&amp;P Live Updates for June 21 - Bloomberg","Hertz Global Holdings Inc. increased the size of a junk-bond sale by a third to $1 billion, as the car-rental company works to bolster its balance ...",www.bloomberg.com,2024-06-20 22:14:57+00:00,2024-06-21 03:03:55
30,"The Dow Needs to Replace Boeing, Intel, Salesforce, and Cisco. 4 Stocks We Recommend Instead.","Among technology companies, the Dow could do with Alphabet, Google's parent, one of ... Copyright © 2024 Dow Jones & Company, Inc. All Rights Reserved.",www.barrons.com,2024-06-20 20:19:35+00:00,2024-06-21 03:03:55
31,SPDR Dow Jones REIT ETF (NYSEARCA:RWR) Shares Sold by PNC Financial Services Group Inc.,"The fund owned 35,445 shares of the company's stock after selling 5,114 shares during the period. PNC Financial Services Group Inc. owned about 0.23% ...",www.defenseworld.net,2024-06-20 19:13:06+00:00,2024-06-21 03:03:55
32,How a company whose name you probably can't pronounce is now worth more than Apple - CNN,"... Inc. and its licensors. All rights reserved. Dow Jones: The Dow Jones branded indices are proprietary to and are calculated, distributed and ...",www.cnn.com,2024-06-20 17:23:55+00:00,2024-06-21 03:03:55
33,"Nvidia's stock furthers gains, and an analyst says not to fight the 'AI train' - Morningstar","This content was created by MarketWatch, which is operated by Dow Jones & Co. ... Copyright (c) 2024 Dow Jones & Company, Inc. Evaluate the market like ...",www.morningstar.com,2024-06-20 14:51:01+00:00,2024-06-21 03:03:55
34,"Dow Inc. shares target cut by Jefferies, highlights high-interest rate risks - Investing.com",The revision reflects a more conservative stance on the company's earnings potential over the next few years. The firm's analyst cited several reasons ...,www.investing.com,2024-06-20 14:46:03+00:00,2024-06-21 03:03:55
35,"Dow to acquire recycler Circulus, boosting PCR capacity By Investing.com","Dow is one of the world's leading materials science companies, with manufacturing sites in 31 countries and approximately 35,900 employees. The ...",www.investing.com,2024-06-20 14:46:02+00:00,2024-06-21 03:03:55
36,"8,608 Shares in SPDR Dow Jones Global Real Estate ETF (NYSEARCA:RWO) Bought by ...","Raymond James Financial Services Advisors Inc. now owns 329,410 shares of the company's stock worth $14,399,000 after acquiring an additional 311,239 ...",www.defenseworld.net,2024-06-20 09:22:28+00:00,2024-06-21 03:03:55
37,"Dow discovers, contains sewer leak on Michigan Operations property - Huron Daily Tribune","... company informed the Daily News in a notice required by law. The ... © 2024 Hearst Newspapers Michigan, Inc.Privacy NoticeInterest Based AdsYour ...",www.michigansthumb.com,2024-06-20 08:36:28+00:00,2024-06-21 03:03:55
38,Time to drop the dow | TahoeDailyTribune.com,The S&P 500 is a capitalization-weighted index so the larger the company the bigger the influence it has on price. In recent years the largest ...,www.tahoedailytribune.com,2024-06-23 01:07:51+00:00,2024-06-23 03:03:57
39,MicroStrategy's bitcoin approach has pushed its stock up over 1000% since 2020,"... Dow Jones Newswires. 06-22-24 0800ET. Copyright (c) 2024 Dow Jones & Company, Inc. Evaluate the market like an analyst. Subscribe to Morningstar ...",www.morningstar.com,2024-06-23 00:03:50+00:00,2024-06-23 03:03:57
40,Dow (DOW) Acquires Circulus to Boost Circular Economy Efforts | Nasdaq,"Dow currently carries a Zacks Rank #3 (Hold). Some better-ranked stocks in the Basic Materials space are Carpenter Technology Corporation CRS, ATI Inc ...",www.nasdaq.com,2024-06-22 18:08:46+00:00,2024-06-23 03:03:57
41,SPDR Dow Jones Global Real Estate ETF (NYSEARCA:RWO) Shares Bought by Banque ...,"Harbour Investments Inc. now owns 5,375 shares of the company's stock valued at $205,000 after purchasing an additional 276 shares during the period.",www.defenseworld.net,2024-06-22 15:23:43+00:00,2024-06-23 03:03:57
42,"Dow hits record high on earnings, '07 outlook - Reuters","U.S. stocks climbed on Thursday, boosted by surprisingly high earnings from investment bank Bear Stearns Co. Inc. and economists' bullish ...",www.reuters.com,2024-06-22 14:53:33+00:00,2024-06-23 03:03:57
43,iShares Dow Jones U.S. ETF (NYSEARCA:IYY) Shares Sold by B. Riley Wealth Advisors Inc.,"The firm owned 6,365 shares of the company's stock after selling 880 shares during the quarter. B. Riley Wealth Advisors Inc.'s holdings in iShares ...",www.defenseworld.net,2024-06-22 10:49:12+00:00,2024-06-23 03:03:57
44,Dow Turns Higher. Business Activity Grew. - Barron's,"The Dow Jones Industrial Average turned higher following an upbeat update on the economy ... Copyright © 2024 Dow Jones & Company, Inc. All Rights ...",www.barrons.com,2024-06-22 08:12:24+00:00,2024-06-23 03:03:57
45,Did Dow Inc. (DOW) Beat Analysts' Expectations in Q1? - Yahoo Finance,"Many popular companies have introduced innovative solutions through R&D efforts. For instance, Berry Global recently launched a new version of its ...",finance.yahoo.com,2024-06-22 06:28:07+00:00,2024-06-23 03:03:57
46,The 30-stock secret: 'Don't fight Papa Dow' - Yahoo Finance,"Tip: Try a valid symbol or a specific company name for relevant results ... Ouster, Inc. (OUST) Registers a Bigger Fall Than the Market: Important ...",finance.yahoo.com,2024-06-22 03:10:04+00:00,2024-06-23 03:03:57
47,Uncovering the Science of Art - CSRwire,Dow (NYSE: DOW) is one of the world's leading materials science companies ... References to Dow or the Company mean Dow Inc. and its subsidiaries ...,www.csrwire.com,2024-06-22 02:49:52+00:00,2024-06-23 03:03:57
48,Dow acquires PE recycler Circulus,"""This acquisition will allow Dow to combine our company's industry ... © 2024 GIE Media, Inc. All Rights Reserved.",www.recyclingtoday.com,2024-06-22 01:38:49+00:00,2024-06-23 03:03:57
49,"Dow leads charge, S&amp;P 500 and Nasdaq flat at open - Yahoo Finance","Stocks (^DJI, ^IXIC, ^GSPC) appear mixed at Friday's session open, with the Dow Jones Industrial Average leading gains early in the trading day.",finance.yahoo.com,2024-06-22 00:29:31+00:00,2024-06-23 03:03:57
50,Dow Inc. stock underperforms Friday when compared to competitors - MarketWatch,"Dow Inc. closed $6.70 short of its 52-week high ($60.69), which the company achieved on April 4th. Advertisement. The stock underperformed when ...",www.marketwatch.com,2024-06-21 23:54:02+00:00,2024-06-23 03:03:57
51,"Kickstart: Paper, not plastic, for Amazon packaging","Dow invests in film recycling. A film recycling company just got a new owner, one with a big name in plastics that wants to get more circular. Dow Inc ...",www.plasticsnews.com,2024-06-21 23:51:25+00:00,2024-06-23 03:03:57
52,"MARKET PULSE-Amarin, Dow Chemical, BlackBerry, Alcoa, Sarepta, Gap | Reuters","The Teamsters will review the contract on Tuesday. ** FOREST LABORATORIES INC, $71.12, +3.46 pct. The drug company's results handily beat analysts' ...",www.reuters.com,2024-06-21 22:51:11+00:00,2024-06-23 03:03:57
53,9 Best Plastics and Rubber Stocks to Buy - Insider Monkey,"Dow Inc. (NYSE:DOW) is a leader in materials science, providing ... The company operates across 31 countries, employing a workforce of roughly 35,900 ...",www.insidermonkey.com,2024-06-21 17:15:25+00:00,2024-06-23 03:03:57
54,U.S. stocks mixed at close of trade; Dow Jones Industrial Average up 0.77% - Investing.com,Apple Inc (NASDAQ:AAPL) declined 2.15% or 4.61 points to end at 209.68 and Coca-Cola Co (NYSE:KO) was down 0.72% or 0.45 points to 62.18. The top ...,www.investing.com,2024-06-21 08:41:47+00:00,2024-06-23 03:03:57
55,Dow Seeks Permit for Its Largest-Ever Ethylene Plant - Natural Gas Intelligence,Dow executive George Blitz told NGI in October that the company had ... ©Copyright 2012Intelligence Press Inc. All rights reserved. The preceding ...,www.naturalgasintel.com,2024-06-21 02:06:24+00:00,2024-06-23 03:03:57
56,CDK Global says software outage will take several days to resolve | CNN Business,... company added the incident will likely negatively impact Sonic's financial and business ... Inc. and its licensors. All rights reserved. Dow Jones: The ...,www.cnn.com,2024-06-24 02:34:59+00:00,2024-06-24 03:03:58
57,"CNBC Daily Open: Dow posts best week since May, Tesla staff down by 14%",Lee's bullish stance on Nvidia is rooted in the company's unique market position. Nvidia “is a 30 P/E stock that sells something that no one else ...,www.cnbc.com,2024-06-24 02:32:27+00:00,2024-06-24 03:03:58
58,Prudential Plans $2 Billion Share Buyback - WSJ,"... Dow Jones & Company, Inc. All Rights Reserved. 87990cbe856818d5eddac44c7b1cdeb8. What to Read Next. Federal Reserve Raises Interest Rates By 0.75 ...",www.wsj.com,2024-06-24 02:15:51+00:00,2024-06-24 03:03:58
59,"If a Company Says It's Ethical, Investors Might Want to Be Skeptical - WSJ","Once again, they found that companies that didn't use trust words had better corporate ... Dow Jones & Company, Inc. All Rights Reserved.",www.wsj.com,2024-06-24 01:59:31+00:00,2024-06-24 03:03:58
60,'I don't live extravagantly by any means': I -2- | Morningstar,"(END) Dow Jones Newswires. 06-23-24 1535ET. Copyright (c) 2024 Dow Jones & Company, Inc. Evaluate the market like an analyst. Subscribe to ...",www.morningstar.com,2024-06-24 01:44:15+00:00,2024-06-24 03:03:58
61,News Highlights: Top Company News of the Day - Sunday at 9 PM ET | Morningstar,"... Dow Jones Newswires. June 23, 2024 21:15 ET (01:15 GMT). Copyright (c) 2024 Dow Jones & Company, Inc. Evaluate the market like an analyst. Subscribe ...",www.morningstar.com,2024-06-24 01:32:15+00:00,2024-06-24 03:03:58
62,Stocks Poised for Muted Open - Barron's,"The Dow Jones Industrial Average is up a mere 3% this year because of several ... Copyright © 2024 Dow Jones & Company, Inc. All Rights Reserved.",www.barrons.com,2024-06-24 01:29:15+00:00,2024-06-24 03:03:58
63,Banque Cantonale Vaudoise Sells 182 Shares of SPDR Dow Jones Industrial Average ETF ...,"ST Germain D J Co. Inc. now owns 193 shares of the exchange traded fund's stock valued at $77,000 after purchasing an additional 27 shares during the ...",www.defenseworld.net,2024-06-23 23:03:39+00:00,2024-06-24 03:03:58
64,What's in Store for Daqo New Energy's (DQ) Q1 Earnings? - Yahoo News UK,"The company is likely to have gained from higher prices, healthy demand ... Dow Inc. DOW, scheduled to release earnings on Apr 21, has an Earnings ...",uk.news.yahoo.com,2024-06-23 21:27:06+00:00,2024-06-24 03:03:58
65,Dow Futures Higher Ahead of Fed's Interest Rate Decision - Yahoo News UK,"Technology companies lifted slightly, with Microsoft Corporation (NASDAQ:MSFT) up 0.9%, Alphabet Inc (NASDAQ:GOOGL) adding 0.3%, Apple Inc (NASDAQ ...",uk.news.yahoo.com,2024-06-23 19:59:17+00:00,2024-06-24 03:03:58
66,Cwm LLC Sells 190 Shares of iShares Dow Jones U.S. ETF (NYSEARCA:IYY),"now owns 3,097 shares of the company's stock worth $361,000 after purchasing an additional 174 shares during the period. Garde Capital Inc. acquired a ...",www.defenseworld.net,2024-06-23 18:39:09+00:00,2024-06-24 03:03:58
67,WSJ Opinion: Hits and Misses of the Week,"... Subscription- Legal Policies- Dow Jones Press Room- Google Play- App Store- Sign In. Copyright ©2024 Dow Jones & Company, Inc. All Rights ...",www.wsj.com,2024-06-23 16:31:37+00:00,2024-06-24 03:03:58
68,Claims Against Orthofix Medical Inc The Schall Law Firm Initiates Probe And Urges ...,"... Dow Jones Live- Your Portfolio- The word Stocks- Stocks Finder- Market Movers ... The Company stated, ""The Board's decision follows an investigation ...",markets.businessinsider.com,2024-06-23 16:22:24+00:00,2024-06-24 03:03:58
69,The Schall Law Firm Starts Investigation Into Allegations Against ARS Pharmaceuticals Inc ...,"... Dow Jones Live- Your Portfolio- The word Stocks- Stocks Finder- Market ... (""ARS"" or ""the Company"") (NASDAQ:SPRY) for violations of the securities ...",markets.businessinsider.com,2024-06-23 16:22:24+00:00,2024-06-24 03:03:58
70,Closing Bell: The Good Shroom CO Inc flat on Friday (MUSH) - The Globe and Mail,... Dow Jones Industrial Average closed 0.77% at 39134.76 and the Nasdaq Composite closed -0.79% at 17721.59. The Good Shroom CO Inc traded under MUSH ...,www.theglobeandmail.com,2024-06-23 04:33:25+00:00,2024-06-24 03:03:58
71,Closing Bell: The Good Shroom CO Inc flat on Wednesday (MUSH) - The Globe and Mail,... Dow Jones Industrial Average closed 0.15% at 38834.86 and the Nasdaq Composite closed 0.03% at 17862.23. The Good Shroom CO Inc traded under MUSH ...,www.theglobeandmail.com,2024-06-23 04:29:26+00:00,2024-06-24 03:03:58
72,"Stock Market Today: Dow, S&amp;P Live Updates for June 25 - Bloomberg","Boeing Co. has offered to acquire Spirit AeroSystems Holdings Inc. for about $35 a share in a deal funded mostly with stock, according to people ...",www.bloomberg.com,2024-06-26 02:25:06+00:00,2024-06-26 03:03:57
73,Dow Jones Industrial Average sheds 300 points on Tuesday - FXStreet,"(WMT) which shed 2.78% and fell below $67.00 per share. Boeing Co. (BA) and Nike Inc. (NKE) were close behind, backsliding around 2.33% apiece to ...",www.fxstreet.com,2024-06-26 01:07:42+00:00,2024-06-26 03:03:57
74,FedEx Stocks Jumps After Company Snaps Streak of Revenue Declines - WSJ,"Stock Market News, June 25, 2024: Nasdaq Closes Higher, Boosted by Nvidia's Gains. The S&P 500 also gains, while the Dow industrials decline. Last ...",www.wsj.com,2024-06-26 01:02:42+00:00,2024-06-26 03:03:57
75,AdvisorNet Financial Inc Has $1.72 Million Position in SPDR Global Dow ETF (NYSEARCA:DGT),"The firm owned 13,355 shares of the company's stock after buying an additional 2,557 shares during the quarter. AdvisorNet Financial Inc owned ...",www.defenseworld.net,2024-06-25 23:19:08+00:00,2024-06-26 03:03:57
76,Nvidia Rebound Lifts Nasdaq; Dow Industrials Stumble - WSJ,"... Dow Jones & Company, Inc. All Rights Reserved. 87990cbe856818d5eddac44c7b1cdeb8. What to Read Next. Markets. Fashion Empire Shein Has Filed for ...",www.wsj.com,2024-06-25 23:15:07+00:00,2024-06-26 03:03:57
77,"Nasdaq soars, Dow falls while Nvidia stock bounces back - Yahoo Finance","Tip: Try a valid symbol or a specific company name for relevant results ... RIVN Rivian Automotive, Inc. 11.96 +0.95 (+8.63%)- FDX FedEx Corporation.",finance.yahoo.com,2024-06-25 21:50:28+00:00,2024-06-26 03:03:57
78,"US close: Nvidia pushes S&amp;P 500 and Nasdaq higher, but Dow drops - Sharecast.com",Dowdupont Inc. (DWDP)$0.000.00% Merck & Co. Inc. (MRK)$132.92-0.03% Coca ... Travelers Company Inc. (TRV)$208.78-1.12%. S&P 500 - Risers. Carnival ...,www.sharecast.com,2024-06-25 21:03:53+00:00,2024-06-26 03:03:57
79,December 2026 Options Now Available For Dow - Nasdaq,"... Dow Inc, as well as studying the business fundamentals becomes important. Below is a chart showing DOW's trailing twelve month trading history ...",www.nasdaq.com,2024-06-25 18:52:46+00:00,2024-06-26 03:03:57
80,Should Invesco Dow Jones Industrial Average Dividend ETF (DJD) Be on Your Investing Radar?,"Looking at individual holdings, Verizon Communications Inc (VZ) accounts for about 10.22% of total assets, followed by 3m Co (MMM) and Dow Inc (DOW).",finance.yahoo.com,2024-06-25 16:51:06+00:00,2024-06-26 03:03:57
81,"Dow Retreats from One-Month Highs, S&amp;P 500 and Nasdaq 100 Edge Higher - MarketPulse","The Dow Jones is benefiting from diversification, while the Nasdaq and S&P 500 eye a recovery. Where to next ... Business Information & Services Inc.",www.marketpulse.com,2024-06-25 16:37:36+00:00,2024-06-26 03:03:57
82,Four Dow Leaders Recognized on INvolve's 2024 Empower Role Model Lists - CSRwire,"Dow (NYSE: DOW) is one of the world's leading materials science companies, serving customers in high-growth markets such as packaging, ...",www.csrwire.com,2024-06-25 14:39:55+00:00,2024-06-26 03:03:57
83,Dow leaps higher while Nasdaq is dragged down by Nvidia - Yahoo Finance,"NVIDIA Corporation. EquityNMS. SEDG. SolarEdge Technologies, Inc. EquityNMS. MLGO. MicroAlgo Inc. EquityNCM. FFIE. Faraday Future Intelligent Electric ...",finance.yahoo.com,2024-06-25 11:39:21+00:00,2024-06-26 03:03:57
84,"Dow Logs 5th-Straight Win as Nasdaq, Nvidia Cool","Schaeffer's Investment Research, Inc. has been providing stock market ... Company Logo. Do Not Sell or Share My Personal Data. When you visit our ...",www.nasdaq.com,2024-06-25 08:34:55+00:00,2024-06-26 03:03:57
85,The Dow Rises While the Nasdaq Falls as Tech Loses Favor - Barron's,Stocks closed mixed on Monday as a selloff in chip companies dragged down the S&P 500 and Nasdaq Composite. The Dow Jones Industrial Average rose ...,www.barrons.com,2024-06-25 08:10:25+00:00,2024-06-26 03:03:57
86,Nvidia and Meta are two reasons the Dow lags the S&amp;P 500 by double digits | Morningstar,"... Dow Jones Newswires. 06-24-24 1356ET. Copyright (c) 2024 Dow Jones & Company, Inc. Evaluate the market like an analyst. Subscribe to Morningstar ...",www.morningstar.com,2024-06-25 06:04:53+00:00,2024-06-26 03:03:57
87,"US stocks mixed as Dow dips, Cisco helps techs - Reuters","... Inc. after the company posted a better-than-expected quarterly profit. However, blue-chip stocks declined, weighed down by a weaker-than-expected ...",www.reuters.com,2024-06-25 05:23:23+00:00,2024-06-26 03:03:57
