,Heading,Subheading,Publisher,Published,Found
0,Here's How Much You Would Have Made Owning WW Grainger Stock In The Last 5 Years,W.W. Grainger (NYSE:GWW) has outperformed the market over the past 5 years by 14.3% on an annualized basis producing an average annual return of 27.56 ...,uk.investing.com,2024-06-18 03:48:28,2024-06-19 13:31:03
1,WW Grainger (GWW) Receives a Hold from RBC Capital | Markets Insider,"The company's shares closed yesterday at $917.45. Dray covers the Industrials sector, focusing on stocks such as Xylem, Honeywell International, and ...",markets.businessinsider.com,2024-06-18 00:38:43,2024-06-19 13:31:03
2,RBC Capital Reaffirms Their Hold Rating on Wesco International (WCC) | Markets Insider,"Dray covers the Industrials sector, focusing on stocks such as Xylem, Honeywell International, and WW Grainger. Wesco International has an analyst ...",markets.businessinsider.com,2024-06-18 00:38:41,2024-06-19 13:31:03
3,Here's How Much You Would Have Made Owning WW Grainger Stock In The Last 5 Years,W.W. Grainger (NYSE:GWW) has outperformed the market over the past 5 years by 14.3% on an annualized basis producing an average annual return of 27.56 ...,uk.investing.com,2024-06-18 08:48:28+00:00,2024-06-19 17:14:23
4,WW Grainger (GWW) Receives a Hold from RBC Capital | Markets Insider,"The company's shares closed yesterday at $917.45. Dray covers the Industrials sector, focusing on stocks such as Xylem, Honeywell International, and ...",markets.businessinsider.com,2024-06-18 05:38:43+00:00,2024-06-19 17:14:23
5,RBC Capital Reaffirms Their Hold Rating on Wesco International (WCC) | Markets Insider,"Dray covers the Industrials sector, focusing on stocks such as Xylem, Honeywell International, and WW Grainger. Wesco International has an analyst ...",markets.businessinsider.com,2024-06-18 05:38:41+00:00,2024-06-19 17:14:23
6,OMNIA Partners Announces Continued Expansion of its OPUS E-commerce Platform,"Company Announcements. Distribution Solutions Group Inc, ODP Corp, Global Industrial Co, WW Grainger Inc, MSC Industrial Direct Co Inc. OMNIA ...",markets.ft.com,2024-06-20 15:56:16+00:00,2024-06-21 10:14:17
7,WW Grainger executive sells shares worth over $467 k - Investing.com,"In a recent transaction, Matt Fortin, the Senior Vice President and Chief HR Officer of W.W. Grainger, Inc. (NYSE:GWW), sold shares of the company's ...",www.investing.com,2024-06-26 04:27:11+00:00,2024-06-26 10:14:11
8,Warren Buffett Detailed Fundamental Analysis - GWW - Nasdaq,WW GRAINGER INC (GWW) is a large-cap growth stock in the Electronic ... Company Logo. Do Not Sell or Share My Personal Data. When you visit our ...,www.nasdaq.com,2024-07-01 14:14:31+00:00,2024-07-01 21:15:04
9,"Final Trades: Amazon, WW Grainger and Target - CNBC","Data is a real-time snapshot *Data is delayed at least 15 minutes. Global Business and Financial News, Stock Quotes, and Market Data and Analysis.",www.cnbc.com,2024-07-02 20:42:08+00:00,2024-07-02 22:14:30
10,"Final Trades: Amazon, WW Grainger and Target - YouTube","Final Trades: Amazon, WW Grainger and Target. 1K views · 8 hours ... company', says Semafor's Ben Smith. CNBC Television New 863 views- 4:24- Go to ...",www.youtube.com,2024-07-03 02:04:10+00:00,2024-07-03 04:14:36
11,WW Grainger Getting Closer To Key Technical Measure | Investor's Business Daily,"WW Grainger is working on a consolidation with a 1,034.18 entry. See if the stock can break out in heavy trading. The company showed 0% earnings ...",www.investors.com,2024-07-03 17:12:44+00:00,2024-07-03 18:15:21
12,Jeff Bezos is cashing out billions in Amazon shares — again - MSN,"The company stock was up 32% year-to-date through Tuesday. Microsoft ... Final Trades: Amazon, WW Grainger and Target (CNBC). Video Player is ...",www.msn.com,2024-07-03 18:09:44+00:00,2024-07-03 22:15:10
13,Amazon shares hit $200 for 1st time but Jeff Bezos is SELLING stocks worth Rs 41k crore - Details,"Final Trades: Amazon, WW Grainger and Target (CNBC). Video Player is loading. Play Video. Loaded: 0%. Play. Current Time 0:00. /. Duration 0:00.",www.msn.com,2024-07-03 17:34:05+00:00,2024-07-03 22:15:10
14,"Jeff Bezos aims to sell another $5 billion of Amazon stock, after earlier selling spree - MSN","Final Trades: Amazon, WW Grainger and Target (CNBC). Video Player is ... Amazon declined to comment when asked if the company or Bezos had comment on ...",www.msn.com,2024-07-04 09:57:52+00:00,2024-07-04 15:15:30
15,WW Grainger Earns Relative Strength Rating Upgrade | Investor's Business Daily,WW Grainger reported 0% earnings growth in the latest quarterly report. Revenue rose 4%. The company is expected to report its latest results on or ...,www.investors.com,2024-07-17 16:17:46+00:00,2024-07-17 22:15:08
16,5 US Growth Stalwarts That Dish Out Increasing Dividends - The Smart Investor,"WW Grainger (NYSE: GWW). Grainger is a broad-line distributor with operations in the US, Japan, and the UK. The company offers a product assortment ...",thesmartinvestor.com.sg,2024-07-25 11:30:08+00:00,2024-07-25 17:15:26
17,U.S. earnings week ahead - XM,WW Grainger Inc. Q2 2024 WW Grainger Inc Earnings Release. 01-Aug-2024. 07:30. SO. Southern Co. Q2 2024 Southern Co Earnings Release. 02-Aug-2024. BMO.,www.xm.com,2024-07-26 16:31:08+00:00,2024-07-26 20:15:23
18,WW Grainger Earns IBD Rating Upgrade | Investor's Business Daily,"WW Grainger reported 0% EPS growth last quarter, while sales growth came in at 4%. Keep an eye out for the company's next round of numbers on or ...",www.investors.com,2024-07-26 16:22:09+00:00,2024-07-26 20:15:23
19,Warren Buffett Detailed Fundamental Analysis - GWW - Nasdaq,"WW GRAINGER INC (GWW) is a large-cap growth stock in the Electronic ... company name. When the symbol you want to add appears, add it to My ...",www.nasdaq.com,2024-07-29 18:28:48+00:00,2024-07-29 22:15:37
20,WW Grainger Inc expected to post earnings of $9.58 a share - Earnings Preview - XM,WW Grainger Inc expected to post earnings of $9.58 a share - Earnings Preview ... The Lake Forest Illinois-based company is expected to report a ...,www.xm.com,2024-07-30 17:49:55+00:00,2024-07-30 21:15:22
21,Four-Way Reversing Valve for Refrigeration Market Size And Forecast Innovation Hubs,TSI Technologies; WW Grainger; Danfoss; Eliwell; Robertshaw; Zem Group; Haiton International; Dunan; Zhejiang Chunhui Intelligent Control; Foshan ...,moosegazette.com,2024-07-31 21:28:09+00:00,2024-08-01 00:15:27
22,Ww Grainger Inc (GWW) Earnings: Q2 Net Sales Meet Estimates with Adjusted EPS ...,"Comments: Grainger narrowed its 2024 earnings outlook, including most Company guidance ranges. Adjusted EPS Forecast: $38.00 to $39.50, estimate ...",www.smartkarma.com,2024-08-01 15:26:52+00:00,2024-08-01 16:15:27
23,WW Grainger Cuts 2024 Sales Forecast on Slow Demand - US News Money,"The Lake Forest, Illinois-based company now expects 2024 sales to be between $17 billion and $17.3 billion, down from its previous forecast of $17.2 ...",money.usnews.com,2024-08-01 14:48:06+00:00,2024-08-01 16:15:27
24,WW Grainger cuts 2024 sales forecast on slow demand - Reuters,"The company provides hand tools, power tools and industrial products to home improvement retailers, construction businesses and aerospace ...",www.reuters.com,2024-08-01 14:40:40+00:00,2024-08-01 16:15:27
25,CBIZ to acquire accounting firm Marcum in $2.3 bln deal - Reuters,The company's total revenue rose 5.4% in the quarter ended June 30. ... WW Grainger cuts 2024 sales forecast on slow demand. 3 min ago. Reuters ...,www.reuters.com,2024-08-01 13:27:25+00:00,2024-08-01 16:15:27
26,Ww Grainger Inc (GWW) Q2 Earnings: Net Sales Align with Estimates Amid Narrowed 2024 ...,"The company has narrowed its 2024 guidance ranges, including daily, organic constant currency sales growth of 4.0% to 6.0%. Adjusted diluted EPS ...",www.smartkarma.com,2024-08-01 13:11:13+00:00,2024-08-01 16:15:27
27,"WW Grainger earnings beat by $0.19, revenue fell short of estimates - Investing.com","... Company News. The ProPicks AI strategy to watch when Tech rally slows ... Check out WW Grainger's recent earnings performance, and WW Grainger's ...",www.investing.com,2024-08-01 12:29:52+00:00,2024-08-01 16:15:27
28,Xcel Energy reports higher Q2 profit - Reuters,"The company, which has 3.8 million electric and 2.1 million natural gas ... WW Grainger cuts 2024 sales forecast on slow demand. 13 hours ago.",www.reuters.com,2024-08-01 13:25:02+00:00,2024-08-01 18:15:31
29,Schroders shares slide as fee pressure leads to profit miss - Reuters,"A man walks past the logo of investment management company Schroders at a branch in Zurich, Swtzerland November 5, 2018. ... WW Grainger cuts 2024 sales ...",www.reuters.com,2024-08-01 13:23:30+00:00,2024-08-01 18:15:31
30,WW Grainger cuts 2024 sales forecast on slow demand - MarketScreener,"Second-quarter sales for the company, which competes with Fastenal and WESCO, rose 3.1% to $4.31 billion. Adjusted per-share earnings for the quarter ...",www.marketscreener.com,2024-08-01 13:07:02+00:00,2024-08-01 18:15:31
31,Stocks Turn Negative on US Economic Concerns - TradingView,"Ventas Inc (VTR), Vertex Pharmaceuticals Inc (VRTX), WW Grainger Inc (GWW), Xcel Energy Inc (XEL). ... Company. About- Features- Pricing- Social ...",www.tradingview.com,2024-08-01 19:45:45+00:00,2024-08-01 21:15:24
32,WW Grainger falls after cutting 2024 revenue forecast - XM,... supplier WW Grainger GWW.N fall ~5% to $926.95. ** GWW lowers its annual sales forecast due to slower-than-expected demand. ** Co expects 2024 sales ...,www.xm.com,2024-08-01 23:01:03+00:00,2024-08-02 00:15:24
33,"Stock Market Slides as Manufacturing Slump Deepens, Construction Spending Falls","Ventas Inc (VTR), Vertex Pharmaceuticals Inc (VRTX), WW Grainger Inc (GWW), Xcel Energy Inc (XEL). ... Company information- Work at The Globe ...",www.theglobeandmail.com,2024-08-01 15:05:05+00:00,2024-08-02 00:15:24
34,WW Grainger cuts 2024 sales forecast on slow demand - MSN,"The Lake Forest, Illinois-based company now expects 2024 sales to be between $17 billion and $17.3 billion, down from its previous forecast of ...",www.msn.com,2024-08-02 01:41:44+00:00,2024-08-02 15:16:00
35,"Analyst trims WW Grainger stock target, retains Sector Perform on macro softness","In other recent news, W.W. Grainger reported a 3.1% increase in sales for the second quarter of 2024. The company's High-Touch Solutions segment and ...",www.investing.com,2024-08-02 15:03:37+00:00,2024-08-02 18:15:25
36,Analysts' Opinions Are Mixed on These Industrial Goods Stocks: Beacon Roofing Supply ...,"... Company, and Honeywell International. Currently, the analyst consensus on WW Grainger is a Hold with an average price target of $980.67, implying ...",markets.businessinsider.com,2024-08-02 15:58:40+00:00,2024-08-02 21:15:31
37,RBC Capital Keeps Their Buy Rating on Tetra Tech (TTEK) | Markets Insider,"Analysts' Opinions Are Mixed on These Industrial Goods Stocks: Beacon Roofing Supply (BECN), Tetra Tech (TTEK) and WW Grainger (GWW). TipRanks 8h.",markets.businessinsider.com,2024-08-02 18:16:58+00:00,2024-08-03 00:15:34
38,WW Grainger (GWW) Gets a Hold from RBC Capital | Markets Insider,"The company's shares closed yesterday at $942.36. Dray covers the Industrials sector, focusing on stocks such as Wesco International, Xylem, and Graco ...",markets.businessinsider.com,2024-08-02 16:30:45+00:00,2024-08-03 16:15:27
39,WW Grainger (GWW) Receives a Rating Update from a Top Analyst | Markets Insider,"The company's shares closed yesterday at $942.36. According to TipRanks, Glynn is a top 100 analyst with an average return of 16.3% and a 62.85% ...",markets.businessinsider.com,2024-08-02 16:23:35+00:00,2024-08-03 16:15:27
