,Heading,Subheading,Publisher,Published,Found
696,Flights resume after global IT crash wreaks havoc | National | dailygazette.com,... Hudson Register Star- Catskill Daily Mail- Galleries- Photo Galleries ... The company also said it could take a few days for a full return to ...,www.dailygazette.com,2024-07-20 19:29:38+00:00,2024-07-20 23:06:39
697,Malicious actors trying to exploit global tech outage for their own gain | KWKT - FOX 44,I was a little surprised that the cause of it was a software update from a very well-respected cybersecurity company ... Hudson- Remarkable Women ...,www.fox44news.com,2024-07-20 23:25:54+00:00,2024-07-21 01:06:39
698,Tech outage latest | Airlines rush to get back on track after global tech disruption,The company says the problem occurred when it deployed a faulty update ... Hudson Area Library. 6:00PM. Promote your event- Jul 19- Concert ...,www.dailygazette.com,2024-07-20 20:23:24+00:00,2024-07-21 01:06:39
699,"Kate Hudson, Matthew McConaughey Are 'Open' to 'How to Lose a Guy' Sequel - Variety",Global- VIP+ Tech. Expand the sub menu. Global- News- Asia- Markets ... Company Logo. Your Privacy Choices (Texas Residents). As explained in our ...,variety.com,2024-07-21 13:38:25+00:00,2024-07-21 16:06:38
700,"Business People: LuAnn Hudson, Firstar Bank - Tulsa World","Mike Leonard, Chairman of Firstar Bank, announced the hiring of LuAnn Hudson as a Senior Vice President and Relationship Manager.",tulsaworld.com,2024-07-21 13:31:39+00:00,2024-07-21 16:06:38
701,"Airlines still recovering from global technology outage at Chicago's O'Hare, Midway airports","In an update Friday night, the company said they were ""actively working with customers impacted"" by the issue. ... Jennifer Hudson surprises fans at ...",abc7chicago.com,2024-07-21 13:18:40+00:00,2024-07-21 16:06:38
702,Mostly sunny Sunday for the Hudson Valley | National - Georgetown News-Graphic,Fenix24 Issues Open-Source Solution for Global CrowdStrike-related Issues- VIRGINIA NATIONAL BANKSHARES CORPORATION ANNOUNCES 2024 SECOND QUARTER ...,www.news-graphic.com,2024-07-21 10:09:42+00:00,2024-07-21 16:06:38
703,Flights resume after global IT crash wreaks havoc | National | dailygazette.com,The company also said it could take a few days for things to fully get ... Hudson Area Library. 6:00PM. Promote your event- Jul 21- Concert ...,www.dailygazette.com,2024-07-21 08:44:35+00:00,2024-07-21 16:06:38
704,WeLoveU volunteers pitch in to help rebuild Grenada - Mid Hudson News,Representatives of the foundation expressed the Chairwoman's eagerness to support all people of the global ... Company thrives under Halayko's ...,midhudsonnews.com,2024-07-21 14:45:33+00:00,2024-07-21 17:06:39
705,"Hudson's Bay explores 'major reinvention,' considers real estate IPO - Fashion Network","Canadian department store operator Hudson's Bay Co said on Wednesday it ... global consolidator,"" Baker said from the Netherlands, where the ...",in.fashionnetwork.com,2024-07-21 04:25:23+00:00,2024-07-21 17:06:39
706,Hudson Value Partners LLC Purchases 1860 Shares of JPMorgan Chase &amp; Co. (NYSE:JPM),"JPMorgan Chase & Co. makes up about 1.4% of Hudson Value Partners LLC's portfolio, making the stock its 28th biggest holding. Hudson Value Partners ...",www.defenseworld.net,2024-07-21 16:56:34+00:00,2024-07-21 18:06:41
707,"Sun, clouds and a possible stray shower in the Hudson Valley | National | benningtonbanner.com",BENNINGTON — The Better Bennington Corporation has been designated an Affiliate Main Street … 'A global destination': Vermont's tourism celebrated by ...,www.benningtonbanner.com,2024-07-21 18:58:57+00:00,2024-07-21 21:06:38
708,TD Asset Management Inc Buys 277261 Shares of JPMorgan Chase &amp; Co. (NYSE:JPM),"Hudson Value Partners LLC now owns 16,469 shares of the financial services provider's stock worth $3,299,000 after purchasing an additional 1,860 ...",www.defenseworld.net,2024-07-21 18:47:13+00:00,2024-07-21 21:06:38
709,Polar bear tracking tech breakthrough could boost conservation as climate heats up,"Two important groups of polar bears in Hudson Bay, Canada, face becoming locally extinct if global temperatures continue to increase, according to a ...",nz.news.yahoo.com,2024-07-20 09:59:10+00:00,2024-07-21 23:06:30
710,"Join China Hi-Tech Fair 2024, Where Innovation Meets Global Opportunity - Valdosta Daily Times",... companies and 400+ CEOs and entrepreneurs from multinational corporations. ... Weekday Pottery. Turner Center for the Arts - Hudson Pottery Studio.,www.valdostadailytimes.com,2024-07-22 00:40:28+00:00,2024-07-22 02:06:38
711,Recollections and reflections — on assassinations | HUDSON | Opinion - Colorado Politics,"Many storefronts remained untouched, including the phone company. I ... You may also enable the Global Privacy Control to opt out of targeted ...",www.coloradopolitics.com,2024-07-22 07:08:57+00:00,2024-07-22 11:06:39
712,Advanced Power Cable Technologies: Transforming Global Energy Infrastructure,"... Company and Abu Dhabi National Energy Company PJSC (TAQA). This ... Hudson Power Express, in the United States. Valued at more than EUR 1.4 ...",timestech.in,2024-07-22 06:29:46+00:00,2024-07-22 11:06:39
713,ON THE MOVE: Raakhee Miller Joins Siebert; Haidee Lee to Goldman Sachs,"Carsten and Haidee join from J.P. Morgan where they served as Global Co-Heads of the Strategic Investor Group M&A franchise. ... Google Cloud, Hudson ...",www.tradersmagazine.com,2024-07-22 06:04:52+00:00,2024-07-22 11:06:39
714,The Broe Group and Hudson Valley Parking Trust Acquire ICON Parking - PR Newswire,"PRNewswire/ -- The Broe Group, a multi-billion-dollar, privately-held investment company with holdings in strategic markets across the United ...",www.prnewswire.com,2024-07-22 12:16:48+00:00,2024-07-22 14:06:39
715,Biden steps aside: Hudson Valley reacts to president's decision | National | benningtonbanner.com,News 12's Lisa LaRocca is in Westchester County this morning getting reactions to the president's decision.,www.benningtonbanner.com,2024-07-22 11:59:26+00:00,2024-07-22 14:06:39
716,ICON parking bought by Broe Group and Hudson Valley Parking Trust - The Real Deal,"Hudson Valley Parking Trust has teamed with The Broe Group to purchase ICON Parking, the NYC's largest parking company.",therealdeal.com,2024-07-22 15:22:03+00:00,2024-07-22 16:06:42
717,Environmentalists blast EPA report on PCB removal from Hudson,A coalition of environmental groups under the banner Friends of a Clean Hudson is blasting the U.S. Environmental Protection Agency's (EPA) latest ...,westfaironline.com,2024-07-22 14:19:10+00:00,2024-07-22 16:06:42
718,"Quick Chick 3 and Mark Bluman Race to the Win in the $40,000 Go Rentals CSI3 ... - The Plaid Horse","International show jumping competition continued during HITS-on-the-Hudson IV at HITS Hudson Valley in Saugerties, New York, on Friday, July 19 ...",www.theplaidhorse.com,2024-07-22 13:52:12+00:00,2024-07-22 16:06:42
719,The Broe Group and Hudson Valley Parking Trust Acquire ICON Parking - Yahoo Finance,"The Broe Group, a multi-billion-dollar, privately-held investment company with holdings in strategic markets across the United States, ...",finance.yahoo.com,2024-07-22 11:04:08+00:00,2024-07-22 16:06:42
720,Shaperon Publishes Efficacy of Next-Generation Cancer Immunotherapy in International Journal,"(Kosdaq 378800, CEO Seung-Yong Seong), a biotech company specializing in innovative immune therapeutics and a headquarter of Hudson in Korea, has ...",ktla.com,2024-07-22 13:46:45+00:00,2024-07-22 17:06:42
721,Biden steps aside: Hudson Valley reacts to president's decision | Nation | griffonnews.com,Fairmount Park track sells to Chicago gaming company. Officials promise long-awaited casino. St. Louis hospitals hit by global IT outage. Some ...,www.griffonnews.com,2024-07-22 12:13:35+00:00,2024-07-22 17:06:42
722,Stock market today: Global shares are mixed after Biden withdraws from the 2024 race,The company said the problem lay in a faulty update sent to computers ... FOX2548 & WIProud Video. Hudson honors fallen deputy Katie Leising. 1 ...,www.wiproud.com,2024-07-22 11:09:40+00:00,2024-07-22 17:06:42
723,Troubled Boeing stays close to the ground at a major UK air show - Times Union,Hudson Valley- Business- Opinion- Entertainment- Food ... The president of Boeing's international strategy and operations division said the company ...,www.timesunion.com,2024-07-22 09:36:46+00:00,2024-07-22 18:06:37
724,ICON Parking Acquired by The Broe Group and Hudson Valley - Mile High CRE,"Led by industry leader Jerry Skillett, Hudson Valley Parking Trust is a global parking platform with a proven record of successful industry ...",milehighcre.com,2024-07-22 17:39:37+00:00,2024-07-22 19:06:37
725,Global Relay Announces Integration with OpenAI's ChatGPT Enterprise Compliance API,"Companies in all sectors, including Global Relay's client roster of ... Hudson Pottery Studio- Thu, Jul 18. Beginning Guitar Lessons - The Hal ...",www.valdostadailytimes.com,2024-07-22 14:14:27+00:00,2024-07-22 19:06:37
726,The M&amp;A Class Action Firm Investigates Merger of Hudson Acquisition I Corp. – HUDA | Morningstar,SHAREHOLDER INVESTIGATION: The M&A Class Action Firm Investigates Merger of Hudson Acquisition I Corp. ... Global Contacts- Affiliate Program- United ...,www.morningstar.com,2024-07-22 21:03:58+00:00,2024-07-22 23:06:38
727,Royden Hudson Wins $900k in the Fanatics 5 Jackpot - Yahoo Finance,"... global digital sports platform, announced that Royden Hudson from Tennessee won $900000 in Fanatics 5 Jackpot, the company's new free to play game ...",finance.yahoo.com,2024-07-22 22:17:31+00:00,2024-07-23 00:06:42
728,Royden Hudson Wins $900k in the Fanatics 5 Jackpot | Morningstar,... company's new free to play game available on the Fanatics app. ... Fanatics has an established database of over 100 million global sports fans; a global ...,www.morningstar.com,2024-07-22 22:56:09+00:00,2024-07-23 02:06:41
729,Wpp's GroupM Names Brian Lesser Global CEO - IMDb,... company's most senior U.S. leadership roles in recent years. Lesser ... Kate Hudson Says She and Matthew McConaughey Are 'Both Totally Open ...,m.imdb.com,2024-07-22 15:00:14+00:00,2024-07-23 02:06:41
730,Rob Hudson Joins AllGear Digital as Head of Sales - PR Newswire,"Hudson's wealth of experience in executive leadership, business ... Global Sites. Asia- APAC- APAC - Traditional Chinese- Brazil- Canada- Czech ...",www.prnewswire.com,2024-07-23 04:08:40+00:00,2024-07-23 06:06:40
731,"Darren Walker, president of Ford Foundation, will step down by the end of 2025","Hudson Valley- Business- Opinion- Entertainment- Food- Sports- Obituaries- Puzzles- Best of the Capital Region- Business. Darren Walker, ...",www.timesunion.com,2024-07-23 03:45:02+00:00,2024-07-23 06:06:40
732,“Safehaven” Producers Resolve Litigation With Strong Global Entertainment - Valdosta Daily Times,"Ravenwood-Productions is a Denver-based film and television company formed by James Seale and Kevin V. Duncan. ... Hudson Pottery Studio- Thu, Jul ...",www.valdostadailytimes.com,2024-07-23 03:03:37+00:00,2024-07-23 06:06:40
733,Wilton company to auction hundreds of historic objects - Westfair Communications,"Jeremy Wayne's Best Business Choices — Amenta Nutrition, Hastings on Hudson ... CNN WIRE ...",westfaironline.com,2024-07-23 02:44:00+00:00,2024-07-23 06:06:40
734,Antaisolar Ranks 12th in Global Solar Tracker Shipments - Yahoo Finance,... company's international strategy and its deep penetration in the global tracker market. ... Ernie Hudson Recalls Emotional Dinner with “The Crow ...,sg.finance.yahoo.com,2024-07-23 01:55:01+00:00,2024-07-23 07:06:49
735,Royden Hudson Wins $900k in the Fanatics 5 Jackpot | Region | eagletribune.com,"... global digital sports platform, announced that Royden Hudson from Tennessee won $900000 in Fanatics 5 Jackpot, the company's new.",www.eagletribune.com,2024-07-23 01:42:01+00:00,2024-07-23 07:06:49
736,CITRIN COOPERMAN'S MAUFACTURING AND DISTRIBUTION SURVEY REPORT,"... Global Network Limited (MGNL). Link: https://westfaironline.com ... Jeremy Wayne's Best Business Choices — Amenta Nutrition, Hastings on Hudson.",westfaironline.com,2024-07-23 01:39:04+00:00,2024-07-23 07:06:49
737,Barings Announces Investment in Diversified Packaging | Business | valdostadailytimes.com,"... Global Private Finance Group. “Diversified Packaging is an attractive ... Turner Center for the Arts - Hudson Pottery Studio- Mon, Jul 22 ...",www.valdostadailytimes.com,2024-07-23 01:24:21+00:00,2024-07-23 07:06:49
738,"Two Retail Giants Merge, Creating Powerhouse Company: REPORT - MSN","After months of negotiation, Hudson's Bay Company's (HBC) Saks Fifth ... The company formed by the merger will be called Saks Global, and ...",www.msn.com,2024-07-22 16:12:14+00:00,2024-07-23 07:06:49
739,Hudson Technologies to Host Conference Call to Discuss Second Quarter 2024 Results,"International callers may dial (919) 882-2331. Callers should use conference ID: 50910. About Hudson Technologies. Hudson Technologies, Inc. is a ...",www.globenewswire.com,2024-07-23 12:38:28+00:00,2024-07-23 15:06:52
740,Frank Truatt of WTBQ celebrates 30 years on the air - Mid Hudson News,"In this day and age everyone gets their national and global news from the web but where do they get their local news, the news that affects them ...",midhudsonnews.com,2024-07-23 13:38:12+00:00,2024-07-23 16:06:45
741,FACT SHEET: Biden-Harris Administration Announces New Actions to Detect and Reduce ...,"ClimeCo, a global sustainability company and the largest developer of ... Hudson Valley Regional Council to reduce fugitive methane emissions ...",www.whitehouse.gov,2024-07-23 12:50:37+00:00,2024-07-23 16:06:45
742,"La Maviglia resort and medi-spa launching in Puglia in 2027, designed by Oppenheim Architecture",Four Seasons Hotels and Resorts and global real estate firm and developer Omnam Group ... by Kath Hudson | 13 Jun 2024- View comments | Sign up ...,www.cladglobal.com,2024-07-23 08:42:39+00:00,2024-07-23 16:06:45
743,Discovery Guarantor 2 Ltd. Ratings Affirmed On Planned Acquisition; Outlook Stable,"Based on the proposed capital structure, we expect the company's S&P Global ... Edward J Hudson. Secondary Contact, New York. P.+ 1 (212) 438 2764.",disclosure.spglobal.com,2024-07-23 06:12:48+00:00,2024-07-23 16:06:45
744,Planet Fitness lands in Europe with first launch in Spain - Leisure Opportunities,"Kath Hudson rounds up recent activity. More News. 1 - 15 of 68,042 ... Rianna Riego joins Seed to Skin as director of global business development.",www.leisureopportunities.co.uk,2024-07-23 03:22:55+00:00,2024-07-23 16:06:45
745,CrowdStrike CEO called to testify to Congress over cybersecurity's firm role in global tech outage,Hudson Valley- Business- Opinion- Entertainment- Food- Sports- Obituaries- Puzzles- Best of the Capital Region- Business. CrowdStrike CEO ...,www.timesunion.com,2024-07-23 06:56:50+00:00,2024-07-23 17:06:51
746,Is FM Global Logistics Holdings Berhad's (KLSE:FM) Latest Stock Performance Being Led ...,... company compared to companies that don't necessarily bear these characteristics. ... Ernie Hudson Recalls Emotional Dinner with “The Crow” Costar ...,uk.finance.yahoo.com,2024-07-23 01:59:16+00:00,2024-07-23 17:06:51
747,US is investigating Delta's flight cancellations and faltering response to global tech outage,Hudson Valley- Business- Opinion- Entertainment- Food- Sports- Obituaries- Puzzles- Best of the Capital Region. BREAKING. 10 min ago. HVCC's ...,www.timesunion.com,2024-07-23 17:10:01+00:00,2024-07-23 18:06:52
748,Hudson Bay Joins Hedge Funds Locking Up Investor Cash for Longer - Bloomberg,"Sander Gerber's firm in April transitioned clients in its flagship fund to a 12.5% quarterly investor gate level, down from 25% — meaning it will now ...",www.bloomberg.com,2024-07-23 16:34:35+00:00,2024-07-23 18:06:52
749,"People, Passion, Planet: Mary Kay Releases 2024 Sustainability Report - Valdosta Daily Times",That dream has blossomed into a global company with millions of independent sales force members in more than 35 countries. ... Turner Center Hudson ...,www.valdostadailytimes.com,2024-07-23 15:31:40+00:00,2024-07-23 18:06:52
750,"Saks Global Takes Shape, Triggers Appointments, Consolidations And Layoffs","... companies will be consolidated under the Saks Global corporate umbrella. ... Also, HBC's Canadian business, which includes TheBay.com, the Hudson's ...",finance.yahoo.com,2024-07-23 18:54:30+00:00,2024-07-23 21:06:48
751,"Slash announces death of Lucy-Bleu Knight, daughter of girlfriend Meegan Hodges","Global Warming- Water & Drought- Entertainment & Arts- Arts- Books- Stand ... Hudson passed peacefully in Los Angeles, CA on July 19, 2024,” the ...",www.latimes.com,2024-07-23 16:43:20+00:00,2024-07-23 21:06:48
752,"La Maviglia resort and medi-spa launching in Puglia in 2027, designed by Oppenheim Architecture",Four Seasons Hotels and Resorts and global real estate firm and developer Omnam Group ... Hudson Yards and looking to the Native Americans for ...,www.cladglobal.com,2024-07-23 15:36:08+00:00,2024-07-23 21:06:48
753,The M&amp;A Class Action Firm Investigates Merger of Hudson Acquisition I Corp. - HUDA - PR Newswire,"PRNewswire/ -- Monteverde & Associates PC (the ""M&A Class Action Firm""), has recovered money for shareholders and is recognized as a Top 50 Firm ...",www.prnewswire.com,2024-07-23 20:18:33+00:00,2024-07-23 22:06:43
754,Saks Deal Leads Transitions Key Executives to Global Roles - The Impression,"Furthermore, Hudson's Bay Company's (HBC) Canadian business will be recapitalized and remain separate from Saks Global. Share. Related. John ...",theimpression.com,2024-07-23 20:02:58+00:00,2024-07-23 22:06:43
755,Gaga retreats celebrating joy of dance to kick off at Schloss Elmau in Germany,BY Kath Hudson The first bricks and mortar Kinrgy studio opens today (1 ... global private investment group Reuben Brothers. Texas welcomes ...,www.spaopportunities.com,2024-07-23 17:04:28+00:00,2024-07-24 01:06:50
756,Noxopharm Says Several Companies Evaluating Its Assets - Mirage News,"... Hudson Institute of Medical Research over the past 18 months, presenting at many international conferences and a large number of follow up meetings.",www.miragenews.com,2024-07-23 16:38:24+00:00,2024-07-24 01:06:50
757,QANTAS JOINS NEW ALLIANCE TO ACCELERATE GLOBAL SUSTAINABLE AVIATION ...,... companies to help accelerate global production of aviation biofuel. ... Qantas Group CEO Vanessa Hudson said SAFFA would invest in projects ...,www.qantasnewsroom.com.au,2024-07-24 00:07:13+00:00,2024-07-24 05:07:08
758,"SHAREHOLDER INVESTIGATION: Halper Sadeh LLC Investigates MORF, HUDA, ALE ...","Morphic Holding, Inc. (NASDAQ: MORF)'s sale to Eli Lilly and Company for $57.00 per share in cash.- Hudson Acquisition I Corp. (NASDAQ: HUDA)'s ...",www.wrbl.com,2024-07-23 22:15:02+00:00,2024-07-24 05:07:08
759,QANTAS JOINS NEW ALLIANCE TO ACCELERATE GLOBAL SUSTAINABLE AVIATION ...,The plant has now received approval to resume operations to produce low carbon intensity SAF and biochemicals. Qantas Group CEO Vanessa Hudson said ...,www.nationaltribune.com.au,2024-07-24 00:28:57+00:00,2024-07-24 06:06:54
760,"La Maviglia resort and medi-spa launching in Puglia in 2027, designed by Oppenheim Architecture",Four Seasons Hotels and Resorts and global real estate firm and developer Omnam Group ... Kath Hudson talks to Italian architect Emanuele ...,www.cladglobal.com,2024-07-23 19:21:15+00:00,2024-07-24 06:06:54
761,"eMazzanti Technologies Ceremony Celebrates Deep Bonds with Community, Clients and ...","... company's bond with the Hudson County Chamber of Commerce. ""In these uncertain times, with rising local, national and global Cyber Attacks, we are ...",www.prweb.com,2024-07-24 12:40:30+00:00,2024-07-24 14:07:13
762,StockNews.com Initiates Coverage on Hudson Global (NASDAQ:HSON) - Defense World,The firm set a “strong-buy” rating on the business services provider's stock. Get Hudson Global alerts: Hudson Global Trading Up 0.4 %. NASDAQ:HSON ...,www.defenseworld.net,2024-07-24 12:05:03+00:00,2024-07-24 14:07:13
763,"Strategic Assessment of the Global Smart Locks Market, 2024-2030 - GlobeNewswire","Hudson Lock LLC; Cansec Systems Ltd. Gantner Electronic GmbH; Kisi, Inc. Dessmann Schliessanlagen GmbH; Idency Limited; D&K GmbH & Company KG; Babuino ...",www.globenewswire.com,2024-07-24 12:03:40+00:00,2024-07-24 14:07:13
764,Hudson Global (NASDAQ:HSON) Stock Crosses Above 200 Day Moving Average of $16.08,"The business services provider reported ($0.72) EPS for the quarter, missing analysts' consensus estimates of $0.26 by ($0.98). The business had ...",www.defenseworld.net,2024-07-24 10:47:37+00:00,2024-07-24 14:07:13
765,Form N-CSRS Global X Funds For: May 31 - StreetInsider,"Global X Management Company LLC. 605 Third Avenue, 43rd floor. New York ... Hudson Pacific Properties, 4.750% <sup>‡</sup>, 339,801, 4,814,980. Kimco Realty ...",www.streetinsider.com,2024-07-24 06:09:04+00:00,2024-07-24 14:07:13
766,Digital Cooperation Organization calls for urgent talks on recent global IT outage implications,"At a closed-door meeting of House Republicans on Tuesday, National Republican Congressional Committee chairman Richard Hudson, R-N.C., urged ...",www.arabnews.pk,2024-07-24 03:34:07+00:00,2024-07-24 14:07:13
767,Republican leaders urge colleagues to steer clear of racist and sexist attacks on Harris,"Richard Hudson, R-NC., walking on stage on ... The Associated Press is an independent global news organization dedicated to factual reporting.",apnews.com,2024-07-24 13:22:42+00:00,2024-07-24 15:06:59
768,"Royalty Pharma Appoints Molly Sawaya as Executive Vice President, Head of Human Capital","... companies to leading global pharmaceutical companies. Royalty Pharma ... Hudson Bay Capital, responsible for designing and delivering the firm's ...",www.stocktitan.net,2024-07-24 12:38:12+00:00,2024-07-24 15:06:59
769,Hudson Atlantic arranges $20M Mercer County multifamily sale - NJBIZ,"... Hudson Atlantic said. ... Greg Lalevee, business manager of the International Union of Operating Engineers Local 825, speaks ...",njbiz.com,2024-07-24 12:07:51+00:00,2024-07-24 15:06:59
770,SAF: Qantas joins global alliance to accelerate sustainable aviation fuel supply - Karryon,"Qantas Group CEO Vanessa Hudson said SAFFA would invest in technologically mature projects, focusing on commercial viability, to improve access to and ...",karryon.com.au,2024-07-24 07:29:13+00:00,2024-07-24 15:06:59
771,Adam Stade - Mid Hudson News,"... Business- Community- Arts & Entertainment- Community- Education ... Global War on Terrorism Medal, Armed Forces Expeditionary Medal and the ...",midhudsonnews.com,2024-07-24 04:12:08+00:00,2024-07-24 15:06:59
772,Hudson Bay is latest fund to lock up investor cash for longer - Hedgeweek,"... Hudson Bay said in the note, highlighting that the firm achieved returns of 11% during the global financial crisis and 15% during the Covid pandemic.",www.hedgeweek.com,2024-07-24 15:35:40+00:00,2024-07-24 16:07:13
773,Events group Ascential jumps after agreeing £1.2 billion takeover by rival Informa,"On top of this, Ascential has agreed that if the sale of US media management firm Hudson ... global platform and operations to enable Ascential's ...",www.sharesmagazine.co.uk,2024-07-24 10:18:01+00:00,2024-07-24 16:07:13
774,Will Saks Global create the ultimate department store behemoth? - Inside Retail,Hudson's Bay Company agreed to acquire Neiman Marcus and Bergdorf Goodman in a US$2.65 billion deal and plans to establish Saks Global.,insideretail.com.au,2024-07-24 09:04:43+00:00,2024-07-24 16:07:13
775,"Commercial Rates Are Flat, Says New Report From Marsh - - Insurance Edge",... Global Insurance Market Index ... Mid-Hudson Co-Operative Insurance Company (MHC) has selected Sequel Business ...,insurance-edge.net,2024-07-24 08:30:17+00:00,2024-07-24 16:07:13
776,KKR-Backed OneStream Shares Climb 33% After $490 Million IPO - BNN Bloomberg,"... Hudson, New York, U.S., on Tuesday, April 6, 2021 ... The company's shares are trading on the Nasdaq Global Select Market under the symbol OS.",www.bnnbloomberg.ca,2024-07-24 17:18:31+00:00,2024-07-24 18:07:14
777,"Saks Global Layoffs: 100 let go as Saks Fifth Avenue, Saks Off 5th, Neiman Marcus merge","Saks Global is a subsidiary of Hudson's Bay Company. Official ... Group under Saks Global. This merger is pending government approval, with ...",stlawyers.ca,2024-07-24 16:45:54+00:00,2024-07-24 18:07:14
778,FTSE 100-listed Informa agrees takeover of rival Ascential for £1.2bn - Proactive Investors,... business and finance news content to a global investment audience. ... Ascential is in the midst of selling off its Hudson MX media management business ...,www.proactiveinvestors.co.uk,2024-07-24 13:09:36+00:00,2024-07-24 18:07:14
779,Official Opening of New UK Manufacturing Facility | Company Announcement - Investegate,... global demand currently in the Company's commercial pipeline. Supported ... +44 (0)20 7920 3150. Simon Hudson / Saskia Sizen / Adam Baynes.,www.investegate.co.uk,2024-07-24 08:00:42+00:00,2024-07-24 18:07:14
780,Q4 2024 Seagate Technology Holdings PLC Earnings Call - Yahoo Finance,"Participants. Shanye Hudson; Senior Vice President, Investor Relations ... Form 8.3 - International Paper Company. 13 minutes ago. Variety. Vince ...",uk.finance.yahoo.com,2024-07-24 14:13:01+00:00,2024-07-24 19:07:05
781,"News | Investors Partner To Buy Icon, New York's Largest Parking Company - CoStar","Broe Group, Hudson Valley Parking Trust Plan To Expand Operations. ... global parking operator and investor, to buy 100% of Icon, the new ...",www.costar.com,2024-07-24 20:19:21+00:00,2024-07-24 21:07:11
