,Heading,Subheading,Publisher,Published,Found
0,"Milbank Lands Chief Trial Counsel at FTC, Amid Growth in Antitrust and Regulatory Practices","Milbank offices at 55 Hudson Yards, on the west side of Manhattan. Photo ... © 2024 ALM Global, LLC, All Rights Reserved. Request academic re-use ...",www.law.com,2024-06-18 14:02:16,2024-06-18 15:15:52
1,Hudson Valley Lighting Unveils New Collections at Lightovation,Hudson Valley Lighting Group will launch new collections for Mitzi and ... Global Trend Ambassador Patti Carpenter will lead a lighting design tour on ...,www.furniturelightingdecor.com,2024-06-18 14:01:43,2024-06-18 15:15:52
2,"Mango continues its global expansion with new stores in Nice, New York, and Barcelona","The company has recently opened a new boutique dedicated to its women's line, located in the Hudson Yards shopping center on Manhattan's West Side.",ww.fashionnetwork.com,2024-06-18 11:10:19,2024-06-18 15:15:52
3,Little Island | Arup,"A multi-media entertainment venue on the Hudson River, visitors are ... We are a global collective dedicated to sustainable development. We use ...",www.arup.com,2024-06-18 10:13:56,2024-06-18 15:15:52
4,Insolvencies slow in May as trading conditions improve - Proactive Investors,... business and finance news content to a global investment audience. All our ... David Hudson at consultancy firm FRP believes that while insolvency ...,www.proactiveinvestors.co.uk,2024-06-18 09:50:13,2024-06-18 15:15:52
5,Amazon Just Walk Out tech powered Hudson Nonstop store hits Washington Dulles ...,"A new Hudson Nonstop store has opened at Washington Dulles International Airport (IAD) in the US. Located in Terminal A, this is Hudson's 15th ...",retailtechinnovationhub.com,2024-06-18 07:18:58,2024-06-18 15:15:52
6,Bristol Myers Squibb Announces Dividend | Business | valdostadailytimes.com,"Bristol Myers Squibb is a global biopharmaceutical company whose ... Weekday Pottery. Turner Center for the Arts - Hudson Pottery Studio- Mon, Jun 17 ...",www.valdostadailytimes.com,2024-06-18 06:35:13,2024-06-18 15:15:52
7,Bankruptcy judge approves sale of Express Inc to group led by WHP Global - Times Union,Hudson Valley- Business- Opinion- Entertainment- Food- Sports- Obituaries- Puzzles- Best of the Capital Region. BREAKING. 40 min ago. Cohoes ...,www.timesunion.com,2024-06-18 05:41:56,2024-06-18 15:15:52
8,Hudson Acquisition I Corp. Announces Receipt of Notice from - GlobeNewswire,Company Contact: Hudson Acquisition I Corp. Pengfei Xie Telephone: +1(917) 345-0953. Investor and Media Contact: International Elite Capital Inc.,www.globenewswire.com,2024-06-18 03:43:48,2024-06-18 15:15:52
9,Time Is Running Out for the Hudson Bay Polar Bears - Smithsonian Magazine,The southern and western subpopulations are on track to disappear as sea ice becomes too thin amid rising global temperatures. ... Company Logo. Privacy ...,www.smithsonianmag.com,2024-06-18 03:30:04,2024-06-18 15:15:52
10,TPI Composites Announces Agreement to Divest Automotive Business Unit as a Part of ...,"TPI Composites, Inc. is a global company focused on innovative and sustainable solutions to decarbonize and electrify the world. ... Hudson have served ...",quantisnow.com,2024-06-18 03:06:28,2024-06-18 15:15:52
11,Closing Bell: Hudson Resources Inc up on Tuesday (HUD) - The Globe and Mail,"... Corporation (""Sigma Lithium"" or the ""Company"") (NASDAQ: SGML, TSXV: SGML, BVMF: S2GM34), a leading global lithium producer dedicated to powering ...",www.theglobeandmail.com,2024-06-17 20:56:59,2024-06-18 15:15:52
12,Chegg Announces Restructuring Plan and New Vision for Growth - Markets data,"Reduce its global headcount by 23% to become a leaner, more efficient organization ... Hudson , press@chegg.com. Source: Chegg.",markets.ft.com,2024-06-17 15:53:31,2024-06-18 15:15:52
13,Cantor hires Deepak Mathivanan as Senior Internet Research Analyst - Yahoo Finance,"Cantor, part of the Cantor Fitzgerald group of companies, is a premier global financial institution. ... Hudson Acquisition I Corp. Announces Receipt ...",sg.finance.yahoo.com,2024-06-17 15:48:28,2024-06-18 15:15:52
14,"Vosyn Unveils AI Advancements at Collision Conference, Announces $8MM Round","... global company of over 400 innovators. We are set to redefine the ... Hudson Bay budget sees no tax increase, but higher garbage fees. 7 minutes ago.",ca.finance.yahoo.com,2024-06-17 15:17:41,2024-06-18 15:15:52
15,"Milbank Lands Chief Trial Counsel at FTC, Amid Growth in Antitrust and Regulatory Practices","Milbank offices at 55 Hudson Yards, on the west side of Manhattan. Photo ... © 2024 ALM Global, LLC, All Rights Reserved. Request academic re-use ...",www.law.com,2024-06-18 19:02:16+00:00,2024-06-19 17:06:38
16,Hudson Valley Lighting Unveils New Collections at Lightovation,Hudson Valley Lighting Group will launch new collections for Mitzi and ... Global Trend Ambassador Patti Carpenter will lead a lighting design tour on ...,www.furniturelightingdecor.com,2024-06-18 19:01:43+00:00,2024-06-19 17:06:38
17,"Mango continues its global expansion with new stores in Nice, New York, and Barcelona","The company has recently opened a new boutique dedicated to its women's line, located in the Hudson Yards shopping center on Manhattan's West Side.",ww.fashionnetwork.com,2024-06-18 16:10:19+00:00,2024-06-19 17:06:38
18,Little Island | Arup,"A multi-media entertainment venue on the Hudson River, visitors are ... We are a global collective dedicated to sustainable development. We use ...",www.arup.com,2024-06-18 15:13:56+00:00,2024-06-19 17:06:38
19,Insolvencies slow in May as trading conditions improve - Proactive Investors,... business and finance news content to a global investment audience. All our ... David Hudson at consultancy firm FRP believes that while insolvency ...,www.proactiveinvestors.co.uk,2024-06-18 14:50:13+00:00,2024-06-19 17:06:38
20,Amazon Just Walk Out tech powered Hudson Nonstop store hits Washington Dulles ...,"A new Hudson Nonstop store has opened at Washington Dulles International Airport (IAD) in the US. Located in Terminal A, this is Hudson's 15th ...",retailtechinnovationhub.com,2024-06-18 12:18:58+00:00,2024-06-19 17:06:38
21,Bristol Myers Squibb Announces Dividend | Business | valdostadailytimes.com,"Bristol Myers Squibb is a global biopharmaceutical company whose ... Weekday Pottery. Turner Center for the Arts - Hudson Pottery Studio- Mon, Jun 17 ...",www.valdostadailytimes.com,2024-06-18 11:35:13+00:00,2024-06-19 17:06:38
22,Bankruptcy judge approves sale of Express Inc to group led by WHP Global - Times Union,Hudson Valley- Business- Opinion- Entertainment- Food- Sports- Obituaries- Puzzles- Best of the Capital Region. BREAKING. 40 min ago. Cohoes ...,www.timesunion.com,2024-06-18 10:41:56+00:00,2024-06-19 17:06:38
23,Hudson Acquisition I Corp. Announces Receipt of Notice from - GlobeNewswire,Company Contact: Hudson Acquisition I Corp. Pengfei Xie Telephone: +1(917) 345-0953. Investor and Media Contact: International Elite Capital Inc.,www.globenewswire.com,2024-06-18 08:43:48+00:00,2024-06-19 17:06:38
24,Time Is Running Out for the Hudson Bay Polar Bears - Smithsonian Magazine,The southern and western subpopulations are on track to disappear as sea ice becomes too thin amid rising global temperatures. ... Company Logo. Privacy ...,www.smithsonianmag.com,2024-06-18 08:30:04+00:00,2024-06-19 17:06:38
25,TPI Composites Announces Agreement to Divest Automotive Business Unit as a Part of ...,"TPI Composites, Inc. is a global company focused on innovative and sustainable solutions to decarbonize and electrify the world. ... Hudson have served ...",quantisnow.com,2024-06-18 08:06:28+00:00,2024-06-19 17:06:38
26,Closing Bell: Hudson Resources Inc up on Tuesday (HUD) - The Globe and Mail,"... Corporation (""Sigma Lithium"" or the ""Company"") (NASDAQ: SGML, TSXV: SGML, BVMF: S2GM34), a leading global lithium producer dedicated to powering ...",www.theglobeandmail.com,2024-06-18 01:56:59+00:00,2024-06-19 17:06:38
27,Chegg Announces Restructuring Plan and New Vision for Growth - Markets data,"Reduce its global headcount by 23% to become a leaner, more efficient organization ... Hudson , press@chegg.com. Source: Chegg.",markets.ft.com,2024-06-17 20:53:31+00:00,2024-06-19 17:06:38
28,Cantor hires Deepak Mathivanan as Senior Internet Research Analyst - Yahoo Finance,"Cantor, part of the Cantor Fitzgerald group of companies, is a premier global financial institution. ... Hudson Acquisition I Corp. Announces Receipt ...",sg.finance.yahoo.com,2024-06-17 20:48:28+00:00,2024-06-19 17:06:38
29,"Vosyn Unveils AI Advancements at Collision Conference, Announces $8MM Round","... global company of over 400 innovators. We are set to redefine the ... Hudson Bay budget sees no tax increase, but higher garbage fees. 7 minutes ago.",ca.finance.yahoo.com,2024-06-17 20:17:41+00:00,2024-06-19 17:06:38
30,Loch Lomond Group reveals single cask bottling at Dubai International Airport - DFNI,"Loch Lomond Group Managing Director – Global Travel Retail, Luke Maga said ... HMSHost and Hudson win at 2024 Excellence in Airport Concessions Awards ...",www.dfnionline.com,2024-06-20 02:32:01+00:00,2024-06-20 05:06:22
31,VML Dominates The D Show,"VML's campaigns for Ford Motor Company and Hudson Rouge's work for Lincoln stood out among the competition. Together, VML and Hudson Rouge drove ...",www.vml.com,2024-06-20 01:18:18+00:00,2024-06-20 05:06:22
32,"Precursor Ventures founder Charles Hudson on investing early, how the landscape for ... - Fortune","Hudson founded Precursor in 2015 as a generalist firm focusing on early stage companies and founders. The firm now has $230 million in AUM, ...",fortune.com,2024-06-19 23:57:27+00:00,2024-06-20 05:06:22
33,Hudson Sandler opens office in South Africa | PR Week,"According to the agency's website, half of its business is now generated from clients based outside the UK. The agency operates in major global ...",www.prweek.com,2024-06-19 22:37:58+00:00,2024-06-20 05:06:22
34,Zeta Global Announces Expanded Functionality from Zeta Opportunity Engine (ZOE ... - Quantisnow,"Zeta Global (NYSE:ZETA), a cloud-based marketing technology company ... The second annual conference in NYC's Hudson Yards will explore how creativity ...",quantisnow.com,2024-06-19 22:31:34+00:00,2024-06-20 05:06:22
35,Didi IPO would give Hong Kong its dream comeback - Reuters,By Hudson Lockett ... Screen for heightened risk individual and entities globally to help uncover hidden risks in business relationships and human ...,www.reuters.com,2024-06-19 18:08:28+00:00,2024-06-20 05:06:22
36,Annual Chief Diversity Officer Summit and Honors - Hudson Valley Press,"The event's purpose is to highlight the contributions of great champions of corporate diversity, equity, and inclusion (DEI), including impactful ...",hudsonvalleypress.com,2024-06-19 16:02:08+00:00,2024-06-20 05:06:22
37,U.S. activist investor urges Hudson's Bay to go private | Reuters,"... Hudson's Bay Co to explore alternatives including taking the company private ... Reuters provides business, financial, national and international news ...",www.reuters.com,2024-06-19 15:55:37+00:00,2024-06-20 05:06:22
38,Bill Belichick Signed His 24-Year-Old Girlfriend's Textbook When They First Met in 2021,TMZ reported that Hudson helped him with all his business endeavors and took her on a business trip to Croatia. Hudson was also seen attending Tom ...,www.complex.com,2024-06-19 15:55:33+00:00,2024-06-20 05:06:22
39,"Chicago Partners Investment Group LLC Makes New $125,000 Investment in ... - Defense World",Hudson Pacific Properties (NYSE: HPP) is a real estate investment trust serving dynamic tech and media tenants in global epicenters for these ...,www.defenseworld.net,2024-06-19 13:07:21+00:00,2024-06-20 05:06:22
40,Have Hudson Technologies Insiders Been Selling Stock? - Simply Wall St News,"Investors may wish to note that the Lead Independent Director of Hudson Technologies, Inc. , Vincent Abbatecola...",simplywall.st,2024-06-19 10:38:58+00:00,2024-06-20 05:06:22
41,Half of nation's auto dealers 'affected dramatically' by cyberattack - Detroit Free Press,"... Group in White Lake, Highland Township, Holly, Waterford and New Hudson. ... “Two days ago, our operating system, which is a company called CDK Global, ...",www.freep.com,2024-06-22 04:06:37+00:00,2024-06-22 05:06:32
42,Sanofi boss: I back British science but politicians make it hard - The Times,"Paul Hudson is getting into the spirit of the Olympic Games. Sanofi, the French drugs company that he leads, is one of the sponsors and Hudson has ...",www.thetimes.com,2024-06-22 02:49:42+00:00,2024-06-22 05:06:32
43,NEW ERA OF ACADEMIC EXCELLENCE AND THREE NEW BOARD MEMBERS FOR UNIVERSITY,"|Binder, advising companies and nonprofits globally. Frayter began her ... PSC approves $62.59M settlement with Central Hudson ...",westfaironline.com,2024-06-22 01:37:47+00:00,2024-06-22 05:06:32
44,How Qantas plans to turn Perth into its second-biggest gateway - FlightGlobal,... Hudson described the deal as ”very strategic” for the business. Qantas ... Global Logo. Company Logo. About Your Privacy. We process your data to ...,www.flightglobal.com,2024-06-21 23:52:49+00:00,2024-06-22 05:06:32
45,Juneteenth celebrations marked across the Hudson Valley | National - Bennington Banner,BENNINGTON — The Better Bennington Corporation has been designated an Affiliate Main Street … 'A global destination': Vermont's tourism celebrated by ...,www.benningtonbanner.com,2024-06-21 23:23:00+00:00,2024-06-22 05:06:32
46,Car dealerships are being disrupted by a multi-day outage after cyberattacks on software supplier,"CDK Global, a company that provides software for thousands of auto ... Hudson- Remarkable Women: Susan Copeland- Remarkable Women: Dr. Susan ...",www.fox44news.com,2024-06-21 22:38:56+00:00,2024-06-22 05:06:32
47,Car dealerships are being disrupted by a multi-day outage after cyberattacks on software supplier,"Hudson Valley- Business- Opinion- Entertainment- Food- Sports- Obituaries- Puzzles ... CDK Global, a company that provides software for thousands ...",www.timesunion.com,2024-06-21 22:33:40+00:00,2024-06-22 05:06:32
48,Sanofi ups Audrey Duval Derveloy to global head of corporate affairs,"... global head of corporate affairs, effective July 1. Based in Paris, Duval Derveloy reports to CEO Paul Hudson in this position. In her new role ...",www.mmm-online.com,2024-06-21 22:19:25+00:00,2024-06-22 05:06:32
49,DIARY - U.S. Company Conference Calls/Webcast for week ahead | Reuters,... International Paper Co. Earnings Conf Call 30 Apr 13:00 Q1 2014 Jones ... Hudson Global Inc Earnings Conf Call 01 May 14:00 Q1 2014 ICG Earnings ...,www.reuters.com,2024-06-21 22:12:28+00:00,2024-06-22 05:06:32
50,"Flip Flops Market size is set to grow by USD 6.83 billion from 2024-2028, Rise in rubber and ...","... Hudson, significantly impact the global flip flops market's growth. The ... Technavio is a leading global technology research and advisory company.",themalaysianreserve.com,2024-06-21 22:07:32+00:00,2024-06-22 05:06:32
51,Fathom Nickel is poised to power the EV market with its portfolio critical minerals projects in ...,... global electric vehicle market. The Company now has a portfolio of two high-quality exploration projects located in the prolific Trans Hudson ...,www.proactiveinvestors.co.uk,2024-06-21 22:01:03+00:00,2024-06-22 05:06:32
52,Insurtech MGA Ledgebrook launches architects &amp; engineers insurance,"How global brands are perceived by top business leaders- How the life ... Her background includes senior roles at Hudson Insurance Group, Argo ...",www.lifeinsuranceinternational.com,2024-06-21 20:21:58+00:00,2024-06-22 05:06:32
53,"Audrey Duval Derveloy appointed Global Head of Corporate Affairs, member of Sanofi's ... - Placera","Audrey will become a member of Sanofi's Executive Committee, reporting into CEO Paul Hudson, and will be based in Paris. Her appointment is ...",www.placera.se,2024-06-21 19:31:48+00:00,2024-06-22 05:06:32
54,PCA Companies buys Space NK US Wholesale division - Global Cosmetics News,"THE DETAILS According to a report published by WWD, the unit, which serves some 600 points of distribution across Bloomingdale's, Nordstrom, Hudson ...",www.globalcosmeticsnews.com,2024-06-21 17:01:39+00:00,2024-06-22 05:06:32
55,Morningstar DBRS Confirms Credit Ratings on European Residential Loan Securitisation ...,"The sources of data and information used for these credit ratings include the Issuer, Hudson, and U.S. Bank Global Corporate Trust, which comprise, in ...",dbrs.morningstar.com,2024-06-21 16:03:06+00:00,2024-06-22 05:06:32
56,Best of Westchester: Home &amp; Garden in 2024,"Your guide to people, places, and things to do in Westchester County, from Croton-on-Hudson to Peekskill, White Plains, Yonkers, and more. Company ...",westchestermagazine.com,2024-06-21 08:17:43+00:00,2024-06-22 05:06:32
57,Who'll win NYC's casino race? Gambling experts set odds - New York Post,"... Companies, which developed Hudson Yards. Bennett Liebman, formerly ... Thor Equities, Chickasaw Nation's Global Gaming Solutions, Saratoga Casino ...",nypost.com,2024-06-23 01:59:13+00:00,2024-06-23 05:06:38
58,Hudson Global (NASDAQ:HSON) Receives New Coverage from Analysts at StockNews.com,"The business had revenue of $33.89 million for the quarter, compared to analyst estimates of $34.80 million. Research analysts expect that Hudson ...",www.defenseworld.net,2024-06-22 17:25:56+00:00,2024-06-23 05:06:38
59,"grizzly-polar bear hybrids remain rare despite global warming, new study reveals - MSN","... Hudson Bay, which some scientists say face extinction by mid-century. How To ... Fast Company. 6. These Insane Cards Offer 0% Interest Until Nearly 2026.",www.msn.com,2024-06-22 13:06:36+00:00,2024-06-23 05:06:38
60,MIL-OSI USA: CONGRESSMAN PAT RYAN AND DEPUTY SECRETARY OF ... - ForeignAffairs.co.nz,"... INTERNATIONAL AIRPORT, HOST ROUNDTABLE WITH LOCAL LEADERS ON OPPORTUNITIES TO EXPAND HUDSON VALLEY TRANSPORTATION SYSTEMS ... Company in announcing ...",foreignaffairs.co.nz,2024-06-22 09:40:09+00:00,2024-06-23 05:06:38
61,Car dealers continue to idle as software firm slowly recovers from massive cyber hack,Retail technology and software provider CDK Global has begun ... Hudson Yards skyscraper The Spiral lands five new tenants to lift occupancy above 80%.,nypost.com,2024-06-24 04:28:29+00:00,2024-06-24 05:06:33
62,Hudson Yards skyscraper The Spiral lands five new tenants to lift occupancy above 80%,"One is said to be moving from Manhattan West, the other from Related's Hudson Yards complex. Global tech firm XR Extreme Reach, which is moving ...",nypost.com,2024-06-24 03:24:35+00:00,2024-06-24 05:06:33
63,"Louisiana, Texas Car Dealerships Disrupted by Cyberattacks on Major Software Supplier","CDK Global, a company that provides software for thousands of auto dealers ... By 1929, the Hudson automobile company was doing well, selling about ...",kpel965.com,2024-06-24 02:18:15+00:00,2024-06-24 05:06:33
64,Directors to Watch 2012,... Global Transaction Business and Hudson Partners. Social Media Is a Game Changer: “Most boards today are made up of former or sitting CEOS and ...,www.directorsandboards.com,2024-06-24 01:49:21+00:00,2024-06-24 05:06:33
65,Sanofi elevates Audrey Duval Derveloy to global head of corporate affairs - Campaign Asia,"... global head of corporate affairs, effective July 1. Based in Paris, Duval Derveloy wll report to CEO Paul Hudson in this position. In her new role ...",www.campaignasia.com,2024-06-24 00:28:50+00:00,2024-06-24 05:06:33
66,"GM Is Moving Out of the Renaissance Center in Detroit, For Now - MSN",General Motors will move downtown to the new Hudson's Detroit development as it works with Dan Gilbert's real-estate firm to redevelop the RenCen.,.google.com,2024-06-23 12:27:05+00:00,2024-06-24 05:06:33
67,Hines Announces The Square Portfolio's Expansion To New York City,"... Hudson in Hudson Square this summer. This marks The Square's sixth location globally, with additional locations in Washington, D.C., Houston, Salt ...",www.hines.com,2024-06-25 03:25:46+00:00,2024-06-25 05:06:34
68,Car dealerships in North America revert to pens and paper after cyberattacks on software provider,"CDK Global, a company that provides software for thousands of auto ... Brunswick teammates celebrate a goal by Hudson Hausmann (25) during boys lacrosse ...",www.stamfordadvocate.com,2024-06-25 00:25:31+00:00,2024-06-25 05:06:34
69,Form DEF 14A Hudson Acquisition I For: Jul 05 - StreetInsider,"In such event, we may need to obtain additional funds to consummate a Business Combination and for the Company's shares of Common Stock to be or ...",www.streetinsider.com,2024-06-25 00:17:34+00:00,2024-06-25 05:06:34
70,Canada to start 30-day consultation to impose surtax on Chinese electric vehicles,... companies to generate a global oversupply. Canada's move comes weeks ... Brunswick teammates celebrate a goal by Hudson Hausmann (25) during boys ...,.google.com,2024-06-24 21:04:33+00:00,2024-06-25 05:06:34
71,New 'Global Grains' event to spotlight Hudson Valley businesses,"Voilà Afrique — a Hackensack, New Jersey, food company – will offer samples of èbà, a staple made of grains or starchy vegetables. The Hudson Oven ...",westfaironline.com,2024-06-26 00:18:51+00:00,2024-06-26 05:06:35
72,World Health Organization says physical inactivity is causing global health threat,World Health Organization says physical inactivity is causing global health threat. By Kath Hudson 26 Jun 2024. WHO finds that globally women tend ...,www.healthclubmanagement.co.uk,2024-06-26 00:05:53+00:00,2024-06-26 05:06:35
73,Qantas invests in DeHavilland Dash 8 fleet - AviTrader,"Qantas Group CEO Vanessa Hudson stated that the ... Modwen Park, Newport, which will serve as the company's global headquarters from the end o...",avitrader.com,2024-06-25 23:38:34+00:00,2024-06-26 05:06:35
74,Movie Academy Re-Ups CEO Bill Kramer's Contract Through 2028 Oscars - MSN,"... Hudson. The news comes as he and the Academy launched Academy100, a $500 ... Paramount Global Co-CEOs Have Hired Bankers to Evaluate Asset Sales ...",www.msn.com,2024-06-25 21:03:01+00:00,2024-06-26 05:06:35
75,Hudson Structured hires Park as Head of Capital Formation &amp; Investor Relations,"Park joined Hudson Structured Capital Management (HSCM) on June 3rd, the company ... companies, ranging from early-stage to complex global institutions.",www.artemis.bm,2024-06-25 18:59:41+00:00,2024-06-26 05:06:35
76,Paying the ransom on a cyber attack make the company more of a target? - Audacy,... Hudson- The Tara Show- The Mike Gallagher Show- Straight Talk with Bill ... A group that says they hacked software company CDK Global is demanding ...,www.audacy.com,2024-06-25 18:35:54+00:00,2024-06-26 05:06:35
77,Hill highlights need for local entrepreneurs to invest in digitalisation - Jamaica Gleaner,"... international demand and driving Jamaica's global competitiveness ... . Until ... SMS consists of two business partners, Dane Spencer and Marlon Hudson ...",jamaica-gleaner.com,2024-06-25 17:22:51+00:00,2024-06-26 05:06:35
78,Israel to build supercomputer to keep pace in global AI race - Yahoo Finance,"""When a high tech company or researcher wants to train a large model ... (Reporting by Steven Scheer; Editing by Alexandra Hudson). View ...",finance.yahoo.com,2024-06-26 14:39:19+00:00,2024-06-26 15:06:42
79,Orange County to purchase former school building for high-tech training - Mid Hudson News,"“They partner up with three major manufacturers – three major companies—General Electric, Global Foundries and I think the third one was Microsoft.",midhudsonnews.com,2024-06-26 14:10:36+00:00,2024-06-26 15:06:42
80,New FIS Research Shows UK Consumers Addicted to 'Financial Doomscrolling' Fuelled by ...,"LONDON --(BUSINESS WIRE)--Jun. 26, 2024-- Global financial technology ... Rob Hudson , Head of International Banking and Payments at FIS ...",markets.ft.com,2024-06-26 14:00:02+00:00,2024-06-26 15:06:42
81,Jules Hudson announces new career move after taking Escape to the Country break,... Holly Willoughby's wild rise to fame - and exciting plans ... Company. About Us- Work for us- Contact Us- Irish Mirror- Syndication ...,www.mirror.co.uk,2024-06-26 13:49:51+00:00,2024-06-26 15:06:42
82,World Health Organization says physical inactivity is causing global health threat,World Health Organization says physical inactivity is causing global health threat. Powered by. By Kath Hudson 26 Jun 2024. WHO finds that globally ...,www.leisureopportunities.co.uk,2024-06-26 06:04:28+00:00,2024-06-26 15:06:42
83,"Tax the super-rich, says a new report commissioned by Brazil for its G20 presidency","Hudson Valley- Business- Opinion- Entertainment- Food- Sports- Obituaries ... organization Oxfam International, which praised the new report. “ ...",www.timesunion.com,2024-06-25 21:02:13+00:00,2024-06-26 15:06:42
84,Argent LNG Selects Chart Industries' IPSMR® Process Technology - FOX40,"... Hudson Air Coolers. Chart Industries (NYSE:GTLS) ... About Chart Industries, Inc. Chart Industries, Inc. is a global leader ...",fox40.com,2024-06-26 11:54:52+00:00,2024-06-26 17:06:33
85,HUB hits the global campaign trail for 'Toy of the Year' Real FX Disney Stitch - Prolific North,"Stuff on the RealFX Disney Stitch project was an absolute joy,” said Helen Hudson, managing director at HUB. “Working from our in-house studios, our ...",www.prolificnorth.co.uk,2024-06-26 15:16:50+00:00,2024-06-26 19:06:39
86,New FIS Research Shows UK Consumers Addicted to 'Financial Doomscrolling' Fuelled by ...,"LONDON--(BUSINESS WIRE)--Global financial technology leader FIS<sup>®</sup> (NYSE ... Rob Hudson, Head of International Banking and Payments at FIS commented: “ ...",www.businesswire.com,2024-06-26 14:21:41+00:00,2024-06-26 19:06:39
