,Heading,Subheading,Publisher,Published,Found
523,"Pitch Update: Arla Food, Jack Daniel's, Kurt Geiger, Lily O'Brien's and more… | PR Week",International spirits company Brown-Forman has appointed ... agency Hudson Sandler to offer financial and corporate communications assistance.,www.prweek.com,2024-07-12 17:17:18+00:00,2024-07-12 23:07:04
524,Top 20 Global Concert Tours from Pollstar - Times Union,Hudson Valley- Business- Opinion- Entertainment- Food- Sports- Obituaries- Puzzles- Best of the Capital Region. BREAKING. 21 min ago. State to ...,www.timesunion.com,2024-07-12 15:49:28+00:00,2024-07-12 23:07:04
525,Stock market today: Wall Street rolls to the edge of records as hopes remain for cuts to rates,Troy police release video of pursuit of man who drowned in Hudson River. 1 hr ago. Business. Stock market today: Wall Street rolls to the edge of ...,www.timesunion.com,2024-07-12 20:28:31+00:00,2024-07-13 01:07:03
526,"Big Law Opts for Smaller but New Space in NY, as Law Firm Leasing Activity Ticks Up","Some of the latest lease transactions include Covington & Burling, which signed for a new office at Hudson ... © 2024 ALM Global, LLC, All Rights ...",www.law.com,2024-07-12 18:58:17+00:00,2024-07-13 01:07:03
527,Notice of Results | Company Announcement - Investegate,"Hudson Sandler. Mark Garraway, Emily Dillon, Nick Moore. Tel +44 020 ... RHI Magnesita is a leading global supplier of high-grade refractory ...",www.investegate.co.uk,2024-07-12 18:41:18+00:00,2024-07-13 01:07:03
528,2 'underperforming' Stop &amp; Shop stores in Hudson Valley set to close - News 12 - Westchester,"Customers tell News12 they're shocked. ""I'm surprised, I thought they had good business here,"" said customer Pierre LaRoche. ""Why go? it's well ...",westchester.news12.com,2024-07-13 00:44:31+00:00,2024-07-13 02:07:01
529,How AWS is empowering global generative AI startups with a $230M commitment,This isn't the first time the company has supported the growth of startups. ... Copyright © 2024 My Hudson Valley. · Privacy policy / Terms of ...,www.timeshudsonvalley.com,2024-07-12 22:51:03+00:00,2024-07-13 04:07:13
530,Kendra Scott and Abercrombie &amp; Fitch to open their doors at Ross Park Mall | Pittsburgh Post-Gazette,The mall is a Simon center — a retail property group with global locations. ... Hudson Warm: hwarm@post-gazette.com. First Published: July 12 ...,www.post-gazette.com,2024-07-13 13:08:03+00:00,2024-07-13 15:07:02
531,The race is on to save a 150-year-old NY lighthouse from crumbling into the Hudson River,"... Hudson, N.Y. The 150-year-old lighthouse is ... The Associated Press is an independent global news organization dedicated to factual reporting.",apnews.com,2024-07-13 12:14:06+00:00,2024-07-13 15:07:02
532,Bulletin: NMG Holding Co. Inc. Ratings Unaffected | S&amp;P Global Ratings,Ratings Unaffected On Announced Acquisition By Hudson's Bay Co. This report does not constitute a rating action. NEW YORK (S&P ...,disclosure.spglobal.com,2024-07-13 12:02:20+00:00,2024-07-13 15:07:02
533,Data of nearly all AT&amp;T customers downloaded to a third-party platform in security breach,"That company, CDK Global, is still attempting to reestablish normal operations. ... Hudson Valley arrests report: July 12, 2024. Esopus man ...",www.dailyfreeman.com,2024-07-13 11:57:59+00:00,2024-07-13 15:07:02
534,Doing good on purpose - NH Business Review,"According to Global Strategy Group's report, “The Shifting Politics of ... business at new Hudson plant- Mike Cote Columnist- $500 million says ...",www.nhbr.com,2024-07-13 04:11:54+00:00,2024-07-13 15:07:02
535,An Indian billionaire's son is married after lavish celebrations that spotlight his global clout,"Hudson Valley- Business- Opinion- Entertainment- Food- Sports ... The wedding early Saturday was being attended by global celebrities, business ...",www.timesunion.com,2024-07-13 10:31:10+00:00,2024-07-13 16:06:59
536,"CHAR Tech Announces Appointment of Chief Development Officer Anton Szpitalak, Senior ...",Pan Asia and its investors have invested more than $100M in VC-stage companies globally. ... Hudson's Bay temporary store closures hints at signs ...,financialpost.com,2024-07-13 09:07:25+00:00,2024-07-13 16:06:59
537,Bunge Global SA (NYSE:BG) Sees Large Drop in Short Interest - MarketBeat,Hudson Bay Capital Management LP purchased a new stake in Bunge ... Bunge Global SA operates as an agribusiness and food company worldwide.,www.marketbeat.com,2024-07-13 15:09:43+00:00,2024-07-13 17:06:57
538,"Sumitomo Mitsui Trust Holdings Inc. Sells 10,181 Shares of Hudson Pacific Properties, Inc ...",Hudson Pacific Properties (NYSE: HPP) is a real estate investment trust serving dynamic tech and media tenants in global epicenters for these ...,www.defenseworld.net,2024-07-13 14:26:41+00:00,2024-07-13 17:06:57
539,The race is on to save a 150-year-old NY lighthouse from crumbling into the Hudson River,The Walt Disney Company Logo. Notice of Right to Opt Out of Sale ... Global Privacy Control (“GPC”). We will process the GPC signal as a ...,abcnews.go.com,2024-07-13 04:21:50+00:00,2024-07-13 17:06:57
540,SG Americas Securities LLC Has $7.74 Million Holdings in Bunge Global SA (NYSE:BG),"Finally, Hudson Bay Capital Management LP purchased a new position in ... Bunge Global SA operates as an agribusiness and food company worldwide.",www.marketbeat.com,2024-07-13 16:42:20+00:00,2024-07-13 22:07:05
541,"LSV Asset Management Sells 30,300 Shares of Global Payments Inc. (NYSE:GPN)","Hudson Bay Capital Management LP purchased a new position in Global Payments during the 3rd quarter worth $7,500,000. Finally, Anchor Investment ...",www.marketbeat.com,2024-07-13 10:28:57+00:00,2024-07-13 23:07:04
542,"Sunny, hot and humid Sunday in the Hudson Valley | National | benningtonbanner.com",Storm Watch Team Julian Seawright says it will be very humid through Wednesday.,www.benningtonbanner.com,2024-07-14 12:26:25+00:00,2024-07-14 15:07:07
543,Hudson Valley officials condemn violence following Trump rally shooting - Brattleboro Reformer,"NORWICH — As America's oldest flour company, King Arthur Baking Co. has seen a lot. It opened in 1790, when George Washington was president ...",www.reformer.com,2024-07-14 14:43:38+00:00,2024-07-14 16:07:04
544,Hudson Valley officials condemn violence following Trump rally shooting - Bennington Banner,Rockland County Executive Ed Day released a statement on Facebook.,www.benningtonbanner.com,2024-07-14 14:40:55+00:00,2024-07-14 16:07:04
545,HEAT ALERT: Mostly sunny skies in the Hudson Valley with feels-like temperatures reaching mid 90s,News 12 Storm Watch Team Meteorologist Alex Calamia says to expect humidity and high temperatures today.,www.benningtonbanner.com,2024-07-14 13:42:42+00:00,2024-07-14 16:07:04
546,The race is on to keep a 150-year-old lighthouse from crumbling into the Hudson River,"The Hudson-Athens Lighthouse is in danger of toppling into the water, and advocates for the 150-year-old lighthouse in the middle of Hudson River ...",abcnews.go.com,2024-07-14 19:09:06+00:00,2024-07-14 21:07:05
547,HEAT ALERT: Hot and humid Monday in the Hudson Valley; feels-like temps near 100,Storm Watch Team Meteorologist Julian Seawright says to expect a gross week of heat and humidity with summertime pop-up storms.,www.benningtonbanner.com,2024-07-14 23:26:39+00:00,2024-07-15 01:07:03
548,Empowered Funds LLC Boosts Stock Holdings in Union Pacific Co. (NYSE:UNP),Hudson Bay Capital Management LP purchased a new stake in shares of ...,www.defenseworld.net,2024-07-14 23:31:55+00:00,2024-07-15 02:06:59
549,"Allspring Global Investments Holdings LLC Makes New Investment in AnaptysBio, Inc ...","Hudson Bay Capital Management LP now owns 100,000 shares of the biotechnology company's stock worth $1,796,000 after buying an additional 50,000 ...",www.defenseworld.net,2024-07-14 19:52:03+00:00,2024-07-15 02:06:59
550,BNP Paribas Collaborates With Ant International on Promoting Cross-Border Payment ...,"... global business opportunities. WorldFirst, which employs AI and other ... Turner Center for the Arts Hudson Pottery Studio- Sat, Jul 13. Young ...",www.valdostadailytimes.com,2024-07-15 04:09:21+00:00,2024-07-15 07:07:02
551,Mace appointed as Hong Kong MTR's Programme Management Partner for its New Railway ...,"... Hudson Tunnel Project in New York. It also has been appointed on many ... A global company of consultancy and construction experts, Mace is ...",www.macaubusiness.com,2024-07-15 03:57:03+00:00,2024-07-15 07:07:02
552,Sunday Summary: Stephen Ross Steps Down From Related - Commercial Observer,"Hudson Bay Company, the parent company of Saks Fifth Avenue, struck a ... Global. Trending Stories. Features. National. Sunday Summary: Stephen ...",commercialobserver.com,2024-07-15 01:01:04+00:00,2024-07-15 07:07:02
553,Overseas Distribution Company fuels Middle East expansion with Dubai office - TRBusiness,... company's expansion which will allow ... International Airport. READ MORE: Dufry Sharjah opens hybrid Hudson Café at Sharjah International Airport.,www.trbusiness.com,2024-07-15 08:58:01+00:00,2024-07-15 09:06:59
554,Babies R Us makes its return. Where you'll be able to find them in NY Kohl's stores,"Kohl's announced a partnership with WHP Global, the parent company of ... Babies ""R"" Us will be opening inside of seven Kohl's stores in the Hudson ...",www.democratandchronicle.com,2024-07-15 07:04:58+00:00,2024-07-15 09:06:59
555,Interim Results | Company Announcement - Investegate,"me-group@hudsonsandler.com. NOTES TO EDITORS. ME Group International plc ... Me Group International plc (the ""Company"") is a public limited company ...",www.investegate.co.uk,2024-07-15 06:07:56+00:00,2024-07-15 11:07:01
556,"How SECNAV's claims about S. Korean, Japanese shipbuilders do and do not line up","It could also influence the company's interest in reviving its ... Topics: Asia, Bryan Clark, Carlos Del Toro, Global, Hudson Institute ...",breakingdefense.com,2024-07-15 10:31:46+00:00,2024-07-15 12:07:09
557,Qantas Launches Direct 787-9 Dreamliner Flights Between Perth and Paris,This makes it the longest non-stop flight to France from any global destination. ... Qantas Group CEO Vanessa Hudson expressed enthusiasm about the new ...,aviationsourcenews.com,2024-07-15 10:19:18+00:00,2024-07-15 12:07:09
558,Logistic Properties of the Americas Expands Board with Appointments of Two Independent Directors,"... global and regional companies are underserved in Latin America.” ... Weekday Pottery. Turner Center for the Arts - Hudson Pottery Studio- Mon, Jul 15 ...",www.valdostadailytimes.com,2024-07-15 10:18:01+00:00,2024-07-15 12:07:09
559,"KKR-Backed OneStream, Shareholders Seek $466 Million in US IPO - BNN Bloomberg","... Hudson, NY, U.S. Tuesday, April 6, 2021. Photographer: Tiffany Hagler ... The company, which offers a cloud-based platform with more than 90 ...",www.bnnbloomberg.ca,2024-07-15 13:38:58+00:00,2024-07-15 15:07:07
560,Banking power in Bethel: POWR2 - Westfair Communications,"Hudson Valley- Courts- Banking & Finance- Construction- Economy ... Before Tim Doling, the global director of innovation and development and co ...",westfaironline.com,2024-07-15 13:36:56+00:00,2024-07-15 15:07:07
561,Mace made programme management partner for Hong Kong's MTR Corp,Mace lands role on $16bn Hudson Tunnel Project ... Send email. Story for GCR? Get in touch via email: global-construction-review@atompublishing.co.uk ...,www.globalconstructionreview.com,2024-07-15 16:21:40+00:00,2024-07-15 18:07:13
562,'Belltown Hellcat' driver facing eviction from Seattle apartment building - KING 5,The company says it received word three days after the deadline to comply that Hudson ... Global Privacy Control (GPC) signal on a supported web ...,www.king5.com,2024-07-15 15:59:47+00:00,2024-07-15 18:07:13
563,I Ran a Hyrox Race to Try the New International Fitness Trend - Men's Health,"... Hudson River before my 11:30 heat time. ... According to the company, 2,000 gyms and trainers globally are already part of its affiliate network.",www.menshealth.com,2024-07-15 15:48:44+00:00,2024-07-15 18:07:13
564,HBC's Burgeoning Luxury Empire and Why More Fans are Refusing to Pay Big Money For Concerts,North America's oldest company isn't too old to learn some new tricks. What happened: Hudson's Bay Co. (HBC) is buying U.S. luxury department store ...,everythingzoomer.com,2024-07-15 14:45:27+00:00,2024-07-15 20:07:17
565,Beloved Global News anchor Linda Olsen announces departure - Daily Hive,One of Calgary's most beloved news anchors has announced she's leaving Global News after 29 years with the company ... Several Hudson's Bay stores ...,dailyhive.com,2024-07-16 01:22:38+00:00,2024-07-16 02:07:08
566,Accessible health for all drives David Beckham to co-found health and wellness brand,"By Kath Hudson 16 Jul 2024 ... Danny Yeung, CEO and co-founder of Prenetics, says this partnership is transformational for Prenetics, global ...",www.healthclubmanagement.co.uk,2024-07-16 12:04:26+00:00,2024-07-16 14:06:44
567,Qantas CEO Vanessa Hudson: Australia is unable to sustain more than three airlines,"As CXO, McNeil will oversee all aspects of HX's global itinerary and expedition experience. ... © 2024 The Misfits Media Company Pty Limited. All Rights ...",www.travelweekly.com.au,2024-07-16 11:48:44+00:00,2024-07-16 14:06:44
568,StockNews.com Begins Coverage on Hudson Global (NASDAQ:HSON),The firm set a “strong-buy” rating on the business services provider's stock. Get Hudson Global alerts: Hudson Global Trading Down 3.1 %. NASDAQ:HSON ...,www.americanbankingnews.com,2024-07-16 11:27:41+00:00,2024-07-16 14:06:44
569,Wafra's Gustavo Cardenas: Citation Capital's 'consistent' strategy an attraction | PE Hub,"Capital Constellation is a vehicle managed by Wafra on behalf of a global set of asset owners, including pension funds and sovereigns. ... Hudson, co- ...",www.pehub.com,2024-07-16 11:02:32+00:00,2024-07-16 14:06:44
570,GM CEO Barra Backs Away From One Million EV Production Goal - BNN Bloomberg,"General Motors Co. Chief Executive Officer Mary Barra walked back expectations for her company's ... Hudson's building in Detroit, Michigan, US ...",www.bnnbloomberg.ca,2024-07-16 10:10:02+00:00,2024-07-16 14:06:44
571,"Rosen Law Firm Urges Walgreens Boots Alliance, Inc. (NASDAQ - Valdosta Daily Times","Walgreens describes itself as a “global company that delivers retail ... Hudson Pottery Studio- Mon, Jul 15. Stained Glass Class. Richard Hill ...",www.valdostadailytimes.com,2024-07-16 06:46:15+00:00,2024-07-16 14:06:44
572,"Global Electronic Skin Market Estimated to hit $20.94 billion by 2031 Globally, Growing at a ...","Companies covered: Resonetics (Hudson Medical Innovations), Abbott, Medtronic, MC10, Tapecon, Inc., GENTAG, Inc., General Electric Company, VivaLNK, ...",finance.yahoo.com,2024-07-16 13:45:51+00:00,2024-07-16 15:06:49
573,BIBB COUNTY CHAMBER OF COMMERCE ANNOUNCES NEW LEADERSHIP,"He has worked on a wide variety of national and international corporate projects, such as Toyota, the Hudson Alpha Institute for Biotechnology ...",www.bibbvoice.com,2024-07-16 09:37:51+00:00,2024-07-16 15:06:49
574,Your Official Summer Dining Guide in the Hudson Valley,"Step into the welcoming atmosphere of Brickmen Kitchen + Bar, where Hudson Valley flavors meet global innovation. ... Company Info. About Us",hvmag.com,2024-07-16 14:17:37+00:00,2024-07-16 16:06:49
575,Dash Hudson Selected as Data Partner for EMARKETER's PRO+ Product Solution,"... global business publication. Unlimited online access to read articles from Financial Post, National Post and 15 news sites across Canada with one ...",financialpost.com,2024-07-16 14:16:33+00:00,2024-07-16 16:06:49
576,PRA Group Celebrates 10 Years of Global Expansion - Australian Associated Press,"As a global leader in acquiring and collecting nonperforming loans, PRA Group ... Dash Hudson Selected as Data Partner for EMARKETER's PRO+ Product ...",www.aap.com.au,2024-07-16 14:11:03+00:00,2024-07-16 16:06:49
577,IMF's economic view: Brighter outlook for China and India but tepid global growth,Hudson Valley- Business- Opinion- Entertainment- Food- Sports- Obituaries- Puzzles- Best of the Capital Region. BREAKING. Judge rejects ...,www.timesunion.com,2024-07-16 13:32:41+00:00,2024-07-16 16:06:49
578,ME Group International PLC 12.9% potential upside indicated by Berenberg Bank,"ME Group International plc is a United Kingdom-based company ... EDX Medical CEO Dr Mike Hudson on Board strength, cancer testing and future plans (LON: ...",www.directorstalkinterviews.com,2024-07-16 12:18:19+00:00,2024-07-16 16:06:49
579,"Launch of Sodali &amp; Co, New Company Formed from Morrow Sodali Following Rapid ...","Launch of Sodali & Co, New Company Formed from Morrow Sodali Following Rapid International Growth ... Turner Center for the Arts - Hudson Pottery Studio.",www.valdostadailytimes.com,2024-07-16 05:58:07+00:00,2024-07-16 16:06:49
580,Marex Opens New Zealand Office | Macau Business,The team will initially serve New Zealand-based and global clients with agency ... Dash Hudson Selected as Data Partner for EMARKETER's PRO+ ...,www.macaubusiness.com,2024-07-16 17:16:37+00:00,2024-07-16 18:06:43
581,WATCH: Hudson White drafted by Boston Red Sox | Arkansas Razorbacks,Elias Schreml – M Track & Field – International & Global Studies Brevin ... company. Smith proved to be the best pitcher in all of college ...,arkansasrazorbacks.com,2024-07-16 14:38:46+00:00,2024-07-16 20:06:45
582,Heimdall Power raises $25 Million USD Series B to Accelerate Power Grid Optimization Globally,The ORLEN Group is an integrated multi-utility energy company listed in the prestigious global Fortune Global 500. ... Hudson Pottery Studio- Sat ...,www.valdostadailytimes.com,2024-07-16 17:36:58+00:00,2024-07-16 21:06:48
583,Vistra Pledges $1 Million to Help Texans Impacted by Hurricane Beryl - Direct Selling News,"The company has already pledged $1 million to help Texans with their ... Hudson, president of Vistra Retail. “The impacts go far beyond the ...",www.directsellingnews.com,2024-07-16 17:30:38+00:00,2024-07-16 21:06:48
584,Summit Broadband Delivers Its First-Ever 400 Gbps Service - Telecompetitor,"... Global, Inc. (Nasdaq: FBYD), a global entertainment powerhouse and ... First Dark Cable Route Across the Hudson River in 20 Years. by ...",www.telecompetitor.com,2024-07-16 19:29:25+00:00,2024-07-16 22:06:48
585,Tiffany Haddish Responds After Common Says He'd Marry Jennifer Hudson - Complex,"I hope they actually get married,” Haddish replied. According to People, Common and Haddish met while co-starring in The Kitchen in 2019 and made ...",www.complex.com,2024-07-16 21:37:10+00:00,2024-07-16 23:06:49
586,Mohawk Highlights Sustainability Progress in 2023 Impact Report - Macau Business,More than 10% of Mohawk's global workforce has been with the Company for 25 or more years. ... Dash Hudson Selected as Data Partner for EMARKETER's PRO+ ...,www.macaubusiness.com,2024-07-16 20:44:24+00:00,2024-07-16 23:06:49
587,Traffic light outage in Hudson - NEWS10 ABC,... global cooperation. … In this photo provided by the United Nations ... Company opens in Niskayuna- Arrest made in Troy shooting that injured ...,www.news10.com,2024-07-16 21:31:12+00:00,2024-07-17 00:06:44
588,"Celebrities like Kim Kardashian and Kate Hudson are getting a $2,500 MRI scan to ... - Daily Mail",The Vancouver-based company says its scans can detect the conditions ... global warming: 'It's not what cinema is about'- EXCLUSIVEShannen ...,www.dailymail.co.uk,2024-07-16 20:28:09+00:00,2024-07-17 01:06:40
589,Kolmar Korea Appoints Global Experts to Speed up Its Presence in North America,"... global cosmetics companies such as L'Oreal USA and Intercos. Most ... Hudson Pottery Studio- Thu, Jul 18. Beginning Guitar Lessons - The Hal ...",www.valdostadailytimes.com,2024-07-16 19:21:47+00:00,2024-07-17 01:06:40
590,"This Week's N.Y. Deal Sheet (July 7, 2024) - Bisnow","Hudson Cos. and St. Nicks Alliance have landed a $194.6M deal in ... Harbor Group International. New York City Posted July 10, 2024- Real ...",www.bisnow.com,2024-07-17 01:41:27+00:00,2024-07-17 04:06:43
591,Smith+Nephew announces 510(k) clearance of new CATALYSTEM™ Primary Hip System,"... global business units of Orthopaedics, Sports Medicine & ENT and Advanced Wound Management. ... Dash Hudson Selected as Data Partner for ...",www.macaubusiness.com,2024-07-16 18:51:12+00:00,2024-07-17 04:06:43
592,StockNews.com Begins Coverage on Hudson Global (NASDAQ:HSON) - Defense World,The brokerage set a “strong-buy” rating on the business services provider's stock. Get Hudson Global alerts: Hudson Global Price Performance. HSON ...,www.defenseworld.net,2024-07-17 00:59:43+00:00,2024-07-17 06:06:40
593,"ImmunoPrecise Announces Financing Agreement with Yorkville Advisors Global, LP of up to ...","ImmunoPrecise Antibodies Ltd. (the “Company” or “IPA”) (NASDAQ: IPA) ... Hudson Pottery Studio- Thu, Jul 18. Beginning Guitar Lessons - The Hal ...",www.valdostadailytimes.com,2024-07-17 00:34:14+00:00,2024-07-17 06:06:40
594,Gmail is DOWN! Google says it's investigating reports of issue with global messaging service,Google's Gmail is down and the company says it's investigating the outage ... Kate Hudson keeps her cool in a mint green dress as she enjoys a ...,www.dailymail.co.uk,2024-07-17 04:25:03+00:00,2024-07-17 08:06:45
595,"Even as women outpace men in graduating from college, their earnings remain stuck","... company S&P Global says. ""I think we're getting there, but it's slow ... Copyright © 2024 Mid Hudson Times. · Privacy policy / Terms of ...",www.timeshudsonvalley.com,2024-07-17 03:48:28+00:00,2024-07-17 08:06:45
596,"This stunning, beautifully designed Hudson Valley country estate could be yours for $22.5 million",Investor's Business Daily- BigCharts- Financial News London- realtor.com- Mansion Global- Dow Jones Smart Money. Intraday Data provided by ...,www.marketwatch.com,2024-07-17 09:27:37+00:00,2024-07-17 11:06:39
597,Introducing Hudson Valley's Newest Luxury Destination: Klocke Estate - PR Newswire,"Initially, tours will be led by Klocke's founders and company leaders, including special tastings. ... Global Sites. Asia- APAC- APAC - Traditional ...",www.prnewswire.com,2024-07-17 13:04:22+00:00,2024-07-17 16:06:40
598,Family-owned The Travel Corporation acquired by US private equity firm,... Global Business Travel. Feature Image: Brett Tollman and family ... Qantas CEO Vanessa Hudson: Australia is unable to sustain more than three airlines.,www.travelweekly.com.au,2024-07-17 11:03:06+00:00,2024-07-17 16:06:40
599,"This stunning, beautifully designed Hudson Valley country estate could be yours for $22.5 million","Copyright (c) 2024 Dow Jones & Company, Inc. Evaluate the market like ... Global Contacts- Affiliate Program- United States Flag United States.",www.morningstar.com,2024-07-17 09:11:21+00:00,2024-07-17 16:06:40
600,"AMP Future Icons 2024: Hudson Taylor Jones, Elite Movers - Arkansas Money &amp; Politics","Hudson Jones' life mission is to develop and empower leaders to ... As a success coach for Business Network International, Jones loves ...",armoneyandpolitics.com,2024-07-17 16:22:15+00:00,2024-07-17 18:06:48
601,Studio Ramsay Global Invests in HexClad - WORLD SCREEN,FOX Entertainment Signs Deal with Oliver Hudson. ALSO ... World Screen is the leading source of information for the international media business.,worldscreen.com,2024-07-17 15:52:23+00:00,2024-07-17 18:06:48
602,Longtime Hudson Valley restaurateur to open Snyder eatery | wgrz.com,A new elevated Italian fast casual restaurant is in development in Snyder by a longtime restaurateur newly returned to the region. Author: Business ...,www.wgrz.com,2024-07-17 18:16:26+00:00,2024-07-17 20:06:49
603,Hudson Capital Management LLC Sells 161 Shares of Apple Inc. (NASDAQ:AAPL),"The firm owned 28,450 shares of the iPhone maker's stock after selling 161 shares during the quarter. Apple comprises about 1.7% of Hudson Capital ...",www.defenseworld.net,2024-07-17 11:45:11+00:00,2024-07-17 20:06:49
604,"Sanofi's Consumer Arm Said to Draw Bids From Advent, PAI, CD&amp;R - BNN Bloomberg",Private equity firms Advent International and PAI Partners are among ... Sanofi Chief Executive Officer Paul Hudson said in a Bloomberg ...,www.bnnbloomberg.ca,2024-07-17 16:30:02+00:00,2024-07-17 22:06:47
605,Oldham Global and Thought Leadership &amp; Innovation Foundation - Valdosta Daily Times,"Oldham Global is a consulting and advisory company focused on ... Turner Center for the Arts - Hudson Pottery Studio- Thu, Jul 18. Beginning ...",www.valdostadailytimes.com,2024-07-17 14:40:43+00:00,2024-07-17 22:06:47
606,Grey Expands its International Presence and Services to Latin America (LATAM ... - VietNam News,Our vision is to build a company that reflects the global nature of our business ... The Hudson Rooms & Track 61 among the top 81 best bars in Asia ...,vietnamnews.vn,2024-07-18 07:11:36+00:00,2024-07-18 11:06:49
607,CTC Global Expands Board of Directors With Industry Veterans Miranda Ballentine and Jim Laurito,... Business Development and as President and CEO of Fortis' Central Hudson Gas & Electric subsidiary. He also held significant positions as President ...,finance.yahoo.com,2024-07-18 10:09:03+00:00,2024-07-18 12:06:40
608,TikTok to open an office in downtown Vancouver | Urbanized - Daily Hive,(Hudson Pacific Properties). The global usage of the short ... company's continued global retraction from its oversized office space holdings.,dailyhive.com,2024-07-18 07:52:30+00:00,2024-07-18 12:06:40
609,"PR Leaders Must Adopt a Human-to-Human Ethos - Thu., Jul. 18, 2024 - O'Dwyer's PR","Trenesa Stanford-Danuser, Chief Communications Officer at Hudson's Bay Company, and Global Head of Branding, Communications, and Community ...",www.odwyerpr.com,2024-07-18 14:01:13+00:00,2024-07-18 15:06:50
