,Heading,Subheading,Publisher,Published,Found
261,U.S. luxury department store Sachs Fifth Avenue is taking over rival Niemann Marcus ...,"... company and share management know-how. According to the Wall Street Journal (WSJ) on the 3rd (local time), Hudson's ... Global'. Analysts say that ...",www.mk.co.kr,2024-07-04 10:04:20+00:00,2024-07-04 16:07:09
262,The Hudson's Bay Company is acquiring Neiman Marcus for $2.65 billion USD - blogTO,"The WSJ says the new brand will be called Saks Global (Hudson's Bay Co. acquired Saks Fifth Avenue in 1998). Marc Metrick, CEO of Saks, is anticipated ...",www.blogto.com,2024-07-04 15:47:56+00:00,2024-07-04 17:07:12
263,Nordstrom May Be Surprise Winner From Saks-Neiman Marcus Merger - Forbes,"Saks owner Hudson Bay Company (HBC) will provide $2 billion of financing through its existing investors, including HBC chairman and CEO Richard Baker ...",www.forbes.com,2024-07-04 15:40:31+00:00,2024-07-04 17:07:12
264,"Global Markets: Starmer, Labour expected to win British election | The Western Producer","– Hudson's Bay Company (HBC) has reached a deal to purchase United States luxury department store chain Neiman Marcus, according to media reports ...",www.producer.com,2024-07-04 14:49:11+00:00,2024-07-04 17:07:12
265,Hill Dickinson acts as English legal adviser on takeover of MC Mining,"Sam Hudson of our London Corporate team has provided English law ... company Helium One Global Limited on its recent placing and subscription, ...",www.hilldickinson.com,2024-07-04 11:01:37+00:00,2024-07-04 17:07:12
266,Neiman Marcus being acquired by owner of Saks Fifth Avenue - San Antonio Express-News,"... company, which the newspaper said will be called Saks Global. HBC, the Toronto holding company that owns retail chain Hudson's Bay Co. and ...",www.expressnews.com,2024-07-04 17:41:30+00:00,2024-07-04 18:07:02
267,Amazon (NASDAQ:AMZN) to Land Minority Stake in Saks/Neiman Marcus Merger - Tipranks,"Hudson Bay Company is financing the deal with $2 billion from existing investors, including Rhône Capital and the Abu Dhabi Investment Council. The ...",www.tipranks.com,2024-07-04 17:13:16+00:00,2024-07-04 18:07:02
268,"Can Saks, Neiman Marcus and Amazon Save the American Department Store? | BoF","Saks Fifth Avenue parent Hudson's Bay Company has inked a long-awaited deal to absorb Neiman Marcus Group in a $2.65 billion transaction, The Wall ...",www.businessoffashion.com,2024-07-04 16:27:23+00:00,2024-07-04 18:07:02
269,"Paul Hudson, CEO of Sanofi: AI to improve organisational efficiency - MarketScreener",The company aspires to become the global leader in immunology and is banking on AI to improve its decision-making and scientific capabilities. Hudson ...,www.marketscreener.com,2024-07-04 13:17:12+00:00,2024-07-04 18:07:02
270,Specialty Equipment Distributors Stocks Q1 Recap: Benchmarking Alta (NYSE:ALTG),"Hudson Technologies reported revenues of $65.25 million, down 15.5% year ... international business. 'Roaring Kitty' lawsuit over GameStop is ...",www.theglobeandmail.com,2024-07-04 13:09:37+00:00,2024-07-04 18:07:02
271,"Luxury department store Saks buys Neiman Marcus, and Amazon gets a stake - NPR","HBC, the owner of Saks and the Canadian chain Hudson's Bay ... The head of Saks.com, Marc Metrick, will run the new combined firm Saks Global.",www.npr.org,2024-07-04 18:38:17+00:00,2024-07-04 19:07:07
272,Hudson's Bay Co. buying Neiman Marcus for US$2.65 billion - North Shore News,"HBC says the plan includes spinning off Neiman Marcus with its other international assets, including Saks Fifth Avenue and Bergdorf Goodman, into a ...",www.nsnews.com,2024-07-04 18:37:53+00:00,2024-07-04 19:07:07
273,Hudson's Bay Company acquiring Neiman Marcus for US$2.65 billion - Daily Hive,Hudson's Bay Co. acquired Saks Fifth Avenue in 1998. Saks Global will create a “$7 billion portfolio of well-located retail real estate assets in top- ...,dailyhive.com,2024-07-04 18:36:19+00:00,2024-07-04 19:07:07
274,Hudson's Bay Co. buying luxury retailer Neiman Marcus for US$2.65-billion,HBC says the plan includes spinning off Neiman Marcus and its other international assets including Saks Fifth Avenue and Bergdorf Goodman into a ...,www.theglobeandmail.com,2024-07-04 18:16:40+00:00,2024-07-04 19:07:07
275,Parent company of Saks Fifth Avenue to buy rival Neiman Marcus | News | tribdem.com,"... global luxury conglomerates, which would still hold most of the cards ... Hudson's Bay Company- Bergdorf Goodman- Business Process- Retail ...",www.tribdem.com,2024-07-04 18:06:17+00:00,2024-07-04 19:07:07
276,Parent company of Saks Fifth Avenue to buy rival Neiman Marcus - Times Union,"Hudson Valley- Business- Opinion- Entertainment- Food- Sports- Obituaries ... global luxury conglomerates, which would still hold most of the ...",www.timesunion.com,2024-07-04 18:05:57+00:00,2024-07-04 19:07:07
277,What you need to know about HBC's deal to buy Neiman Marcus | Financial Post,"Under the deal, HBC, a holding company controlled by U.S. real estate investor Richard Baker that already owns the Hudson's Bay, Saks and Saks OFF ...",financialpost.com,2024-07-04 18:04:17+00:00,2024-07-04 19:07:07
278,Hudson's Bay buys luxury American retail chain Neiman Marcus,Hudson's Bay Co. has announced a deal to buy luxury department store rival Neiman Marcus for US$2.65 billion. News of the deal follows months of ...,www.ominecaexpress.com,2024-07-04 19:07:36+00:00,2024-07-04 20:07:02
279,Hudson's Bay Co. buying Neiman Marcus for US$2.65 billion - Elliot Lake News,"HBC is positioning Saks Global as a collection of international high-end brands. ""We're thrilled to take this step in bringing together these ...",www.elliotlaketoday.com,2024-07-04 18:39:26+00:00,2024-07-04 20:07:02
280,Hudson's Bay Co. buying Neiman Marcus for US$2.65 billion - CityNews Toronto,... Global. It says it intends to re-establish HBC's Canadian business of stores and online retailing as a stand-alone entity with significantly ...,toronto.citynews.ca,2024-07-04 18:34:30+00:00,2024-07-04 20:07:02
281,Hudson's Bay Co. buying Neiman Marcus for US$2.65 billion - Yahoo Finance,HBC says the plan includes spinning off Neiman Marcus and its other international assets including Saks Fifth Avenue and Bergdorf Goodman into a new ...,ca.finance.yahoo.com,2024-07-04 18:20:08+00:00,2024-07-04 20:07:02
282,Hudson's Bay Co. buying Neiman Marcus for US$2.65 billion | Financial Post,... Inc. and software giant Salesforce become investors in Saks Global. The tech companies did not respond to a request for comment seeking ...,financialpost.com,2024-07-04 19:49:40+00:00,2024-07-04 21:07:01
283,Saks' Online CEO Says Amazon to Help 'Future-Proof' Neiman Deal - BNN Bloomberg,"... company, Saks Global, when the deal closes. He didn't offer a time frame for the closing. Saks Fifth Avenue owner Hudson's Bay Co. is betting that ...",www.bnnbloomberg.ca,2024-07-04 17:27:11+00:00,2024-07-04 21:07:01
284,'Marriage of convenience': Hudson's Bay Co. buying Neiman Marcus for US$2.65B,The tech companies did not answer questions about whether they were taking an ownership stake in Saks Global as part of the transaction. The tie-up ...,lethbridgeherald.com,2024-07-04 20:50:15+00:00,2024-07-04 22:07:00
285,Hudson's Bay Company to buy luxury retailer Neiman Marcus in $2.65B US deal - CBC,"HBC is positioning Saks Global as a collection of international high-end brands. ""We're thrilled to take this step in bringing together these iconic ...",www.cbc.ca,2024-07-04 20:37:12+00:00,2024-07-04 22:07:00
286,Hudson's Bay Co. buying Neiman Marcus for US$2.65 billion - St. Albert Gazette,The tech companies did not respond to a request for comment seeking information on whether they were taking an ownership stake in Saks Global as part ...,www.stalbertgazette.com,2024-07-04 20:11:18+00:00,2024-07-04 22:07:00
287,Hudson's Bay Co. buying Neiman Marcus for US$2.65 billion - CityNews Halifax,HBC is positioning Saks Global as a collection of international high-end brands. “We're thrilled to take this step in bringing together these ...,halifax.citynews.ca,2024-07-04 18:50:04+00:00,2024-07-04 22:07:00
288,'Marriage of convenience': Hudson's Bay Co. buying Neiman Marcus for US$2.65B,... Inc. and software giant Salesforce become investors in Saks Global. The tech companies did not answer questions about whether they were taking an ...,nationalpost.com,2024-07-04 21:12:34+00:00,2024-07-04 23:07:03
289,'Marriage of convenience': Hudson's Bay Co. buying Neiman Marcus for US$2.65B,The tech companies did not answer questions about whether they were taking an ownership stake in Saks Global as part of the transaction. The tie ...,www.ctvnews.ca,2024-07-04 20:53:32+00:00,2024-07-04 23:07:03
290,Hudson's Bay Co. to buy luxury retailer Neiman Marcus in US$2.65-billion deal,"HBC will establish a new company called Saks Global, combining Saks, Saks Off 5th, Neiman Marcus and Bergdorf Goodman when the deal closes.",www.theglobeandmail.com,2024-07-04 22:19:21+00:00,2024-07-05 00:07:13
291,Why two luxury retail giants are joining forces to stave off closure - Daily Mail,"Together, Neiman Marcus and Saks will become Saks Global. Hudson Bay Co (HBC), the parent company of Saks Fifth Avenue, is. +8. View ...",www.dailymail.co.uk,2024-07-04 19:45:24+00:00,2024-07-05 01:07:05
292,Hudson's Bay Company set to acquire Neiman Marcus for $2.65bn - Yahoo Finance,Saks Global will have a total of 75 stores and 100 off-price outlets.,finance.yahoo.com,2024-07-05 02:54:11+00:00,2024-07-05 09:06:56
293,Hudson's Bay officially confirms Neiman Marcus takeover - Fashion United,"Following a slew of media reports on the matter, Hudson's Bay Company (HBC) has officially confirmed its acquisition of Neiman Marcus Group (NMG), ...",fashionunited.uk,2024-07-05 08:44:20+00:00,2024-07-05 10:07:02
294,Hudson's Bay buys luxury American retail chain Neiman Marcus - Eagle Valley News,US$2.65B deal expected to result in a new entity called Saks Global.,www.eaglevalleynews.com,2024-07-05 07:04:41+00:00,2024-07-05 11:07:06
295,"Market Still Lacking Some Conviction On Hudson Global, Inc. (NASDAQ:HSON)","With a price-to-sales (or ""P/S"") ratio of 0.3x Hudson Global, Inc. ( NASDAQ:HSON ) may be sending bullish signals at...",simplywall.st,2024-07-05 14:22:14+00:00,2024-07-05 15:07:07
296,Hudson's Bay To Buy Neiman Marcus For $2.65 Billion - Yahoo Finance,"The acquisition will result in a new company called “Saks Global” that will include retailers Saks Fifth Avenue, Saks OFF 5TH, the Neiman Marcus ...",ca.finance.yahoo.com,2024-07-05 14:15:13+00:00,2024-07-05 15:07:07
297,Saks Fifth Avenue and Amazon are buying Neiman Marcus - ABC7 New York,"... Global. The merger means that HBC's Canadian business, which includes Hudson's Bay department stores and $2 billion in property across the country ...",abc7ny.com,2024-07-05 11:34:53+00:00,2024-07-05 15:07:07
298,"What the US$2.65B deal for Neiman Marcus means for HBC, Amazon - The Logic","What about Hudson's Bay: The company will recapitalize the iconic Canadian business as an entity separate from Saks Global, according to a release ...",thelogic.co,2024-07-05 12:44:21+00:00,2024-07-05 16:07:09
299,Saks buys Neiman Marcus in $2.65B deal - The Week,"Following the merger of the two legacy retailers, the new entity will be called Saks Global. ... Hudson's Bay Company, which owns Saks Fifth Avenue, ...",theweek.com,2024-07-05 15:37:58+00:00,2024-07-05 17:06:57
300,Saks Fifth Avenue parent company to acquire Neiman Marcus Group for US$2.65B,"Hudson's Bay Company, parent company of Saks Fifth Avenue, enters a ... Saks Global will also include HBC's US real estate assets and Neiman Marcus ...",www.personalcareinsights.com,2024-07-05 13:35:59+00:00,2024-07-05 17:06:57
301,HBC should apply learnings from new Saks Global company to the Bay: experts,TORONTO — Retail consultants say Hudson's Bay Co. should apply lessons it learns from a newly-announced deal uniting several department store ...,ca.finance.yahoo.com,2024-07-05 16:30:26+00:00,2024-07-05 18:07:05
302,'Marriage of convenience': Hudson's Bay Co. buying Neiman Marcus for US$2.65B,The new entity will be called Saks Global and run by Saks.com chief executive Marc Metrick. The union of brands puts to rest long-standing speculation ...,www.coastreporter.net,2024-07-05 09:06:24+00:00,2024-07-05 18:07:05
303,"HBC should apply learnings from new Saks Global company to the Bay, experts say",Lisa Hutcheson of J.C. Williams Group says there's lots of room for Hudson's Bay Co. to replicate smart processes from its other subsidiary at its ...,www.theglobeandmail.com,2024-07-05 17:25:35+00:00,2024-07-05 19:07:09
304,HBC should apply learnings from new Saks Global company to the Bay: experts,TORONTO - Retail consultants say Hudson's Bay Co. should apply lessons it learns from a newly-announced deal uniting several department store ...,www.chroniclejournal.com,2024-07-05 17:08:45+00:00,2024-07-05 19:07:09
305,Hudson's Bay Co. buying Neiman Marcus for US$2.65 billion - Innisfil Today,The new entity will be called Saks Global and run by Saks.com chief executive Marc Metrick. The union of brands puts to rest long-standing ...,www.innisfiltoday.ca,2024-07-04 20:13:14+00:00,2024-07-05 19:07:09
306,HBC should apply learnings from new Saks Global company to the Bay: experts,The deal announced Thursday will see Hudson's Bay Co. buy Neiman Marcus and Bergdorf Goodman before combining them into a new business with Saks Fifth ...,www.winnipegfreepress.com,2024-07-05 16:33:49+00:00,2024-07-05 20:07:11
307,KBRA Assigns Preliminary Ratings to RRE 20 Loan Management DAC - StreetInsider,"Kroll Bond Rating Agency, LLC (KBRA) is ... Eric Hudson, Senior Managing Director, Co-Head of Global Structured Credit (Rating Committee Chair) + ...",www.streetinsider.com,2024-07-05 19:39:51+00:00,2024-07-05 21:06:54
308,HBC should apply learnings from new Saks Global company to the Bay: experts - Toronto Star,"TORONTO - When Liza Amlani visited Hudson's Bay Co.'s flagship Toronto store last week, she was quickly taken aback by the scene.",www.thestar.com,2024-07-05 19:29:58+00:00,2024-07-05 21:06:54
309,Three US Growth Companies With Insider Ownership Exceeding 13% - Simply Wall St News,"Overview: Zscaler, Inc. is a global cloud security company with a ... Market Still Lacking Some Conviction On Hudson Global, Inc. (NASDAQ ...",simplywall.st,2024-07-05 17:35:49+00:00,2024-07-05 21:06:54
310,KBRA Assigns Preliminary Ratings to RRE 20 Loan Management DAC - Business Wire,"... company established and seeded by Apollo ... Eric Hudson, Senior Managing Director, Co-Head of Global Structured Credit (Rating Committee Chair) + ...",www.businesswire.com,2024-07-05 16:35:55+00:00,2024-07-05 21:06:54
311,"In uncertain times, Americans take a break for Independence Day | Reuters","... Hudson for the first time in a decade. In recent years, the ... Reuters provides business, financial, national and international news ...",www.reuters.com,2024-07-05 16:24:26+00:00,2024-07-05 21:06:54
312,Saks Parent Hudson's Bay Co. to Acquire Neiman Marcus in $2.65 Billion Deal,"HBC's Canadian business will be spun out as a standalone entity, separate from Saks Global, and it will continue to own its Canadian retail and real ...",www.frequentbusinesstraveler.com,2024-07-05 16:19:01+00:00,2024-07-05 21:06:54
313,Amazon takes piece of Neiman Marcus in sale to Saks parent company - PIX11,"The Hudson's Bay Company, the parent company to Saks Fifth Avenue, is ... The new global entity will be called Saks Global, according to a company ...",pix11.com,2024-07-05 15:50:44+00:00,2024-07-05 21:06:54
314,"Weekly roundup: CDK Global makes progress following cyberattack, Tesla sees B2B ...","The company is adopting a phased approach to restore its systems ... We're pleased to welcome back Scott Hudson, SVP of Partnerships for Aura ...",www.cbtnews.com,2024-07-05 15:42:57+00:00,2024-07-05 21:06:54
315,A Deal at Last: Assessing the Future for 'Saks Global',"Also, HBC's Canadian business, which includes TheBay.com, the Hudson's Bay department stores, and $2 billion in real estate, will be recapitalized ...",wwd.com,2024-07-05 15:16:32+00:00,2024-07-05 21:06:54
316,Hudson's Bay Co. buying Neiman Marcus for US$2.65 billion - MSN,TORONTO — Several North American department stores are joining forces under a deal that will see Hudson's Bay Co. buy Neiman Marcus and spin it ...,www.msn.com,2024-07-05 15:10:18+00:00,2024-07-05 21:06:54
317,"Are Robust Financials Driving The Recent Rally In The TJX Companies, Inc.'s (NYSE:TJX) Stock?","... company compared to companies that don't necessarily bear these characteristics. ... Market Still Lacking Some Conviction On Hudson Global, Inc. (NASDAQ ...",simplywall.st,2024-07-05 20:04:19+00:00,2024-07-05 22:07:06
318,"The World's Best Bourbons, According To The 2024 International Whisky Competition","The World's Best Bourbons, According To The 2024 International Whisky Competition. Hudson Lindenberger ... DENVER, CO -FEBRUARY 18: Katie Millar pours ...",www.forbes.com,2024-07-05 19:44:53+00:00,2024-07-05 22:07:06
319,"Saks, Neiman Marcus Merging in $2.65 Billion Deal - JCK","Upon closing the deal, the companies will form Saks Global ... HBC's Canadian business, comprising the Hudson's Bay department store ...",www.jckonline.com,2024-07-05 17:45:49+00:00,2024-07-05 22:07:06
320,TD Cowen: Saks-Neiman Deal Likely a Boon to Both Retailers Amid Brand Moves to DTC,TD Cowen analyst sees HBC's deal to acquire Neiman to create Saks Global as a positive. Saks parent Hudson's Bay Co. is slated to acquire Neiman ...,sourcingjournal.com,2024-07-05 21:29:32+00:00,2024-07-05 23:07:02
321,HBC should apply learnings from new Saks Global company to the Bay: experts,"TORONTO — When Liza Amlani visited Hudson's Bay Co.'s flagship Toronto store last week, she was quickly taken aback by the scene.",www.timescolonist.com,2024-07-05 19:39:24+00:00,2024-07-05 23:07:02
322,The Family Business Season 5 Episode 4: When and where to watch - The Economic Times,"Brown, Ernie Hudson, and Trey Haley. The production team features ... Business News › News › International › US News › The Family Business ...",m.economictimes.com,2024-07-05 19:18:05+00:00,2024-07-06 00:06:59
323,Amazon.com Willkie Farr &amp; Gallagher Sullivan &amp; Cromwell Lath... - Law.com,"Hudson's Bay Co., parent company of Saks Fifth Avenue, has entered into ... Amazon will be an investor in and work with Saks Global following the close ...",www.law.com,2024-07-05 18:23:30+00:00,2024-07-06 00:06:59
324,HBC to Acquire Neiman Marcus Group for $2.7B - Commercial Property Executive,"Saks Global will incorporate HBC's and Neiman Marcus Group's ... acted as financial advisor to Insight Partners. Hudson's Bay Company, Neiman Marcus ...",www.commercialsearch.com,2024-07-05 16:02:57+00:00,2024-07-06 00:06:59
325,What we know so far about the sale of Neiman Marcus to the parent of Saks Fifth Avenue,"The new combined company will be called “Saks Global,” per a news ... The New York-based group is the majority shareholder of companies like Hudson's ...",www.dallasnews.com,2024-07-05 23:19:17+00:00,2024-07-06 04:07:10
326,Hudson Pacific Properties (NYSE:HPP) Shares Down 4.7% - MarketBeat,"The company traded as low as $4.82 and last traded at $4.82. 785,822 shares traded hands during mid-day trading, a decline of 68% from the average ...",www.marketbeat.com,2024-07-05 21:04:54+00:00,2024-07-06 04:07:10
327,"EVgo, Inc. (NASDAQ:EVGO) Stocks Shoot Up 30% But Its P/S Still Looks Reasonable","Market Still Lacking Some Conviction On Hudson Global, Inc. (NASDAQ:HSON). Simply Wall St. Simply Wall Street Pty Ltd Level 7 ...",simplywall.st,2024-07-05 20:04:14+00:00,2024-07-06 05:07:02
328,Investors Shouldn't Overlook Caterpillar's (NYSE:CAT) Impressive Returns On Capital,"... company's efficiencies. The company is doing well in that sense, and ... Market Still Lacking Some Conviction On Hudson Global, Inc. (NASDAQ ...",simplywall.st,2024-07-05 18:38:49+00:00,2024-07-06 07:07:12
329,"Gaza war is a recruiting boon for terrorists, U.S. intelligence shows - The Washington Post","“They are reflected in the analysis that we've conducted,” he said, acknowledging “the global ... John Hudson is a reporter at The Washington ...",www.washingtonpost.com,2024-07-06 02:20:14+00:00,2024-07-06 09:06:57
330,"Benetton to undergo restructuring, attempts to protect jobs - Fashion United","Business. Hudson's Bay officially confirms Neiman Marcus takeover. Following a slew of media reports on the matter, Hudson's Bay Company (HBC) has ...",fashionunited.uk,2024-07-05 21:37:41+00:00,2024-07-06 10:06:58
331,Saks Fifth Avenue is buying Neiman Marcus with Amazon's help | CNN Business,"... Global. Ad Feedback. The merger means that HBC's Canadian business, which includes Hudson's Bay department stores and $2 billion in property across ...",www.cnn.com,2024-07-06 14:40:05+00:00,2024-07-06 17:07:04
332,Parent company of Saks Fifth Avenue to buy Neiman Marcus | Business | avpress.com,"... Group and HBC, a holding company that purchased Saks in 2013. The ... Apollo Global Management- Hudson's Bay Company- Money- Business Ownership ...",www.avpress.com,2024-07-06 11:09:23+00:00,2024-07-06 17:07:04
333,Form 485APOS BLACKROCK FUNDS - StreetInsider,"Richards served as Chief Compliance Officer of the Asset and Wealth Management global lines of business at JPMorgan Chase & Co. ... Inc., 50 Hudson ...",www.streetinsider.com,2024-07-06 06:38:54+00:00,2024-07-06 17:07:04
334,Hudson's Bay To Buy Neiman Marcus For $2.65 Billion - MSN,"The acquisition will result in a new company called ""Saks Global"" that will include retailers Saks Fifth Avenue, Saks OFF 5TH, the Neiman Marcus ...",www.msn.com,2024-07-05 19:40:52+00:00,2024-07-06 17:07:04
335,Saks owner HBC to acquire American retailer Neiman Marcus for $2.65 bn - Fibre2Fashion,"HBC is acquiring Neiman Marcus Group for $2.65 billion, forming Saks Global ... Hudson's Bay Company (HBC), parent company of Saks Fifth Avenue, has ...",www.fibre2fashion.com,2024-07-05 18:55:04+00:00,2024-07-06 17:07:04
336,HBC should apply learnings from new Saks Global company to the Bay: experts,"When Liza Amlani visited Hudson's Bay Co.'s flagship Toronto store last week, she was quickly taken aback by the scene.",www.bnnbloomberg.ca,2024-07-06 07:36:56+00:00,2024-07-06 18:07:04
337,saks fifth avenue neiman marcus Saks Fifth Avenue owner buys Neiman Marcus for $2.65 bn,"saks fifth avenue neiman marcus Saks Fifth Avenue parent Hudson Bay Company is acquiring Neiman Marcus for $2.65 bn, the privately held upscale ...",www.cgwall.com,2024-07-06 19:10:42+00:00,2024-07-06 20:07:01
338,"Pictures of the Day | July 5, 2024 - Reuters",... Hudson River from ... Screen for heightened risk individual and entities globally to help uncover hidden risks in business relationships and human ...,www.reuters.com,2024-07-05 13:52:50+00:00,2024-07-06 23:07:07
339,"Kroll Bond Rating Agency, LLC: KBRA Assigns Preliminary Ratings to RRE 20 Loan ...","... Global Credit Management, LLC (Apollo) in 2016 to manage CLOs. The RRAM ... Hudson, Senior Managing Director, Co-Head of Global Structured ...",www.finanznachrichten.de,2024-07-05 13:45:05+00:00,2024-07-06 23:07:07
340,Saks Fifth Avenue owner buying Neiman Marcus for $2.65 billion - MSN,"Canada's Hudson's Bay Company, which owns Saks Fifth Avenue and other retailers, is buying 117-year-old Neiman Marcus.",www.msn.com,2024-07-06 02:15:21+00:00,2024-07-07 02:07:02
341,"Mirae Asset Global Investments Co. Ltd. Trims Position in Crane NXT, Co. (NYSE:CXT)","Hudson Bay Capital Management LP purchased a new stake in Crane NXT during the third quarter valued at $3,319,000. Finally, Brown Advisory Inc.",www.marketbeat.com,2024-07-07 14:16:56+00:00,2024-07-07 15:07:02
342,"Hudson Valley, New York Boutique Makes Jewelry That &quot;Rocks!&quot; - WRRV",Kiwanis is a global organization of volunteers dedicated to improving the world one child and one community at a time. Kiwanis strives to be a ...,wrrv.com,2024-07-07 12:48:37+00:00,2024-07-07 15:07:02
343,Hudson Pacific Properties (NYSE:HPP) Trading Down 4.7% - Defense World,"Mirae Asset Global Investments Co. Ltd. Has $14.41 Million Stake in Kronos Worldwide, Inc. Daily Ratings & News for Hudson Pacific Properties.",www.defenseworld.net,2024-07-07 14:27:20+00:00,2024-07-07 16:06:55
344,Sumitomo Mitsui Trust Holdings Inc. Sells 11163 Shares of FirstEnergy Corp. (NYSE:FE),Hudson Bay Capital Management LP lifted its ... The Western Union Company (NYSE:WU) Shares Purchased by Mirae Asset Global Investments Co.,www.defenseworld.net,2024-07-07 15:15:04+00:00,2024-07-07 17:07:02
345,"Principal Financial Group Inc. Trims Stake in Intellia Therapeutics, Inc. (NASDAQ:NTLA)","Hudson Bay Capital Management LP now owns 185,200 shares of the company's stock valued at $5,856,000 after buying an additional 25,200 shares in ...",www.defenseworld.net,2024-07-07 16:01:48+00:00,2024-07-07 22:06:55
346,Van ECK Associates Corp Cuts Stock Position in Bausch Health Companies Inc. (NYSE:BHC),"... Companies by 35.3% in the third quarter. Hudson Bay Capital Management LP now owns 11,500,000 shares of the company's stock valued at $94,530,000 ...",www.defenseworld.net,2024-07-07 16:39:54+00:00,2024-07-07 23:07:09
347,Motorola Solutions Announces New Global R&amp;D Centre in Ireland - Valdosta Daily Times,"The company has deployed more than 13,000 LMR networks worldwide ... Kids Pottery Workshop. Turner Center Hudson Pottery Studio- Sun, Jun 30 ...",www.valdostadailytimes.com,2024-07-07 23:34:13+00:00,2024-07-08 01:07:06
348,29 Connecticut Companies Named to Newsweek's Greatest Workplaces 2024 List,... International Leisure Facilities. Hudson RPO Advertising & Marketing. ISG Advertising & Marketing. RBC Bearings Industrial Products. St. Vincent's ...,ctbythenumbers.news,2024-07-08 02:42:21+00:00,2024-07-08 04:06:53
