,Heading,Subheading,Publisher,Published,Found
87,Homebuilder Stocks Rally To Record Highs On Rate-Cut Frenzy But Housing Sales Still Struggle,"Tip: Try a valid symbol or a specific company name for relevant results ... JELD-WEN Holding, Inc. 26.80%. Installed Building Products, Inc. 26.65 ...",finance.yahoo.com,2024-07-28 20:36:05+00:00,2024-07-28 23:07:46
88,"JELD-WEN Holding, Inc. (NYSE:JELD) Receives $16.80 Average Price Target from Analysts","The Goldman Sachs Group reduced their price objective on shares of JELD-WEN from $19.00 to $14.00 and set a ""neutral"" rating for the company in a ...",www.marketbeat.com,2024-07-28 17:09:30+00:00,2024-07-28 23:07:46
89,JELD-WEN (JELD) to Release Earnings on Monday - Defense World,"Persons that are interested in registering for the company's earnings conference call can do so using this link. ... JELD-WEN Holding, Inc designs, ...",www.defenseworld.net,2024-07-29 06:59:46+00:00,2024-07-29 21:07:58
90,"State Board of Administration of Florida Retirement System Sells 11,171 Shares of JELD ...","... JELD-WEN Holding, Inc. (NYSE:JELD) at Defense World. ... Allspring Global Investments Holdings LLC now owns 2,165 shares of the company's ...",www.defenseworld.net,2024-07-30 09:43:15+00:00,2024-07-30 19:07:55
91,Framing Our World: JELD-WEN Releases 2023 ESG Report - Stock Titan,"JELD-WEN Holding, Inc. (NYSE: JELD) has released its 2023 Environmental, Social and Governance (ESG) report, highlighting progress towards its ...",www.stocktitan.net,2024-08-01 12:50:45+00:00,2024-08-01 15:07:38
92,Framing Our World: JELD-WEN Releases 2023 ESG Report - PR Newswire,"PRNewswire/ -- JELD-WEN Holding, Inc. (NYSE: JELD) today released its ... company. Our ESG goals directly impact all three and I am proud of ...",www.prnewswire.com,2024-08-01 12:03:24+00:00,2024-08-01 15:07:38
93,Framing Our World: JELD-WEN Releases 2023 ESG Report | Placera,"... company. Our ESG goals directly impact all three and I am proud of our ... JELD-WEN Holding, Inc. (NYSE: JELD) is a leading global designer ...",www.placera.se,2024-08-01 12:02:57+00:00,2024-08-01 15:07:38
94,"JELD-WEN Holding, Inc.'s (NYSE:JELD) Price Is Right But Growth Is Lacking After Shares ...",Do Revenue Forecasts Match The Low P/S Ratio? There's an inherent assumption that a company should underperform the industry for P/S ratios like JELD- ...,simplywall.st,2024-08-01 10:22:01+00:00,2024-08-01 15:07:38
95,A Detailed Analysis of the Growth Drivers and Upcoming Trends in the Windows and Doors ...,"JELD-WEN Holding, Inc. DCM Shriram Ltd. (Fenesta Building System). LIXIL ... Corporation. Andersen Corporation. Sanwa Holdings Corporation (Horton ...",tech.einnews.com,2024-08-02 11:46:01+00:00,2024-08-02 14:07:59
96,"Wooden Doors Market to Reach $76.2 Billion, Globally, by 2032 at 5.3% CAGR - PR Newswire","JELD-WEN Holding, Inc. Pella Corporation; Simpson Door Company; Andersen ... Allied Market Research CEO Pawan Kumar is instrumental in inspiring and ...",www.prnewswire.com,2024-08-02 08:48:39+00:00,2024-08-02 14:07:59
97,A Detailed Analysis of the Growth Drivers and Upcoming Trends in the Windows and Doors ...,"JELD-WEN Holding, Inc. DCM Shriram Ltd. (Fenesta Building System). LIXIL Corporation. Andersen Corporation. Sanwa Holdings Corporation (Horton ...",www.einnews.com,2024-08-02 23:43:16+00:00,2024-08-03 01:07:41
98,"Vanguard Group Inc. Increases Holdings in Dillard's, Inc. (NYSE:DDS) - Defense World","Cuts Holdings in Trustmark Co. (NASDAQ:TRMK)- Vanguard Group Inc. Buys 19,622 Shares of JELD-WEN Holding, Inc. (NYSE:JELD)- Vanguard Group Inc.",www.defenseworld.net,2024-08-02 21:39:10+00:00,2024-08-03 01:07:41
99,"Insider Selling: Turtle Creek Asset Management, JELD-WEN Holding Inc. [JELD] 10 ... - Knox Daily","Over the course of the year, JELD-WEN Holding Inc. shares have dropped approximately -16.74%. Shares of the company reached a 52-week high of $21.75 ...",knoxdaily.com,2024-08-02 19:56:48+00:00,2024-08-03 01:07:41
