,Heading,Subheading,Publisher,Published,Found
0,Kadant Inc. (NYSE:KAI) Sees Large Growth in Short Interest - Defense World,"increased its holdings in Kadant by 46.3% in the first quarter. Vanguard Group Inc. now owns 967,638 shares of the industrial products company's stock ...",www.defenseworld.net,2024-06-18 06:54:32,2024-06-18 15:16:51
1,Kadant Inc. (NYSE:KAI) Sees Large Growth in Short Interest - Defense World,"increased its holdings in Kadant by 46.3% in the first quarter. Vanguard Group Inc. now owns 967,638 shares of the industrial products company's stock ...",www.defenseworld.net,2024-06-18 11:54:32+00:00,2024-06-19 17:07:34
2,(KAI) - Analyzing Kadant's Short Interest - Benzinga,Kadant Short Interest Graph (3 Months). short_fig. As you can see from ... A company's peer is another company that has similar characteristics to ...,www.benzinga.com,2024-06-20 01:10:04+00:00,2024-06-20 04:07:24
3,"The Potential Rise in the Price of Kadant, Inc. (KAI) following insiders activity - Knox Daily","Kadant, Inc.'s recent filing unveils that its Director Russell Erin L unloaded Company's shares for reported $0.31 million on May 31 '24.",knoxdaily.com,2024-06-19 23:48:24+00:00,2024-06-20 04:07:24
4,"14,085 Shares in Kadant Inc. (NYSE:KAI) Acquired by Confluence Investment Management LLC","Kadant Inc supplies technologies and engineered systems worldwide. It operates in three segments: Flow Control, Industrial Processing, and Material ...",www.marketbeat.com,2024-06-19 22:47:07+00:00,2024-06-20 04:07:24
5,Q2 2024 EPS Estimates for Kadant Inc. Decreased by William Blair (NYSE:KAI) - MarketBeat,"Vancity Investment Management Ltd now owns 3,089 shares of the industrial products company's stock worth $1,013,000 after purchasing an additional 260 ...",www.marketbeat.com,2024-06-19 22:33:29+00:00,2024-06-20 04:07:24
6,Virtu Financial LLC Takes Position in Kadant Inc. (NYSE:KAI) - Defense World,"The institutional investor purchased 1,398 shares of the industrial products company's stock, valued at approximately $392,000. Get Kadant alerts: A ...",www.defenseworld.net,2024-06-19 09:30:54+00:00,2024-06-20 04:07:24
7,Kadant Acquires Dynamic Sealing Technologies - Pumps &amp; Systems,"DSTI is a leader in engineered fluid sealing and transfer solutions for rotating applications. The company specializes in the design, manufacture and ...",www.pumpsandsystems.com,2024-06-20 15:14:07+00:00,2024-06-21 03:07:23
8,Kadant Inc.'s (NYSE:KAI) Shares May Have Run Too Fast Too Soon - Simply Wall St,"It seems most investors are hoping for a turnaround in the company's business prospects, but the analyst cohort is not so confident this will happen.",simplywall.st,2024-06-20 11:22:18+00:00,2024-06-21 03:07:23
9,Global Rotary Union Market Segmentation: Understanding Types and Applications - TIMC,"Leading 10 Companies in the Global Rotary Union Market Research Report: Deublin Company, Duff-Norton, Kadant Inc., John Crane Group, Rotary Systems ...",www.theindianmoviechannel.com,2024-06-24 08:37:26+00:00,2024-06-25 04:07:33
10,"Kadant Stock: Growing E-Commerce, Circular Economy, Acquisition Dynamic Sealing (NYSE:KAI)","25, 2024 8:37 AM ETKadant Inc. (KAI) Stock- RL Insights profile picture ... EBITDA margin measures a company's core business activity performance, ...",seekingalpha.com,2024-06-26 00:40:56+00:00,2024-06-26 04:07:28
11,Kadant Inc. (NYSE:KAI) Shares Sold by Goldman Sachs Group Inc. - Defense World,raised its holdings in Kadant by 37.0% in the 4th quarter. First Horizon Advisors Inc. now owns 185 shares of the industrial products company's stock ...,www.defenseworld.net,2024-06-25 10:10:17+00:00,2024-06-26 04:07:28
12,Navigating 4 Analyst Ratings For Kadant - Benzinga,"Financial Milestones: Kadant's Journey. Market Capitalization Analysis: Reflecting a smaller scale, the company's market capitalization is positioned ...",www.benzinga.com,2024-06-26 14:12:47+00:00,2024-06-26 20:07:39
13,"Zebra (ZBRA) Acquires Fetch Robotics, Boosts Product Offerings - Yahoo News NZ","Some better-ranked stocks from the Zacks Industrial Products sector are Kadant Inc. KAI, Dover Corporation DOV and EnPro Industries, Inc. NPO ...",nz.news.yahoo.com,2024-06-27 08:29:39+00:00,2024-06-28 05:07:28
14,Buy Rating Justified by Kadant's Strategic Position in Sustainable Industrial Markets,"Kadant (KAI – Research Report), the Industrials sector company, was revisited by a Wall Street analyst today. Analyst Gary Prestopino from...",markets.businessinsider.com,2024-06-26 20:33:38+00:00,2024-06-28 05:07:28
15,Kadant Inc. (NYSE:KAI) Shares Sold by PNC Financial Services Group Inc. - Defense World,"Parallel Advisors LLC now owns 106 shares of the industrial products company's stock worth $30,000 after buying an additional 39 shares during the ...",www.defenseworld.net,2024-06-30 14:29:35+00:00,2024-06-30 20:07:31
16,Agricultural Product Baler Market Recovery and Impact Analysis Report - TIMC,"John Deere, Vermeer, Kadant PAAL, Claas, Krone, Minos, Abbriata (Piedmont), Case IH, Fendt (AGCO Corporation), Massey Ferguson, Kuhn, New Holland ...",www.theindianmoviechannel.com,2024-07-02 15:03:08+00:00,2024-07-02 20:07:36
17,Possible Bearish Signals With Kadant Insiders Disposing Stock - Simply Wall St News,Kadant insiders didn't buy any shares over the last year. You can see a visual depiction of insider transactions (by companies and individuals) over ...,simplywall.st,2024-07-03 23:27:38+00:00,2024-07-04 05:07:49
18,Desuperheaters Market to Grow Significantly by Leading Players 2024 to 2032 - WICZ,"2.3 Desuperheaters Market Share by Company Type (Tier 1, Tier 2 and Tier 3) ... 7.5.4 Kadant (Thermo Fisher Scientific) Main Business and Markets Served",www.wicz.com,2024-07-04 16:52:15+00:00,2024-07-04 21:08:00
19,Reasons Why Applied Industrial (AIT) Should Be in Your Portfolio - Yahoo Finance,"We have highlighted three other top-ranked stocks, namely Crane Company CR, Flowserve Corporation FLS and Kadant Inc. KAI. Each of these companies ...",finance.yahoo.com,2024-07-04 15:18:16+00:00,2024-07-04 21:08:00
20,Short Interest in Kadant Inc. (NYSE:KAI) Rises By 7.6% - Defense World,Company insiders own 1.40% of the company's stock. Institutional Inflows and Outflows. Hedge funds have recently bought and sold shares of the stock.,www.defenseworld.net,2024-07-04 09:46:20+00:00,2024-07-04 21:08:00
21,"Kadant Clears Technical Benchmark, Hitting 80-Plus RS Rating | Investor's Business Daily",The company is expected to report its latest numbers on or around Jul. 30. Kadant holds the No. 12 rank among its peers in the Machinery-General ...,www.investors.com,2024-07-05 17:06:05+00:00,2024-07-06 21:07:56
22,Kadant (KAI) Authorizes $50M Worth of Share Buyback Program - MSN,We believe that the repurchase program is in sync with its commitment to rewarding shareholders handsomely. The company's shares inched down 0.6% ...,.google.com,2024-07-05 10:09:47+00:00,2024-07-06 21:07:56
23,Vertical Downstroke Baler Market Case Studies: Success Stories and Lessons,Leading 10 Companies in the Vertical Downstroke Baler Market Research Report: Kadant PAAL; Maren Engineering Corporation; Macpresse; Harris Equipment ...,www.knowcasino.co.nz,2024-07-10 02:57:21+00:00,2024-07-10 06:07:54
24,Kadant Inc. (KAI) To Go Ex-Dividend on July 11th - Defense World,"The industrial products company reported $2.38 earnings per share for the quarter, topping analysts' consensus estimates of $1.96 by $0.42. Kadant had ...",www.defenseworld.net,2024-07-09 11:23:48+00:00,2024-07-10 06:07:54
25,A Look Back at General Industrial Machinery Stocks' Q1 Earnings: Kadant (NYSE:KAI) Vs ...,"Quarterly earnings results are a good time to check in on a company's progress, especially compared to its peers in the same sector.",finance.yahoo.com,2024-07-11 13:05:32+00:00,2024-07-12 05:07:58
26,Microsoft And 5 Other Stocks Have High Sales Growth And An Above 3% Return on Equity,"Kadant Inc. supplies equipment and critical components worldwide. The company's Papermaking Systems segment develops, manufactures, and markets custom ...",via.news,2024-07-13 03:25:56+00:00,2024-07-13 14:07:57
27,BNP Paribas Financial Markets Cuts Stock Holdings in Kadant Inc. (NYSE:KAI),"The firm owned 10,811 shares of the industrial products company's stock after selling 622 shares during the period. BNP Paribas Financial Markets ...",www.defenseworld.net,2024-07-14 15:12:46+00:00,2024-07-14 21:07:59
28,"Fluid Rotary Unions Industry Key Drivers, Restraints, and Opportunities - TIMC","In-depth analyses of the market shares, company profiles, and ... Moog, GAT, RIX, Columbus McKinnon, MOFLON, Kadant, BGB Innovation, Dynamic ...",www.theindianmoviechannel.com,2024-07-15 07:38:48+00:00,2024-07-15 14:08:12
29,7 Short-Squeeze Stocks That Could Beat Down the Bears | InvestorPlace,Kadant (KAI): Kadant offers a quietly relevant business that deserves a rethink.- AirSculpt Technologies (AIRS): AirSculpt may rise on the promise of ...,investorplace.com,2024-07-16 19:42:56+00:00,2024-07-16 22:07:43
30,"Susquehanna Fundamental Investments LLC Makes New $670,000 Investment in Kadant ...","The institutional investor purchased 2,043 shares of the industrial products company's stock, valued at approximately $670,000. Get Kadant alerts:.",www.marketbeat.com,2024-07-16 17:09:14+00:00,2024-07-16 22:07:43
31,"Kadant (NYSE:KAI) jumps 13% this week, though earnings growth is still tracking behind five ...","On the back of a solid 7-day performance, let's check what role the company's fundamentals have played in driving long term shareholder returns. See ...",simplywall.st,2024-07-17 11:12:21+00:00,2024-07-17 14:07:46
32,Susquehanna Fundamental Investments LLC Invests $670000 in Kadant Inc. (NYSE:KAI),"The institutional investor bought 2,043 shares of the industrial products company's stock, valued at approximately $670,000. Get Kadant alerts:.",www.defenseworld.net,2024-07-16 21:04:17+00:00,2024-07-17 14:07:46
33,Sei Investments Co. Raises Stake in Kadant Inc. (NYSE:KAI) - MarketBeat,"Kadant Inc supplies technologies and engineered systems worldwide. It operates in three segments: Flow Control, Industrial Processing, and Material ...",www.marketbeat.com,2024-07-17 15:59:20+00:00,2024-07-18 05:07:42
34,Is Kadant Inc.'s (NYSE:KAI) Stock's Recent Performance Being Led By Its Attractive Financial ...,Kadant's (NYSE:KAI) stock is up by a considerable 18% over the past month. Given the company's impressive performance...,finance.yahoo.com,2024-07-20 14:44:40+00:00,2024-07-20 21:07:32
35,"Kadant to Hold Earnings Conference Call on Wednesday, July 31, 2024 - Quantisnow","The Company's products and services play an integral role in enhancing efficiency, optimizing energy utilization, and maximizing productivity in ...",quantisnow.com,2024-07-26 02:31:07+00:00,2024-07-26 05:08:04
36,Kadant Solutions Division Launches the X-Tek™ Roll Cleaning Blade - lithium-ion battery production,"Kadant Solutions Division, a division of Kadant Inc. (NYSE: KAI) ... The company's cleaning and conditioning products are applied to the ...",batteriesnews.com,2024-07-26 00:11:40+00:00,2024-07-26 05:08:04
37,Kadant Inc. reaches all-time high at 354.04 USD - Investing.com,This substantial growth underscores the company's resilience and adaptability in a challenging economic environment. Investors and market watchers ...,www.investing.com,2024-07-25 18:32:27+00:00,2024-07-26 05:08:04
38,"Kadant to Hold Earnings Conference Call on Wednesday, July 31, 2024 | KAI Stock News","(NYSE: KAI) has announced its plans to release the 2024 second quarter results after market close on Tuesday, July 30, 2024. The company will hold a ...",www.stocktitan.net,2024-07-25 14:37:51+00:00,2024-07-26 05:08:04
39,"Kadant to Hold Earnings Conference Call on Wednesday, July 31, 2024 - Yahoo Finance","... and future expectations. To listen to the live call and view the webcast, go to the “Investors” section of the Company's website at www.kadant.c.",finance.yahoo.com,2024-07-25 14:23:46+00:00,2024-07-26 05:08:04
40,Janney Montgomery Scott LLC Buys Shares of 638 Kadant Inc. (NYSE:KAI) - Defense World,"The firm bought 638 shares of the industrial products company's stock, valued at approximately $209,000. Get Kadant alerts: Several other hedge funds ...",www.defenseworld.net,2024-07-26 10:57:31+00:00,2024-07-26 21:08:09
41,Kadant Earnings: What To Look For From KAI - Barchart.com,"5 Best AI Companies to Invest In This Year- 1. Microsoft. As a company best known for its software, it's easy to see where- 2. NVIDIA- 3. Alphabet- 4.",www.barchart.com,2024-07-29 20:46:44+00:00,2024-07-30 07:08:03
42,Kadant Earnings: What To Look For From KAI - The Globe and Mail,"The majority of analysts covering the company have reconfirmed their estimates over the last 30 days, suggesting they anticipate the business to stay ...",www.theglobeandmail.com,2024-07-29 19:33:07+00:00,2024-07-30 07:08:03
43,Kadant is about to announce its earnings — here's what Wall Street expects,On the revenue side analysts estimate that the company will bring in $1.06 billion in the current fiscal year. ... Outperform Rating for Kadant Inc. on ...,markets.businessinsider.com,2024-07-29 14:12:36+00:00,2024-07-30 07:08:03
44,Kadant Earnings: What To Look For From KAI - Yahoo Finance,"It was a strong quarter for the company, with an impressive beat of analysts' earnings estimates. ADVERTISEMENT. Advertisement. Is Kadant a buy or ...",finance.yahoo.com,2024-07-29 09:53:59+00:00,2024-07-30 07:08:03
45,Kadant: Q2 Earnings Snapshot - Times Union,"(KAI) on Tuesday reported second-quarter profit of $31.3 million. On a per-share basis, the Westford, Massachusetts-based company said it had profit ...",www.timesunion.com,2024-07-30 21:06:43+00:00,2024-07-30 22:08:08
46,Kadant (NYSE:KAI) Surprises With Q2 Sales - The Globe and Mail,"Revenue Guidance for Q3 CY2024 is $263 million at the midpoint, below analyst estimates of $274 million; The company slightly lifted its revenue ...",www.theglobeandmail.com,2024-07-30 20:56:14+00:00,2024-07-30 22:08:08
47,Kadant Reports Second Quarter 2024 Results - GlobeNewswire,Kadant Inc. is a global supplier of technologies and engineered systems that drive Sustainable Industrial Processing. The Company's products and ...,www.globenewswire.com,2024-07-30 20:41:40+00:00,2024-07-30 22:08:08
48,Kadant Reports Second Quarter 2024 Results | KAI Stock News,The company raised its full-year 2024 guidance: Revenue of $1.045 to $1.065 billion (up from $1.040-$1.065 billion); Adjusted EPS of $9.80 to $10.05 ( ...,www.stocktitan.net,2024-07-30 20:37:01+00:00,2024-07-30 22:08:08
49,Kadant (NYSE:KAI) Has Some Way To Go To Become A Multi-Bagger - Simply Wall St,"If you see this, it typically means it's a company with a great business model and plenty of profitable reinvestment opportunities. That's why when we ...",simplywall.st,2024-07-30 19:09:48+00:00,2024-07-30 22:08:08
50,"Xylem (XYL) Q2 Earnings &amp; Revenues Beat, '24 View Raised - Nasdaq",The company also bought back shares worth $18 million in the same ... Kadant Inc. KAI presently sports a Zacks Rank #1 (Strong Buy). You can ...,www.nasdaq.com,2024-07-30 19:03:05+00:00,2024-07-30 22:08:08
51,American International Group Inc. Sells 50 Shares of Kadant Inc. (NYSE:KAI),"Raymond James & Associates now owns 82,151 shares of the industrial products company's stock valued at $23,028,000 after buying an additional 47,618 ...",www.defenseworld.net,2024-07-30 12:40:17+00:00,2024-07-30 22:08:08
52,Earnings call: Kadant posts record Q2 revenue and raises EPS guidance - Investing.com,"Kadant's robust financial results for the second quarter of 2024 reflect the company's ability to navigate a challenging global market, with ...",www.investing.com,2024-08-01 03:58:50+00:00,2024-08-01 06:07:49
53,"Kadant (NYSE:KAI) Announces Quarterly Earnings Results, Beats Estimates By $0.38 EPS",Kadant (NYSE:KAI - Get Free Report) released its quarterly earnings data on Tuesday. The industrial products company reported $2.81 earnings per ...,www.marketbeat.com,2024-07-31 17:04:50+00:00,2024-08-01 06:07:49
54,D.A. Davidson Keeps Their Hold Rating on Kadant (KAI) | Markets Insider,"The company's shares closed yesterday at $356.64. According to TipRanks, Yinger is a 5-star analyst with an average return of 26.5% and a 79.78% ...",markets.businessinsider.com,2024-07-31 17:03:18+00:00,2024-08-01 06:07:49
55,"Kadant earnings beat by $0.38, revenue topped estimates - Investing.com","... Company News. The ProPicks AI strategy to watch when Tech rally slows ... Check out Kadant's recent earnings performance, and Kadant's financials ...",www.investing.com,2024-07-31 06:59:59+00:00,2024-08-01 06:07:49
56,"KAI Stock Earnings: Kadant Beats EPS, Beats Revenue for Q2 2024 | InvestorPlace",Kadant reported earnings per share of $2.81. This was above the analyst estimate for EPS of $2.43.- The company reported revenue of $274.77 million.,investorplace.com,2024-07-31 02:05:10+00:00,2024-08-01 06:07:49
57,"Kadant (KAI) Q2 Earnings and Revenues Surpass Estimates - July 30, 2024 - Zacks.com","This page has not been authorized, sponsored, or otherwise approved or endorsed by the companies represented herein. Each of the company logos ...",www.zacks.com,2024-07-31 00:30:23+00:00,2024-08-01 06:07:49
58,Kadant (KAI) Q2 Earnings and Revenues Surpass Estimates | Nasdaq,"There are no easy answers to this key question, but one reliable measure that can help investors address this is the company's earnings outlook. Not ...",www.nasdaq.com,2024-07-30 23:05:06+00:00,2024-08-01 06:07:49
59,"Kadant Inc (KAI) Q2 2024 Earnings: EPS of $2.66 Beats Estimates, - GuruFocus","The company's performance is noteworthy due to the record revenue and adjusted EBITDA, driven by strong aftermarket demand and capital business.",www.gurufocus.com,2024-07-30 21:41:55+00:00,2024-08-01 06:07:49
60,Kadant Q2 Financial Performance Webcast and Insights - TipRanks.com,"The discussion will be supported by a slideshow presentation, providing a deeper insight into the company's earnings and financial health. This event ...",www.tipranks.com,2024-07-30 21:14:12+00:00,2024-08-01 06:07:49
61,Chart Of The Day: Kadant - 18 Advances In The Last 20 Trading Sessions - Barchart.com,... company Kadant (KAI) . I found the stock by using Barchart's powerful screening functions to find stocks with the highest technical...,www.barchart.com,2024-08-01 16:08:28+00:00,2024-08-01 22:07:53
62,DA Davidson Boosts Kadant (NYSE:KAI) Price Target to $300.00 - MarketBeat,"The firm currently has a ""neutral"" rating on the industrial products company's stock. DA Davidson's target price would indicate a potential downside ...",www.marketbeat.com,2024-08-01 14:45:40+00:00,2024-08-01 22:07:53
63,Chart of the Day: Kadant - 18 Advances in the Last 20 Trading Sessions | Nasdaq,"The company markets and sells its products, services, and systems through direct sales, independent sales agents, and distributors. The company was ...",www.nasdaq.com,2024-08-01 14:18:49+00:00,2024-08-01 22:07:53
64,Q2 2024 Kadant Inc Earnings Call Transcript - GuruFocus,"... Kadant Inc - Chief Financial Officer, Executive Vice President Thank ... Company. About GuruFocus Career Contact Us Advertise Site Map Term of ...",www.gurufocus.com,2024-08-01 09:55:13+00:00,2024-08-01 22:07:53
65,DA Davidson Equities Analysts Decrease Earnings Estimates for Kadant Inc. (NYSE:KAI),Kadant had a return on equity of 15.73% and a net margin of 11.35%. The company's revenue was up 12.2% on a year-over-year basis. During the same ...,www.marketbeat.com,2024-08-02 15:13:58+00:00,2024-08-03 06:08:10
66,Kadant (NYSE:KAI) Hits New 12-Month High Following Strong Earnings - Defense World,"The company traded as high as $360.08 and last traded at $360.08, with a volume of 96366 shares. The stock had previously closed at $356.64. Get ...",www.defenseworld.net,2024-08-02 03:52:29+00:00,2024-08-03 06:08:10
