,Heading,Subheading,Publisher,Published,Found
528,County asked to support Mosaic broadband grant effort | Free News,... company in its efforts to apply for more funding. Okey said Mosaic has been a good corporate citizen. He noted that Mosaic played a key role in ...,www.news-shield.com,2024-07-10 13:45:34+00:00,2024-07-10 15:09:32
529,Thetford Guildhall heritage project sees students from four schools create mosaic artwork of ...,"... mosaic artwork of famous figures from town's history. By Mariam Ghaemi. -. mariam.ghaemi@iliffepublishing.co.uk. Published: 12:47, 10 July 2024 ...",www.suffolknews.co.uk,2024-07-10 11:58:54+00:00,2024-07-10 15:09:32
530,PICTURE SPECIAL: Legion of fun at Roman Alcester Heritage Museum,... mosaic. Picture by Marcus Mingins 2824004MMR www.buyphotos247.com ... There was a special Roman-themed photographic display of Royal Shakespeare Company ...,leamingtonobserver.co.uk,2024-07-10 10:07:12+00:00,2024-07-10 15:09:32
531,AE Industrial Partners Raises $1.3B for 3rd Fund; Michael Greene Quoted - GovCon Wire,ExecutiveBiz- Dataminr's Geoff Gage Dives Into National Security Challenges & Company Culture ... © Copyrights Executive Mosaic - All Rights Reserved.,www.govconwire.com,2024-07-10 10:02:06+00:00,2024-07-10 15:09:32
532,HealthSource Solutions Celebrates Mosaic's Achievement of Gold Bell Seal for Workplace ...,"... company's efforts, it reinforces the credibility and authenticity of the company's initiatives. ... The Mosaic Company is the world's leading integrated ...",www.einnews.com,2024-07-10 15:03:12+00:00,2024-07-10 16:09:44
533,Federal lawsuit alleges housing discrimination against a New Jersey DACA recipient,... company that denied her housing discriminated against her based on her ... Mosaic staff writer Vashti Harris can be reached at vharris@njadvancemedia.,mosaic.nj.com,2024-07-10 14:34:28+00:00,2024-07-10 16:09:44
534,'A mosaic of memories' - The Woodstock Independent,TWI writer Eileen Millard to debut her 'cozy' mystery at Read Between the Lynes' 19th birthday party By Susan W. Murraynews@thewoodstockindependent.co ...,www.thewoodstockindependent.com,2024-07-10 14:31:19+00:00,2024-07-10 16:09:44
535,WNS (Holdings) Limited Reports Unaudited Fiscal 2024 and 2023 Results Under ...,"... Mosaic; Mitch Blaser, Co-CEO, Mosaic; Keshav R. Murugesh, Group CEO ... She will also become a member of the Company's Audit and Nominating & Corporate ...",quantisnow.com,2024-07-10 06:44:36+00:00,2024-07-10 16:09:44
536,Mosaic (NYSE:MOS) Price Target Cut to $30.00 by Analysts at UBS Group - Defense World,They currently have a neutral rating on the basic materials company's stock. Get Mosaic alerts: Other equities analysts have also issued research ...,www.defenseworld.net,2024-07-10 13:58:51+00:00,2024-07-10 18:09:34
537,Mosaic (NYSE:MOS) Hits New 12-Month Low on Analyst Downgrade - MarketBeat,"Institutional investors and hedge funds own 77.54% of the company's stock. Mosaic Trading Down 1.2 %. The stock has a market cap of $8.55 billion, a ...",www.marketbeat.com,2024-07-10 18:50:50+00:00,2024-07-10 20:09:36
538,The 2024 Wash100 Popular Vote Top 10 Winners - ExecutiveBiz,Being appointed chair of Executive Mosaic's ... She was selected for widening the company's presence in the federal market and promoting cloud ...,executivebiz.com,2024-07-10 20:11:10+00:00,2024-07-10 21:09:27
539,Fidelis Capital Partners LLC Purchases Shares of 1550 The Mosaic Company (NYSE:MOS),"The firm purchased 1,550 shares of the basic materials company's stock, valued at approximately $50,000. Get Mosaic alerts: Several other ...",www.defenseworld.net,2024-07-10 18:54:56+00:00,2024-07-10 21:09:27
540,VP Kamala Harris launches new campaign to gain Asian American voters - Mosaic - NJ.com,"https://t.co/DIQWmyj4XH. — Kamala Harris (@KamalaHarris) July 9, 2024. The initiative's main objective, Harris explained is to ensure that Asian ...",mosaic.nj.com,2024-07-10 21:00:12+00:00,2024-07-10 22:09:29
541,The Mosaic House in Chiswick: a hidden mosaic masterpiece - South West Londoner,artartistCarrie ReichardtChiswickLondonThe Mosaic House. Search in https://www.swlondoner.co.uk/. SWL Podcasts. Lance Stroll's Aston Martin- The SWL ...,www.swlondoner.co.uk,2024-07-10 19:59:00+00:00,2024-07-11 00:09:44
542,"Assistant General Manager - Mosaic District, EDENS | The #1 Commercial Real Estate Job Network",Contract management as assigned. Support execution of a capital management program defining a 5–10-year business plan. Assist with Common Area ...,www.selectleaders.com,2024-07-10 18:51:49+00:00,2024-07-11 00:09:44
543,"Mosaic Co. stock falls Wednesday, underperforms market - MarketWatch","Shares of Mosaic Co. shed 0.30% to $26.83 Wednesday, on what proved to be an all-around favorable trading session for the stock market, ...",www.marketwatch.com,2024-07-10 21:44:02+00:00,2024-07-11 02:09:38
544,Oshkosh Defense Books $232M in Army Delivery Orders for Modernized Heavy Tactical Vehicles,He noted that the delivery orders show that the U.S. Army continues to rely on the company ... © Copyrights Executive Mosaic - All Rights Reserved.,www.govconwire.com,2024-07-10 19:11:34+00:00,2024-07-11 02:09:38
545,This 8% Dividend Stock Pays Cash Every Month - Yahoo Finance,"Pixelated acronym REIT made from cubes, mosaic pattern ... Furthermore, the company's strategic capital allocation and debt reduction are encouraging.",ca.finance.yahoo.com,2024-07-11 02:27:24+00:00,2024-07-11 07:09:59
546,Students discover 'Roman villa' in Leicestershire countryside - BBC News,Finds from the villa included fragments of brightly painted wall plaster and mosaic tiles. ... Send your story ideas to eastmidsnews@bbc.co.uk ...,www.bbc.co.uk,2024-07-11 08:26:45+00:00,2024-07-11 09:09:42
547,Anneke Christensen Joins GDIT as Growth VP - GovCon Wire,"... company. Christensen, early in her career, was a mission manager for ... © Copyrights Executive Mosaic - All Rights Reserved. GovCon Wire.",www.govconwire.com,2024-07-11 09:16:59+00:00,2024-07-11 10:09:43
548,Business | The “fall and rise” of desktop 3D printing - 3D ADEPT MEDIA,"That being said, for Mitch Debora, CEO of Mosaic Manufacturing, a Canada-based 3D printer manufacturer, “the reason businesses are choosing to invest ...",3dadept.com,2024-07-11 08:37:46+00:00,2024-07-11 10:09:43
549,Students discover 'Roman villa' in Leicestershire countryside - BBC News,"Finds from the villa included fragments of brightly painted wall plaster and mosaic tiles. ... eastmidsnews@bbc.co.uk, external or via WhatsApp ...",.google.com,2024-07-11 05:26:59+00:00,2024-07-11 10:09:43
550,'We would be happy to have you': Mosaic Community Food Farm looking for volunteers,"... Co-op! More on Agriculture. Residential Lot Draw Package for Westheath Phase 5 & 6A. Westheath Residential Lot Draw, click here. Next. Local News. 'We ...",discovermoosejaw.com,2024-07-11 10:04:16+00:00,2024-07-11 11:09:28
551,Students discover 'Roman villa' in Leicestershire countryside - BBC,Send your story ideas to eastmidsnews@bbc.co.uk or via WhatsApp on 0808 100 2210. More on this story. Remarkable Roman mosaic found in farmer's field ...,www.bbc.com,2024-07-11 06:34:21+00:00,2024-07-11 11:09:28
552,Interplay between drought and plant viruses co-infecting melon plants - Hortidaily,"Here, we established an experiment with well-watered or water-stressed melon plants, later single infected with either cucumber mosaic virus (CMV ...",www.hortidaily.com,2024-07-11 12:19:57+00:00,2024-07-11 13:09:29
553,The Mosaic Company (NYSE:MOS) Stock Holdings Increased by Daiwa Securities Group Inc.,Read The Mosaic Company (NYSE:MOS) Stock Holdings Increased by Daiwa Securities Group Inc. at Defense World.,www.defenseworld.net,2024-07-11 11:37:26+00:00,2024-07-11 13:09:29
554,CFC snaps cyber expert from Mosaic to lead new US mid-market division | Intelligent Insurer,"Company Logo. We respect your privacy. By clicking “Accept All Cookies”, you agree to the storing of cookies on your device to enhance site ...",www.intelligentinsurer.com,2024-07-11 10:39:57+00:00,2024-07-11 13:09:29
555,IFS Buys EmpowerMX to Expand MRO Software Offerings for Aerospace &amp; Defense Sector,"The company's industrial AI technology, IFS.ai, is designed to help ... © Copyrights Executive Mosaic - All Rights Reserved. GovCon Wire.",www.govconwire.com,2024-07-11 09:19:03+00:00,2024-07-11 13:09:29
556,Knights of Columbus will cover up mosaics by ex-Jesuit artist accused of abusing women,"Company Logo. About Your Privacy Choices. We and our 371 partners store and/or access information on your device, such as unique IDs in cookies to ...",apnews.com,2024-07-11 17:06:41+00:00,2024-07-11 17:09:34
557,Knights of Columbus will cover up mosaics by ex-Jesuit artist accused of abusing women,A mosaic by ex-Jesuit artist Marko Rupnik is seen on... A mosaic by ... Company Logo. Privacy Preference Center. Your Privacy. Your Privacy. Like ...,www.newsday.com,2024-07-11 17:03:35+00:00,2024-07-11 17:09:34
558,Booz Allen Invests in Space Technology Company Quindar - ExecutiveBiz,"... business strategy, the McLean, Virginia-based company announced Thursday. ... Staying in line with Executive Mosaic's dedication to covering all ...",executivebiz.com,2024-07-11 16:07:36+00:00,2024-07-11 17:09:34
559,Lourdes decides to keep Rupnik mosaics for time-being - The Tablet,"Mosaics portraying the Luminous Mysteries of the Rosary by Fr ... Copyright © The Tablet Publishing Company 2015 - 2024, all rights reserved.",www.thetablet.co.uk,2024-07-11 15:31:37+00:00,2024-07-11 17:09:34
560,Norway's Yara seeks antitrust nod for Brazil NPK asset disposal - TradingView,"... company in Brazil, a move to stay competitive on a key market for the ... Mosaic MOS, the largest local player, commanded a 17% share of ...",www.tradingview.com,2024-07-11 15:11:39+00:00,2024-07-11 17:09:34
561,Gas South awards $200000 in grants to two Atlanta area nonprofits - The Business Journals,"Gas South awarded Mosaic Georgia $100,000 as part of its impact grant program. The effort is part of the utility's goal of giving away to charity 5% ...",www.bizjournals.com,2024-07-11 12:04:46+00:00,2024-07-11 17:09:34
562,Mosaic (NYSE:MOS) Sets New 52-Week Low After Analyst Downgrade - Defense World,"Dimensional Fund Advisors LP now owns 3,969,039 shares of the basic materials company's stock worth $141,829,000 after acquiring an additional 189,706 ...",www.defenseworld.net,2024-07-11 11:25:47+00:00,2024-07-11 17:09:34
563,CT-based Knights of Columbus will cover up mosaics by ex-Jesuit artist accused of abusing women,Click to share on X (Opens in new window). A mosaic ... COMPANY INFO- Contact Us- About Us- Classifieds- Careers- Privacy Policy ...,www.courant.com,2024-07-11 17:19:55+00:00,2024-07-11 18:09:43
564,Knights of Columbus will cover up mosaics by ex-Jesuit artist accused of abusing women,Our CompanyCareersOur Use of AIEthics Policy. Contact. Customer ServiceContact Us. Services. Advertise with UsEmail Newsletters. About. Our Company ...,www.chron.com,2024-07-11 17:09:13+00:00,2024-07-11 18:09:43
565,Xartup is now a part of HT Media Group's Mosaic Digital to Build World's Largest Startup Community,Business credibility as an entrepreneur boils down to being trusted and respected in your industry and by your target audience. It is the ability to ...,www.msn.com,2024-07-11 14:16:36+00:00,2024-07-11 18:09:43
566,Xartup is now a part of HT Media Group's Mosaic Digital to Build World's Largest Startup Community,Latest NewsCompany NewsMarket NewsIndia NewsPolitics NewsCricket NewsPersonal FinanceTechnology NewsWorld NewsIndustry NewsEducation NewsOpinion ...,www.business-standard.com,2024-07-11 18:28:42+00:00,2024-07-11 19:09:33
567,X-Bow Closes Series B Investment Round With Over $70M in Fresh Capital - ExecutiveBiz,The company will use the fresh funds to grow its hypersonic-capable ... Staying in line with Executive Mosaic's dedication to covering all ...,executivebiz.com,2024-07-11 16:02:23+00:00,2024-07-11 19:09:33
568,Knights of Columbus will cover up mosaics by ex-Jesuit artist accused of abusing women,"Rupnik, a charismatic preacher, co-founded a Jesuit-inspired community in his native Slovenia and then opened an atelier in Rome that received ...",www.washingtonpost.com,2024-07-11 20:03:17+00:00,2024-07-11 20:09:46
569,"Danville's Mosaic City Church Announces Feed the Community Day on Sunday, July 14th","It will all be happening at the Mosaic City Church's place of worship, the Danville Family YMCA ... Company Sues County Board Over Solar Facility Vote.",vermilioncountyfirst.com,2024-07-11 19:58:10+00:00,2024-07-11 20:09:46
570,Greater Minden Chamber welcomes The Mosaic Co. to Minden - Minden Press-Herald,The Mosaic Company specializes in providing a diverse range of flooring ... For more information about The Mosaic Company you can visit their ...,press-herald.com,2024-07-11 19:52:45+00:00,2024-07-11 20:09:46
571,"U.S. CoreCivic, Eli Lilly, 40 - XM",* Azek Company Inc AZEK.N: Citigroup cuts target price to $44 from $50 ... * Mosaic Co MOS.N: BofA Global Research raises price objective to $44 ...,www.xm.com,2024-07-11 19:25:50+00:00,2024-07-11 20:09:46
572,Knights of Columbus will cover up mosaics by ex-Jesuit artist accused of abusing women,"Beck Selmani makes ice cream at his new business, Sweet Scoops in Brookfield. New Fairfield group IDs possible bus parking lot sites, including ...",www.newstimes.com,2024-07-11 18:01:52+00:00,2024-07-11 20:09:46
573,"Chugach Government Solutions Names Dirk van der Vaart as President, Michael Iacobucci ...",The company said Wednesday van der Vaart will also serve as executive VP of ... © Copyrights Executive Mosaic - All Rights Reserved. GovCon Wire.,www.govconwire.com,2024-07-11 15:19:14+00:00,2024-07-11 20:09:46
574,Police arrest local teen for alleged theft and fraud - Minden Press-Herald,"Greater Minden Chamber welcomes The Mosaic Co. to... Jul 11, 2024. Webster Parish School Board approves superintendent's contract with... Jul 10 ...",press-herald.com,2024-07-11 21:17:55+00:00,2024-07-11 22:09:31
575,In the Company of Kings Review: A Compelling Tribute to Boxing's Legends - IMDb,"Despite taking detours, its mosaic emerges compelling. We see boxing as a complex force, rewarding challengers who confront hardship in and out of ...",m.imdb.com,2024-07-11 16:15:38+00:00,2024-07-11 22:09:31
576,Knights of Columbus will cover up mosaics by ex-Jesuit artist accused of abusing women,The skyline of downtown Stamford. Business- Connecticut drops to No. 32 in CNBC's 2024 Top States for Business ranking.,www.middletownpress.com,2024-07-11 17:08:41+00:00,2024-07-11 23:09:37
577,LSU to celebrate 100 years of Tiger Stadium with many upgrades to Death Valley in 2024,"Greater Minden Chamber welcomes The Mosaic Co. to Minden. Related Posts. NSU announces N-Club Hall of Fame Class of... Jul 11, 2024. Outdoors ...",press-herald.com,2024-07-11 23:31:53+00:00,2024-07-12 00:09:41
578,Knights of Columbus will cover up mosaics by ex-Jesuit artist accused of abusing women,The lawsuit accused Chili's parent company Brinker International of creating a social media ad in 2022 that used significant portions of “Sabotage” ...,www.thederrick.com,2024-07-11 23:25:51+00:00,2024-07-12 00:09:41
579,"Fast Company's View of the Internet in 1994, Expanded by “Internet Explorer's Kit for Macintosh”","Curious about what the Internet was like 30 years ago, in 1994? Fast Company ... Mosaic on the computers I was using, so I didn't use it much. (See also ...",tidbits.com,2024-07-11 22:46:11+00:00,2024-07-12 00:09:41
580,Knights of Columbus will cover up mosaics by ex-Jesuit artist accused of abusing women,AdvertisingOnline StorePhoto StoreCorporate SubscriptionsMobile AppArchives. Account. Subscribee-EditionNewsletters. About. Our Company- Careers ...,www.timesunion.com,2024-07-11 18:22:18+00:00,2024-07-12 00:09:41
581,Knights of Columbus will cover up mosaics by ex-Jesuit artist accused of abusing women,ArchivesAdvertisingCorporate Subscriptions. Account. Subscribee-EditionNewsletters. About. Our Company- Careers- Our Use of AI- Standards and ...,www.houstonchronicle.com,2024-07-11 17:52:14+00:00,2024-07-12 00:09:41
582,"Newmont, Eastman Chemical among top Quant picks in materials as earnings loom","Fertilizer maker The Mosaic Company (MOS) and lithium producer Albemarle (ALB) are the only two companies in the pack with a 'Sell' rating, with ...",seekingalpha.com,2024-07-12 02:38:06+00:00,2024-07-12 04:09:34
583,Knights of Columbus will cover up mosaics by ex-Jesuit artist accused of abusing women,"Sign up for Business Weekly. The Knights of Columbus, a U.S. insurance company and charitable organization, has been a major donor to the Vatican ...",www.winnipegfreepress.com,2024-07-11 23:31:13+00:00,2024-07-12 04:09:34
584,"Mosaic Co. stock rises Thursday, outperforms market - MarketWatch","Shares of Mosaic Co. advanced 4.70% to $28.09 Thursday, on what proved to be an all-around mixed trading session for the stock market, ...",www.marketwatch.com,2024-07-11 22:22:06+00:00,2024-07-12 04:09:34
585,"Mosaic Co. stock rises Thursday, outperforms market - MarketWatch","Mosaic Co. closed $14.72 below its 52-week high ($42.81), which the company reached on August 10th. Trading ...",www.marketwatch.com,2024-07-11 22:22:02+00:00,2024-07-12 04:09:34
586,Knights of Columbus will cover up mosaics by ex-Jesuit artist accused of abusing women,Our CompanyCareersOur Use of AIEthics Policy. Contact. Contact Us. Services. AdvertisingArchives. Account. SubscribeNewsletters. About. Our Company ...,www.michigansthumb.com,2024-07-11 17:16:23+00:00,2024-07-12 04:09:34
587,"83,241 Shares in The Mosaic Company (NYSE:MOS) Purchased by Mediolanum ...","Mediolanum International Funds Ltd bought a new position in shares of The Mosaic Company (NYSE:MOS - Free Report) during the first quarter, ...",www.marketbeat.com,2024-07-12 00:17:27+00:00,2024-07-12 09:09:31
588,Lockheed's Sikorsky Awarded $251M Army Contract Modification for UH-60M Aircraft Procurement,"Sikorsky, a Lockheed Martin company, has received a U.S. Army contract ... © Copyrights Executive Mosaic - All Rights Reserved. GovCon Wire.",www.govconwire.com,2024-07-12 09:32:49+00:00,2024-07-12 10:09:38
589,Knights of Columbus to cover Rupnik art - The Pillar,Mosaics by the disgraced religious artist ... The Vatican later ordered the closure of a religious community co-founded by the mosaic artist.,www.pillarcatholic.com,2024-07-12 08:52:45+00:00,2024-07-12 10:09:38
590,Matt Gratias Promoted to Relativity Space Federal Programs VP - GovCon Wire,"Rocket company Relativity Space has appointed Matt Gratias, a business ... © Copyrights Executive Mosaic - All Rights Reserved. GovCon Wire.",www.govconwire.com,2024-07-12 09:38:09+00:00,2024-07-12 11:09:31
591,Critical Analysis: Mosaic ImmunoEngineering (OTCMKTS:CPMV) versus Adverum ...,"Adverum Biotechnologies, Inc., a clinical-stage company, develops gene therapy product candidates to treat ocular diseases. Its lead product candidate ...",www.defenseworld.net,2024-07-12 09:58:20+00:00,2024-07-12 13:09:46
592,Reminder: Program for the publication of Yara International ASA second quarter results 2024,"Stock The Mosaic Company. -21.38%, 9.03B. ACRON- Stock Acron. -.--%, 7.66B ... YONFER AGRICULTURAL TECHNOLOGY CO., LTD. Stock YONFER Agricultural ...",www.marketscreener.com,2024-07-12 11:22:50+00:00,2024-07-12 15:09:30
593,"Sulfur Fertilizers Market Opportunities, Growth Analysis And Forecast 2024-2032","... business. All the key subtle elements relating to ... (Canada), ICL (Israel), The Mosaic Company (US), and K+S Aktiengesellschaft (Germany).",www.thenrinews.com,2024-07-12 09:51:15+00:00,2024-07-12 15:09:30
594,Nordea Investment Management AB Acquires 622 Shares of The Mosaic Company (NYSE:MOS),Get Mosaic alerts: A number of other hedge funds have also recently modified their holdings of the business. Dimensional Fund Advisors LP grew ...,www.defenseworld.net,2024-07-12 11:12:55+00:00,2024-07-12 16:09:45
595,Sentar Secures $173M DHA Cybersecurity Support Task Order - GovCon Wire,"The Huntsville, Alabama-based company said Thursday the Cybersecurity ... © Copyrights Executive Mosaic - All Rights Reserved. GovCon Wire.",www.govconwire.com,2024-07-12 15:32:56+00:00,2024-07-12 17:09:52
596,Caboose Brewery Brown Ale Wins Gold Medal At US Open Beer Championship - Patch,... Mosaic District shows where the beer is brewed. (Michael O'Connell ... Company in Norfolk. Find out what's happening in Fairfax Citywith free ...,patch.com,2024-07-12 18:53:35+00:00,2024-07-12 19:09:40
597,Mosaic bench an effort of community coming together in memory of Oregon District shooting victims,"... Company Logo. Privacy Preference Center. When you visit any website, it may store or retrieve information on your browser, mostly in the form of ...",www.daytondailynews.com,2024-07-12 18:30:08+00:00,2024-07-12 19:09:40
598,"[2024] Fertilizer Market Size, Exploring Applications - openPR.com",Nutrien Ltd. Yara International The Mosaic Company Eurochem Israel ... We are in professional corporate relations with various companies and ...,www.openpr.com,2024-07-12 17:13:06+00:00,2024-07-12 19:09:40
599,"Sulfuric Acid Market Opportunities, Growth Analysis And Forecast 2024-2032","(UK), BASF SE (Germany), The Mosaic Company (US), Yunnan Copper Co. Ltd. (China), Jiangxi Copper Group Co. Ltd. (China), Honeywell International ...",www.thenrinews.com,2024-07-12 15:56:12+00:00,2024-07-12 19:09:40
600,Knights of Columbus to cover mosaic shrines during sexual abuse case - WTNH.com,(WTNH) — Leaders with the Knights of Columbus Thursday announced they will be covering mosaic ... companies to allow residents of those states to submit ...,www.wtnh.com,2024-07-12 19:27:14+00:00,2024-07-12 20:09:44
601,Norma Jean Ferguson - Minden Press-Herald,"Greater Minden Chamber welcomes The Mosaic Co. to Minden. next post. Helen K. Jones. Related Posts. Helen K. Jones. Jul 11, 2024. Eva Deirdre Nettles ...",press-herald.com,2024-07-12 09:01:13+00:00,2024-07-12 20:09:44
602,ESPY host Serena Williams lands quick dig at Chiefs kicker Harrison Butker - Mosaic,"Earning her bachelor's degree in graphic design, Susannah said she will be working for a nationwide magazine company doing layout and photography.",mosaic.nj.com,2024-07-12 19:27:33+00:00,2024-07-12 21:09:36
603,"Mosaic Co. stock rises Friday, outperforms market - MarketWatch","Shares of Mosaic Co. advanced 1.07% to $28.39 Friday, on what proved to be an all-around great trading session for the stock market, ...",www.marketwatch.com,2024-07-12 21:36:41+00:00,2024-07-13 00:09:41
604,The Mosaic Company (NYSE:MOS) is Duality Advisers LP's Largest Position - MarketBeat,"Duality Advisers LP lifted its stake in The Mosaic Company (NYSE:MOS - Free Report) by 523.0% in the 1st quarter, according to its most recent ...",www.marketbeat.com,2024-07-12 20:53:13+00:00,2024-07-13 00:09:41
605,PageTiger wins International Business of the Year at Lincolnshire Business Excellence Awards,The company's cutting-edge software solutions have ... Hot Desking in Lincoln City Centre. Join the ever-growing digital community at Mosaic.,mylocal.co.uk,2024-07-13 03:02:29+00:00,2024-07-13 04:09:37
606,How Kajura mills money from cassava - Daily Monitor,"Business Podcasts- Lifestyle Podcasts- Puzzles. Editions. Africa- Kenya ... Mosaic and the CBSD diseases, the farmers had to take on varieties ...",www.monitor.co.ug,2024-07-13 09:48:03+00:00,2024-07-13 11:09:28
607,The Mosaic Company (NYSE:MOS) Shares Sold by Mirae Asset Global Investments Co. Ltd.,Read The Mosaic Company (NYSE:MOS) Shares Sold by Mirae Asset Global Investments Co. Ltd. at Defense World.,www.defenseworld.net,2024-07-13 09:27:49+00:00,2024-07-13 11:09:28
608,Mosaic Behavioral Health welcomes new telehealth therapist | News | Maryville Forum,Big Time Grain Co. Donaldson Westside Park. 7:00PM. More Events.,www.maryvilleforum.com,2024-07-13 06:54:10+00:00,2024-07-13 11:09:28
609,LJ Fairburn &amp; Son clinches Family Business of the Year at Lincolnshire Business Excellence Awards,The company operates a production system with facilities including ... Mosaic. Sponsored. Join the community. Are you looking ...,mylocal.co.uk,2024-07-13 03:06:30+00:00,2024-07-13 11:09:28
610,Luxury homebuilder buys 100 acres in Chatham County - The Business Journals,"The 501 corridor between Pittsboro and Chapel Hill is filling in fast with commercial and residential development, including the huge Mosaic project, ...",www.bizjournals.com,2024-07-12 12:18:59+00:00,2024-07-13 11:09:28
611,Laser Red crowned Business of the Year at Lincolnshire Business Excellence Awards,"A company dedicated to innovation, community engagement, and exceptional customer service. ... Mosaic. Sponsored. Join the community. Are you looking ...",mylocal.co.uk,2024-07-13 07:41:25+00:00,2024-07-13 14:09:31
612,Mosaic ImmunoEngineering (OTCMKTS:CPMV) Stock Price Down 49.8% - Defense World,"The company traded as low as $0.30 and last traded at $0.30. 197 shares changed hands during trading, a decline of 83% from the average session volume ...",www.defenseworld.net,2024-07-13 06:01:41+00:00,2024-07-13 14:09:31
613,White Phosphorus Market to Witness an Outstanding Growth by 2032,"Several companies dominate the white phosphorus market. Key players include, FMC Corporation, Mosaic Company, Samfer, OCP Group, Cristal Global ...",www.openpr.com,2024-07-13 13:01:52+00:00,2024-07-13 15:09:32
614,IRS Swati Chopra's book of poems 'The Mosaic' released in Delhi - MSN,"New Delhi [India], July 12 (ANI): A book titled 'The Mosaic', a ... Company Logo. About Your Privacy. We process your data to deliver content ...",www.msn.com,2024-07-13 04:25:27+00:00,2024-07-13 15:09:32
