,Heading,Subheading,Publisher,Published,Found
264,Mosaic Gains on Strong Demand Amid Soft Fertilizer Pricing - Investing.com UK,"Benzinga - by Zacks, Benzinga Contributor. The Mosaic Company (NYSE: MOS) is gaining from healthy demand for phosphate and potash and actions to ...",uk.investing.com,2024-06-26 17:04:46+00:00,2024-06-26 18:08:56
265,3 Reasons Underrepresented People Should Consider Entrepreneur-Through-Acquisition,"Mosaic ETA. Eduardo Zaldivar is a Managing Partner at Mosaic ETA. Prior to co-founding Mosaic, he was a private equity investor and startup operator.",www.forbes.com,2024-06-26 16:40:24+00:00,2024-06-26 18:08:56
266,'Black Barbie' doc celebrates the women behind iconic doll. Here's are fans reactions.,The company says they draw complaints from buyers of being too generic or too ethnic. ... Mosaic staff writer Vashti Harris can be reached at ...,mosaic.nj.com,2024-06-26 16:30:19+00:00,2024-06-26 18:08:56
267,Public invited to help complete Oregon District shooting memorial - Dayton Daily News,"From 4-7 p.m. July 11, people can help create the “bench mosaic,” a ... Company Logo. Privacy Preference Center. When you visit any website, it may ...",www.daytondailynews.com,2024-06-26 16:27:46+00:00,2024-06-26 19:09:06
268,Should You Hold Mosaic Co. (MOS)? - MSN,"Ariel Investments, an investment management company, released its “Ariel Focus Fund” first-quarter 2024 investor letter.",www.msn.com,2024-06-26 14:41:11+00:00,2024-06-26 19:09:06
269,Venezuelan comedian Angelo Colina is resonating with Latino audiences - Mosaic - NJ.com,"Julie Schwietert Collazo is a bilingual writer, editor, fact checker, and translator, as well as the co-founder and director of Immigrant Families ...",mosaic.nj.com,2024-06-26 19:20:48+00:00,2024-06-26 20:09:07
270,Oregon District Memorial Mosaic - WHIO-TV,Oregon District Memorial Mosaic. Volunteers are doing their part ... 1-year-old seriously injured after being hit by car in Clark Co. 1-year ...,www.whio.com,2024-06-26 21:57:49+00:00,2024-06-26 23:09:02
271,Tech Mahindra announces merger of Healthnxt with parent company - Techcircle,A step-down subsidiary is a company that is owned by another company ... Property of Mosaic Media Ventures Pvt. Ltd. Sign up for Newsletter.,www.techcircle.in,2024-06-26 08:45:58+00:00,2024-06-27 00:09:01
272,"Mosaic Co. stock rises Wednesday, outperforms market - MarketWatch","Shares of Mosaic Co. inched 0.82% higher to $29.60 Wednesday, on what proved to be an all-around favorable trading session for the stock market, ...",www.marketwatch.com,2024-06-26 22:20:02+00:00,2024-06-27 03:09:01
273,Wellington Management Group LLP Decreases Stake in Invesco Senior Loan ETF ...,"Decreases Holdings in The Mosaic Company (NYSE:MOS)- B. Riley Wealth Advisors Inc. Has $327,000 Stake in Dolby Laboratories, Inc. (NYSE:DLB) ...",www.defenseworld.net,2024-06-26 21:07:29+00:00,2024-06-27 05:09:02
274,Magna International (NYSE:MGA) Price Target Lowered to $46.00 at Wells Fargo &amp; Company,"Ballentine Partners LLC Acquires Shares of 12,706 Regions Financial Co. (NYSE:RF)- Ballentine Partners LLC Raises Stake in The Mosaic Company (NYSE: ...",www.defenseworld.net,2024-06-26 19:35:13+00:00,2024-06-27 08:09:04
275,"Weyerhaeuser Company filed SEC Form 8-K: Regulation FD Disclosure, Financial ...","... Mosaic Company, to the company's board of directors. His appointment is effective immediately. ""We are very pleased to welcome Joc to the ...",quantisnow.com,2024-06-27 08:47:18+00:00,2024-06-27 10:09:02
276,Vovo Telo's mosaic mural to celebrate Hartbeespoort Dam's 100th birthday - Kormorant,NEWS: news@kormorant.co.za. ADVERTISE: ads@kormorant.co.za. CLASSIFIEDS: classi@kormorant.co.za. The #1 Community Newspaper. Toggle Navigation.,kormorant.co.za,2024-06-27 08:46:17+00:00,2024-06-27 10:09:02
277,Amazon becomes the 5th U.S. company to reach $2 trillion in stock market value - WEMU,Lee Morgan - VARIOUS: the Mosaic Sampler. Whisper Not. Next Up: Lee Morgan - VARIOUS: the Mosaic Sampler Whisper Not. 0:00. 0:00. Whisper Not. Lee ...,www.wemu.org,2024-06-27 05:41:24+00:00,2024-06-27 10:09:02
278,B. Riley Wealth Advisors Inc. Decreases Holdings in The Mosaic Company (NYSE:MOS),Read B. Riley Wealth Advisors Inc. Decreases Holdings in The Mosaic Company (NYSE:MOS) at Defense World.,www.defenseworld.net,2024-06-26 21:07:21+00:00,2024-06-27 10:09:02
279,Julian Setian of SOSi Presented With 2024 Wash100 Award - GovCon Wire,See for your own eyes: Jim Garrettson of Executive Mosaic hand ... Executive Mosaic is excited to see what the future holds for the company.,www.govconwire.com,2024-06-27 09:40:06+00:00,2024-06-27 11:09:06
280,Alpha Omega CEO Gautam Ijoor Explores National Security Threats &amp; the ... - GovCon Wire,This interview with Ijoor tackles the foundational values of his company ... Share. Video of the Day. Executive Mosaic. 3.62K subscribers. Executive ...,www.govconwire.com,2024-06-27 09:40:06+00:00,2024-06-27 11:09:06
281,"Ballentine Partners LLC Sells 2,650 Shares of Equinor ASA (NYSE:EQNR) - Defense World","The fund owned 9,408 shares of the company's stock after selling 2,650 shares during the period. ... Ballentine Partners LLC Raises Stake in The Mosaic ...",www.defenseworld.net,2024-06-26 22:03:45+00:00,2024-06-27 11:09:06
282,Downtown Mosaic Art Project spawns school of funky fish | Monticello Times,"MONTICELLO — Some vibrant, funky fish are adding river-based personality to the downtown in the form of mosaic artwork ... Company- Help Wanted.",www.hometownsource.com,2024-06-27 11:04:49+00:00,2024-06-27 13:09:01
283,SEC Form 6-K filed by WNS (Holdings) Limited - Quantisnow,"... Mosaic; Mitch Blaser, Co-CEO, Mosaic; Keshav R. Murugesh, Group CEO, WNS; and Krishnan Ethirajan, COO, Mosaic (Photo: Business Wire) Under the ...",quantisnow.com,2024-06-27 11:03:38+00:00,2024-06-27 13:09:01
284,How A $10K Mosaic Investment In 2019 Worked Out - My Morning Joe Stock Watch,"Today, we examine what would have happened over a five year holding period, had you decided back in 2019 to buy shares of Mosaic Co (NYSE: MOS) and ...",mmjstockwatch.com,2024-06-27 10:50:16+00:00,2024-06-27 13:09:01
285,Artists and Students Create Mosaic Magic for Whale Bone Pier - Good Things Guy,"... mosaic makeover! Umhlanga, South Africa (27 June 2024) — Umhlanga's ... company that distills unique content across multiple media platforms ...",www.goodthingsguy.com,2024-06-27 08:54:42+00:00,2024-06-27 13:09:01
286,Mosaic (MOS) Dips More Than Broader Markets: What You Should Know - Yahoo News Singapore,"Wall Street will be looking for positivity from Mosaic as it approaches its next earnings report date. The company is expected to report EPS of $0.85, ...",sg.news.yahoo.com,2024-06-27 07:56:53+00:00,2024-06-27 13:09:01
287,Mosaic Brands Limited Announces CFO Changes - MarketScreener,"Incoming CFO David Clarke has held a range of senior executive roles in both listed and private companies in the retail, distribution, health and ...",www.marketscreener.com,2024-06-27 02:27:42+00:00,2024-06-27 13:09:01
288,Sulfur-Based Compound Fertilizer Market Analysis Business Growth - WICZ,Anhui Sierte Fertilizer industry LTD. Sinofert Holdings Limited; The Mosaic Company; Kugler Company; Hakaphos; ICL Fertilizers; Triferto Fertilizers ...,www.wicz.com,2024-06-27 12:23:23+00:00,2024-06-27 15:08:58
289,Ukrainian fans' tribute to their fallen friends: Supporters unfurl huge 'peace' mosaic of ... - Daily Mail,Ukrainian fans' tribute to their fallen friends: Supporters unfurl huge 'peace' mosaic ... Ellie Goulding wears ripped up leather co-ord to lead the ...,www.dailymail.co.uk,2024-06-27 14:57:55+00:00,2024-06-27 16:09:00
290,North 2 Shore: A blues and jazz jam that fuses mental health and music in Newark - Mosaic,"Toxic Positivity was dismissive to the co-worker struggling on the job, to an unhappy wife tired of marriage, and to a mother fed up with family life ...",mosaic.nj.com,2024-06-27 14:25:43+00:00,2024-06-27 16:09:00
291,VanEck Mortgage REIT Income ETF (NYSEARCA:MORT) Shares Sold by International ...,"... Mosaic Company (NYSE:MOS)- NEXT HEADLINE ». International Assets Investment Management LLC Has $203,000 Stock Holdings in Boyd Gaming Co. (NYSE:BYD) ...",www.defenseworld.net,2024-06-27 14:11:57+00:00,2024-06-27 16:09:00
292,North 2 Shore: Hey! I heard you're Black - Mosaic - NJ.com,Mosaic asked Whavers about her future goals. “I want to be a working artist with a theater company that I am able to run with my sister that has ...,mosaic.nj.com,2024-06-27 13:50:47+00:00,2024-06-27 16:09:00
293,Mosaic Brands Announces Management Changes - MarketScreener,"Mosaic Brands announced the resignation of Company Secretary, Luke Softa and the appointment of David Clarke as Company Secretary.",www.marketscreener.com,2024-06-27 02:10:38+00:00,2024-06-27 16:09:00
294,Mosaic Diagnostics Appoints Healthcare Industry Veteran Rob Rebak as CEO - Morningstar,"Rebak previously served as CEO of Forefront Telecare, a leading virtual behavioral healthcare provider in rural America, where he led the company ...",www.morningstar.com,2024-06-27 16:09:34+00:00,2024-06-27 17:08:50
295,"Queen Camilla reacts to new portrait of King Charles: 'My goodness me, that's my husband'","Camilla then posed for pictures with the children as they told her how they'd made the mosaic. Later during the visit, Camilla was asked by one of the ...",www.entertainmentdailyuk.com,2024-06-27 16:01:57+00:00,2024-06-27 17:08:50
296,"The Mosaic Company (NYSE:MOS) to Post FY2026 Earnings of $2.47 Per Share, Zacks ...",The Mosaic Company (NYSE:MOS - Free Report) - Analysts at Zacks Research lowered their FY2026 EPS estimates for shares of Mosaic in a report ...,www.marketbeat.com,2024-06-27 13:56:26+00:00,2024-06-27 17:08:50
297,Ukraine supporters unfurl huge mosaic of football-loving soldiers - MSN,Company Logo. About Your Privacy. We process your data to deliver content or advertisements and measure the delivery of such content or ...,www.msn.com,2024-06-27 15:15:12+00:00,2024-06-27 18:09:07
298,"Design, quality, research - IFDM","... company with a prominent surname (last time it was at Alessi itself ... Fractured Idols VI Mosaic by Bisazza Atelier, design Daniel Arsham – photo © ...",ifdm.design,2024-06-27 17:56:44+00:00,2024-06-27 19:08:51
299,TRADING UPDATES: Sovereign Metals signs deal with Palladium Group | Finance News,"Says digital terrain model topographic, ortho-mosaic photographic ... company says. These re-assay results are an important step in the ...",shareprices.com,2024-06-27 06:29:45+00:00,2024-06-27 19:08:51
300,Cultivating Success: A Detailed Exploration of Market Trends and Growth Opportunities ... - WhaTech,"Top Companies Covered In This Report: Yara International ASA, Potash Corporation of Saskatchewan Inc., CF Industries Holdings Inc., The Mosaic Company ...",www.whatech.com,2024-06-27 17:20:38+00:00,2024-06-27 20:09:02
301,International Assets Investment Management LLC Has $200000 Stock Holdings in ... - Defense World,Read International Assets Investment Management LLC Has $200000 Stock Holdings in The Mosaic Company (NYSE:MOS) at Defense World.,www.defenseworld.net,2024-06-27 14:21:27+00:00,2024-06-27 20:09:02
302,Top Ranked Value Stocks to Buy for August 9th - Yahoo Lifestyle,"The Mosaic Company Price and Consensus ... Mosaic Co. has a price-to-earnings ratio (P/E) of 7.23, compared with 15.80 for the industry. The company ...",au.lifestyle.yahoo.com,2024-06-27 12:12:09+00:00,2024-06-27 21:09:04
303,A Miami doughnut chain honored for its pastries to open first D.C.-area location,The Mosaic location is not yet listed on the company's website. Related Content. Congress Heights IHOP to reopen after pandemic-era closure. Related ...,www.bizjournals.com,2024-06-27 18:30:07+00:00,2024-06-27 22:08:59
304,PRIDE Festival adds to mosaic of Dubois County,"Seeing people connect over the things we have in common as human beings and enjoying each other's company is truly heartwarming,” said Andy. “It's ...",www.duboiscountyfreepress.com,2024-06-27 21:52:48+00:00,2024-06-27 23:09:01
305,Mosaic Brands switches up CFO leadership - Ragtrader,Australian apparel business Mosaic Brands has appointed a new chief financial officer and company secretary following the resignation of long ...,www.ragtrader.com.au,2024-06-27 23:39:56+00:00,2024-06-28 01:08:57
306,"High-quality renders of the Samsung Galaxy Watch Ultra, Galaxy Watch7, and Buds3 leak","The company is also expected to launch the Galaxy Watch7, the Galaxy ... mosaic pictures ahead of launch- Sagar Naresh · Jun 8, 2024 with 0 ...",www.neowin.net,2024-06-28 04:56:37+00:00,2024-06-28 06:08:59
307,MIL-OSI USA: Sols 4226-4228: A Powerful Balancing Act | ForeignAffairs.co.nz,The remote imaging capabilities of the ChemCam instrument will also be utilized to acquire a mosaic of a nearby area with interesting lighter- and ...,foreignaffairs.co.nz,2024-06-28 04:37:57+00:00,2024-06-28 06:08:59
308,"Sulphuric Acid Market Outlook, Global Size, Price Trends, Share Analysis &amp; Forecast 2024-2032",Solvay S.A. • The Mosaic Company • Valero Energy Corporation. Key Market Segmentation: Breakup by Raw Material Type: • Elemental Sulfur • Pyrite ...,www.einnews.com,2024-06-27 22:46:08+00:00,2024-06-28 06:08:59
309,"MANN, second phase of the restoration of the Alexander the Great Mosaic begins - Finestre sull'Arte","At the MANN in Naples, the second phase of the restoration of the Alexander the Great mosaic begins July 3 ... Publishing company Danae Project S.R.L..",www.finestresullarte.info,2024-06-27 12:33:13+00:00,2024-06-28 07:09:13
310,Fertilizer producer Mosaic says stockpiles too high to restart Canadian mine,"WINNIPEG, Manitoba (Reuters) -Fertilizer producer Mosaic Co does not currently see the right market conditions to restart its idled Canadian ...",ca.movies.yahoo.com,2024-06-28 02:56:01+00:00,2024-06-28 08:09:07
311,EPC hired for Paraguay green fertilizer project - BNamericas,... company ICE. The next steps for the Central America project entail the ... Mosaic announces LatAm expansion.,www.bnamericas.com,2024-06-27 23:49:52+00:00,2024-06-28 08:09:07
312,SEC Form 11-K filed by Mosaic Company - Quantisnow,11-K - MOSAIC CO (0001285785) (Filer),quantisnow.com,2024-06-28 10:10:21+00:00,2024-06-28 11:08:58
313,DZYNE Buys High Point Aerotechnologies to Broaden Autonomous Tech Offerings - GovCon Wire,... company of Dallas-based private investment firm Highlander Partners ... Video of the Day. Executive Mosaic. 3.62K subscribers. Executive Mosaic ...,www.govconwire.com,2024-06-28 10:08:03+00:00,2024-06-28 11:08:58
314,Wellington Management Group LLP Buys 219463 Shares of The Mosaic Company (NYSE:MOS),Read Wellington Management Group LLP Buys 219463 Shares of The Mosaic Company (NYSE:MOS) at Defense World.,www.defenseworld.net,2024-06-28 08:47:35+00:00,2024-06-28 11:08:58
315,"The Mosaic Company (NYSE:MOS) to Post FY2026 Earnings of $2.47 Per Share, Zacks ...","Read The Mosaic Company (NYSE:MOS) to Post FY2026 Earnings of $2.47 Per Share, Zacks Research Forecasts at Defense World.",www.defenseworld.net,2024-06-28 06:54:24+00:00,2024-06-28 11:08:58
316,"Mosaic Co. stock falls Thursday, underperforms market - MarketWatch","Shares of Mosaic Co. slipped 0.27% to $29.52 Thursday, on what proved to be an all-around favorable trading session for the stock market, ...",www.marketwatch.com,2024-06-28 06:15:43+00:00,2024-06-28 11:08:58
317,"World's Largest Gummy Candy Mosaic, world record in Kenosha, Wisconsin","Kenosha, Wisconsin, United States--The German candy company HARIBO and partners built a giant candy mosaic at University of Wisconsin-Parkside, ...",www.worldrecordacademy.org,2024-06-28 10:42:18+00:00,2024-06-28 12:08:50
318,Paradyme Promotes Roger Miller to DOJ Practice VP - GovCon Wire,... company. Paradyme announced Miller's promotion to lead its DOJ portfolio ... Video of the Day. Executive Mosaic. 3.62K subscribers. Executive Mosaic ...,www.govconwire.com,2024-06-28 10:08:03+00:00,2024-06-28 12:08:50
319,Core4ce Makes New Leadership Appointments to Boost Data Innovation Incubator,Sass will oversee the company's data engineering and analytics efforts ... Video of the Day. Executive Mosaic. 3.62K subscribers. Executive Mosaic ...,www.govconwire.com,2024-06-28 09:33:51+00:00,2024-06-28 13:09:07
320,Mosaic gets new lease of life – and a special day to mark its restoration - South London Press,"Those were the days when the United Transport Company offered Londoners affordable excursions to the countryside, coastal resorts and horse racing ...",londonnewsonline.co.uk,2024-06-28 12:43:18+00:00,2024-06-28 14:09:01
321,Agile Underwriting acquires specialist MGA First Dive - Life Insurance International,Canadian insurance company Agile Underwriting Solutions has announced ... Mosaic Insurance partners WNS on digital-first operations model.,www.lifeinsuranceinternational.com,2024-06-28 10:09:51+00:00,2024-06-28 14:09:01
322,When (MOS) Moves Investors should Listen - Stock traders daily,"Updated AI-Generated Signals for Mosaic Company (the) (MOS) available here: MOS. MOS Ratings for June 28: Term →, Near, Mid, Long. Rating, Strong ...",news.stocktradersdaily.com,2024-06-28 14:54:26+00:00,2024-06-28 16:08:56
323,STL Partnership BRE Team Hosts Tour of Kindeva Drug Delivery,... company in St. Louis. Partners of the Business Retention and ... Mosaic Project and World Trade Center St. Louis. The BRE program links ...,stlpartnership.com,2024-06-28 14:22:37+00:00,2024-06-28 16:08:56
324,"Mosaics by priest accused of abuse must go, women say | National News - Citizen Tribune",... company had something to do with it. Read All Headlines. More Headlines ... Slovenian mosaic artist Marko Rupnik is accused of having carried ...,www.citizentribune.com,2024-06-28 15:28:21+00:00,2024-06-28 17:08:58
325,Rupniks remain on Vatican site despite O'Malley appeal - The Pillar,Marko Rupnik case and lack of outreach to victims.” The Vatican later ordered the closure of a religious community co-founded by the mosaic artist.,www.pillarcatholic.com,2024-06-28 17:37:49+00:00,2024-06-28 18:09:00
326,Mosaic and Yara yet to agree on July Tampa ammonia price,Company- Price Assessments- Ammonia- Freight- Cost of Production- Carbon-adjusted Ammonia- Natural Gas- API Feed- Publishing Schedule. © 2024 ...,www.qcintel.com,2024-06-28 17:14:03+00:00,2024-06-28 18:09:00
327,"Mosaics by priest accused of abuse must go, women say | National | benningtonbanner.com","Slovenian mosaic artist Marko Rupnik is accused of having carried out ... But no company makes it to 100 years without hard work, t…",www.benningtonbanner.com,2024-06-28 15:25:32+00:00,2024-06-28 18:09:00
328,"Mosaics by priest accused of abuse must go, women say | National | brenhambanner.com",FedEx Shares Soar as Company Beats Earnings Estimates ...,www.brenhambanner.com,2024-06-28 15:24:42+00:00,2024-06-28 20:09:14
329,Museum mosaic: Building community brick by brick - Halifax Examiner,"Here's what Tim Bousquet wrote when the company's drawn-out death throes finally ended, in 2016: Unique Solutions was started by Tanya Shaw, a ...",www.halifaxexaminer.ca,2024-06-28 20:40:20+00:00,2024-06-28 21:09:08
330,Yara agrees a $15/mt increase with Mosaic for July Tampa ammonia,"At 1730 London time, Yara and Mosaic had yet to agree on a Tampa price for July deliveries... ... Company- Price Assessments- Ammonia- Freight- Cost ...",www.qcintel.com,2024-06-28 20:43:07+00:00,2024-06-28 22:09:09
331,Consulting Co. Says Rivals Merged Despite Promising Not To - Law360,"In a lawsuit filed in Boulder County District Court on Wednesday, Tennessee-based Mosaic Consulting Group LLC, which works with companies implementing ...",www.law360.com,2024-06-28 21:52:24+00:00,2024-06-28 23:09:04
332,"Mosaics by priest accused of abuse must go, women say | News | sanfordherald.com",Airbus Shares Plummet Nearly 12% as Company Slashes Financial ...,www.sanfordherald.com,2024-06-28 21:29:13+00:00,2024-06-28 23:09:04
333,North 2 Shore: Prudential Rock Lounge fosters a sense of community - Mosaic,... company based in Newark for the last 150 years and the title sponsor of North to Shore. “That's just another example of how we truly mean it when ...,mosaic.nj.com,2024-06-29 02:01:23+00:00,2024-06-29 05:09:09
334,Fresh pool mosaic tiles by Klay Tiles and Facades - ArchitectureAU,"... companies- Back to All Products &gt; Flooring &gt; Tiles, stone and concrete flooring. Fresh pool mosaic tiles by Klay Tiles and Facades. words ...",architectureau.com,2024-06-29 01:07:57+00:00,2024-06-29 05:09:09
335,"Water-Soluble Fertilizers Market Size, Share, Trends, Growth Drivers, Key Opportunities ...","... Mosaic Company (US), Hebei Monband ... The company offers its fertilizers business under the specialty plant nutrients and potassium business ...",www.barchart.com,2024-06-29 00:59:01+00:00,2024-06-29 05:09:09
336,Transcriptomic Insights into the Epigenetic Modulation of Turnip Mosaic Virus Evolution in ...,... Mosaic Virus Evolution in Arabidopsis 2. thaliana 3. 4. María J. Olmo ... Company. About us- News- Careers. Support. Help Center. Business solutions.,www.researchgate.net,2024-06-28 13:34:58+00:00,2024-06-29 05:09:09
337,Carlisle Creative welcomes summer with new pop-up shop | News and Star,"... Company, and mosaic artist Helen Clues, with crafts ranging from pottery and mosaics, to felt art, textiles, and resin. ""We want everyone to feel ...",www.newsandstar.co.uk,2024-06-29 04:07:42+00:00,2024-06-29 07:09:16
338,Business Retention &amp; Expansion | St. Louis Economic Development Partnership,"Become an active partner with company leaders and management to ... Mosaic logo. World Trade Center St, Louis logo. BRE International. For ...",.google.com,2024-06-29 02:11:47+00:00,2024-06-29 07:09:16
339,The Mosaic Company (NYSE:MOS) Stock Holdings Boosted by Wellington Management Group LLP,"Wellington Management Group LLP lifted its position in The Mosaic Company (NYSE:MOS - Free Report) by 1007.5% during the 4th quarter, according to ...",www.marketbeat.com,2024-06-29 02:02:58+00:00,2024-06-29 07:09:16
340,The past one-year earnings decline for Mosaic (NYSE:MOS) likely explains shareholders ...,One way to examine how market sentiment has changed over time is to look at the interaction between a company's share price and its earnings per share ...,simplywall.st,2024-06-29 14:48:07+00:00,2024-06-29 16:09:07
341,Mosaic Capital (CVE:M) Share Price Passes Below 200-Day Moving Average of $5.50,Mosaic Capital Stock Up 0.5 %. The firm has a market cap of C$58.88 million and a price-to-earnings ratio of -3.89. The business's 50 day moving ...,www.defenseworld.net,2024-06-29 13:59:07+00:00,2024-06-29 16:09:07
342,S&amp;P 500 climbs as rally broadens to close gap on record high - MSN,"Materials including The Mosaic Company (NYSE:MOS), FMC Corporation (NYSE:FMC), and Freeport-McMoran Copper&Gold Inc (NYSE:FCX) were led higher ...",.google.com,2024-06-29 12:44:49+00:00,2024-06-29 16:09:07
343,Women abused by ex-Jesuit artist ask for mosaic's removal | Newsline | avpress.com,A mosaic by ex-Jesuit artist Marko Rupnik adorns the main facade of ... Whitney Rose Launches Sōl People -- a New Kind of Social Selling Company ...,www.avpress.com,2024-06-29 11:46:13+00:00,2024-06-29 16:09:07
344,Theatre academy to expand in listed Boston building - MyLocal Lincolnshire,... Company will take place Credit: Boston Borough Council ... Hot Desking in Lincoln City Centre. Join the ever-growing digital community at Mosaic.,mylocal.co.uk,2024-06-29 05:33:45+00:00,2024-06-29 16:09:07
345,Advantage Solutions (NASDAQ:ADV) Trading 3.9% Higher - Defense World,"Mosaic Family Wealth Partners LLC now owns 270,000 shares of the company's stock valued at $1,169,000 after buying an additional 15,000 shares during ...",www.defenseworld.net,2024-06-28 15:32:09+00:00,2024-06-29 16:09:07
346,"Alleged victims, cardinal call on Church to remove Rupnik mosaics - STA","... mosaic by the Vatican News website. The letter ... Dec 16, 2023, 12:01 // Politics. Vatican orders dissolution of nun order co-founded by Rupnik.",english.sta.si,2024-06-29 10:28:50+00:00,2024-06-29 18:08:56
347,Centene (NYSE:CNC) Downgraded by StockNews.com to Buy - MarketBeat,"Mosaic Family Wealth Partners LLC now owns 9,043 shares of the company's stock worth $710,000 after purchasing an additional 1,700 shares during the ...",www.marketbeat.com,2024-06-29 13:34:12+00:00,2024-06-29 22:09:05
348,Mosaic (MOS) Dips More Than Broader Market: What You Should Know - MSN,"The upcoming earnings release of Mosaic will be of great interest to investors. The company's earnings per share (EPS) are projected to be $0.83, ...",www.msn.com,2024-06-29 18:39:57+00:00,2024-06-29 23:08:50
349,Neighbours near Qualicum Beach call on Mosaic to not log parcel of land - CHEK News,"A community petition at the forest is being signed by many, and locals are calling for the company to hold off. Watch the full story below: ...",www.cheknews.ca,2024-06-30 00:31:24+00:00,2024-06-30 02:09:01
350,10 Best Potash Stocks to Buy - Insider Monkey,"Major players in the potash market include JSC Belaruskali, Compass Minerals, Mosaic Company, Uralkali, and Rio Tinto. ... Mosaic Company (NYSE:MOS)The ...",www.insidermonkey.com,2024-06-30 03:18:19+00:00,2024-06-30 04:08:57
351,Why Is Archer-Daniels-Midland Company (ADM) the Best Potash Stock to Buy Now?,"Major players in the potash market include JSC Belaruskali, Compass Minerals, Mosaic Company, Uralkali, and Rio Tinto. Our Methodology. To rank the ...",finance.yahoo.com,2024-06-30 04:58:20+00:00,2024-06-30 06:08:54
352,Is The Mosaic Company (MOS) the Best Potash Stock to Buy According to Hedge Funds?,"In this article, we are going to take a look at where The Mosaic Company (NYSE:MOS) stands against the other potash stocks. Global Potash Market ...",finance.yahoo.com,2024-06-30 04:56:34+00:00,2024-06-30 06:08:54
