,Heading,Subheading,Publisher,Published,Found
0,CuspAI uses GenAI to store CO2 in new materials - Techzine Europe,"Company of Professor Max Welling, affiliated with the University of ... Databricks solidifies Mosaic AI as a foundation for building AI apps.",www.techzine.eu,2024-06-18 14:02:55,2024-06-18 15:18:26
1,Mosaic Restoration | The Daily Standard Stories,"Mosaic Restoration. Marble statue to reside in cabinet in Zuma church. By ... Hone said it's believed the Orsoni Company of Venice, Italy, made the ...",.google.com,2024-06-18 13:05:18,2024-06-18 15:18:26
2,What you can learn with Topeka United's Mosaic Partner Pairs | KSNT 27 News,"... Business Spotlight- Our News Team. Top Stories. $390,000 in grant money to fix Kansas downtown buildings. Top Stories. Kansas Senate approves tax ...",www.ksnt.com,2024-06-18 12:46:32,2024-06-18 15:18:26
3,"A gate is installed on a Mount Fuji trail to control crowds, but governor says more measures needed",The mosaic was the focal point of Westerville's famous Kyoto Tea House built by George Henderson.,www.wcnc.com,2024-06-18 12:15:11,2024-06-18 15:18:26
4,Draper Unveils Partnership Platform to Accelerate Defense Technology Development,... company said Monday. The platform will also provide tech companies with ... Staying in line with Executive Mosaic's dedication to covering all ...,executivebiz.com,2024-06-18 11:16:58,2024-06-18 15:18:26
5,How the (MOS) price action is used to our Advantage,"Updated AI-Generated Signals for Mosaic Company (the) (MOS) available here: MOS. MOS Ratings for June 18: Term →, Near, Mid, Long. Rating, Weak, Weak ...",news.stocktradersdaily.com,2024-06-18 11:09:54,2024-06-18 15:18:26
6,Seattle company acquires OSG in $480M deal - Tampa Bay Business Journal,The Mosaic Co. 3. 3. Crown Holdings Inc. View this list. Related Articles. Tampa cargo shipper receives take-private offer from Seattle company. Tampa ...,www.bizjournals.com,2024-06-18 11:07:19,2024-06-18 15:18:26
7,"Free drink on board, priority boarding: JetBlue overhauls loyalty program adding new benefits","""We are listening constantly,"" and one of the biggest comments was that the existing points system for earning Mosaic status with the airline was ...",ca.style.yahoo.com,2024-06-18 07:42:45,2024-06-18 15:18:26
8,Mosaic (MOS) Dips More Than Broader Markets: What You Should Know - MSN,Wall Street will be looking for positivity from Mosaic as it approaches its next earnings report date. The company is expected to report EPS of ...,.google.com,2024-06-18 06:23:09,2024-06-18 15:18:26
9,Mosaic Moment | Opinion | duboiscountyherald.com,"As a leader, what actions are you being intentional about that will bring kind of influence and change in the lives of those around you? Business.",www.duboiscountyherald.com,2024-06-18 06:16:33,2024-06-18 15:18:26
10,SAIC Chief Toni Townes-Whitley Receives 2024 Wash100 Award From Executive Mosaic,One of the aforementioned business groups is dedicated to SAIC's Air Force business. The company is sponsoring the Potomac Officers Club's 2024 ...,www.govconwire.com,2024-06-18 04:58:02,2024-06-18 15:18:26
11,Luke Buys CCMS to Expand Government Health Care Staffing Services; John Sanders Quoted,“This acquisition aligns seamlessly with LUKE's overarching vision of becoming a premier staffing company. ... Video of the Day. Executive Mosaic. 3.62K ...,www.govconwire.com,2024-06-18 04:39:26,2024-06-18 15:18:26
12,Databricks Unveils New Mosaic AI Capabilities to Help Customers Build Production-Quality ...,"Databricks, the Data and AI company, today announced several innovations to Mosaic AI to help customers build production-quality Generative AI ...",cxotoday.com,2024-06-18 01:09:01,2024-06-18 15:18:26
13,"Crop Micronutrients Global Market Size, Growth, Share, - openPR.com","Major companies operating in the crop micronutrients market report are BASF SE, Nutrien Ltd, Yara International ASA, The Mosaic Company, DowDuPont Inc ...",www.openpr.com,2024-06-18 00:58:04,2024-06-18 15:18:26
14,MosaicMusicUK: Mosaic at Tewkesbury Festival 2024 - Cotswold Journal Events,Business- E-editions- What's On- Announcements- Puzzles- Reader Rewards. LOCAL EVENTS CALENDAR. Find events in Cotswold and the surrounding areas ...,www.cotswoldjournal.co.uk,2024-06-17 22:21:20,2024-06-18 15:18:26
15,Virtu Financial LLC Cuts Stock Holdings in The Mosaic Company (NYSE:MOS) - MarketBeat,"Virtu Financial LLC cut its stake in shares of The Mosaic Company (NYSE:MOS - Free Report) by 69.4% during the fourth quarter, according to its ...",www.marketbeat.com,2024-06-17 19:31:43,2024-06-18 15:18:26
16,The Pixelbot 3000 turns simple AI prompts into Lego mosaic masterpieces - The Verge,"Built from scratch, this Lego printer uses AI and custom code to generate and pixelate images before turning them into Lego masterpieces.",www.theverge.com,2024-06-17 18:25:49,2024-06-18 15:18:26
17,WIN TICKETS TO SEE AMERICAN MOSAIC - FM100.3 - Better Music Better Work Day,WIN TICKETS TO SEE AMERICAN MOSAIC. American Mosaic. Caller wins a family 5 ... Your use of our site is deemed your consent. Continue. Company Logo. Do ...,fm100.com,2024-06-17 16:14:50,2024-06-18 15:18:26
18,Mosaics reflecting intimacy of NYC public life installed at Williamsburg subway station - 6sqft,Upper East Side pre-war elegance in a compact co-op package asks $1.75M ...,www.6sqft.com,2024-06-17 11:09:23,2024-06-18 15:18:26
19,ABPCO sees surge in membership as new co-chairs take seats - Conference News,"The appointments follow the tenure of outgoing chairs Emma Duffy from the Royal College of Paediatrics and Child Health, and Sarah Byrne from Mosaic ...",www.conference-news.co.uk,2024-06-17 10:20:17,2024-06-18 15:18:26
20,"3D pixel/mosaic art nina BINI Mikha at Maloi, hinangaan sa social media - ABS-CBN News","The identity of the buyer was not clear, the outlet said, with paperwork showing it had been purchased by a Delaware-based limited liability company.",news.abs-cbn.com,2024-06-19 02:56:09,2024-06-19 13:25:22
21,"Data + AI Summit focuses on Databricks' open sourcing of Unity Catalog, AI development",... company's recent announcements at Data. Databricks' Joel Minnick discusses the company's acquisition of Mosaic AI. “We are finding for the ...,siliconangle.com,2024-06-19 02:06:39,2024-06-19 13:25:22
22,Mission Porto &amp; Mar visits technology giants in Korea - A Tribuna,"The company has two programs that encourage innovation. Mosaic was launched exactly 10 years ago, on June 11st, 2014. It was inspired by a ...",www.atribuna.com.br,2024-06-18 18:28:11,2024-06-19 13:25:22
23,"Mosaic Co. stock rises Tuesday, outperforms market - MarketWatch","Shares of Mosaic Co. inched 0.97% higher to $27.16 Tuesday, on what proved to be an all-around positive trading session for the stock market, ...",www.marketwatch.com,2024-06-18 17:39:29,2024-06-19 13:25:22
24,Spreyton School unveils mosaic created by students - Okehampton Times,sales@tavistock-today.co.uk. Contact Us. 42 Brook Street Tavistock Devon England PL19 0HE Tel: 01822 613666- editorial@tavistock-today.co.uk. Follow ...,www.okehampton-today.co.uk,2024-06-18 15:30:25,2024-06-19 13:25:22
25,Databricks unveils new Mosaic AI capabilities to help customers build production-quality AI ...,"“Corning is a materials science company — our glass and ceramics technologies are used in many industrial and scientific applications, so ...",www.crn.in,2024-06-18 13:56:48,2024-06-19 13:25:22
26,Baraka: Reparations are a reckoning whose time has come | Opinion - Mosaic,Two entrepreneurial Black women started the fund to encourage and help women of color program succeed in business. It has awarded about 350 grants of ...,mosaic.nj.com,2024-06-19 12:32:12+00:00,2024-06-19 17:09:04
27,£300mln invested in long duration energy storage facility - IOM3,"The company claim this would represent nearly 20% of the UK's long ... Rio Tinto, Goldman Sachs, KIRKBI and Mosaic Capital were also involved in the ...",www.iom3.org,2024-06-19 11:49:14+00:00,2024-06-19 17:09:04
28,Dutch AI recruiter Textkernel acquired by US-based Bullhorn for 300 million euros,"Textkernel, a Dutch company specialising in workforce recruitment using AI, has been sold to Bullhorn. ... Databricks' Mosaic AI will focus on stronger ...",www.techzine.eu,2024-06-19 10:49:33+00:00,2024-06-19 17:09:04
29,Kilburn station introduces colourful new art mosaics - Times Series,"A station has been revamped with colourful artwork celebrating the area's history. Mosaics were put together by Kilburn artist Debra Collis, after she ...",www.times-series.co.uk,2024-06-19 10:29:17+00:00,2024-06-19 17:09:04
30,Netscape at 30: What the defunct browser can tell us about the modern internet - Fast Company,"Installing Netscape Navigator 0.92. Netscape was the first commercial attempt at a web browser, and an immediate successor to Mosaic, which Marc ...",www.fastcompany.com,2024-06-19 10:20:39+00:00,2024-06-19 17:09:04
31,Kip Gering Named SpiderOak Chief Revenue Officer - GovCon Wire,The company said Tuesday Gering will directly report to SpiderOak CEO Dave ... Video of the Day. Executive Mosaic. 3.62K subscribers. Executive Mosaic ...,www.govconwire.com,2024-06-19 10:15:41+00:00,2024-06-19 17:09:04
32,"3D pixel/mosaic art nina BINI Mikha at Maloi, hinangaan sa social media - ABS-CBN News","The identity of the buyer was not clear, the outlet said, with paperwork showing it had been purchased by a Delaware-based limited liability company.",news.abs-cbn.com,2024-06-19 07:56:09+00:00,2024-06-19 17:09:04
33,"Data + AI Summit focuses on Databricks' open sourcing of Unity Catalog, AI development",... company's recent announcements at Data. Databricks' Joel Minnick discusses the company's acquisition of Mosaic AI. “We are finding for the ...,siliconangle.com,2024-06-19 07:06:39+00:00,2024-06-19 17:09:04
34,Mission Porto &amp; Mar visits technology giants in Korea - A Tribuna,"The company has two programs that encourage innovation. Mosaic was launched exactly 10 years ago, on June 11st, 2014. It was inspired by a ...",www.atribuna.com.br,2024-06-18 23:28:11+00:00,2024-06-19 17:09:04
35,"Mosaic Co. stock rises Tuesday, outperforms market - MarketWatch","Shares of Mosaic Co. inched 0.97% higher to $27.16 Tuesday, on what proved to be an all-around positive trading session for the stock market, ...",www.marketwatch.com,2024-06-18 22:39:29+00:00,2024-06-19 17:09:04
36,Spreyton School unveils mosaic created by students - Okehampton Times,sales@tavistock-today.co.uk. Contact Us. 42 Brook Street Tavistock Devon England PL19 0HE Tel: 01822 613666- editorial@tavistock-today.co.uk. Follow ...,www.okehampton-today.co.uk,2024-06-18 20:30:25+00:00,2024-06-19 17:09:04
37,CuspAI uses GenAI to store CO2 in new materials - Techzine Europe,"Company of Professor Max Welling, affiliated with the University of ... Databricks solidifies Mosaic AI as a foundation for building AI apps.",www.techzine.eu,2024-06-18 19:02:55+00:00,2024-06-19 17:09:04
38,Databricks unveils new Mosaic AI capabilities to help customers build production-quality AI ...,"“Corning is a materials science company — our glass and ceramics technologies are used in many industrial and scientific applications, so ...",www.crn.in,2024-06-18 18:56:48+00:00,2024-06-19 17:09:04
39,Mosaic Restoration | The Daily Standard Stories,"Mosaic Restoration. Marble statue to reside in cabinet in Zuma church. By ... Hone said it's believed the Orsoni Company of Venice, Italy, made the ...",.google.com,2024-06-18 18:05:18+00:00,2024-06-19 17:09:04
40,What you can learn with Topeka United's Mosaic Partner Pairs | KSNT 27 News,"... Business Spotlight- Our News Team. Top Stories. $390,000 in grant money to fix Kansas downtown buildings. Top Stories. Kansas Senate approves tax ...",www.ksnt.com,2024-06-18 17:46:32+00:00,2024-06-19 17:09:04
41,"A gate is installed on a Mount Fuji trail to control crowds, but governor says more measures needed",The mosaic was the focal point of Westerville's famous Kyoto Tea House built by George Henderson.,www.wcnc.com,2024-06-18 17:15:11+00:00,2024-06-19 17:09:04
42,Draper Unveils Partnership Platform to Accelerate Defense Technology Development,... company said Monday. The platform will also provide tech companies with ... Staying in line with Executive Mosaic's dedication to covering all ...,executivebiz.com,2024-06-18 16:16:58+00:00,2024-06-19 17:09:04
43,How the (MOS) price action is used to our Advantage,"Updated AI-Generated Signals for Mosaic Company (the) (MOS) available here: MOS. MOS Ratings for June 18: Term →, Near, Mid, Long. Rating, Weak, Weak ...",news.stocktradersdaily.com,2024-06-18 16:09:54+00:00,2024-06-19 17:09:04
44,Seattle company acquires OSG in $480M deal - Tampa Bay Business Journal,The Mosaic Co. 3. 3. Crown Holdings Inc. View this list. Related Articles. Tampa cargo shipper receives take-private offer from Seattle company. Tampa ...,www.bizjournals.com,2024-06-18 16:07:19+00:00,2024-06-19 17:09:04
45,Israel grows more polarized as Gaza wartime Cabinet dissolves - The Hill,"Tony Schiena, the CEO of global defense intelligence company MOSAIC, said a cease-fire and hostage release deal is less likely without the ...",thehill.com,2024-06-19 17:16:08+00:00,2024-06-19 19:19:16
46,Tod Brindlinger Joins Mercury as Operations SVP - ExecutiveBiz,"Brindlinger's career also includes time with Paradigm Precision, Ducommun and the former UTC company. ... Mosaic's media group covering government ...",executivebiz.com,2024-06-19 15:53:24+00:00,2024-06-19 19:19:16
47,Damian DiPippa Joins Enlightenment Capital-Backed Auria as CEO - GovCon Wire,“Damian is uniquely qualified to lead Auria through its continued rapid growth as we expand the Company's ... Video of the Day. Executive Mosaic. 3.62K ...,www.govconwire.com,2024-06-19 15:32:33+00:00,2024-06-19 19:19:16
48,BUZZ-Intrepid Potash Inc: Stock hits record low | Reuters,"** Company reports bigger Q3 loss, hurt by weakening demand and lower fertilizer prices. ** ... ** Shares of Mosaic Co down 3.9 pct, Potash Corp of ...",www.reuters.com,2024-06-19 14:49:55+00:00,2024-06-19 19:19:16
49,"BUZZ-U.S. STOCKS ON THE MOVE-Expedia, TripAdvisor, Incyte, Avon, Tesla | Reuters","** MOSAIC CO, Wednesday close $23.42, -0.60 pct premarket. The U.S. fertilizer company, the world's largest producer of finished phosphate products ...",www.reuters.com,2024-06-19 14:00:09+00:00,2024-06-19 19:19:16
50,Argentine dock workers threaten strike in Rosario | Reuters,"... company Mosaic , a union leader said ... company Mosaic , a union leader said. Stevedores and members of the San Lorenzo branch of ...",www.reuters.com,2024-06-19 12:10:01+00:00,2024-06-19 19:19:16
51,The Untapped Opportunity: Igniting Growth in Cannabis Retail,"Jack Blaser is the founder and CEO of Mosaic, a company that helps dispensaries with digital solutions. He also serves as a board director for ...",cannatechtoday.com,2024-06-19 20:14:10+00:00,2024-06-19 21:08:50
52,Kapitalo Investimentos Ltda Acquires Shares of 4853 The Mosaic Company (NYSE:MOS),"The firm acquired 4,853 shares of the basic materials company's stock, valued at approximately $173,000. Get Mosaic alerts: Several other large ...",www.defenseworld.net,2024-06-19 16:28:59+00:00,2024-06-19 21:08:50
53,"STOCKS NEWS US-Standard Motor suspends dividend, shares drop | Reuters","Shares of International Business Machine fell on Tuesday, ahead of the company's ... The firm rated both Potash and Mosaic Co hold and gave a sell ...",www.reuters.com,2024-06-19 14:46:43+00:00,2024-06-19 21:08:50
54,Meet the local visionary behind 'Mainly Mosaics Maraetai' - Times,"... mosaic pots. Times photos ... The Times is published by Times Media, an independently-owned publishing company based in East Auckland, founded in 1972.",www.times.co.nz,2024-06-19 21:59:20+00:00,2024-06-19 23:08:53
55,LinQuest Company Recognized With 2024 DCSA James S. Cogswell Award - ExecutiveGov,"ExecutiveGov, published by Executive Mosaic, is a site dedicated to the news and headlines in the federal government. ExecutiveGov serves as a news ...",executivegov.com,2024-06-19 21:21:05+00:00,2024-06-19 23:08:53
56,[INTERVIEW] Cheyul puts 21st-century luxury spin on Korean craftsmanship,... mosaic — whether in the world-class museums' East Asian galleries or ... The company's in-house team first designs their original line of furniture ...,www.koreatimes.co.kr,2024-06-20 02:45:07+00:00,2024-06-20 04:08:51
57,Derrick Reig Named Chief Revenue Officer of Exostar - ExecutiveBiz,... company to even greater heights. I'm ready to go capture that ... Staying in line with Executive Mosaic's dedication to covering all angles of ...,executivebiz.com,2024-06-20 03:49:19+00:00,2024-06-20 05:08:46
58,'Cool to be a part of it': Regina company assisting NHL team through Stanley Cup run,"The Saskatchewan Roughriders built permanent cold tubs into their locker room at Mosaic Stadium. Although it's a stationary program for now, they ...",regina.ctvnews.ca,2024-06-20 00:25:56+00:00,2024-06-20 07:09:18
59,I'm blown away by this ingenious AI-powered Lego mosaic printer | Creative Bloq,"The Pixelbot 3000 made by YouTuber Creative Mindstorms (a.k.a Sten), is a custom-built Lego mosaic ... England and Wales company registration number ...",www.creativebloq.com,2024-06-20 11:00:19+00:00,2024-06-20 12:08:59
60,"Goldman Sachs Group Inc. Sells 752,653 Shares of Vanguard Intermediate-Term Treasury ...","The fund owned 827,330 shares of the company's stock after selling 752,653 shares during the period. ... Decreases Stock Holdings in The Mosaic Company ...",www.defenseworld.net,2024-06-20 09:28:32+00:00,2024-06-20 12:08:59
61,Israel peace activist calls for co-existence at Mosaic event - The Movement for Reform Judaism,"Magen Inon, a peace activist whose parents were murdered on 7 October, spoke to an appreciative audience of 75 people at Mosaic Jewish Community.",www.reformjudaism.org.uk,2024-06-20 09:21:26+00:00,2024-06-20 12:08:59
62,New mosaic unveiled at local primary school | creditoncourier.co.uk,A NEW mosaic has been unveiled at Spreyton Primary School. A collaborative project with Chloe Farrant and Steve McCracken of Meraki Art School in ...,www.creditoncourier.co.uk,2024-06-20 08:00:21+00:00,2024-06-20 12:08:59
63,Education consultant Career Mosaic eyes maiden funding to take brand global - VCCircle,"The company, which was set up in 2002 by Abhijit Zaveri, has been bootstrapped ...... This is a Premium article. Please subscribe or log in to ...",www.vccircle.com,2024-06-20 07:01:57+00:00,2024-06-20 12:08:59
64,Thousands upon thousands of rays gather in Tampa Bay - MSN,Massive brush fire contained after breaking out at Mosaic Company plant in Riverview. Cownose rays have a wingspan of up to 3 feet. The rays are ...,.google.com,2024-06-20 04:06:45+00:00,2024-06-20 12:08:59
65,Embracing the Cultural Mosaic: Cape Town's Upcoming Events,"Our daily email brings you up-to-date summaries of all important Cape Town news, including business, sports, lifestyle, and crime.",capetown.today,2024-06-20 02:49:08+00:00,2024-06-20 12:08:59
66,Vanguard Group Inc. Decreases Stock Holdings in The Mosaic Company (NYSE:MOS),Get Mosaic alerts: Other institutional investors and hedge funds have also bought and sold shares of the company. Denali Advisors LLC grew its ...,www.defenseworld.net,2024-06-20 15:13:50+00:00,2024-06-20 16:09:00
67,Why You Should Retain Mosaic (MOS) Stock in Your Portfolio - Yahoo Finance,"However, softer fertilizer prices may weigh on its top line and margins. The company's shares are down 23.5% in a year compared with a 20.7% decline ...",finance.yahoo.com,2024-06-20 14:08:39+00:00,2024-06-20 16:09:00
68,Rise of Nvidia: From humble beginnings to most valuable company in the world - Techcircle,Mosaic Digital. Loading... Analysis. Rise of Nvidia: From humble beginnings to most valuable company in the world. Rise of Nvidia: From humble ...,www.techcircle.in,2024-06-20 13:45:47+00:00,2024-06-20 16:09:00
69,Marionettes to end jubilee season with Mosaic 6 - Trinidad and Tobago Newsday,"The Marionettes Chorale will be celebrating the end of it 60th anniversary, diamond jubilee season by presenting Mosaic ... Business- Features ...",newsday.co.tt,2024-06-20 13:02:41+00:00,2024-06-20 16:09:00
70,Mosaic Insurance Partners with WNS on Future-ready Operations Model | National - WDRB,"L to R : Reeva Bakhshi, CFO, Mosaic; Mitch Blaser, Co-CEO, Mosaic; Keshav R. Murugesh, Group CEO, WNS; and Krishnan Ethirajan, COO, Mosaic (Photo: ...",www.wdrb.com,2024-06-20 12:22:46+00:00,2024-06-20 16:09:00
71,Mosaic Insurance Partners with WNS on Future-ready Operations Model - Placera,"... Mosaic; Mitch Blaser, Co-CEO, Mosaic; Keshav R. Murugesh, Group CEO, WNS; and Krishnan Ethirajan, COO, Mosaic (Photo: Business Wire). Under the ...",www.placera.se,2024-06-20 12:09:41+00:00,2024-06-20 16:09:00
72,Mosaic Insurance Partners with WNS on Future-ready Operations Model | Business Wire,... Co-Founder and Co-CEO of Mosaic. “This alliance helps us stay nimble ... WNS (Holdings) Limited (NYSE: WNS) is a leading Business Process Management ( ...,www.businesswire.com,2024-06-20 12:09:29+00:00,2024-06-20 16:09:00
73,Recheck launches industry registry of solar salespeople and installers,"... Mosaic, Palmetto, Sungage Financial, Sunlight Financial and Sunrun. The ... company to company. “A healthy solar industry is vital to consumers and ...",www.solarpowerworldonline.com,2024-06-20 12:05:12+00:00,2024-06-20 16:09:00
74,API from Belgian Luzmo writes down data insights in normal language - Techzine Europe,"The company is launching an AI component that provides analysis in human language. ... Databricks' Mosaic AI will focus on stronger model quality, new ...",www.techzine.eu,2024-06-20 11:14:18+00:00,2024-06-20 16:09:00
75,Peraton Wins Spot on $1.4B Defense Enterprise HR Applications &amp; Data Services BPA,The company said Wednesday the DEHRADS BPA covers support for DMDC in 25 task ... Video of the Day. Executive Mosaic. 3.62K subscribers. Executive ...,www.govconwire.com,2024-06-20 09:47:33+00:00,2024-06-20 16:09:00
76,Globex Mining Enterprises (TSE:GMX) Share Price Crosses Below 50-Day Moving Average of $0.99,"The company has a debt-to-equity ratio of 0.30, a current ratio of 165.30 ... Decreases Stock Holdings in The Mosaic Company (NYSE:MOS)- Vanguard ...",www.defenseworld.net,2024-06-20 09:30:14+00:00,2024-06-20 16:09:00
77,"GE Aerospace, NASA Collaborate on Hybrid Electric Demonstrator Engine Project",The company said Wednesday the hybrid electric demonstrator engine ... Staying in line with Executive Mosaic's dedication to covering all angles of ...,executivebiz.com,2024-06-20 16:21:25+00:00,2024-06-20 17:09:06
78,4 Tips to Elevate Your Company's Cybersecurity - GovCon Wire,"They have to understand what the risk is for their company as they're using the technology,” said Evans. ... Video of the Day. Executive Mosaic. 3.62K ...",www.govconwire.com,2024-06-20 15:41:29+00:00,2024-06-20 17:09:06
79,Mosaic Insurance Partners with WNS on Future-ready Operations Model - Social News XYZ,"Business Wire India WNS (Holdings) Limited (NYSE: WNS), a leading provider of global digital-led Business Process Management (BPM) solutions, ...",www.socialnews.xyz,2024-06-20 12:37:33+00:00,2024-06-20 17:09:06
80,"BUZZ-U.S. STOCKS ON THE MOVE-Citigroup, Valeant, Dean Foods, Amedica | Reuters","... Mosaic Co: down 4.5 pct ** Nutrien Ltd: up 3.3 pct UPDATE 1-Mosaic profit misses on transport bottlenecks, delayed spring UPDATE 1-Nutrien posts ...",www.reuters.com,2024-06-20 13:42:46+00:00,2024-06-20 18:09:02
81,North 2 Shore: Mosaic's picks for the best of the festival in Newark - NJ.com,– Company of Collaborative Artists; 2pm – DJ Sienna Chanel / Host Kitab ... Mosaic staff writer Vashti Harris can be reached at vharris@njadvancemedia.,mosaic.nj.com,2024-06-20 18:13:01+00:00,2024-06-20 19:09:09
82,What is Juneteenth? The history and significance of the holiday - UCCS Communique,"... MOSAIC Coordinator, for opportunities to learn more about this important date. ... There are two amazing events that the MOSAIC center is co-hosting ...",communique.uccs.edu,2024-06-20 17:10:40+00:00,2024-06-20 19:09:09
83,Why You Should Retain Mosaic (MOS) Stock in Your Portfolio - Nasdaq,The Mosaic Company MOS is benefiting from healthy demand for phosphate and potash and actions to improve its cost structure.,www.nasdaq.com,2024-06-20 16:38:08+00:00,2024-06-20 20:08:57
84,"BUZZ-U.S. STOCKS ON THE MOVE-Dermira, GTx, Sparton, Intrepid Potash | Reuters",Raymond James ** Vericel Corp: up 21.9 pct BRIEF-Vericel Q4 revenue rose 41 pct to $23.4 mln ** Intrepid Potash: up 10.0 pct ** Mosaic Co: up 1.9 ...,www.reuters.com,2024-06-20 16:00:38+00:00,2024-06-20 20:08:57
85,Mosaic Insurance Partners with WNS on Future-ready Operations Model - Yahoo Finance,"... Mosaic; Mitch Blaser, Co-CEO, Mosaic; Keshav R. Murugesh, Group CEO, WNS; and Krishnan Ethirajan, COO, Mosaic (Photo: Business Wire). NEW YORK ...",finance.yahoo.com,2024-06-20 12:09:28+00:00,2024-06-20 20:08:57
86,Officer's Choice whisky maker Allied Blenders sets IPO price band at Rs 267-281/share - PTI,... company announced. Broking firms have pegged the company's market ... Mosaic Insurance Partners with WNS on Future-ready Operations Model. TOP ...,www.ptinews.com,2024-06-20 13:43:24+00:00,2024-06-21 00:08:55
87,Program for the publication of Yara International ASA second quarter results 2024,"THE MOSAIC COMPANY- Stock The Mosaic Company. -23.99%, 8.73B. ACRON- Stock Acron. -.--%, 8.05B. COROMANDEL INTERNATIONAL LIMITED- Stock Coromandel ...",www.marketscreener.com,2024-06-20 13:09:38+00:00,2024-06-21 02:08:59
