,Heading,Subheading,Publisher,Published,Found
881,Barclays Remains a Buy on Mosaic Co (MOS) | Markets Insider,"In a report released today, Benjamin Theurer from Barclays maintained a Buy rating on Mosaic Co (MOS – Research Report), with a price targ...",markets.businessinsider.com,2024-07-23 16:29:26+00:00,2024-07-23 20:09:07
882,ScottsMiracle-Gro Stock Blooms After Investor Day Optimism,"... companies like Intrepid Potash Inc. (NYSE: IPI), The Mosaic Co. (NYSE: MOS), and CF Industries Holdings Inc. (CF). ScottsMiracle-Gro Portfolio of ...",www.sharewise.com,2024-07-23 15:18:44+00:00,2024-07-23 20:09:07
883,Smith joins Mosaic as Americas CEO - Global Reinsurance,"He previously worked with Mosaic's leadership at Ironshore from 2009, launching its environmental business, holding roles including president of ...",www.globalreinsurance.com,2024-07-23 21:25:40+00:00,2024-07-23 22:09:07
884,Liverpool contract extension for Trent Alexander-Arnold dispelled after mosaic theory,Liverpool fans speculating that an Anfield mosaic announcing a ... CITY & BUSINESS- PERSONAL FINANCE- THE CRUSADER- TRAVEL- TRAVEL NEWS- UK ...,www.express.co.uk,2024-07-23 22:23:43+00:00,2024-07-23 23:09:11
885,30 leaders will examine the future of life insurance distribution,"Mosaic conveys this powerful message. In 2014, LinkedIn co-founder Reid Hoffman stated: “No company can succeed by itself. The only way to ...",insurance-portal.ca,2024-07-23 15:01:06+00:00,2024-07-23 23:09:11
886,Unveiling 57-metre mosaic mural 'In a River a Thousand Streams' by London Bridge Station,Lifestyle- Business- Entertainment- Sports. All rights reserved 2013-2017 ©. London Post - A 2Trom News Group Company Powered by Moscow Media ...,london-post.co.uk,2024-07-23 23:44:32+00:00,2024-07-24 00:09:10
887,Two opportunities remain to submit ideas to Mosaic Mural Project - PANHANDLE,Nebraska Community Foundation Intern Kate Kratzer hosted the Mosaic Mural Project at Beans and Steams Coffee House today ... Business- Health ...,panhandle.newschannelnebraska.com,2024-07-24 03:41:20+00:00,2024-07-24 05:09:42
888,Fiera Comox aims its box of tricks at timberland - Agri Investor,"Zweig, who joined Fiera Comox from PSP, BCI, and AimCo portfolio company Mosaic in 2022, where he was president and CEO, says he and his new ...",www.agriinvestor.com,2024-07-24 02:48:11+00:00,2024-07-24 05:09:42
889,Agricultural Micronutrients Market Changing Strategies to Remain Competitive Analysis,"(India), Helena Chemical Company (US), Yara International ASA (Norway), The Mosaic Company (US), Haifa Group (Israel), Sapec SA (Belgium), Compass ...",www.thenrinews.com,2024-07-24 05:38:17+00:00,2024-07-24 07:09:44
890,"Residents decry Austin police chief search, blame city policies for weak applicant pool","Gonzalez also said the city was satisfied with recruitment efforts by Mosaic, stating that the company “worked tirelessly to recruit applicants for ...",www.statesman.com,2024-07-24 12:03:17+00:00,2024-07-24 13:09:46
891,Everything is ready for the start-up of the Flexicoking Unit of the New Talara Refinery,Company: Mosaic Fertilizantes do Brasil Ltda. (Mosaic Brasil); The ... companies that drive business in Latin America. Request Demo. 0. 0 ...,www.bnamericas.com,2024-07-24 11:52:50+00:00,2024-07-24 13:09:46
892,Mosaic hires new CEO for Americas division - Life Insurance International,"Mosaic, a global specialty insurer, has appointed Toby Smith as the CEO of its Americas business, effective 23 July.",www.lifeinsuranceinternational.com,2024-07-24 11:09:10+00:00,2024-07-24 13:09:46
893,Insurance broker District Cover secures $7m in funding round backed by Andreessen Horowitz,"Richard Smith, general partner & co-founder at Mosaic General Partnership, remarked, “One of the reasons we founded Mosaic was to focus on how ...",fintech.global,2024-07-24 09:36:35+00:00,2024-07-24 13:09:46
894,Study on funding options to manage Oxford's visitor industry gets go-ahead,"The Mosaic Partnership, experts in this field, will explore different ... If it is decided to pursue one of the options, an independent company ...",www.oxford.gov.uk,2024-07-24 09:20:47+00:00,2024-07-24 13:09:46
895,Blair William &amp; Co. IL Grows Holdings in Bausch Health Companies Inc. (NYSE:BHC),... Companies and related companies with MarketBeat.com's FREE daily email newsletter. ... IL Sells 522 Shares of The Mosaic Company (NYSE:MOS)- Blair ...,www.defenseworld.net,2024-07-24 09:13:49+00:00,2024-07-24 13:09:46
896,"Mosaic Co. stock falls Tuesday, underperforms market - MarketWatch","Shares of Mosaic Co. slid 2.45% to $28.67 Tuesday, on what proved to be an all-around dismal trading session for the stock market, ...",www.marketwatch.com,2024-07-24 05:09:55+00:00,2024-07-24 13:09:46
897,"Mosaic Co. stock falls Tuesday, underperforms market - MarketWatch","This was the stock's fourth consecutive day of losses. Mosaic Co. closed $14.14 below its 52-week high ($42.81), which the company achieved on August ...",www.marketwatch.com,2024-07-24 05:09:47+00:00,2024-07-24 13:09:46
898,Mosaic appoints Toby Smith as Americas CEO - The Royal Gazette,"Veteran specialty market executive Toby Smith has joined Mosaic Insurance as Americas CEO. The Bermudian-based company said Mr Smith, ...",www.royalgazette.com,2024-07-24 04:46:32+00:00,2024-07-24 13:09:46
899,Swiss National Bank Has $2.88 Million Stock Position in JBG SMITH Properties (NYSE:JBGS),... company in its most recent 13F filing with the SEC. The firm ... IL Sells 522 Shares of The Mosaic Company (NYSE:MOS)- Blair William & Co ...,www.defenseworld.net,2024-07-23 15:57:47+00:00,2024-07-24 13:09:46
900,Mosaic Insurance names Toby Smith as Americas CEO - Coverager,"At Mosaic, Smith will direct new product development and oversee Americas-focused lines of business, including the company's three largest divisions— ...",www.coverager.com,2024-07-24 14:17:21+00:00,2024-07-24 15:09:32
901,A Mosaic of History and Everyday Moments - Times of India,"Copyright © 2024 Bennett, Coleman & Co. Ltd. All rights reserved. For reprint rights: Times Syndication Service. Company Logo. We Care About Your ...",timesofindia.indiatimes.com,2024-07-24 13:36:47+00:00,2024-07-24 15:09:32
902,Fintech (Financial Technology) Industry Value Chain Analysis - Economica,Latest Innovations of Phosphoric Acid Market | The Mosaic Company; PJSC PhosAgro; Nutrien; IFFCO; EuroChem Group AG; Prayon Group; Israel Chemical ...,economica.ma,2024-07-24 11:59:17+00:00,2024-07-24 15:09:32
903,Lockheed Marks 9% Growth in Q2 2024 Net Sales; Jim Taiclet on F-35 Program's ...,Net sales of the company's missiles and fire control business during ... © Copyrights Executive Mosaic - All Rights Reserved. GovCon Wire.,www.govconwire.com,2024-07-24 09:24:58+00:00,2024-07-24 15:09:32
904,Eaglesledge Energy's Proposed Clean-Tech Refinery and Solar Facility Gains Momentum ...,"... company Mosaic. The CFR is slated to process 30,000 barrels per stream day (bpsd) of low-sulphur light crude oil, as well as to feature a 125 ...",nationtalk.ca,2024-07-24 08:56:26+00:00,2024-07-24 15:09:32
905,The Mosaic Company (NYSE:MOS) Shares Purchased by Vanguard Group Inc.,Other hedge funds have also recently bought and sold shares of the company. Denali Advisors LLC boosted its position in Mosaic by 100.5% during the ...,www.defenseworld.net,2024-07-24 06:45:37+00:00,2024-07-24 15:09:32
906,Roman Mosaic Floor Found in Naples Waters - Art News,"Roman mosaic floor found in Naples waters, project to restore ... Company Logo. Your Privacy Choices (Texas Residents). As explained in our ...",www.artnews.com,2024-07-24 14:57:31+00:00,2024-07-24 16:09:47
907,Finance Executive Andre Maciel Joins Iron Mountain Board - ExecutiveBiz,"... Company. As Kraft Heinz CFO, Maciel is responsible for mergers and ... Staying in line with Executive Mosaic's dedication to covering all ...",executivebiz.com,2024-07-24 16:10:05+00:00,2024-07-24 17:09:39
908,Stunning ancient Roman mosaic found submerged in the sea off Naples | CNN,A mosaic from the floor of an ancient Roman villa has been uncovered ... Company. All Rights Reserved. CNN Sans ™ & © 2016 Cable News Network ...,www.cnn.com,2024-07-24 16:05:20+00:00,2024-07-24 17:09:39
909,Blair William &amp; Co. IL Purchases 287 Shares of iShares MSCI ACWI ETF (NASDAQ:ACWI),IL Sells 579 Shares of VSE Co. (NASDAQ:VSEC)- Blair William & Co. IL Sells 522 Shares of The Mosaic Company (NYSE:MOS)- Blair William & Co. IL ...,www.defenseworld.net,2024-07-24 09:13:49+00:00,2024-07-24 17:09:39
910,The People in Charge at Databricks as It Moves Toward a Potential IPO - The Information,"Rao's direct reports include other Mosaic co-founders Hanlin Tang and Jonathan Frankle, who both support AI initiatives. Rao's team also includes the ...",www.theinformation.com,2024-07-24 17:18:39+00:00,2024-07-24 18:09:51
911,Mosaic hires new CEO for Americas division - Yahoo Finance,"Mosaic, a global specialty insurer, has appointed Toby Smith as the CEO of its Americas business, effective 23 July. Smith joins the leadership ...",finance.yahoo.com,2024-07-24 11:28:45+00:00,2024-07-24 18:09:51
912,Construction crews uncover mosaic seal of the state at Carson City school,"... company, Hart & Sons Septic. With over a decade of experience under his belt, Cameron's dedication to serving the community shines through his new ...",www.carsonnow.org,2024-07-24 17:47:56+00:00,2024-07-24 19:09:36
913,New Yorkers invited to create mosaic out of LEGO blocks for Penn Station entrance,... company NBA vet Taj Gibson launches real estate firm to revitalize Brooklyn community- sunset park fire 'They moved very quickly': Firefighters ...,www.amny.com,2024-07-24 19:55:11+00:00,2024-07-24 20:09:46
914,"Donut Shop To Open In Mosaic District; Kreole Seafood Closes: Report | Fairfax City, VA Patch","This is a hard time for our entire Kreole Family, as this restaurant has been more than just a business—it has been our passion and a labor of love.",patch.com,2024-07-24 17:57:38+00:00,2024-07-24 20:09:46
915,Ron Ash to Succeed John Goodman as Accenture Federal Services CEO - GovCon Wire,The company said Tuesday Ash will also take over the chairmanship of ... © Copyrights Executive Mosaic - All Rights Reserved. GovCon Wire.,www.govconwire.com,2024-07-24 20:29:14+00:00,2024-07-24 21:09:45
916,Raymond James picks up Citi talent lost in restructuring - Tampa Bay Business Journal,"Company name. 1. 1. TD Synnex Corp. 2. 2. Jabil. 3. 3. The Mosaic Co. View this list. Friday, September 27, 2024. Q3 Power Breakfast: Will Weatherford ...",www.bizjournals.com,2024-07-24 21:39:56+00:00,2024-07-24 22:09:44
917,Mosaic Insurance names Toby Smith as Americas CEO - Reinsurance News,"... company's three largest divisions, namely transactional liability, cyber, and environmental liability. Mitch Blaser, Co-CEO, Mosaic, commented ...",www.reinsurancene.ws,2024-07-24 20:05:17+00:00,2024-07-24 22:09:44
918,Stunning ancient Roman mosaic found submerged in the sea off Naples - KION546,... Company. All rights reserved. Article Topic Follows: CNN - Style. Jump to comments ↓. CNN Newsource. Related Articles. Look of the week: Gigi Hadid's ...,kion546.com,2024-07-24 18:07:15+00:00,2024-07-24 23:09:37
919,UniSuper Management Pty Ltd Has $1.06 Million Stock Holdings in The Mosaic Company ...,"UniSuper Management Pty Ltd increased its position in shares of The Mosaic Company (NYSE:MOS - Free Report) by 647.8% in the 1st quarter, ...",www.marketbeat.com,2024-07-25 00:12:57+00:00,2024-07-25 02:09:32
920,Mosaic Co. stock outperforms market despite losses on the day - MarketWatch,"Shares of Mosaic Co. slipped 0.38% to $28.56 Wednesday, on what proved to be an all-around grim trading session for the stock market, ...",www.marketwatch.com,2024-07-24 22:32:37+00:00,2024-07-25 03:09:38
921,Mosaic Co. stock outperforms market despite losses on the day - MarketWatch,"Mosaic Co. closed $14.25 below its 52-week high ($42.81), which the company reached on August 10th. Trading ...",www.marketwatch.com,2024-07-24 22:13:49+00:00,2024-07-25 03:09:38
922,The new space race: nuclear-powered spaceships to Mars - Israel Hayom,This article was written in collaboration with Generative AI news company Alchemiq. ... Stunning Roman mosaic discovered underwater near Naples. 07-25- ...,www.israelhayom.com,2024-07-25 08:39:24+00:00,2024-07-25 09:09:39
923,Stunning Roman mosaic discovered underwater near Naples - Israel Hayom,The mosaic features intricate geometric patterns created ... This article was written in collaboration with Generative AI news company Alchemiq.,www.israelhayom.com,2024-07-25 08:06:05+00:00,2024-07-25 09:09:39
924,"Despite the Toll of War at Home and Rising Hostility Abroad, Investors Are Still Choosing Israel",The company is instead planning an initial public offering. In the wake ... Monthly Essays Observations Editors' Picks Mosaic Books About Mosaic.,mosaicmagazine.com,2024-07-25 04:14:31+00:00,2024-07-25 09:09:39
925,Oxford City Council looking at maximising visitor industry benefits - This Is Oxfordshire,"The Mosaic Partnership has been appointed to explore ways the city's ... If an option is decided upon, an independent company would be set up ...",www.thisisoxfordshire.co.uk,2024-07-25 04:09:01+00:00,2024-07-25 09:09:39
926,General Dynamics Sees 'Strong' Q2 FY2024 With $12B in Revenue - GovCon Wire,The company said Wednesday that its revenue for the period was 18 ... © Copyrights Executive Mosaic - All Rights Reserved. GovCon Wire.,www.govconwire.com,2024-07-25 09:58:30+00:00,2024-07-25 12:09:44
927,"AA alum Adam Nathaniel Furman completes the 57-metre mosaic, In a River a Thousand Streams",is a Registered Charity Incorporated as a Company limited by guarantee. Registered in England No.171402. Registered office as above. Architectural ...,www.aaschool.ac.uk,2024-07-25 09:12:50+00:00,2024-07-25 12:09:44
928,Archaeologists make stunning underwater discovery of ancient mosaic in sea off Italy,"Receive updates, offers & other information from the CBS family of companies & our partners. Opt out through the unsubscribe link in any marketing ...",www.cbsnews.com,2024-07-25 13:53:26+00:00,2024-07-25 14:09:35
929,Mosaic Acquires 100% of the Amanda Project - Yahoo Finance,"MONTREAL, July 25, 2024 (GLOBE NEWSWIRE) -- Mosaic Minerals Corporation (CSE: MOC) (“Mosaic” or “The Company”) announces that it has signed a ...",finance.yahoo.com,2024-07-25 12:50:06+00:00,2024-07-25 14:09:35
930,The Crab's Symbolic Significance for the Month of Tammuz - Mosaic Magazine,"The company is instead planning an initial public offering. In the wake of the CrowdStrike debacle, companies like Wiz have every reason to be ...",mosaicmagazine.com,2024-07-25 10:14:07+00:00,2024-07-25 14:09:35
931,"SandboxAQ, Army to Use AI to Advance Battery Design, Alloy Material Development",The company said Tuesday the collaboration with the Army's Command ... Staying in line with Executive Mosaic's dedication to covering all ...,executivebiz.com,2024-07-25 04:04:46+00:00,2024-07-25 14:09:35
932,The Top of the Wash100 Pyramid: Home of GovCon's Finest - ExecutiveBiz,An offering of elite GovCon events and media company Executive Mosaic ... business as corporate vice president and president. She led Grumman to ...,executivebiz.com,2024-07-25 15:59:16+00:00,2024-07-25 16:09:47
933,Craig Fitzpatrick Named Akira Technologies Chief Innovation Officer - GovCon Wire,"In a LinkedIn post published Wednesday, the Washington, D.C.-based company ... © Copyrights Executive Mosaic - All Rights Reserved. GovCon Wire.",www.govconwire.com,2024-07-25 15:42:08+00:00,2024-07-25 16:09:47
934,Mosaic acquiert 100% du projet Amanda - GlobeNewswire,"Company ProfileMosaic Minerals CorporationIndustry: MiningWebsite: ... GlobeNewswire is one of the world's largest newswire distribution networks, ...",www.globenewswire.com,2024-07-25 12:50:11+00:00,2024-07-25 16:09:47
935,Casino operator Bally's to be bought by top investor in $4.6 billion deal - Yahoo Finance,"... Company's attractive growth profile,"" said Soo Kim, chairman at Bally's ... GlobeNewswire. Mosaic Acquires 100% of the Amanda Project. 5 ...",ca.finance.yahoo.com,2024-07-25 12:50:05+00:00,2024-07-25 16:09:47
936,Mosaic Capital (CVE:M) Share Price Crosses Below 200 Day Moving Average of $5.50,"Mosaic Capital shares last traded at C$5.50, with a volume of 2,850 shares. Mosaic Capital Stock Performance. The business has a fifty day simple ...",www.defenseworld.net,2024-07-25 10:30:06+00:00,2024-07-25 16:09:47
937,KBR Logs 6% Increase in Q2 FY24 Revenue; Mark Sopp on Government Solutions Unit's ...,The company returned to shareholders a total of $118 million in capital ... © Copyrights Executive Mosaic - All Rights Reserved. GovCon Wire.,www.govconwire.com,2024-07-25 15:46:57+00:00,2024-07-25 17:09:43
938,Marc Andreessen Thinks AI Could Power a Comedy Renaissance. ChatGPT Disagrees,"Marc Andreessen first became known for co-creating Mosaic, the very first web browser, then for co-founding Netscape, and for being the ""A"" part of ...",www.inc.com,2024-07-25 17:30:18+00:00,2024-07-25 18:09:38
939,Mosaic's Quarterly Earnings Preview: What You Need to Know - TradingView,The Mosaic Company NYSE:MOS is a leading producer and marketer of concentrated phosphate and potash crop nutrients for the global agriculture ...,www.tradingview.com,2024-07-25 19:24:51+00:00,2024-07-25 20:09:44
940,Mosaic's Quarterly Earnings Preview: What You Need To Know - Barchart.com,"Mosaic is all set to announce its second-quarter results next month, and analysts forecast a double-digit decline in the company's bottom-line ...",www.barchart.com,2024-07-25 19:21:12+00:00,2024-07-25 20:09:44
941,Mosaic unveiled outside The Shard took two years and 70 volunteers to create - Southwark News,Shard and London Eye light up for England's semi-final win in Euros ... Last week's performance at The Shard. Rotherhithe theatre company performed at ...,southwarknews.co.uk,2024-07-25 17:27:47+00:00,2024-07-25 20:09:44
942,Weyerhaeuser Reports Second Quarter 2024 Results - Quantisnow,"... Mosaic Company, to the company's board of directors. His appointment is effective immediately. ""We are very pleased to welcome Joc to the ...",quantisnow.com,2024-07-25 20:41:01+00:00,2024-07-25 21:09:37
943,Province grants $2M to struggling Sask. food banks | Regina Leader Post,"The Mosaic Company, one of Saskatchewan's major potash producers, announced in February it would contribute $1 million to the Regina Food Bank ...",leaderpost.com,2024-07-25 19:55:18+00:00,2024-07-25 21:09:37
944,“Does Anyone in Congress Talk about Any Other Ally This Way?” » Mosaic,"In the wake of the CrowdStrike debacle, companies like Wiz have every reason to be optimistic, as Sophie Shulman explains: For the Israeli cyber ...",mosaicmagazine.com,2024-07-25 16:12:46+00:00,2024-07-25 23:09:42
945,Strategic Natural Resource Consultants (SNRC) appoints Domenico Iannidinardo as its CEO,"... Mosaic Forest Management, one of B.C.'s largest forest companies and landowners. ... The Ehattesaht have been incredibly positive for our company and ...",themalaysianreserve.com,2024-07-25 23:11:10+00:00,2024-07-26 00:10:07
946,Better Workplaces - Inside Hibernian House's recording studio - AdNews,"Mosaic's foyer. overview listening area. The office, designed by the studio's co-founders Doig and Adam Moses, mixes the functionality of a ...",www.adnews.com.au,2024-07-25 22:04:31+00:00,2024-07-26 00:10:07
947,Strategic Natural Resource Consultants (SNRC) appoints Domenico Iannidinardo as its CEO,"... Mosaic Forest Management, one of B.C.'s largest forest companies and landowners. Read more at newswire.ca. Provided Content: Content provided by ...",www.theglobeandmail.com,2024-07-25 23:17:21+00:00,2024-07-26 02:09:29
948,Forest company provides update for qathet Regional District - Powell River Peak,"At the July 24 committee of the whole meeting, Mosaic Forest Management representatives briefed regional district directors on what the company is and ...",www.prpeak.com,2024-07-26 01:55:37+00:00,2024-07-26 03:09:33
949,'Textura' art exhibit opens Aug. 6 at The Main - Santa Clarita Valley Signal,“Mosaic is my new passion; it connects me to an ancient form of art ... Related To This Story. Local theater company puts on 'Hamlet'. July 25 ...,signalscv.com,2024-07-25 22:23:19+00:00,2024-07-26 03:09:33
950,Paul Aronhime Appointed Federal Sector SVP at Keeper Security - ExecutiveBiz,"... company efforts to meet public sector requirements. Aronhime, before ... Staying in line with Executive Mosaic's dedication to covering all ...",executivebiz.com,2024-07-25 21:57:28+00:00,2024-07-26 03:09:33
951,"Mosaic Co. stock rises Thursday, outperforms market - MarketWatch","Mosaic Co. closed $13.51 short of its 52-week high ($42.81), which the company reached on August 10th. Trading volume (2.9 M) remained 1.2 million ...",www.marketwatch.com,2024-07-26 04:06:11+00:00,2024-07-26 05:09:38
952,Federal grant to allow Mosaic Medical to build new Madras health clinic,The clinic will be co-located with the Jefferson County Public Health Department on the St. Charles Madras campus. The intention is to create the ...,www.centraloregondaily.com,2024-07-26 02:45:19+00:00,2024-07-26 06:09:38
953,London Bridge's Bus Terminal Illuminated by New 190-Foot-Long Mosaic - Art News,New mosaic created on a wall at London Bridge's bus terminal. ... Company Logo. Your Privacy Choices (Texas Residents). As explained in our ...,www.artnews.com,2024-07-26 08:49:38+00:00,2024-07-26 09:09:32
954,Company says manufacturing problem was behind wind turbine blade breaking off Nantucket Island,Trending Stories- Celebrate Jimmy Carter's birthday through mosaic- UPDATE: 1 injured in shooting that closed parts of …- 'She didn't deserve this': ...,www.wsav.com,2024-07-26 08:25:09+00:00,2024-07-26 09:09:32
955,Privacy Law Patchwork Expands: Two New State Laws Join The Data Protection Mosaic,"Entities that do business in these states or collect data from persons in such state, such that these laws may be applicable, should consult counsel ...",www.mondaq.com,2024-07-26 06:23:37+00:00,2024-07-26 09:09:32
956,Mosaic in the park | Local News - Brattleboro Reformer,"BRATTLEBORO — Artists Corrine Yonce, of Winooski, and Mary Lacy, of Jericho, team up with Epsilon Spires to create a mosaic with broken ceramics ...",www.reformer.com,2024-07-26 09:09:57+00:00,2024-07-26 10:09:35
957,Toby Smith Joins Mosaic Insurance as Americas CEO,"... company's three largest divisions—transactional liability, cyber, and environmental liability. “I'm thrilled to join Mosaic at this stage of its ...",riskandinsurance.com,2024-07-26 13:20:36+00:00,2024-07-26 14:09:39
958,Mosaic intends to acquire Amanda gold project in Canada - Mining Technology,"Mosaic Minerals has signed a letter of intent with Canadian mining company Iamgold to gain full ownership of the Amanda property, situated in ...",www.mining-technology.com,2024-07-26 13:07:31+00:00,2024-07-26 14:09:39
959,London Bridge Station Adorned With 190-Foot Mosaic - The Art Insider,A section of the London Bridge terminus has been decorated with a 190-foot-long mosaic and unveiled to the public ... Company. Home- News- Art World ...,www.art-insider.com,2024-07-26 12:08:40+00:00,2024-07-26 14:09:39
960,Springfield Contemporary Theatre's 29th season has 3 comedies,"Springfield Contemporary Theatre's 29th season includes 3 comedies, collaboration with Mosaic Arts Collective ... company. by Jeff Kessinger 1 min ...",sgfcitizen.org,2024-07-26 12:01:22+00:00,2024-07-26 14:09:39
961,The Mosaic Company (NYSE:MOS) Shares Sold by US Bancorp DE - Defense World,"The firm owned 11,854 shares of the basic materials company's stock after selling 2,377 shares during the period. US Bancorp DE's holdings in Mosaic ...",www.defenseworld.net,2024-07-26 11:59:08+00:00,2024-07-26 14:09:39
962,"US Bancorp DE Increases Stock Position in Medical Properties Trust, Inc. (NYSE:MPW)",... companies with MarketBeat.com's FREE daily email newsletter. « PREVIOUS HEADLINE. The Mosaic Company (NYSE:MOS) Shares Sold by US Bancorp DE- NEXT ...,www.defenseworld.net,2024-07-26 11:58:55+00:00,2024-07-26 14:09:39
963,Form 424B2 JPMORGAN CHASE &amp; CO - StreetInsider,We refer to The Mosaic Company as “Mosaic”. Contingent Interest Payments: If the notes have not been automatically called and the closing price of one ...,www.streetinsider.com,2024-07-26 11:45:41+00:00,2024-07-26 14:09:39
964,Mosaic Hires Sierra Club Executive as Next Leader - The Chronicle of Philanthropy,"Jack Connors Jr., a Boston philanthropist and founding partner of the advertising company Hill, Holliday, Connors, Cosmopulos, died from pancreatic ...",www.philanthropy.com,2024-07-26 11:02:39+00:00,2024-07-26 14:09:39
965,Northrop Records 7% Increase in Q2 Fiscal 2024 Sales; Kathy Warden Offers Update on ...,The company's mission systems business reported $2.7 billion in Q2 ... © Copyrights Executive Mosaic - All Rights Reserved. GovCon Wire.,www.govconwire.com,2024-07-26 10:20:57+00:00,2024-07-26 14:09:39
966,Mosaic intends to acquire Amanda gold project in Canada - Yahoo Finance,"Mosaic Minerals has signed a letter of intent with Canadian mining company Iamgold to gain full ownership of the Amanda property in Jamésie, Quebec.",finance.yahoo.com,2024-07-26 11:48:57+00:00,2024-07-26 16:09:46
967,Mosaic: Arts &amp; Cultural Festival - Tacoma Weekly,"Mosaic: Arts & Cultural Festival ... Vendors include multicultural artists and crafters, local small business owners and Tacoma community groups, ...",tacomaweekly.com,2024-07-26 15:27:19+00:00,2024-07-26 17:09:54
968,"Companies Help Government Clients Accelerate Space Imagery, Data Analysis - ExecutiveBiz","is a staff writer at Executive Mosaic, where she writes for ExecutiveBiz about IT modernization, cybersecurity, space procurement and industry leaders ...",executivebiz.com,2024-07-26 16:57:35+00:00,2024-07-26 18:09:44
