,Heading,Subheading,Publisher,Published,Found
86,Fourteen charged after pro-Palestinian demo outside Thales factory | Bury Mercury,Thales said it has a small-medium enterprise joint venture (SME JV) with Israeli company Elbit that supplies systems to the Ministry of Defence (MoD) ...,www.burymercury.co.uk,2024-07-03 22:05:47+00:00,2024-07-04 01:09:25
87,"Rugged Electronics Market Size, Share, Trends, Business - openPR.com","... Inc., Advantech Co Ltd, Crystal Group, Kontron AG, Mercury Systems Inc, AdLink Technology Inc., DT Research Inc., Juniper Systems Inc., CipherLab Co.",www.openpr.com,2024-07-03 07:01:02+00:00,2024-07-04 01:09:25
88,Fourteen charged after pro-Palestinian demo outside Thales factory,This is a UK-registered company that supplies systems to the UK MoD. It ... Wymondham & Attleborough Mercury Wymondham & Attleborough Mercury.,www.wymondhamandattleboroughmercury.co.uk,2024-07-04 04:02:13+00:00,2024-07-04 09:09:30
89,FDA approves second Alzheimer's drug that can modestly slow disease | Weston Mercury,"The company also said a year's worth of therapy would cost 32,000 ... Many smaller hospitals and health systems aren't yet set up to ...",www.thewestonmercury.co.uk,2024-07-03 23:02:32+00:00,2024-07-04 09:09:30
90,Review slates power distributors over response to severe outages - The Mercury,"The report did note that given Ausnet's defective systems, infrastructure and event planning, the company did the best it could in managing the outage ...",www.themercury.com.au,2024-07-04 13:14:36+00:00,2024-07-04 17:09:36
91,OpenAI breached by hacker in 2023 – report - Milford Mercury,"... technologies being worked on by the company. But they did not get into the systems where OpenAI's product are built and housed, the report said.",www.milfordmercury.co.uk,2024-07-05 12:55:39+00:00,2024-07-05 14:09:28
92,MIL-OSI Europe: Current figures on offset transactions as of end of June 2024,The company Mercury Mission Systems from French-speaking Switzerland will manufacture mission-critical components for the command and control ...,foreignaffairs.co.nz,2024-07-05 11:52:41+00:00,2024-07-05 14:09:28
93,"Electronic Warfare System Market is Calculated to Reach US$ 33.88 Billion by 2034, Fact.MR","Top Key Players are BAE Systems Plc.; Leonardo S.p.A.; Elbit Systems Ltd ... Mercury Systems, Inc.; Airbus Defense and Space; General Dynamics ...",www.einnews.com,2024-07-05 10:14:53+00:00,2024-07-05 14:09:28
94,Hennion &amp; Walsh Asset Management Inc. Makes New Investment in NXP Semiconductors ...,"Hennion & Walsh Asset Management Inc. Takes Position in Mercury Systems, Inc. (NASDAQ:MRCY)- NEXT HEADLINE ». Hennion & Walsh Asset Management Inc.",www.defenseworld.net,2024-07-05 11:53:19+00:00,2024-07-05 21:09:16
95,"What Does Mercury Systems, Inc.'s (NASDAQ:MRCY) Share Price Indicate? - Yahoo Sports","Mercury Systems, Inc. ( NASDAQ:MRCY ), might not be a large cap stock, but it received a lot of attention from a...",ca.sports.yahoo.com,2024-07-05 17:57:30+00:00,2024-07-06 01:09:17
96,Van ECK Associates Corp Sells 100 Shares of Booking Holdings Inc. (NASDAQ:BKNG),"The Company, through its online travel companies (OTCs), connects consumers ... Van ECK Associates Corp Boosts Holdings in Mercury Systems, Inc.",www.defenseworld.net,2024-07-06 13:12:19+00:00,2024-07-06 17:09:26
97,Cadence Announces Second Quarter 2024 Financial Results Webcast - Quantisnow,"The company applies its underlying Intelligent System Design strategy ... Inc., Mercury Systems, Inc., DXC Technology and Proterra Inc. and ...",quantisnow.com,2024-07-06 08:57:51+00:00,2024-07-06 17:09:26
98,"UFP Industries, Inc. (NASDAQ:UFPI) Shares Purchased by Van ECK Associates Corp","Corporate insiders own 2.58% of the company's stock. UFP Industries Trading ... Van ECK Associates Corp Boosts Holdings in Mercury Systems, Inc.",www.defenseworld.net,2024-07-06 13:11:12+00:00,2024-07-06 21:09:17
99,"Digital Mobile Radio Market Size, Share, Global Analysis- 2033","... Mercury Systems Inc., Beijing Jiaxun Feihong Electrical Co ... The new report published by The Business Research Company, titled """"5G System ...",www.openpr.com,2024-07-07 15:01:16+00:00,2024-07-07 18:09:28
100,"PNC Financial Services Group Inc. Buys 1062 Shares of NetScout Systems, Inc. (NASDAQ:NTCT)","Signaturefd LLC now owns 1,268 shares of the technology company's ... Has $84,000 Stock Position in Mercury Systems, Inc. (NASDAQ:MRCY)- PNC ...",www.defenseworld.net,2024-07-07 14:34:55+00:00,2024-07-07 18:09:28
101,Reflecting On Defense Contractors Stocks' Q1 Earnings: KBR (NYSE:KBR) - Barchart.com,"It was a weak quarter for the company, with a miss of analysts' earnings and organic revenue estimates. Mercury Systems had the weakest ...",www.barchart.com,2024-07-08 11:21:18+00:00,2024-07-08 14:09:18
102,'Out of date' IT system leaves NHS at risk of further cyber attacks | Great Yarmouth Mercury,"Professor Ciaran Martin, founding chief executive of the National Cyber Security Centre, said ransomware is a 'major global problem'.",www.greatyarmouthmercury.co.uk,2024-07-08 08:54:37+00:00,2024-07-08 14:09:18
103,GovCon Index Dropped for Second Consecutive Week - ExecutiveBiz,"Many companies made gains last week despite overall losses. Mercury Systems, which grew by 7.47%, led the way. Its closest competitor was Palantir ...",executivebiz.com,2024-07-08 16:14:52+00:00,2024-07-08 17:09:25
104,Reflecting On Defense Contractors Stocks' Q1 Earnings: KBR (NYSE:KBR) - Yahoo Finance Canada,"Mercury Systems reported revenues of $208.3 million, down 21% year on ... WiSA Technologies, Inc. Regains Compliance with Nasdaq Stockholders ...",ca.finance.yahoo.com,2024-07-08 12:14:44+00:00,2024-07-08 17:09:25
105,Eagle Mountain Mining confirms copper porphyry-style targets in Arizona | The Mercury,Company confident targets align with major porphyry deposits in Arizona. Geophysics review and strategic review currently underway. Special Report ...,www.themercury.com.au,2024-07-09 01:39:13+00:00,2024-07-09 06:09:38
106,Ukraine's Zelensky discusses further Nato support with Donald Tusk | Great Yarmouth Mercury,“I can see a possibility for our partners to use their air defence systems in a way to hit .. ... Company 'fell short of its own standards' when ...,www.greatyarmouthmercury.co.uk,2024-07-09 04:08:34+00:00,2024-07-09 10:09:40
107,Natasha Cloud and Kahleah Copper's hometown grit reshaping Phoenix Mercury's culture,Sports Business. 'Philly Special': Natasha Cloud and Kahleah Copper's hometown grit reshaping Phoenix Mercury's culture.,www.bizjournals.com,2024-07-09 18:24:15+00:00,2024-07-09 21:09:31
108,Telstra reprimanded by ACMA over silent numbers made publicly available - The Mercury,“Telstra is entrusted with personal details of millions of Australians and those people have the right to expect that Telstra has robust systems and ...,www.themercury.com.au,2024-07-09 14:12:07+00:00,2024-07-09 21:09:31
109,Earths Energy's South Australian geothermal projects have the right stuff | The Mercury,"... systems (EGS) and advanced geothermal systems (AGS). Based on a relatively conservative group of analogous operating projects in the US, the company ...",www.themercury.com.au,2024-07-09 23:39:20+00:00,2024-07-10 01:09:15
110,Defense Contractors Stocks Q1 In Review: General Dynamics (NYSE:GD) Vs Peers,"... Corporation, Lockheed Martin Corporation. Read Stock ... company, with a miss of analysts' earnings and organic revenue estimates. Mercury Systems ...",ca.investing.com,2024-07-09 23:25:17+00:00,2024-07-10 01:09:15
111,Mercury Expands Fundraising Capabilities with Appointment of Jeff Davis as Partner ...,"NEW YORK--(BUSINESS WIRE)--Mercury Capital Advisors, a leading global ... systems. They are usually only set in response to actions made by ...",www.businesswire.com,2024-07-09 23:20:59+00:00,2024-07-10 01:09:15
112,Vodafone and Meta scheme cuts mobile network traffic and boosts video quality | Sudbury Mercury,"... company Meta. The two firms said they have worked together to free up ... systems, resulting in better optimisation and efficiency. We are ...",www.sudburymercury.co.uk,2024-07-09 08:55:32+00:00,2024-07-10 01:09:15
113,Dual-core CPU Modules Market: Comprehensive study explores,"... company profiles, product/service offerings, market ... Whats keeping Eurotech, Extreme Engineering Solutions, MERCURY SYSTEMS, Sealevel Systems ...",www.openpr.com,2024-07-10 16:13:15+00:00,2024-07-10 17:09:22
114,Q1 Rundown: ICF (NASDAQ:ICFI) Vs Other Defense Contractors Stocks - Barchart.com,It was a weak quarter for the company with a miss of analysts' earnings and organic revenue estimates. Mercury Systems had the weakest performance ...,www.barchart.com,2024-07-10 12:11:52+00:00,2024-07-10 17:09:22
115,U.S. Navy Funds Mercury to Advance Chip-Scale Technologies Needed to Reduce ... - Stock Titan,The $13.2 million contract with the U.S. Navy signifies a material revenue stream for Mercury Systems. This aligns with the company's core mission of ...,www.stocktitan.net,2024-07-10 11:41:18+00:00,2024-07-10 17:09:22
116,U.S. Navy Funds Mercury to Advance Chip-Scale Technologies Needed to Reduce ...,"ANDOVER, Mass., July 10, 2024 (GLOBE NEWSWIRE) -- Mercury Systems, Inc. (NASDAQ: MRCY, www.mrcy.com), a technology company that delivers ...",finance.yahoo.com,2024-07-10 11:07:06+00:00,2024-07-10 17:09:22
117,U.S. Navy Funds Mercury to Advance Chip-Scale Technologies Needed to Reduce ... - StreetInsider,"Mercury Systems, Inc. (NASDAQ: MRCY, www.mrcy.com), a technology company that delivers mission-critical processing power to the edge, ...",www.streetinsider.com,2024-07-10 11:05:12+00:00,2024-07-10 17:09:22
118,MERCURY GENERAL CORPORATION TO REPORT SECOND QUARTER RESULTS ON ...,"LOS ANGELES, July 9, 2024 /PRNewswire/ -- Mercury General Corporation (NYSE: MCY) reported today that after the markets close on Tuesday, July 30, ...",themalaysianreserve.com,2024-07-10 04:53:17+00:00,2024-07-10 17:09:22
119,Mercury Systems secures $13.2M Navy contract - Investing.com,"- Mercury Systems Inc (NASDAQ:MRCY) has secured a $13.2 million contract with the U.S. Navy to enhance sensor processing technologies, aiming to ...",www.investing.com,2024-07-10 15:54:33+00:00,2024-07-10 21:09:17
120,Daily Briefs | Aviation Week Network,UKRAINE signs remote sensing agreement with ICEYE... IFS acquires AI-powered MRO company... MERCURY SYSTEMS works to shorten EW development ...,aviationweek.com,2024-07-11 04:54:22+00:00,2024-07-11 06:09:19
121,"Mercury review July 2024: business checking, savings, treasury, and more - Fortune",Mercury is a fintech offering business banking products and services geared toward tech companies and startups.,fortune.com,2024-07-11 17:06:31+00:00,2024-07-11 18:09:34
122,Mercury (MRCY) Secures $13.2 Million Agreement From U.S. Navy - Yahoo Finance,The company will provide a FPGA-based common signal acquisition and digital beamforming solution for BlueHalo's BADGER system. Mercury also signed a ...,uk.finance.yahoo.com,2024-07-11 16:19:12+00:00,2024-07-11 18:09:34
123,Defense Contractors Stocks Q1 Earnings: Northrop Grumman (NYSE:NOC) Best of the Bunch,"Mercury Systems reported revenues of $208.3 million, down 21% year on ... It was a weak quarter for the company with a miss of analysts' earnings and ...",uk.finance.yahoo.com,2024-07-11 13:06:12+00:00,2024-07-11 18:09:34
124,U.S. Navy Funds Mercury to Advance Chip-Scale Technologies - Seapower,"ANDOVER, Mass., July 10, 2024 (GLOBE NEWSWIRE) — Mercury Systems, Inc. (NASDAQ: MRCY, www.mrcy.com), a technology company that delivers mission ...",seapowermagazine.org,2024-07-10 23:40:18+00:00,2024-07-11 18:09:34
125,MIL-OSI: U.S. Navy Funds Mercury to Advance Chip-Scale Technologies Needed to Reduce ...,"Source: GlobeNewswire (MIL-OSI). ANDOVER, Mass., July 10, 2024 (GLOBE NEWSWIRE) — Mercury Systems, Inc. (NASDAQ: MRCY, www.mrcy.com), a technology ...",foreignaffairs.co.nz,2024-07-10 23:22:54+00:00,2024-07-11 18:09:34
126,South Korea to deploy laser weapons to intercept North Korean drones - Diss Mercury,"It said the system, developed by local company Hanwha Aerospace, costs just 2,000 won (about £1.10) per shot. “We face North Korea on our doorstep ...",www.dissmercury.co.uk,2024-07-11 14:07:31+00:00,2024-07-11 22:09:21
127,Data of AT&amp;T customers downloaded to third-party platform after security breach | Bridgwater Mercury,"That company, CDK Global, is still attempting to re-establish normal operations. Cybersecurity experts are warning that hospital systems around the US ...",www.bridgwatermercury.co.uk,2024-07-12 14:53:16+00:00,2024-07-12 19:09:30
128,June 2025 Options Now Available For Mercury Systems (MRCY) - Nasdaq,"Investors in Mercury Systems Inc (Symbol: MRCY) saw new options become available today, for the June 2025 expiration. One of the key inputs that ...",www.nasdaq.com,2024-07-12 14:46:24+00:00,2024-07-12 19:09:30
129,Q1 Earnings Highlights: BWX (NYSE:BWXT) Vs The Rest Of The Defense Contractors Stocks,It was a weak quarter for the company with a miss of analysts' earnings and organic revenue estimates. Mercury Systems posted the weakest ...,www.barchart.com,2024-07-12 11:46:09+00:00,2024-07-12 19:09:30
130,"Janney Montgomery Scott LLC Grows Stock Holdings in Annaly Capital Management, Inc ...","... LLC Sells 1,289 Shares of Citizens Financial Group, Inc. (NYSE:CFG)- Mutual of America Capital Management LLC Sells 5,192 Shares of Mercury Systems, ...",www.defenseworld.net,2024-07-14 09:35:04+00:00,2024-07-14 11:09:16
131,Janney Montgomery Scott LLC Cuts Holdings in Overlay Shares Large Cap Equity ETF ...,"... company in its most recent filing with the Securities ... Mutual of America Capital Management LLC Sells 5,192 Shares of Mercury Systems, Inc.",www.defenseworld.net,2024-07-14 15:38:36+00:00,2024-07-14 19:09:22
132,Janney Montgomery Scott LLC Takes $2.49 Million Position in Invesco Equal Weight 0-30 ...,"... company in its most recent disclosure with the ... Mutual of America Capital Management LLC Sells 5,192 Shares of Mercury Systems, Inc.",www.defenseworld.net,2024-07-14 15:36:38+00:00,2024-07-14 19:09:22
133,"Mutual of America Capital Management LLC Sells 5,192 Shares of Mercury Systems, Inc ...","Mercury Systems, Inc, a technology company, manufactures and sells components, products, modules, and subsystems for aerospace and defense industries ...",www.defenseworld.net,2024-07-14 17:25:40+00:00,2024-07-14 22:09:13
134,"Mutual of America Capital Management LLC Sells 1,289 Shares of Citizens Financial Group ...","Company insiders own 0.62% of the company's stock. ... Mutual of America Capital Management LLC Sells 5,192 Shares of Mercury Systems, Inc.",www.defenseworld.net,2024-07-14 09:43:22+00:00,2024-07-14 22:09:13
135,Unpacking Q1 Earnings: Axon (NASDAQ:AXON) In The Context Of Other Aerospace And ...,It was a weak quarter for the company with a miss of analysts' earnings and organic revenue estimates. Mercury Systems posted the slowest revenue ...,www.barchart.com,2024-07-15 11:49:05+00:00,2024-07-15 15:09:25
136,"Star casinos shut pokies after major technology glitch | Illawarra Mercury | Wollongong, NSW",... systems down on Saturday night. The issue arose as the company upgraded all of its platforms to enable cashless gaming. The Star's Sydney licence ...,www.illawarramercury.com.au,2024-07-15 10:32:46+00:00,2024-07-15 15:09:25
137,Far East Gold picks up potential company maker and successful mining executive as Chairman,The Mercury. Hobart. Today. 3 °/ 10 °. Set your local weather. Home- My ... systems – similar to areas such as the 60Moz-plus Kalgoorlie Goldfields ...,www.themercury.com.au,2024-07-15 04:50:22+00:00,2024-07-15 15:09:25
138,Mutual of America Capital Management LLC Sells 1134 Shares of ManpowerGroup Inc. (NYSE:MAN),"The company offers recruitment services, including ... Mutual of America Capital Management LLC Sells 5,192 Shares of Mercury Systems, Inc.",www.defenseworld.net,2024-07-14 21:14:28+00:00,2024-07-15 15:09:25
139,GovCon Index Jumped Back Into Positive Territory Last Week - ExecutiveBiz,"Fluor Corporation led last week's growth with gains of 6.97%. The Carlyle Group (+6.80%) was its closest follower, and Mercury Systems (+6.45%) also ...",executivebiz.com,2024-07-15 16:27:08+00:00,2024-07-15 19:09:29
140,Fibre Channel Products Market Leading Players Overview - Economica,"Mercury Systems, Inc. New Wave Design & Verification PDE Technology QLogic Corporation Studio Network Solutions Vicom Systems, Inc. ACON Optics ...",economica.ma,2024-07-15 15:56:42+00:00,2024-07-15 19:09:29
141,GovCon Index Recorded Growth Last Week - ExecutiveGov,"... company the top spot in the ranks. Second place was claimed by The Carlyle Group, which rose by 6.80%. Mercury Systems, which recorded gains of ...",executivegov.com,2024-07-15 21:17:43+00:00,2024-07-15 22:09:22
142,"MoneyTalks: Sequoia initiates coverage on marine tech stock Veem, sees smooth waters ahead",The Mercury. Hobart. Today. 3 ... Veem is a $237m market-capped marine technology company specialising in propulsion and stabilisation systems.,www.themercury.com.au,2024-07-15 21:13:17+00:00,2024-07-15 22:09:22
143,A Look Back at Defense Contractors Stocks' Q1 Earnings: CACI (NYSE:CACI) Vs The Rest ...,It was a weak quarter for the company with a miss of analysts' earnings and organic revenue estimates. Mercury Systems posted the weakest performance ...,ca.investing.com,2024-07-15 18:17:30+00:00,2024-07-15 22:09:22
144,"Tories received £50,000 donation from business linked to convicted billionaire | Milford Mercury",Prakash Hinduja was jailed by a Swiss court shortly before a company linked to him donated £50000 to the Conservative Party.,www.milfordmercury.co.uk,2024-07-15 15:55:04+00:00,2024-07-15 22:09:22
145,"RF Isolators and Circulators Market 2024 : Trends, Business - openPR.com","... Technologies Corp, Kete Microwave, L-3 Narda, M2 Global Technology, Microwave Communications Laboratories Inc, , Mercury Systems Inc., Mesa ...",www.openpr.com,2024-07-16 12:40:02+00:00,2024-07-16 18:09:00
146,"BNP Paribas Financial Markets Sells 80557 Shares of Celldex Therapeutics, Inc. (NASDAQ:CLDX)","Celldex Therapeutics, Inc, a biopharmaceutical company, engages in ... BNP Paribas Financial Markets Trims Position in Mercury Systems, Inc.",www.defenseworld.net,2024-07-16 08:54:25+00:00,2024-07-16 18:09:00
147,"Qenos September closure of Altona, Melbourne manufacturing plant | The Mercury",Qenos' last remaining manufacturing plant could be closed by as early as September as the company's administrators prepare to hand over the site ...,www.themercury.com.au,2024-07-16 06:38:57+00:00,2024-07-16 18:09:00
148,"Mercury Systems, Inc. (NASDAQ:MRCY) Position Reduced by Oppenheimer &amp; Co. Inc.","Read Mercury Systems, Inc. (NASDAQ:MRCY) Position Reduced by Oppenheimer & Co. Inc. at Defense World.",www.defenseworld.net,2024-07-16 19:51:49+00:00,2024-07-17 11:08:58
149,Defense Contractors Stocks Q1 Highlights: RTX (NYSE:RTX) | Investing.com Canada,"Shares Analysis by Stock Story covering: Northrop Grumman Corporation, Raytheon Company ... Weakest Q1: Mercury Systems (NASDAQ:MRCY) Founded in 1981, ...",ca.investing.com,2024-07-17 13:21:38+00:00,2024-07-17 15:09:11
150,No value on safety before power plant explosion: report | Lithgow Mercury,"The company conducted reviews into its systems but the response to fix issues ""rarely addressed the underlying causes"", Dr Brady found.",www.lithgowmercury.com.au,2024-07-17 02:50:14+00:00,2024-07-17 15:09:11
151,"System on Module Market Report 2024: Growth, Trends, Analysis, - openPR.com","Press release - The Business research company - System on Module Market ... Mercury Systems Inc., DFI Inc., AAEON Technology Inc., Avalue ...",www.openpr.com,2024-07-17 13:05:28+00:00,2024-07-17 18:09:21
152,"Director Sangiovanni Vincentelli Alberto sold $471,855 worth of shares (1,500 units at ...","... technology companies, also serves as a director of Mercury Systems, Inc. and Proterra Inc. Ms. Krakauer's appointment was confirmed by the Cadence ...",quantisnow.com,2024-07-17 21:28:56+00:00,2024-07-17 22:09:31
153,Growing with 7.9% CAGR | The Military Embedded System Market Share Reach USD 3.3 ...,"... system market analyzed in the research include Intel Corporation, Mercury Systems, Inc. Curtiss-Wright Corporation, Advantech Co., Ltd., BAE Systems ...",www.einnews.com,2024-07-17 18:48:27+00:00,2024-07-17 22:09:31
154,Firm behind pylons plan defends hosting event at Senedd | Milford Mercury,"The company has hit back at claims from the action group that the drinks reception was held to ""wine and dine"" Senedd members. A spokesperson for ...",www.milfordmercury.co.uk,2024-07-17 17:57:14+00:00,2024-07-17 22:09:31
155,Market Highlights: Microchip stocks crash on Biden's threat; and 5 ASX small caps to watch today,The Mercury. Hobart. Today. 5 °/ 11 °. Set your local weather. Home ... Building on recent collaborations with defense companies like Triton Systems ...,www.themercury.com.au,2024-07-18 00:18:25+00:00,2024-07-18 07:08:52
156,APELY vs. MRCY: Which Stock Is the Better Value Option? - Nasdaq,... company's expected earnings growth rate. MRCY currently has a PEG ... Mercury Systems Inc (MRCY) : Free Stock Analysis Report- To read this ...,www.nasdaq.com,2024-07-18 17:20:04+00:00,2024-07-18 18:09:04
157,Phoenix Mercury open downtown Phoenix practice facility - The Business Journals,"The Phoenix Mercury have unveiled the team's brand new, $100 million practice facility, just as the WNBA gears up for the 2024 All-Star Game ...",www.bizjournals.com,2024-07-18 16:10:22+00:00,2024-07-18 18:09:04
158,Sharrow Marine Unveils the Sharrow X10™ For Mercury V10 Motors | Business Wire,"Sharrow Marine, the industry leader in innovative marine propulsion technology, announced today the launch of the Sharrow X10™ Propeller series, ...",www.businesswire.com,2024-07-18 14:56:55+00:00,2024-07-18 18:09:04
159,"Envestnet Portfolio Solutions Inc. Purchases 10,189 Shares of Franklin U.S. Treasury Bond ...","... company in its most recent Form 13F filing with the Securities & Exchange Commission. ... Mercury Systems, Inc. (NASDAQ:MRCY) Shares Acquired by Texas ...",www.defenseworld.net,2024-07-18 09:35:58+00:00,2024-07-18 18:09:04
160,"Texas Permanent School Fund Corp Buys 525 Shares of PROG Holdings, Inc. (NYSE:PRG)","PROG Holdings, Inc (NYSE:PRG) is a financial technology holding company ... Mercury Systems, Inc. (NASDAQ:MRCY) Shares Acquired by Texas Permanent ...",www.defenseworld.net,2024-07-18 09:35:57+00:00,2024-07-18 22:08:59
161,"Mass IT outage shows how exposed services are, says expert | Bridgwater Mercury","He told BBC Radio Four's Today programme: “So if a company is using both CrowdStrike and Windows for its operating system, it seems that they get what ...",www.bridgwatermercury.co.uk,2024-07-19 17:29:29+00:00,2024-07-19 19:09:03
162,Imricor Medical Systems raising $35m to fund growth strategy - The Mercury,"The company's growth strategy is focused on three areas. It is completing the US FDA pivotal trial called VISABL-AFL for atrial flutter, expanding ...",www.themercury.com.au,2024-07-19 17:05:09+00:00,2024-07-19 19:09:03
163,IT outage fix deployed but 'some time' before all systems restored – CrowdStrike | Weston Mercury,The largest financial markets in the US and UK fell during the trading session as other companies were also affected. Today was not a security or ...,www.thewestonmercury.co.uk,2024-07-19 16:42:56+00:00,2024-07-19 19:09:03
164,"Widespread global tech outage disrupts flights, banks, hospitals and media outlets","The Mercury News- Business |- Widespread global tech ... technology outage disrupted flights, banks, media outlets and companies around the world.",www.mercurynews.com,2024-07-19 16:18:23+00:00,2024-07-19 19:09:03
165,Technology Officer reveals reason behind Microsoft crash | Stowmarket Mercury,"Earlier today, businesses and users who use Microsoft faced major outages in the UK and worldwide, with laptops and systems not working. Train ...",www.stowmarketmercury.co.uk,2024-07-19 14:08:31+00:00,2024-07-19 19:09:03
166,What is CrowdStrike - the prime suspect in global IT shutdown - Leicester Mercury,Cybersecurity experts said that the widespread access CrowdStrike's Falcon Sensor had to business systems meant an issue with the platform would have ...,www.leicestermercury.co.uk,2024-07-19 13:34:27+00:00,2024-07-19 19:09:03
167,Renesas Introduces Power Management with Voltage Monitoring Solution for Space-Grade ...,"ANDOVER, Mass., March 18, 2024 (GLOBE NEWSWIRE) -- Mercury Systems, Inc. (NASDAQ: MRCY, www.mrcy.com), a technology company that delivers mission ...",www.eejournal.com,2024-07-19 13:16:50+00:00,2024-07-19 19:09:03
168,Defense Contractors Stocks Q1 Recap: Benchmarking Mercury Systems (NASDAQ:MRCY),"Earnings results often indicate what direction a company will take in the months ahead. With Q1 now behind us, let's have a look at Mercury ...",finance.yahoo.com,2024-07-19 12:29:14+00:00,2024-07-19 19:09:03
169,"Texas Permanent School Fund Corp Has $1.36 Million Stake in NetScout Systems, Inc ...","NetScout Systems Company Profile. (Free Report). NetScout Systems ... Mercury Systems, Inc. (NASDAQ:MRCY) Shares Acquired by Texas Permanent ...",www.defenseworld.net,2024-07-18 18:22:17+00:00,2024-07-19 19:09:03
170,Bay Area courts provide minimal services amid global tech outage - The Mercury News,... company apologized and said a fix was on the way. The Superior Court of Alameda County stated that that “our two primary case management systems ...,www.mercurynews.com,2024-07-19 19:54:26+00:00,2024-07-19 22:08:55
171,IT outage fix deployed but 'some time' before all systems restored – CrowdStrike,"In the UK, Sky News briefly went off air on Friday morning and Britain's biggest train company ... Wymondham & Attleborough Mercury Wymondham & ...",www.wymondhamandattleboroughmercury.co.uk,2024-07-19 18:32:12+00:00,2024-07-19 22:08:55
