,Heading,Subheading,Publisher,Published,Found
172,Man Utd among sports clubs and broadcasters affected by global IT outage - Milford Mercury,"... company's most popular services, used by millions of business and people around the world. EFL clubs including Blackburn, Bolton, Bradford ...",www.milfordmercury.co.uk,2024-07-19 17:48:34+00:00,2024-07-19 22:08:55
173,Crowdstrike IT outage: All to know on cyber-security firm | Weston Mercury,"Additionally, companies which use Microsoft have had issues with people being able to access systems. Australia's home affairs ministry and ...",www.thewestonmercury.co.uk,2024-07-19 16:37:33+00:00,2024-07-19 22:08:55
174,"Software error disrupts flights, banks, media worldwide | Illawarra Mercury | Wollongong, NSW","Major infrastructure including airlines, train companies, stock exchanges, banks and media outlets have been disrupted after their computer systems ...",www.illawarramercury.com.au,2024-07-19 14:52:29+00:00,2024-07-19 22:08:55
175,What is CrowdStrike - the prime suspect in global IT shutdown - Leicester Mercury,"Major infrastructure including airlines, train companies, banks and media outlets have ground to a halt after their computer systems were knocked ...",www.leicestermercury.co.uk,2024-07-19 14:18:29+00:00,2024-07-19 22:08:55
176,"IT outage disrupts flights, banks, media worldwide | The Maitland Mercury","... systems. Some New Zealand banks said they were also offline. Microsoft 365 posted on X the company was ""working on rerouting the impacted traffic ...",www.maitlandmercury.com.au,2024-07-19 09:13:58+00:00,2024-07-19 22:08:55
177,"Cyber experts say vetting failed before global crash | Illawarra Mercury | Wollongong, NSW","Global banks, airlines, hospitals and government offices were disrupted. Advertisement. Ad. CrowdStrike released information to fix affected systems, ...",www.illawarramercury.com.au,2024-07-20 04:29:07+00:00,2024-07-20 07:09:07
178,Global IT outage: What happened and when will it be fixed? - Milford Mercury,... systems. Here is a closer look at what we know about the incident ... company said had been corrected. An error has occurred. Sign up to the ...,www.milfordmercury.co.uk,2024-07-20 03:47:49+00:00,2024-07-20 07:09:07
179,"Bay Area airports, hospitals, courts hit hard by global tech outage - The Mercury News","While the airport and its major airlines restored their affected systems by Friday afternoon, flights continued to experience residual delays, San ...",www.mercurynews.com,2024-07-20 08:35:08+00:00,2024-07-20 10:09:07
180,IT outage fix deployed but 'some time' before all systems restored – CrowdStrike,"In the UK, Sky News briefly went off air on Friday morning and Britain's biggest train company ... Great Yarmouth Mercury Great Yarmouth Mercury. This ...",www.greatyarmouthmercury.co.uk,2024-07-20 04:33:09+00:00,2024-07-20 10:09:07
181,"Internet outage latest | Airlines, businesses hit by global technology disruption - The Mercury","Azul Airlines, a Brazilian low-cost airline, said its check-in systems were affected, causing occasional flight delays. The company recommended that ...",www.pottsmerc.com,2024-07-19 16:39:58+00:00,2024-07-20 10:09:07
182,"Tesla 'Autopilot' killed father of two in Santa Clara County crash, family claims - The Mercury News",Jason Bolton turned on Tesla's controversial “Autopilot” system while driving his Model 3 to a business meeting in the Bay Area from his Fresno ...,www.mercurynews.com,2024-07-20 16:35:37+00:00,2024-07-20 18:08:59
183,Kansas Profile: Travis Scale Company is leading the 'weigh' | Features | themercury.com,"The company also offers checkweighers, dimensioning systems, force ... The Manhattan Mercury. To view our latest e-Edition click the image on ...",themercury.com,2024-07-20 16:03:19+00:00,2024-07-20 18:08:59
184,What the papers say – July 20 | Diss Mercury,The Independent says the issue with Windows systems caused “worldwide havoc ... The Times: IT company's error could be terminal for getaways ...,www.dissmercury.co.uk,2024-07-20 12:15:51+00:00,2024-07-20 18:08:59
185,GPs and pharmacies say global IT outage disruption to continue over weekend | Weston Mercury,"Across England, GP surgeries reported being unable to book appointments or access patient records as their EMIS Web system went down. Dr Fari Ahmad ...",www.thewestonmercury.co.uk,2024-07-20 11:41:09+00:00,2024-07-20 18:08:59
186,IT outage ends but sparks fears of a vulnerable system | The Maitland Mercury,Authorities are scrambling to understand how a simple software update caused an unprecedented IT outage that crippled companies...,www.maitlandmercury.com.au,2024-07-19 17:47:33+00:00,2024-07-20 18:08:59
187,NHS warns of continued disruption to GP services next week from global IT outage | Weston Mercury,NHS England said on Saturday afternoon that its systems were “coming back online in most areas” but “still running slightly slower than usual”. An NHS ...,www.thewestonmercury.co.uk,2024-07-20 16:50:37+00:00,2024-07-20 22:08:48
188,More flight cancellations and delays expected in wake of global IT outage | Bridgwater Mercury,... systems to fully recover. A flawed update rolled out by cybersecurity ... company at the centre of the outage warning it would take “some ...,www.bridgwatermercury.co.uk,2024-07-20 11:18:04+00:00,2024-07-20 22:08:48
189,Mercury Transit in Leo 2024: What Does it Mean for Each Zodiac Sign | - Times of India,"Mercury, is the planet of crystal-clear communication as well as technology-based communication systems, public understanding and lot more. In KPC ...",timesofindia.indiatimes.com,2024-07-20 11:02:31+00:00,2024-07-20 22:08:48
190,What Are Putin's Thermobaric Weapons? Russian Troops Deploy Heavy ... - Manhattan Mercury,"In this video, we delve into the recent reports of Russian troops using heavy flamethrower systems ... Company is leading the 'weigh'- EYESTONE ...",themercury.com,2024-07-21 17:48:57+00:00,2024-07-21 19:08:53
191,"Mercury Systems (NASDAQ:MRCY) shareholders are up 7.1% this past week, but still in the ...","Mercury Systems, Inc. ( NASDAQ:MRCY ) shareholders should be happy to see the share price up 21% in the last quarter...",simplywall.st,2024-07-21 15:56:58+00:00,2024-07-21 19:08:53
192,"NMI Holdings, Inc.'s (NASDAQ:NMIH) Business And Shares Still Trailing The Market",... company? Then our free report on NMI Holdings will help you uncover ... (NASDAQ:HOLX)?- Simply Wall St- Mercury Systems (NASDAQ ...,simplywall.st,2024-07-21 15:56:58+00:00,2024-07-21 19:08:53
193,Blair William &amp; Co. IL Makes New $3.30 Million Investment in Korn Ferry (NYSE:KFY),"The company provides executive search services to recruit board ... IL Lowers Stock Position in Mercury Systems, Inc. (NASDAQ:MRCY)- Blair ...",www.defenseworld.net,2024-07-21 14:54:34+00:00,2024-07-21 19:08:53
194,"GPs need time to recover from global IT outage, warns BMA - Weston Mercury",The British Medical Association (BMA) said its GP committee would continue to talk to NHS England and patient record system supplier EMIS to secure a ...,www.thewestonmercury.co.uk,2024-07-21 13:40:39+00:00,2024-07-21 19:08:53
195,What to do with deli meats as CDC investigates listeria outbreak - The Mercury News,"Listeria infections are especially dangerous for people older than 65 and those with weakened immune systems, according to the CDC. Victims of this ...",www.mercurynews.com,2024-07-21 09:10:42+00:00,2024-07-21 19:08:53
196,Mercury Systems (NASDAQ:MRCY) Trading Up 4.5% - Defense World,JPMorgan Chase & Co. upped their target price on shares of Mercury Systems from $24.00 to $26.00 and gave the company a “neutral” rating in a research ...,www.defenseworld.net,2024-07-21 14:22:27+00:00,2024-07-21 22:08:57
197,CrowdStrike failure now a matter of national security | The Mercury,"If CrowdStrike can't defend their big corporate clients against a failed software upgrade, then how can it protect them against more nefarious ...",www.themercury.com.au,2024-07-21 08:48:04+00:00,2024-07-21 22:08:57
198,7 Suffolk roadworks to avoid on your journey this week - Sudbury Mercury,"The company is replacing pipes in the area, according to one.network. Closures will be in place until August 2. Britannia Road, Ipswich. Britannia ...",www.sudburymercury.co.uk,2024-07-21 21:07:00+00:00,2024-07-22 03:09:01
199,Minister: Majority of sectors have mostly recovered following global IT outage | Bridgwater Mercury,"Cabinet Office minister Ellie Reeves said the UK transport system is “running normally” and systems are back online for GPs, although NHS England and ...",www.bridgwatermercury.co.uk,2024-07-22 16:59:34+00:00,2024-07-22 18:08:55
200,Mercury land partnership with beauty brand Laneige - Sports Business Journal,"The parent company of Laneige, Amorepacific US GM Julien Bouzitat said that the company ... systems. They are usually only set in response to actions ...",www.sportsbusinessjournal.com,2024-07-22 16:53:27+00:00,2024-07-22 18:08:55
201,GovCon Index Marked Another Week-on-Week Gain - ExecutiveBiz,"Mercury Systems and four other GCI constituents were the only stocks that finished in green on Friday. On the other hand, the 25 decliners were ...",executivebiz.com,2024-07-22 16:28:10+00:00,2024-07-22 18:08:55
202,Mitsubishi UFJ Asset Management Co. Ltd. Trims Stock Position in Inspire Medical Systems ...,"Sells 1,120 Shares of Mercury Systems, Inc. Daily Ratings & News for Inspire Medical Systems. Complete the form below to receive the latest headlines ...",www.defenseworld.net,2024-07-22 15:15:02+00:00,2024-07-22 18:08:55
203,Ofcom fines BT £17.5 million for 'catastrophic failure' - Diss Mercury,BT has been fined £17.5 million by regulator Ofcom after the company failed to respond to a more than 10-hour outage of its emergency call system ...,www.dissmercury.co.uk,2024-07-22 15:11:27+00:00,2024-07-22 18:08:55
204,HID unveils Mercury MP controllers for enhanced cybersecurity - SourceSecurity.com,"The company has an innovative product that enables smartphone NFC keyless entry for buildings, regardless of... ... Ajax Systems, Europe's largest ...",www.sourcesecurity.com,2024-07-22 13:47:45+00:00,2024-07-22 18:08:55
205,HID's Next-Gen Mercury MP Controllers Boosts Flexibility - SecurityInformed.com,"As technology advances, access control systems require robust encryption and advanced threat detection. Mercury MP Controllers. The new Mercury MP ...",www.securityinformed.com,2024-07-22 13:46:47+00:00,2024-07-22 18:08:55
206,Phoenix Mercury partner with Korean beauty brand Laneige - The Business Journals,... Mercury's corporate headquarters. GET TO KNOW YOUR CITY. Find Local ... systems. They are usually only set in response to actions made by you ...,www.bizjournals.com,2024-07-22 12:47:52+00:00,2024-07-22 18:08:55
207,French media group Canal+ to list in London as parent Vivendi plots split | Stowmarket Mercury,"... company Vivendi. In plans announced on Monday, Vivendi will split its three main subsidiaries, Canal+, Havas and Lagardere, into separate companies.",www.stowmarketmercury.co.uk,2024-07-22 10:32:23+00:00,2024-07-22 18:08:55
208,"Digital banking startup Mercury abruptly shuttered service for startups in Ukraine, Nigeria ...","In an apparent response to that federal scrutiny and as part of the company's “ongoing commitment to compliance,” a Mercury spokesperson told ...",techcrunch.com,2024-07-23 17:31:27+00:00,2024-07-23 19:08:55
209,"States strike out on their own on AI, privacy regulation - Virginia Mercury",... business practices upon AI systems. These technologies have become the backbone of huge developments like power grids and space exploration. Most ...,virginiamercury.com,2024-07-23 15:34:06+00:00,2024-07-23 19:08:55
210,Mercury Bio Announces Biomolecular Research Project to Include Los Alamos National ...,"Mercury Bio (www.mercurybio.com), a New Mexico-based biotech company focused on the development of a novel new drug-delivery platform, ...",ca.finance.yahoo.com,2024-07-23 13:16:51+00:00,2024-07-23 19:08:55
211,Mitsubishi UFJ Asset Management Co. Ltd. Reduces Stake in Allison Transmission Holdings ...,"Sells 1,120 Shares of Mercury Systems, Inc. Daily Ratings & News for Allison Transmission. Complete the form below to receive the latest headlines and ...",www.defenseworld.net,2024-07-22 20:36:46+00:00,2024-07-23 19:08:55
212,Mercury Systems to Report Fourth Quarter and Full Fiscal Year 2024 Financial Results on ...,"ANDOVER, Mass., July 23, 2024 -- Mercury Systems Inc. , a technology company that delivers mission-critical processing power to the edge, ...",www.marketscreener.com,2024-07-23 20:24:44+00:00,2024-07-23 22:08:58
213,Mercury Systems to Report Fourth Quarter and Full Fiscal Year 2024 Financial Results on ...,"ANDOVER, Mass., July 23, 2024 (GLOBE NEWSWIRE) -- Mercury Systems Inc. (NASDAQ: MRCY, www.mrcy.com), a technology company that delivers ...",finance.yahoo.com,2024-07-23 20:21:34+00:00,2024-07-23 22:08:58
214,Google parent Alphabet beats quarterly revenue estimates - Yahoo Finance,"Mercury Systems to Report Fourth Quarter and Full Fiscal Year 2024 Financial Results on August 13, 2024. 4 minutes ago. Business Wire. TechnipFMC ...",ca.finance.yahoo.com,2024-07-23 20:19:25+00:00,2024-07-23 22:08:58
215,Renowned scientist to discuss role of livestock production in today's society - Manhattan Mercury,"Scientist Peer Ederer, whose international company conducts research ... Systems lecture Oct. 7 at KSU. Ederer's talk – titled 'Scientific ...",themercury.com,2024-07-23 19:14:16+00:00,2024-07-23 22:08:58
216,Starmer promises bosses it will be easier to build roads and warehouses | Great Yarmouth Mercury,... Systems area at the Farnborough International Airshow in Hampshire earlier this week (PA) ... Company fined £3m after death of demolition worker ...,www.greatyarmouthmercury.co.uk,2024-07-23 17:12:35+00:00,2024-07-23 22:08:58
217,Signals Intelligence (SIGINT) Market Analysis of Trends and Forecasts Hits a CAGR of 4.5 ...,"... Technologies Corporation, Elbit Systems Ltd., General Dynamics Corporation, Rheinmetall AG, L3Harris Technologies, Inc., and Mercury Systems, Inc.",tech.einnews.com,2024-07-23 15:08:31+00:00,2024-07-23 22:08:58
218,"Water firms' performance on sewage spills 'unacceptable', regulator says | Sudbury Mercury","The Environment Agency said there were 47 serious pollution incidents last year – up from 44 in 2022. Four companies – Thames Water, Anglian Water, ...",www.sudburymercury.co.uk,2024-07-23 13:37:01+00:00,2024-07-23 22:08:58
219,War on drones looks a winner for ASX stock | The Mercury,"The company is recognised as a pioneer in counter-unmanned aerial systems or C-UAS technology. C-UAS is a term that includes the detection, tracking, ...",www.themercury.com.au,2024-07-23 07:46:56+00:00,2024-07-23 22:08:58
220,Ushur appoints Mike Price CRO as it continues rapid growth in delivering AI solutions for ...,Mercury Systems to Report Fourth Quarter and Full Fiscal Year 2024 ... technology company with next generation Autonomous Intelligence products.,www.itnewsonline.com,2024-07-24 01:38:20+00:00,2024-07-24 03:09:33
221,CrowdStrike: More machines fixed but details on what caused meltdown still pending,"The Mercury News. ☰ Menu. CrowdStrike: More machines ... UPDATED: July 23, 2024 at 6:18 a.m.. Categories: Business, National News, News, Technology.",www.mercurynews.com,2024-07-23 23:58:25+00:00,2024-07-24 03:09:33
222,"Single Board Computer Market 2024 Report By Key Companies,","... Mercury Systems Inc., Digi International Inc., Adlink Technology Inc ... Inc., Olimex Ltd., Xilinx Inc., Arbor Solutions Inc. Contents of the ...",www.openpr.com,2024-07-23 22:37:44+00:00,2024-07-24 03:09:33
223,Mercury Systems to Report Fourth Quarter and Full Fiscal Year 2024 Financial Results on ...,"The company will host a conference call and webcast at 5:00 p.m. ET on the same day to discuss the results, business highlights, and outlook.",www.stocktitan.net,2024-07-23 20:18:26+00:00,2024-07-24 03:09:33
224,"CrowdStrike: quality-control bug led to global outage | Illawarra Mercury | Wollongong, NSW","That triggered an ""unexpected exception"" that caused a Windows operating system crash, the company said. CrowdStrike has said a ""significant ...",www.illawarramercury.com.au,2024-07-24 17:33:47+00:00,2024-07-24 18:09:40
225,CrowdStrike blames bug that led to global tech outage | Weston Mercury,"That triggered an “unexpected exception” that caused a Windows operating system crash, the company said. As part of the new prevention measures ...",www.thewestonmercury.co.uk,2024-07-24 13:47:45+00:00,2024-07-24 18:09:40
226,Mercury Bank to Close Accounts in Prohibited Countries by August - FinTech Alliance,"US fintech company Mercury Bank has announced it will close accounts for users in several prohibited countries, including Zimbabwe, by August 22, ...",fintech-alliance.com,2024-07-24 13:47:33+00:00,2024-07-24 18:09:40
227,Analog chipmaker TI beats second-quarter profit estimates - Yahoo Finance,Business Wire. Community Health Systems Releases 2024 Community Impact Report. 10 minutes ago. GlobeNewswire. Mercury Systems to Report Fourth Quarter ...,ca.finance.yahoo.com,2024-07-23 20:24:55+00:00,2024-07-24 18:09:40
228,BlackLine Announces Date for Second Quarter 2024 Earnings Release and Conference Call,BlackLine is a global company with operations in major business ... Mercury Systems to Report Fourth Quarter and Full Fiscal Year 2024 ...,www.itnewsonline.com,2024-07-24 06:28:02+00:00,2024-07-24 21:09:35
229,Mercury Systems to Report Fourth Quarter and Full Fiscal Year 2024 Financial Results on ...,"ANDOVER, Mass., July 23, 2024 (GLOBE NEWSWIRE) -- Mercury Systems Inc. (NASDAQ: MRCY, www.mrcy.com), a technology company that delivers mission-.",markets.businessinsider.com,2024-07-23 22:48:39+00:00,2024-07-24 21:09:35
230,"Radar Market Shares, Growth Analysis, Key Insights, Size - openPR.com","... Mercury Systems Inc., Reutech Radar Systems ... Technologies Inc., Echodyne Corporation, Blighter Surveillance Systems, Robin Radar Systems B.V.",www.openpr.com,2024-07-24 17:33:46+00:00,2024-07-25 00:09:29
231,MIL-OSI: Mercury Systems to Report Fourth Quarter and Full Fiscal Year 2024 Financial ...,"In addition, Company representatives may answer questions concerning business and financial developments and trends, the Company's view on earnings ...",foreignaffairs.co.nz,2024-07-24 08:31:01+00:00,2024-07-25 00:09:29
232,"Mercury may have 10-mile thick layer of diamonds beneath its surface, NASA craft discovers","Mercury, the solar system's smallest planet, may have vast riches ... Company Logo. This page is not available in your area. Strictly ...",nypost.com,2024-07-25 12:21:16+00:00,2024-07-25 13:09:30
233,CrowdStrike's tests failed to flag bug behind epic crash - The Mercury News,That undetected error crashed Windows systems and kicked off one of the most spectacular rolling IT failures in history. The US company is trying to ...,www.mercurynews.com,2024-07-25 12:07:31+00:00,2024-07-25 13:09:30
234,Mercury Retrograde Will Affect Each Zodiac Sign August 2024 - StyleCaster,"... systems during this time. However, things could get even more emotional and intense once Mercury retrogrades back into your eighth house of ...",stylecaster.com,2024-07-25 11:17:43+00:00,2024-07-25 13:09:30
235,"Mercury has a layer of diamond up to 10 miles thick, scientists suggest - More Radio","It may be the smallest planet in the solar system but Mercury could be hiding a big secret ... Business Centre, 6 Jubilee Road, Burgess Hill ...",www.moreradio.online,2024-07-25 10:01:48+00:00,2024-07-25 13:09:30
236,Joby Aviation takes 523-mile hydrogen-electric flight above Monterey County,The Mercury News. ☰ Menu. Joby Aviation takes 523-mile ... Joby's hydrogen-electric demonstrator is part of the Company's future technology ...,www.mercurynews.com,2024-07-25 00:25:31+00:00,2024-07-25 13:09:30
237,"At 4.1% CAGR, Signals Intelligence Market Size Will be - GlobeNewswire",Mercury Systems (US); Northrop Grumman (US). Inquire more about this ... The company specializes in providing exceptional market intelligence and in- ...,www.globenewswire.com,2024-07-25 12:22:41+00:00,2024-07-25 16:09:36
238,State Board of Administration of Florida Retirement System Has $1.73 Million Stock Position ...,"State Board of Administration of Florida Retirement System Buys 5,799 Shares of Mercury Systems, Inc. (NASDAQ:MRCY). You might be interested in ...",www.defenseworld.net,2024-07-25 18:21:47+00:00,2024-07-25 21:09:28
239,Revolut secures UK banking licence after three-year wait - Sudbury Mercury,"But the road to becoming a bank has been challenging, with the company repeatedly saying that approval was just around the corner. ... systems it will ...",www.sudburymercury.co.uk,2024-07-25 15:08:10+00:00,2024-07-25 21:09:28
240,Global Naval Unmanned Systems Industry Research 2024-2029: Key Companies to Watch ...,"Charli XCX nominated for 2024 Mercury Prize. 5 minutes ago. Investor's Business Daily. Dow Jones Reverses On GDP, Inflation Data; Nvidia Below Key ...",uk.finance.yahoo.com,2024-07-25 13:52:18+00:00,2024-07-25 21:09:28
241,ASX cyber stocks watching out for us | The Mercury,"The global IT outage originated from a flawed software update released by the company, triggering widespread failures across critical industries such ...",www.themercury.com.au,2024-07-26 02:11:45+00:00,2024-07-26 04:09:27
242,"Mercury has a layer of diamond up to 10 miles thick, scientists suggest - Island FM",Just Played Songs. 12:43pm. Love Me Like ...,www.islandfm.com,2024-07-25 11:47:06+00:00,2024-07-26 04:09:27
243,How Homegrown Fintech Verto Aims To Fill Void Of Mercury Fallout In Africa - WeeTracker,The challenges with Mercury and Float illustrate the broader issue of access to global banking systems. ... The startup is a global business-facing ...,weetracker.com,2024-07-26 17:14:04+00:00,2024-07-26 18:09:35
244,"As California wildfires rage, one Bay Area insurer uses AI for coverage - The Mercury News","While insurers like State Farm and Allstate are retreating to avoid costly fire damage claims, Delos is going all in. The SF-based company has ...",www.mercurynews.com,2024-07-26 19:36:20+00:00,2024-07-26 21:09:33
245,"Natixis Invests $693,000 in Mercury Systems, Inc. (NASDAQ:MRCY) - MarketBeat","Natixis acquired a new position in Mercury Systems, Inc. (NASDAQ:MRCY - Free Report) in the first quarter, according to the company in its most ...",www.marketbeat.com,2024-07-26 16:46:28+00:00,2024-07-26 21:09:33
246,Did NASA's MESSENGER discover a hidden diamond treasure on Mercury?,Company Logo. We Care About Your Privacy. We and our 777 partners store ... systems. They are usually only set in response to actions made by ...,m.economictimes.com,2024-07-27 07:16:15+00:00,2024-07-27 16:09:30
247,"UniSuper Management Pty Ltd Buys Shares of 11601 Mercury Systems, Inc. (NASDAQ:MRCY)",Get Mercury Systems alerts: Several other hedge funds have also made changes to their positions in the business. Daiwa Securities Group Inc. lifted ...,www.defenseworld.net,2024-07-28 13:14:55+00:00,2024-07-28 15:09:23
248,Mercury Monitoring Systems Market Performance Metrics: Measuring Success,Nippon Instruments Corporation; Ohio Lumex; Environnement S.A; Opsis AB. Mercury Monitoring Systems Market Competitive Landscape. The competitive ...,moosegazette.com,2024-07-28 12:22:33+00:00,2024-07-28 21:09:30
249,UniSuper Management Pty Ltd Purchases New Holdings in Mercury General Co. (NYSE:MCY),Institutional investors and hedge funds own 42.39% of the company's stock. Mercury General Stock Performance. MCY opened at $58.14 on Friday. The ...,www.defenseworld.net,2024-07-28 14:50:11+00:00,2024-07-29 07:09:32
250,Multiple places in Japan see mercury top 40 C for first time this year,Scorching temperatures swept Japan on Monday due to high pressure systems ... Company info- Privacy policy- Link policy- Announcements- Work with us ...,www.japantimes.co.jp,2024-07-29 12:21:02+00:00,2024-07-29 13:09:34
251,Energy Focus (NASDAQ:EFOI) Research Coverage Started at StockNews.com,"The construction company reported ($0.13) earnings per share for the quarter. ... Gabelli Funds LLC Buys 5,000 Shares of Mercury Systems, Inc. (NASDAQ ...",www.defenseworld.net,2024-07-29 11:58:30+00:00,2024-07-29 16:09:35
252,KeyCorp (NYSE:KEY) Receives Average Rating of “Moderate Buy” from Brokerages,"The company offers various deposits, investment products and services ... Gabelli Funds LLC Buys 5,000 Shares of Mercury Systems, Inc. (NASDAQ ...",www.defenseworld.net,2024-07-29 18:30:51+00:00,2024-07-29 21:09:30
253,"Post Office was 'very badly run' with 'creaky' IT infrastructure, says ex-chair - Milford Mercury","... company after it had experienced a 10-year-long decline in profitability. ... It was 15 years old by that stage, most IT systems don't last more than 10 ...",www.milfordmercury.co.uk,2024-07-29 17:32:05+00:00,2024-07-29 21:09:30
254,Mercury Insurance Partners With iHeart Radio to Honor Community Heroes,... Systems- FOX44 Apple Sport Chevy Storm ... For more information visit www.MercuryInsurance.com or follow the company on Twitter or Facebook.,www.fox44news.com,2024-07-29 16:18:25+00:00,2024-07-29 21:09:30
255,Fiber Optic Fusion Splicing Service Market 2024 [SWOT] Analysis - Economica,"The Mercury Group, Diamond H Services, Inc., iFiber Optix, Electronauts ... Systems Inc., Radiant Vision Systems- Non Destructive Testing ...",economica.ma,2024-07-29 15:40:36+00:00,2024-07-29 21:09:30
256,California electric bills have essentially doubled over the past decade - The Mercury News,"Consider the bear of wildfire mitigation, a prime driver. The quicker and less expensive way for an electric company to harden its system is to use ...",www.mercurynews.com,2024-07-29 21:17:29+00:00,2024-07-30 00:09:19
