,Heading,Subheading,Publisher,Published,Found
0,CA Public Utilities Commission will decide if San Jose Water can increase its rates 11% in 2025,... Mercury News- Business |- CA Public Utilities Commission will decide if ... A water filtration system at the San Jose Water Company Columbine site ...,www.mercurynews.com,2024-06-18 13:06:55,2024-06-18 15:18:18
1,Rocket Lab rides new launch deal to four-month high (NASDAQ:RKLB) | Seeking Alpha,"... company Synspective committed to ten launches. Roth MKM reiterated a Buy rating ... Mercury Systems, Inc. VVX, -, -. V2X, Inc. KTOS, -, -. Kratos ...",seekingalpha.com,2024-06-18 09:44:55,2024-06-18 15:18:18
2,Farage's Reform UK consults lawyers over candidate vetting firm | Bridgwater Mercury,"The company said its working assumption had been that it would have had ... Given the explicit need for candidate consent, as well as our systems ...",www.bridgwatermercury.co.uk,2024-06-18 08:09:04,2024-06-18 15:18:18
3,Urgent flea warning to all cat and dog owners in the UK | Milford Mercury,"However, Jamie Walker, an experienced vet and technical services manager at global veterinary pharmaceuticals company, Dechra, explained: “Many ...",www.milfordmercury.co.uk,2024-06-18 04:02:22,2024-06-18 15:18:18
4,WealthCheck boss Sam Mitchell facing series of staff claims as creditors circle - The Mercury,Mr McKenzie alleges he faced a hostile work environment and saw his access to company systems cut off without cause. “At no point was I given a ...,www.themercury.com.au,2024-06-18 03:29:21,2024-06-18 15:18:18
5,Zeller's deal with Oracle opens the door for start-up's expansion - The Mercury,"... systems were “the actual nerve centre of the business”. Zeller has picked up several major corporate clients since its launch, such as pizza giant ...",www.themercury.com.au,2024-06-18 01:33:49,2024-06-18 15:18:18
6,Display for Avionics Applications Market size is set to grow by USD 1.32 billion from 2024 ...,"KG, Elbit Systems Ltd., Excelitas Technologies Corp., FDS Avionics Corp ... Mercury Systems Inc., Nytric Ltd., Parker Hannifin Corp., RTX Corp ...",finance.yahoo.com,2024-06-18 00:24:17,2024-06-18 15:18:18
7,3 Defense Stocks to Sell in June Before They Crash &amp; Burn | Markets Insider,"Mercury Systems (NASDAQ:MRCY) is the final company to make this list of top defense stocks to sell this summer. Unlike the other entries, Mercury does ...",markets.businessinsider.com,2024-06-17 16:12:16,2024-06-18 15:18:18
8,INTEGRITY-178 tuMP RTOS Enters Verification Phase for Multicore DO-178C DAL A ...,Mercury Systems – Innovation that matters<sup>®</sup> Mercury Systems is a technology company that delivers mission-critical processing power to the edge to ...,themalaysianreserve.com,2024-06-17 15:23:27,2024-06-18 15:18:18
9,CA Public Utilities Commission will decide if San Jose Water can increase its rates 11% in 2025,... Mercury News- Business |- CA Public Utilities Commission will decide if ... A water filtration system at the San Jose Water Company Columbine site ...,www.mercurynews.com,2024-06-18 18:06:55+00:00,2024-06-19 17:08:55
10,Rocket Lab rides new launch deal to four-month high (NASDAQ:RKLB) | Seeking Alpha,"... company Synspective committed to ten launches. Roth MKM reiterated a Buy rating ... Mercury Systems, Inc. VVX, -, -. V2X, Inc. KTOS, -, -. Kratos ...",seekingalpha.com,2024-06-18 14:44:55+00:00,2024-06-19 17:08:55
11,Farage's Reform UK consults lawyers over candidate vetting firm | Bridgwater Mercury,"The company said its working assumption had been that it would have had ... Given the explicit need for candidate consent, as well as our systems ...",www.bridgwatermercury.co.uk,2024-06-18 13:09:04+00:00,2024-06-19 17:08:55
12,Urgent flea warning to all cat and dog owners in the UK | Milford Mercury,"However, Jamie Walker, an experienced vet and technical services manager at global veterinary pharmaceuticals company, Dechra, explained: “Many ...",www.milfordmercury.co.uk,2024-06-18 09:02:22+00:00,2024-06-19 17:08:55
13,WealthCheck boss Sam Mitchell facing series of staff claims as creditors circle - The Mercury,Mr McKenzie alleges he faced a hostile work environment and saw his access to company systems cut off without cause. “At no point was I given a ...,www.themercury.com.au,2024-06-18 08:29:21+00:00,2024-06-19 17:08:55
14,Zeller's deal with Oracle opens the door for start-up's expansion - The Mercury,"... systems were “the actual nerve centre of the business”. Zeller has picked up several major corporate clients since its launch, such as pizza giant ...",www.themercury.com.au,2024-06-18 06:33:49+00:00,2024-06-19 17:08:55
15,Display for Avionics Applications Market size is set to grow by USD 1.32 billion from 2024 ...,"KG, Elbit Systems Ltd., Excelitas Technologies Corp., FDS Avionics Corp ... Mercury Systems Inc., Nytric Ltd., Parker Hannifin Corp., RTX Corp ...",finance.yahoo.com,2024-06-18 05:24:17+00:00,2024-06-19 17:08:55
16,3 Defense Stocks to Sell in June Before They Crash &amp; Burn | Markets Insider,"Mercury Systems (NASDAQ:MRCY) is the final company to make this list of top defense stocks to sell this summer. Unlike the other entries, Mercury does ...",markets.businessinsider.com,2024-06-17 21:12:16+00:00,2024-06-19 17:08:55
17,INTEGRITY-178 tuMP RTOS Enters Verification Phase for Multicore DO-178C DAL A ...,Mercury Systems – Innovation that matters<sup>®</sup> Mercury Systems is a technology company that delivers mission-critical processing power to the edge to ...,themalaysianreserve.com,2024-06-17 20:23:27+00:00,2024-06-19 17:08:55
18,Tod Brindlinger Joins Mercury as Operations SVP - ExecutiveBiz,"Tod Brindlinger, former vice president at L3Harris Technologies, was appointed senior VP of operations at Mercury Systems ... The company said Tuesday ...",executivebiz.com,2024-06-19 21:52:25+00:00,2024-06-20 04:08:42
19,Corsair for Business (CRSR) Partners with TD SYNNEX (SNX) - StreetInsider,Serious News for Serious Traders! Try StreetInsider.com Premium Free! You May Also Be Interested In. Mercury Systems (MRCY) Appoints Tod Brindlinger ...,www.streetinsider.com,2024-06-19 19:44:17+00:00,2024-06-20 04:08:42
20,Global Signals Intelligence (SIGINT) Market Report 2024: Analysis and Forecast (2014-2030),"Company Profiles: Coverage of major players such as BAE Systems, Cobham ... Mercury Systems. Northrop Grumman. Raytheon. Rheintmetall. Rolta India. Saab.",ca.finance.yahoo.com,2024-06-19 16:07:39+00:00,2024-06-20 04:08:42
21,Weatherman sun and thunderstorms for Glastonbury Festival - Weston Mercury,"He studies a variety of mapping systems for pressure patterns, temperature and wind speeds and interprets the data to form a forecast. He said the ...",www.thewestonmercury.co.uk,2024-06-19 12:04:33+00:00,2024-06-20 04:08:42
22,"Mercury Appoints Senior Vice President of Operations, - GlobeNewswire","ANDOVER, Mass., June 18, 2024 (GLOBE NEWSWIRE) -- Mercury Systems, Inc. (NASDAQ: MRCY, www.mrcy.com), a technology company that delivers ...",www.globenewswire.com,2024-06-19 09:11:25+00:00,2024-06-20 04:08:42
23,Mercury Systems (MRCY) Appoints Tod Brindlinger as Senior Vice President of Operations,"Mercury Systems, Inc. (NASDAQ: MRCY), a technology company that delivers mission-critical processing power to the edge, today announced the ...",www.streetinsider.com,2024-06-19 09:09:59+00:00,2024-06-20 04:08:42
24,"Mercury Systems, Inc. Announces the Appointment of Tod Brindlinger as Senior Vice ...","Mercury Systems, Inc. announced the appointment of Tod Brindlinger as Senior Vice President of Operations, effective June 10, 2024.",www.marketscreener.com,2024-06-19 03:47:58+00:00,2024-06-20 04:08:42
25,"AT&amp;T must keep providing landline service in California, regulator rules - The Mercury News",Subscribe Today Get digital access for just 99 cents! More in Technology. The company “shut all systems ...,www.mercurynews.com,2024-06-20 23:58:36+00:00,2024-06-21 05:08:50
26,Massachusetts defense tech company to cut 100 jobs - The Business Journals,"Mercury Systems is headquartered in Andover, Massachusetts. Drdaaz/Wikipedia. Hannah Green. By Hannah Green – Reporter, ...",www.bizjournals.com,2024-06-20 17:01:48+00:00,2024-06-21 05:08:50
27,Moody National Bank Trust Division Makes New Investment in Ingevity Co. (NYSE:NGVT),"(NYSE:NGVT – Free Report) during the 1st quarter, according to the company ... Moody National Bank Trust Division Raises Position in Mercury Systems, ...",www.defenseworld.net,2024-06-20 16:39:53+00:00,2024-06-21 05:08:50
28,"Moody National Bank Trust Division Raises Position in Mercury Systems, Inc. (NASDAQ:MRCY)",Get Mercury Systems alerts: Other hedge funds and other institutional investors have also recently bought and sold shares of the company. Vanguard ...,www.defenseworld.net,2024-06-20 16:39:52+00:00,2024-06-21 05:08:50
29,"Alliance will no longer tolerate Stormont's 'toxic' veto system, says Long | Weston Mercury","“But it's incredibly toxic in terms of how we do business, that we still have that imbalance in terms of how we operate together. It doesn't enhance ...",www.thewestonmercury.co.uk,2024-06-20 12:45:25+00:00,2024-06-21 05:08:50
30,U.S. Army Reveals Identity Of Raging Parakeet UAS | Aviation Week Network,Already a member of AWIN or subscribe to Aerospace Daily & Defense Report through your company? ... 'Challenged Programs' Still Dogging Mercury Systems.,aviationweek.com,2024-06-22 02:29:43+00:00,2024-06-22 05:08:46
31,Lockheed Martin secures $977.5 million contract extension for missile-warning satellites,"The recent contract modification, known as Phase 2.1B, extends the company's ... L3Harris taps Mercury Systems to supply solid-state data recorders for ...",spacenews.com,2024-06-22 02:09:45+00:00,2024-06-22 05:08:46
32,"Five things, plus a Celtics rolling rally, summer solstice, CIO awards, minority businesses ...",Massachusetts defense tech company to cut 100 jobs. Hannah also reports that corporate restructuring that Mercury Systems Inc. announced earlier ...,www.bizjournals.com,2024-06-21 21:44:23+00:00,2024-06-22 05:08:46
33,Rugged Data Systems for Military Operations - A Buyer's Guide - Air Force Technology,... Services- Company Releases- White Papers- Videos- Buyer's Guides- Partner Content- Buyer's Guides ... Mercury Systems' Secure Rackmount Servers ...,www.airforce-technology.com,2024-06-21 21:08:52+00:00,2024-06-22 05:08:46
34,Mercury Systems (NASDAQ:MRCY) Shares Up 5.5% - MarketBeat,Several equities research analysts have recently commented on the company. JPMorgan Chase & Co. boosted their price target on Mercury Systems from ...,www.marketbeat.com,2024-06-21 20:42:48+00:00,2024-06-22 05:08:46
35,Break it Down: Imricor has its finger on the pulse | The Mercury,Break it down host Fraser Palamara talks the early success Imricor Medical Systems has seen in its trial in search of FDA approval. Stockhead TV.,www.themercury.com.au,2024-06-21 16:04:50+00:00,2024-06-22 05:08:46
36,"Mercury Systems, Inc. (NASDAQ:MRCY) Shares Sold by Quadrature Capital Ltd","Mercury Systems, Inc, a technology company, manufactures and sells components, products, modules, and subsystems for aerospace and defense industries ...",www.defenseworld.net,2024-06-21 15:03:23+00:00,2024-06-22 05:08:46
37,"How Much Of Mercury Systems, Inc. (NASDAQ:MRCY) Do Institutions Own?","The big shareholder groups in Mercury Systems, Inc. (NASDAQ:MRCY) have power over the company. Institutions will often...",nz.news.yahoo.com,2024-06-22 19:37:51+00:00,2024-06-23 05:08:52
38,Boba cafe brings Viet cuisine to Alum Rock neighborhood - The Mercury News,"After receiving his bachelor's degree in business and information systems from San Jose State University in 1997, Nguyen started his company, Bay ...",www.mercurynews.com,2024-06-25 03:01:48+00:00,2024-06-25 05:08:48
39,"NHS cyber attack data taken from Synnovis system, provider confirms - Diss Mercury","Synnovis, which provides services to NHS trusts and GP services, primarily in south-east London, was the victim of a cyber attack on June 3.",www.dissmercury.co.uk,2024-06-24 23:04:44+00:00,2024-06-25 05:08:48
40,Disruption to travellers continues after Manchester Airport power cut | Great Yarmouth Mercury,"The power outage, which hit systems in the early hours of Sunday, meant that about 70 departures and 50 arrivals were axed, according to aviation ...",www.greatyarmouthmercury.co.uk,2024-06-24 15:45:19+00:00,2024-06-25 05:08:48
41,Global Electronic Warfare Market to Surpass 27.71 billion by 2031 As Revealed In New Report,"Raytheon Company (US); Northrop Grumman Corporation (US); Thales Group ... Mercury Systems, Inc. (US); Airbus Defense and Space (France); General ...",www.whatech.com,2024-06-24 11:20:13+00:00,2024-06-25 05:08:48
42,American International Group Inc. Has $4.74 Million Stock Holdings in Lumentum ... - Defense World,"The fund owned 90,500 shares of the technology company's stock after selling 6,288 shares during the quarter. ... Mercury Systems (NASDAQ:MRCY) Trading ...",www.defenseworld.net,2024-06-23 21:17:09+00:00,2024-06-25 05:08:48
43,Andover Company Cutting 100 Jobs,Publicly-traded Mercury Systems disclosed the layoffs in a securities filing last week. The layoffs are part of the consolidation of its mission ...,andovermanews.com,2024-06-26 01:33:44+00:00,2024-06-26 04:08:49
44,Listeria Fears Spur Nationwide Ice Cream Recall | Health | themercury.com,"... systems,"" the company said in a post on the U.S. Food and Drug Administration's website. ... The Manhattan Mercury. To view our latest e-Edition ...",themercury.com,2024-06-26 00:56:26+00:00,2024-06-26 04:08:49
45,Radiation-Hardened Electronics Market size is set to grow by USD 275 million from 2024 ...,"... Mercury Systems Inc., Microchip Technology Inc., Renesas Electronics Corp ... Technavio is a leading global technology research and advisory company.",finance.yahoo.com,2024-06-25 22:41:34+00:00,2024-06-26 04:08:49
46,Quadrature Capital Ltd Raises Stock Position in Mercury General Co. (NYSE:MCY),Get Mercury General alerts: Other institutional investors and hedge funds also recently added to or reduced their stakes in the company. Dimensional ...,www.defenseworld.net,2024-06-25 16:12:55+00:00,2024-06-26 04:08:49
47,"High-Speed Data Converter Market Poised for Growth, Expected to Reach $4.57 Billion by 2028","... Technology Inc., Teledyne Technologies Incorporated, Keysight Technologies, Rohm Co. ... Mercury Systems Inc., Cohu Inc., Semtech Corporation, Lattice ...",tech.einnews.com,2024-06-25 12:46:02+00:00,2024-06-26 04:08:49
48,Mercury and Saturn in Trine on 26th June 2024: Time To Get Lucky! - Times of India,"In Vedic Astrology, Saturn rules bones, joints, teeth, and the urinary system, while Mercury rules the nervous and respiratory systems. Thus ...",timesofindia.indiatimes.com,2024-06-26 09:16:24+00:00,2024-06-26 10:08:44
49,Listeria Fears Spur Nationwide Ice Cream Recall | Health | themercury.com,"... systems,"" the company said in a post on the U.S. Food and Drug Administration's website. ... The Manhattan Mercury. To view our latest e-Edition click ...",themercury.com,2024-06-25 20:59:22+00:00,2024-06-26 10:08:44
50,Amazon crosses two trillion dollars in stock market value for the first time | Diss Mercury,Most of the company's focus has been on business-focused products ... systems. Amazon also makes and designs its own AI chips. Share. 0 ...,www.dissmercury.co.uk,2024-06-26 19:53:44+00:00,2024-06-27 00:08:50
51,Form 4 MERCURY SYSTEMS INC For: Jun 24 Filed by: Ballhaus William L - StreetInsider,"Form 4 MERCURY SYSTEMS INC For: Jun 24 Filed by: Ballhaus William L. June 26, 2024 8:45 AM. FORM 4, UNITED STATES SECURITIES AND EXCHANGE COMMISSION",www.streetinsider.com,2024-06-26 18:44:59+00:00,2024-06-27 00:08:50
52,Radiation-Hardened Electronics Market size is set to grow by USD 275 million from 2024 ...,"... Mercury Systems Inc., Microchip Technology Inc., Renesas Electronics ... Technavio is a leading global technology research and advisory company.",themalaysianreserve.com,2024-06-26 00:47:25+00:00,2024-06-27 00:08:50
53,RF Isolators and Circulators Market Exploring Future Growth - openPR.com,"... Company Performance and Forecast 2031 | ADMOTECH, Cernex Inc. 06-26-2024 ... Mercury Systems Inc., Mesa Microwave, Microwave Devices Inc ...",www.openpr.com,2024-06-26 22:10:04+00:00,2024-06-27 06:08:50
54,"Keybanc Maintains Overweight on Cadence Design Sys, Raises Price Target to $355","... Inc., Mercury Systems, Inc., DXC Technology and Proterra Inc. and previously held various executive roles at global technology companies. ""We are ...",quantisnow.com,2024-06-27 11:44:19+00:00,2024-06-27 16:08:50
55,Why WestRock Company Are Trading Lower By 13%? Here Are Other Stocks Moving In ...,"MicroVision, Inc. (NASDAQ:MVIS) gained 16.3% to $2.9187. Mercury Systems, Inc. (NASDAQ:MRCY) jumped 16.2% to $58.08 following Q2 results ...",quantisnow.com,2024-06-27 06:47:56+00:00,2024-06-27 16:08:50
56,Parents' bid to collect money Alex Jones owes for Sandy Hook 'hoax' claim halted | Weston Mercury,"... company, Infowars' parent Free Speech Systems. That order came after the company's bankruptcy reorganisation failed and its case was dismissed.",www.thewestonmercury.co.uk,2024-06-27 18:23:11+00:00,2024-06-27 20:08:51
57,Mercury Analyzer Market Is Expected To Reach USD 380.62 Mn. Bn. By 2030 - WhaTech,Who are the leading companies and what are their portfolios in Mercury Analyzer Market? ... Small Business Telephone Systems- CAD- Cloud Computing ...,www.whatech.com,2024-06-27 13:35:28+00:00,2024-06-27 20:08:51
58,Reflecting On Defense Contractors Stocks' Q1 Earnings: AeroVironment (NASDAQ:AVAV),"It was a strong quarter for the company, with an impressive beat of analysts' revenue and earnings estimates. ... Mercury Systems reported revenues of ...",ca.finance.yahoo.com,2024-06-28 12:45:03+00:00,2024-06-28 16:08:47
59,"Microsoft says Russian hackers spied on emails | Illawarra Mercury | Wollongong, NSW","Russian hackers who broke into Microsoft's systems and spied on staff inboxes also stole emails from the company's customers, the tech giant says.",www.illawarramercury.com.au,2024-06-28 09:29:44+00:00,2024-06-28 16:08:47
60,A Glimpse Into The Expert Outlook On Chesapeake Energy Through 11 Analysts,"(NASD:CHK) will replace Mercury Systems Inc. (NASD: MRCY) in the S&P MidCap 400, and Mercury Systems will replace Arconic Corp. (NYSE:ARNC) in the ...",quantisnow.com,2024-06-28 05:07:36+00:00,2024-06-28 16:08:47
61,Keybanc Initiates Coverage On Chesapeake Energy with Sector Weight Rating,"Company, Date, Price Target, Rating, Analyst. Chesapeake Energy ... (NASD:CHK) will replace Mercury Systems Inc. (NASD: MRCY) in the S&P ...",quantisnow.com,2024-06-28 04:59:27+00:00,2024-06-28 16:08:47
62,Reflecting On Defense Contractors Stocks' Q1 Earnings: AeroVironment (NASDAQ:AVAV),"It was a weak quarter for the company, with a miss of analysts' revenue and earnings estimates. Mercury Systems had the weakest performance ...",www.barchart.com,2024-06-28 12:05:16+00:00,2024-06-28 21:08:57
63,"Fewer Investors Than Expected Jumping On Mercury Systems, Inc. (NASDAQ:MRCY)","It's not a stretch to say that Mercury Systems, Inc.'s ( NASDAQ:MRCY ) price-to-sales (or ""P/S"") ratio of 1.9x right...",simplywall.st,2024-06-29 16:28:20+00:00,2024-06-29 18:08:46
64,Mercury Systems: Fiscal 2Q Earnings Snapshot - Yahoo Life UK,"ANDOVER, Mass. (AP) _ Mercury Systems Inc. (MRCY) on Tuesday reported fiscal second-quarter profit of $12.4 million. On a per-share basis, ...",uk.style.yahoo.com,2024-06-30 01:42:02+00:00,2024-06-30 09:08:45
65,Enhancing Food Safety: Digestion of Seafood Samples with Multiwave 7000 with PDC ...,"Subsequent quantitative analysis was performed with a Flow Injection Mercury Systems according to EN ISO 12846, employing NaBH4 as a reductant.",www.foodprocessing.com.au,2024-06-30 14:02:23+00:00,2024-06-30 18:08:53
66,Phoenix Mercury sees third largest crowd ever in loss against Caitlin Clark,Phoenix Mercury adds woman-founded company as jersey sponsor. Related ... systems. They are usually only set in response to actions made by ...,www.bizjournals.com,2024-07-01 14:34:22+00:00,2024-07-01 15:08:56
67,Defense Contractors Stocks Q1 Results: Benchmarking Huntington Ingalls (NYSE:HII),"It was a weak quarter for the company, with a miss of analysts' operating margin and earnings estimates. Mercury Systems had the weakest ...",www.barchart.com,2024-07-01 11:48:42+00:00,2024-07-01 15:08:56
68,Air Pollution Control System for Coal-Fired Power Plants - GlobeNewswire,"... mercury emissions from power plants, propelling the adoption of FGD systems. ... business analysts, economists, consultants, and technology experts.",www.globenewswire.com,2024-07-01 16:35:25+00:00,2024-07-01 19:10:14
69,"Massachusetts tech layoff tracker, Q2 2024 - Boston Business Journal",Mercury Systems Inc.: The Andover-based defense tech company (Nasdaq: MRCY) disclosed in a securities filing that it would cut about 100 positions ...,www.bizjournals.com,2024-07-01 22:46:15+00:00,2024-07-02 00:08:55
70,3 Big Data Stocks to Sell in July Before They Crash &amp; Burn | InvestorPlace,The company's financial instability and negative growth trends underscore the risks associated with holding onto this stock. Mercury Systems is ...,investorplace.com,2024-07-01 19:16:06+00:00,2024-07-02 00:08:55
71,Meet Your Portland 2024 Mayoral Candidates,"The Mercury's QUEER GUIDE!- Drink Up... the SUMMER OF SLUSHIES Is ... He now runs a trucking company- Titan Freight Systems, which he says ...",www.portlandmercury.com,2024-07-02 05:30:05+00:00,2024-07-02 10:08:56
72,3 Defense Stocks to Sell in July Before They Crash &amp; Burn | InvestorPlace,"Mercury Systems (MRCY): Declining revenue and earnings could continue ... The companies behind these “Defense” stocks sell weapons, defense systems ...",investorplace.com,2024-07-02 13:59:42+00:00,2024-07-02 15:09:06
73,"Wellington Management Group LLP Purchases 1,251 Shares of Mercury Systems, Inc ...","Read Wellington Management Group LLP Purchases 1251 Shares of Mercury Systems, Inc. (NASDAQ:MRCY) at Defense World.",www.defenseworld.net,2024-07-02 08:29:32+00:00,2024-07-02 15:09:06
74,3 Big Data Stocks to Sell in July Before They Crash &amp; Burn | Markets Insider,"Mercury Systems (NASDAQ:MRCY) is a technology company that provides solutions for big data applications, particularly in the defense and aerospace ...",markets.businessinsider.com,2024-07-01 20:17:05+00:00,2024-07-02 15:09:06
75,Mercury Security MP Controllers,"As technology advances, access control systems require robust encryption and advanced threat detection. The new Mercury MP Controllers empower access ...",www.securityinfowatch.com,2024-07-02 16:32:34+00:00,2024-07-02 20:08:54
76,Defense Contractors Stocks Q1 Recap: Benchmarking Leidos (NYSE:LDOS) - Barchart.com,"It was a weak quarter for the company, with a miss of analysts' earnings estimates. Mercury Systems had the weakest performance against analyst ...",www.barchart.com,2024-07-02 12:06:36+00:00,2024-07-02 20:08:54
77,Wellington Management Group LLP Trims Holdings in U.S. Bancorp (NYSE:USB),"Wellington Management Group LLP Purchases 1,251 Shares of Mercury Systems, Inc. (NASDAQ:MRCY)- NEXT HEADLINE ». West Pharmaceutical Services, Inc.",www.defenseworld.net,2024-07-02 08:29:44+00:00,2024-07-02 20:08:54
78,Brazil regulator bans Meta from mining data to train AI models - Diss Mercury,Meta's updated privacy policy enables the company to feed people's public posts into its AI systems. That practice will not be permitted in Brazil ...,www.dissmercury.co.uk,2024-07-02 21:02:29+00:00,2024-07-03 02:08:48
79,Here's How Much You Would Have Made Owning Cadence Design Sys Stock In The Last 15 Years,"... May 4, 2023. Ms. Krakauer, who previously held various executive roles at global technology companies, also serves as a director of Mercury Systems.",quantisnow.com,2024-07-03 14:41:58+00:00,2024-07-03 17:09:34
80,Pro-Palestine demonstrators blockade factory - Milford Mercury,Thales said it has a small medium enterprise joint venture (SME JV) with Israeli company Elbit that supplies systems to the UK Ministry of Defence ( ...,www.milfordmercury.co.uk,2024-07-03 13:37:36+00:00,2024-07-03 17:09:34
81,"PRIVACY ALERT: Evolve, Affirm, Bilt, Shopify, Mercury, Plaid, Stripe, and Others Under ...","On June 26, 2024, Evolve announced that its systems were breached in May 2024 in a ransomware attack by cybercriminal group LockBit. The group appears ...",www.prnewswire.com,2024-07-03 10:08:39+00:00,2024-07-03 17:09:34
82,"Mercury Systems, Inc. (NASDAQ:MRCY) Given Consensus Rating of “Reduce” by Analysts","Read Mercury Systems, Inc. (NASDAQ:MRCY) Given Consensus Rating of “Reduce” by Analysts at Defense World.",www.defenseworld.net,2024-07-03 05:24:40+00:00,2024-07-03 17:09:34
83,"Vanguard Group Inc. Has $207.33 Million Stock Holdings in Mercury Systems, Inc. (NASDAQ:MRCY)","Vanguard Group Inc. boosted its position in shares of Mercury Systems, Inc. (NASDAQ:MRCY - Free Report) by 1.0% in the fourth quarter, ...",www.marketbeat.com,2024-07-03 16:01:51+00:00,2024-07-03 21:09:20
84,"Mercury Systems, Inc. (NASDAQ:MRCY) Receives Average Recommendation of &quot;Reduce ...","Shares of Mercury Systems, Inc. (NASDAQ:MRCY - Get Free Report) have earned an average rating of ""Reduce"" from the seven ratings firms that are ...",www.marketbeat.com,2024-07-03 15:20:29+00:00,2024-07-03 21:09:20
85,"PRIVACY ALERT: Evolve, Affirm, Bilt, Shopify, Mercury, Plaid, Stripe, and Others Under ...","As a fintech firm, Evolve partnered with numerous other companies, including Affirm, Bilt, Shopify, Mercury, Plaid, and Stripe. If you did business ...",www.morningstar.com,2024-07-02 22:55:50+00:00,2024-07-03 21:09:20
