,Heading,Subheading,Publisher,Published,Found
257,"Dry Sorbent Injection System Market 2024 Key Insights | Amec Foster Wheeler, Dustex ...","Traffic Information Management Software Market 2024 Trends | Cisco Systems, Inc., MercuryGate TMS. Next Post. [Trends ] Open Source Data Labelling ...",economica.ma,2024-07-29 20:34:16+00:00,2024-07-30 00:09:19
258,"Global Military Jammer Market Share Report with Top Countries Data, Forecast 2032 - WICZ",L-3 Technologies; Ultra Electronics; Mercury Systems. On the basis of ... To study and analyse the global Military Jammer market size (value & volume) ...,www.wicz.com,2024-07-30 07:03:01+00:00,2024-07-30 18:09:32
259,Basic IT security failings left electoral register vulnerable – data watchdog - Weston Mercury,The Electoral Commission has been issued with a reprimand after the Information Commissioner's Office said it should have kept its systems ...,www.thewestonmercury.co.uk,2024-07-30 22:32:01+00:00,2024-07-31 00:09:34
260,Kaleidescape Strengthens Commercial Segment with Mercury Studios Alliance - CEPRO,"It hasn't been that long since Kaleidescape, a developer of high-performance movie delivery systems for the luxury residential market for over 20 ...",www.cepro.com,2024-07-31 08:27:28+00:00,2024-07-31 13:09:13
261,Business accounting software Xero crashes in global outage | The Maitland Mercury,"""We are now seeing recovery across our systems. Customers should be able to log in and navigate through Xero as expected,"" a tweet from the company ...",www.maitlandmercury.com.au,2024-07-31 07:51:03+00:00,2024-07-31 13:09:13
