,Heading,Subheading,Publisher,Published,Found
89,Lifeist Reports Second Quarter 2024 Financial Results - Le Lézard,"Sturm, Ruger & Company, Inc. to Report Second Quarter Results and File Quarterly Report on Form 10-Q on Wednesday, July 31. Sturm, Ruger & Company, ...",www.lelezard.com,2024-07-30 22:46:04+00:00,2024-07-31 06:13:01
90,Why investors should buy industrial stocks now as a valuable market driver deteriorates ...,"Business Wire. Sturm, Ruger & Company, Inc. to Report Second Quarter Results and File Quarterly Report on Form 10-Q on Wednesday, July 31. 9 minutes ...",ca.finance.yahoo.com,2024-07-30 21:13:37+00:00,2024-07-31 06:13:01
91,The Intersection of Leadership and Expertise - INSCMagazine,"Sturm, Ruger & Company, Inc. to Report Second Quarter Results and File ... - Assignmentgeek.com is the best homework writing assistance company you've ...",theinscribermag.com,2024-07-31 06:33:42+00:00,2024-07-31 11:13:10
92,TC Energy signs deal to sell minority stake in pipeline to Indigenous groups,"Business Wire. Sturm, Ruger & Company, Inc. to Report Second Quarter Results and File Quarterly Report on Form 10-Q on Wednesday, July 31. 8 minutes ...",ca.finance.yahoo.com,2024-07-30 21:12:02+00:00,2024-07-31 11:13:10
93,Top 10 Best Revolver Makers in The United States | KnowInsiders,"Sturm, Ruger & Co., commonly known as Ruger, was founded by William B. Ruger and Alexander McCormick Sturm. Since its inception, Ruger has grown ...",knowinsiders.com,2024-07-31 13:54:44+00:00,2024-07-31 15:13:04
94,The Rise of Ruger: From Humble Beginnings to Firearm Industry Giant - MSN,"... Ruger. In 1949, he founded Sturm, Ruger & Co. along with Alexander McCormick Sturm. The company quickly made a name for itself in highly ...",www.msn.com,2024-07-31 09:06:33+00:00,2024-07-31 15:13:04
95,How Cash for Scrap Cars Programs Help Reduce Toronto's Carbon Footprint,"Sturm, Ruger & Company, Inc. to Report Second Quarter Results and File ... INSC: Useful Resources. - Assignmentgeek.com is the best homework writing ...",theinscribermag.com,2024-07-31 16:18:50+00:00,2024-07-31 19:13:13
96,Sturm Ruger &amp; Company Inc reports results for the quarter ended in June - Earnings Summary,FORECAST CHANGESRECOMMENDATIONSWall Street's median 12-month price target for Sturm Ruger & Company Inc is $62.00 This summary was machine ...,www.tradingview.com,2024-07-31 21:55:05+00:00,2024-08-01 00:13:07
97,Sturm Ruger: Q2 Earnings Snapshot - CT Insider,"The Southport, Connecticut-based company said it had profit of 47 cents per share. The firearm maker posted revenue of $130.8 million in the period.",www.ctinsider.com,2024-07-31 21:50:28+00:00,2024-08-01 00:13:07
98,Sturm Ruger: Q2 Earnings Snapshot - Yahoo Finance,"SOUTHPORT, Conn. AP) — Sturm Ruger & Co. (RGR) on Wednesday reported earnings of $8.3 million in its second quarter.",finance.yahoo.com,2024-07-31 21:45:11+00:00,2024-08-01 00:13:07
99,Sturm Ruger: Q2 Earnings Snapshot | | thewesterlysun.com,"(AP) — Sturm Ruger & Co. (RGR) on Wednesday reported earnings of $8.3 million in its second quarter. The Southport, Connecticut-based company said ...",www.thewesterlysun.com,2024-07-31 21:33:37+00:00,2024-08-01 00:13:07
100,"Sturm Ruger &amp; Co Inc Q2 Income Drops, Misses Estimates - RTTNews",Sturm Ruger & Co Inc (RGR) released a profit for second quarter that decreased from the same period last year and missed the Street estimates.,www.rttnews.com,2024-07-31 21:28:44+00:00,2024-08-01 00:13:07
101,Sturm Ruger: Q2 Earnings Snapshot - MarketScreener,"(AP) — Sturm Ruger & Co. (RGR) on Wednesday reported earnings of $8.3 million in its second quarter. The Southport, Connecticut -based company said it ...",www.marketscreener.com,2024-07-31 21:23:31+00:00,2024-08-01 00:13:07
102,"Sturm, Ruger &amp; Company, Inc. Reports Second Quarter Diluted Earnings of 47¢ Per ... - Morningstar","Sturm, Ruger & Company, Inc. (NYSE-RGR) announced today that for the second quarter of 2024, net sales were $130.8 million and diluted earnings were ...",www.morningstar.com,2024-07-31 21:21:45+00:00,2024-08-01 00:13:07
103,"Sturm, Ruger &amp; Company, Inc. Reports Second Quarter Diluted Earnings of 47¢ Per ... - Markets data","--(BUSINESS WIRE)--Jul. 31, 2024-- Sturm, Ruger & Company, Inc. (NYSE-RGR) announced today that for the second quarter of 2024, net sales were ...",markets.ft.com,2024-07-31 21:13:12+00:00,2024-08-01 00:13:07
104,Sturm Ruger (RGR) Misses Q2 EPS by 29c - StreetInsider,"For earnings history and earnings-related data on Sturm Ruger (RGR) click here. Categories. Earnings. Next Articles. Sturm, Ruger & Company, Inc.",www.streetinsider.com,2024-07-31 21:09:47+00:00,2024-08-01 00:13:07
105,The Returns On Capital At Sturm Ruger (NYSE:RGR) Don't Inspire Confidence,"In a perfect world, we'd like to see a company investing more capital into its business and ideally the returns earned from that capital are also ...",finance.yahoo.com,2024-07-31 19:13:56+00:00,2024-08-01 00:13:07
106,"RGR Stock Earnings: Sturm Ruger &amp; Co Misses EPS, Misses Revenue for Q2 2024",RGR stock results show that Sturm Ruger & Co missed analyst estimates for earnings per share and missed on revenue for the second quarter of 2024.,investorplace.com,2024-08-01 01:55:09+00:00,2024-08-01 03:13:04
107,"Sturm, Ruger Sees Q2 Profits Slide on 8 Percent Sales Decline | SGB Media Online","Sturm, Ruger & Company Inc. reported earnings fell in the second quarter ended June 29 as sales slid 8.4 percent. Sales in the quarter reached ...",sgbonline.com,2024-07-31 22:26:27+00:00,2024-08-01 03:13:04
108,"Sturm Ruger &amp; Co Inc Q2 Income Drops, Misses Estimates - Nasdaq",(RTTNews) - Sturm Ruger & Co Inc (RGR) released a profit for second quarter that decreased from the same period last year and missed the Street ...,www.nasdaq.com,2024-07-31 21:56:23+00:00,2024-08-01 03:13:04
109,Sturm Ruger: Q2 Earnings Snapshot - CTPost,"(AP) — Sturm Ruger & Co. (RGR) on Wednesday reported earnings of $8.3 ... The Southport, Connecticut-based company said it had profit of 47 cents per ...",www.ctpost.com,2024-08-01 09:30:38+00:00,2024-08-01 11:12:51
110,Sturm Ruger &amp; Company Inc. filed SEC Form 8-K: Results of Operations and Financial ...,"STURM, RUGER & COMPANY, INC. (Exact Name of Registrant as Specified in its Charter). Delaware. (State or Other ...",quantisnow.com,2024-08-01 09:14:42+00:00,2024-08-01 11:12:51
111,"Sturm, Ruger &amp; Company, Inc. Reports Earnings Results for the Second Quarter and Six ...","Sturm, Ruger & Company, Inc. reported earnings results for the second quarter and six months ended June 29, 2024. For the second quarter, ...",www.marketscreener.com,2024-08-01 08:40:00+00:00,2024-08-01 11:12:51
112,Sturm Ruger &amp; Co Inc (RGR) Q2 2024 Earnings: EPS of $0.47 Misses - GuruFocus,"Sturm Ruger & Co Inc and its subsidiary are principally engaged in the design, manufacture, and sale of firearms to domestic customers. The company's ...",www.gurufocus.com,2024-08-01 03:31:36+00:00,2024-08-01 11:12:51
113,Topgolf Callaway Brands to Release Second Quarter 2024 Financial Results - Le Lézard,"Sturm, Ruger & Company, Inc. announced today that for the second quarter of 2024, net sales were $130.8 million and diluted earnings were 47¢ per ...",www.lelezard.com,2024-08-01 03:16:18+00:00,2024-08-01 11:12:51
114,"Sturm, Ruger &amp; Company, Inc. Reports Second Quarter Diluted Earnings of 47¢ Per ... - Stock Titan","Sturm, Ruger & Company (NYSE: RGR) reported Q2 2024 results with net sales of $130.8 million and diluted earnings of 47¢ per share, ...",www.stocktitan.net,2024-07-31 21:31:23+00:00,2024-08-01 11:12:51
115,Ambri Successfully Completes Sale and Emerges from Chapter 11 - Le Lézard,"Sturm, Ruger & Company, Inc. Reports Second Quarter Diluted Earnings of ... Sturm, Ruger & Company, Inc. announced today that for the second ...",www.lelezard.com,2024-07-31 21:24:27+00:00,2024-08-01 11:12:51
116,Ohio Bankruptcy Court Offers Guidance On (The Amended) Ordinary Course Payment ...,"(""AcuSport""), was an authorized distributer of firearms manufactured by Sturm Ruger & Co., Inc. (""Ruger""). During the 90-day period preceding its ...",www.mondaq.com,2024-08-01 13:29:31+00:00,2024-08-01 15:12:51
117,Life Time Promotes Erik Weaver to EVP and Chief Financial Officer | SGB Media Online,"Weaver joined Life Time in 2004 and has served in increasing roles of responsibility, including as the company's ... Sturm, Ruger Sees Q2 Profits Slide ...",sgbonline.com,2024-08-01 12:02:30+00:00,2024-08-01 15:12:51
118,Sturm Ruger's 2Q Profit Falls by Half as Revenue Slips on Weakening Demand,"The Southport, Conn.-based company on Wednesday posted a profit of $8.3 million, or 47 cents a share, compared with $16.2 million, or 91 cents a share ...",www.marketwatch.com,2024-08-01 10:10:12+00:00,2024-08-01 15:12:51
119,"Fluidra Achieves Sales of ? 1,171 Million and Expands EBITDA Margin in the First Half of 2024","Sturm, Ruger & Company, Inc. Reports Second Quarter Diluted Earnings of 47¢ Per Share and Declares Quarterly Dividend of 19¢ Per Share. Sturm ...",www.lelezard.com,2024-08-01 07:02:04+00:00,2024-08-01 15:12:51
120,Paul Daugerdas Provides a Consulting Playbook for Startups: Scaling Your Consulting Skills,"Sturm, Ruger & Company, Inc. Reports Second Quarter Diluted Earnings of ... INSC: Useful Resources. - Assignmentgeek.com is the best homework writing ...",theinscribermag.com,2024-08-01 04:11:14+00:00,2024-08-01 15:12:51
121,Exploring Barbering Courses in Toronto: A Gateway to a Thriving Career - INSCMagazine,"Professionalism: Important personal areas like business ethics, customer relations, and company organizational behavior. ... Sturm, Ruger & Company, Inc ...",theinscribermag.com,2024-08-01 16:10:33+00:00,2024-08-01 17:13:23
122,CT-based gun-maker discloses workforce reduction | Hartford Business Journal,"Amid slumping gun sales, Southport-based gun-maker Sturm, Ruger & Co. Inc. announced it has cut its workforce. In a second quarter earnings report ...",www.hartfordbusiness.com,2024-08-01 15:26:59+00:00,2024-08-01 17:13:23
123,Harris-Powell Double Act Leads to Unwinding of 'Trump Trades' - Bloomberg.com,"By contrast, gun stocks like Smith & Wesson Brands and Sturm Ruger & Co. are faring well so far. Bank stocks — which have been called out as a key ...",www.bloomberg.com,2024-08-01 18:31:12+00:00,2024-08-01 20:13:17
124,Discovering Jobzvice.com: Your Ultimate Guide to Finding the Perfect Job - INSCMagazine,"... company or a small one, Jobzvice.com has lots of choices to. ... Sturm, Ruger & Company, Inc. Reports Second Quarter Diluted Earnings of ...",theinscribermag.com,2024-08-01 18:25:32+00:00,2024-08-01 20:13:17
125,"Sturm, Ruger &amp; Company, Inc. (RGR) Q2 2024 Earnings Call Transcript | Seeking Alpha","Sturm, Ruger & Company, Inc. (NYSE:NYSE:RGR) Q2 2024 Earnings Conference Call August 1, 2024 9:00 AM ETCompany ParticipantsChristopher Killoy -...",seekingalpha.com,2024-08-01 18:15:56+00:00,2024-08-01 20:13:17
126,Sturm Ruger's 2Q Profit Falls by Half as Revenue Slips on Weakening Demand,"Chief Executive Christopher Killoy said that despite falling demand for firearms, the estimated sell-through of the company's products from ...",www.marketwatch.com,2024-08-01 13:58:34+00:00,2024-08-01 20:13:17
127,Soft demand for firearms sends Ruger's profit down 49% - Winston-Salem Journal,"It's likely Sturm, Ruger & Co. will experience a sales uptick in the third quarter in the aftermath of the failed assassination attempt on former ...",journalnow.com,2024-08-01 21:59:39+00:00,2024-08-01 23:13:14
128,"Earnings call: Sturm, Ruger &amp; Company sees dip in Q2 sales and earnings - Investing.com","Sturm, Ruger & Company, Inc. (RGR) reported a decline in its second quarter financial results for 2024, with net sales dropping to $130.8 million ...",in.investing.com,2024-08-01 21:19:25+00:00,2024-08-01 23:13:14
129,Arbutus Biopharma Corporation (ABUS) Q2 2024 Earnings Call Transcript | Seeking Alpha,"Sturm, Ruger & Company, Inc. (RGR) Q2 2024 Earnings Call Transcript. SA Transcripts. Steven Cress, Quant Team profile picture. Trump Trade: Top 5 ...",seekingalpha.com,2024-08-01 21:05:08+00:00,2024-08-01 23:13:14
130,Kamala Harris' popularity and hints of a rate cut hurt 'Trump Trades',"In contrast, gun stocks like Smith & Wesson Brands and Sturm Ruger & Co. ... Meanwhile, Trump Media & Technology Group Corp., the parent company of ...",thebharatexpressnews.com,2024-08-01 19:58:42+00:00,2024-08-01 23:13:14
131,Historic Victory Against Qatar: A Major Legal and Economic Precedent at ICSID,"This decision has the potential to influence future investor and company ... Sturm, Ruger & Company, Inc. Reports Second Quarter Diluted Earnings of ...",theinscribermag.com,2024-08-01 18:25:22+00:00,2024-08-01 23:13:14
132,"Sturm Ruger &amp; Co Inc Q2 Income Drops, Misses Estimates | Markets Insider",(RTTNews) - Sturm Ruger & Co Inc (RGR) released a profit for second quarter that decreased from the same period last year and missed the Street e.,markets.businessinsider.com,2024-08-01 00:06:22+00:00,2024-08-02 11:13:10
133,"Allstate reports second quarter profit on stronger premiums, investment income","The company's consolidated premiums written for the quarter were ... Sturm, Ruger & Company, Inc. Reports Second Quarter Diluted Earnings of ...",ca.finance.yahoo.com,2024-07-31 21:16:29+00:00,2024-08-02 11:13:10
134,In One Year This Rifle Company Makes Enough Guns to Arm Half the US Military - MSN,"1. Sturm, Ruger & Company- 2. Savage Arms- 3. Henry Repeating Arms- 4. Springfield Inc.- 5. Sig Sauer- 6. Smith & Wesson- 7. Radical Firearms- 8.",www.msn.com,2024-08-02 11:48:34+00:00,2024-08-02 17:13:13
135,Sturm Ruger Second Quarter 2024 Earnings: EPS: US$0.48 (vs US$0.91 in 2Q 2023),"Designs, manufactures, and sells firearms under the Ruger name and trademark in the United States.",simplywall.st,2024-08-02 11:38:50+00:00,2024-08-02 17:13:13
136,Advisors Asset Management Inc. Increases Stock Position in Grupo Aeroportuario del ...,"Sturm, Ruger & Company, Inc. To Go Ex-Dividend on August 15th.",www.defenseworld.net,2024-08-02 11:07:03+00:00,2024-08-02 17:13:13
137,Alabama woman pleads guilty to defrauding pandemic relief fund out of $2 million,Q2 2024 Sturm Ruger & Company Inc Earnings Call. 25 minutes ago. KCRA - Sacramento Videos. Sacramento photographer hopes to bring vibrancy to Del ...,ca.finance.yahoo.com,2024-08-02 06:51:06+00:00,2024-08-02 17:13:13
138,Q2 2024 Sturm Ruger &amp; Company Inc Earnings Call - Yahoo Finance,"Good morning, and welcome to the Sturm Ruger & Company second quarter 2024 conference call. I'll ask Patricia Shepard, our Deputy General Counsel ...",finance.yahoo.com,2024-08-02 06:34:34+00:00,2024-08-02 17:13:13
139,Sturm Ruger &amp; Company (RGR) Gets a Buy from Lake Street | Markets Insider,"In a report released today, Mark Smith from Lake Street maintained a Buy rating on Sturm Ruger & Company (RGR – Research Report), wit...",markets.businessinsider.com,2024-08-01 16:24:53+00:00,2024-08-02 17:13:13
140,Sturm Ruger &amp; Company Q2 2024 Financial Discussion Recap - TipRanks.com,Sturm Ruger & Company (RGR) has shared an announcement. The Company recently held a conference call to discuss its financial outcomes for the ...,www.tipranks.com,2024-08-02 19:00:09+00:00,2024-08-02 20:13:11
141,Federal judge overturns $4.7 billion jury verdict in 'Sunday Ticket' lawsuit and rules for NFL,... company warned. Its stock dropped sharply. a few seconds ago. Thomson Reuters StreetEvents. Q2 2024 Sturm Ruger & Company Inc Earnings Call. 6 ...,ca.finance.yahoo.com,2024-08-02 06:32:33+00:00,2024-08-02 20:13:11
142,Hunting Accessories Market Marketing Strategies: Effective Approaches - KnowCasino,Sturm Ruger and Co. Inc. Vista Outdoor Inc. Hunting Accessories Market Competitive Landscape. The competitive landscape of the Hunting Accessories ...,www.knowcasino.co.nz,2024-08-02 17:33:52+00:00,2024-08-02 23:13:00
143,"Sturm, Ruger &amp; Company: Bottoming At Around $40/Share, I Say 'Buy' (NYSE:RGR)","Sturm, Ruger & Company is a publicly traded firearms industry leader, currently trading at $45/share with a 2.5% pre-market decrease.",seekingalpha.com,2024-08-03 07:07:12+00:00,2024-08-03 09:12:59
144,BDC Weekly Review: TRIN Has Been Busy | Seeking Alpha,"I have no business relationship with any company whose stock is mentioned in this article. ... Sturm, Ruger ...",seekingalpha.com,2024-08-03 05:32:21+00:00,2024-08-03 09:12:59
145,Sturm Ruger mpany : CONFERENCE CALL PARTICIPANTS Form 8 K - MarketScreener,"Please go ahead. Christopher Killoy Sturm Ruger & Company Inc - President, Chief Executive Officer, Director. Good morning, and welcome to the Sturm ...",www.marketscreener.com,2024-08-03 00:51:23+00:00,2024-08-03 09:12:59
146,"Sturm, Ruger &amp; Company, Inc. (NYSE:RGR) Q2 2024 Earnings Call Transcript","Christopher Killoy: Good morning, and welcome to Sturm, Ruger & Company's second quarter 2024 conference call. I'll ask Patricia Shepard, our Deputy ...",www.insidermonkey.com,2024-08-02 19:24:12+00:00,2024-08-03 09:12:59
