,Heading,Subheading,Publisher,Published,Found
87,Gibraltar Industries (NASDAQ:ROCK) Updates FY 2024 Earnings Guidance - MarketBeat,"About Gibraltar Industries ... Gibraltar Industries, Inc manufactures and provides products and services for the renewable energy, residential, agtech, ...",www.marketbeat.com,2024-07-31 16:22:09+00:00,2024-08-01 09:05:51
88,Gibraltar Announces Second Quarter 2024 Financial Results - Morningstar,"Agtech bookings surpassed $90 million in the quarter, a record for the business, and support strong revenue growth in the second half. We continue to ...",www.morningstar.com,2024-07-31 11:48:17+00:00,2024-08-01 20:06:09
89,"Earnings call: Gibraltar Industries sees mixed Q2 results, optimistic outlook - Investing.com",... business practices. Key Takeaways. Gibraltar Industries' second quarter adjusted net sales decreased by 2%. The company's backlog dropped by 4 ...,www.investing.com,2024-08-01 19:01:35+00:00,2024-08-01 22:05:54
90,"Quanta (PWR) Q2 Earnings Miss Estimates, 2024 Guidance Raised - Zacks","Gibraltar Industries, Inc. (ROCK) - free report &gt;&gt;- Armstrong World ... Each of the company logos represented herein are trademarks of Microsoft ...",www.zacks.com,2024-08-01 16:35:41+00:00,2024-08-01 22:05:54
91,Seaport Global Keeps Their Buy Rating on Lincoln Electric Holdings (LECO),"The company's shares closed yesterday at $205.41. ... Liptak covers the Industrials sector, focusing on stocks such as Federal Signal, Gibraltar ...",markets.businessinsider.com,2024-08-01 16:17:24+00:00,2024-08-01 22:05:54
92,"CANADA LIFE ASSURANCE Co Trims Stock Position in Kulicke and Soffa Industries, Inc ...","Company insiders own 0.03% of the company's stock. Analyst ... CANADA LIFE ASSURANCE Co Sells 16,249 Shares of Gibraltar Industries, Inc.",www.defenseworld.net,2024-08-01 15:11:07+00:00,2024-08-01 22:05:54
93,Gibraltar Industries Second Quarter 2024 Earnings: Misses Expectations - Yahoo Finance,"The company's shares are down 5.1% from a week ago. Balance Sheet Analysis. Just as investors must consider earnings, it is also important to take ...",finance.yahoo.com,2024-08-01 11:46:37+00:00,2024-08-01 22:05:54
94,"Gibraltar Industries earnings missed by $0.07, revenue fell short of estimates","Investing.com - Gibraltar Industries (NASDAQ: ROCK) reported second quarter EPS of $1.18, $0.07 worse than the analyst estimate of $1.25.",ng.investing.com,2024-08-01 10:25:57+00:00,2024-08-01 22:05:54
95,Global Castor Oil Market to Reach $1.68 Billion by 2028 - Yahoo Finance,Company Profiles. Adani Wilmar. Gokul Agro Resources. Jayant Agro ... Q2 2024 Gibraltar Industries Inc Earnings Call. 14 minutes ago. Globe ...,uk.finance.yahoo.com,2024-08-01 08:19:42+00:00,2024-08-01 22:05:54
96,OSG Tanker Believed Headed for Israel Departs Gibraltar Without Bunkering - Star Concord,They said the decision not to bunker was a commercial decision made by the company and the suppliers and that the government was not involved. The ...,www.starconcord.com.sg,2024-08-01 04:37:48+00:00,2024-08-01 22:05:54
97,Coin-op amusements news | 35th Ozone opens in Algeciras - InterGame,"Major Spanish tenpin bowling operator Ozone has opened its 35th venue in Algeciras, close to Gibraltar. Ozone Gibraltar. The company, the largest ...",www.intergameonline.com,2024-08-02 19:35:40+00:00,2024-08-02 22:05:57
98,Validea Peter Lynch Strategy Daily Upgrade Report - 8/2/2024 | Nasdaq,"Company Description: Gibraltar Industries, Inc. is a manufacturer and provider of products and services for the renewable energy, residential ...",www.nasdaq.com,2024-08-02 09:29:52+00:00,2024-08-02 22:05:57
99,Seaport Global Sticks to Its Buy Rating for Regal Rexnord (RRX) | Markets Insider,"The company's shares closed yesterday at $162.96. ... Liptak covers the Industrials sector, focusing on stocks such as Federal Signal, Gibraltar ...",markets.businessinsider.com,2024-08-02 23:01:06+00:00,2024-08-03 06:06:02
