,Heading,Subheading,Publisher,Published,Found
0,Foreign Discovery Insights 2 Years After ZF Automotive - Law360,Servotronics Inc. The Boeing Co. United Nations Commission on International Trade Law. Government Agencies. International Chamber of Commerce; U.S. ...,www.law360.com,2024-06-17 15:35:29,2024-06-19 13:28:04
1,Foreign Discovery Insights 2 Years After ZF Automotive - Law360,Servotronics Inc. The Boeing Co. United Nations Commission on International Trade Law. Government Agencies. International Chamber of Commerce; U.S. ...,www.law360.com,2024-06-17 20:35:29+00:00,2024-06-19 17:11:35
2,"Industrial Electrical Equipment Manufacturing Industry size, share, trend | Complete Analysis","... Corporation, Altra Industrial Motion, Regal Beloit, Servotronics, Allison Transmission, Littelfuse, BWX Technologies, Franklin Electric, Woodward, Inc ...",www.theindianmoviechannel.com,2024-06-19 09:12:18+00:00,2024-06-20 10:11:26
3,FTSE 100 Set To Open Higher; Major Changes Coming To London Listings - Finimize,"Servotronics, Inc. What's going on here? Britain's FTSE 100 is poised ... company listing rules on the London Stock Exchange for the first ...",finimize.com,2024-07-11 17:18:01+00:00,2024-07-11 21:12:16
4,"Servotronics, Inc. (NYSEAMERICAN:SVT) Short Interest Down 13.5% in June","Read Servotronics, Inc. (NYSEAMERICAN:SVT) Short Interest Down 13.5% in June at Defense World.",www.defenseworld.net,2024-07-14 08:49:21+00:00,2024-07-15 06:12:07
5,Sensient Technologies (NYSE:SXT) Reaches New 1-Year High at $78.89 - Defense World,"The company traded as high as $78.89 and last traded at $78.28 ... Servotronics, Inc. (NYSEAMERICAN:SVT) Short Interest Down 13.5% in June ...",www.defenseworld.net,2024-07-14 06:57:32+00:00,2024-07-15 06:12:07
6,NEXT plc (OTCMKTS:NXGPF) Sees Large Decrease in Short Interest,"NEXT Company Profile. (Get Free Report). NEXT plc engages in the ... Servotronics, Inc. (NYSEAMERICAN:SVT) Sees Significant Drop in Short ...",www.americanbankingnews.com,2024-07-15 13:21:30+00:00,2024-07-15 21:12:26
7,When (SVT) Moves Investors should Listen - Stock traders daily,"Updated AI-Generated Signals for Servotronics Inc. (SVT) available here: SVT. SVT Ratings for July 27: Term →, Near, Mid, Long. Rating, Strong, Weak ...",news.stocktradersdaily.com,2024-07-27 20:58:06+00:00,2024-07-27 23:12:35
8,5 Microcaps with Exposure to Defense Spending - Yahoo Finance,"Servotronics, Inc. SVT manufactures controls and components for aircraft, jet engines, missiles, and manufacturing equipment. In the latest ...",ca.finance.yahoo.com,2024-07-30 14:56:23+00:00,2024-07-31 08:12:30
