,Heading,Subheading,Publisher,Published,Found
0,Tower Crane Market Growth Factors Impact Analysis To $9.9 Billion by 2028 - EIN News,"... Company, Inc., SANY Global, Sarens n.v./s.a., Terex Corporation, WOLFFKRAN International AG, and Zoomlion Heavy Industry Science & Technology Co., Ltd ...",www.einnews.com,2024-06-18 10:15:39,2024-06-18 15:22:12
1,Electric Drive Mining Truck Market Revenue Is Expected To Grow By 26.5 % From 2024 ... - WhaTech,"... company websites, and news stories. By concentrating on a number of ... Terex Corporation 2. Hitachi, Ltd. 3. OJSC BELAZ 4. XCMG Group 5. BEML ...",www.whatech.com,2024-06-18 05:05:21,2024-06-18 15:22:12
2,"Joe Broking named president, CEO of Mesabi Metallics | The Daily Briefing - Business North","Twenty-seven-year industry veteran to lead company as it ramps up staffing and construction ... Terex Corporation, and director of financial accounting, ...",www.businessnorth.com,2024-06-18 04:51:33,2024-06-18 15:22:12
3,JP Morgan downgrades Terex Corp. (TEX) rating to a Neutral - Knox Daily,"Terex Corp.'s recently made public that its Senior V.P., Gen Counsel Sec. POSNER SCOTT unloaded Company's shares for reported $0.76 million on May ...",knoxdaily.com,2024-06-18 04:47:29,2024-06-18 15:22:12
4,"Cone Crushers Market Is Expected To Reach USD 2,568.96 Million By 2032 As Revealed In ...",R.R. Equipment Company; Sandvik AB; Telsmith Inc. Terex Corporation; Tesan Engineering Ltd. Trimax Machinery; Weir Group Plc. Market Segmentation: The ...,www.whatech.com,2024-06-18 09:04:11,2024-06-19 13:29:05
5,"Cone Crushers Market Is Expected To Reach USD 2,568.96 Million By 2032 As Revealed In ...",R.R. Equipment Company; Sandvik AB; Telsmith Inc. Terex Corporation; Tesan Engineering Ltd. Trimax Machinery; Weir Group Plc. Market Segmentation: The ...,www.whatech.com,2024-06-18 14:04:11+00:00,2024-06-19 17:12:32
6,"Terex MPS to launch portable cone, impact plants at Hillhead - Pit &amp; Quarry",The company says the new WG220E cone crushing plant and the WV1400E vertical shaft impact crushing plant are designed primarily for the European ...,www.pitandquarry.com,2024-06-20 00:56:18+00:00,2024-06-20 07:12:44
7,"Surface Mining Global Market Report 2024 - By Report, Share, - openPR.com","... Terex* Corporation, Liebherr-International AG, HD Hyundai Infracore Co. ... LinkedIn: https://in.linkedin.com/company/the-business-research-company",www.openpr.com,2024-06-19 20:49:34+00:00,2024-06-20 07:12:44
8,Off-Highway Electric Vehicle Global Market Report 2024 - - openPR.com,"Kg, Solectrac LLC, Deere & Company, Terex* Corporation, Liebherr Group, Xuzhou Construction Machinery Group Co. ... company/the-business-research- ...",www.openpr.com,2024-06-19 20:27:33+00:00,2024-06-20 07:12:44
9,Mesabi Metallics appoints Joe Broking as President and CEO - Social News XYZ,"President and Chief Executive Officer of the company. “Mesabi Metallics is ... Terex Corporation, and Director of Financial Accounting, among other ...",www.socialnews.xyz,2024-06-19 19:33:04+00:00,2024-06-20 07:12:44
10,Bucket Wheel Excavator Market Is Anticipated To Increase At A Stable CAGR Over The ...,✦ Terex Corporation ✦ Techint ✦ Taiyuan Heavy Machinery Group ✦ Sanyhi ✦ Thyssenkrupp ✦ L＆H Industrial ✦ Kawasaki Heavy Industries,www.whatech.com,2024-06-19 12:34:44+00:00,2024-06-20 07:12:44
11,Form N-CSRS FIDELITY CAPITAL TRUST For: Apr 30 - StreetInsider,"... Company Act file number 811-02841. Fidelity Capital Trust. (Exact name of registrant ... Terex Corp. 489,600. 27,442. Timken Co. 676,996. 60,402.",www.streetinsider.com,2024-06-22 03:00:46+00:00,2024-06-22 07:12:56
12,EvoQuip adds Bison 170 to its crusher line - Construction &amp; Demolition Recycling,"EvoQuip, a United Kingdom-based brand of Terex Corp. that makes ... The company says the Bison 170's diesel-electric drive technology makes it a ...",www.cdrecycler.com,2024-06-21 21:17:33+00:00,2024-06-22 07:12:56
13,Zacks Research Comments on Terex Co.'s Q3 2025 Earnings (NYSE:TEX) - MarketBeat,"Terex Corporation manufactures and sells aerial work platforms and materials processing machinery worldwide. It operates in two segments, Materials ...",www.marketbeat.com,2024-06-21 21:05:07+00:00,2024-06-22 07:12:56
14,Noble Iron Secures $10 Million in Financing to Expand its Houston Fleet,The company has secured approximately $7.2 million U.S of manufacturer ... Terex aerial work platforms and light construction equipment. This ...,www.forconstructionpros.com,2024-06-21 18:18:29+00:00,2024-06-22 07:12:56
15,A Look Back at Heavy Machinery Stocks' Q1 Earnings: Oshkosh (NYSE:OSK) Vs The Rest ...,"... company, Terex (NYSE:TEX) today manufactures lifting and material handling equipment designed to move and hoist heavy goods and materials. Terex ...",ca.investing.com,2024-06-21 16:26:39+00:00,2024-06-22 07:12:56
16,"BUZZ-U.S. STOCKS ON THE MOVE-Google, Symantec, Terex, Shake Shack | Reuters",The packaged food company formed by the merger of ketchup maker H.J. Heinz Co and Kraft Foods Group Inc said sales fell 4.9 percent at Kraft and 4.1 ...,www.reuters.com,2024-06-21 14:54:09+00:00,2024-06-22 07:12:56
17,"11072 Shares in Rocket Pharmaceuticals, Inc. (NASDAQ:RCKT) Purchased by Virtu Financial LLC","Sells 4,520 Shares of Terex Co. (NYSE:TEX). You might be interested in: Foster Group Inc. Grows ...",www.defenseworld.net,2024-06-21 14:42:43+00:00,2024-06-22 07:12:56
18,A Look Back at Heavy Machinery Stocks' Q1 Earnings: Oshkosh (NYSE:OSK) Vs The Rest ...,"With humble beginnings as a dump truck company, Terex (NYSE:TEX) today manufactures lifting and material handling equipment designed to move and hoist ...",au.finance.yahoo.com,2024-06-21 13:12:41+00:00,2024-06-22 07:12:56
19,"BUZZ-U.S. STOCKS ON THE MOVE-Microsoft, Staar Surgical, NF Energy | Reuters","** TEREX CORP, $22.44, -4.59 pct. ** MANITOWOC CO INC, $19.01, -5.09 pct. ** JOY GLOBAL INC, $41.34, -5.21 pct. Caterpillar on Tuesday warned the ...",www.reuters.com,2024-06-21 09:05:52+00:00,2024-06-22 07:12:56
20,Knuckle Boom Offshore Crane Market is Gaining Momentum with Key Players | Taiwan News,Terex Corporation Kenz Figee Liebherr Manitowoc Konecranes National Oilwell Varco Palfinger Cargotec. Most important types of Knuckle Boom Offshore ...,www.taiwannews.com.tw,2024-06-21 06:01:29+00:00,2024-06-22 07:12:56
21,U.S. Construction Equipment Industry Report 2024-2029 - New - GlobeNewswire,"Terex Corporation; Zoomlion Heavy Industry Science & Technology Co., Ltd. CASE Construction Equipment. Other Prominent Vendors. Kubota; Toyota ...",www.globenewswire.com,2024-06-20 14:09:27+00:00,2024-06-22 07:12:56
22,Codington County requests bids on “long overdue” road repair - AOL.com,"In other park news, Terex Corporation of Watertown has donated 17 deciduous trees obtained through the National Resources Conservation Services.",www.aol.com,2024-06-20 11:28:51+00:00,2024-06-22 07:12:56
23,Mesabi Metallics appoints Joe Broking as President and CEO - ETHRWorld.com,"While there, he led the transformation of the company's Scully Mine, an ... Terex Corporation, and Director of Financial Accounting, among other ...",hr.economictimes.indiatimes.com,2024-06-20 06:32:48+00:00,2024-06-22 07:12:56
24,"Analysts Issue Forecasts for NextEra Energy, Inc.'s FY2027 Earnings (NYSE:NEE)",Q3 2025 Earnings Estimate for Terex Co. (NYSE:TEX) Issued By Zacks Research. You might be interested in:.,www.defenseworld.net,2024-06-22 08:31:57+00:00,2024-06-23 07:12:27
25,Cranes Market to Reach $52.7 Billion by 2032 at a CAGR of 3.2% As Revealed In New Report,"Cargotec Corporation; Terex Corporation; Zoomlion Heavy Industry Science and Technology Co., Ltd. Kito Corporation; Konecranes Plc. Liebherr ...",www.whatech.com,2024-06-24 06:46:16+00:00,2024-06-24 07:12:44
26,The Future of Sustainable Lighting: Mobile Light Tower Market Trends In New Report,"The key market players analyzed in the global mobile light tower market report include Terex ... Company, Youngman Richardson & Co. Ltd, Atlas Copco AB, ...",www.whatech.com,2024-06-24 06:46:15+00:00,2024-06-24 07:12:44
27,Long boom Terex 80t RT | Vertikal.net,Terex Rough Terrain Cranes has launched a new longer boomed 80 tonne ... The crane is fitted with the company's wider 'Space' cab which can be ...,vertikal.net,2024-06-24 05:05:02+00:00,2024-06-24 07:12:44
28,"PNC Financial Services Group Inc. Sells 1530 Shares of Roku, Inc. (NASDAQ:ROKU)",... company in its most recent disclosure with the Securities and ... (NYSE:CVE) Shares Sold by PNC Financial Services Group Inc. NEXT HEADLINE ». Terex Co.,www.defenseworld.net,2024-06-23 21:51:17+00:00,2024-06-24 07:12:44
29,"PNC Financial Services Group Inc. Raises Position in Juniper Networks, Inc. (NYSE:JNPR)",(NYSE:CVE) Shares Sold by PNC Financial Services Group Inc. NEXT HEADLINE ». Terex Co. ... Eli Lilly and Company (NYSE:LLY) Shares Sold by Meyer ...,www.defenseworld.net,2024-06-23 21:51:16+00:00,2024-06-24 07:12:44
30,"Terex : Conflict Minerals Report for Calendar Year Ended December 31, 2023","Section 1: Introduction and Company Overview. This report of Terex Corporation (""Terex,"" ""Company,"" or ""we"") for the year ended December 31, 2023 ...",www.marketscreener.com,2024-06-25 00:46:24+00:00,2024-06-25 06:12:13
31,United closes Oz deal | Vertikal.net,"... company in the region. This is not United's first venture in Australia ... Terex Rough Terrain Cranes has launched a longer boomed 80t RT, the TRT 80L.",vertikal.net,2024-06-25 00:11:13+00:00,2024-06-25 06:12:13
32,Manitowoc (MTW) Wraps Up Aspen Acquisition for $51 Million - Yahoo Sport Australia,"Terex has an estimated earnings growth rate of 2,207.6% for 2021. The company's shares have appreciated 47.4% so far this year. ADVERTISEMENT.",au.sports.yahoo.com,2024-06-24 18:59:56+00:00,2024-06-25 06:12:13
33,Wellington Management Group LLP Has $47.32 Million Stock Position in FirstEnergy Corp ...,"(NYSE:FE – Free Report) by 52.3% during the fourth quarter, according to the company in its most recent Form 13F filing with the SEC. ... Terex Co.",www.defenseworld.net,2024-06-24 14:58:01+00:00,2024-06-25 06:12:13
34,Is The Options Market Predicting A Spike In Terex (TEX) Stock? - Yahoo Finance,"What do the Analysts Think? Clearly, options traders are pricing in a big move for Terex shares, but what is the fundamental picture for the company?",finance.yahoo.com,2024-06-24 14:41:19+00:00,2024-06-25 06:12:13
35,"Terex to get $595 mln, EUR200 mln from sale of Material Handling and Port Solutions business","June 24 (Reuters) - Terex Corp: * On June 21, 2016, entered into amendment to stock and asset purchase agreement with Konecranes PLC.",www.reuters.com,2024-06-24 07:30:12+00:00,2024-06-25 06:12:13
36,"United States Construction Equipment Market Key Players, Growth Analysis during 2024-2032","Key players in the United States construction equipment market include Kobelco Construction Machinery, Komatsu Ltd., Terex Corporation, Hyundai ...",www.taiwannews.com.tw,2024-06-26 05:44:41+00:00,2024-06-26 07:12:55
37,New leadership at Terex Washing Systems - Pit &amp; Quarry,"Mark Fisher, who is being introduced at this week's Hillhead, was appointed business line director for the company.",www.pitandquarry.com,2024-06-26 05:19:26+00:00,2024-06-26 07:12:55
38,Faresin adds to UK distribution - Vertikal.net,"The company, founded in 1970 by Warwick Ward, is one of the largest ... Terex and Keestrack. The Faresin diesel line up runs from a classic six ...",vertikal.net,2024-06-26 04:57:30+00:00,2024-06-26 07:12:55
39,Is The Options Market Predicting A Spike In Terex (TEX) Stock? - MSN,Investors in Terex Corporation TEX need to pay close attention to the stock based on moves in the options market lately.,www.msn.com,2024-06-26 01:52:06+00:00,2024-06-26 07:12:55
40,Q1 Earnings Roundup: Lindsay (NYSE:LNN) And The Rest Of The Heavy Machinery Segment,"Terex reported revenues of $1.29 billion, up 4.6% year on year, outperforming analysts' expectations by 5%. It was a stunning quarter for the company, ...",ca.investing.com,2024-06-26 00:53:51+00:00,2024-06-26 07:12:55
41,Terex Washing Systems appoint Fisher to new role - Quarry Magazine,Mark Fisher has been unveiled as new business line director for Terex Washing Systems at the industry's largest exhibition.,www.quarrymagazine.com,2024-06-26 00:48:53+00:00,2024-06-26 07:12:55
42,Kerry O'Sullivan joins Aviation Technical Services as COO - AviTrader,"... Terex Corporation. He attended the University of Phoenix, holds an ... business, leading the company to revise its 2024 guidance. In the first half ...",avitrader.com,2024-06-25 16:53:44+00:00,2024-06-26 07:12:55
43,Mining Equipment Market Is Expected To Reaching Nearly USD 199.47 Billion By 2030.,"Terex Corporation (Westport, Connecticut, USA) 2. Astec Industries ... The company's vision is to be an integral part of the client's business as a ...",www.whatech.com,2024-06-25 06:21:23+00:00,2024-06-26 07:12:55
44,"Mizuho Financial Group, Inc. (NYSE:MFG) Shares Sold by PNC Financial Services Group Inc.","It operates through Retail & Business Banking Company, Corporate & Institutional Company ... Quadrature Capital Ltd Purchases Shares of 5,550 Terex Co.",www.defenseworld.net,2024-06-26 08:56:36+00:00,2024-06-26 12:12:34
45,"PNC Financial Services Group Inc. Sells 203 Shares of LGI Homes, Inc. (NASDAQ:LGIH)","The company also engages in the wholesale business, which include building ... Quadrature Capital Ltd Purchases Shares of 5,550 Terex Co. (NYSE:TEX) ...",www.defenseworld.net,2024-06-26 08:55:19+00:00,2024-06-26 12:12:34
46,Terex (TEX) Declines More Than Market: Some Information for Investors - MSN,"The company is forecasted to report an EPS of $1.41, showcasing a 5.22% upward movement from the corresponding quarter of the prior year. Meanwhile, ...",www.msn.com,2024-06-26 06:31:38+00:00,2024-06-26 12:12:34
47,Q1 Earnings Roundup: Lindsay (NYSE:LNN) And The Rest Of The Heavy Machinery Segment,"With humble beginnings as a dump truck company, Terex (NYSE:TEX) today ... Company's future performance, business prospects or opportunities. All ...",www.theglobeandmail.com,2024-06-26 06:00:36+00:00,2024-06-26 12:12:34
48,"Despite Fast-paced Momentum, Terex (TEX) Is Still a Bargain Stock - Yahoo Life UK","I wasn't going to question that, because it's none of my business.” ADVERTISEMENT. Advertisement. And she conceded that she had been angry with Robert ...",uk.style.yahoo.com,2024-06-26 05:07:32+00:00,2024-06-26 12:12:34
49,U.S. Excavator Market Trends Report 2024-2030: Analysis by - GlobeNewswire,Mitsubishi Heavy Industries Ltd. Sany America; Terex Corporation. Key Topics Covered: Chapter 1. Methodology and Scope Chapter 2. Executive Summary,www.globenewswire.com,2024-06-26 03:10:02+00:00,2024-06-26 12:12:34
50,Looking Into Terex's Recent Short Interest - Terex (NYSE:TEX) - Benzinga,"The company recently reported that it has 3.95 million shares sold short, which is 8.07% of all regular shares that are available for trading. Based ...",www.benzinga.com,2024-06-26 14:28:48+00:00,2024-06-26 16:12:32
51,"U.S. Campbell Soup, Tesla, Walgreens - XM","* Terex Corp TEX.N: Citigroup initiates coverage with neutral rating; target price $60. * Tesla Inc TSLA.O: RBC Expects Q2 Deliveries of 410,000 vs ...",www.xm.com,2024-06-26 13:47:23+00:00,2024-06-26 16:12:32
52,"Photos from Hillhead 2024 in Buxton – Europe's largest construction, recycling and ...","... Terex Group (Powerscreen, Finlay, EvoQuip, MDS, and Terex Washing ... Advertise My Business- Ad Manager- Place your Ad- Submit your story- Advertise ...",www.buxtonadvertiser.co.uk,2024-06-26 13:43:15+00:00,2024-06-26 16:12:32
53,Form N-CSRS BNY MELLON MIDCAP INDEX For: Apr 30 - StreetInsider,"Terex Corp. 40,313. 2,259,544. The Middleby Corp. 32,635. <sup>a</sup>. 4,535,286. The Timken Company. 39,753. 3,546,763. The Toro Company. 63,385. 5,551,892.",www.streetinsider.com,2024-06-26 12:41:22+00:00,2024-06-26 16:12:32
54,Citi sees upside for Terex stock but stays on the sidelines with Neutral rating - Investing.com,Terex Corporation's (NYSE:TEX) financial metrics and market performance underscore several key strengths that align with the company's strategic goals ...,www.investing.com,2024-06-26 12:16:59+00:00,2024-06-26 16:12:32
55,"PNC Financial Services Group Inc. Acquires 2,754 Shares of United Microelectronics Co ...","(NASDAQ:OKTA) Shares Sold by PNC Financial Services Group Inc. NEXT HEADLINE ». Quadrature Capital Ltd Purchases Shares of 5,550 Terex Co. (NYSE ...",www.defenseworld.net,2024-06-26 08:58:39+00:00,2024-06-26 16:12:32
56,Looking Into Terex's Recent Short Interest By Benzinga - Investing.com UK,Terex's (NYSE:TEX) short percent of float has risen 16.79% since its last report. The company recently reported that it has 3.95 million shares ...,uk.investing.com,2024-06-26 16:04:56+00:00,2024-06-26 19:12:35
57,New leadership for Terex Washing Systems - Agg-Net,"Mark Fisher joins TWS as business line director. Terex Washing Systems have introduced their new leader at Hillhead 2024, with Mark Fisher ...",www.agg-net.com,2024-06-26 20:21:43+00:00,2024-06-26 23:12:35
58,ORBCOMM Inc. Launches Next-Generation CT 3600 Reefer Container Monitoring Device,Terex Corporation to Offer Orbcomm&#146;S Factory Installed Lte ... Company Profile. ORBCOMM Inc. is a United States-based company. The ...,www.marketscreener.com,2024-06-26 16:48:07+00:00,2024-06-26 23:12:35
59,Point of Rental named an Inc. 'Best Place to Work',"... company has been listed. “A few years ago, we set a 10-year big ... Corp.; Terex Corp. READ MORE- ADD TO CART- Herc Rentals. Article. 1 min ...",news.ararental.org,2024-06-27 18:20:01+00:00,2024-06-27 19:12:21
60,HBS Systems partners with GleanQuote - Rental Management,Company News- partnership. Like. Share. Save. Subscribe. Share. Related. View All ... Corp.; Terex Corp. READ MORE- ADD TO CART- Herc Rentals.,news.ararental.org,2024-06-27 18:19:56+00:00,2024-06-27 19:12:21
61,The latest screening equipment for producers - Pit &amp; Quarry,"The latest screening equipment for producers. June 27, 2024 | By P&Q Staff. Photo: Terex MPS ... company says. 'Revolutionary ...",www.pitandquarry.com,2024-06-27 15:06:01+00:00,2024-06-27 19:12:21
62,"Tipper Pads Market Poised for Steady Growth, Expected to Reach $5.12 Billion by 2028","The Business Research Company's Tipper Pads Global Market Report ... Key players in the tipper pads market include Mahle GmbH, Terex Corporation ...",tech.einnews.com,2024-06-27 14:27:21+00:00,2024-06-27 19:12:21
63,"Vanguard Group Inc. Decreases Stake in Lantheus Holdings, Inc. (NASDAQ:LNTH)","... companies with MarketBeat.com's FREE daily email newsletter. « PREVIOUS HEADLINE. Vanguard Group Inc. Sells 99,594 Shares of Terex Co. (NYSE:TEX) ...",www.defenseworld.net,2024-06-27 13:13:31+00:00,2024-06-27 19:12:21
64,Check out the massive machines that were up for sale at a 'heavy equipment auction' in ...,"It was the most expensive machine purchased, selling for $299,120. 2014 TEREX ...",ca.movies.yahoo.com,2024-06-27 12:18:39+00:00,2024-06-27 19:12:21
65,Blasting Barriers to Entry in Quarrying and Construction - Agg-Net,"The company's award-winning National Skills and Safety Park is playing ... Mark Fisher, the new business line director at Terex Washing Systems ...",www.agg-net.com,2024-06-27 11:25:44+00:00,2024-06-27 19:12:21
66,"Scissor Lift Market Share, Analysis, Size, and Forecast 2023 to 2032 | Taiwan News",(Oshkosh Corporation Company) Terex Corporation Aichi Corporation Linamar Corporation (Skyjack Inc.) Haulotte Group Beijing Jingcheng Heavy ...,www.taiwannews.com.tw,2024-06-27 11:14:16+00:00,2024-06-27 19:12:21
67,Citigroup Initiates Coverage of Terex (TEX) with Neutral Recommendation - Nasdaq,"Terex's products are manufactured in North and South America, Europe, Australia, and Asia and sold worldwide. The Company engages with customers ...",www.nasdaq.com,2024-06-27 06:18:11+00:00,2024-06-27 19:12:21
68,Terex launches 80 tonne capacity rough terrain crane - American Cranes &amp; Transport,"Terex launches 80 tonne capacity rough terrain crane ... At the 2024 Liebherr Customer Days, the company unveiled its new 6-axle crane with Y-guying.",www.cranebriefing.com,2024-06-27 19:16:13+00:00,2024-06-27 23:12:30
69,Dynapac celebrates 90th anniversary with charity partnership - Rental Management,... company said. “We are honored to support Dream On 3 as part of our ... Corp.; Terex Corp. READ MORE- ADD TO CART- Herc Rentals. Article. 1 min ...,news.ararental.org,2024-06-27 18:20:05+00:00,2024-06-27 23:12:30
70,Magni America opens new US headquarters - Rental Management,"The company's new headquarters features 26,000 sq. ft. of office ... Corp.; Terex Corp. READ MORE- ADD TO CART- Herc Rentals. Article. 1 min ...",news.ararental.org,2024-06-27 18:19:59+00:00,2024-06-27 23:12:30
71,25 years of Cranes &amp; Access - Vertikal.net,Long boom Terex 80t RT ... LGMG has formed a partnership with Danish company Trackunit up to provide telematics solutions for its European aerial lifts.,vertikal.net,2024-06-28 01:46:30+00:00,2024-06-28 04:12:43
72,LiftEx 2024 - Cranes Today,Partner Content. Zentratec- EET Corporation- Sarens nv- Van Beest B.V. More Relevant. News- Bardonaro appointed Terex global sales- News- Japan ...,www.cranestodaymagazine.com,2024-06-27 23:58:11+00:00,2024-06-28 04:12:43
73,Shares of several companies in the broader industrials sector are trading lower in sympathy ...,"Image for Terex Corporation. Terex Corporation- $TEX. 6/26/2024, $60.00, Neutral. Citigroup. Image for Oshkosh Corporation (Holding Company). Oshkosh ...",quantisnow.com,2024-06-27 22:19:09+00:00,2024-06-28 04:12:43
74,"Vanguard Group Inc. Sells 259823 Shares of Euronet Worldwide, Inc. (NASDAQ:EEFT)","Sells 99,594 Shares of Terex Co. (NYSE:TEX)- NEXT HEADLINE ». Herc ... Johns Investment Management Company LLC Boosts Position in Chevron Co.",www.defenseworld.net,2024-06-27 20:35:09+00:00,2024-06-28 04:12:43
75,Waste heat efficiency roll-out helping to reduce carbon emissions | Agg-Net,"... company's goal of 10 implementations by the end of 2024 and saving a ... Mark Fisher, the new business line director at Terex Washing Systems ...",www.agg-net.com,2024-06-28 14:37:51+00:00,2024-06-28 17:12:22
76,Raymond James Initiates Coverage On Terex with Market Perform Rating - Quantisnow,"He joins Terex from The Timken Company, a $5 billion industrial manufacturing company, where since 2019 he had served as Head of Investor Relations.",quantisnow.com,2024-06-28 12:31:15+00:00,2024-06-28 17:12:22
77,Develon releases its first mini wheel excavator - Construction &amp; Demolition Recycling,The company touts its new excavator as the ideal combination of compact ... Terex Washing Systems adds executive- Construction sector retains ...,www.cdrecycler.com,2024-06-28 09:11:01+00:00,2024-06-28 17:12:22
78,'Impressive line-up': Terex reflects on Hillhead 2024 - Quarry Magazine,"In the demonstration, the company showcased the new Powerscreen 1300X Maxtrak cone crusher, EvoQuip Bison 220R jaw crusher, Finlay electric I-120RS ...",www.quarrymagazine.com,2024-06-28 01:10:08+00:00,2024-06-28 17:12:22
79,A Look Into Industrials Sector Value Stocks - Quantisnow,"Terex saw a decrease in earnings per share from 0.82 in Q4 to $0.74 now. The company's most recent dividend yield sits at 1.83%, which has increased ...",quantisnow.com,2024-06-27 21:03:08+00:00,2024-06-28 17:12:22
80,Is Terex Corp. (TEX) a good investment opportunity? - US Post News,"While Terex Corp. has underperformed by -0.08%, investors are advised to look at stock chart patterns for technical insight.",www.uspostnews.com,2024-06-28 18:35:46+00:00,2024-06-28 20:12:40
81,Montana acquisition for REIC | Vertikal.net,Kevin Fitzgerald – now executive chairman of REIC added: “Bigfork is an excellent company ... Long boom Terex 80t RT- 5. 25 years of Cranes ...,vertikal.net,2024-06-28 23:23:36+00:00,2024-06-29 00:12:38
82,Luxury cab - Vertikal.net,Most read. 1. Crane banner drop injures 10- 2. Luxury cab- 3. Two new Grove RTs- 4. Long boom Terex 80t RT ... Irish rental company Balloo Hire ...,vertikal.net,2024-06-28 23:17:12+00:00,2024-06-29 00:12:38
83,New Leadership for Terex Washing Systems at Hillhead 2024 - HUB-4.COM,"Terex Washing Systems was pleased to introduce its new leader at Hillhead 2024 exhibition, with Mark Fisher appointed as Business Line Director.",hub-4.com,2024-06-28 23:02:29+00:00,2024-06-29 00:12:38
84,Terex Utilities Service School offers hands-on technician training | Trailer Body Builders,"By submitting your information, you are agreeing to Endeavor Business Media's Terms of Service and Privacy Policy. Loading ...",www.trailer-bodybuilders.com,2024-06-29 02:46:35+00:00,2024-06-29 09:12:33
85,New sales director for MyCrane India - Cranes Today,... company. “India is proving to be one of the most receptive markets for ... Terex Cranes returns to profitability- News- More Mega Jack 300s in ...,www.cranestodaymagazine.com,2024-06-29 01:00:38+00:00,2024-06-29 09:12:33
86,More Sinobooms for Balloo | Vertikal.net,Irish rental company Balloo Hire Centres has added more Sinoboom all electric booms and scissor lifts. ... Long boom Terex 80t RT- 5. 25 years of ...,vertikal.net,2024-06-29 00:36:04+00:00,2024-06-29 09:12:33
87,United States Steel Co. (NYSE:X) Shares Acquired by Atlas Capital Advisors LLC,"(NYSE:X – Free Report) by 178.8% during the 1st quarter, according to the company ... Terex Co. (NYSE:TEX) Shares Sold by Atlas Capital Advisors LLC ...",www.defenseworld.net,2024-06-28 21:47:50+00:00,2024-06-29 09:12:33
88,"Insiders At Terex Sold US$15m In Stock, Alluding To Potential Weakness - Simply Wall St",The fact that multiple Terex Corporation ( NYSE:TEX ) insiders offloaded a considerable amount of shares over the past...,simplywall.st,2024-06-29 13:28:48+00:00,2024-06-29 21:12:31
