,Heading,Subheading,Publisher,Published,Found
352,Zip Co.'s Capital Raising - Global Legal Chronicle,"Terex Corporation's $2 Billion Acquisition of Environmental Solutions Group Business of Dover. July 24, 20244. OnRamp's $14.2 Million Seed and ...",globallegalchronicle.com,2024-07-24 12:46:52+00:00,2024-07-24 18:13:37
353,"Delta CEO, in Paris for the Olympics, says outage-related cancellations should end Thursday","CrowdStrike is the cybersecurity company whose ... Heavy-equipment manufacturer Terex plans to relocate its main offices within Norwalk, Conn.",www.stamfordadvocate.com,2024-07-24 18:26:17+00:00,2024-07-24 19:13:21
354,Amphenol: Q2 Earnings Snapshot - The Register Citizen,The company said it expects revenue in the range of $3.7 billion to ... Heavy-equipment manufacturer Terex plans to relocate its main offices within ...,.google.com,2024-07-24 18:21:18+00:00,2024-07-24 19:13:21
355,Alert: Nearly 600 Mexicans flee drug cartel violence to seek refuge in neighboring Guatemala,"Don't Miss ... Heavy-equipment manufacturer Terex plans to relocate its main offices within Norwalk, Conn. Business- CT-based equipment manufacturer ...",www.greenwichtime.com,2024-07-24 18:14:37+00:00,2024-07-24 19:13:21
356,CT Terex to acquire Dover Corp's ESG waste management for $2 billion - CT Insider,"The Norwalk-based company has agreed to purchase Downers Grove, Illinois-based Dover Corp.'s Environmental Solutions Group (ESG), which designs and ...",www.ctinsider.com,2024-07-24 17:56:03+00:00,2024-07-24 19:13:21
357,"Person found dead in Burlington home on Smith Lane, state police say - The Middletown Press","Heavy-equipment manufacturer Terex plans to relocate its main offices within Norwalk, Conn. Business- CT-based equipment manufacturer Terex to buy ...",.google.com,2024-07-24 17:47:21+00:00,2024-07-24 19:13:21
358,Boston Scientific: Q2 Earnings Snapshot - New Canaan Advertiser,The company expects full-year earnings in the range of $2.38 to $2.42 ... Heavy-equipment manufacturer Terex plans to relocate its main offices within ...,www.ncadvertiser.com,2024-07-24 17:40:39+00:00,2024-07-24 19:13:21
359,Fortive: Q2 Earnings Snapshot - New Canaan Advertiser,The company said it expects revenue in the range of $1.55 billion for ... Heavy-equipment manufacturer Terex plans to relocate its main offices within ...,www.ncadvertiser.com,2024-07-24 17:40:35+00:00,2024-07-24 19:13:21
360,Bitcoin Reward Firm Fold Said to Near Deal With Betsy Cohen SPAC,... company started by SPAC veteran Betsy ... Lawyers from Fried Frank and Pryor Cashman guided Terex in its $2 billion deal to acquire Dover Corp.,news.bloomberglaw.com,2024-07-24 05:24:32+00:00,2024-07-24 19:13:21
361,"'Cher: The Memoir, Part One' to come out in November. Part Two is set for 2025 - CTPost","Carol and Dawn Taubl, co-founders of the SOUND & Stage Musical Theater Company in... ... Heavy-equipment manufacturer Terex plans to relocate its main ...",www.ctpost.com,2024-07-24 20:41:40+00:00,2024-07-24 21:13:30
362,New to volunteering? A how-to guide to find the right fit - Stamford Advocate,"Two Roads Brewing Company's annual Summer Fest was held at the Stratford brewery on Friday, ... Heavy-equipment manufacturer Terex plans to relocate its ...",www.stamfordadvocate.com,2024-07-24 20:17:37+00:00,2024-07-24 21:13:30
363,Knight-Swift: Q2 Earnings Snapshot - NewsTimes,"The trucking company posted revenue of $1.85 billion in the period, also missing Street forecasts. ... Heavy-equipment manufacturer Terex plans to ...",www.newstimes.com,2024-07-24 20:16:53+00:00,2024-07-24 21:13:30
364,Lamb Weston: Fiscal Q4 Earnings Snapshot - Greenwich Time,"For the year, the company reported profit of $725.5 million, or $4.98 per share. ... Heavy-equipment manufacturer Terex plans to relocate its main ...",www.greenwichtime.com,2024-07-24 19:56:55+00:00,2024-07-24 21:13:30
365,"Lamb Weston, Tesla fall; Tenet Healthcare, Mattel rise; Wednesday, 7/24/2024 - TheHour","The data storage company reported profits that ... Heavy-equipment manufacturer Terex plans to relocate its main offices within Norwalk, Conn.",www.thehour.com,2024-07-24 19:55:37+00:00,2024-07-24 21:13:30
366,"Reckitt to Sell Some Homecare Brands, Review Formula Unit (3)","... company said in a statement, and a sale will help streamline the business. ... Terex in its $2 billion deal to acquire Dover Corp.'s environmental ...",news.bloomberglaw.com,2024-07-24 18:39:23+00:00,2024-07-24 21:13:30
367,Teradyne: Q2 Earnings Snapshot - CTPost,The company said it expects revenue in the range of $680 million to ... Heavy-equipment manufacturer Terex plans to relocate its main offices within ...,www.ctpost.com,2024-07-24 22:10:56+00:00,2024-07-24 23:13:21
368,"Dump truck rolls over onto car in North Branford crash, officials say - CT Insider","North Branford Fire Department Headquarters Company One ... Heavy-equipment manufacturer Terex plans to relocate its main offices within Norwalk, Conn.",www.ctinsider.com,2024-07-24 21:36:23+00:00,2024-07-24 23:13:21
369,Sallie Mae: Q2 Earnings Snapshot - Shelton Herald,The student loan company posted revenue of $783.3 million in the period. ... Heavy-equipment manufacturer Terex plans to relocate its main offices ...,www.sheltonherald.com,2024-07-24 21:26:02+00:00,2024-07-24 23:13:21
370,Terex Expands into Waste Management with Strategic $2B Acquisition - TipRanks.com,"Terex (TEX) has issued an update. Terex Corporation is set to acquire the Environmental Solutions Group from Dover Corporation for $2 billion, ...",www.tipranks.com,2024-07-24 21:08:20+00:00,2024-07-24 23:13:21
371,Remembering John Stevenson - Equipment Journal,The company would grow to specialize in crushing and concrete equipment ... Terex Corporation has signed a definitive agreement to acquire ...,www.equipmentjournal.com,2024-07-24 20:55:38+00:00,2024-07-24 23:13:21
372,Ford 2Q net income falls as combustion engine unit posts loss due to - The Middletown Press,Ford Motor Co.'s second-quarter net income fell 4.7% from a year ago as the company's ... Heavy-equipment manufacturer Terex plans to relocate its main ...,www.middletownpress.com,2024-07-24 20:51:10+00:00,2024-07-24 23:13:21
373,Appeals judges rule against fund used to provide phone services for rural and low-income people,"... Company, to determine how much to charge telecommunications companies. ... Heavy-equipment manufacturer Terex plans to relocate its main offices within ...",www.milfordmirror.com,2024-07-24 20:48:56+00:00,2024-07-24 23:13:21
374,Otis Worldwide: Q2 Earnings Snapshot - The Register Citizen,"The Farmington, Connecticut-based company said it had profit of $1.02 per share. ... Heavy-equipment manufacturer Terex plans to relocate its main ...",www.registercitizen.com,2024-07-24 18:54:04+00:00,2024-07-24 23:13:21
375,Alert: Boeing and the Justice Department detail the company's guilty plea involving ... - Darien Times,"Heavy-equipment manufacturer Terex plans to relocate its main offices within Norwalk, Conn. News- CT-based equipment manufacturer Terex to buy ESG ...",www.darientimes.com,2024-07-24 23:40:13+00:00,2024-07-25 02:13:22
376,"BMW recalls over 291,000 SUVs because interior cargo rails can detach in crash, raising injury risk",The company says in documents posted by U.S. safety regulators that ... Heavy-equipment manufacturer Terex plans to relocate its main offices within ...,www.theridgefieldpress.com,2024-07-24 23:12:37+00:00,2024-07-25 02:13:22
377,"CrowdStrike blames bug for letting bad data slip through, leading to global tech outage",The company on Wednesday posted details online from its “preliminary ... Heavy-equipment manufacturer Terex plans to relocate its main offices within ...,www.ctpost.com,2024-07-24 23:04:31+00:00,2024-07-25 02:13:22
378,United Rentals: Q2 Earnings Snapshot - The Middletown Press,"The equipment rental company posted revenue of $3.77 billion in the period, which met Street forecasts. ... Heavy-equipment manufacturer Terex plans to ...",www.middletownpress.com,2024-07-24 20:51:08+00:00,2024-07-25 02:13:22
379,Great Ajax: Q2 Earnings Snapshot - Trumbull Times,"The company's shares closed at $3.85. A year ago, they were trading at ... Heavy-equipment manufacturer Terex plans to relocate its main offices within ...",www.trumbulltimes.com,2024-07-25 04:34:24+00:00,2024-07-25 07:13:28
380,"Killingly bomb threat spurs evacuation of North Main Street business, police say - CT Insider","The northern lights were spotted from Hebron, Connecticut, on Friday, May 11. CT-based equipment manufacturer Terex to buy ESG waste management in $2 ...",www.ctinsider.com,2024-07-25 04:23:17+00:00,2024-07-25 07:13:28
381,P.A.M. Transportation: Q2 Earnings Snapshot - Shelton Herald,The trucking company posted revenue of $182.9 million in the period. ... Heavy-equipment manufacturer Terex plans to relocate its main offices within ...,www.sheltonherald.com,2024-07-24 21:25:10+00:00,2024-07-25 07:13:28
382,It's All Good: A delivery driver got a big surprise this summer - CT Insider,"I had not counted on company. So I hastily ... Heavy-equipment manufacturer Terex plans to relocate its main offices within Norwalk, Conn.",www.ctinsider.com,2024-07-25 09:14:29+00:00,2024-07-25 10:13:23
383,"Basware Revolutionizes Office of the CFO, Named a Leader in Inaugural IDC Accounts ...",Chemical company Huntsman prevented ... Materials processing machinery manufacturer Terex Corporation increased on-time payments to 85% with AI.,www.morningstar.com,2024-07-25 08:37:31+00:00,2024-07-25 10:13:23
384,"Basware Revolutionizes Office of the CFO, Named a Leader in Inaugural IDC Accounts ...","Materials processing machinery manufacturer Terex Corporation increased on-time payments to 85% with AI. ... company Glantus, alongside key ...",www.prnewswire.com,2024-07-25 08:01:14+00:00,2024-07-25 10:13:23
385,Norwalk-based Terex to acquire solid waste management company for $2B,"Terex Corp., a publicly traded company based in Norwalk that produces materials processing machinery and aerial work platforms, is expanding with ...",www.hartfordbusiness.com,2024-07-25 15:34:55+00:00,2024-07-25 16:13:31
386,Diamond Mowers' new rooftop cooler increases operating longevity - Equipment Journal,As the latest addition to the company's line of skid-steer attachments and ... Terex Corporation has signed a definitive agreement to acquire ...,www.equipmentjournal.com,2024-07-25 14:42:34+00:00,2024-07-25 16:13:31
387,Dover's Second-Quarter Profit Rises on Strong Engineered Product Demand - USNews.com,"... Terex Corp in an all-cash deal valued at $2 billion. Dover's net income ... The company reported a 4% rise in quarterly revenue, to about ...",www.usnews.com,2024-07-25 14:33:13+00:00,2024-07-25 16:13:31
388,Dover's second-quarter profit rises on strong engineered product demand - MarketScreener,Terex Corporation entered into definitive agreement to acquire ... Corporation. More charts- Company Profile. Logo Dover Corporation. Dover ...,www.marketscreener.com,2024-07-25 12:58:59+00:00,2024-07-25 16:13:31
389,Dover Corporation Reports Earnings Results for the Second Quarter and Six Months Ended ...,Terex Corporation entered into definitive agreement to acquire Environmental Solutions Group from Dover Corporation for approximately $2 billion.,www.marketscreener.com,2024-07-25 12:24:51+00:00,2024-07-25 16:13:31
390,AEM visits Terex Utilities during manufacturing express tour,"On July 22, city officials and area business leaders visited Terex Utilities to recognise the company and its team members for their contributions ...",www.ivtinternational.com,2024-07-25 10:48:20+00:00,2024-07-25 16:13:31
391,Biotech company's CEO pleads guilty in Mississippi welfare fraud case - CTPost,The chief executive officer of a biotech company with ties to the largest public ... Heavy-equipment manufacturer Terex plans to relocate its main ...,www.ctpost.com,2024-07-25 08:10:31+00:00,2024-07-25 16:13:31
392,GLG Life Tech: Q1 Earnings Snapshot - The Middletown Press,"On a per-share basis, the Richmond, British Columbia-based company said it had a loss of 13 cents. ... Heavy-equipment manufacturer Terex plans to ...",www.middletownpress.com,2024-07-25 03:47:50+00:00,2024-07-25 16:13:31
393,A company insider recently sold 12500 shares of Terex Corp. [TEX]. Should You Sale?,Investors can expect a company's stock to rise or fall based on the buying and selling of stock by its insiders. Terex Corp. shares valued at ...,knoxdaily.com,2024-07-25 16:10:12+00:00,2024-07-25 18:13:18
394,Looking Westward: AEM Manufacturing Express Travels on to South Dakota,"... Terex Utilities, Dakota Bodies, and Crenlo Engineered Cabs. The ... company's long-standing reputation as a trusted freight logistics company.",www.aem.org,2024-07-25 14:35:03+00:00,2024-07-25 18:13:18
395,Plexus: Fiscal Q3 Earnings Snapshot - CT Insider,The company said it expects revenue in the range of $990 million to ... Heavy-equipment manufacturer Terex plans to relocate its main offices within ...,www.ctinsider.com,2024-07-25 08:49:45+00:00,2024-07-25 18:13:18
396,Icon PLC: Q2 Earnings Snapshot - The Middletown Press,"On a per-share basis, the Dublin 18, Ireland-based company said it had profit of $1.76. ... Heavy-equipment manufacturer Terex plans to relocate its ...",www.middletownpress.com,2024-07-25 03:47:50+00:00,2024-07-25 18:13:18
397,Kaiser: Q2 Earnings Snapshot - The Middletown Press,The aluminum products company posted revenue of $773.4 million in the period. ... Heavy-equipment manufacturer Terex plans to relocate its main offices ...,www.middletownpress.com,2024-07-25 03:47:49+00:00,2024-07-25 18:13:18
398,Emcor Group: Q2 Earnings Snapshot - CT Insider,"The construction and maintenance company posted ... Heavy-equipment manufacturer Terex plans to relocate its main offices within Norwalk, Conn.",www.ctinsider.com,2024-07-25 17:46:03+00:00,2024-07-25 20:13:38
399,Company says manufacturing problem was behind wind turbine blade breaking off Nantucket Island,More For You- JetBlue to add more flights to Florida this winter from CT out of Bradley- CT-based equipment manufacturer Terex to buy ESG waste ...,www.ctinsider.com,2024-07-25 20:34:52+00:00,2024-07-25 22:13:23
400,"Workers at GM seat supplier in Missouri reach tentative agreement, end strike - CT Insider","... company, ending a strike that was in its fourth day. About 480 workers ... Heavy-equipment manufacturer Terex plans to relocate its main offices within ...",www.ctinsider.com,2024-07-25 19:54:38+00:00,2024-07-25 22:13:23
401,"Stubborn warranty costs push down Ford's 2Q net profits, causing stock plunge in after-hours trading","DETROIT (AP) — In October of 2020, Ford's then-new CEO Jim Farley said the company ... Heavy-equipment manufacturer Terex plans to relocate its main ...",www.stamfordadvocate.com,2024-07-25 08:45:41+00:00,2024-07-25 22:13:23
402,KLA: Fiscal Q4 Earnings Snapshot - The Middletown Press,"For the year, the company reported profit of $2.76 billion, or $20.28 per share. ... Heavy-equipment manufacturer Terex plans to relocate its main ...",www.middletownpress.com,2024-07-25 03:47:50+00:00,2024-07-25 22:13:23
403,Dover Corporation Provides Earnings Guidance for the Full Year 2024 - MarketScreener,Terex Corporation entered into definitive agreement to acquire ... Company Profile. Logo Dover Corporation. Dover Corporation is a diversified ...,www.marketscreener.com,2024-07-25 21:15:59+00:00,2024-07-25 23:13:26
404,Boeing completes deal to plead guilty over 737 Max crashes - Crain's Chicago Business,Terex to buy Dover's garbage-truck biz in $2 billion deal. Downers Grove-based Dover's environmental solutions business builds garbage trucks under ...,www.chicagobusiness.com,2024-07-25 19:34:01+00:00,2024-07-25 23:13:26
405,Dover Raises FY24 Adjusted EPS Outlook From $9.00 - $9.15 To $9.05 - $9.20 (Est $9.10),"The company reported quarterly sales of ... Image for Terex to Acquire Environmental Solutions Group (ESG) from Dover Corporation, Establishing.",quantisnow.com,2024-07-25 16:47:37+00:00,2024-07-25 23:13:26
406,Dover Corporation filed SEC Form 8-K: Results of Operations and Financial Condition ...,"Image for Terex to Acquire Environmental Solutions Group (ESG) from Dover Corporation, Establishing. Purchase price of $2.0 billion; $1.725 billion ...",quantisnow.com,2024-07-25 16:47:36+00:00,2024-07-25 23:13:26
407,OpenAI tests ChatGPT-powered search engine that could compete with Google - CT Insider,SAN FRANCISCO (AP) — OpenAI is testing a ChatGPT-powered search engine that could put the artificial intelligence company ... Terex plans to relocate ...,www.ctinsider.com,2024-07-25 20:33:43+00:00,2024-07-26 02:13:17
408,Taylor Morrison: Q2 Earnings Snapshot - Greenwich Time,"The Scottsdale, Arizona-based company said it had profit of $1.86 per share. ... Heavy-equipment manufacturer Terex plans to relocate its main offices ...",www.greenwichtime.com,2024-07-25 04:58:20+00:00,2024-07-26 10:13:18
409,Dover's Robust Growth and Strategic Reshaping Justify Buy Rating | Markets Insider,"The company's order trajectory remains robust, particularly in ... Baird views Dover sale of ESG business to Terex as 'a positive,' remains buyer.",markets.businessinsider.com,2024-07-26 06:19:53+00:00,2024-07-26 12:13:22
410,State Board of Administration of Florida Retirement System Raises Position in FirstCash ...,"The fund owned 13,130 shares of the company's ... State Board of Administration of Florida Retirement System Increases Holdings in Terex Co.",www.defenseworld.net,2024-07-26 09:00:37+00:00,2024-07-26 14:13:23
411,Airlines Turn To Generic Jet Parts From Heico (HEI) Amid Supply Shortage - Bloomberg,Aircraft parts distribution and trading company AAR Corp. ... Dover Corp. agreed to sell its garbage-truck manufacturing business to Terex Corp.,www.bloomberg.com,2024-07-26 14:17:17+00:00,2024-07-26 15:13:21
412,"Heavy Construction Equipment Market Surges to USD 253.52 Billion by 2031, Propelled by ...","KEY COMPANIES PROFILED. Deere & Company, Hyundai Construction Equipment Co. Ltd., SANY Group, Terex Corporation, JCB, AB Volvo, CNH Industrial.",finance.yahoo.com,2024-07-26 14:07:57+00:00,2024-07-26 15:13:21
413,Dover's second-quarter profit rises on strong engineered product demand - MSN,"The Grove, Illinois-based company's Engineered Products unit ... Terex Corp in an all-cash deal valued at $2 billion. Dover's net income ...",www.msn.com,2024-07-25 16:25:11+00:00,2024-07-26 15:13:21
414,Veris: Q2 Earnings Snapshot - Trumbull Times,"The company said it had net income of $2.9 million, or 3 cents per ... Heavy-equipment manufacturer Terex plans to relocate its main offices within ...",www.trumbulltimes.com,2024-07-25 04:34:20+00:00,2024-07-26 16:13:34
415,"Wedge Sockets Market to Set an Explosive Growth in Near Future: Slingmax, Konecranes ...","KITO Corporation (Japan), Columbus McKinnon Corporation (United States), Terex Corporation (United States), Chain & Rigging Supply, Inc. (United ...",www.newstrail.com,2024-07-26 14:41:28+00:00,2024-07-26 17:13:37
416,Northfield: Q2 Earnings Snapshot - New Haven Register,"The holding company for Northfield Bank posted ... Heavy-equipment manufacturer Terex plans to relocate its main offices within Norwalk, Conn.",www.nhregister.com,2024-07-25 03:26:59+00:00,2024-07-26 18:13:35
417,"U.S. Heavy Duty Construction Equipment Market Share, Future Trends, Comprehensive ... - menafn","(JCB), Komatsu America Corp., Liebherr Group, Sany Heavy Industries Co. Ltd, Terex Corporation, Ahern Rentals, Herc Rentals Inc., and United ...",menafn.com,2024-07-26 17:55:40+00:00,2024-07-26 19:13:36
418,This Week in Waste: Top Stories for July 22 – July 25,"Norwalk, Conn.-based Terex Corporation has agreed to purchase Environmental Solutions Group (ESG) from Dover Corporation. The $2 billion all-cash ...",www.waste360.com,2024-07-26 19:33:51+00:00,2024-07-26 21:13:27
419,"LIXIL Co. (OTCMKTS:JSGRY) Short Interest Up 1,680.0% in July - Defense World",LIXIL Company Profile. (Get Free Report). LIXIL Corporation ... Equities Analysts Issue Forecasts for Terex Co.'s FY2024 Earnings (NYSE ...,www.defenseworld.net,2024-07-27 12:51:11+00:00,2024-07-27 14:13:15
420,Terex to buy Dover's environmental solution business in deal valued at $2 billion,"(Reuters) -Terex said on Monday it would acquire Dover Corp's environmental solutions business in an all-cash deal valued at $2 billion, ...",www.msn.com,2024-07-27 08:37:32+00:00,2024-07-27 14:13:15
421,Dover price target raised to $219 from $208 at Baird - TipRanks.com,"Dover acquires Marshall Excelsior Company for $395M in cash- Baird views Dover sale of ESG business to Terex as 'a positive,' remains buyer.",www.tipranks.com,2024-07-27 06:37:14+00:00,2024-07-27 14:13:15
422,Dover raises FY24 adjusted EPS view to $9.05-$9.20 from $9.00-$9.15 - TipRanks.com,"The company said, “We are approaching the second half of 2024 constructively. ... Baird views Dover sale of ESG business to Terex as 'a positive,' ...",www.tipranks.com,2024-07-26 23:36:26+00:00,2024-07-27 16:13:26
423,"Earnings drive 3M to top industrial gainer of week, while dragging down Saia - MSN",... company Saia. Industrials was among the 7 of the 11 S&P 500 sectors ... Terex (TEX) +18.24%. The stock jumped +10.96% on Monday after the ...,www.msn.com,2024-07-27 16:53:12+00:00,2024-07-27 21:13:01
424,Forecast sees global demand for heavy equipment growing - Recycling Today,"... company. “This urban expansion accelerates construction ... and Terex Corp., based in the United States; Hyundai Construction Equipment Co.",www.recyclingtoday.com,2024-07-29 04:23:17+00:00,2024-07-29 06:13:19
425,O Shaughnessy Asset Management LLC Raises Holdings in Regal Rexnord Co. (NYSE:RRX),"(NYSE:RRX – Free Report) by 8.1% in the first quarter, according to the company ... O Shaughnessy Asset Management LLC Acquires 525 Shares of Terex Co.",www.defenseworld.net,2024-07-29 11:46:39+00:00,2024-07-29 13:13:27
426,Western Europe Construction Equipment Market Assessment 2024-2029 - GlobeNewswire,"Terex Corporation; Takeuchi Manufacturing; Hidromek; Tadano; KATO WORKS CO., LTD. MERLO S.p.A.; Bobcat; Haulotte; Toyota Material Handling; AMMANN ...",www.globenewswire.com,2024-07-29 11:11:43+00:00,2024-07-29 13:13:27
427,Bardonaro moves to Brock | Vertikal.net,... business. Frank Bardonaro In 2010 he resigned and joined Terex as managing director of Terex Cranes in the Americas and was promoted to managing ...,vertikal.net,2024-07-29 11:07:40+00:00,2024-07-29 13:13:27
428,Markets Brief: Fed Interest Rate Decision Looms - Morningstar,"What Stocks Are Up? Lumen Technologies LUMN, SunPower Corporation SPWR, 3M Company MMM, Bristol-Myers Squibb Company BMY, Terex Corporation TEX ...",www.morningstar.com,2024-07-29 10:19:46+00:00,2024-07-29 13:13:27
429,Earnings To Watch: Terex (TEX) Reports Q2 Results Tomorrow - Yahoo Finance,Lifting and material handling equipment company Terex (NYSE:TEX) will be reporting earnings tomorrow after market hours.,finance.yahoo.com,2024-07-29 09:28:22+00:00,2024-07-29 13:13:27
430,Backhoe Loader Market Estimated to Grow $25.77 Billion from 2024 to 2032,"... Co. Ltd., Terex Corporation, Volvo Construction Equipment and others. Our market research solution gives you answers to the following questions ...",www.thenrinews.com,2024-07-29 09:28:14+00:00,2024-07-29 13:13:27
431,Earnings To Watch: Terex (TEX) Reports Q2 Results Tomorrow - The Globe and Mail,Lifting and material handling equipment company Terex (NYSE:TEX) will be reporting earnings tomorrow after market hours. Here's what investors ...,www.theglobeandmail.com,2024-07-29 08:48:07+00:00,2024-07-29 13:13:27
432,Earnings To Watch: Terex (TEX) Reports Q2 Results Tomorrow - The Globe and Mail,"The majority of analysts covering the company have reconfirmed their estimates over the last 30 days, suggesting they anticipate the business to stay ...",www.theglobeandmail.com,2024-07-29 08:32:32+00:00,2024-07-29 13:13:27
433,Kranlyft UK unveils a new Maeda - Vertikal.net,"Terex CSE 32 self erecting tower crane. Nicola Castenetto, Business Line Director of Terex Self Erecting Cranes Some of the visitors also put their ...",vertikal.net,2024-07-29 15:28:50+00:00,2024-07-29 17:13:55
434,Earnings To Watch: Terex (TEX) Reports Q2 Results Tomorrow - Barchart.com,... company before making an investment based on rising investor interest or the fear of missing out. Investing in artificial intelligence (AI) companies ...,www.barchart.com,2024-07-29 14:34:00+00:00,2024-07-29 17:13:55
435,"O Shaughnessy Asset Management LLC Acquires 942 Shares of Teradyne, Inc. (NASDAQ:TER)",Corporate insiders own 0.36% of the company's stock. Teradyne Price ... O Shaughnessy Asset Management LLC Acquires 525 Shares of Terex Co.,www.defenseworld.net,2024-07-29 13:10:11+00:00,2024-07-29 17:13:55
436,This Insurance Company Agreed to Be Taken Private. Investors Don't Like the Deal,"Insurance company Enstar Group (ESGR) is going private. Investors ... Terex Stock Surges After Buying Dover Unit for $2B. Jul 29, 2024. Up Next.",www.investopedia.com,2024-07-29 22:01:01+00:00,2024-07-29 23:13:25
437,Asiens Börsen tiefer | 30.07.24 - finanzen.at,"Terex Corp. / Quartalszahlen. 30.07.24, TESEC CorpShs / Quartalszahlen. 30.07.24, The Kansai Electric Power Co. Inc. / Quartalszahlen. 30.07.24 ...",www.finanzen.at,2024-07-30 04:59:18+00:00,2024-07-30 07:13:25
438,Mallusk-based Tribe Tech ship first autonomous drill rig to Australia - The Irish News,"The company said its new machine, developed over four years ... Terex to cut more than 100 jobs across Co Tyrone sites due to industry slowdown ...",www.irishnews.com,2024-07-30 08:57:12+00:00,2024-07-30 11:13:15
