,Heading,Subheading,Publisher,Published,Found
177,Global Scissor Lift Tables Market 2023-2032 Market Leaders: Innovators and Pioneers,"Terex Corporation, Oshkosh Corporation（JLG Industries）, Haulotte Group, Snorkel, Niftylift, MEC Aerial Work Platforms, Advance Lifts, Pentalift ...",www.thenrinews.com,2024-07-11 15:10:12+00:00,2024-07-11 17:13:24
178,Decoding 5 Analyst Evaluations For Terex - Terex (NYSE:TEX) - Benzinga,"A Deep Dive into Terex's Financials. Market Capitalization: Indicating a reduced size compared to industry averages, the company's market ...",www.benzinga.com,2024-07-11 15:03:57+00:00,2024-07-11 17:13:24
179,"U.S. Corecivic, Eli Lilly, Wd-40 - XM",* Azek Company Inc AZEK.N: Citigroup cuts target price to $44 from $50. * B&G ... * Terex Corp TEX.N: Jefferies cuts target price to $55 from $68.,www.xm.com,2024-07-11 13:27:13+00:00,2024-07-11 17:13:24
180,Mining Lifting Equipment Market Trends Research Report [2024-2032] | 122 Pages - WICZ,TEREX-DEMAG; Caterpillar; Komatsu (Joy Global); Hitachi ... 2 Company Profiles 2.1 Company 2.1.1 Company Details 2.1.2 Company Major Business,www.wicz.com,2024-07-11 13:04:14+00:00,2024-07-11 17:13:24
181,"Calidi Biotherapeutics (NYSE:CLDI) Shares to Reverse Split on Monday, July 15th","The company reported ($0.20) EPS for the quarter, beating analysts ... Capstone Investment Advisors LLC Takes Position in Terex Co. (NYSE:TEX) ...",www.defenseworld.net,2024-07-11 11:39:26+00:00,2024-07-11 17:13:24
182,Global Truck-mounted Auger Drilling Market Recovery Strategies for Post-Pandemic Growth,"... Terex Corporation, Little Beaver, Premier Augers, Barbco. Market Segment by Product Type: Double Start , Single Start. Market Segment by Application ...",www.thenrinews.com,2024-07-11 10:48:46+00:00,2024-07-11 17:13:24
183,Asia Dragon (LON:DGN) Reaches New 1-Year High at $419.00 - Defense World,"The company has a market capitalization of £672.37 million, a P/E ... Jennison Associates LLC Grows Stake in Terex Co. (NYSE:TEX)- Jennison ...",www.defenseworld.net,2024-07-10 20:10:56+00:00,2024-07-11 17:13:24
184,Caterpillar (CAT) Trades Above 200-Day SMA: How to Play the Stock? - MSN,"The company is planning to double its output with a multi-year capital investment. ... The stock is also not cheap when compared with Komatsu, Terex ...",.google.com,2024-07-11 14:55:51+00:00,2024-07-11 23:13:24
185,Germany Construction Equipment Market Report 2024: Adoption - GlobeNewswire,Terex Corporation; Manitou Group; Takeuchi Manufacturing; DEVELON; Hidromek; Tadano; KATO Works. MERLO; Bobcat; Haulotte; Toyota Material Handling ...,www.globenewswire.com,2024-07-12 13:46:40+00:00,2024-07-12 17:13:39
186,Grader Market Size is Set to Reach US$ 5.77 Billion at a CAGR of 2.7% by 2033 - EIN News,"Leading companies in the market are Caterpillar Inc., Deere and Company, CNH Industrial N.V., Komatsu Ltd., and Terex Corporation, Volvo ...",www.einnews.com,2024-07-12 13:37:36+00:00,2024-07-12 17:13:39
187,"Automated Container Terminal Market Size, Share, Revenue, Trends And Drivers For 2024-2033","The Business Research Company's Automated Container Terminal Global ... Terex Corporation, Konecranes, Port of Hamburg Marketing, COSCO ...",www.einnews.com,2024-07-12 11:48:21+00:00,2024-07-12 17:13:39
188,Jefferies Reaffirms Their Hold Rating on Terex (TEX) | Markets Insider,"The company's shares closed yesterday at $52.11. Volkmann covers the Industrials sector, focusing on stocks such as Fastenal Company, Caterpillar, and ...",markets.businessinsider.com,2024-07-11 20:02:37+00:00,2024-07-12 17:13:39
189,JLG Whitepaper Offers Strategies for a “Safety First” Culture | Rental Equipment Register,"Haulotte Adds Rent Trade & Service Company as Distributor in Thailand ... Terex Net Sales Jump 16.6 Percent in 2023. Feb. 10, 2024. Photo by Hy ...",www.rermag.com,2024-07-12 20:42:06+00:00,2024-07-13 03:13:18
190,The Goldman Sachs Group Lowers AGCO (NYSE:AGCO) Price Target to $112.00,The brokerage presently has a “neutral” rating on the industrial products company's stock. ... Brokerages Set Terex Co ...,www.americanbankingnews.com,2024-07-13 13:55:51+00:00,2024-07-13 18:13:25
191,Mutual of America Capital Management LLC Decreases Stock Holdings in MSC Industrial ...,... companies with MarketBeat.com's FREE daily email newsletter. « PREVIOUS HEADLINE. Mutual of America Capital Management LLC Cuts Stake in Terex Co.,www.defenseworld.net,2024-07-13 17:58:14+00:00,2024-07-14 00:13:12
192,"O'Reilly Automotive, Inc.'s (NASDAQ:ORLY) Share Price Not Quite Adding Up","If we review the last year of earnings growth, the company posted a worthy increase of 14%. ... Stock Analysis. Insufficient Growth At Terex Corporation ...",simplywall.st,2024-07-14 14:49:46+00:00,2024-07-14 16:13:25
193,Insufficient Growth At Terex Corporation (NYSE:TEX) Hampers Share Price - Simply Wall St,"When close to half the companies in the United States have price-to-earnings ratios (or ""P/E's"") above 18x, you may consider Terex Corporation ...",simplywall.st,2024-07-14 14:41:39+00:00,2024-07-14 16:13:25
194,JPMorgan Chase Second Quarter 2024 Earnings: Beats Expectations - Simply Wall St News,The company's share price is broadly unchanged from a week ago. Risk ... Insufficient Growth At Terex Corporation (NYSE:TEX) Hampers Share Price.,simplywall.st,2024-07-14 14:32:21+00:00,2024-07-14 18:13:21
195,Aggregate Industries UK appoint new CEO - Agg-Net,"Mark Fisher, the new business line director at Terex Washing Systems- New leadership for Terex Washing Systems. 26/06/2024 09:20 | Plant & Equipment.",www.agg-net.com,2024-07-15 09:46:24+00:00,2024-07-15 12:13:32
196,Trump's wealth to surge by $1.7bn after assassination attempt - latest updates - The Telegraph,"Shares in Donald Trump's social media company have soared after his attempted assassination, adding $1 ... As Terex continues to navigate market ...",www.telegraph.co.uk,2024-07-15 16:51:26+00:00,2024-07-15 18:13:39
197,Terex: Manufacturing firm to cut about 100 jobs in Northern Ireland - BBC News,The United States company makes crushing and screening equipment used in industries like construction and mining. It said an “extraordinary surge in ...,www.bbc.co.uk,2024-07-15 16:50:11+00:00,2024-07-15 18:13:39
198,Envestnet Portfolio Solutions Inc. Raises Stock Position in Otis Worldwide Co. (NYSE:OTIS),Corporate insiders own 0.23% of the company's stock. Otis Worldwide ... Terex (TEX) – Analysts' Weekly Ratings Changes- HNI Co. (NYSE:HNI) ...,www.defenseworld.net,2024-07-15 16:46:09+00:00,2024-07-15 18:13:39
199,Up to 150 jobs at risk at NI manufacturing giant | BelfastTelegraph.co.uk,Up to 150 roles are at risk in Northern Ireland including through compulsory redundancy at manufacturing giant Terex after a Covid-era boom wore ...,www.belfasttelegraph.co.uk,2024-07-15 16:39:16+00:00,2024-07-15 18:13:39
200,Terex to cut more than 100 jobs across Co Tyrone sites due to industry slowdown,"US machinery giant Terex has announced plans to cut around 130 jobs across its sites in Co Tyrone. The engineering group, which employs hundreds ...",www.irishnews.com,2024-07-15 15:30:58+00:00,2024-07-15 18:13:39
201,"Global Construction Equipment Market Revenue, Price, Growth Rate, Forecast To 2030","An in-depth knowledge of company profiles of leading Worldwide ... Terex, Zoomlion, Shantui. Historical & Forecast Period. This study report ...",www.thenrinews.com,2024-07-15 15:06:35+00:00,2024-07-15 18:13:39
202,More than 100 jobs to go at Dungannon manufacturing firm Terex - Armagh I,"While the exact number is unknown, the US-owned business did say it was consulting on job losses after an “extraordinary surge in demand” for its ...",armaghi.com,2024-07-15 19:44:57+00:00,2024-07-15 21:13:28
203,Road Machinery &amp; Supplies Co. Acquires Ruffridge Johnson Equipment Company,Ruffridge Johnson was founded in 1936 and currently represents Terex MPS' Cedarapids line of crushing and screening products; Masaba conveying ...,www.constructionequipmentguide.com,2024-07-15 19:26:10+00:00,2024-07-15 21:13:28
204,MRP formally submits bid for £80m student accommodation scheme in Belfast city centre,Terex to cut more than 100 jobs across Co Tyrone sites due to industry slowdown. The bid for the massive student accommodation scheme comes four ...,www.irishnews.com,2024-07-15 19:00:52+00:00,2024-07-15 21:13:28
205,NI photographer caught in Russian ambush in Ukraine - BBC,Terex company logo on a phone screen. The logo is red and white and has ... Business- Innovation- Culture- Travel- Earth- Video- Live- Audio.,www.bbc.com,2024-07-15 18:27:28+00:00,2024-07-15 21:13:28
206,Terex: Manufacturing firm to cut about 100 jobs in Northern Ireland - Head Topics,The United States company makes crushing and screening equipment used in industries like construction and mining.,headtopics.com,2024-07-15 18:09:40+00:00,2024-07-15 21:13:28
207,"Compaction Machines Market to Reach USD 10.42 Billion by 2033, with a CAGR of 6.4% As ...",Caterpillar Inc. Terex Corporation; BOMAG GmbH; Wacker Neuson SE; XCMG Co. Ltd; Zoomlion Heavy Industries Science and Technology Co Ltd; Atlas Copco ...,www.whatech.com,2024-07-15 17:39:45+00:00,2024-07-15 21:13:28
208,Texas Permanent School Fund Corp Acquires 360 Shares of John Bean Technologies Co ...,Terex (TEX) – Analysts' Weekly Ratings Changes- HNI Co. (NYSE:HNI) Shares Purchased by Illinois Municipal Retirement Fund- Illinois Municipal ...,www.defenseworld.net,2024-07-15 16:36:08+00:00,2024-07-15 21:13:28
209,Terex confirms redundancies process under way at Derry and other NI sites,A global manufacturing company which unveiled a £12m plant in Derry back in 2020 has confirmed it is currently consulting with staff on ...,www.derryjournal.com,2024-07-16 11:42:09+00:00,2024-07-16 13:12:45
210,150 employees in Co. Tyrone under threat of losing jobs - Yahoo News UK,150 jobs in Co. Tyrone could be under threat after reports that US company Terex could be set to let go a huge number of employees.,uk.news.yahoo.com,2024-07-16 11:15:45+00:00,2024-07-16 13:12:45
211,McKeever Group confirms acquisition of The Lodge Hotel in Coleraine - The Irish News,Three-star venue becomes the sixth hotel under control of family-run Antrim company- Terex to cut more than 100 jobs across Co Tyrone sites due to ...,www.irishnews.com,2024-07-16 09:54:20+00:00,2024-07-16 13:12:45
212,Over 100 jobs to be cut at Northern Ireland manufacturing giant due to industry slowdown,"Over 100 jobs are at risk at the Co Trone operations of manufacturing firm Terex. ... In a statement a company spokeswoman, confirmed: “The ...",www.newsletter.co.uk,2024-07-16 08:36:36+00:00,2024-07-16 13:12:45
213,Gabriel launches new company website | Trailer Body Builders,"Terex Utilities Service School offers hands-on technician training- TBB ... By employing SEO practices, Gabriel's new site strengthens the company's ...",www.trailer-bodybuilders.com,2024-07-16 02:36:40+00:00,2024-07-16 13:12:45
214,Jobs at risk at US manufacturing firm Terex in Northern Ireland - Head Topics,"""As a global company with a strong presence in the UK and Northern Ireland for over 25 years, Terex has extensive experience managing cyclical market ...",headtopics.com,2024-07-16 01:42:12+00:00,2024-07-16 13:12:45
215,Brookfield Co. (NYSE:BN) Shares Purchased by Forsta AP Fonden - Defense World,"(NYSE:BN – Free Report) by 12.8% during the 1st quarter, according to the company in its most recent filing with the SEC. ... Terex (TEX) – Analysts' ...",www.defenseworld.net,2024-07-16 01:33:18+00:00,2024-07-16 13:12:45
216,John Deere to lay off hundreds at its Waterloo operations amid economic woes - MSN,Terex to cut more than 100 jobs across Co Tyrone sites due to ...,www.msn.com,2024-07-15 23:16:32+00:00,2024-07-16 13:12:45
217,Redundancies announced at the Northern Ireland sites of US manufacturing firm Terex,A global manufacturing business – which operates sites throughout Northern Ireland - has announced redundancies at its plants in the province.,www.northernirelandworld.com,2024-07-16 13:54:47+00:00,2024-07-16 18:12:39
218,Antrim-based vehicle telematics provider Cubo acquired by Fuel Card Services,Terex to cut more than 100 jobs across Co Tyrone sites due to industry slowdown ... company embarks on an incredibly exciting chapter of an ...,www.irishnews.com,2024-07-16 11:21:56+00:00,2024-07-16 18:12:39
219,July 2024 Employment Roundup: Manufacturing firm plans to cut around 100 jobs in Northern Ireland,... Terex sites in Co Tyrone. Slalom to create 300 new jobs in next 3-5 years. A business and technology consulting company has announced plans to ...,insideireland.ie,2024-07-15 20:29:50+00:00,2024-07-16 18:12:39
220,Allison Transmission says over 10K fully automatic transmissions for Hyundai Mighty,"Federal Signal Corporation, Post. 94.01, 0.00%. ALSMY, 1.84, -2.13%. Alstom SA. TEX, 55.69, 1.96%. Terex Corporation, Post. 55.69, 0.00%. Compare ...",seekingalpha.com,2024-07-16 20:44:17+00:00,2024-07-16 22:12:50
221,Allison Transmission says over 10K fully automatic transmissions for Hyundai Mighty,"Oshkosh Corporation. FSS, 90.74, 2.25%. Federal Signal Corporation. ALSMY, 1.88, -. Alstom SA. TEX, 54.62, 0.57%. Terex Corporation. Compare. Trending ...",seekingalpha.com,2024-07-17 08:50:17+00:00,2024-07-17 10:12:34
222,Ballymoney Manufacturing Giant Faces Job Losses Due to Post Covid Surge Downturn,... Terex Global Business Services in Lurgan. The company stated that the surge in demand and backlog experienced after the pandemic has now ...,www.ballymoneybubble.co.uk,2024-07-17 08:36:50+00:00,2024-07-17 10:12:34
223,Container Gantry Cranes Market Demand And Growth Rate Forecast 2024-2033,"Dominant Key Players Container Gantry Cranes Market : Liebherr, Terex Corporation ... Company (ZPMC), Nantong COSCO Heavy Industry. Container ...",www.thenrinews.com,2024-07-17 05:09:30+00:00,2024-07-17 10:12:34
224,Newsquest is looking for new people to join our sales team - could it be you?,Terex &lt;i&gt;(Image: @TerexCorp)&lt;/i&gt; ... Approximately 150 jobs in Tyrone could be under threat following reports that US-based company Terex is planning ...,uk.news.yahoo.com,2024-07-17 03:48:30+00:00,2024-07-17 10:12:34
225,Derry-based Northbound Brewery set to open new north west visitor experience,Terex to cut more than 100 jobs across Co Tyrone sites due to industry slowdown. 2. Trump's running mate J.D Vance wrote of pride in Ulster-Scots ...,www.irishnews.com,2024-07-16 22:45:43+00:00,2024-07-17 10:12:34
226,Harkin: Solidarity with Terex workers - Derry Daily,People Before Profit Councillor Shaun Harkin has said his party stands in solidarity with Terex workers as the US company plans to cut 100 jobs in the ...,www.derrydaily.net,2024-07-17 11:42:53+00:00,2024-07-17 14:12:50
227,Strength Seen in Terex (TEX): Can Its 8.5% Jump Turn into More Strength? - Yahoo Finance,"This represents a change of +3.2% from what the company reported a year ago. ... Terex Corporation (TEX) : Free Stock Analysis Report- Hyster-Yale, Inc ...",finance.yahoo.com,2024-07-17 11:13:56+00:00,2024-07-17 14:12:50
228,Around 100 job losses on the way for NW - Highland Radio - Latest Donegal News and Sport,US company Terex has announced the lay offs in response to what it says is the stabilising of an extraordinary surge in demand for its products ...,highlandradio.com,2024-07-17 11:03:05+00:00,2024-07-17 14:12:50
229,From Container Terminals to Mega Ports: Strategies for Ship-to-Shore Crane Adoption ... - EIN News,"... Terex Corporation, TTS Group, Wuhu Port Machinery Co., Ltd., and Xiamen ... ✓Market Players and Competitor Analysis: The report covers the key players ...",www.einnews.com,2024-07-17 10:40:41+00:00,2024-07-17 14:12:50
230,"Global Jet Capital Appoints Kacin as VP, Sales for Northeastern and Midwest U.S.","Global Jet Capital, a global company in financial solutions for business ... Terex Financial Services, Citibank and Wachovia. His deep expertise ...",www.monitordaily.com,2024-07-17 10:32:25+00:00,2024-07-17 14:12:50
231,"Inflation held at 2% in June, but hotel prices soared by 8.8% - ONS - The Irish News",Terex to cut more than 100 jobs across Co Tyrone sites due to industry slowdown. The latest data showed that prices in restaurants and hotels rose ...,www.irishnews.com,2024-07-17 14:05:20+00:00,2024-07-17 16:12:44
232,"Crawler Cranes Market Size, Share | Research Analysis 2024-2032",Terex Corporation 3. Manitowoc Company Inc. 4. Zoomlion Heavy Industry Science and Technology Co. Ltd. 5. XCMG Group 6. SANY Group 7. Kobelco ...,menafn.com,2024-07-17 10:03:28+00:00,2024-07-17 16:12:44
233,Assets raid at UTV after shareholders are paid £25m dividend - The Irish News,Terex to cut more than 100 jobs across Co Tyrone sites due to industry slowdown ... In March UTV's parent company ITV said its profits more than ...,www.irishnews.com,2024-07-17 17:00:55+00:00,2024-07-17 19:12:34
234,King Charles III honours Newtownabbey firm at Windsor reception - NorthernIrelandWorld,"Redundancies announced at the Northern Ireland sites of US manufacturing firm Terex ... The company now operates four sites across Great Britain, ...",www.northernirelandworld.com,2024-07-17 15:53:46+00:00,2024-07-17 19:12:34
235,Exploring efficiency: The Terex MDS M515 heavy duty track trommel - Quarry Magazine,The Terex MDS M515 stands as a testament to the company's dedication to pushing the boundaries of what's possible in the field of material processing.,www.quarrymagazine.com,2024-07-18 00:46:32+00:00,2024-07-18 01:12:42
236,Winners And Losers Of Q1: Terex (NYSE:TEX) Vs The Rest Of The Heavy Machinery Stocks,"Terex (NYSE:TEX) ... With humble beginnings as a dump truck company, Terex (NYSE:TEX) today manufactures lifting and material handling equipment ...",finance.yahoo.com,2024-07-18 14:09:10+00:00,2024-07-18 16:12:45
237,Winners And Losers Of Q1: Terex (NYSE:TEX) Vs The Rest Of The Heavy Machinery Stocks,"Terex (NYSE:TEX) With humble beginnings as a dump truck company, Terex (NYSE:TEX) today manufactures lifting and material handling equipment ...",ca.investing.com,2024-07-18 14:05:53+00:00,2024-07-18 16:12:45
238,North's unemployment rate at a record low with the average wage up 11% - The Irish News,Terex to cut more than 100 jobs across Co Tyrone sites due to industry slowdown. The official economic inactivity rate also crept up in the three ...,www.irishnews.com,2024-07-18 14:01:09+00:00,2024-07-18 16:12:45
239,"Manitex International, Inc. (NASDAQ:MNTX) institutional owners may be pleased with recent ...","Royce & Associates, LP is the second largest shareholder owning 7.3% of common stock, and Terex Corporation holds about 5.6% of the company stock.",ca.finance.yahoo.com,2024-07-18 12:55:50+00:00,2024-07-18 16:12:45
240,S.Africa's Transnet gets $1 bln African Development Bank loan,"... Terex Corp., at the Port of Durban, operated by Transnet SOC Holdings Ltd.'s Ports Authority, in Durban, South Africa, on Friday, May 25, 2018 ...",www.cnbcafrica.com,2024-07-18 12:42:35+00:00,2024-07-18 16:12:45
241,Henry Brothers attend The King's Awards for Enterprise Reception at Windsor Castle,Redundancies announced at the Northern Ireland sites of US manufacturing firm Terex- News- Traffic and Travel- Crime- Politics- Health- Business ...,www.northernirelandworld.com,2024-07-18 12:35:54+00:00,2024-07-18 16:12:45
242,US digital engineering firm GlobalLogic opens Newry base creating 15 jobs - The Irish News,First base in Northern Ireland comes 12 months after the Hitachi Group company entered the Irish market. ... Terex to cut more than 100 jobs across Co ...,www.irishnews.com,2024-07-18 12:01:53+00:00,2024-07-18 16:12:45
243,Cintas (CTAS) Surpasses Q4 Earnings and Revenue Estimates - Nasdaq,"Over the last four quarters, the company has surpassed consensus EPS estimates four times. ... Terex Corporation (TEX) : Free Stock Analysis Report- To ...",www.nasdaq.com,2024-07-18 15:32:08+00:00,2024-07-18 17:12:43
244,Gaussin bids for unfinished machines - WorldCargo News,"A company called Corail-SM has put in a bid for Metalliance. Corail-SM ... It is led by Steve Filipov, the former President of Terex Cranes and CEO of ...",www.worldcargonews.com,2024-07-18 20:58:58+00:00,2024-07-18 23:12:39
245,Global Scissors Lifters Market Marketing Strategies: Effective Approaches - Moose Gazette,"Haulotte, Airman, Rite-Hite, Terex ... (4) The report also discusses competitive situation and trends and sheds light on company expansions and merger ...",moosegazette.com,2024-07-18 21:40:48+00:00,2024-07-19 01:12:39
246,Cintas Surpasses Q4 Earnings and Revenue Estimates | Markets Insider,"... Terex Corp. Disclaimer- Get real-time tex charts here &gt;&gt;. MORE. Cintas (NASDAQ:CTAS) came out with quarterly earnings of $3.99 per share, beating the ...",markets.businessinsider.com,2024-07-18 17:05:45+00:00,2024-07-19 01:12:39
247,Unemployment: Rate in NI falls to 2% record low - BBC,"The overall jobs market remains healthy with the number of people on company payrolls growing to 808,000 in June. ... Terex company logo on a phone ...",www.bbc.com,2024-07-19 04:00:41+00:00,2024-07-19 09:12:31
248,Global Compost Turning Machine Market Global Trade: Export and Import Trends,"... Terex Corporation, Vermeer Corporation, Allu Finland Oy. Global Compost Turning Machine Market Competitive Landscape and Market Leaders. The ...",moosegazette.com,2024-07-19 03:55:52+00:00,2024-07-19 09:12:31
249,Terex Announces Second Quarter 2024 Financial Results Conference Call,"Terex Corporation is focused on manufacturing of materials processing machinery and aerial work platforms. The Company designs, builds and supports ...",www.marketscreener.com,2024-07-19 12:32:23+00:00,2024-07-19 15:12:46
250,Terex Announces Second Quarter 2024 Financial Results Conference Call - Yahoo Finance,"Terex Corporation (NYSE: TEX) will host a conference call to review its second quarter 2024 financial results on Wednesday, July 31, ...",finance.yahoo.com,2024-07-19 12:29:46+00:00,2024-07-19 15:12:46
251,"Triple Flag Precious Metals Corp. to Post Q2 2024 Earnings of $0.11 Per Share, National ...",The company reported $0.12 earnings per share for the quarter ... Zacks Research Equities Analysts Decrease Earnings Estimates for Terex Co.,www.defenseworld.net,2024-07-19 11:23:26+00:00,2024-07-19 15:12:46
252,Terex Announces Second Quarter 2024 Financial Results Conference Call,"NORWALK, Conn., July 19, 2024 /PRNewswire/ -- Terex Corporation (NYSE: TEX) will host a conference call to review its second quarter 2024 ...",themalaysianreserve.com,2024-07-19 14:13:28+00:00,2024-07-19 17:12:56
253,Global Tower Crane Market Innovation Trends: Emerging Technologies - Moose Gazette,"... Terex Corporation, Manitowoc Cranes, Zoomlion Heavy Industry Science and Technology Co. Ltd., Hankook Tower Crane, Sany Group, Orlaco, XAMG ...",moosegazette.com,2024-07-19 16:52:06+00:00,2024-07-19 19:12:46
254,"Envestnet Portfolio Solutions Inc. Raises Stock Holdings in Clean Harbors, Inc. (NYSE:CLH)",Corporate insiders own 5.90% of the company's stock. Clean Harbors ... Zacks Research Equities Analysts Decrease Earnings Estimates for Terex Co.,www.defenseworld.net,2024-07-19 16:33:58+00:00,2024-07-19 19:12:46
255,"Envestnet Portfolio Solutions Inc. Raises Holdings in Tyson Foods, Inc. (NYSE:TSN)","The fund owned 8,690 shares of the company's stock after ... Zacks Research Equities Analysts Decrease Earnings Estimates for Terex Co.",www.defenseworld.net,2024-07-19 22:12:20+00:00,2024-07-19 23:12:37
256,Zacks Research Equities Analysts Decrease Earnings Estimates for Terex Co. (NYSE:TEX),"Terex Corporation manufactures and sells aerial work platforms and materials processing machinery worldwide. It operates in two segments, Materials ...",www.defenseworld.net,2024-07-19 11:23:28+00:00,2024-07-20 08:12:37
257,Terex (NYSE:TEX) Is Investing Its Capital With Increasing Efficiency - Yahoo Finance,... company earns on the capital invested in its business. The formula for this calculation on Terex is: ADVERTISEMENT. Advertisement. Return on Capital ...,finance.yahoo.com,2024-07-20 14:58:30+00:00,2024-07-20 16:12:27
258,"5,156 Shares in Minerals Technologies Inc. (NYSE:MTX) Purchased by QRG Capital ...",Corporate insiders own 3.50% of the company's stock. About Minerals ... Raises Stock Holdings in Terex Co. (NYSE:TEX)- QRG Capital Management ...,www.defenseworld.net,2024-07-20 14:15:11+00:00,2024-07-20 16:12:27
259,"Azenta, Inc. (NASDAQ:AZTA) Stock Holdings Decreased by QRG Capital Management Inc.",Sanmina Co. (NASDAQ:SANM) Stock Position Decreased by QRG Capital Management Inc. QRG Capital Management Inc. Raises Stock Holdings in Terex Co.,www.defenseworld.net,2024-07-20 14:14:53+00:00,2024-07-20 16:12:27
260,QRG Capital Management Inc. Sells 164 Shares of NewMarket Co. (NYSE:NEU),(NASDAQ:SANM) Stock Position Decreased by QRG Capital Management Inc. QRG Capital Management Inc. Raises Stock Holdings in Terex Co. (NYSE:TEX)- QRG ...,www.defenseworld.net,2024-07-20 14:15:41+00:00,2024-07-20 19:12:24
261,Osool And Bakheet Investment Announces Purchasing Shares Of Advanced Operations ...,July 22 (Reuters) -Osool & Bakheet Investment Company SCJSC 9586.SE: ... Terex to buy Dover's environmental solution business in deal valued at $2 bln.,www.xm.com,2024-07-22 11:18:39+00:00,2024-07-22 12:12:42
262,Terex To Acquire Environmental Solutions Group For $2 Billion | citybiz,Terex Corporation (NYSE: TEX) today announced it has signed a definitive agreement to acquire Environmental Solutions Group from Dover Corporation ...,www.citybiz.co,2024-07-22 11:17:35+00:00,2024-07-22 12:12:42
263,Terex to buy Dover's environmental solution business in deal valued at $2 bln - XM,July 22 (Reuters) -Terex TEX.N said on Monday it would acquire Dover Corp's DOV.N environmental solutions business in an all-cash deal valued at $2 ...,www.xm.com,2024-07-22 11:15:41+00:00,2024-07-22 12:12:42
