,Heading,Subheading,Publisher,Published,Found
89,Global Mining Truck Market Size To Worth USD 33.8 Billion By 2033 | CAGR Of 3.88%,"Companies covered: Atlas Copco, BharatBenz, KRESS CORPORATION, MAN Truck & Bus, Doosan, Terex Trucks, Scania, Hitachi, Caterpillar, BELAZ, Yutong, ...",www.globenewswire.com,2024-06-30 14:01:22+00:00,2024-06-30 17:12:28
90,"PNC Financial Services Group Inc. Grows Holdings in Intellia Therapeutics, Inc. (NASDAQ:NTLA)","(NASDAQ:NTLA – Free Report) by 209.7% in the fourth quarter, according to the company ... Sells 610 Shares of Terex Co. (NYSE:TEX)- NEXT HEADLINE ».",www.defenseworld.net,2024-06-30 12:13:36+00:00,2024-06-30 17:12:28
91,Terex (TEX) Outpaces Stock Market Gains: What You Should Know - MSN,"Market participants will be closely following the financial results of Terex in its upcoming release. The company is expected to report EPS of $1.40, ...",www.msn.com,2024-06-29 20:15:51+00:00,2024-06-30 17:12:28
92,Is Terex (TEX) a Profitable Pick For Value Investors Now? - Yahoo Life UK,"In particular, it is worth noting that the company has a Growth Score of C and a Momentum Score of D. ... Terex Corporation Price and Consensus | Terex ...",uk.style.yahoo.com,2024-06-29 18:33:05+00:00,2024-06-30 17:12:28
93,PNC Financial Services Group Inc. Sells 347 Shares of Hyatt Hotels Co. (NYSE:H),Hyatt Hotels Corporation operates as a hospitality company in the United States and internationally. ... Sells 610 Shares of Terex Co. (NYSE:TEX). You ...,www.defenseworld.net,2024-06-30 12:13:33+00:00,2024-07-01 00:12:24
94,"Terex offers electric shredder for C&amp;D, RDF markets - Waste Today","Terex Recycling Systems, a United Kingdom-based business unit of United States-based Terex Corp., is now offering the TDS-V20SE static electric ...",www.wastetodaymagazine.com,2024-07-01 07:48:27+00:00,2024-07-01 08:12:27
95,"Trommel Screens Market Set to Grow Demand in Optimistic Scenario, Opportunity, Trends ... - TIMC",Here below are major companies that are covered in this report. VERMEER Eggersmann GmbH McCloskey International Terex McLanahan Corporation Pronar,www.theindianmoviechannel.com,2024-07-01 04:46:00+00:00,2024-07-01 08:12:27
96,"Concrete Mixer Market Projected to Reach US$ 8.80 Billion by 2030, Growing at a CAGR of ...","Among the leading businesses in the market are BHS-Sonthofen GmbH, Terex Corporation, Anhui Hualing Automobile Group Co. ... The company's vision ...",www.whatech.com,2024-07-01 13:27:18+00:00,2024-07-01 16:12:41
97,Construction company fined following HGV driver fatality - HSM,Construction company fined following HGV driver fatality ... Terex Port Solutions has delivered and commissioned a Terex Gottwald HMK 170 E Mobile ...,www.hsmsearch.com,2024-07-01 08:58:52+00:00,2024-07-01 16:12:41
98,Florida Coast Equipment Expands Footprint With Acquisition of Polk Tractor Company,"Today's top stories. Knife River Corporation, TxDOT Make Swift Repairs After Flood Damage- Terex Utilities Service School Provides Hands-On ...",www.constructionequipmentguide.com,2024-07-01 19:04:46+00:00,2024-07-01 20:13:07
99,Rubicon CEO steps down - Waste Today -,"... company's Board of Directors, effective immediately. Osman Ahmed ... Terex offers electric shredder for C&D, RDF markets- Heil adds to ...",www.wastetodaymagazine.com,2024-07-01 18:22:47+00:00,2024-07-01 20:13:07
100,Terex Utilities Service School Provides Hands-On Instruction for Techs,"By submitting your information, you are agreeing to Endeavor Business Media's Terms of Service and Privacy Policy.",www.rermag.com,2024-07-01 17:37:56+00:00,2024-07-01 20:13:07
101,Tolu Salami Unveils Groundbreaking AI Innovation for Indoor Gardening - openPR.com,"Known for their expertise and commitment to customer satisfaction, the company ... Agro master Agricultural Machinery, Sysbohr GmbH, Terex Corporation, ...",www.openpr.com,2024-07-01 21:13:51+00:00,2024-07-02 00:12:36
102,"Teletrac Navman announces new chief operations, financial officer - Waste Today -","The company says Ricardo Buranello is a seasoned technology executive ... Terex offers electric shredder for C&D, RDF markets- Heil adds to ...",www.wastetodaymagazine.com,2024-07-02 04:02:43+00:00,2024-07-02 09:12:26
103,Morris Export Services Acquires First LiuGong Reach Stacker in North America,"Andrew Talley, a co-owner at Morris Export Services, said, ""Partnering with a company ... Terex Utilities Service School Provides Hands-On Instruction ...",www.constructionequipmentguide.com,2024-07-02 01:49:30+00:00,2024-07-02 09:12:26
104,Terex Scraps Konecranes Merger; Stock up on MHPS Sale - Yahoo News NZ,Terex Corporation (TEX) shares soared 10% after it scrapped a 9-month old merger deal with Konecranes and agreed to sell its MHPS segment.,nz.news.yahoo.com,2024-07-01 23:50:47+00:00,2024-07-02 09:12:26
105,"Terex offers electric shredder for C&amp;D, RDF markets - Construction &amp; Demolition Recycling","Terex Recycling Systems, a United Kingdom-based business unit of Terex Corp., is now offering the TDS-V20SE static electric shredder, ...",www.cdrecycler.com,2024-07-01 19:45:24+00:00,2024-07-02 09:12:26
106,Hands on service training from Terex Utilities - Access Briefing,"This year, the school consisted of nine stations, with Terex team member instructors from the Technical Support, Field Service, and the Regional ...",www.accessbriefing.com,2024-07-02 15:35:17+00:00,2024-07-02 17:12:31
107,Scissor Lift Market Set to Total USD 4251.7 Million by - GlobeNewswire,"Terex Corporation; JLG Industries; Linamar Corporation; Snorkel International; Haulotte Group; Zhejiang Dingli Machinery Co, Ltd; Aichi Corporation ...",www.globenewswire.com,2024-07-02 14:36:11+00:00,2024-07-02 17:12:31
108,"U.S. Atlassian, Crowdstrike Holdings, CS Disco",* Terex Corp TEX.N: Truist Securities cuts target price to $68 from $73. * Toll Brothers Inc TOL.N: Citigroup cuts target price to $125 from $133.,www.xm.com,2024-07-02 13:31:50+00:00,2024-07-02 17:12:31
109,Truist cuts PTs for U.S. machinery companies ahead of Q2 earnings - XM,AGCO Corp AGCO.N. $130. $137. $132.50. Terex Corp TEX.N. $68. $73. $62. Oshkosh Corp OSK.N. $123. $132. $132. ** Brokerage expects guidance cuts from ...,www.xm.com,2024-07-02 13:28:28+00:00,2024-07-02 17:12:31
110,"Scissor Lift Market Revenue, Price, Growth Rate, Forecast To 2032 | Taiwan News",(Oshkosh Corporation Company); Terex Corporation; Aichi Corporation; Linamar Corporation (Skyjack Inc.) Haulotte Group; Beijing Jingcheng Heavy ...,www.taiwannews.com.tw,2024-07-02 10:03:38+00:00,2024-07-02 17:12:31
111,Meridian Waste named a Readers' Choice awardee,"Meridian has been named Nassau County Record's Best Trash Company five years in a row. ... Terex offers electric shredder for C&D, RDF markets ...",www.wastetodaymagazine.com,2024-07-02 19:18:57+00:00,2024-07-02 20:12:32
112,Terex (NYSE:TEX) PT Lowered to $68.00 | MarketBeat,Terex Company Profile ... Terex Corporation manufactures and sells aerial work platforms and materials processing machinery worldwide. It operates in ...,www.marketbeat.com,2024-07-02 14:45:21+00:00,2024-07-02 20:12:32
113,SWANA appoints new board members - Waste Today -,Tammy Hayes of global engineering and construction company CDM Smith has been named president for fiscal year 2025. ... Terex offers electric shredder ...,www.wastetodaymagazine.com,2024-07-02 11:09:36+00:00,2024-07-02 20:12:32
114,"Scissor Lift Market Revenue, Price, Growth Rate, Forecast To 2032 | Taiwan News","Terex Corporation; Aichi Corporation; Linamar Corporation (Skyjack Inc.) Haulotte Group; Beijing Jingcheng Heavy Industry Co., ...",www.taiwannews.com.tw,2024-07-02 10:42:59+00:00,2024-07-02 20:12:32
115,EvoQuip expands jaw crusher range with new diesel-electric model,"Company info. Terex EvoQuip- Terex EvoQuip Logo. 200 Coalisland Road Co. Tyrone Dungannon, IE, BT71 4DR. Website: terex.com/evoquip- Read more ...",www.recyclingproductnews.com,2024-07-02 22:39:09+00:00,2024-07-03 00:12:46
116,Terex Utilities Service School provides hands-on instruction for techs - Rental Management,"This year, the school consisted of nine stations, with Terex team member instructors from the company's technical support, field service and regional ...",news.ararental.org,2024-07-02 20:03:07+00:00,2024-07-03 00:12:46
117,Liebherr Premiers Prototype Hydrogen Loader | Construction Equipment,"The company demonstrated the L 566 H wheel loader during an event at ... Cummins, Terex partner on hydrogen concrete trucks. Komatsu has ...",www.constructionequipment.com,2024-07-02 19:49:52+00:00,2024-07-03 00:12:46
118,Highlights from Hillhead: What did you miss? - International Rental News,"In addition, the company unveiled a generator powered by a JCB hydrogen combustion engine at the show. ... On the stands, Terex launched new products ...",www.internationalrentalnews.com,2024-07-03 10:01:26+00:00,2024-07-03 16:13:17
119,DEUTZ to acquire Blue Star Power Systems - Rental Management,... company said. “We are proud of the business we have built together at ... Terex Utilities Service School provides hands-on instruction for techs.,news.ararental.org,2024-07-03 07:49:37+00:00,2024-07-03 16:13:17
120,"Building Construction Machinery Market Analysis, Research Study - SOUTHEAST",Terex; Manitou Group; Kubota; Kobelco Construction Machinery Co. Ltd; CNH Industrial N.V; Volvo; Deere & Company; Liebherr Group. Short Description ...,southeast.newschannelnebraska.com,2024-07-03 00:02:09+00:00,2024-07-03 16:13:17
121,California legislator continues to push for textiles EPR law - Waste Today,"Heritage Environmental Services to acquire energetic waste disposal company- Terex offers electric shredder for C&D, RDF markets- Legislation and ...",www.wastetodaymagazine.com,2024-07-03 15:40:29+00:00,2024-07-03 18:13:16
122,"Crane Market Business Outlook, Critical Insight, Opportunities, Regional Overview ... - WhaTech","Liebherr Group, Manitowoc, Tadano, Terex, Xuzhou Construction Machinery Group (XCMG), Zoomlion, Sany, KobelcoCrane, HitachiSumitomo, Furukaw, and ...",www.whatech.com,2024-07-03 15:24:40+00:00,2024-07-03 18:13:16
123,Komatsu Company Stores East Announce Upcoming Open Houses,Komatsu Company Stores East announced a series of five open houses ... Terex Utilities Service School Provides Hands-On Instruction for Techs.,www.constructionequipmentguide.com,2024-07-03 18:17:48+00:00,2024-07-03 20:13:27
124,Terex price target lowered to $68 from $73 at Truist - TipRanks.com,Largest Companies by Market Cap. ETFs. ETF Center- Top ETFs by Upside. New- Top ETFs by Smart Score- Top Gainers/ Losers/ Active ETFs. Options.,www.tipranks.com,2024-07-04 01:17:05+00:00,2024-07-04 05:13:08
125,Pre-Owned Construction Equipment Market Size Expected to Fly High with Increased Demand,What is business meeting etiquette? | Collaboration blog by Vivitek. The ... – Terex Corporation – Truck1 – Volve CE Used Equipment – Other ...,www.taiwannews.com.tw,2024-07-04 05:33:30+00:00,2024-07-04 07:14:12
126,Mobile Light Tower Market Future Revenues to Take Flight as Market Size Continues to Expand,– Generac Power Systems Inc. – The Will-Burt Company – Inmesol Gensets SL – BMI Group – Terex Corporation – Xylem Inc. – Doosan Portable Power,www.taiwannews.com.tw,2024-07-04 05:33:17+00:00,2024-07-04 07:14:12
127,Remediation specialist ranks among UK's fastest-growing companies,NEWSLETTER- Valdeau'Mat: A Pioneering Construction and Demolition Waste Recycling Plant in France- Terex Environmental To Showcase Latest Innovations ...,www.demolitionandrecycling.media,2024-07-04 08:32:43+00:00,2024-07-04 09:13:12
128,Terex introduces new electric shredder - Demolition &amp; Recycling International,French company Valdeau'Mat is making significant strides in sustainable waste management with their recently opened C&D waste recycling plant. This ...,www.demolitionandrecycling.media,2024-07-04 08:02:37+00:00,2024-07-04 09:13:12
129,Sarens lifts Lithuania's locomotives to European standards - Project Cargo Journal,"The company completed a critical project at the Šeštokai railway ... Sarens opted for two Terex Demag AC220-5 cranes, specifically chosen for ...",www.projectcargojournal.com,2024-07-04 06:55:28+00:00,2024-07-04 09:13:12
130,Vanguard S&amp;P 500 ETF (NYSEARCA:VOO) Shares Sold by Measured Wealth Private Client ...,"Measured Wealth Private Client Group LLC Has $363,000 Stock Position in Terex Co. (NYSE:TEX). You might be interested in:.",www.defenseworld.net,2024-07-03 12:09:09+00:00,2024-07-04 09:13:12
131,Thailand Construction Equipment Market Assessment 2024-2029 Featuring Caterpillar ...,"KATO WORKS CO., LTD. GEHL; MERLO Spa; Bobcat; Terex Corporation; CNH Industrial; AIRMAN; Euromach; Shandong Lingong Construction Machinery (SDLG) ...",www.businesswire.com,2024-07-04 12:31:49+00:00,2024-07-04 13:13:28
132,Rail plant goes to auction - Construction Index,Two Terex Giga cranes- Caterpillar D5C Hydro Stat dozer; 11 Genie Z60/34 ... © 2024 The Construction Index [Company No. 6177490]. Contact- About ...,www.theconstructionindex.co.uk,2024-07-04 10:41:09+00:00,2024-07-04 13:13:28
133,TWS mark five years of filter press production - Agg-Net,Milestone underscores company's commitment to environmental responsibility in quarry operations. TEREX Washing Systems (TWS) are celebrating five ...,www.agg-net.com,2024-07-04 10:10:56+00:00,2024-07-04 13:13:28
134,"Synergy Asset Management LLC Raises Position in Merck &amp; Co., Inc. (NYSE:MRK)","Merck & Co, Inc operates as a healthcare company worldwide. ... Measured Wealth Private Client Group LLC Has $363,000 Stock Position in Terex Co.",www.defenseworld.net,2024-07-04 00:01:53+00:00,2024-07-04 13:13:28
135,Enterprise Agile Transformation Services Market Research Report - Economica,"Adroit Market Research is an India-based business analytics and consulting company ... Light Tower Market Research Report | Generac Holdings, Terex ...",economica.ma,2024-07-04 14:58:44+00:00,2024-07-04 17:13:23
136,"Construction Equipment Industry Research Study |Doosan Group, Guangxi LiuGong ...","... Terex Corporation, XCMG Group, Volvo Construction ... Adroit Market Research is an India-based business analytics and consulting company.",economica.ma,2024-07-04 16:14:43+00:00,2024-07-04 18:13:13
137,Aerial Work Platform (AWP) Market 2024 Growth Analysis by Future - WICZ,"... Terex, JLG, Haulotte, Aichi, Dingli, Ruthmann ... Company Analysis: Report covers individual Aerial Work Platform (AWP) ...",www.wicz.com,2024-07-04 16:31:12+00:00,2024-07-04 20:13:20
138,Mobile Screener Market Growth and Status Explored in a New Research Report 2032,"... company, by Type and by Application. from 2017 to 2022 and ... 12.2.1 Terex GB Limited Corporation Information 12.2.2 Terex GB Limited ...",www.wicz.com,2024-07-04 14:47:42+00:00,2024-07-04 20:13:20
139,"Sales of Construction Equipment in the UK, Spain, &amp; France are A - NORTHEAST","... Co., Ltd., Kubota, CNH Industrial, Hyundai Construction Equipment & John Deere. Other Prominent Vendors: Liugong, Yanmar, Terex Corporation ...",northeast.newschannelnebraska.com,2024-07-04 22:29:57+00:00,2024-07-05 00:13:26
140,Thailand Construction Equipment Market Assessment 2024-2029 Featuring Caterpillar ... - Le Lézard,"These companies have a substantial market share and offer diverse sets of equipment. Terex, CNH Industrial, LiuGong, Manitou, Kato Works Co. Ltd., ...",www.lelezard.com,2024-07-04 15:58:46+00:00,2024-07-05 14:13:19
141,OSHA fines Pennsylvania hauler after worker's death - Waste Today,"... company's workers was killed on the job earlier this year, StateCollege ... Terex offers electric shredder for C&D, RDF markets- Heil adds to ...",www.wastetodaymagazine.com,2024-07-05 15:41:28+00:00,2024-07-05 18:13:28
142,"Construction Equipment Market Growth to Hit 5.5% CAGR, Globally, by 2030","... Terex, Zoomlion, Shantui. [PDF]Get Sample Copy ... In addition, the companies in the report are studied according to key factors such as company ...",www.thenrinews.com,2024-07-05 17:49:28+00:00,2024-07-05 20:13:19
143,"Mobile Crushers and Screeners Market Analysis 2024: Industry Revenue, Future Demand ...","Major companies in the industry include Kleemann, Terex Corporation, McCloskey International, etc. The top three enterprises account for more than ...",www.wicz.com,2024-07-05 15:23:03+00:00,2024-07-05 22:13:25
144,Mining Transport Machinery Market Analysis 2024: Industry Revenu - WICZ,"Terex; Guangxi Liugong Machinery Co.,Ltd. FL Smidth. Get Sample Copy of ... Company Analysis: Report covers individual Mining Transport ...",www.wicz.com,2024-07-06 01:32:31+00:00,2024-07-06 05:13:10
145,Wheel Crane Market Developments Notable Innovations and Breakthroughs,"XCMG Construction Machinery, Hitachi Sumitomo Heavy Industries Construction Crane, The Manitowoc Company, KATO WORKS, Liebherr Group, Terex ...",www.thenrinews.com,2024-07-06 06:15:08+00:00,2024-07-06 07:13:27
146,"Telescopic Boom Offshore Crane Market Outlook Report, 2032 - The NRI News","KENZ-FIGEE, Palfinger, Konecranes, Liebherr, Terex Corporation, Zoomlion, Manitowoc, Cargotec, National Oilwell Varco, Huisman. By Product Type ...",www.thenrinews.com,2024-07-06 07:38:39+00:00,2024-07-06 11:13:18
147,Terex's stock slides as hiked outlook falls short of Street view - MSN,MARKET PULSE Shares of Terex Corp. declined in the extended session Tuesday after the crane and construction equipment company's hiked outlook ...,www.msn.com,2024-07-06 13:23:45+00:00,2024-07-06 20:13:08
148,State of Michigan Retirement System Has $1.12 Million Stock Holdings in Knife River Co ...,"(NYSE:KNF – Free Report) by 2.2% during the 1st quarter, according to the company ... State of Michigan Retirement System Raises Stock Holdings in Terex ...",www.defenseworld.net,2024-07-07 09:03:12+00:00,2024-07-07 10:13:07
149,Janus Henderson Group plc (NYSE:JHG) Shares Bought by State of Michigan Retirement System,... company in its most recent Form 13F filing with the Securities and ... State of Michigan Retirement System Raises Stock Holdings in Terex Co.,www.defenseworld.net,2024-07-07 15:03:09+00:00,2024-07-07 16:13:07
150,The Ten Biggest Manufacturers In Washington State,"Terex Aerial Work Platforms. The Redmond based company, not named Microsoft, makes lift and material handling equipment for a number of different ...",newstalkkit.com,2024-07-07 13:18:31+00:00,2024-07-07 18:13:22
151,Terex Utilities sevvice school - Vertikal.net,Terex Utilities sevvice school. Terex Utilities held its 39th annual ... Welsh rental company Davies Crane Hire has taken delivery of a 90t ...,vertikal.net,2024-07-07 22:33:44+00:00,2024-07-08 00:13:20
152,Terex Utilities service school - Vertikal.net,Terex Utilities service school. Terex Utilities held its 39th annual ... Latest news. Five to four. German crane and access rental company Rolf ...,vertikal.net,2024-07-08 07:45:52+00:00,2024-07-08 09:13:02
153,Cement Mixer Market Observe Significant Growth To Reach $24.3 Billion by 2031,"Key companies profiled in the cement mixer industry report include ... Terex Corporation, XCMG Group, Zhengzhou SanqGroup Machinery Co., Ltd ...",www.einnews.com,2024-07-08 15:26:26+00:00,2024-07-08 17:13:18
154,We Did The Math IJK Can Go To $100 | Nasdaq,"iShares S&P Mid-Cap 400 Growth ETF, IJK, $87.22 ; Flowserve Corp, FLS, $46.67 ; Terex Corp. TEX, $53.47 ; Core & Main Inc, CNM, $48.35 ...",www.nasdaq.com,2024-07-08 14:37:43+00:00,2024-07-08 18:13:22
155,Terex Washing Systems debuts software system | Pit &amp; Quarry,"The company unveiled its new Stream software at Hillhead, with the aim of revolutionizing how operators interact with their equipment.",www.pitandquarry.com,2024-07-08 17:33:35+00:00,2024-07-08 20:13:18
156,The key to a successful dealer partnership | Pit &amp; Quarry,Major did its due diligence to identify which dealer in the territory might best fit the company. ... Terex Washing Systems includes features for ...,www.pitandquarry.com,2024-07-08 21:02:48+00:00,2024-07-08 22:13:29
157,Apex Waste Solutions makes two Colorado acquisitions,"Parker, Colorado-based company acquires Twin Enviro and certain WM of Colorado assets. ... Terex offers electric shredder for C&D, RDF markets.",www.wastetodaymagazine.com,2024-07-08 19:45:22+00:00,2024-07-08 22:13:29
158,Terex Corporation: Current Valuation Does Not Justify This Amazing Company,"Terex's Q1 growth may have slowed, but strong backlog and demand in North America suggest promising long-term prospects for investors.",seekingalpha.com,2024-07-09 15:48:22+00:00,2024-07-09 16:13:13
159,Caterpillar (CAT) Trades Above 200-Day SMA: How to Play the Stock? | Nasdaq,Terex Corporation (TEX) : Free Stock Analysis Report- Komatsu Ltd. (KMTUY) : Free Stock Analysis Report- To read this article on Zacks.com click ...,www.nasdaq.com,2024-07-09 15:17:23+00:00,2024-07-09 16:13:13
160,"Global Dust Control System Market to Reach US$ 26628.99 million by 2034, with a 4.34% CAGR","Donaldson Company; Colliery Dust Control (Pty) Ltd; EnviroSystems LLC; Camfil ... Terex Ecotec, Terex Finlay, Terex MPS, and Terex Washing Systems.",www.prnewswire.com,2024-07-09 14:06:40+00:00,2024-07-09 16:13:13
161,Rocket Companies (NYSE:RKT) Price Target Increased to $13.50 by Analysts at JPMorgan ...,"Rocket Companies, Inc, a fintech holding company, provides ... Nordea Investment Management AB Lowers Holdings in Terex Co. (NYSE:TEX) ...",www.defenseworld.net,2024-07-09 13:54:29+00:00,2024-07-09 16:13:13
162,System 'Crushes' Force Measurement Application - Assembly Magazine,"Terex MPS machines can process hard and soft rock, sand and gravel, ore and industrial minerals. The company's brands include Canica, Cedarapids and ...",www.assemblymag.com,2024-07-09 13:07:12+00:00,2024-07-09 16:13:13
163,Has Risk-On Run Out Of Road? - Seeking Alpha,Terex Corporation: Current Valuation Does Not Justify This Amazing Company.,seekingalpha.com,2024-07-09 07:23:51+00:00,2024-07-09 16:13:13
164,Terex (TEX) Receives a Buy from Truist Financial | Markets Insider,"The company's shares closed yesterday at $53.19. According to TipRanks, Cook is a 5-star analyst with an average return of 11.8% and a 60.86% success ...",markets.businessinsider.com,2024-07-09 05:51:34+00:00,2024-07-09 16:13:13
165,Nordea Investment Management AB Has $8.49 Million Stake in Huron Consulting Group Inc ...,Corporate insiders own 2.20% of the company's stock. Analyst ... Nordea Investment Management AB Lowers Holdings in Terex Co. (NYSE:TEX) ...,www.defenseworld.net,2024-07-09 19:50:12+00:00,2024-07-09 20:13:27
166,"Caterpillar (CAT) Trades Above 200-Day SMA: How to Play the Stock? - July 9, 2024 - Zacks",Terex Corporation (TEX) - free report &gt;&gt;- Komatsu Ltd. (KMTUY) - free report &gt;&gt;. Published in. industrial-products. Zacks' 7 Best Strong Buy Stocks ...,www.zacks.com,2024-07-09 15:07:12+00:00,2024-07-09 20:13:27
167,LJ Inc. to purchase Supreme Manufacturing | Pit &amp; Quarry,“We feel so incredibly blessed for this new opportunity to take over a company ... Terex Washing Systems includes features for logging daily checks ...,www.pitandquarry.com,2024-07-09 13:42:29+00:00,2024-07-09 20:13:27
168,Genie adds to German team | Vertikal.net,He joins the company from an export role with cycling equipment company ... Kai-Uwe Zanner will join Terex financial services in January as business ...,vertikal.net,2024-07-09 22:33:12+00:00,2024-07-10 00:13:36
169,Caterpillar Trades Above 200-Day SMA: How to Play the Stock? | Markets Insider,... Terex Corp. Disclaimer- Get real-time tex charts here &gt;&gt;. MORE. Caterpillar (NYSE:CAT) has consistently traded above its 200-day simple moving ...,markets.businessinsider.com,2024-07-09 20:27:29+00:00,2024-07-10 07:13:30
170,"U.S. Nvidia, Qualcomm, Tesla - XM",* Manitowoc Company Inc MTW.N: JP Morgan cuts target price to ... * Terex Corp TEX.N: JP Morgan cuts target price to $59 from $63. * Tesla ...,www.xm.com,2024-07-10 13:50:31+00:00,2024-07-10 17:13:15
171,"Crusher Market Industry Size, Growth Factors, and Market Performance Evaluation 2023 to 2032","Terex Corporation Shibang Industry & Technology Group Co., Ltd ... company's marketing department to enhance products, reduce costs, and ...",www.taiwannews.com.tw,2024-07-10 11:54:46+00:00,2024-07-10 17:13:15
172,Q1 Earnings Highlights: Caterpillar (NYSE:CAT) Vs The Rest Of The Heavy Machinery Stocks,"Terex reported revenues of $1.29 billion, up 4.6% year on year, outperforming analysts' expectations by 5%. It was a stunning quarter for the company ...",ca.investing.com,2024-07-10 11:23:39+00:00,2024-07-10 17:13:15
173,Waystar Holding Corp.'s Quiet Period To End on July 17th (NASDAQ:WAY) - Defense World,... company because of SEC regulations. Following the end of the company's ... Terex Co. (NYSE:TEX) Given Consensus Recommendation of “Hold” by ...,www.defenseworld.net,2024-07-10 11:23:00+00:00,2024-07-10 17:13:15
174,JP Morgan cuts PTs of US construction equipment makers on weaker orders - XM,Company. New PT. Old PT. Median PT - LSEG data. Oshkosh Corp OSK.N. $120. $130. $132. Terex Corp TEX.N. $59. $63. $62. Manitowoc Co MTW.N. $12. $14.,www.xm.com,2024-07-10 17:06:36+00:00,2024-07-10 20:13:21
175,"Global Dust Control System Market to Reach US$ 26628.99 million by 2034, with a 4.34% CAGR","... company's well-known Surge range. Terex, a global producer of lifting and material processing solutions, has introduced 'Aquamist by Terex', a ...",themalaysianreserve.com,2024-07-10 01:50:18+00:00,2024-07-10 20:13:21
176,Crowland and Hoeflon partner up - Vertikal.net,"It is also official dealer of Ormgi, Terex ... Italian rental company Mollo Noleggio has acquired the Brescia based aerial lift rental company Albatros.",vertikal.net,2024-07-10 21:51:08+00:00,2024-07-10 23:13:24
