,Heading,Subheading,Publisher,Published,Found
963,Major US carriers restore some flight operations amid global cyber outage - XM,"Parcel delivery firm FedEx FDX.N said it faced substantial disruptions throughout its networks, while peer United Parcel Service UPS.N also warned of ...",www.xm.com,2024-07-19 23:00:01+00:00,2024-07-20 01:13:45
964,"United Parcel Service, Inc. (NYSE:UPS) Shares Sold by Beacon Investment Advisory ... - MarketBeat","Beacon Investment Advisory Services Inc. decreased its holdings in United Parcel Service, Inc. (NYSE:UPS - Free Report) by 43.3% in the first ...",www.marketbeat.com,2024-07-19 19:17:35+00:00,2024-07-20 01:13:45
965,How Did The Global Tech Outage Impact Transportation? - Law360,Southwest Airlines Co. United Parcel Service Inc. Government Agencies. National Railroad Passenger Corp. Port of Los Angeles.,www.law360.com,2024-07-20 01:23:28+00:00,2024-07-20 02:13:37
966,United Parcel Service (NYSE:UPS) Shares Down 0.9% - MarketBeat,Several research analysts recently issued reports on the company. Susquehanna raised their target price on United Parcel Service from $150.00 to ...,www.marketbeat.com,2024-07-19 21:20:52+00:00,2024-07-20 02:13:37
967,Is UPS Stock (NYSE:UPS) a Buy Before Its Q2 Earnings? - TipRanks.com,"United Parcel Service ($UPS) is scheduled to release its Q2 results on Tuesday, July 23. Wall Street expects flat revenues and a significant drop ...",www.tipranks.com,2024-07-20 02:22:38+00:00,2024-07-20 06:13:27
968,FedEx : Media Statement Regarding Potential Service Disruptions - MarketScreener,"Capi. FEDEX CORPORATION- Stock FedEx Corporation. +21.09%, 74.91B. UNITED PARCEL SERVICE INC. Stock United Parcel Service Inc. -7.66%, 124B. DHL ...",www.marketscreener.com,2024-07-20 01:47:44+00:00,2024-07-20 06:13:27
969,"United Parcel Service Inc. Cl B stock rises Friday, outperforms market - MarketWatch","Shares of United Parcel Service Inc. Cl B inched 0.29% higher to $145.18 Friday, on what proved to be an all-around poor trading session for the ...",www.marketwatch.com,2024-07-19 23:00:01+00:00,2024-07-20 06:13:27
970,"Google, Tesla Amid Earnings Deluge, Trump Talks Crypto, And Paris Olympics","... parcel delivery giant United Parcel Service, Inc. (NYSE:UPS), car manufacturers General Motors Company (GM) and Ford Motor Company (F) ...",seekingalpha.com,2024-07-20 15:15:07+00:00,2024-07-20 16:13:26
971,Expeditors International of Washington : CBP to Require Estimated Date of Arrival for Entry Type 86,"... Company- Financials- Consensus- Revisions- ETFs- Summary ... Stock United Parcel Service Inc. -7.66%, 124B. FEDEX CORPORATION- Stock FedEx ...",www.marketscreener.com,2024-07-20 12:21:25+00:00,2024-07-20 16:13:26
972,"Microsoft Windows “blue screen” has caused more than 2,000 flights to be grounded and ...",United Parcel Service and FedEx also said that although their airlines ... companies have effectively been taken “offline” due to the blue screen.,passionategeekz.com,2024-07-20 11:53:05+00:00,2024-07-20 16:13:26
973,FedEx operations back online after disruptions due to global IT outage - Yahoo Finance,FedEx's peer United Parcel Service had also warned of potential delivery delays and added that contingency plans were in place. Railroad operator ...,ca.finance.yahoo.com,2024-07-20 01:48:11+00:00,2024-07-20 16:13:26
974,"United Parcel Service, Inc. (NYSE:UPS) Stock Position Reduced by Kingsview Wealth ...","Kingsview Wealth Management LLC cut its position in United Parcel Service, Inc. (NYSE:UPS - Free Report) by 70.6% in the 1st quarter, according to ...",www.marketbeat.com,2024-07-20 17:16:25+00:00,2024-07-20 19:13:23
975,"United, American Airlines resume service after global outage - Yahoo News UK","... United Parcel Service also warned of potential delivery delays. ... Amadeus, a company which manages baggage at Heathrow, now confirms it has been ...",uk.news.yahoo.com,2024-07-19 22:13:01+00:00,2024-07-20 21:13:28
976,"Railroads, Seaports Hit by CrowdStrike Outage - WSJ","... firm Everstream Analytics, but most expected to resume normal business on Friday. United Parcel Service said its package business was “operating ...",www.wsj.com,2024-07-19 17:33:35+00:00,2024-07-20 22:13:22
977,FedEx experienced network disruptions due to global IT outage - TradingView,"Peer United Parcel Service UPS also warned of potential delivery delays ... Select market data provided by ICE Data Services © 2024 TradingView, Inc.",www.tradingview.com,2024-07-19 13:48:52+00:00,2024-07-20 22:13:22
978,"Major Tech Outage Grounds Flights, Hits Banks and Businesses Worldwide - MSN","United Parcel Service said its package business was “operating and delivering in all areas,” but warned of possible delays in pickup and delivery.",.google.com,2024-07-20 20:13:21+00:00,2024-07-21 02:13:42
979,Agility Public Warehousing K S C P : TEC and UPAC Sign Messila Beach Contract,"KUWAIT - 18 July 2024 - Touristic Enterprises Company (TEC) and United ... UNITED PARCEL SERVICE INC. Stock United Parcel Service Inc. -7.66%, 124B.",www.marketscreener.com,2024-07-20 02:05:16+00:00,2024-07-21 02:13:42
980,Two Magnificent Seven companies report this week. Only one will likely be among ... - Morningstar,"Results are due from United Parcel Service Inc. (UPS), as shipping demand remains uneven and the package-deliverer prepares to start handling air ...",www.morningstar.com,2024-07-21 14:04:23+00:00,2024-07-21 15:13:32
981,Two Magnificent Seven companies report this week - MarketWatch,"Results are due from United Parcel Service Inc. UPS, +0.29% , as shipping demand remains uneven and the package-deliverer prepares to start ...",www.marketwatch.com,2024-07-21 14:03:47+00:00,2024-07-21 15:13:32
982,"Nwam LLC Reduces Position in United Parcel Service, Inc. (NYSE:UPS) - Defense World","The fund owned 3,798 shares of the transportation company's stock after selling 2,562 shares during the period. Nwam LLC's holdings in United Parcel ...",www.defenseworld.net,2024-07-21 13:50:15+00:00,2024-07-21 15:13:32
983,FedEx Stock Soars to New Peak. Here's Why I'm Doubling Down | The Motley Fool,The company increased revenue per package while enacting targeted cost-controlling measures. ... The Motley Fool recommends United Parcel Service. The ...,www.fool.com,2024-07-21 13:37:38+00:00,2024-07-21 15:13:32
984,What To Expect in the Markets This Week - Investopedia,"Best Credit Repair Companies- Best Credit Cards- View All- Financial ... United Parcel Service (UPS)12 report earnings. Wednesday, July 24. S&P ...",www.investopedia.com,2024-07-21 11:50:06+00:00,2024-07-21 15:13:32
985,Wall Street Breakfast: The Week Ahead | Seeking Alpha,"... Company (KO), Texas Instruments (TXN), Philip Morris International (PM), United Parcel Service (UPS), Lockheed Martin (LMT), General Motors (GM) ...",seekingalpha.com,2024-07-21 11:14:27+00:00,2024-07-21 15:13:32
986,Microsoft CrowdStrike global outage hits Deloitte Qantas Woolworths and several countries ...,"... company that tracks flight information. ... FedEx said it faced substantial disruptions throughout its networks, while peer United Parcel Service also ...",headtopics.com,2024-07-21 09:24:14+00:00,2024-07-21 15:13:32
987,United Parcel Service (NYSE:UPS) Shares Down 0.9% - Defense World,JPMorgan Chase & Co. decreased their price target on United Parcel Service from $154.00 to $150.00 and set a “neutral” rating for the company in a ...,www.defenseworld.net,2024-07-21 08:54:36+00:00,2024-07-21 15:13:32
988,"Tesla, AT&amp;T, Alphabet, Chipotle, Visa, and More Stocks to Watch This Week | Barron's","... United Parcel Service , and Visa all on Tuesday. On Wednesday, AT&T ... Copyright © 2024 Dow Jones & Company, Inc. All Rights Reserved ...",www.barrons.com,2024-07-21 08:10:23+00:00,2024-07-21 15:13:32
989,"Tesla, AT&amp;T, Alphabet, Chipotle, Visa, and More Stocks to Watch This Week - Barron's","... United Parcel Service, and Visa all on Tuesday. Advertisement - Scroll ... Copyright © 2024 Dow Jones & Company, Inc. All Rights Reserved.",www.barrons.com,2024-07-21 16:11:38+00:00,2024-07-21 17:13:30
990,FedEx Stock Soars to New Peak. Here's Why I'm Doubling Down - Nasdaq,"The Motley Fool recommends United Parcel Service. The Motley Fool has a ... Founded in 1993 in Alexandria, VA., by brothers David and Tom Gardner, The ...",www.nasdaq.com,2024-07-21 14:27:54+00:00,2024-07-21 17:13:30
991,"United Parcel Service, Inc. (NYSE:UPS) Shares Sold by Banco Santander S.A.","grew its position in United Parcel Service by 12.0% in the fourth quarter. Whittier Trust Co. of Nevada Inc. now owns 13,581 shares of the ...",www.defenseworld.net,2024-07-21 14:41:46+00:00,2024-07-21 19:13:30
992,"M&amp;G Plc Purchases New Shares in United Parcel Service, Inc. (NYSE:UPS) - MarketBeat","M&G Plc purchased a new stake in United Parcel Service, Inc. (NYSE:UPS - Free Report) in the 1st quarter, according to the company in its most ...",www.marketbeat.com,2024-07-21 15:55:56+00:00,2024-07-21 20:13:23
993,FedEx Stock Soars to New Peak. Here's Why I'm Doubling Down - AOL.com,"The Motley Fool recommends United Parcel Service. The Motley Fool has a ... Company's foundry services. As a result, companies like Nvidia ...",www.aol.com,2024-07-21 19:54:25+00:00,2024-07-21 21:13:28
994,"Tesla, Alphabet, GM, Ford Lead Earnings Parade This Week As Market Struggles To Sustain ...","United Parcel Service, Inc. (NYSE:UPS). After close: Alphabet; Capital One Financial Corporation (NYSE:COF); Chubb Limited (NYSE:CB) ...",quantisnow.com,2024-07-21 21:39:38+00:00,2024-07-21 22:13:27
995,"Tesla, Alphabet, GM, Ford Lead Earnings Parade This Week As Market Struggles To Sustain ...","United Parcel Service, Inc. UPS+0.27%. Get Free Report. After close: Alphabet; Capital One Financial Corporation. COF-0.97%. + Free Alerts. Chubb ...",www.benzinga.com,2024-07-21 21:31:32+00:00,2024-07-21 23:13:18
996,"News in Brief podcast | Week 30 2024 | Surcharges, strikes and IATA's stressful settlements","SUPPLY CHAIN DIVE reports: United Parcel Service appointed 25-year company veteran Brian Dykes as its CFO, ... Supply Chain Dive UPS. Jul 15, 2024 ...",theloadstar.com,2024-07-22 03:06:09+00:00,2024-07-22 06:13:24
997,The Week Ahead: US Big Tech | Card Networks | US Auto | UK Banks | Mark Simpson,"Coming up this week… Date. Big UK earnings. US company reporting ... United Parcel Service (Q2) Visa (Q3). PMI (U, US, EU). Wednesday - 24 ...",www.stockopedia.com,2024-07-22 07:17:15+00:00,2024-07-22 08:13:34
998,Event Logistics Market Receive a Fillip Owing to Burgeoning - openPR.com,"United Parcel Service of America, Inc XPO Logistics, Inc. Get a Sample Copy of Report, Click Here: https://www.theinsightpartners.com/sample ...",www.openpr.com,2024-07-22 07:04:43+00:00,2024-07-22 08:13:34
999,"DJT, CrowdStrike, Tesla, Verizon, Ryanair, and More Stock Market Movers - Barron's",", Alphabet, Visa, Coca-Cola, Texas Instruments, GE Aerospace, Comcast, Philip Morris, United Parcel Service ... The company also reported first ...",www.barrons.com,2024-07-22 08:52:10+00:00,2024-07-22 09:13:30
1000,10 Best Dividend Growth Stocks to Buy and Hold Forever - AOL.com,"... Company's foundry services. As a result, companies like Nvidia ... The Motley Fool recommends United Parcel Service. The Motley Fool has a ...",www.aol.com,2024-07-22 02:55:16+00:00,2024-07-22 09:13:30
1001,2 No-Brainer Stocks I'd Buy Right Now Without Hesitation,The company's services allow customers to replace traditional ... The Motley Fool recommends United Parcel Service. The Motley Fool has a ...,www.aol.com,2024-07-22 09:17:21+00:00,2024-07-22 10:13:37
1002,"Election, Earnings Lift Wall Street Pre-bell, Asia Off, Europe Up - TradingView","... Company (BMY), Visa (V), Colgate-Palmolive (CL), Coca-Cola (KO), Lockheed Martin (LMT), and United Parcel Service (UPS), among many others. Truist ...",www.tradingview.com,2024-07-22 11:24:05+00:00,2024-07-22 12:13:38
1003,United Parcel Service (UPS) To Report Earnings Tomorrow: Here Is What To Expect,Parcel delivery company UPS (NYSE:UPS) will be reporting earnings tomorrow morning. Here's what investors should know.,finance.yahoo.com,2024-07-22 11:16:52+00:00,2024-07-22 12:13:38
1004,"Stocks Set to Open Higher After Biden's Withdrawal, Earnings and Key U.S. Inflation Data in Focus","... company reported better-than-expected Q2 results. Also, Starbucks (SBUX) ... United Parcel Service (UPS). On the economic data front, the June ...",www.nasdaq.com,2024-07-22 11:16:19+00:00,2024-07-22 12:13:38
1005,United Parcel Service (UPS) To Report Earnings Tomorrow: Here Is What To Expect,Stock Story -. Parcel delivery company UPS (NYSE:UPS) will be reporting earnings tomorrow morning. Here's what investors should know.,ca.investing.com,2024-07-22 10:48:20+00:00,2024-07-22 12:13:38
1006,"DJT, CrowdStrike, Tesla, Verizon, Ryanair, and More Stock Market Movers | Barron's","... United Parcel Service , Lockheed Martin , Spotify Technology ... Copyright © 2024 Dow Jones & Company, Inc. All Rights Reserved. Barrons.",www.barrons.com,2024-07-22 08:44:29+00:00,2024-07-22 12:13:38
1007,"Volvo, FedEx test truck 'platooning' on public U.S. road - Yahoo Lifestyle Canada",(Reuters) - Truck maker Volvo AB &lt;VOLVb.ST&gt; and package delivery company FedEx Corp &lt;FDX. ... United Parcel Service Inc &lt;UPS.N&gt; run in a number of U.S. ...,ca.style.yahoo.com,2024-07-22 08:34:42+00:00,2024-07-22 12:13:38
1008,"Boasting A 35% Return On Equity, Is United Parcel Service, Inc. (NYSE:UPS) A Top Quality Stock?","Does United Parcel Service Have A Good ROE? By comparing a company's ROE with its industry average, we can get a quick measure of how good it is.",finance.yahoo.com,2024-07-22 14:35:24+00:00,2024-07-22 15:13:43
1009,UPS: A Nearly 5% Yielding A-Rated Strong Buy For This Overvalued Market | Seeking Alpha,"UPS: A Nearly 5% Yielding A-Rated Strong Buy For This Overvalued Market. Jul. 22, 2024 7:30 AM ETUnited Parcel Service, Inc. (UPS) Stock, UPS:CA Stock ...",seekingalpha.com,2024-07-22 13:54:55+00:00,2024-07-22 15:13:43
1010,"First Full Week of Q2 Earnings, PCE Out Friday - July 22, 2024 - Zacks.com","United Parcel Service, Inc. (UPS) - free report &gt;&gt;- General Motors ... Each of the company logos represented herein are trademarks of Microsoft ...",www.zacks.com,2024-07-22 13:54:30+00:00,2024-07-22 15:13:43
1011,"Watch UPS, Tesla, Alphabet, and Coke - Baystreet.ca",The quarterly earnings season will highlight four firms this week. Analysts expect United Parcel Service (UPS) to report $1.99 in earnings per ...,.google.com,2024-07-22 13:45:58+00:00,2024-07-22 15:13:43
1012,Global Deep Frozen Packaging Logistics Market Overview And Statistic For 2024-2033,"... United Parcel Service of America Inc., FedEx ... These companies are focusing on developing ultra-low temperature-controlled logistics services ...",www.einnews.com,2024-07-22 13:33:44+00:00,2024-07-22 15:13:43
1013,EQS-News: STEMMER IMAGING AG: MiddleGround Capital concludes investment ... - Finanzen,13:51 Ausblick: United Parcel Service (UPS) informiert über die jüngsten Quartalsergebnisse ... PRIMEPULSE is the investment company of the founders of ...,www.finanzen.ch,2024-07-22 12:48:20+00:00,2024-07-22 15:13:43
1014,"Biden Bows Out, Stocks Bend Lower, and an Earnings Bonanza - TheStreet Pro","... corporate calendar other than earnings. Earnings, though, will be aplenty. As far as headliners, Tuesday morning brings United parcel Service (UPS) ...",pro.thestreet.com,2024-07-22 12:35:17+00:00,2024-07-22 15:13:43
1015,"Courier Services Global Market Report 2024 - Market Size, - openPR.com","... United Parcel Service Inc., Deutsche Post AG, FedEx Corporation, Japan Post Co Ltd., The United States Postal Service, DB Schenker, SF Express Co.",www.openpr.com,2024-07-22 12:19:26+00:00,2024-07-22 15:13:43
1016,"Berkshire Sells BofA Holdings, Ryanair Shares Drop 12%, Delta Still Struggling After IT Disruption","The company faces challenges such as low consumer confidence, air ... FedEx (NYSE:FDX), United Parcel Service (NYSE:UPS) – FedEx and UPS ...",br.advfn.com,2024-07-22 11:16:28+00:00,2024-07-22 15:13:43
1017,Two Magnificent Seven companies report this week. Only one will likely be among the ... - MSN,Results are due from United Parcel Service Inc. as shipping demand remains uneven and the package-deliverer prepares to start handling air ...,www.msn.com,2024-07-22 04:13:39+00:00,2024-07-22 15:13:43
1018,iShares Core Dividend Growth ETF Experiences Big Inflow - Nasdaq,"... United Parcel Service Inc (Symbol: UPS) is off about 0.4%, Bristol Myers Squibb Co. (Symbol: BMY) is up about 0.2%, and Morgan Stanley (Symbol: MS) ...",www.nasdaq.com,2024-07-22 15:17:00+00:00,2024-07-22 16:13:40
1019,"UPS Set for Lower 2Q Profit, Small Revenue Lift -- Earnings Preview - MarketWatch",United Parcel Service is scheduled to report second-quarter results ... PROFIT: The package-delivery company is expected to post a profit of ...,www.marketwatch.com,2024-07-22 15:16:13+00:00,2024-07-22 16:13:40
1020,"First Full Week of Q2 Earnings, PCE Out Friday - Nasdaq","United Parcel Service, Inc. (UPS) : Free Stock Analysis Report- General Motors Company (GM) : Free Stock Analysis Report- Tesla, Inc. (TSLA) ...",www.nasdaq.com,2024-07-22 16:31:15+00:00,2024-07-22 17:13:29
1021,"First Full Week of Q2 Earnings, PCE Out Friday - Nasdaq","... UPS UPS. Wednesday will be Chipotle CME and Thursday ... United Parcel Service, Inc. (UPS) : Free Stock Analysis Report- General Motors Company ...",www.nasdaq.com,2024-07-22 15:58:31+00:00,2024-07-22 17:13:29
1022,"Stocks Set to Open Higher After Biden's Withdrawal, Earnings and Key U.S. Inflation Data in Focus","Lockheed Martin Corp. AAL, 10.64, +0.06, +0.57%. American Airlines Gp. UPS, 144.74, -0.44, -0.30%. United Parcel Service. RYA.I.DX, 13.735, -2.690, - ...",www.barchart.com,2024-07-22 15:42:54+00:00,2024-07-22 17:13:29
1023,"EXCLUSIVE: Google's YouTube 'Crushing The Competition,' While Under-The-Radar Stock ...",Alphabet is also largely in focus as one of two Magnificent Seven stocks reporting. An earnings report from United Parcel Service. UPS-0.60%. Get Free ...,www.benzinga.com,2024-07-22 16:59:44+00:00,2024-07-22 18:13:38
1024,When the chips are down | Active Trader Commentary,"... United Parcel Service (UPS), Enphase Energy (ENPH), Alphabet (GOOGL) ... Click here to log on to your account or learn more about E*TRADE's trading ...",us.etrade.com,2024-07-22 15:00:04+00:00,2024-07-22 18:13:38
1025,"Noteworthy Monday Option Activity: WDC, UPS, LUV | Nasdaq","United Parcel Service Inc (Symbol: UPS) options are showing a volume of 18,832 contracts thus far today. That number of contracts represents ...",www.nasdaq.com,2024-07-22 17:58:10+00:00,2024-07-22 19:13:29
1026,UPS Q2 Earnings Preview: Macro headwinds could affect the quarter despite promising future,"United Parcel Service, Inc. Post. 145.11, -0.05%. FDX, 306.31, -0.10%. FedEx Corporation, Post. 306.31, 0.00%.",seekingalpha.com,2024-07-22 17:19:50+00:00,2024-07-22 19:13:29
1027,Barclays Sticks to Their Hold Rating for United Parcel (UPS) | Markets Insider,"United Parcel (UPS) Company Description: Founded in 1907, Georgia-based United Parcel Service, Inc. is the world's largest package delivery ...",markets.businessinsider.com,2024-07-22 17:34:32+00:00,2024-07-22 20:13:37
1028,"UPS to acquire Estafeta, boosting capabilities for customers in Mexico and beyond","We've entered into an agreement to acquire Estafeta, a leading Mexican express delivery company. ... Copyright ©1994 - 2024 United Parcel Service of ...",about.ups.com,2024-07-22 20:21:11+00:00,2024-07-22 21:13:49
1029,"UPS to Acquire Estafeta, Providing Powerful Global Logistics Solutions and Trade ...","Explore all the financial releases for United Parcel Service, a global logistics company.",investors.ups.com,2024-07-22 20:15:32+00:00,2024-07-22 21:13:49
1030,"Osaic Holdings Inc. Reduces Holdings in United Parcel Service, Inc. (NYSE:UPS)","Osaic Holdings Inc. trimmed its stake in United Parcel Service, Inc. (NYSE:UPS - Free Report) by 13.2% in the first quarter, according to the ...",www.marketbeat.com,2024-07-22 20:05:24+00:00,2024-07-22 21:13:49
1031,The Daily Breakdown: Can Bitcoin break out? - eToro,"On Tuesday, Spotify, United Parcel Service, General Electric, Coca-Cola, Visa, Tesla, and Alphabet will report earnings. A bunch of others will ...",www.etoro.com,2024-07-22 17:08:46+00:00,2024-07-22 21:13:49
1032,"GIS in Transportation Market Emerging Trends | Autodesk, Bentley Systems, ESRI","... Corporation, United Parcel Service Inc., The Emirates Group- Maritime Freight Transport Market Size Analysis| AP Moller (Maersk), Mediterranean ...",economica.ma,2024-07-22 21:48:30+00:00,2024-07-22 22:13:32
1033,UPS to Buy Mexican Delivery Company Estafeta - WSJ,"United Parcel Service agreed to acquire Mexican express delivery company Estafeta, in a deal aimed at expanding the U.S.-based carrier's role in ...",www.wsj.com,2024-07-22 21:45:22+00:00,2024-07-22 22:13:32
1034,"United Parcel Service Inc. Cl B stock remains steady Monday, underperforms market","United Parcel Service Inc. Cl B closed $47.80 short of its 52-week high ($192.98), which the company achieved on July 25th. Trading volume (3.6 M) ...",www.marketwatch.com,2024-07-22 21:16:09+00:00,2024-07-22 22:13:32
1035,UPS in Deal to Buy Mexican Express Delivery Company Estafeta | Morningstar,By Sabela Ojea. United Parcel Service agreed to acquire Mexico's Estafeta in a deal that is intended to expand the U.S.-based logistics company's ...,www.morningstar.com,2024-07-22 21:03:56+00:00,2024-07-22 22:13:32
1036,UPS in Deal to Buy Mexican Express Delivery Company Estafeta - MarketScreener,By Sabela Ojea United Parcel Service agreed to acquire Mexico's Estafeta in a deal that is intended to expand the U.S.-based logistics company's ...,www.marketscreener.com,2024-07-22 20:58:04+00:00,2024-07-22 22:13:32
1037,Stocks Higher on Strength in Chip Stocks and China's Rate Cut — TradingView News,"... company. Earnings Reports (7/23/2024). United Parcel Service Inc (UPS), General Motors Co (GM), Kimberly-Clark Corp (KMB), Avery Dennison Corp (AVY) ...",www.tradingview.com,2024-07-22 20:57:46+00:00,2024-07-22 22:13:32
1038,International Petroleum Corporation Announces Results of Normal Course Issuer Bid,22:51 Ausblick: United Parcel Service (UPS) informiert über die jüngsten Quartalsergebnisse ... (IPC) is an international oil and gas exploration and ...,www.finanzen.ch,2024-07-22 22:07:54+00:00,2024-07-22 23:13:32
1039,Zymeworks Announces FDA Clearance of Investigational New Drug Application for ZW191 ...,22:51 Ausblick: United Parcel Service (UPS) informiert über die jüngsten Quartalsergebnisse ... The Company expects to file applications seeking ...,www.finanzen.ch,2024-07-22 22:07:53+00:00,2024-07-22 23:13:32
1040,United Parcel Service (NYSE:UPS) Shares Down 0.3% on Analyst Downgrade - MarketBeat,"JPMorgan Chase & Co. reduced their price target on United Parcel Service from $154.00 to $150.00 and set a ""neutral"" rating for the company in a ...",www.marketbeat.com,2024-07-22 22:01:28+00:00,2024-07-22 23:13:32
1041,UPS's Earnings Will Send a Message About the Economy - Barron's,UPS- SPX. Investors want more from United Parcel Service- UPS. 0.29%. 's second-quarter earnings than a healthy set of numbers. They are hoping for ...,www.barrons.com,2024-07-22 21:54:21+00:00,2024-07-22 23:13:32
1042,"UPS, Ford: 2 Undervalued Dividend Stocks to Watch Now - TipRanks.com","United Parcel Service (NYSE:UPS). When it comes to major players in logistics, United Parcel Service immediately comes to mind. This company, known ...",www.tipranks.com,2024-07-22 23:21:45+00:00,2024-07-23 01:13:43
1043,UPS Agrees to Acquire Mexican Parcel Carrier Estafeta - Bloomberg,United Parcel Service Inc. agreed to buy Mexican parcel carrier Estafeta as the package delivery giant tries to capitalize on a rise in ...,www.bloomberg.com,2024-07-22 23:21:34+00:00,2024-07-23 01:13:43
1044,United Parcel Service (UPS) To Report Earnings Tomorrow: Here Is What To Expect - Barchart.com,"We encourage users to Contact Us for feedback and accommodation requests. © 2024 Barchart.com, Inc. All Rights Reserved. About Barchart | Affiliate ...",www.barchart.com,2024-07-22 22:32:02+00:00,2024-07-23 01:13:43
1045,UPS to acquire Mexican delivery firm Estafeta - Investing.com,"ATLANTA - United Parcel Service Inc. (NYSE: NYSE:UPS) has announced its intention to acquire Estafeta Mexicana S.A. de C.V., a prominent express ...",in.investing.com,2024-07-22 21:33:11+00:00,2024-07-23 01:13:43
1046,Q2 Earnings in Full Swing This week - Nasdaq,"... Corporation (MSFT) : Free Stock Analysis Report- Verizon Communications Inc. (VZ) : Free Stock Analysis Report- United Parcel Service, Inc. (UPS) ...",www.nasdaq.com,2024-07-22 19:20:23+00:00,2024-07-23 02:13:36
1047,Terry Scott Goss | Obituaries | huntingdondailynews.com,"He was a graduate of Altoona High School and served in the U.S. Army. He retired with long service from the United Parcel Service in Baltimore, Md. He ...",www.huntingdondailynews.com,2024-07-23 01:47:16+00:00,2024-07-23 03:13:37
1048,United Parcel Service (NYSE:UPS) Price Target Cut to $158.00 by Analysts at Bank of America,"The brokerage presently has a ""neutral"" rating on the transportation company's stock. Bank of America's price objective indicates a potential upside ...",www.marketbeat.com,2024-07-22 21:05:47+00:00,2024-07-23 03:13:37
1049,"UPS boosts volume in US for first time since 2022, but profit and revenue slide | AP News","CEO Carol Tome said the package delivery company returned to volume ... For the three months ended June 30, United Parcel Service Inc. earned ...",apnews.com,2024-07-23 15:09:00+00:00,2024-07-23 15:13:48
