,Heading,Subheading,Publisher,Published,Found
0,How the Teamsters and a Homegrown Union Plan to Take On Amazon - Yahoo News Singapore,"... company in the United States. ADVERTISEMENT. Advertisement. Teamsters, which ... United Parcel Service secure a more favorable contract last year.",sg.news.yahoo.com,2024-06-18 12:10:24,2024-06-18 15:23:18
1,Drone Package Delivery Industry Report 2024-2030: Discover Actionable Insights to Identify ...,"Company Profiles: Coverage of major players such as Airbus S.A.S., Altitude ... United Parcel Service of America, Inc. Wing Aviation LLC. Workhorse ...",uk.finance.yahoo.com,2024-06-18 10:35:25,2024-06-18 15:23:18
2,Drone Package Delivery Industry Report 2024-2030: Discover - GlobeNewswire,"United Parcel Service of America, Inc. Wing Aviation LLC; Workhorse ... Company ProfileResearch and MarketsIndustry: Support ServicesWebsite: https ...",www.globenewswire.com,2024-06-18 10:31:44,2024-06-18 15:23:18
3,Amazon's First U.S. Union Is Joining the Teamsters. What It Means for the Stock. - Barron's,"... companies such as United Parcel Service- UPS. 0.56%. face, with workforces represented en masse by the Teamsters. Unionization efforts at various ...",www.barrons.com,2024-06-18 09:24:36,2024-06-18 15:23:18
4,Amazon Union Workers Join Forces With the Teamsters - The New York Times,"David Levin, staff director for Teamsters for a Democratic Union, a reform group within the union that helped mobilize United Parcel Service workers ...",www.nytimes.com,2024-06-18 08:06:20,2024-06-18 15:23:18
5,Ballard and Vertiv announce strategic technology partnership to support alternative energy ...,Detailed price information for United Parcel Service (UPS-N) from The Globe and Mail including charting and trades.,www.theglobeandmail.com,2024-06-18 07:46:58,2024-06-18 15:23:18
6,Autonomous Last Mile Delivery Market to Fly High and - GlobeNewswire,"Skycart Inc. SZ DJI Technology Co., Ltd; Terra Drone Corporation; United Parcel Service of America, Inc. UVL Robotics; Wing Aviation LLC; Workhorse ...",www.globenewswire.com,2024-06-18 07:45:13,2024-06-18 15:23:18
7,Amazon Labor Union votes to ratify Teamsters affiliation | Reuters,"Teamsters, which created an internal Amazon division in 2021, was also instrumental in helping U.S. workers at United Parcel Service (UPS.N) , opens ...",www.reuters.com,2024-06-18 07:25:07,2024-06-18 15:23:18
8,"Spartan Planning &amp; Wealth Management Raises Stake in United Parcel Service, Inc. (NYSE:UPS)","Read Spartan Planning & Wealth Management Raises Stake in United Parcel Service, Inc. (NYSE:UPS) at Defense World.",www.defenseworld.net,2024-06-18 06:57:03,2024-06-18 15:23:18
9,"Trust Co. of Vermont Sells 604 Shares of United Parcel Service, Inc. (NYSE:UPS)","Read Trust Co. of Vermont Sells 604 Shares of United Parcel Service, Inc. (NYSE:UPS) at Defense World.",www.defenseworld.net,2024-06-18 06:22:53,2024-06-18 15:23:18
10,Amazon Labor Union votes to ratify Teamsters affiliation | WKZO | Everything Kalamazoo,"... company in the United States. Teamsters, which created an internal Amazon ... United Parcel Service secure a more favorable contract last year.",wkzo.com,2024-06-18 06:22:36,2024-06-18 15:23:18
11,Amazon Labor Union votes to ratify Teamsters affiliation - MarketScreener,"Teamsters, which created an internal Amazon division in 2021, was also instrumental in helping U.S. workers at United Parcel Service secure a more ...",www.marketscreener.com,2024-06-18 05:51:45,2024-06-18 15:23:18
12,"Scarborough Advisors LLC Buys New Shares in United Parcel Service, Inc. (NYSE:UPS)","The firm purchased 554 shares of the transportation company's stock, valued at approximately $87,000. Get United Parcel Service alerts: Other ...",www.defenseworld.net,2024-06-18 04:37:34,2024-06-18 15:23:18
13,TD Cowen Keeps Their Buy Rating on FedEx (FDX) | Markets Insider,"Becker covers the Industrials sector, focusing on stocks such as Delta Air Lines, Aercap Holdings, and United Parcel. In addition to TD Cowen ...",markets.businessinsider.com,2024-06-18 02:36:58,2024-06-18 15:23:18
14,TD Cowen Remains a Buy on Copa Holdings (CPA) | Markets Insider,"Becker covers the Industrials sector, focusing on stocks such as Delta Air Lines, Aercap Holdings, and United Parcel. Copa Holdings has an analyst ...",markets.businessinsider.com,2024-06-18 02:36:58,2024-06-18 15:23:18
15,"Wellington Management Group LLP Grows Position in United Parcel Service, Inc. (NYSE:UPS)",Hedge funds and other institutional investors own 60.26% of the company's stock. United Parcel Service Price Performance. Shares of UPS opened at ...,www.defenseworld.net,2024-06-17 23:04:46,2024-06-18 15:23:18
16,A letter to The Jarvis Family - About UPS,"The UPS family mourns the loss of Ken Jarvis – a UPSer who served our company ... Copyright ©1994 - 2024 United Parcel Service of America, Inc. All ...",about.ups.com,2024-06-17 20:16:41,2024-06-18 15:23:18
17,Expeditors International of Washington : FDA Issues Final Rule on Administrative Destruction,"UNITED PARCEL SERVICE INC. Stock United Parcel Service Inc. -13.60%, 116B. DHL GROUP- Stock DHL Group. -16.04 ...",www.marketscreener.com,2024-06-17 19:11:39,2024-06-18 15:23:18
18,Global Road Logistics Market Report 2024-2028: Analysis by - GlobeNewswire,United Parcel Service Inc. Werner Enterprises Inc. XPO Inc. Yellow Corp ... Company ProfileResearch and MarketsIndustry: Support ServicesWebsite:.,www.globenewswire.com,2024-06-19 06:44:09,2024-06-19 13:30:04
19,Here's Why United Parcel Service (NYSE:UPS) Can Manage Its Debt Responsibly,"It's only natural to consider a company's balance sheet when you examine how risky it is, since debt is often involved when a business collapses. We ...",simplywall.st,2024-06-19 06:16:25,2024-06-19 13:30:04
20,Does AAR (NYSE:AIR) Have A Healthy Balance Sheet? - Simply Wall St News,"In the worst case scenario, a company can go bankrupt if it cannot pay its creditors. ... Stock Analysis. Here's Why United Parcel Service (NYSE:UPS) ...",simplywall.st,2024-06-19 05:47:43,2024-06-19 13:30:04
21,Bio Pharma Logistics Market Anticipated To Achieve USD 192.52 - openPR.com,"SF Express Co., Ltd. • SkyCell AG • UPS (United Parcel Service, Inc.) • VersaCold Logistics Services • World Courier, a part of AmerisourceBergen",www.openpr.com,2024-06-19 05:13:00,2024-06-19 13:30:04
22,Bernstein rates DHL Group at 'Outperform' - Target 45 euros - MarketScreener,Company Profile. DHL Group AG specializes in transportation and logistics ... UNITED PARCEL SERVICE INC. Stock United Parcel Service Inc. -14.65 ...,www.marketscreener.com,2024-06-19 04:15:57,2024-06-19 13:30:04
23,FedEx : Celebrates PRIDE by Investing in the Future of LGBTQIA+ Workforce in India,Company Profile. FedEx Corporation is the world leader in express shipping ... UNITED PARCEL SERVICE INC. Stock United Parcel Service Inc. -14.65 ...,www.marketscreener.com,2024-06-19 04:11:57,2024-06-19 13:30:04
24,Finished Vehicles Logistics Market size is set to grow by USD 20.6 billion from 2024-2028 ...,"... Inc., Omsan Lojistik AS, Ryder System Inc., Schnellecke Group AG and Co. KG, SNCF Group., United Parcel Service Inc., and XPO Inc.. Please enable ...",www.theautochannel.com,2024-06-18 23:00:53,2024-06-19 13:30:04
25,Amazon Labor Union votes to ratify Teamsters affiliation | Business Information &amp; News | FE,"... company in the United States. Teamsters, which created an internal Amazon ... UNITED PARCEL SERVICE, INC.; INTERNATIONAL BROTHERHOOD OF TEAMSTERS ...",today.westlaw.com,2024-06-18 21:48:04,2024-06-19 13:30:04
26,FedEx Corp. stock outperforms competitors despite losses on the day - MarketWatch,"... company reached on March 22nd. Despite its losses, the stock outperformed some of its competitors Tuesday, as United Parcel Service Inc. Cl B UPS ...",www.marketwatch.com,2024-06-18 20:16:22,2024-06-19 13:30:04
27,Finished Vehicles Logistics Market size is set to grow by USD 20.6 billion from 2024-2028 ...,"... Inc., Omsan Lojistik AS, Ryder System Inc., Schnellecke Group AG and Co. KG, SNCF Group., United Parcel Service Inc., and XPO Inc.. Technavio has ...",themalaysianreserve.com,2024-06-18 19:39:13,2024-06-19 13:30:04
28,"United Parcel Service Inc. Cl B stock falls Tuesday, underperforms market - MarketWatch","Shares of United Parcel Service Inc. Cl B slipped 1.21% to $134.20 Tuesday, on what proved to be an all-around positive trading session for the ...",www.marketwatch.com,2024-06-18 19:05:03,2024-06-19 13:30:04
29,Finished Vehicles Logistics Market size is set to grow by USD 20.6 billion from 2024-2028 ...,"... Inc., Omsan Lojistik AS, Ryder System Inc., Schnellecke Group AG and Co. KG, SNCF Group., United Parcel Service Inc., and XPO Inc.. Continue ...",www.prnewswire.com,2024-06-18 18:48:08,2024-06-19 13:30:04
30,Form 487 Advisors Disciplined - StreetInsider,"the company's headquarters is located outside the United States,. •the stocks are ... United Parcel Service, Inc. ​. 2.01. ​. ​. 135.85. ​. ​. 2,989.",www.streetinsider.com,2024-06-18 16:17:05,2024-06-19 13:30:04
31,FedEx : Announces Appointment of Karen Blanks Ellis as New Chief Sustainability Officer,... company and amid increasing global interest in corporate sustainability action. ... UNITED PARCEL SERVICE INC. Stock United Parcel Service Inc. -14.65 ...,www.marketscreener.com,2024-06-18 15:42:21,2024-06-19 13:30:04
32,A letter to The Jarvis Family - About UPS,"The UPS family mourns the loss of Ken Jarvis – a UPSer who served our company ... Copyright ©1994 - 2024 United Parcel Service of America, Inc. Todos ...",about.ups.com,2024-06-18 14:58:16,2024-06-19 13:30:04
33,United Parcel Service (NYSE:UPS) Stock Price Down 0.2% - MarketBeat,"The company traded as low as $135.12 and last traded at $135.61. 528,203 shares changed hands during mid-day trading, a decline of 87% from the ...",www.marketbeat.com,2024-06-18 14:51:42,2024-06-19 13:30:04
34,Confluence Investment Management LLC Acquires New Shares in United Parcel Service ...,"Confluence Investment Management LLC acquired a new stake in United Parcel Service, Inc. (NYSE:UPS - Free Report) in the first quarter, ...",www.marketbeat.com,2024-06-18 12:43:35,2024-06-19 13:30:04
35,Wells Fargo Remains a Hold on FedEx (FDX) | Markets Insider,"Wetherbee covers the Industrials sector, focusing on stocks such as FedEx, United Parcel, and Werner Enterprises. In addition to Wells Fargo ...",markets.businessinsider.com,2024-06-18 10:50:34,2024-06-19 13:30:04
36,11 Best Freight Stocks To Buy Now - Insider Monkey,"The company has so far released over 125,000 additional containers. You can ... Corporation (NYSE:UNP)United Parcel Service Inc. (NYSE:UPS)Norfolk ...",www.insidermonkey.com,2024-06-19 16:26:23+00:00,2024-06-19 17:13:27
37,Gary airport breaks ground on $12 million hangar - Chicago Tribune,"... United Parcel Service cargo business, the 2022 approval of the airport's master plan, and last year's purchase of the Griffith-Merrillville Airport.",www.chicagotribune.com,2024-06-19 15:06:41+00:00,2024-06-19 17:13:27
38,Former Employee Sues United Parcel Service Over Pregnancy Discrimination | Pennsylvania Record,"Candice Cooley lodged the complaint against United Parcel Service (UPS) in the United ... However, after taking her discretionary days as per company ...",pennrecord.com,2024-06-19 14:53:40+00:00,2024-06-19 17:13:27
39,Parcel Delivery: Enhancing Security and User Experience - EIN News,"Key players in the parcel delivery market include Amazon.com Inc., United Parcel Service Inc., FedEx Corporation, Deutsche Post AG, and SF Holding Co.",www.einnews.com,2024-06-19 14:28:39+00:00,2024-06-19 17:13:27
40,Amazon Labor Union members in New York City vote to affiliate with Teamsters - The Mirror,"Logan added: ""Doing it independently is just so difficult when you're up against a company ... United Parcel Service, Inc. Get our money-saving tips and ...",www.mirror.co.uk,2024-06-19 14:25:40+00:00,2024-06-19 17:13:27
41,"Rural Clinical and Healthcare Logistics Market Report, 2024-2028 - GlobeNewswire","United Parcel Service Inc. Zipline International Inc. Also, the rural ... Company ProfileResearch and MarketsIndustry: Support ServicesWebsite:.",www.globenewswire.com,2024-06-19 14:12:23+00:00,2024-06-19 17:13:27
42,"Last Mile Delivery Market Set for Rapid Expansion, Predicted to Reach $288.00 Billion by 2028","... Company's Last Mile Delivery Global Market Report 2024 – Market Size ... Key companies such as Amazon.com Inc., United Parcel Service Inc., and ...",www.einnews.com,2024-06-19 14:06:25+00:00,2024-06-19 17:13:27
43,Juneteenth 2024: What businesses are open and closed in Houston?,Both United Parcel Service and FedEx will offer pickup and delivery ... Tractor Supply Company. SEE ALSO: 'From Chains to Church' Immerse yourself ...,www.click2houston.com,2024-06-19 13:34:46+00:00,2024-06-19 17:13:27
44,"MARKET PULSE-Boeing, Alexion, UPS, JPMorgan, IGO, WebMD, Medicines - Reuters","... company at more than $23 billion, after Bloomberg first reported Roche's plans. ** UNITED PARCEL SERVICES INC, $86.08, down 5.8 pct (1359 ET). ** ...",www.reuters.com,2024-06-19 12:31:54+00:00,2024-06-19 17:13:27
45,Is This Amazon's Next $100 Billion Opportunity? - Nasdaq,The Motley Fool has positions in and recommends Amazon and FedEx. The Motley Fool recommends United Parcel Service. The Motley Fool has a disclosure ...,www.nasdaq.com,2024-06-19 12:30:13+00:00,2024-06-19 17:13:27
46,"United Parcel Service, Inc. (NYSE:UPS) Shares Sold by Fisher Asset Management LLC","Read United Parcel Service, Inc. (NYSE:UPS) Shares Sold by Fisher Asset Management LLC at Defense World.",www.defenseworld.net,2024-06-19 12:29:44+00:00,2024-06-19 17:13:27
47,Is This Amazon's Next $100 Billion Opportunity? - The Motley Fool,"... services, adds another $40 billion-plus to the company's top line. In ... The Motley Fool recommends United Parcel Service. The Motley Fool has a ...",www.fool.com,2024-06-19 12:17:57+00:00,2024-06-19 17:13:27
48,Global Road Logistics Market Report 2024-2028: Analysis by - GlobeNewswire,United Parcel Service Inc. Werner Enterprises Inc. XPO Inc. Yellow Corp ... Company ProfileResearch and MarketsIndustry: Support ServicesWebsite:.,www.globenewswire.com,2024-06-19 11:44:09+00:00,2024-06-19 17:13:27
49,Here's Why United Parcel Service (NYSE:UPS) Can Manage Its Debt Responsibly,"It's only natural to consider a company's balance sheet when you examine how risky it is, since debt is often involved when a business collapses. We ...",simplywall.st,2024-06-19 11:16:25+00:00,2024-06-19 17:13:27
50,"STOCKS NEWS US-FedEx down after results, outlook, weighs on UPS - Reuters",Shares of the company slid 4.2 percent to $41.25 in premarket trade while peer company United Parcel Service was down 1.1 percent to $46 before the ...,www.reuters.com,2024-06-19 11:16:00+00:00,2024-06-19 17:13:27
51,Fisher Asset Management LLC Sells 145378 Shares of Ambev S.A. (NYSE:ABEV),"The firm owned 5,739,554 shares of the company's stock after selling 145,378 shares during the quarter. ... United Parcel Service, Inc. (NYSE:UPS) ...",www.defenseworld.net,2024-06-19 10:58:59+00:00,2024-06-19 17:13:27
52,Does AAR (NYSE:AIR) Have A Healthy Balance Sheet? - Simply Wall St News,"In the worst case scenario, a company can go bankrupt if it cannot pay its creditors. ... Stock Analysis. Here's Why United Parcel Service (NYSE:UPS) ...",simplywall.st,2024-06-19 10:47:43+00:00,2024-06-19 17:13:27
53,Bio Pharma Logistics Market Anticipated To Achieve USD 192.52 - openPR.com,"SF Express Co., Ltd. • SkyCell AG • UPS (United Parcel Service, Inc.) • VersaCold Logistics Services • World Courier, a part of AmerisourceBergen",www.openpr.com,2024-06-19 10:13:00+00:00,2024-06-19 17:13:27
54,Bpost: agreement on newspaper distribution in Wallonia - MarketScreener,Company Profile. bpost SA/NV is the leading Belgian provider of postal ... UNITED PARCEL SERVICE INC. Stock United Parcel Service Inc. -14.65 ...,www.marketscreener.com,2024-06-19 09:45:53+00:00,2024-06-19 17:13:27
55,Bernstein rates DHL Group at 'Outperform' - Target 45 euros - MarketScreener,Company Profile. DHL Group AG specializes in transportation and logistics ... UNITED PARCEL SERVICE INC. Stock United Parcel Service Inc. -14.65 ...,www.marketscreener.com,2024-06-19 09:15:57+00:00,2024-06-19 17:13:27
56,"Los Angeles Capital Management LLC Reduces Position in United Parcel Service, Inc. (NYSE:UPS)","Los Angeles Capital Management LLC decreased its stake in shares of United Parcel Service, Inc. (NYSE:UPS - Free Report) by 7.5% in the 1st ...",www.marketbeat.com,2024-06-19 17:29:50+00:00,2024-06-19 19:23:50
57,Expeditors International of Washington : BIS Expands Sanctions for Russia,"UNITED PARCEL SERVICE INC. Stock United Parcel Service Inc. -14.65%, 115B. DHL GROUP- Stock DHL Group. -15.59 ...",www.marketscreener.com,2024-06-19 12:11:12+00:00,2024-06-19 19:23:50
58,11 Best Freight Stocks To Buy Now - Insider Monkey,"The company has a 20,000-mile network across Canada and the United States ... Corporation (NYSE:UNP)United Parcel Service Inc. (NYSE:UPS)Norfolk ...",www.insidermonkey.com,2024-06-19 16:32:22+00:00,2024-06-19 20:13:06
59,"Fisher Asset Management LLC Sells 10418 Shares of Workday, Inc. (NASDAQ:WDAY)","(NASDAQ:WDAY – Free Report) by 14.7% during the fourth quarter, according to the company ... United Parcel Service, Inc. (NYSE:UPS) Shares Sold by ...",www.defenseworld.net,2024-06-19 16:08:41+00:00,2024-06-19 20:13:06
60,11 Best Freight Stocks To Buy Now - Insider Monkey,The transport company provides full truckload carrier services with an ... Corporation (NYSE:UNP)United Parcel Service Inc. (NYSE:UPS)Norfolk ...,www.insidermonkey.com,2024-06-19 16:08:37+00:00,2024-06-19 21:13:09
61,"Does United Parcel Service, Inc. (UPS)'s Tech Prowess Set It Apart From Other Freight Stocks?","In this article, we are going to take a look at where United Parcel Service, Inc. (NYSE:UPS) stands against the other freight stocks. The Red Sea ...",finance.yahoo.com,2024-06-19 21:03:56+00:00,2024-06-19 22:13:19
62,Newell Brands latest big Atlanta company to sign new HQ deal - The Business Journals,"The company, whose brands include Rubbermaid, Sharpie and Elmer's, will ... United Parcel Service Inc. 2. 2. WestRock Inc. 3. 3. Cox Enterprises Inc ...",www.bizjournals.com,2024-06-19 20:48:08+00:00,2024-06-19 22:13:19
63,Uptick of stolen packages reported in Amherst - MSN,"Have your packages delivered somewhere else. If you know you won't be home when your package will be delivered, FedEx and United Parcel Service (UPS) ...",.google.com,2024-06-19 16:47:11+00:00,2024-06-19 22:13:19
64,PostNL N : appoints Willem-Jan van Tongeren as CIO - MarketScreener,"UNITED PARCEL SERVICE INC. Stock United Parcel Service Inc. -14.65%, 115B. FEDEX CORPORATION- Stock FedEx Corporation. -1.93%, 61.05B. DHL GROUP ...",www.marketscreener.com,2024-06-19 15:23:30+00:00,2024-06-19 22:13:19
65,"Agios Pharmaceuticals, Inc. (NASDAQ:AGIO) Shares Sold by Fisher Asset Management LLC","Agios Pharmaceuticals, Inc, a biopharmaceutical company, discovers and ... United Parcel Service, Inc. (NYSE:UPS) Shares Sold by Fisher Asset ...",www.defenseworld.net,2024-06-19 14:04:36+00:00,2024-06-19 22:13:19
66,"What Is Sonos, Inc.'s (NASDAQ:SONO) Share Price Doing? - Simply Wall St News",... company's future expectations. Sonos' revenue growth are expected to be ... Here's Why United Parcel Service (NYSE:UPS) Can Manage Its Debt Responsibly.,simplywall.st,2024-06-19 12:38:11+00:00,2024-06-19 22:13:19
67,United Parcel Service (NYSE:UPS) Shares Down 1.2% - MarketBeat,"United Parcel Service, Inc. (NYSE:UPS - Get Free Report)'s stock price fell 1.2% during mid-day trading on Wednesday . The company traded as low ...",www.marketbeat.com,2024-06-19 17:53:45+00:00,2024-06-19 23:13:17
68,11 Best Freight Stocks To Buy Now - Insider Monkey,"United Parcel Service, Inc. (NYSE:UPS) is a global shipping and logistics company based in the United States. The company offers freight forwarding ...",www.insidermonkey.com,2024-06-19 16:39:46+00:00,2024-06-19 23:13:17
69,Fisher Asset Management LLC Sells 53459 Shares of Banner Co. (NASDAQ:BANR),"Banner Corporation operates as the bank holding company for Banner Bank that ... United Parcel Service, Inc. (NYSE:UPS) Shares Sold by Fisher Asset ...",www.defenseworld.net,2024-06-19 16:08:43+00:00,2024-06-19 23:13:17
70,DUBUQUE COMMUNITY SCHOOL DISTRICT | Legals | telegraphherald.com,"... Service Of America $367.87; Superior Welding Supply Co $9,589.60; Swift ... United Parcel Service $341.88; United Way Services $229.88; Unitypoint ...",www.telegraphherald.com,2024-06-20 03:42:13+00:00,2024-06-20 08:13:18
71,Plaintiff alleges Automated Health Systems violated labor laws through unfair wage practices,"... services management company for alleged violations of federal wage laws. The complaint, brought by Julie Delk on June 3, 2024, in the United ...",pennrecord.com,2024-06-20 12:20:18+00:00,2024-06-20 13:13:23
72,Amazon Is Ditching Plastic Air Pillow Packaging in North America - BNN Bloomberg,... United Parcel Service Inc. is scheduled to release earnings figures on ... company's sustainable packaging initiatives. “We're now at the stage ...,www.bnnbloomberg.ca,2024-06-20 12:14:19+00:00,2024-06-20 13:13:23
73,Amazon takes aim at packaging waste - Bangkok Post,Amazon has ramped up its plastic-reduction efforts following criticism from environmental watchdogs who said the company ... United Parcel Service ...,www.bangkokpost.com,2024-06-20 12:12:44+00:00,2024-06-20 13:13:23
74,"NBC Securities Inc. Boosts Holdings in United Parcel Service, Inc. (NYSE:UPS)","Read NBC Securities Inc. Boosts Holdings in United Parcel Service, Inc. (NYSE:UPS) at Defense World.",www.defenseworld.net,2024-06-20 11:28:07+00:00,2024-06-20 13:13:23
75,"Cwm LLC Sells 31,968 Shares of United Parcel Service, Inc. (NYSE:UPS) - MarketBeat",Institutional investors own 60.26% of the company's stock. United Parcel Service Trading Down 1.2 %. UPS opened at $134.20 on Thursday. The firm's ...,www.marketbeat.com,2024-06-20 10:52:17+00:00,2024-06-20 13:13:23
76,"Cwm LLC Sells 31,968 Shares of United Parcel Service, Inc. (NYSE:UPS) - Defense World",Versant Capital Management Inc increased its holdings in shares of United Parcel Service by 2.2% during the 1st quarter. Versant Capital Management ...,www.defenseworld.net,2024-06-20 10:45:02+00:00,2024-06-20 13:13:23
77,SEHK Growth Companies With Up To 30% Insider Ownership - Simply Wall St News,"An investment holding company, offers express delivery services. See The ... United Parcel Service. Market Insights. Finding Healthy Companies Within ...",simplywall.st,2024-06-20 10:34:00+00:00,2024-06-20 13:13:23
78,DIARY-S&amp;P 500 EARNINGS MONTH AHEAD - Reuters,"1.74 31 1.68 30 Jan Q4 2013 United Parcel Service, Inc. 1.43 27 1.32 30 ... Company 0.90 28 0.79 05 Feb BMO Q2 2014 The Estée Lauder Companies Inc.",www.reuters.com,2024-06-20 10:07:54+00:00,2024-06-20 13:13:23
79,"Regulatory Challenges, and Future Growth of Bio-pharma - openPR.com","◘ United Parcel Service ◘ Cavalier Logistics ◘ LifeConEx ... - Market split the breakdown knowledge by company, products, end-user, and prime ...",www.openpr.com,2024-06-20 07:40:40+00:00,2024-06-20 13:13:23
80,Some UPS packages bound for small towns are spending more time at the Pittsfield ...,"UPS, known formally as United Parcel Service, hasn't identified the ZIP ... ""I think it's sad that a company like UPS, who has prided themselves on ...",www.berkshireeagle.com,2024-06-20 14:55:22+00:00,2024-06-20 16:13:24
81,World Future Awards Honors The TOP 100 Global Innovation Companies Of 2024,"UPS (United Parcel Service): A leader in logistics, UPS has innovated in supply chain management and delivery services, improving global logistics ...",www.europeanbusinessreview.com,2024-06-20 14:11:49+00:00,2024-06-20 16:13:24
82,Guru Fundamental Report for UPS - Nasdaq,"UNITED PARCEL SERVICE, INC. (UPS) is a large-cap growth stock in the Air Courier industry. The rating using this strategy is 66% based on the firm's ...",www.nasdaq.com,2024-06-20 14:07:51+00:00,2024-06-20 16:13:24
83,Project 2025 Would Undo the NLRB's Progress on Protecting Workers' Right To Organize,... company never goes through a union election again.” And the Project 2025 policy ... United Parcel Service (UPS) contract. The number of workers ...,www.americanprogress.org,2024-06-20 13:04:33+00:00,2024-06-20 16:13:24
84,"How to Play FedEx (FDX) Stock Ahead of Its Q4 Earnings? - June 20, 2024 - Zacks","United Parcel Service, Inc. (UPS) - free report &gt;&gt;- FedEx Corporation ... Each of the company logos represented herein are trademarks of Microsoft ...",www.zacks.com,2024-06-20 13:02:32+00:00,2024-06-20 16:13:24
85,Comprehensive Market Research Report on Strategy Management Software 2024,"Leading companies in the strategy management software market such as United Parcel Service Inc., Accenture Plc, and Oracle Corporation are ...",www.einnews.com,2024-06-20 12:50:47+00:00,2024-06-20 16:13:24
86,Should You Buy FedEx Corporation (NYSE:FDX) For Its Upcoming Dividend?,"Dividends are typically paid out of company income, so if a company pays out ... United Parcel Service- NYSE:EXPD. Expeditors International of ...",simplywall.st,2024-06-20 11:01:56+00:00,2024-06-20 16:13:24
87,Watch Out For New Scam Involving Minnesota's E-ZPass,"... Company is the oldest major broadcasting company in the United States. ... United Postal Service,"" it is in fact the United Parcel Service. In ...",b105country.com,2024-06-20 13:46:27+00:00,2024-06-20 18:13:24
88,"STOCKS NEWS US-Motorola swings to loss, suspends dividend | Reuters","... Co , MetLife , Motorola Inc , PNC Financial , Schering-Plough , Dow Chemical , United Parcel Service and Yum! Brands . Reuters Messaging: ryan ...",www.reuters.com,2024-06-20 13:05:57+00:00,2024-06-20 18:13:24
