,Heading,Subheading,Publisher,Published,Found
703,"3M CFO Resigns Following Leadership Shakeup, Health-Care Spinoff - BNN Bloomberg",... Inc.'s finance chief and United Parcel Service Inc.'s appointment of a new executive to that role. ©2024 Bloomberg L.P.. Top Stories. CPPIB invests ...,www.bnnbloomberg.ca,2024-07-10 12:51:11+00:00,2024-07-10 16:14:29
704,"United Parcel Service, Inc. (NYSE:UPS) Shares Sold by Jennison Associates LLC","Jennison Associates LLC lessened its stake in United Parcel Service, Inc. (NYSE:UPS - Free Report) by 37.2% in the 1st quarter, according to the ...",www.marketbeat.com,2024-07-10 12:04:22+00:00,2024-07-10 16:14:29
705,"UPS To Release Second-Quarter 2024 Results On Tuesday, July 23, 2024 - Quantisnow","United Parcel Service Inc. against its peers $FDX$HD. UPS (NYSE:UPS) will announce its 2024 second-quarter results on July 23, 2024, at ...",quantisnow.com,2024-07-10 09:11:36+00:00,2024-07-10 16:14:29
706,"GameStop, UPS, Cabrini and other large Pa. layoffs from the first half of 2024 - Delco Times","United Parcel Service Inc. laid off 198 part-time employees and eight full-time employees at 521 N. Center Ave. in New Stanton, Westmoreland County.",www.delcotimes.com,2024-07-10 05:52:54+00:00,2024-07-10 16:14:29
707,"Goodyear, Smart Global rise; LegalZoom falls, Wednesday, 7/10/2024 - ABC News","United Parcel Service Inc. (UPS), up 4 cents to $134.32. The package delivery service named Brian Dykes as its new chief financial officer.",abcnews.go.com,2024-07-10 16:19:45+00:00,2024-07-10 17:14:17
708,"Goodyear, Smart Global rise; LegalZoom falls, Wednesday, 7/10/2024 - Yahoo Finance","United Parcel Service Inc. UPS), up 4 cents to $134.32. The package delivery service named Brian Dykes as its new chief financial officer.",finance.yahoo.com,2024-07-10 16:55:40+00:00,2024-07-10 18:14:19
709,"Goodyear, Smart Global rise; LegalZoom falls, Wednesday, 7/10/2024 - Seattle PI","(TSM), up $4.91 to $189.44. The chipmaker reported a jump in June revenue from a year ago. United Parcel Service Inc. (UPS), up 4 ...",www.seattlepi.com,2024-07-10 16:22:48+00:00,2024-07-10 18:14:19
710,UPS Appoints Bryan Dykes As CFO - Quantisnow,Image for SEC Form 4 filed by Hewett Wayne M. 4 - UNITED PARCEL SERVICE INC (0001090727) (Issuer). 5/3/24 4:21:00 PM ET.,quantisnow.com,2024-07-10 08:11:56+00:00,2024-07-10 18:14:19
711,"UPS Women Asserting Gender, Age Bias Lose Summary Judgment - Bloomberg Law News","United Parcel Service Inc. signage is seen on delivery trucks in New York City, July 24, 2017. Photographer: Victor J. Blue/Bloomberg via Getty ...",news.bloomberglaw.com,2024-07-10 07:08:42+00:00,2024-07-10 18:14:19
712,"Consolidated Chassis Management promotes Summers to VP, Corporate Maintenance ...",More Intermodal. UPS names company insider as CFO after predecessor's sudden exit. United Parcel Service Inc. named a company veteran to be its ...,www.ajot.com,2024-07-10 02:11:16+00:00,2024-07-10 18:14:19
713,"United Parcel Service, Inc. (NYSE:UPS) Receives Average Recommendation of &quot;Hold&quot; from Analysts","Shares of United Parcel Service, Inc. (NYSE:UPS - Get Free Report) have been assigned an average rating of ""Hold"" from the twenty-three brokerages ...",www.marketbeat.com,2024-07-10 08:05:42+00:00,2024-07-10 19:14:23
714,UPS Elevates Brian Dykes to the Chief Financial Officer Position - Yahoo Finance,"United Parcel Service UPS has appointed Brian Dykes as its new ... Previously, he held many senior roles within the company's finance and accounting, ...",sg.finance.yahoo.com,2024-07-10 16:20:53+00:00,2024-07-10 21:14:09
715,"Stock Market Update &amp; Analysis for July 10th, 2024 - The Globe and Mail","... company's growth and financial governance. United Parcel Service Inc (UPS): Brian Dykes, a company insider with over 25 years of experience, has ...",www.theglobeandmail.com,2024-07-10 16:20:21+00:00,2024-07-10 21:14:09
716,"Newly-appointed UPS CFO faces shipping, cost quandary",United Parcel Service (UPS) is slated to become the United States Postal Service's ... United Parcel Service appointed 25-year company veteran Brian ...,www.cfodive.com,2024-07-10 20:55:57+00:00,2024-07-10 22:14:11
717,"Morning Headlines - Wednesday, July 10, 2024 | Recent News - DrydenWire.com","According to court records, in December 2022, agents intercepted a United Parcel Service (UPS) package intended for Mack that contained approximately ...",drydenwire.com,2024-07-10 20:22:42+00:00,2024-07-10 22:14:11
718,"New electric plane soars at Atlantic City, NJ airport showcase - NJ 101.5",UPS also has the option to purchase up to 150 of the aircraft. BETA electric aircraft with the UPS logo (United Parcel Service). LOOK: Most common ...,nj1015.com,2024-07-10 19:46:03+00:00,2024-07-10 22:14:11
719,GitLab Inc. (NASDAQ:GTLB) Given Consensus Rating of “Moderate Buy” by Analysts,"United Parcel Service, Inc. Receives Average Recommendation of ...",www.defenseworld.net,2024-07-10 19:40:41+00:00,2024-07-10 22:14:11
720,"Noteworthy Wednesday Option Activity: CVX, PYPL, UPS - Nasdaq","And United Parcel Service Inc (Symbol: UPS) saw options trading volume of 17,727 contracts, representing approximately 1.8 million underlying ...",www.nasdaq.com,2024-07-10 19:38:47+00:00,2024-07-10 22:14:11
721,United Parcel Service (NYSE:UPS) Trading Down 0.1% - MarketBeat,"JPMorgan Chase & Co. lowered their price objective on United Parcel Service from $154.00 to $150.00 and set a ""neutral"" rating on the stock in a ...",www.marketbeat.com,2024-07-10 17:30:42+00:00,2024-07-10 22:14:11
722,"United Parcel Service, Inc. (NYSE:UPS) Shares Sold by Jennison Associates LLC","Read United Parcel Service, Inc. (NYSE:UPS) Shares Sold by Jennison Associates LLC at Defense World.",www.defenseworld.net,2024-07-10 14:18:31+00:00,2024-07-10 22:14:11
723,"3M CFO Resigns Following Leadership Shakeup, Health-Care Spinoff - Bloomberg","... companies, following the departure of Chipotle Mexican Grill Inc.'s finance chief and United Parcel Service Inc.'s appointment of a new executive ...",www.bloomberg.com,2024-07-10 11:33:51+00:00,2024-07-10 22:14:11
724,Third-Party Logistics (3PL) Market Size In US is set to grow by USD 120.1 billion from 2024 ...,"Key US players such as C H Robinson Worldwide Inc., FedEx Corp., and United Parcel Service Inc. are prominent due to their extensive networks and ...",www.prnewswire.com,2024-07-10 21:45:54+00:00,2024-07-10 23:14:27
725,"Goodyear, Smart Global rise; LegalZoom falls, Wednesday, 7/10/2024 - Lancaster Online","United Parcel Service Inc., up $1.37 to $135.65. The package delivery service named Brian Dykes as its new chief financial officer. Chipotle ...",lancasteronline.com,2024-07-10 20:40:26+00:00,2024-07-10 23:14:27
726,Green Logistics Market Analysis: From $1.3 Trillion in 2022 to $2.9 Trillion by 2032 at a ... - EIN News,"... company against losses. Within the green logistics market, cargo ... Inc., and United Parcel Service of America, Inc. David Correa Allied ...",www.einnews.com,2024-07-10 17:55:14+00:00,2024-07-10 23:14:27
727,Spare Parts Logistics Market size is set to grow by USD 24.2 billion from 2024-2028 ...,"... United Parcel Service Inc., and XPO Inc. Market Driver. Industry 4.0 ... Technavio is a leading global technology research and advisory company.",themalaysianreserve.com,2024-07-10 23:36:09+00:00,2024-07-11 02:14:22
728,Spare Parts Logistics Market size is set to grow by USD 24.2 billion from 2024-2028 ...,"... United Parcel Service Inc., and XPO Inc. Market Driver. Industry 4.0 ... Company Landscape. 11 Company Analysis. 12 Appendix. About Technavio.",www.news-journal.com,2024-07-11 02:12:19+00:00,2024-07-11 03:14:18
729,K Enter names Tan Chin Hwee as interim CEO and chairman | Seeking Alpha,The company added that Tan Chin Hwee's term as ... United Parcel Service: Robust Profitability Benefiting From Durable Competitive Advantages.,seekingalpha.com,2024-07-11 02:06:43+00:00,2024-07-11 03:14:18
730,"FedEx Corp. stock rises Wednesday, still underperforms market - MarketWatch","... company reached on June 28th. The stock underperformed when compared to some of its competitors Wednesday, as United Parcel Service Inc. Cl B. UPS. - ...",www.marketwatch.com,2024-07-10 23:40:13+00:00,2024-07-11 03:14:18
731,Spare Parts Logistics Market size is set to grow by USD 24.2 billion from 2024-2028 ...,"... United Parcel Service Inc., and XPO Inc. Market Driver. Industry 4.0 ... 10 Company Landscape 11 Company Analysis 12 Appendix. About Technavio.",finance.yahoo.com,2024-07-10 22:34:50+00:00,2024-07-11 03:14:18
732,Walmart officials confirm plans to build second facility at Hawfields industrial park,"Walmart corporate officials confirmed Wednesday that the company ... Ralph Scott Parkway; and United Parcel Service also has 788,850 square feet of ...",alamancenews.com,2024-07-11 06:12:22+00:00,2024-07-11 08:14:23
733,"United Parcel Service Inc. Cl B stock rises Wednesday, still underperforms market","Shares of United Parcel Service Inc. Cl B rallied 1.02% to $135.65 Wednesday, on what proved to be an all-around favorable trading session for the ...",www.marketwatch.com,2024-07-10 23:18:30+00:00,2024-07-11 08:14:23
734,"United Parcel Service Inc. Cl B stock rises Wednesday, still underperforms market","United Parcel Service Inc. Cl B closed $57.33 below its 52-week high ($192.98), which the company reached on July 25th.",www.marketwatch.com,2024-07-10 23:18:27+00:00,2024-07-11 08:14:23
735,Double-Digit EPS Growth Ahead? Key Stocks to Watch This Q2 Earnings Season,"Company News- Analysis. Analysis. Market Overview- Currencies- Stock ... United Parcel Service (NYSE:UPS), Lockheed Martin (NYSE:LMT), and Deere ...",www.investing.com,2024-07-10 21:22:31+00:00,2024-07-11 08:14:23
736,Blain's Farm &amp; Fleet Improves Customer Experience and Sales with Roadie Same-Day Delivery,"United Parcel Service. Blain's Farm & Fleet Improves Customer Experience ... Roadie, a UPS company, is a logistics management and crowdsourced delivery ...",www.placera.se,2024-07-11 13:10:33+00:00,2024-07-11 15:14:24
737,Blain's Farm &amp; Fleet Improves Customer Experience and Sales with Roadie Same-Day Delivery,"Blain's Farm & Fleet has partnered with Roadie, a UPS company, to offer same-day delivery services. ... United Parcel Service, Inc. NYSE:UPS. UPS ...",www.stocktitan.net,2024-07-11 13:07:49+00:00,2024-07-11 15:14:24
738,5 Iowa Retail Stores Where You Can Still Write a Check,"Chiquita began as a banana brand of United Fruit Co., founded in 1899. ... It changed its name to UPS from United Parcel Service in 2003. The ...",khak.com,2024-07-11 11:50:38+00:00,2024-07-11 15:14:24
739,"Logistics 4.0 Market Size &amp; Share, Forecasts Report 2024-2032",Logistics 4.0 Market Companies- DHL Supply Chain- Kuehne + Nagel- XPO Logistics- C.H. Robinson- FedEx Corporation- United Parcel Service (UPS)- DB ...,www.gminsights.com,2024-07-11 11:17:40+00:00,2024-07-11 15:14:24
740,Realizing RFID's Full Potential in the Supply Chain,"With increased visibility into the supply chain via RFID technology, comes a better understanding of company ... United Parcel Service (UPS). June 28, ...",www.sdcexec.com,2024-07-11 10:01:18+00:00,2024-07-11 15:14:24
741,10 Best Value Stocks to Buy for the Long Term | Morningstar,"Pfizer Inc, 28.35 USD, 2.27, Rating. Polaris Inc, 74.25 USD, 0.81, Rating. The Toronto-Dominion Bank, 76.00 CAD, -0.24, Rating. United Parcel Service ...",www.morningstar.ca,2024-07-11 09:46:43+00:00,2024-07-11 15:14:24
742,"Goodyear, Smart Global rise; LegalZoom falls, Wednesday, 7/10/2024 - SFGATE","Taiwan Semiconductor Manufacturing Co., up $6.53 to $191.05. The chipmaker reported a jump in June revenue from a year ago. United Parcel Service Inc.",www.sfgate.com,2024-07-11 04:20:57+00:00,2024-07-11 15:14:24
743,Air Cargo and Freight Logistics Market Growing with a Surprising - openPR.com,"... United Parcel Service Inc., Expeditors International, DB Schenker, Korean Airlines, Cargolux Airlines International S.A, Cathay Pacific Airways ...",www.openpr.com,2024-07-10 22:38:08+00:00,2024-07-11 15:14:24
744,Amazon Labor Union Votes to Affiliate with Teamsters Union - Random Lengths News,"David Levin, staff director for Teamsters for a Democratic Union, a reform group within the union that helped mobilize United Parcel Service ...",www.randomlengthsnews.com,2024-07-11 16:31:40+00:00,2024-07-11 17:14:26
745,Cigo Tracker's Sprinter Tracking Solutions | Supply &amp; Demand Chain Executive,"United Parcel Service (UPS). June 28, 2024. Wisc Forum Logo Resized For ... UPS to Sell Coyote Logistics to RXO, Inc. This acquisition will ...",www.sdcexec.com,2024-07-11 16:03:06+00:00,2024-07-11 17:14:26
746,"BUZZ-U.S. STOCKS ON THE MOVE- Twitter, New York Times, F5 Networks | Reuters",... United Parcel Service Inc: down 4.3 pct at $107.41 UPDATE 1-U.S. ecommerce deliveries lift UPS quarterly profit ** Procter & Gamble Co: up 1.3 pct ...,www.reuters.com,2024-07-11 13:35:06+00:00,2024-07-11 18:14:27
747,"Product Recalls Issued Nationwide on July 11, 2024, Highlighting Consumer Safety Concerns","Raymond worked for a number of years in construction and then went on to the United Parcel Service, where he worked for 25 years until he retired.",fcfreepresspa.com,2024-07-11 18:19:17+00:00,2024-07-11 19:14:11
748,Expeditors International of Washington : EU to Allow Electronic ATR Movement Certificates,... Company- Financials- Consensus- Revisions- ETFs- Summary All News Analyst ... UNITED PARCEL SERVICE INC. Stock United Parcel Service Inc. -13.73 ...,www.marketscreener.com,2024-07-11 12:10:34+00:00,2024-07-11 19:14:11
749,14 Hospitalized After Acid Leak at Franklin County Facility,"... company outside the Letterkenny Army Depot. ... Raymond worked for a number of years in construction and then went on to the United Parcel Service, ...",fcfreepresspa.com,2024-07-11 19:12:59+00:00,2024-07-11 20:14:25
750,Data Breach Alert for Maryland Residents - Franklin County Free Press,"Clay lives in Little Cove and has been with the company. 14 Hospitalized ... United Parcel Service, where he worked for 25 years until he retired.",fcfreepresspa.com,2024-07-11 19:54:54+00:00,2024-07-11 21:14:17
751,"Drone Delivery System Market to Grow at 14.4% CAGR, Valued at US$ - openPR.com","Drone delivery firms such as United Parcel Service of America (UPS), Zipline, and others are propelling the market expansion with their robust ...",www.openpr.com,2024-07-11 19:49:58+00:00,2024-07-11 21:14:17
752,"The Healthcare Logistics Market to Hit $290.73 Billion by 2029, Driven by High Adoption of ...",United Parcel Service (UPS). AWL. Alloga. Bollore Logistics. Cardinal ... Company Name:Arizton Advisory & Intelligence Contact Person: Jessica,www.theglobeandmail.com,2024-07-11 19:43:25+00:00,2024-07-11 21:14:17
753,"Goodyear, Smart Global rise; LegalZoom falls, Wednesday, 7/10/2024 - MSN","United Parcel Service Inc., up $1.37 to $135.65. The package delivery service named Brian Dykes as its new chief financial officer. Chipotle Mexican ...",www.msn.com,2024-07-11 01:22:37+00:00,2024-07-11 21:14:17
754,"Why the Market Dipped But Trip.com (TCOM) Gained Today - July 11, 2024 - Zacks",The the stock of travel services company has fallen by 3.53% in ... Up Next. United Parcel Service (UPS) Rises As Market Takes a Dip: Key Facts ...,www.zacks.com,2024-07-11 21:32:33+00:00,2024-07-11 22:14:10
755,The Teamster President's Trumpian Tilt - The American Prospect,... service of building a powerful union that genuinely bettered members ... United Parcel Service that the company agreed to a historically good ...,prospect.org,2024-07-11 21:14:50+00:00,2024-07-11 22:14:10
756,"DAVENPORT &amp; Co LLC Sells 565,205 Shares of United Parcel Service, Inc. (NYSE:UPS)","DAVENPORT & Co LLC cut its position in United Parcel Service, Inc. (NYSE:UPS - Free Report) by 83.2% during the 1st quarter, according to the ...",www.marketbeat.com,2024-07-11 21:07:26+00:00,2024-07-11 22:14:10
757,"E-Commerce Logistics Market Growth Outlook, Economic - openPR.com","... United Parcel Service, Inc., FedEx Corporation Detailed Segmentation By Service Type • Transportation • Warehousing By Operational Area",www.openpr.com,2024-07-11 18:56:11+00:00,2024-07-11 22:14:10
758,2 High Yield Dividend Stocks For Income: One Yields More Than 5%,"Return on Equity &gt; 5%. From this pre-selection, I have selected the following high dividend yield companies: United Parcel Service, Inc. (UPS).",seekingalpha.com,2024-07-11 22:19:14+00:00,2024-07-11 23:14:24
759,"The Healthcare Logistics Market to Hit $290.73 Billion by 2029, - PANHANDLE",United Parcel Service (UPS). AWL. Alloga. Bollore Logistics. Cardinal ... Company Name: Arizton Advisory & Intelligence Contact Person: Jessica,panhandle.newschannelnebraska.com,2024-07-11 22:04:46+00:00,2024-07-11 23:14:24
760,Form 424B2 ROYAL BANK OF CANADA - StreetInsider,"(“DAL”) and the Class B common stock of United Parcel Service, Inc. (“UPS”). Each offering is linked to a single Underlying. Coupon Payment: We will ...",www.streetinsider.com,2024-07-11 21:33:32+00:00,2024-07-11 23:14:24
761,United Parcel Service (NYSE:UPS) Trading 1.6% Higher - MarketBeat,"Several equities analysts have commented on the company. Wells Fargo & Company started coverage on United Parcel Service in a report on Friday, June ...",www.marketbeat.com,2024-07-11 22:42:25+00:00,2024-07-12 00:14:24
762,Expeditors International of Washington : DHS Publishes UFLPA Strategy with a Focus on ...,"... Inc. -3.47%, 17.03B. UNITED PARCEL SERVICE INC. Stock United Parcel Service Inc. -12.08%, 116B. FEDEX CORPORATION- Stock FedEx Corporation. +18.41% ...",www.marketscreener.com,2024-07-12 00:09:36+00:00,2024-07-12 02:14:27
763,United Parcel Service (UPS) Rises As Market Takes a Dip: Key Facts - Yahoo Finance,"The PEG ratio bears resemblance to the frequently used P/E ratio, but this parameter also includes the company's expected earnings growth trajectory.",finance.yahoo.com,2024-07-12 00:04:29+00:00,2024-07-12 02:14:27
764,Fortinet (FTNT) Falls More Steeply Than Broader Market: What Investors Need to Know,United Parcel Service (UPS) Rises As Market Takes a Dip: Key Facts. Most ... Each of the company logos represented herein are trademarks of Microsoft ...,www.zacks.com,2024-07-12 02:59:53+00:00,2024-07-12 05:14:26
765,Raymond L. Wingert Obituary - Chambersburg Public Opinion,"He worked for a number of years in construction and then went on to the United Parcel Service, where he worked for 25 years until he retired.",www.publicopiniononline.com,2024-07-12 02:17:14+00:00,2024-07-12 05:14:26
766,FedEx Corp. stock outperforms competitors on strong trading day - MarketWatch,"... company reached on June 28th. The stock outperformed some of its competitors Thursday, as United Parcel Service Inc. Cl B UPS rose 1.91% to $138.24.",www.marketwatch.com,2024-07-12 01:17:13+00:00,2024-07-12 05:14:26
767,"United Parcel Service Inc. Cl B stock rises Thursday, outperforms market - MarketWatch","Shares of United Parcel Service Inc. Cl B rose 1.91% to $138.24 Thursday, on what proved to be an all-around mixed trading session for the stock ...",www.marketwatch.com,2024-07-12 00:54:40+00:00,2024-07-12 05:14:26
768,Blain's Farm &amp; Fleet Improves Customer Experience and Sales with Roadie Same-Day Delivery,"Company Announcements. United Parcel Service Inc. Blain's Farm & Fleet ... Roadie, a UPS company, is a logistics management and crowdsourced delivery ...",markets.ft.com,2024-07-11 23:57:34+00:00,2024-07-12 05:14:26
769,Last-Mile Delivery Market to Witness Huge Growth by 2031 - - openPR.com,"... Inc., United Parcel Service of America, Inc., FedEx, DHL International GmbH, Contrary Research ... Company Name: DataM Intelligence Contact ...",www.openpr.com,2024-07-12 08:44:47+00:00,2024-07-12 11:14:18
770,Jet Freight Logistics Limited Announces Appointment of Anmol Ashvin Patni as Company Secretary,"UNITED PARCEL SERVICE INC. Stock United Parcel Service Inc. -12.08%, 116B. FEDEX CORPORATION- Stock FedEx Corporation. +18.41%, 72.17B. DHL GROUP ...",www.marketscreener.com,2024-07-12 02:16:46+00:00,2024-07-12 11:14:18
771,WillScot Mobile Mini Holdings (WSC) Gets a Buy from Oppenheimer | Markets Insider,"Schneeberger covers the Industrials sector, focusing on stocks such as WillScot Mobile Mini Holdings, Pool, and United Parcel. The word on The ...",markets.businessinsider.com,2024-07-11 23:35:47+00:00,2024-07-12 11:14:18
772,"Louisville Fabletics warehouse facility to close, layoff nearly 70 employees",... United Parcel Service Inc. Worldport hub and CSX. Fabletics. Piper ... No details are listed in the notice about what the separation package includes ...,www.bizjournals.com,2024-07-12 11:02:15+00:00,2024-07-12 12:14:18
773,6 Top Undervalued Stocks To Buy In August 2024 - Forbes,"This does not clear the path for the pharma company, but it eliminates one roadblock. ... United Parcel Service (UPS). Stock price: $135.83; PEG: 1.79 ...",www.forbes.com,2024-07-12 15:01:56+00:00,2024-07-12 16:14:28
774,"Express Delivery Global Market 2024 - By Size, Drivers, Trends, - openPR.com","... Parcel Service Inc., FedEx Corporation, United States Postal Service, Shanghai YTO Express Co. Ltd., La Poste Group, SF Holding Co. Ltd., DSV ...",www.openpr.com,2024-07-12 11:45:18+00:00,2024-07-12 16:14:28
775,Due to postal law reform: DHL changes parcel offer - MarketScreener,"UNITED PARCEL SERVICE INC. Stock United Parcel Service Inc. -12.08%, 118B. FEDEX CORPORATION- Stock FedEx Corporation. +18.41%, 73.71B. EXPEDITORS ...",www.marketscreener.com,2024-07-12 10:38:45+00:00,2024-07-12 16:14:28
776,"Advisory Services Network LLC Buys 10,235 Shares of United Parcel Service, Inc. (NYSE:UPS)","Advisory Services Network LLC lifted its holdings in shares of United Parcel Service, Inc. (NYSE:UPS - Free Report) by 27.9% during the 1st ...",www.marketbeat.com,2024-07-12 16:15:17+00:00,2024-07-12 18:14:21
777,Procter &amp; Gamble 5-Year Buy-And-Hold Turned $10K Into This,"... Company (NYSE: PG) and decided upon a five year investment time horizon ... Had You Purchased United Parcel Service in 2014, Here's Your Result ...",mmjstockwatch.com,2024-07-12 05:38:05+00:00,2024-07-12 18:14:21
778,"Synchronoss (SNCR) Rises As Market Takes a Dip: Key Facts - July 11, 2024 - Zacks",The the stock of mobile services company ... Past performance is no guarantee of future results. Up Next. United Parcel Service (UPS) Rises As Market ...,www.zacks.com,2024-07-11 22:00:56+00:00,2024-07-12 19:14:28
779,Calif. Forecast: Language Co. Could Pay $4M In Wage Deal - Law360,"United Parcel Service, Inc. et al. Case Number. 5:23-cv-06044. Court. California Northern. Nature of Suit. Labor: Other. Date Filed. November 21, 2023 ...",www.law360.com,2024-07-12 18:50:05+00:00,2024-07-12 20:14:35
780,United Parcel Service (NYSE:UPS) Shares Up 1.4% - MarketBeat,"The company traded as high as $140.16 and last traded at $140.15. 334,994 shares changed hands during mid-day trading, a decline of 92% from the ...",www.marketbeat.com,2024-07-12 20:09:29+00:00,2024-07-12 21:14:24
781,"Emerson Electric, Honeywell and Parker-Hannifin favored ahead of Q2 season - Quant picks","Behemoths like Boeing (BA), Lockheed Martin (LMT), United Parcel Service (UPS), 3M (MMM), and American Airlines Group (AAL) were rated Hold, while ...",seekingalpha.com,2024-07-12 20:59:39+00:00,2024-07-12 22:14:30
782,"Freight and Logistics Market Report 2024: Growth, Trends, Analysis, Forecast 2033","Major companies operating in the freight and logistics market report are United Parcel Service Inc., DHL International GmbH, Deutsche Post AG ...",www.openpr.com,2024-07-12 22:39:26+00:00,2024-07-13 00:14:18
783,"United Parcel Service (UPS) Rises As Market Takes a Dip: Key Facts - July 11, 2024 - Zacks",United Parcel Service (UPS) closed the most recent ... Each of the company logos represented herein are trademarks of Microsoft Corporation ...,www.zacks.com,2024-07-12 01:33:23+00:00,2024-07-13 00:14:18
784,"Twilio (TWLO) Gains As Market Dips: What You Should Know - July 11, 2024 - Zacks.com",Up Next. United Parcel Service (UPS) Rises As Market Takes a Dip: Key Facts ... Each of the company logos represented herein are trademarks of Microsoft ...,www.zacks.com,2024-07-12 03:07:15+00:00,2024-07-13 02:14:14
785,"United Parcel Service Inc. Cl B stock rises Friday, outperforms market - MarketWatch","Shares of United Parcel Service Inc. Cl B rose 2.97% to $142.35 Friday, on what proved to be an all-around positive trading session for the stock ...",www.marketwatch.com,2024-07-13 00:19:57+00:00,2024-07-13 04:14:29
786,Cipher Mining Inc. (CIFR) Sees a More Significant Dip Than Broader Market: Some Facts to Know,Past performance is no guarantee of future results. Up Next. United Parcel Service (UPS) Rises As Market Takes a Dip: Key Facts. Most Read ...,www.zacks.com,2024-07-11 22:08:58+00:00,2024-07-13 05:14:20
787,Expeditors International of Washington : United States and Mexico Announce Plan to ...,"... Inc. -5.71%, 17.34B. UNITED PARCEL SERVICE INC. Stock United Parcel Service Inc. -9.46%, 118B. FEDEX CORPORATION- Stock FedEx Corporation. +18.20% ...",www.marketscreener.com,2024-07-13 00:05:34+00:00,2024-07-13 06:14:13
788,Cold Chain Market Is Estimated To Grow At A CAGR Of 8.6% Over The Forecast Period As ...,"XPO Logistics Inc. 16.Wabash National Corporation 17.NewCold 18.Sonoco ThermoSafe (Sonoco Products Company) 19.United Parcel Service of America, Inc",www.whatech.com,2024-07-12 17:19:06+00:00,2024-07-13 07:14:30
789,United Parcel Service: Good Risk/Reward In The Long Run - Seeking Alpha,The company's financials show declining top-line growth but stable margins and good efficiency and profitability metrics.,seekingalpha.com,2024-07-13 12:50:57+00:00,2024-07-13 14:14:14
