,Heading,Subheading,Publisher,Published,Found
0,Core &amp; Main Earnings: What To Look For From CNM - The Globe and Mail,"Watsco posted flat year-on-year revenue, missing analysts' expectations ... The Financing represents an opportunity for the Company to bolster its ...",www.theglobeandmail.com,2024-06-18 07:02:42,2024-06-18 15:23:55
1,"Creekmur Asset Management LLC Makes New $32,000 Investment in Invesco NASDAQ ...","... company in its most recent disclosure with the Securities and Exchange Commission. ... Wellington Management Group LLP Sells 12,704 Shares of Watsco, ...",www.defenseworld.net,2024-06-18 04:42:49,2024-06-18 15:23:55
2,"Virtu Financial LLC Purchases New Holdings in Watsco, Inc. (NYSE:WSO) - MarketBeat","Institutional investors and hedge funds own 89.71% of the company's stock. Insider Activity at Watsco. In related news, EVP Barry S. Logan sold 774 ...",www.marketbeat.com,2024-06-17 19:25:46,2024-06-18 15:23:55
3,Watsco (NYSE:WSO.B) Sets New 1-Year High at $473.32 - MarketBeat,"Watsco Increases Dividend. The company also recently announced a quarterly dividend, which was paid on Tuesday, April 30th. Shareholders of record on ...",www.marketbeat.com,2024-06-17 18:47:07,2024-06-18 15:23:55
4,Watsco (NYSE:WSO) Hits New 12-Month High at $493.65 - MarketBeat,Insiders own 12.86% of the company's stock. Institutional Investors Weigh In On Watsco. A number of hedge funds and other institutional investors have ...,www.marketbeat.com,2024-06-18 18:38:31,2024-06-19 13:30:36
5,Watsco (NYSE:WSO.B) Shares Gap Up to $424.75 | MarketBeat,"Watsco Stock Performance. The firm has a market cap of $17.94 billion, a PE ratio of 34.24 and a beta of 0.57. The company has a current ratio of ...",www.marketbeat.com,2024-06-18 17:40:44,2024-06-19 13:30:36
6,Watsco (NYSE:WSO) Hits New 12-Month High at $493.65 - MarketBeat,Insiders own 12.86% of the company's stock. Institutional Investors Weigh In On Watsco. A number of hedge funds and other institutional investors have ...,www.marketbeat.com,2024-06-18 23:38:31+00:00,2024-06-19 17:13:56
7,Watsco (NYSE:WSO.B) Shares Gap Up to $424.75 | MarketBeat,"Watsco Stock Performance. The firm has a market cap of $17.94 billion, a PE ratio of 34.24 and a beta of 0.57. The company has a current ratio of ...",www.marketbeat.com,2024-06-18 22:40:44+00:00,2024-06-19 17:13:56
8,"Watsco, Inc.'s (NYSE:WSO) Stock Is Going Strong: Is the Market Following Fundamentals?","Particularly, we will be paying attention to Watsco's ROE today. Return on equity or ROE is a key measure used to assess how efficiently a company's ...",simplywall.st,2024-06-21 06:08:00+00:00,2024-06-21 09:13:58
9,"B. Riley Wealth Advisors Inc. Sells 600 Shares of Watsco, Inc. (NYSE:WSO) - Defense World","Franklin Resources Inc. now owns 44,737 shares of the construction company's stock worth $19,168,000 after buying an additional 1,650 shares in the ...",www.defenseworld.net,2024-06-20 16:37:58+00:00,2024-06-21 09:13:58
10,Watsco (NYSE:WSO.B) Shares Gap Up to $424.75 - Defense World,"The business had revenue of $1.56 billion during the quarter. Watsco Increases Dividend. The company also recently declared a quarterly dividend, ...",www.defenseworld.net,2024-06-20 16:25:51+00:00,2024-06-21 09:13:58
11,Watsco Inc. Inc. (WSO) Price Performance: A Fundamental Analysis Perspective,"Watsco Inc. experienced a somewhat steady performance in the stock market. The company's stock reached a 1-year high of $491.90 on 06/18/24, while ...",investchronicle.com,2024-06-20 00:29:58+00:00,2024-06-21 09:13:58
12,Here's How Much $100 Invested In Watsco 5 Years Ago Would Be Worth Today,Company News- Analysis. Analysis. Market Overview- Currencies- Stock Markets ... Watsco (NYSE:WSO) has outperformed the market over the past 5 years ...,uk.investing.com,2024-06-22 01:25:56+00:00,2024-06-22 09:13:53
13,"American National Bank Buys 2,169 Shares of Watsco, Inc. (NYSE:WSO) - MarketBeat","CWM LLC now owns 957 shares of the construction company's stock valued at $413,000 after buying an additional 265 shares during the last quarter.",www.marketbeat.com,2024-06-21 21:42:52+00:00,2024-06-22 09:13:53
14,"Running Oak Capital LLC Acquires 2,737 Shares of Watsco, Inc. (NYSE:WSO) - MarketBeat","The fund owned 25,915 shares of the construction company's stock after purchasing an additional 2,737 shares during the quarter. Watsco makes up ...",www.marketbeat.com,2024-06-23 02:51:59+00:00,2024-06-23 09:13:54
15,"Mather Group LLC. Invests $114,000 in Watsco, Inc. (NYSE:WSO) - Defense World","The institutional investor purchased 266 shares of the construction company's stock, valued at approximately $114,000. Get Watsco alerts: A number of ...",www.defenseworld.net,2024-06-22 22:29:18+00:00,2024-06-23 09:13:54
16,"Cwm LLC Has $413,000 Position in Watsco, Inc. (NYSE:WSO) - Defense World",The firm owned 957 shares of the construction company's stock after buying an additional 265 shares during the period. Cwm LLC's holdings in Watsco ...,www.defenseworld.net,2024-06-22 10:00:31+00:00,2024-06-23 09:13:54
17,Global Building Material and Garden Equipment and Supplies Dealers Market - openPR.com,"... Watsco Inc., GMS Inc., L&W Supply Corporation, US LBM Holdings Inc ... LinkedIn: https://in.linkedin.com/company/the-business-research-company",www.openpr.com,2024-06-24 04:29:24+00:00,2024-06-24 09:13:53
18,"HighPoint Advisor Group LLC Buys Shares of 467 Watsco, Inc. (NYSE:WSO)","The fund acquired 467 shares of the construction company's stock, valued at approximately $201,000. Get Watsco alerts: Other hedge funds also recently ...",www.defenseworld.net,2024-06-23 13:40:29+00:00,2024-06-24 09:13:53
19,"107 Shares in Watsco, Inc. (NYSE:WSO) Purchased by Opal Wealth Advisors LLC","Hartford Financial Management Inc. now owns 75 shares of the construction company's stock worth $32,000 after purchasing an additional 26 shares in ...",www.defenseworld.net,2024-06-25 01:46:39+00:00,2024-06-25 09:14:01
20,Watsco (NYSE:WSO.B) Sets New 12-Month High at $445.15 - MarketBeat,"The firm had revenue of $1.56 billion during the quarter. Watsco Increases Dividend. The business also recently announced a quarterly dividend, which ...",www.marketbeat.com,2024-06-24 23:44:29+00:00,2024-06-25 09:14:01
21,"Lloyd Advisory Services LLC. Has $1.15 Million Stake in Watsco, Inc. (NYSE:WSO)","The institutional investor owned 2,655 shares of the construction company's stock after buying an additional 2,181 shares during the quarter. Lloyd ...",www.marketbeat.com,2024-06-24 19:06:44+00:00,2024-06-25 09:14:01
22,"Watsco, Inc. (NYSE:WSO) Given Consensus Recommendation of &quot;Hold&quot; by Brokerages","In other news, Director John Alexander Macdonald sold 5,334 shares of the company's stock in a transaction on Thursday, May 9th. The stock was sold at ...",www.marketbeat.com,2024-06-26 06:55:42+00:00,2024-06-26 09:13:52
23,"Comfort Systems (FIX) Up 56% YTD: Should You Buy Now? - June 26, 2024 - Zacks.com","Watsco, Inc. ( WSO Quick Quote WSO - Free Report) , AAON ... Each of the company logos represented herein are trademarks of Microsoft Corporation ...",www.zacks.com,2024-06-26 16:01:55+00:00,2024-06-26 19:14:00
24,"Watsco, Inc. (NYSE:WSO) Given Consensus Rating of “Hold” by Analysts - Defense World",... company. The average 1-year price target among brokerages that have issued ratings on the stock in the last year is $404.25. Get Watsco alerts: A ...,www.defenseworld.net,2024-06-26 05:42:59+00:00,2024-06-26 19:14:00
25,Comfort Systems (FIX) Up 56% YTD: Should You Buy Now? - Yahoo Finance,"... companies including Watsco, Inc. WSO, AAON, Inc. AAON, and EMCOR Group ... Given the positive business outlook, valuation, and impressive performance of ...",finance.yahoo.com,2024-06-26 18:18:35+00:00,2024-06-27 04:13:55
26,Watsco (NYSE:WSO.B) Shares Gap Up to $424.75 | MarketBeat,"The business had revenue of $1.56 billion for the quarter. Watsco Increases Dividend. The firm also recently declared a quarterly dividend, which was ...",www.marketbeat.com,2024-06-27 16:56:46+00:00,2024-06-27 21:13:55
27,"Watsco, Inc. (NYSE:WSO) Shares Acquired by Park Avenue Securities LLC - Defense World","The firm owned 1,784 shares of the construction company's stock after purchasing an additional 36 shares during the period. Park Avenue Securities ...",www.defenseworld.net,2024-06-27 15:53:14+00:00,2024-06-27 21:13:55
28,Comfort Systems (FIX) Up 56% YTD: Should You Buy Now?,"... companies including Watsco, Inc. WSO, AAON, Inc. AAON, and EMCOR Group, Inc. EME, whose shares gained 8.9%, 14.3%, and 75.7%, respectively. This ...",www.msn.com,2024-06-27 10:11:37+00:00,2024-06-27 21:13:55
29,"Watsco, Inc. (NYSE:WSO) Stake Raised by Wealth Enhancement Advisory Services LLC","Hartford Financial Management Inc. now owns 75 shares of the construction company's stock valued at $32,000 after purchasing an additional 26 shares ...",www.marketbeat.com,2024-06-30 09:24:01+00:00,2024-06-30 12:13:57
30,Watsco (NYSE:WSO.B) Shares Gap Up to $424.75 - Defense World,"Watsco Increases Dividend. The firm also recently declared a quarterly dividend, which was paid on Tuesday, April 30th. Investors of record on Monday, ...",www.defenseworld.net,2024-06-30 04:35:31+00:00,2024-06-30 12:13:57
31,"Watsco, Inc. (NYSE:WSO) Stake Raised by Wealth Enhancement Advisory Services LLC","The institutional investor owned 22,852 shares of the construction company's stock after buying an additional 2,433 shares during the quarter. Wealth ...",www.defenseworld.net,2024-06-30 16:05:21+00:00,2024-06-30 21:13:57
32,"Hennion &amp; Walsh Asset Management Inc. Sells 577 Shares of Watsco, Inc. (NYSE:WSO)",Get Watsco alerts: Other institutional investors and hedge funds have also recently modified their holdings of the company. Wetzel Investment Advisors ...,www.defenseworld.net,2024-06-30 12:13:31+00:00,2024-06-30 21:13:57
33,Watsco Declares $2.70 Quarterly Dividend - Morningstar,Watsco has paid dividends to shareholders for 50 consecutive years. The Company's philosophy is to share cash flow through dividends while maintaining ...,www.morningstar.com,2024-07-01 11:42:23+00:00,2024-07-01 16:14:10
34,Ambac Financial Group And 5 Other Stocks Have High Sales Growth And An Above 3 ...,... Company (ERIE) are the highest sales ... Companies Sales Growth SFM Sprouts Farmers Market Stock Stock Analysis Uber Wall Street Watsco WSO ...,via.news,2024-07-01 03:25:52+00:00,2024-07-01 16:14:10
35,Cl B Com/Watsco Inc. (NYSE: WSO__B) on 07-01-2024 declared a dividend of $2.7000 per share,"The products Co. distributes consist of: equipment, including residential ducted and ductless air conditioners, gas, electric, and oil furnaces, ...",www.dividendinvestor.com,2024-07-01 20:41:25+00:00,2024-07-02 00:14:03
36,Watsco announces quarterly dividend of $2.70 per share - Investing.com,"... company announced today. This continues Watsco's long-standing tradition of dividend payments, marking the 50th consecutive year of dividends to ...",www.investing.com,2024-07-01 20:05:52+00:00,2024-07-02 00:14:03
37,"How Do Analysts See Watsco, Inc. (NYSE:WSO) Performing Over The Next Year?","... company. For those interested in more of an analysis of the company, you can research its fundamentals here. Check out our latest analysis for Watsco ...",uk.style.yahoo.com,2024-07-01 16:12:26+00:00,2024-07-02 00:14:03
38,"Watsco, Inc. (NYSE:WSO) Position Cut by Compass Ion Advisors LLC - Defense World","Following the sale, the executive vice president now owns 1,770 shares of the company's stock, valued at $838,714.50. The disclosure for this sale can ...",www.defenseworld.net,2024-07-02 16:13:25+00:00,2024-07-02 18:14:09
39,Miami climate tech hub get $19.5 million in federal funding,"... Watsco, a Miami company that distributes energy efficient HVAC systems that is partnering with the CLEO Institute, a grassroots advocacy group ...",www.miamiherald.com,2024-07-02 16:07:45+00:00,2024-07-02 18:14:09
40,Watsco Inc (NYSE:WSO.B) to Issue Quarterly Dividend of $2.70 - MarketBeat,The construction company reported $2.17 earnings per share for the quarter. The firm had revenue of $1.56 billion for the quarter. Watsco had a net ...,www.marketbeat.com,2024-07-02 13:01:37+00:00,2024-07-02 18:14:09
41,"Watsco, Inc. (NYSE:WSO) to Issue $2.70 Quarterly Dividend - Defense World","Equities analysts expect Watsco to earn $16.10 per share next year, which means the company should continue to be able to cover its $10.80 annual ...",www.defenseworld.net,2024-07-02 12:35:10+00:00,2024-07-02 18:14:09
42,Holocaust Museum L.A. launches new augmented-reality app with an assist from Hollywood,"Watsco, a local HVAC distributor, is a member of the SouthFlorida ... company that distributes energy efficient HVAC systems that is ...",www.aol.com,2024-07-02 11:20:00+00:00,2024-07-02 18:14:09
43,"Recent Dividend Hikes And Strong Yields: Timken, Watsco, And AFLAC in Focus","This piece discusses three companies — Timken, Watsco, and AFLAC — that recently hiked their dividends and offer solid yields. The Timken. The Timken ...",finance.yahoo.com,2024-07-03 08:56:47+00:00,2024-07-03 13:15:03
44,WSO Quantitative Stock Analysis - Nasdaq,WATSCO INC (WSO) is a large-cap growth stock in the Misc. Capital Goods industry. The rating using this strategy is 81% based on the firm's ...,www.nasdaq.com,2024-07-02 18:26:08+00:00,2024-07-03 13:15:03
45,"LVW Advisors LLC Has $662000 Stock Position in Watsco, Inc. (NYSE:WSO)","Hartford Financial Management Inc. now owns 75 shares of the construction company's stock valued at $32,000 after buying an additional 26 shares in ...",www.defenseworld.net,2024-07-02 15:34:36+00:00,2024-07-03 13:15:03
46,"State of Michigan Retirement System Decreases Holdings in Watsco, Inc. (NYSE:WSO)","LPL Financial LLC now owns 14,848 shares of the construction company's stock valued at $5,609,000 after acquiring an additional 1,390 shares during ...",www.defenseworld.net,2024-07-03 18:30:58+00:00,2024-07-03 21:14:36
47,"Allspring Global Investments Holdings LLC Sells 5,618 Shares of Watsco, Inc. (NYSE:WSO)","In other Watsco news, Director John Alexander Macdonald sold 5,334 shares of the company's stock in a transaction that occurred on Thursday, May 9th.",www.marketbeat.com,2024-07-03 14:52:43+00:00,2024-07-03 21:14:36
48,"Allspring Global Investments Holdings LLC Sells 5618 Shares of Watsco, Inc. (NYSE:WSO)",Hedge funds and other institutional investors own 89.71% of the company's stock. Wall Street Analyst Weigh In. A number of analysts have recently ...,www.defenseworld.net,2024-07-03 10:10:28+00:00,2024-07-03 21:14:36
49,"Handelsinvest Investeringsforvaltning Has $407000 Stock Holdings in Watsco, Inc. (NYSE:WSO)","Raleigh Capital Management Inc. now owns 108 shares of the construction company's stock worth $41,000 after acquiring an additional 28 shares in the ...",www.defenseworld.net,2024-07-04 16:12:26+00:00,2024-07-04 21:14:56
50,"Norden Group LLC Purchases 31,621 Shares of Watsco, Inc. (NYSE:WSO) - MarketBeat","Advisors Asset Management Inc. now owns 16,906 shares of the construction company's stock worth $6,386,000 after purchasing an additional 1,092 shares ...",www.marketbeat.com,2024-07-04 13:41:55+00:00,2024-07-04 21:14:56
51,Comfort Systems USA Surges 52% YTD: What's Next for FIX? | Markets Insider,"The company is also trading currently at a discount compared to other industry players like Watsco, Inc. (NYSE:WSO) and AAON, Inc. (NASDAQ:AAON) but ...",markets.businessinsider.com,2024-07-05 19:18:13+00:00,2024-07-05 21:14:41
52,"Diversify Advisory Services LLC Makes New $822,000 Investment in Watsco, Inc. (NYSE:WSO)","The institutional investor purchased 1,894 shares of the construction company's stock, valued at approximately $822,000. Get Watsco alerts: Sign ...",www.marketbeat.com,2024-07-07 12:03:30+00:00,2024-07-07 13:14:36
53,"Van ECK Associates Corp Grows Position in Watsco, Inc. (NYSE:WSO) - Defense World","Shaker Investments LLC OH now owns 7,564 shares of the construction company's stock worth $3,267,000 after purchasing an additional 24 shares in the ...",www.defenseworld.net,2024-07-07 10:33:52+00:00,2024-07-07 13:14:36
54,Van ECK Associates Corp Increases Stock Holdings in Carnival Co. &amp; plc (NYSE:CCL),"Wells Fargo & Company raised their price target on Carnival Co. & ... Van ECK Associates Corp Grows Position in Watsco, Inc. (NYSE:WSO)- Van ...",www.defenseworld.net,2024-07-07 10:32:02+00:00,2024-07-07 13:14:36
55,Watsco: Overoptimistic Margin Expectations (NYSE:WSO) | Seeking Alpha,"Business Model. On the surface, Watsco's business model is quite simple. It acts as a middleman between the HVAC manufacturers and the contractor in ...",seekingalpha.com,2024-07-07 19:31:14+00:00,2024-07-07 21:14:31
56,"Diversify Advisory Services LLC Makes New $822000 Investment in Watsco, Inc. (NYSE:WSO)","The institutional investor purchased 1,894 shares of the construction company's stock, valued at approximately $822,000. Get Watsco alerts: Other ...",www.defenseworld.net,2024-07-07 11:38:14+00:00,2024-07-07 21:14:31
57,Infrastructure Distributors Q1 Earnings: MRC Global (NYSE:MRC) Simply the Best - Yahoo Finance,"It was a very strong quarter for the company, with an impressive beat of analysts' earnings estimates. ... Originally a manufacturing company, Watsco ( ...",finance.yahoo.com,2024-07-08 12:14:04+00:00,2024-07-08 14:14:38
58,Infrastructure Distributors Q1 Earnings: MRC Global (NYSE:MRC) Simply The Best,"Watsco reported revenues of $1.56 billion, flat year on year, falling short of analysts' expectations by 2%. It was a weak quarter for the company, ...",www.barchart.com,2024-07-08 11:40:27+00:00,2024-07-08 14:14:38
59,Watsco (NYSE:WSO.B) Sets New 12-Month High at $445.15 - Defense World,The stock had previously closed at $424.75. Get Watsco alerts: Watsco Price Performance. The company's 50-day simple moving average ...,www.defenseworld.net,2024-07-08 14:20:21+00:00,2024-07-08 21:14:57
60,"Norden Group LLC Buys 330 Shares of Watsco, Inc. (NYSE:WSO) - Defense World",boosted its stake in Watsco by 53.1% during the fourth quarter. Hartford Financial Management Inc. now owns 75 shares of the construction company's ...,www.defenseworld.net,2024-07-08 10:21:04+00:00,2024-07-08 21:14:57
61,"Mutual of America Capital Management LLC Sells 2,281 Shares of Watsco, Inc. (NYSE:WSO)","Shaker Investments LLC OH now owns 7,564 shares of the construction company's stock valued at $3,267,000 after acquiring an additional 24 shares ...",www.marketbeat.com,2024-07-09 03:34:34+00:00,2024-07-09 05:15:12
62,"Watsco, Inc. (NYSE:WSO) Shares Bought by Nordea Investment Management AB","BNP Paribas Financial Markets now owns 15,047 shares of the construction company's stock valued at $6,500,000 after buying an additional 3,841 shares ...",www.defenseworld.net,2024-07-09 19:30:10+00:00,2024-07-09 21:15:02
63,"State of Alaska Department of Revenue Sells 260 Shares of Watsco, Inc. (NYSE:WSO)","Sumitomo Mitsui Trust Holdings Inc. now owns 71,298 shares of the construction company's stock valued at $30,799,000 after purchasing an additional ...",www.defenseworld.net,2024-07-09 15:17:05+00:00,2024-07-09 21:15:02
64,"Watsco, Inc. (NYSE:WSO) Shares Purchased by Jennison Associates LLC - MarketBeat","Shaker Investments LLC OH now owns 7,564 shares of the construction company's stock worth $3,267,000 after acquiring an additional 24 shares during ...",www.marketbeat.com,2024-07-10 01:40:20+00:00,2024-07-10 14:14:49
65,"Norden Group LLC Makes New Investment in Cohen &amp; Steers, Inc. (NYSE:CNS)","(NYSE:CNS – Free Report) in the first quarter, according to the company in its most recent Form 13F filing with the SEC. ... Watsco, Inc. (NYSE ...",www.defenseworld.net,2024-07-09 13:29:09+00:00,2024-07-10 14:14:49
66,"Daiwa Securities Group Inc. Grows Holdings in Watsco, Inc. (NYSE:WSO) - Defense World","Vanguard Group Inc. now owns 3,265,589 shares of the construction company's stock worth $1,399,207,000 after acquiring an additional 55,119 shares ...",www.defenseworld.net,2024-07-11 12:45:52+00:00,2024-07-11 14:14:55
67,"Sequoia Financial Advisors LLC Purchases Shares of 478 Watsco, Inc. (NYSE:WSO)","boosted its holdings in shares of Watsco by 6.7% in the first quarter. Cutter & CO Brokerage Inc. now owns 12,928 shares of the construction company's ...",www.defenseworld.net,2024-07-11 10:19:41+00:00,2024-07-11 14:14:55
68,Watsco (NYSE:WSO) Hits New 52-Week High at $495.73 - MarketBeat,"The company's revenue was up .9% on a year-over-year basis. On average, equities analysts anticipate that Watsco, Inc. will post 14.26 earnings per ...",www.marketbeat.com,2024-07-11 16:15:56+00:00,2024-07-11 22:14:41
69,"Texas Permanent School Fund Corp Cuts Stock Holdings in Watsco, Inc. (NYSE:WSO)","Texas Permanent School Fund Corp trimmed its holdings in shares of Watsco, Inc. (NYSE:WSO - Free Report) by 6.5% in the 1st quarter, according to ...",www.marketbeat.com,2024-07-12 14:31:40+00:00,2024-07-12 22:15:02
70,Watsco (NYSE:WSO) Hits New 12-Month High at $495.73 - Defense World,"The company has a market capitalization of $19.85 billion, a price-to-earnings ratio of 37.89 and a beta of 0.88. The firm has a 50-day moving average ...",www.defenseworld.net,2024-07-13 16:33:12+00:00,2024-07-13 22:14:58
71,"Geneos Wealth Management Inc. Lowers Stock Holdings in Watsco, Inc. (NYSE:WSO)",The fund owned 373 shares of the construction company's stock after selling 34 shares during the quarter. Geneos Wealth Management Inc.'s holdings in ...,www.defenseworld.net,2024-07-13 14:42:36+00:00,2024-07-13 22:14:58
72,"Watsco, Inc. (NYSE:WSO) Shares Sold by Oppenheimer Asset Management Inc.",Other institutional investors and hedge funds have also added to or reduced their stakes in the company. Oppenheimer & Co. Inc. raised its stake in ...,www.marketbeat.com,2024-07-13 21:01:30+00:00,2024-07-14 06:14:27
73,"Duality Advisers LP Invests $489,000 in Watsco, Inc. (NYSE:WSO) - Defense World","The institutional investor purchased 1,132 shares of the construction company's stock, valued at approximately $489,000. Get Watsco alerts:.",www.defenseworld.net,2024-07-14 16:24:49+00:00,2024-07-14 22:14:33
74,Wells Fargo &amp; Company (NYSE:WFC) Trading Down 6.6% - Defense World,"... Company and related companies with MarketBeat.com's FREE daily email newsletter. ... Duality Advisers LP Invests $489,000 in Watsco, Inc. (NYSE:WSO) ...",www.defenseworld.net,2024-07-14 10:26:33+00:00,2024-07-14 22:14:33
75,"Forsta AP Fonden Sells 12,700 Shares of Watsco, Inc. (NYSE:WSO) - Defense World","The fund owned 8,600 shares of the construction company's stock after selling 12,700 shares during the period. Forsta AP Fonden's holdings in Watsco ...",www.defenseworld.net,2024-07-15 20:08:25+00:00,2024-07-15 22:14:43
76,"Caledonia Investments - Time, well invested - QuotedData","Watsco (watsco.com) is a heating, ventilation, air conditioning, and refrigeration distribution business. It is a $22.1bn market cap listed company ...",quoteddata.com,2024-07-15 18:10:39+00:00,2024-07-15 22:14:43
77,"Empowered Funds LLC Sells 7,490 Shares of Watsco, Inc. (NYSE:WSO) - Defense World","The firm owned 4,651 shares of the construction company's stock after selling 7,490 shares during the period. Empowered Funds LLC's holdings in Watsco ...",www.defenseworld.net,2024-07-15 17:41:28+00:00,2024-07-15 22:14:43
78,"Susquehanna Portfolio Strategies LLC Sells 25,944 Shares of Watsco, Inc. (NYSE:WSO)","now owns 44,737 shares of the construction company's stock worth $19,168,000 after buying an additional 1,650 shares during the last quarter. Goldman ...",www.marketbeat.com,2024-07-15 17:16:47+00:00,2024-07-15 22:14:43
79,"William Blair Research Analysts Reduce Earnings Estimates for Watsco, Inc. (NYSE:WSO)","During the same quarter in the previous year, the business earned $2.83 EPS. Watsco Dividend Announcement. The firm also recently announced a ...",www.marketbeat.com,2024-07-15 08:48:49+00:00,2024-07-15 22:14:43
80,"Watsco, Inc.: - MarketScreener","The Company sells products to the commercial refrigeration market, which include condensing units, compressors, evaporators, valves, refrigerants, ...",www.marketscreener.com,2024-07-16 00:04:20+00:00,2024-07-16 07:14:30
81,Watsco (NYSE:WSO.B) Reaches New 1-Year High at $500.76 - MarketBeat,"Watsco Announces Dividend. The business also recently disclosed a quarterly dividend, which will be paid on Wednesday, July 31st. Investors of record ...",www.marketbeat.com,2024-07-16 00:03:37+00:00,2024-07-16 07:14:30
82,"Donoghue Forlines LLC Purchases Shares of 1,195 Watsco, Inc. (NYSE:WSO) - MarketBeat","The fund purchased 1,195 shares of the construction company's stock, valued at approximately $516,000. Get Watsco alerts: Sign Up. A number of other ...",www.marketbeat.com,2024-07-16 16:02:05+00:00,2024-07-16 22:14:21
83,"Sei Investments Co. Sells 2,379 Shares of Watsco, Inc. (NYSE:WSO) - Defense World",Get Watsco alerts: Other hedge funds and other institutional investors have also bought and sold shares of the company. Wetzel Investment Advisors Inc ...,www.defenseworld.net,2024-07-17 18:19:55+00:00,2024-07-17 22:14:39
84,"Sei Investments Co. Buys 1044 Shares of The Interpublic Group of Companies, Inc. (NYSE:IPG)","Interpublic Group of Companies Company Profile. (Free Report). The ... Sells 2,379 Shares of Watsco, Inc. (NYSE:WSO)- Sei Investments Co ...",www.defenseworld.net,2024-07-17 18:19:55+00:00,2024-07-17 22:14:39
85,"Sei Investments Co. Sells 2,379 Shares of Watsco, Inc. (NYSE:WSO) - MarketBeat","Sei Investments Co. trimmed its stake in Watsco, Inc. (NYSE:WSO - Free Report) by 4.4% during the 1st quarter, according to the company in its ...",www.marketbeat.com,2024-07-17 15:59:49+00:00,2024-07-17 22:14:39
