,Heading,Subheading,Publisher,Published,Found
86,Infrastructure Distributors Stocks Q1 Recap: Benchmarking NOW (NYSE:DNOW),"Overall, it was a weak quarter for the company with a miss of analysts' earnings estimates. ... Originally a manufacturing company, Watsco (NYSE:WSO) ...",finance.yahoo.com,2024-07-17 12:00:43+00:00,2024-07-17 22:14:39
87,Infrastructure Distributors Stocks Q1 Recap: Benchmarking NOW (NYSE:DNOW),"Originally a manufacturing company, Watsco (NYSE:WSO) today only distributes air conditioning, heating, and refrigeration equipment, as well as ...",www.barchart.com,2024-07-17 11:54:59+00:00,2024-07-17 22:14:39
88,Is President Biden too old? How his age stacks up against the 7 oldest CEOs on the Fortune 500,Greenberg has served as Skechers' chair and CEO since he co-founded the company in 1992. ... Watsco has grown from a market capitalization of $22 ...,fortune.com,2024-07-18 20:34:38+00:00,2024-07-18 22:14:01
89,(WSO) - Analyzing Watsco's Short Interest - Benzinga,Watsco Short Interest Graph (3 Months). short_fig. As you can see ... A company's peer is another company that has similar characteristics to ...,www.benzinga.com,2024-07-18 18:41:55+00:00,2024-07-18 22:14:01
90,"SG Americas Securities LLC Increases Position in Watsco, Inc. (NYSE:WSO)",Hedge funds and other institutional investors own 89.71% of the company's stock. Analysts Set New Price Targets. Several equities research analysts ...,www.defenseworld.net,2024-07-18 17:50:28+00:00,2024-07-18 22:14:01
91,Watsco (NYSE:WSO.B) Shares Gap Up to $424.75 | MarketBeat,The business had revenue of $1.56 billion for the quarter. Watsco had a return on equity of 19.26% and a net margin of 7.03%. Watsco Dividend ...,www.marketbeat.com,2024-07-18 15:48:06+00:00,2024-07-18 22:14:01
92,"Is Watsco, Inc. (NYSE:WSO) Potentially Undervalued? - Yahoo Finance","Let's talk about the popular Watsco, Inc. ( NYSE:WSO ). The company's shares saw a significant share price rise of 27...",finance.yahoo.com,2024-07-18 15:34:54+00:00,2024-07-18 22:14:01
93,"William Blair Investment Management LLC Purchases 3,881 Shares of Watsco, Inc. (NYSE:WSO)","The institutional investor owned 66,966 shares of the construction company's stock after purchasing an additional 3,881 shares during the period.",www.marketbeat.com,2024-07-18 13:42:13+00:00,2024-07-18 22:14:01
94,"Watsco, Inc. (NYSE:WSO) Shares Sold by State Board of Administration of Florida Retirement System",A number of other institutional investors and hedge funds also recently added to or reduced their stakes in the company. Wetzel Investment Advisors ...,www.marketbeat.com,2024-07-19 17:35:46+00:00,2024-07-19 22:14:10
95,"Mitsubishi UFJ Asset Management Co. Ltd. Has $7.87 Million Stock Position in Watsco, Inc ...","Mitsubishi UFJ Asset Management Co. Ltd. grew its holdings in shares of Watsco, Inc. (NYSE:WSO - Free Report) by 15.0% during the 1st quarter, ...",www.marketbeat.com,2024-07-20 17:16:23+00:00,2024-07-20 22:13:52
96,"Watsco, Inc. (NYSE:WSO) Shares Sold by QRG Capital Management Inc. - Defense World",The firm owned 845 shares of the construction company's stock after selling 117 shares during the period. QRG Capital Management Inc.'s holdings in ...,www.defenseworld.net,2024-07-20 14:15:41+00:00,2024-07-20 22:13:52
97,Watsco (NYSE:WSO.B) Shares Gap Up to $424.75 - Defense World,"Watsco shares last traded at $445.15, with a volume of 300 shares changing hands. Get Watsco alerts: Watsco Price Performance. The company's fifty day ...",www.defenseworld.net,2024-07-20 10:20:28+00:00,2024-07-20 22:13:52
98,Is President Biden too old? How his age stacks up against the 7 oldest CEOs on the Fortune 500,"Greenberg has served as Skechers' chair and CEO since he co-founded the company in 1992. ... Watsco, No. 489 in the Fortune 500. Nahmad founded ...",www.msn.com,2024-07-19 22:05:59+00:00,2024-07-20 22:13:52
99,"Watsco, Inc. (NYSE:WSO) Shares Sold by Westfield Capital Management Co. LP","Westfield Capital Management Co. LP decreased its stake in shares of Watsco, Inc. (NYSE:WSO - Free Report) by 88.4% in the 1st quarter, ...",www.marketbeat.com,2024-07-21 20:15:06+00:00,2024-07-21 22:13:57
100,"Watsco, Inc. (NYSE:WSO) Given Average Recommendation of “Hold” by Analysts",Company insiders own 12.86% of the company's stock. Hedge Funds Weigh In On Watsco. A number of large investors have recently bought and sold shares ...,www.defenseworld.net,2024-07-21 15:15:07+00:00,2024-07-21 22:13:57
101,"Russell Investments Group Ltd. Has $7.02 Million Holdings in Trex Company, Inc. (NYSE:TREX)","Read Russell Investments Group Ltd. Has $7.02 Million Holdings in Trex Company, Inc. (NYSE:TREX) at Defense World. ... Watsco, Inc. (NYSE:WSO) Shares ...",www.defenseworld.net,2024-07-22 17:01:57+00:00,2024-07-22 22:14:04
102,"Watsco's Second Quarter Earnings Call Scheduled on July 30, 2024 | Morningstar","... Company's estimates, can be found at www.watsco.com. Barry S. Logan Executive Vice President (305) 714-4102 e-mail: blogan@watsco.com. Primary Logo.",www.morningstar.com,2024-07-22 14:10:25+00:00,2024-07-22 22:14:04
103,"Watsco's Second Quarter Earnings Call Scheduled on July 30, 2024 | WSO Stock News","The call will be web-cast and available on the company's website. Watsco, the largest distributor of HVAC/R products in North America, serves over ...",www.stocktitan.net,2024-07-22 14:10:04+00:00,2024-07-22 22:14:04
104,"Watsco, Inc. (NYSE:WSO) Shares Purchased by Russell Investments Group Ltd.","International Assets Investment Management LLC now owns 205,237 shares of the construction company's stock worth $87,938,000 after acquiring an ...",www.defenseworld.net,2024-07-22 11:04:07+00:00,2024-07-22 22:14:04
105,"ProShare Advisors LLC Decreases Position in Watsco, Inc. (NYSE:WSO) - Defense World","The firm owned 1,525 shares of the construction company's stock after selling 256 shares during the quarter. ProShare Advisors LLC's holdings in ...",www.defenseworld.net,2024-07-23 19:46:34+00:00,2024-07-23 22:14:07
106,Women in HVACR's board shows its commitment to advancing women in the trades - PR Newswire,"Kristin Gallup: Gallup is the director of product management for Carrier Enterprise, a joint venture between Watsco, Inc. and Carrier Corporation.",www.prnewswire.com,2024-07-24 11:17:19+00:00,2024-07-24 15:14:53
107,Women in HVACR's board shows its commitment to advancing women in the trades,"... Watsco, Inc. and Carrier Corporation. She has been in HVAC Distribution for over 17 years in multiple leadership capacities and has been a ...",www.streetinsider.com,2024-07-24 11:03:49+00:00,2024-07-24 15:14:53
108,Watsco (WSO.B) Scheduled to Post Quarterly Earnings on Tuesday - MarketBeat,The construction company reported $2.17 EPS for the quarter. Watsco had a return on equity of 19.26% and a net margin of 7.03%. The firm had revenue ...,www.marketbeat.com,2024-07-23 18:23:30+00:00,2024-07-24 15:14:53
109,Validea Peter Lynch Strategy Daily Upgrade Report - 7/25/2024 | Nasdaq,"Company Description: Watsco, Inc. is engaged in the distribution of air ... Company Description: Hanmi Financial Corporation is a holding company of ...",www.nasdaq.com,2024-07-25 09:58:50+00:00,2024-07-25 16:15:13
110,Watsco (NYSE:WSO.B) Reaches New 52-Week High at $491.75 - MarketBeat,The construction company reported $2.17 earnings per share (EPS) for the quarter. The firm had revenue of $1.56 billion during the quarter. Watsco ...,www.marketbeat.com,2024-07-25 20:13:31+00:00,2024-07-25 22:15:03
111,Reflecting On Infrastructure Distributors Stocks' Q1 Earnings: Core &amp; Main (NYSE:CNM),"Slowest Q1: Watsco (NYSE:WSO). Originally a manufacturing company, Watsco (NYSE:WSO) today only distributes air conditioning, heating, and ...",finance.yahoo.com,2024-07-26 09:50:19+00:00,2024-07-26 11:14:49
112,Reflecting On Infrastructure Distributors Stocks' Q1 Earnings: Core &amp; Main (NYSE:CNM),"Originally a manufacturing company, Watsco (NYSE:WSO) today only ... Such statements include statements regarding the Company's ability to grow its ...",www.theglobeandmail.com,2024-07-26 08:53:29+00:00,2024-07-26 11:14:49
113,Reflecting On Infrastructure Distributors Stocks' Q1 Earnings: Core &amp; Main (NYSE:CNM),"Originally a manufacturing company, Watsco (NYSE:WSO) today only ... Rapid Proliferation of AI Companies: A significant increase in the number of ...",www.barchart.com,2024-07-26 08:49:54+00:00,2024-07-26 11:14:49
114,"Healthcare of Ontario Pension Plan Trust Fund Buys New Shares in Watsco, Inc. (NYSE:WSO)","The institutional investor bought 1,137 shares of the construction company's stock, valued at approximately $491,000. Get Watsco alerts: Sign Up.",www.marketbeat.com,2024-07-26 13:23:00+00:00,2024-07-26 16:15:13
115,3 High-Yield Dividend Stocks That Also Deliver Solid Gains | InvestorPlace,Watsco (WSO): The company has an annualized dividend growth rate of 10.49% in the past five years. JPMorgan Chase (JPM): It's one of the best big ...,investorplace.com,2024-07-26 12:04:44+00:00,2024-07-26 16:15:13
116,WSO.B (Watsco) Float Percentage Of Total Shares Outstanding - GuruFocus,All currency related amount are indicated in the company's associated stock exchange currency. Watsco Business Description. Industry. GURUFOCUS.COM ...,www.gurufocus.com,2024-07-27 08:34:52+00:00,2024-07-27 10:14:57
117,"Capital World Investors Sells 169,282 Shares of Watsco, Inc. (NYSE:WSO) - MarketBeat",... recent Form 13F filing with the Securities and Exchange Commission (SEC). The firm owned 739018 shares of the construction company's stock after sell.,www.marketbeat.com,2024-07-27 20:39:08+00:00,2024-07-27 22:15:00
118,Watsco (WSO) Scheduled to Post Quarterly Earnings on Tuesday - Defense World,Analysts expect the company to announce earnings of $4.70 per share for the quarter. Investors interested in registering for the company's conference ...,www.defenseworld.net,2024-07-28 14:01:24+00:00,2024-07-28 16:14:49
119,Watsco (WSO.B) Set to Announce Quarterly Earnings on Tuesday - Defense World,Watsco had a return on equity of 19.26% and a net margin of 7.03%. The business had revenue of $1.56 billion during the quarter. Watsco Stock ...,www.defenseworld.net,2024-07-28 13:38:49+00:00,2024-07-28 16:14:49
120,Earnings To Watch: Watsco (WSO) Reports Q2 Results Tomorrow - Yahoo Finance,"The majority of analysts covering the company have reconfirmed their estimates over the last 30 days, suggesting they anticipate the business to stay ...",finance.yahoo.com,2024-07-29 14:23:10+00:00,2024-07-29 16:15:06
121,"U.S. First Hawaiian, Olin, Watsco - XM","... companies, including First Hawaiian, Olin and Watsco on Monday. HIGHLIGHTS. * 1st Source Corp SRCE.O: Piper Sandler cuts to neutral from overweight.",www.xm.com,2024-07-29 14:10:28+00:00,2024-07-29 16:15:06
122,"Toronto Dominion Bank Sells 1,134 Shares of Watsco, Inc. (NYSE:WSO) - MarketBeat","Toronto Dominion Bank lessened its stake in Watsco, Inc. (NYSE:WSO - Free Report) by 25.9% in the first quarter, according to the company in its ...",www.marketbeat.com,2024-07-29 11:36:48+00:00,2024-07-29 16:15:06
123,"First Hawaiian, Olin, Watsco — TradingView News","Wall Street securities analysts revised their ratings and price targets on several U.S.-listed companies, including First Hawaiian, Olin and ...",www.tradingview.com,2024-07-29 08:14:25+00:00,2024-07-29 16:15:06
124,Earnings To Watch: Watsco (WSO) Reports Q2 Results Tomorrow - Barchart.com,For more information see our Cookie Policy.View our Terms and Privacy Policy. Accept All Cookies. Company Logo. Privacy Preference Center. Your Opt ...,www.barchart.com,2024-07-29 20:20:04+00:00,2024-07-29 22:15:09
125,"Toronto Dominion Bank Sells 1,134 Shares of Watsco, Inc. (NYSE:WSO) - Defense World","EntryPoint Capital LLC now owns 58 shares of the construction company's stock valued at $25,000 after buying an additional 29 shares during the period ...",www.defenseworld.net,2024-07-29 17:30:12+00:00,2024-07-29 22:15:09
126,"O Shaughnessy Asset Management LLC Has $705000 Stake in Watsco, Inc. (NYSE:WSO)","Shaker Investments LLC OH now owns 7,564 shares of the construction company's stock valued at $3,267,000 after purchasing an additional 24 shares ...",www.defenseworld.net,2024-07-29 13:19:08+00:00,2024-07-29 22:15:09
127,"1832 Asset Management L.P. Purchases 381 Shares of PayPal Holdings, Inc. (NASDAQ:PYPL)","Company insiders own 0.14% of the company's stock. Analyst Upgrades and ... Toronto Dominion Bank Sells 1,134 Shares of Watsco, Inc. (NYSE ...",www.americanbankingnews.com,2024-07-30 00:58:02+00:00,2024-07-30 05:14:50
128,Watsco 2Q Revenue Higher but Misses Wall Street Estimates - MarketWatch,"Watsco posted higher revenue in its latest quarter, which the company said was a sign of residential end-markets in a healthier position. The ...",www.marketwatch.com,2024-07-30 15:08:47+00:00,2024-07-30 16:15:16
129,"The Zacks Analyst Blog Highlights Armstrong World Industries, Eagle Materials, UFP ...",... Watsco are included in this Analyst Blog ... Each of the company logos represented herein are trademarks of Microsoft Corporation ...,www.zacks.com,2024-07-30 15:00:51+00:00,2024-07-30 16:15:16
130,Watsco (NYSE:WSO) Reports Sales Below Analyst Estimates In Q2 Earnings,"Reviewing a company's long-term performance can reveal insights into its business quality. Any business can have short-term success, but a top-tier ...",finance.yahoo.com,2024-07-30 14:57:51+00:00,2024-07-30 16:15:16
131,"Watsco Reports Record Sales, Enhanced Operating Efficiency and Strong Cash Flow ...","Commentary was also provided on business trends, growth opportunities, technology innovation and its financial position. Watsco is the largest ...",www.abc27.com,2024-07-30 14:28:10+00:00,2024-07-30 16:15:16
132,Watsco (WSO) Q2 Earnings and Revenues Lag Estimates - Nasdaq,"Over the last four quarters, the company has surpassed consensus EPS estimates just once. Watsco , which belongs to the Zacks Building Products ...",www.nasdaq.com,2024-07-30 14:25:00+00:00,2024-07-30 16:15:16
133,Watsco: Q2 Earnings Snapshot | Business | dailygazette.com,"(AP) — Watsco Inc. (WSO.B) on Tuesday ... On a per-share basis, the Coconut Grove, Florida-based company said it had net income of $4.49.",www.dailygazette.com,2024-07-30 14:03:36+00:00,2024-07-30 16:15:16
134,Watsco Inc reports results for the quarter ended in June - Earnings Summary - TradingView,... company reported EPS of $4.42. The mean expectation of eleven analysts for the quarter was for earnings of $4.69 per share. Wall Street expected ...,www.tradingview.com,2024-07-30 13:42:22+00:00,2024-07-30 16:15:16
135,Watsco Q2 Results Miss Estimates - Nasdaq,"On average, ten analysts polled by Thomson Reuters expected the company to report earnings of $4.68 per share on revenues of $2.18 billion for the ...",www.nasdaq.com,2024-07-30 13:35:14+00:00,2024-07-30 16:15:16
136,"Watsco, Inc. Reports Earnings Results for the Second Quarter and Six Months Ended June 30, 2024","For the second quarter, the company reported sales was USD 2,139.33 million compared to USD 2,003.08 million a year ago. Net income was USD 181.41 ...",www.marketscreener.com,2024-07-30 13:26:53+00:00,2024-07-30 16:15:16
137,"Lazard Asset Management LLC Has $3.79 Million Stock Position in Watsco, Inc. (NYSE:WSO)","The firm owned 8,770 shares of the construction company's stock after selling 660 shares during the quarter. Lazard Asset Management LLC's holdings in ...",www.defenseworld.net,2024-07-30 12:22:25+00:00,2024-07-30 16:15:16
138,"Watsco Inc. (WSO) Q2 Earnings: EPS of $4.49 Misses Estimates, Re - GuruFocus","However, the company's earnings per share (EPS) of $4.49 fell short of the analyst estimate of $4.67, while revenue of $2,139.33 million fell short of ...",www.gurufocus.com,2024-07-30 12:12:28+00:00,2024-07-30 16:15:16
139,"The Zacks Analyst Blog Highlights Armstrong World Industries, Eagle Materials, UFP ...","Armstrong World Industries, Eagle Materials, UFP Industries, M/I Homes and Watsco are included in this Analyst Blog.",finance.yahoo.com,2024-07-30 12:06:38+00:00,2024-07-30 16:15:16
140,Watsco Inc (WSO) Earnings: 2Q EPS Misses Estimates Despite Record Sales and Strong Cash Flow,The combination of its distribution of essential equipment and strong Smartkarma Smart Scores highlights the company's potential for sustained growth ...,www.smartkarma.com,2024-07-30 12:00:46+00:00,2024-07-30 16:15:16
141,Watsco: Q2 Earnings Snapshot | Business - standard-journal.com,MIAMI (AP) — MIAMI (AP) — Watsco Inc. (WSO) on Tuesday reported second-quarter earnings of $181.4 million. The Miami-based company said it had net ...,www.standard-journal.com,2024-07-30 11:56:08+00:00,2024-07-30 16:15:16
142,Watsco: Q2 Earnings Snapshot - WTOP News,"(WSO.B) on Tuesday reported profit of $181.4 million in its second quarter. On a per-share basis, the Coconut Grove, Florida-based company said it ...",wtop.com,2024-07-30 11:54:39+00:00,2024-07-30 16:15:16
143,Watsco: Q2 Earnings Snapshot | Business - standard-journal.com,"Watsco: Q2 Earnings Snapshot. STATS Perform dba Automated Insights; Jul ... On a per-share basis, the Coconut Grove, Florida-based company said it had ...",www.standard-journal.com,2024-07-30 11:54:04+00:00,2024-07-30 16:15:16
144,Watsco: Q2 Earnings Snapshot - Greenwich Time,(WSO) on Tuesday reported second-quarter earnings of $181.4 million. The Miami-based company said it had net income of $4.49 per share. The results ...,www.greenwichtime.com,2024-07-30 11:52:44+00:00,2024-07-30 16:15:16
145,Watsco: Q2 Earnings Snapshot - MarketScreener,MIAMI — MIAMI — Watsco Inc. on Tuesday reported second-quarter earnings of $181.4 million. The Miami-based company said it had net income of $4.49 ...,www.marketscreener.com,2024-07-30 11:46:13+00:00,2024-07-30 16:15:16
146,Watsco posts record Q2 revenue; EPS misses estimates - Investing.com,"... company's second-quarter performance, highlighting record sales and strong cash flow. He also emphasized the company's strengthened balance sheet ...",www.investing.com,2024-07-30 11:42:48+00:00,2024-07-30 16:15:16
147,"Watsco Reports Record Sales, Enhanced Operating Efficiency",The Company believes these technologies will continue to be an important catalyst for long-term growth and performance. Second Quarter Results.,www.globenewswire.com,2024-07-30 11:34:31+00:00,2024-07-30 16:15:16
148,"Rob Base, CL Smooth free Plaza concert moved to Corning Preserve - Times Union","Business- Opinion- Entertainment- Food- Sports- Obituaries- Puzzles- Best of ... Watsco Center on March 11, 2023 in Coral Gables, Florida. Due to ...",www.timesunion.com,2024-07-30 21:12:44+00:00,2024-07-30 22:15:05
149,"Watsco, Inc. (WSO) Q2 2024 Earnings Call Transcript | Seeking Alpha","Watsco, Inc. (NYSE:WSO) Q2 2024 Earnings Conference Call July 30, 2024 10:00 AM ET. Company Participants. Al Nahmad - Chairman and CEO Paul Johnston ...",seekingalpha.com,2024-07-30 20:52:49+00:00,2024-07-30 22:15:05
150,How Watsco grows on ecommerce and an entrepreneurial spirit - Digital Commerce 360,"In a Q2 earnings call today, Chairman and CEO Albert Nahmad attributed that performance to the company's long-running strategy of acquiring ...",www.digitalcommerce360.com,2024-07-30 20:51:10+00:00,2024-07-30 22:15:05
151,"Watsco Earnings: Stock Slides on EPS Miss, but Profit Margin Remains Robust | Morningstar","Nevertheless, Watsco continues to deliver above-historical-average profit margins, but we believe market expectations for the company have become too ...",www.morningstar.com,2024-07-30 20:22:01+00:00,2024-07-30 22:15:05
152,Leading US HVAC Distributor Watsco Continues to Enjoy Strong Profit Margins,"Business Strategy and Outlook. Watsco is the largest player in the fragmented heating, ventilation, air conditioning, and refrigeration distribution ...",www.morningstar.com,2024-07-30 19:29:07+00:00,2024-07-30 22:15:05
153,"Watsco reports record sales, enhanced operating efficiency and strong cash flow during ...","Watsco announced its operating results for the second quarter and six-month period ended June 30, 2024. Commentary was also provided on business ...",www.supplyht.com,2024-07-30 19:08:57+00:00,2024-07-30 22:15:05
154,"Stanley B&amp;D Organic Sales, Margins Improve Despite “Weak Consumer Backdrop”","... company's previously announced infrastructure divestiture earlier this year and currency. ... Watsco 2Q Sales Improve, Gross Margin Slides- July ...",www.mdm.com,2024-07-30 19:01:14+00:00,2024-07-30 22:15:05
155,Watsco (NYSE:WSO) Reports Sales Below Analyst Estimates In Q2 Earnings - Barchart.com,"Sales Growth. Reviewing a company's long-term performance can reveal insights into its business quality. Any business can have short-term success, but ...",www.barchart.com,2024-07-30 18:34:42+00:00,2024-07-30 22:15:05
156,"Watsco (WSO) Q2 Earnings Lag, Revenues Beat, Margins Down Y/Y - MSN","Watsco, Inc. WSO reported mixed second-quarter 2024 results, with ... The company has no borrowings under its unsecured $600 million credit ...",www.msn.com,2024-07-30 18:28:35+00:00,2024-07-30 22:15:05
157,Why Watsco Stock Is Falling Today | The Motley Fool,"The company's quarter came in below what Wall Street had expected. Watsco (WSO -4.75%) reported record sales, improving cash flow, and an ...",www.fool.com,2024-07-30 18:07:59+00:00,2024-07-30 22:15:05
158,Watsco Shares Dip 5% After Q2 EPS And Sales Fall Short Of Expectations - TradingView,"Watsco, Inc. NYSE:WSO shares are trading lower on Tuesday after reporting second-quarter results.The company reported quarterly earnings per share ...",www.tradingview.com,2024-07-30 17:41:54+00:00,2024-07-30 22:15:05
