,Heading,Subheading,Publisher,Published,Found
0,Signature Bank (NASDAQ:SBNY) Research Coverage Started at StockNews.com,Westwater Resources (NASDAQ:WWR) Coverage Initiated by Analysts at StockNews.com ... Eli Lilly and Company (NYSE:LLY) Shares Sold by Walker Asset ...,www.defenseworld.net,2024-06-22 15:12:35+00:00,2024-06-23 01:14:03
1,Westwater Resources (NASDAQ:WWR) Coverage Initiated by Analysts at StockNews.com,"Westwater Resources, Inc operates as an energy technology company, focuses on developing battery-grade natural graphite materials. The company ...",www.defenseworld.net,2024-06-22 13:55:22+00:00,2024-06-23 01:14:03
2,SK On signs MOU to secure US-sourced lithium from ExxonMobil - KED Global,"BATTERY MATERIAL SUPPLY DEALS IN US This past February, SK On signed an agreement with Westwater Resources Inc. to buy US-processed graphite in ...",www.kedglobal.com,2024-06-26 16:25:00+00:00,2024-06-26 17:14:13
3,SK on Collaborates with ExxonMobil on Lithium Supply - Korea IT Times,Notable agreements include a natural graphite supply contract with Westwater Resources in February 2023 and a lithium supply agreement with Chile's ...,www.koreaittimes.com,2024-06-26 15:58:03+00:00,2024-06-26 17:14:13
4,SK On wins lithium supply deal with ExxonMobil - The Korea Herald,"In February, the company signed a contract with US mining company Westwater Resources for the supply of natural graphite. In November 2022, it ...",www.koreaherald.com,2024-06-26 11:09:27+00:00,2024-06-26 17:14:13
5,SK On signs MOU with ExxonMobil for lithium offtake in U.S.,The company is also building three battery plants in the U.S. with Ford Motor Co. ... – SK On signs agreement with Westwater Resources for natural ...,skinnonews.com,2024-06-26 10:04:58+00:00,2024-06-26 17:14:13
6,SK On signs lithium MOU with ExxonMobil for U.S. battery production - MarkLines,"This new MOU follows SK On's previously signed deals with Westwater Resources, Global Lithium Resources, and Lake Resources. (ExxonMobil press ...",www.marklines.com,2024-06-26 21:02:50+00:00,2024-06-27 10:14:17
7,Amendment: SEC Form F-3/A filed by Jayud Global Logistics Limited - Quantisnow,Westwater Resources (AMEX:WWR) shares rose 7.13% to $0.55. The company's market cap stands at $31.4 million. Jayud Global Logistics (NASDAQ:JYD) ...,quantisnow.com,2024-06-27 19:33:59+00:00,2024-06-28 01:14:11
8,SEC Form NT 10-K filed by Addentax Group Corp. - Quantisnow,The company's market cap stands at $7.2 million. Westwater Resources (AMEX:WWR) stock moved upwards by 7.34% to $0.5. The company's market cap ...,quantisnow.com,2024-06-28 16:24:27+00:00,2024-06-28 17:14:03
9,The Global Graphite Market 2024-2035: Increasing Demand for - GlobeNewswire,"Company Logo. The Global Graphite Market 2024-2035: Increasing ... Westwater Resources, Inc; Xincheng Graphite Co. Ltd; Zentek Ltd; Zhanjiang ...",www.globenewswire.com,2024-06-28 15:21:02+00:00,2024-06-28 17:14:03
10,A graphite processing plant in Alabama could help the U.S. rely less on China - NPR,"Chinese companies already know how to reshape graphite. But when Westwater Resources first tried it, their particles were too flat. JACOBS: The ...",www.npr.org,2024-06-29 08:44:00+00:00,2024-06-29 10:14:07
11,Westwater Resources (NASDAQ:WWR) Coverage Initiated by Analysts at StockNews.com,"Westwater Resources, Inc operates as an energy technology company, focuses on developing battery-grade natural graphite materials. The company holds ...",www.defenseworld.net,2024-06-30 06:29:28+00:00,2024-06-30 17:14:08
12,"Global Graphite Market Report 2024 -100+ Key Player Profiles Including GrafTech, Gratomic ...","4 Company Profiles. Aben Resources; Alba Mineral Resources; Anovion ... Westwater Resources, Inc; Xincheng Graphite Co. Ltd; Zentek Ltd; Zhanjiang ...",www.businesswire.com,2024-07-02 13:04:01+00:00,2024-07-02 17:14:14
13,SEC Form S-3 filed by Westwater Resources Inc. - Quantisnow,SEC Form S-3 filed by Westwater Resources Inc. 7/3/24 4:11:43 PM ET. $WWR. Other Metals and Minerals. Basic Materials.,quantisnow.com,2024-07-03 20:27:12+00:00,2024-07-04 02:15:03
14,StockNews.com Upgrades Northwest Natural (NYSE:NWN) to Hold - Defense World,Jacobs Levy Equity Management Inc. lifted its holdings in ... Recent News. StockNews.com Initiates Coverage on Westwater Resources (NASDAQ:WWR) ...,www.defenseworld.net,2024-07-08 17:23:07+00:00,2024-07-08 18:15:10
15,"Westwater Resources Announces Business Update Conference Call on July 18, 2024","Westwater Resources, Inc. (NYSE American: WWR) an energy technology and battery-grade natural graphite development company, today announced it ...",www.placera.se,2024-07-10 01:30:33+00:00,2024-07-10 03:15:14
16,KnowBe4 Completes Acquisition of Egress - News Hub,"Westwater Resources Announces Business Update Conference Call on July 18, 2024. CENTENNIAL, Colo.–BUSINESS WIRE– Westwater Resources, Inc. (NYSE ...",newshub.medianet.com.au,2024-07-09 22:12:25+00:00,2024-07-10 03:15:14
17,Barrick Continues to Invest in Mali - Le Lézard,"Westwater Resources, Inc. an energy technology and battery-grade natural graphite development company, today announced it will hold a ...",www.lelezard.com,2024-07-09 20:53:45+00:00,2024-07-10 03:15:14
18,Dominion Energy's (D) Arm to Buy Offshore Wind Lease for $160M - Yahoo Finance,"Dominion Energy D announced that its subsidiary, Virginia Electric and Power Company ... Westwater Resources Announces Business Update Conference Call ...",sg.finance.yahoo.com,2024-07-09 19:42:47+00:00,2024-07-10 03:15:14
19,Termination of the lease agreement with the tenant of two of the fund's subsidiaries and ...,"... limited company Hortes. According to the mentioned regulation ... Westwater Resources Announces Business Update Conference Call on July 18, 2024.",www.finanzen.at,2024-07-09 19:34:59+00:00,2024-07-10 03:15:14
20,"Westwater Resources Announces Business Update Conference Call on July 18, 2024","CENTENNIAL, Colo., July 09, 2024--Westwater Resources, Inc. (NYSE American: WWR) an energy technology and battery-grade natural graphite ...",finance.yahoo.com,2024-07-09 19:34:01+00:00,2024-07-10 03:15:14
21,Midea Group's 2024 1H Overseas Campus Recruitment Review: A Strategic Leap Forward ...,"These recruitment activities also represent a significant step in the company's ... CENTENNIAL, Colo.–BUSINESS WIRE– Westwater Resources, Inc. (NYSE ...",newshub.medianet.com.au,2024-07-10 15:02:29+00:00,2024-07-10 19:15:10
22,NetApp Expands Intelligent Data Infrastructure Capabilities to Power Strategic Cloud Workloads,"... company, today announced the introduction of new capabilities designed ... CENTENNIAL, Colo.–BUSINESS WIRE– Westwater Resources, Inc. (NYSE ...",newshub.medianet.com.au,2024-07-10 12:31:48+00:00,2024-07-10 19:15:10
23,Examining 3 US Growth Companies With High Insider Ownership And A Minimum 18 ...,"Business Wire. Westwater Resources Announces Business Update Conference Call on July 18, 2024. 8 minutes ago. Investor's Business Daily. Dow Jones ...",uk.finance.yahoo.com,2024-07-09 19:33:31+00:00,2024-07-10 19:15:10
24,Purdue Pharma seeks litigation ceasefire after SCOTUS ruling - Yahoo Finance,"... company alleging that its painkiller OxyContin spurred an ... Westwater Resources Announces Business Update Conference Call on July 18, 2024.",uk.finance.yahoo.com,2024-07-09 19:33:31+00:00,2024-07-10 19:15:10
25,South West Water invites customers to discuss plans for desalination in Cornwall,"... resources available in Cornwall by 45% and in Devon by 30 ... West Water's desalination proposals, visit www.southwestwater.co.uk/desalination.",www.southwestwater.co.uk,2024-07-15 09:01:28+00:00,2024-07-15 10:15:04
26,Omnicell (NASDAQ:OMCL) Downgraded by StockNews.com to “Hold” - Defense World,Horrell Capital Management Inc. boosted its holdings in shares of ... Westwater Resources (NASDAQ:WWR) Now Covered by Analysts at StockNews.com ...,www.defenseworld.net,2024-07-16 05:35:06+00:00,2024-07-16 19:14:31
27,Aptose Biosciences (NASDAQ:APTO) Coverage Initiated at StockNews.com,Texas Capital Bank Wealth Management Services Inc purchased a new position in Aptose Biosciences Inc ... Westwater Resources (NASDAQ:WWR) Now Covered by ...,www.defenseworld.net,2024-07-17 01:00:46+00:00,2024-07-17 10:14:14
28,StockNews.com Begins Coverage on Hudson Global (NASDAQ:HSON) - Defense World,Victory Capital Management Inc. bought a new position in Hudson ... Westwater Resources (NASDAQ:WWR) Now Covered by Analysts at StockNews.com ...,www.defenseworld.net,2024-07-17 00:59:43+00:00,2024-07-17 10:14:14
29,Westwater Resources wins offtake agreement with Stellantis for Kellyton graphite,"Westwater Resources wins offtake agreement with Stellantis for Kellyton graphite. Jul. 18, 2024 7:19 AM ETWestwater Resources, Inc. (WWR) StockSTLA ...",seekingalpha.com,2024-07-18 17:20:00+00:00,2024-07-18 18:14:29
30,Westwater Resources announces major graphite sales agreement with Fiat Chrysler,"Westwater Resources Inc (NYSE-A:WWR) has announced a significant sales agreement with Fiat Chrysler Automobiles, part of the Stellantis group of ...",www.youtube.com,2024-07-18 17:04:34+00:00,2024-07-18 18:14:29
31,"Fathom Nickel reports promising exploration results at Gochager Lake, prepares for autumn program",on the company's Gochager Lake property. The recent field ... Westwater Resources announces major graphite sales agreement with Fiat Chrysler.,www.youtube.com,2024-07-18 16:57:59+00:00,2024-07-18 18:14:29
32,Eden Research expands commercial team with key hires - YouTube,"Eden Research PLC (AIM:EDEN, OTCQB:EDNSF) CEO Sean Smith discusses the company's latest strategic hires and ... Westwater Resources announces major ...",www.youtube.com,2024-07-18 16:57:55+00:00,2024-07-18 18:14:29
33,Westwater Resources Announced The Execution Of A Binding Off-take Agreement With Fiat ...,"Westwater contracts with Fiat Chrysler Automobiles (""FCA""), a leading manufacturer of electric vehicles and part of Stellantis, to supply natural ...",quantisnow.com,2024-07-18 16:16:57+00:00,2024-07-18 18:14:29
34,Westwater Resources (WWR) Announces Off-Take Sales Agreement with Stellantis (STLA ...,"Westwater Resources, Inc. (NYSE American: WWR), an energy technology and battery-grade natural graphite company (“Westwater Resources” or ...",www.streetinsider.com,2024-07-18 16:02:26+00:00,2024-07-18 18:14:29
35,"CDU Expert: AI could improve e-scooter safety, but still has its own risks - News Hub","... company's global expansion. The ceremony was attended by Ms ... 20:11. Westwater Resources, Inc. Westwater Resources Announces Off-Take ...",newshub.medianet.com.au,2024-07-18 15:56:20+00:00,2024-07-18 18:14:29
36,Westwater Resources secures major graphite supply deal with Fiat Chrysler | NYSE-A:WWR,Westwater Resources Inc (NYSE-A:WWR) announced it has secured a binding off-take agreement with Fiat Chrysler Automobiles to supply natural ...,www.proactiveinvestors.com,2024-07-18 13:07:06+00:00,2024-07-18 18:14:29
37,Westwater Resources Announces Off-Take Sales Agreement with Stellantis for ... - Yahoo Finance,"CENTENNIAL, Colo., July 18, 2024--Westwater Resources, Inc. (NYSE American: WWR), an energy technology and battery-grade natural graphite company ...",finance.yahoo.com,2024-07-18 12:53:42+00:00,2024-07-18 18:14:29
38,Cricket cuisine: unlocking sustainable protein - News Hub - Medianet,"Westwater Resources Announces Update to Conference Call on July 18, 2024. CENTENNIAL, Colo.–BUSINESS WIRE– Westwater Resources, Inc. (NYSE American ...",newshub.medianet.com.au,2024-07-18 12:02:18+00:00,2024-07-18 18:14:29
39,Westwater Resources Secures Major Deal with FCA US LLC - TipRanks.com,"Westwater Resources (WWR) has issued an announcement. Alabama Graphite Products, LLC, a subsidiary of Westwater Resources, Inc., has entered into ...",www.tipranks.com,2024-07-18 10:38:59+00:00,2024-07-18 18:14:29
40,Westwater Resources Announces Off-Take Sales Agreement with Stellantis for Sale of ... - Stock Titan,The company views this as a important step in establishing a U.S.-based supply chain for natural graphite anode material in the electric vehicle ...,www.stocktitan.net,2024-07-18 10:25:14+00:00,2024-07-18 18:14:29
41,"Westwater Resources Announces Update to Conference Call on July 18, 2024","Westwater Resources, Inc. an energy technology and battery-grade natural graphite development company, today announced detail for its conference ...",www.marketscreener.com,2024-07-18 03:21:09+00:00,2024-07-18 18:14:29
42,"Westwater Resources Announces Update to Conference Call on July 18, 2024","Westwater Resources, Inc. (NYSE American: WWR) an energy technology and battery-grade natural graphite development company, today announced detail ...",www.businesswire.com,2024-07-18 03:16:59+00:00,2024-07-18 18:14:29
43,Westwater Resources : test post) - MarketScreener,Westwater Resources is focused on developing battery-grade natural graphite products. The Company's primary project is the Kellyton Graphite Plant ...,www.marketscreener.com,2024-07-18 02:44:13+00:00,2024-07-18 18:14:29
44,Ultra Lithium Receives Default Notice From Power Minerals Limited - Le Lézard,"Westwater Resources, Inc. an energy technology and battery-grade natural graphite development company, today announced detail for its ...",www.lelezard.com,2024-07-17 17:19:33+00:00,2024-07-18 18:14:29
45,Intersect Power Secures $837 Million in Project Financing to Build 1 GWh of Battery Energy ...,"Intersect Power is a clean energy company bringing innovative and ... Westwater Resources, Inc. an energy technology and battery-grade ...",www.lelezard.com,2024-07-17 17:17:26+00:00,2024-07-18 18:14:29
46,"Westwater Resources Announces Update to Conference Call on July 18, 2024","CENTENNIAL, Colo., July 17, 2024--Westwater Resources, Inc. (NYSE American: WWR) an energy technology and battery-grade natural graphite ...",finance.yahoo.com,2024-07-17 15:24:29+00:00,2024-07-18 18:14:29
47,Westwater Resources CFO explains major deal with Fiat Chrysler - ICYMI | NYSE-A:WWR,"Westwater Resources Inc (NYSE-A:WWR) senior vice president and CFO, Steven Cates, talked with Proactive about the exciting new Baltic sales ...",www.proactiveinvestors.com,2024-07-20 12:01:23+00:00,2024-07-20 19:14:10
48,"Earnings call: Westwater secures offtake agreement, eyes debt financing - Investing.com","Westwater Resources Inc. (NYSE American: NYSE:WWR) has announced a significant milestone in its latest earnings call, securing a second multi-year ...",www.investing.com,2024-07-20 06:11:31+00:00,2024-07-20 19:14:10
49,Westwater Resources Inc. (WWR) Business Update Conference Call Transcript,"Westwater Resources Inc. (NYSE:NYSE:WWR) Business Update Conference Call July 18, 2024 10:00 AM ETCompany ParticipantsFrank Bakker - President and ...",seekingalpha.com,2024-07-20 04:16:56+00:00,2024-07-20 19:14:10
50,Stellantis signs an agreement with Westwater Resources for the supply of natural graphite,"Westwater Resources, a company specializing in energy technologies and natural graphite for batteries, has announced signing a significant supply ...",www.clubalfa.it,2024-07-19 23:20:13+00:00,2024-07-20 19:14:10
51,Westwater Resources forms off-take sales agreement with Stellantis for graphite anode material,"Westwater Resources, Inc., an energy technology focused on the development and production of battery-grade natural graphite, announced a binding ...",www.marklines.com,2024-07-19 21:07:33+00:00,2024-07-20 19:14:10
52,Mullen announces battery pack exchange program for existing customers - MarkLines,"Westwater Resources forms off-take sales agreement with Stellantis for graphite anode material. Jul 20, 2024. Stellantis recalls 19,516 Chrysler ...",www.marklines.com,2024-07-19 21:07:33+00:00,2024-07-20 19:14:10
53,"EVOKE TRANSFORMS EVs INTO MOVING CANVASES, BOOSTING AUSSIE ARTISTS ...","... company, has launched its innovative Art Series Cars initiative ... Westwater Resources, Inc. Westwater Resources Announces Off-Take Sales ...",newshub.medianet.com.au,2024-07-19 11:07:13+00:00,2024-07-20 19:14:10
54,Westwater Resources Secures Major Graphite Supply Deal with Fiat Chrysler - citybuzz,Westwater Resources Inc (NYSE-A:WWR) has made a significant stride in the graphite industry by securing a major sales agreement with Fiat Chrysler ...,www.citybuzz.co,2024-07-19 04:46:47+00:00,2024-07-20 19:14:10
55,"Connected Car News: BMW, NXP, Expedera, Applied Info, Synopsys, UVeye, Wind River ...","Westwater Resources, Inc. (NYSE American: WWR), an energy technology and battery-grade natural graphite company (“Westwater Resources” or “Westwater ...",www.autoconnectedcar.com,2024-07-22 01:58:46+00:00,2024-07-22 03:14:22
56,Stellantis (STLA) Gets a Buy from RBC Capital | Markets Insider,The company's shares closed today at $20.71. According to ... Westwater Resources signs graphite off-take sales agreement with Stellantis ...,markets.businessinsider.com,2024-07-23 06:18:04+00:00,2024-07-23 11:14:29
57,Nation's food security tackled through new institute - News Hub,"Agriculture Farming Rural; 18/07/2024; 01:26. Westwater Resources, Inc. Westwater Resources Announces Update to Conference Call on July 18 ...",newshub.medianet.com.au,2024-07-23 06:04:16+00:00,2024-07-23 11:14:29
58,Kellyton plant contracts with international company | News - Alexander City Outlook,"Westwater Resources, Inc. announced the execution of a binding off-take agreement with Fiat Chrysler Automobiles, a leading electric vehicle ...",www.alexcityoutlook.com,2024-07-24 02:04:52+00:00,2024-07-24 03:15:22
59,"JE Cleantech Holdings Limited Announces Continuation of $1,000,000 Stock Repurchase Program",The available amount that the Company's management is authorized to ... Westwater Resources (AMEX:WWR) stock moved upwards by 7.34% to $0.5 ...,quantisnow.com,2024-07-24 01:06:03+00:00,2024-07-24 03:15:22
60,Westwater Resources (NASDAQ:WWR) Receives New Coverage from Analysts at StockNews.com,"Westwater Resources, Inc operates as an energy technology company, focuses on developing battery-grade natural graphite materials. The company holds ...",www.defenseworld.net,2024-07-24 06:48:45+00:00,2024-07-24 19:15:14
61,Electra Battery Materials Identifies New Copper Showing in Idaho and Extends Redcastle Agreement,Electra Battery Materials Corporation (NASDAQ: ELBM; TSX-V: ELBM) (“Electra” or the “Company ... Westwater Resources Announces Off-Take Sales Agreement ...,batteriesnews.com,2024-07-28 15:45:26+00:00,2024-07-28 16:15:06
62,Graphite One and Lucid Supply Agreement Announced at US Capitol Briefing,“These companies represent the start and the end of the supply chain ... Westwater Resources Announces Off-Take Sales Agreement with ...,batteriesnews.com,2024-07-29 16:36:14+00:00,2024-07-29 21:15:22
63,"Idaho Strategic Resources, Inc. Reports Earnings Results for the Second Quarter and Six ...","... company reported revenue was USD 6.13 million compared ... Idaho Strategic Resources, Inc. cancelled the acquisition of Westwater Resources, Inc..",www.marketscreener.com,2024-07-30 16:10:29+00:00,2024-07-30 18:15:23
64,Premier American Uranium Outlines Multiple Targets for Expansion Drilling at the Cebolleta ...,"... Westwater Canyon (“Westwater”), 300 feet below the Jackpile Sandstone. ... Aurania Resources Ltd. Calibre Mining Corp. Canada Nickel Company Inc ...",www.resource-capital.ch,2024-07-29 21:20:23+00:00,2024-07-30 18:15:23
65,Westwater Resources (NASDAQ:WWR) Stock Price Crosses Above 200 Day Moving ...,"Westwater Resources, Inc operates as an energy technology company, focuses on developing battery-grade natural graphite materials. The company ...",www.defenseworld.net,2024-08-01 09:47:18+00:00,2024-08-01 20:15:24
